"The restaurant turned out to be really great.My girlfriend and me tried:(1) fried noodles with seafood(2) an omelette with oysters as an appetizer (3) curry soymeat with rice (4) mango pudding1 - very tasty and extremely huge portion2 - little fishy for my taste, but really good3 - those who like this type of dishes will appreciate it;4 - omg, just wonderful. No, really. I mean it. It was sooo good.Rose tea - nothing special, but I like it.The waiter was extremely polite and nice.I would say that it's 100% 5 out of five for this level of restaurant.You might probably not find any discoveries here, but food is really, really good.",5.0
"Ate here tonight. First thing I notice is my spoon has what looks like a dried patch of black seaweed stuck to the back of it. I hope the utensils that look clean actually are..We started with the pork belly buns. Small portions, tasty, chewy. Not bad. Next we had a fried noodle with chicken and shrimp. This was good. Tasted like a spicy pad Thai. Next we had the squid in tomato sauce. Squid was so bland and the tomato sauce tasted like ketchup. Very unimpressive. Next we had the soft shelled crab. So fried and soft that I barely knew I was eating crab, I just tasted fried batter. The veggies that came with it were good. Next we had a chicken curry. Decent. The prices are higher than they should be. The staff is fine. The decor is a little tacky. Wouldn't go back.",2.0
"Because of the reviews, I expected this place to be much more than it actually was. Atmosphere: Fairly quiet, with typical top charts radio music playing. The music doesn't really suit the restaurant in my opinion. Food: Curry Laksa was solid, just the right amount of spice. I wish the half-egg that's in the dish wasn't well done. I also tried the seafood casserole with black bean sauce. It doesn't come with rice so you have to order a side of it. ($16 + $2.50 for rice) First off, it wasn't served in a casserole, which it should be if you're selling it as a casserole dish. The sauce was very starchy and although they gave a decent amount of shrimp, the imitation crab meat ruined the dish. Any establishment claiming to be a seafood restaurant should never serve any sort of imitation seafood. It just doesn't make sense. The casserole was also way too salty to be eaten on its own without any rice. A dish like this should always come with a side, as opposed to having diners order rice in addition to the dish. Definitely not worth the price point. Service: Friendly. It was a decent dinner, not the worst I've had. The 4.5 Yelp stars though? Pretty misleading. Will I return? Probably not.",3.0
"More of 3.5 stars for a solid restaurant with some higher than expected pricing. Came into Al Seabu on a Saturday night with the place not so packed, aside from us there was another two tables with customers. Ordered the BKT soup, some Roti and Char Kuay Teow and Beef Rendang, basically the Malay staples. The soup was surprisingly bland and disappointing for its price of $7.00 for a cup. The roti was fresh and cooked well and has substance instead of the airy thin roti other Malaysian places have. The Char Kuay Teow was bland with the flavoring uninspiring while the beef rendang lacked punch but cooked very tender. All in a, a solid place but overpriced for what it is, good service and with the free check in desert makes the price slightly more palatable.",3.0
A group of 6 of us went here last night and everyone raved about it. Particularly note worthy were the roti and pork bun appetizers and the lasi namek. Highly recommended to anyone- great addition to the neighborhood.,5.0
"Really solid Malaysian dishes with good variety and intensities of heat. I've been here a couple times - first ordering the seafood wattan hor. It was tasty and had lots of seafood, but the sauce it comes in is kinda heavy. Hearty meal though! The second time I ordered curry prawns. Very spicy but with great flavor. The potions here are a good value and the food is always super tasty. The staff is super attentive and friendly as well. Definitely recommend as a solid option!",4.0
"An awesome addition to the neighborhood, truly.  Get the laksa or anything else you won't be disappointed.  The service, ambience and cuisine are worth every bit of 5 stars. Had to post a quick review as I've been a few times and it's been a pretty sparse crowd. It's shocking because it's really the best restaurant within 10 blocks IMO.  Brought some foodie-traveling-writing about food and drink folk last weekend and they were equally impressed.Do yourself a favor and pop on over.. Bon appetit!",5.0
A neighborhood gem. The Malaysian specialties are terrific. The red curry was spiced perfectly and the Chad kuai teow (a seafood noodle dish) was awesome. We love this place!!!,5.0
"Very nice spot in PS. The restaurant is clean and staff is courteous. The food overall is good, nothing stood out for me personally. I was pretty bummed they don't have hainanese chicken rice... Which to me is pretty standard for Malaysian cuisine.",3.0
"Came to this South Slope Malaysian restaurant for lunch and greatly enjoyed the food here.  Started off with roti which came hot, soft and flakey accompanied by a curry sauce that packed nice heat.  Ordered the Malaysian red curry which was flavorful and just hot enough.  The Malay noodles with shrimp, crab, squid and scallop was tasty as well.  Finished off with a lite mango pudding.  Service was very good and the lunch special prices are very reasonable.  I will certainly come back.",4.0
"Really delicious food, staff is very attentive without being overbearing or pretending to be your bff, decor of the restaurant is very nice and calming (suitable for an intimate date or a rendezvous with a small group of friends). Can't wait to come back!",5.0
"New in my hood, need to support it!Been there for lunch and ordered delivery too.So far All that I tried was fresh and good, service very kind. Delivery fast. Prices good. Satay mix is a great deal, with 9$ you get 4 skewersNot impressed by the pork belly buns, though I like their ""slider"" version instead pf the classic chinese rice bun we always see.Love the noodles, especially the flat Char Kuay Teow witj seafood. The wattan hor look very similar to a pad thai, they came a bit broken in my delivery box but liked anyway. Maybe a bit dry?Their signature spare and pork ribs herbal soup was delicious, I suggest you order the small version as an appetizer so you can taste it. No dessert tried yetI am a fan already, want to try the whole menu, I am curious",4.0
"A great new spot in Park Slope! While I'm a bit of newbie to the Malaysian cuisine, I enjoyed my dish- (Seafood Wattan Hor). The dish was flavorful and came with an impressive amount of fresh seafood (scallops, shrimp, squid). Yelp check-in meant a free dessert (Homemade Mango Pudding), a sweet treat to end the meal. Service here was friendly/attentive, and the atmosphere was very nice. The menu had a lot of appetizing choices; I can't wait to go back and try the other items.",4.0
"This was good on the first try - although we mourned the loss of former tenant Chip Shop - and very good a couple months later. Seems they have hit their stride. We had a table of six with a bunch of appetizers and a couple of entrees to share. The roti and curry was great, the fried tofu balls went down like donuts with the kids, and the best surprise was the fried fish cakes with a cracker hard sesame seed crust and succulent hot fish inside. We used the leftover sweet dipping sauce with some fresh steamed vegetables that we well done. The fried rice was well above the norm and the omelette was nicely cooked - moister than usual. Food was timely for an early dinner before the crowd. Prices are good if you go family style - and you get to try more, of course. No room for desert this time, but I recall them being good first time. We'll be back.",4.0
"Pretty good Malaysian fusion.  A very nice welcome to the Park Slope community of 5th Ave restaurants, they served up some good Nasi Lemak and Chow Kiew Tiew.  Glass was never empty, and the tiny gesture of giving us some simple shrimp chips was nice.Very casual and would definitely dine here again.",4.0
"Ambiance was cozy and inviting. I loved the blue and brick walls. Perfect setting for groups and dates. Prices are very reasonable and great portions!We ordered their red curry with chicken as well as the flat ""Char Kuay Teow"" noodles. It wasn't as spicy as I hoped it would be, and it ended up being a little too oily for my taste. The red curry was very good, but it didn't have the spicy kick we were hoping for. They only had house wines by the glass which was alright, only because their red ended up being really good. Service was attentive and pleasant which is always much appreciated.",4.0
"Finally made it here for lunch which had been on my to-do list and had a great meal! Started with the pork buns. They were so adorable and a great app. Moved on to the mee goreng with chicken and shrimp. I'm not sure if I've ever had Malaysian and it reminded me of pad Thai. It was great!! The place is also very cute, appeared immaculately clean, and staff was adorable and very sweet. Also, major points for being attentive to my water consumption when housing such spicy food. I'll be back!!",5.0
"Malaysian food in NYC is hard to come by, especially GOOD Malaysian. We had lunch here the other day and the food, value & service were great!! Good happy hour - free roti & $3 beers. This place is a few blocks from home & will be the new 'go-to' restaurant for sure.",5.0
"Al Seabu is a new Malaysian restaurant in Park Slope that has a lot of potential and already has a lot of good things going for it.  It seems authentic, and it would probably benefit from taking ""fusion"" out of its branding considering that people crave authenticity over fusion restaurants these days. We had the fish & shrimp cakes, which I liked a lot (although they were probably not too healthy), the nasi lemak, and the penang asam laksa.  All seemed to be cooked with care.  We also had the rose lemonade which was really interesting and not too sweet. The space is warm, with wood paneling, and this place would certainly do great as a casual date spot once the cocktails get going. The staff were all really nice and attentive too.  They said they will be starting seamless soon, but in the meantime you can call and get delivery.  I am glad Al Seabu is in the neighborhood, and I will certainly be back. PS--you currently get a free dessert for checking in on yelp!",4.0
"This is by far one of the best Malaysian restaurants in Brooklyn and Manhattan. It is more pricey than others, but quality of food is worth the try.  The menu has a good selection seafood, authentic Noodle dishes, and curry. I also enjoyed the cozy setting, service is excellent, I'll definitely come back.",5.0
"Really delicious food, staff is very attentive without being overbearing or pretending to be your bff, decor of the restaurant is very nice and calming (suitable for an intimate date or a rendezvous with a small group of friends). Can't wait to come back!",5.0
"New in my hood, need to support it!Been there for lunch and ordered delivery too.So far All that I tried was fresh and good, service very kind. Delivery fast. Prices good. Satay mix is a great deal, with 9$ you get 4 skewersNot impressed by the pork belly buns, though I like their ""slider"" version instead pf the classic chinese rice bun we always see.Love the noodles, especially the flat Char Kuay Teow witj seafood. The wattan hor look very similar to a pad thai, they came a bit broken in my delivery box but liked anyway. Maybe a bit dry?Their signature spare and pork ribs herbal soup was delicious, I suggest you order the small version as an appetizer so you can taste it. No dessert tried yetI am a fan already, want to try the whole menu, I am curious",4.0
"A great new spot in Park Slope! While I'm a bit of newbie to the Malaysian cuisine, I enjoyed my dish- (Seafood Wattan Hor). The dish was flavorful and came with an impressive amount of fresh seafood (scallops, shrimp, squid). Yelp check-in meant a free dessert (Homemade Mango Pudding), a sweet treat to end the meal. Service here was friendly/attentive, and the atmosphere was very nice. The menu had a lot of appetizing choices; I can't wait to go back and try the other items.",4.0
"This was good on the first try - although we mourned the loss of former tenant Chip Shop - and very good a couple months later. Seems they have hit their stride. We had a table of six with a bunch of appetizers and a couple of entrees to share. The roti and curry was great, the fried tofu balls went down like donuts with the kids, and the best surprise was the fried fish cakes with a cracker hard sesame seed crust and succulent hot fish inside. We used the leftover sweet dipping sauce with some fresh steamed vegetables that we well done. The fried rice was well above the norm and the omelette was nicely cooked - moister than usual. Food was timely for an early dinner before the crowd. Prices are good if you go family style - and you get to try more, of course. No room for desert this time, but I recall them being good first time. We'll be back.",4.0
"Pretty good Malaysian fusion.  A very nice welcome to the Park Slope community of 5th Ave restaurants, they served up some good Nasi Lemak and Chow Kiew Tiew.  Glass was never empty, and the tiny gesture of giving us some simple shrimp chips was nice.Very casual and would definitely dine here again.",4.0
"Ambiance was cozy and inviting. I loved the blue and brick walls. Perfect setting for groups and dates. Prices are very reasonable and great portions!We ordered their red curry with chicken as well as the flat ""Char Kuay Teow"" noodles. It wasn't as spicy as I hoped it would be, and it ended up being a little too oily for my taste. The red curry was very good, but it didn't have the spicy kick we were hoping for. They only had house wines by the glass which was alright, only because their red ended up being really good. Service was attentive and pleasant which is always much appreciated.",4.0
"Finally made it here for lunch which had been on my to-do list and had a great meal! Started with the pork buns. They were so adorable and a great app. Moved on to the mee goreng with chicken and shrimp. I'm not sure if I've ever had Malaysian and it reminded me of pad Thai. It was great!! The place is also very cute, appeared immaculately clean, and staff was adorable and very sweet. Also, major points for being attentive to my water consumption when housing such spicy food. I'll be back!!",5.0
"Malaysian food in NYC is hard to come by, especially GOOD Malaysian. We had lunch here the other day and the food, value & service were great!! Good happy hour - free roti & $3 beers. This place is a few blocks from home & will be the new 'go-to' restaurant for sure.",5.0
"Al Seabu is a new Malaysian restaurant in Park Slope that has a lot of potential and already has a lot of good things going for it.  It seems authentic, and it would probably benefit from taking ""fusion"" out of its branding considering that people crave authenticity over fusion restaurants these days. We had the fish & shrimp cakes, which I liked a lot (although they were probably not too healthy), the nasi lemak, and the penang asam laksa.  All seemed to be cooked with care.  We also had the rose lemonade which was really interesting and not too sweet. The space is warm, with wood paneling, and this place would certainly do great as a casual date spot once the cocktails get going. The staff were all really nice and attentive too.  They said they will be starting seamless soon, but in the meantime you can call and get delivery.  I am glad Al Seabu is in the neighborhood, and I will certainly be back. PS--you currently get a free dessert for checking in on yelp!",4.0
"This is by far one of the best Malaysian restaurants in Brooklyn and Manhattan. It is more pricey than others, but quality of food is worth the try.  The menu has a good selection seafood, authentic Noodle dishes, and curry. I also enjoyed the cozy setting, service is excellent, I'll definitely come back.",5.0
"Came here for a late dinner after painting.  I ordered Nasi Lemak, the Malaysian national dish, to eat and a Rose Lemonade to drink.  The Nasi Lemak was separated into separate parts.  It was interesting to taste each part individually before mixing them together to combine the flavors.  I liked the combination of flavors as each component could still be tasted and complimented the others.  The spice level was comfortable -- between medium and mild, but you can request to add more spice if desired.  The lemonade was refreshing.  The rose was not overpowering and went well with the lemonade.  I liked the presentation of small edible roses on top of a lemon slice on top of the drink.  Be sure to use the Yelp check-in offer to get the free mango pudding dessert.  It was a nice treat at the end of the meal as it was light and not too sweet.  Service was good.  Will be back if I'm in the area again.",4.0
Everything was delicious and flavorful. The curry prawns were amazing! I highly recommend them! And the laksa had great flavor without being too spicy. The service was attentive and friendly. I will definitely be back!,5.0
I walked in here with slight trepidation as I've been to one too many restaurants which claim to make authentic food  only to be sorely disappointed .But one bite of their satay nearly brought tears of joy to my eyes.The peanut sauce which comes with the satay is as the menu states : homemade and truly truly excellent. The nasi lemak was also enjoyable ( though I secretly wished it came with fried crispy chicken wings ) . I will definitely be back to try the other delicious offerings!Finally !!! Great Malaysian food in nyc.,4.0
Go into the restaurant do not get delivery of you want to leave a review Food here nothing less than spectacular Started with roti and pork belly skewers - both full of flavor rich and varied loved them and will love to have them again soonTried the prawns and the Malaysian rice dish that is a national dish - amazing !Almost forgot we started with house cocktails they were spot on perfect I had a plum wine ginger cocktail and loved it Can't wait to return YUM!,5.0
We had lunch at AL seabu and it was great! Wonderful curry noodles soup and a great egg noodles dish. So good,5.0
"We have been here many times already and thought time for a review.  My favorite dish is Curry Laksa - amazing flavor with lots of ingredients.  The other curry dishes were also delicious, so far no disappointment.  Staffs are friendly and attentive.  A great addition to the neighborhood.",4.0
"I guess I didn't understand the hype/generally superlative ratings. It was pretty solid Malaysian food, but definitely not earth shattering in any way.The satay tofu was relatively flavorless - there also wasn't enough peanut sauce in the way they served the dish. The rendang rice/curry dish was a relatively small portion, and unfortunately, when selecting the veggie meat option, resulted in no vegetables at all (not even the side salad that others seem to have gotten). I'm surprised there wasn't a way to combine the vegetables and the veggie meat.Service was just ok.",3.0
Perfect Curry Laksa! Roti is phenomenal. I haven't tried anything else because this winning formula makes me happy every time I am there,5.0
So excited that a really good Asian restaurant opened up on 5th Ave. Dream come true. Had the Curry Laksa and did not regret. We also ordered the Alseabu Omelette and normally I don't like Oysters but this was amazing.,5.0
"Finally some legitimate Southeast Asian food in the slope that isn't cooked in a chinese fashion. Really damn good. Satay, fish cakes, pork belly buns, crab rangoons, curries are all incredibly good. And this was for take out. Definitely will have to pay a visit to the restaurant.",5.0
"Came here for a late dinner after painting.  I ordered Nasi Lemak, the Malaysian national dish, to eat and a Rose Lemonade to drink.  The Nasi Lemak was separated into separate parts.  It was interesting to taste each part individually before mixing them together to combine the flavors.  I liked the combination of flavors as each component could still be tasted and complimented the others.  The spice level was comfortable -- between medium and mild, but you can request to add more spice if desired.  The lemonade was refreshing.  The rose was not overpowering and went well with the lemonade.  I liked the presentation of small edible roses on top of a lemon slice on top of the drink.  Be sure to use the Yelp check-in offer to get the free mango pudding dessert.  It was a nice treat at the end of the meal as it was light and not too sweet.  Service was good.  Will be back if I'm in the area again.",4.0
Everything was delicious and flavorful. The curry prawns were amazing! I highly recommend them! And the laksa had great flavor without being too spicy. The service was attentive and friendly. I will definitely be back!,5.0
I walked in here with slight trepidation as I've been to one too many restaurants which claim to make authentic food  only to be sorely disappointed .But one bite of their satay nearly brought tears of joy to my eyes.The peanut sauce which comes with the satay is as the menu states : homemade and truly truly excellent. The nasi lemak was also enjoyable ( though I secretly wished it came with fried crispy chicken wings ) . I will definitely be back to try the other delicious offerings!Finally !!! Great Malaysian food in nyc.,4.0
Go into the restaurant do not get delivery of you want to leave a review Food here nothing less than spectacular Started with roti and pork belly skewers - both full of flavor rich and varied loved them and will love to have them again soonTried the prawns and the Malaysian rice dish that is a national dish - amazing !Almost forgot we started with house cocktails they were spot on perfect I had a plum wine ginger cocktail and loved it Can't wait to return YUM!,5.0
We had lunch at AL seabu and it was great! Wonderful curry noodles soup and a great egg noodles dish. So good,5.0
"We have been here many times already and thought time for a review.  My favorite dish is Curry Laksa - amazing flavor with lots of ingredients.  The other curry dishes were also delicious, so far no disappointment.  Staffs are friendly and attentive.  A great addition to the neighborhood.",4.0
"I guess I didn't understand the hype/generally superlative ratings. It was pretty solid Malaysian food, but definitely not earth shattering in any way.The satay tofu was relatively flavorless - there also wasn't enough peanut sauce in the way they served the dish. The rendang rice/curry dish was a relatively small portion, and unfortunately, when selecting the veggie meat option, resulted in no vegetables at all (not even the side salad that others seem to have gotten). I'm surprised there wasn't a way to combine the vegetables and the veggie meat.Service was just ok.",3.0
Perfect Curry Laksa! Roti is phenomenal. I haven't tried anything else because this winning formula makes me happy every time I am there,5.0
So excited that a really good Asian restaurant opened up on 5th Ave. Dream come true. Had the Curry Laksa and did not regret. We also ordered the Alseabu Omelette and normally I don't like Oysters but this was amazing.,5.0
"Finally some legitimate Southeast Asian food in the slope that isn't cooked in a chinese fashion. Really damn good. Satay, fish cakes, pork belly buns, crab rangoons, curries are all incredibly good. And this was for take out. Definitely will have to pay a visit to the restaurant.",5.0
the chili crabs and the buttermilk fried green beans are a must!!!,5.0
"Was there recently and I was not impressed. They are new, I hope they will take these criticism positively and improved on the dishes mentioned below. I am Malaysian and have been to most 'Malaysian' restaurants there are in NYC. Al Seabu's decor is simple yet welcoming. The seats are ok for comfort. I brought 3 friends with me (all Malaysians)  to try this place out. The menu is filled with some of the more Malaysian 'hawker style' dishes. So, to the review of the dishes ordered ~  1) Satay Chicken ~ My guess is that it's fried and then slightly grilled. Very oily, not the usual authentic taste. The best satays are still at the 'Malay restaurant' in Queens . The peanut dipping sauce is ok. The condiments are miniscule and is not fresh. The marinade can be improved.2) Char Kuey Teow ~ Bland. But, it's the best dish out of the 4 that we ordered. More bean sprouts would not hurt either. 3) Assam Laksa ~ NOT authentic and the broth is just not cooked right. The least favorite for ALL of us. We returned it almost untouched. We did pay for it as it was not the server's fault. The service was good until he splattered the remaining Wat Tan Hor's sauce over my lap onto my jeans. He was quick thought to offer a wet wipe and paper napkins. 4) Wat Tan Hor ~ It's edible and served with the right preserved green chili.5) Nasi Lemak ~ It's mediocre. But, the sambal is good. The rice needs more coconut milk and the ikan bilis (anchovies) needs to a bit more. Thai Iced Tea ~ Very refreshing!",2.0
"I don't really know what to say. This place is f#%^ing amazing. The food is delicious, the staff is really really nice, the service is good, and the vibe is generally really good. Their prices are reasonable, lunch prices more so. But here's one thing I would recommend: do not go there with that friend that isn't open minded and thinks every Asian country makes Chinese food. Matter of fact, you should probably lose them as friends...",5.0
