"I had the baby yellowtail sushi special, live Uni and Chirashi, which also came with Miso Soup. My guest tried to order the Beef Yakitori, and they ran out of it. Then, she tried to order the live scallops, and they were also out of that. So she ordered the Salmon skin hand roll.The miso soup arrived, and there was no complaints about that. The baby yellowtail sushi special was delicious. It came on a bed of lettuce, avocado slices and sprouts. It had a light dressing on it and did not need any additional sauces. All the flavored worked really well together. With that being said, they kept the lettuce as one big piece, which made it really inconvenient to eat. We had to request for a knife to cut through the large chunk of lettuce and then the entire dish fell apart. It would have been much better if the lettuce was already sliced or shredded. We tried to recommend that to the owner, but he didn't seem to care.The live Uni came, and that was presentation at its best!  They had the Uni meat positioned over a green leafy vegetable on top of the Uni shell. This was my first experience with live Uni, but I really enjoyed it!  My guests have had it before elsewhere and said that it was definitely the largest slivers of Uni that they have ever seen!  So at a price of $22 for this large Uni, they were very pleased.I did enjoy the Chirashi sushi entree. It's a great value, as you get a nice sized bowl of rice topped with three different pickled vegetables, ginger, and 3 pieces of salmon, 3 pieces of yellowtail, 2 pieces of tuna and 2 pieces of cooked octopus... All for $15!  It was very filling!Then they brought out the salmon skin sushi roll for my guest... Did you catch that mistake?  She ordered the hand roll and now had to wait another 15 minutes for the correct salmon skin hand roll to arrive. Another guest had ordered the hibachi salmon with fried rice, and they brought her meal out with steamed rice.Then we tried to order the Green Tea Crepe Cake and were really excited about it because we were told by the waiter that it was from Lady M's Confections. Only to discover a few minutes later that they had run out of it.Overall, the food was actually really good here. But the service and lack of ""inventory"" was sub-par this time around.",3.0
"I've ordered a couple times since my last review and both times the delivery guy has been a nice, older man. Very friendly! And the food is still great!",5.0
"I'm so glad I found this place! I'm not a Brooklyn girl-but whenever I dine in at a Japanese restaurant in brooklyn, every sushi restaurant is a disappointment. I came this weekend and the waitress are very nice! The decor is fab and the food is great. Food arrived promptly and they serve a generous amount of everything!I've never seen a restaurant that serves this much kani salad! The squid appetizer is crispy and the flavor is on point. I order the three roll comb and I did not expect much out of it. Since it is a cheap combo, I expect it to be ""blah"" like any other restaurants that serves 3 roll combo. Lemme tell you, I was wrong! The rolls were not too tiny and not so ginormous- eel is very fresh, spicy crab with lots of tobiko! I will return for more ! :) This place definitely replaced my favorite japanese restaurant in Elmhurst, Queens (Tomo).",5.0
I'd say stick to entrées if you want your order to arrive warm. Otherwise stick to going there yourself.,3.0
"ATTENTION: DO NOT BE DECEIVED BY THE POSITIVE REVIEWS. YOU WILL BE DISAPPOINTED. I came to this place during my lunch hour based on the rave reviews on Yelp. I was greeted by an indifferent, but not impolite, host. I ordered the chicken pad thai which came up to $9.80 after tax. I tried to pay with my credit card but was told that it must be $10.00 or more. Seriously? 20 cents is a big deal?(Sidebar: Merchants aren't allowed to demand a minimum charge for credit card use. It's a violation of the merchant agreement with the credit card companies.)Anyway, I ordered jasmine rice for $1 to get above the $10 mark. I got back to my work place and took about four bites of the pad thai before discarding it. It was by far the WORST pad thai I had ever had. Both the chicken and noodles were very dry and tasted like leftovers from the day before. There was no flavor and no spice, despite it being advertised as spicy. $11 gone down the drain. I was so upset about it that I decided to create a Yelp account just so I could write this dump of a place a negative review. In short, the kindest thing that can be said about this sham of a restaurant is that it has a very nice bathroom.",1.0
"A cute and pretty decent spot at the very faaarrr end of the Asian-Chinese 8th Avenue.I had previously heard about this place from friends and when there was a Groupon deal offered, I bought it and decided to have a dinner date with one of my friends. It was a first experience here for both my friend and I.First, let's talk about the Groupon, it offered 2 beers/wines, 2 special rolls and a ramen/noodle/udon, etc. I forgot the price I paid for this Groupon though. I felt that they were accommodating to our request of the Groupon cuz we did not want to drink beer/wine so we each ordered one of the regular drinks on the menu. They offered a wide range of drinks, from smoothie to slushies to bubble teas and some regular drinks. If you see the drink menu has such a big variety, that would mean that the food menu would be a huge variety too, and you're right! There's a variety of different dishes on the menu. All the food sounded so appetizing! My friend and I ordered a sushi pizza as a starter then 2 special rolls, which were all very delicious and unique. The stir-fried udon we ordered to share was good portion and well-sauced! Definitely a good amount of food to try.I would like to come back in the future. The only downside would be that it is rather far from the main 8th Avenue area, and if you're walking, it's a work out for your legs! If you're lucky enough to catch the bus, that'd be great too. This is a good restaurant though. Casual decor which also gives a classy-nice vibe to it as well.",4.0
"Came here twice, once was delivery through seamless and another was going to the restaurant. The decorations were nice and had great service. I did not know what to order and the waiter was able to speak to me asking if I want rice or noodle and narrow it down to which two dishes he recommends. He would explain what's inside each dish and I enjoyed it. However, ordering from seamless seems totally different. The delivery guy called me and screamed DELIVERY then hung up real quick. Seems like he didn't like his job or hate the restaurant. He did not even bother to give me any eye contact or smile. I know its not the restaurants fault but that delivery guy seems like he was putting his anger out in his job. Seems like I won't be ordering online anymore. Though I did enjoy the sushi. I would recommend the Pad Thai, and sushi from this place.",4.0
"very impressive menu with lots of fusion items. very impressive decor as well as one wouldn't expect this to be in the middle of 8th ave. we tried the skewer special 6 for $12 essentially $2 per stick. the pork belly, smelt, and fried chicken. my fave was the pork belly which was nicely seasoned and so tasty! also tried the kani salad which lacked mayo dressing. had a salmon lover which came with salmon sashimi, salmon hand roll and a salmon avoc roll. decent but nothing too crazy as well. the special of the day was curry laksa so we tried that but it was rather lacking coconut/butteryness. we were just too full but i wanted to have some crepe cake. will def be back for more!",4.0
"Asea is not the best Japanese retaurant i've had but it's certainly a cut above the rest. The sushi is definitely fresh, and the yakitori is done well. There's of course alcohol served here so thats a plus. Tried the beef, scallop and bacon, and chicken, yakitori and it was pretty good. Not many places serve that along 8th Ave so it was nice. The sushi was nice and fresh, and their Kani salad was pretty good.I would actually go here more if it wasn't so out of place for me. I would definitely come back though and with a bigger group of friends (more than 3) to try more of their food.",3.0
They make the quality good for the area. Nice to watch soccer matches here. But the prices too high. Doesn't really fit with 8th ave. The owner is nice. For the price you pay better to go to park slope or city I think,2.0
"Love this sushi restaurant, fresh sushi. Staff very friendly they remember you as soon as you walk in. Beautiful decor very big place.",5.0
"I've ordered a couple times since my last review and both times the delivery guy has been a nice, older man. Very friendly! And the food is still great!",5.0
"I'm so glad I found this place! I'm not a Brooklyn girl-but whenever I dine in at a Japanese restaurant in brooklyn, every sushi restaurant is a disappointment. I came this weekend and the waitress are very nice! The decor is fab and the food is great. Food arrived promptly and they serve a generous amount of everything!I've never seen a restaurant that serves this much kani salad! The squid appetizer is crispy and the flavor is on point. I order the three roll comb and I did not expect much out of it. Since it is a cheap combo, I expect it to be ""blah"" like any other restaurants that serves 3 roll combo. Lemme tell you, I was wrong! The rolls were not too tiny and not so ginormous- eel is very fresh, spicy crab with lots of tobiko! I will return for more ! :) This place definitely replaced my favorite japanese restaurant in Elmhurst, Queens (Tomo).",5.0
I'd say stick to entrées if you want your order to arrive warm. Otherwise stick to going there yourself.,3.0
"ATTENTION: DO NOT BE DECEIVED BY THE POSITIVE REVIEWS. YOU WILL BE DISAPPOINTED. I came to this place during my lunch hour based on the rave reviews on Yelp. I was greeted by an indifferent, but not impolite, host. I ordered the chicken pad thai which came up to $9.80 after tax. I tried to pay with my credit card but was told that it must be $10.00 or more. Seriously? 20 cents is a big deal?(Sidebar: Merchants aren't allowed to demand a minimum charge for credit card use. It's a violation of the merchant agreement with the credit card companies.)Anyway, I ordered jasmine rice for $1 to get above the $10 mark. I got back to my work place and took about four bites of the pad thai before discarding it. It was by far the WORST pad thai I had ever had. Both the chicken and noodles were very dry and tasted like leftovers from the day before. There was no flavor and no spice, despite it being advertised as spicy. $11 gone down the drain. I was so upset about it that I decided to create a Yelp account just so I could write this dump of a place a negative review. In short, the kindest thing that can be said about this sham of a restaurant is that it has a very nice bathroom.",1.0
"A cute and pretty decent spot at the very faaarrr end of the Asian-Chinese 8th Avenue.I had previously heard about this place from friends and when there was a Groupon deal offered, I bought it and decided to have a dinner date with one of my friends. It was a first experience here for both my friend and I.First, let's talk about the Groupon, it offered 2 beers/wines, 2 special rolls and a ramen/noodle/udon, etc. I forgot the price I paid for this Groupon though. I felt that they were accommodating to our request of the Groupon cuz we did not want to drink beer/wine so we each ordered one of the regular drinks on the menu. They offered a wide range of drinks, from smoothie to slushies to bubble teas and some regular drinks. If you see the drink menu has such a big variety, that would mean that the food menu would be a huge variety too, and you're right! There's a variety of different dishes on the menu. All the food sounded so appetizing! My friend and I ordered a sushi pizza as a starter then 2 special rolls, which were all very delicious and unique. The stir-fried udon we ordered to share was good portion and well-sauced! Definitely a good amount of food to try.I would like to come back in the future. The only downside would be that it is rather far from the main 8th Avenue area, and if you're walking, it's a work out for your legs! If you're lucky enough to catch the bus, that'd be great too. This is a good restaurant though. Casual decor which also gives a classy-nice vibe to it as well.",4.0
"Came here twice, once was delivery through seamless and another was going to the restaurant. The decorations were nice and had great service. I did not know what to order and the waiter was able to speak to me asking if I want rice or noodle and narrow it down to which two dishes he recommends. He would explain what's inside each dish and I enjoyed it. However, ordering from seamless seems totally different. The delivery guy called me and screamed DELIVERY then hung up real quick. Seems like he didn't like his job or hate the restaurant. He did not even bother to give me any eye contact or smile. I know its not the restaurants fault but that delivery guy seems like he was putting his anger out in his job. Seems like I won't be ordering online anymore. Though I did enjoy the sushi. I would recommend the Pad Thai, and sushi from this place.",4.0
"very impressive menu with lots of fusion items. very impressive decor as well as one wouldn't expect this to be in the middle of 8th ave. we tried the skewer special 6 for $12 essentially $2 per stick. the pork belly, smelt, and fried chicken. my fave was the pork belly which was nicely seasoned and so tasty! also tried the kani salad which lacked mayo dressing. had a salmon lover which came with salmon sashimi, salmon hand roll and a salmon avoc roll. decent but nothing too crazy as well. the special of the day was curry laksa so we tried that but it was rather lacking coconut/butteryness. we were just too full but i wanted to have some crepe cake. will def be back for more!",4.0
"Asea is not the best Japanese retaurant i've had but it's certainly a cut above the rest. The sushi is definitely fresh, and the yakitori is done well. There's of course alcohol served here so thats a plus. Tried the beef, scallop and bacon, and chicken, yakitori and it was pretty good. Not many places serve that along 8th Ave so it was nice. The sushi was nice and fresh, and their Kani salad was pretty good.I would actually go here more if it wasn't so out of place for me. I would definitely come back though and with a bigger group of friends (more than 3) to try more of their food.",3.0
They make the quality good for the area. Nice to watch soccer matches here. But the prices too high. Doesn't really fit with 8th ave. The owner is nice. For the price you pay better to go to park slope or city I think,2.0
"Love this sushi restaurant, fresh sushi. Staff very friendly they remember you as soon as you walk in. Beautiful decor very big place.",5.0
"Came in to watch the football game of all things.  I know,  but my wife was getting her hair done across the street.  Very nice and accommodating,  sat for the jet game with some draft beer,  and comp edamame, thanks Joseph! Will come and try the food next time. ..",5.0
Really nice local Asian fusion spot... food was delicious and really affordable. .. def coming back... i recommend the coconut shrimp for appetizers mad good!,4.0
"This is definitely 4 stars for the neighborhood. In three visits everything we've had was solid. It's not Michelin star amazing but it's good. Today I had the Malaysian Curry Laksa Noodle Soup. Spicy, filling, GOOD. Service is great, the ambience is a little bit of Asian-fusiony-fancy everything and too much but it's clean. This place is great for Sunset Park/Boro Park and really reliably good.",4.0
"Finally a decent jap restaurant around brooklyn! Second time here this week, the first time we came they sold out of live uni so we came back today and it was sooo YUMMY!(we got 3 orders) my second time trying uni and im glad this place left a good impression. I've tried almost everything on the menu and everything is delicious. The pizza only comes in four slices so if u come with a big crowd order double, same with the m&m. Had stellar bay oysters for the first time, the first batch we had was yummy the second batch could have been better but the service was remarkable. Love the decor and the vibe of the restaurant, was told every monday there's fresh scallops and weds live uni & starting november 1 there will also be valet cause parking is IMPOSSIbLE there. Will definitely be back :) NEW favorite! goodbye ichi sushi!",4.0
"This is the best sushi place in Sunset Park. We actually order delivery from them all the time, but I think we are just going to go to the restaurant from now on because it's such a nice place. The sashimi was great, the rolls were delish, the sake was fair (could be very good, but I don't have a palate developed for it yet, so I'm not sure), the service was fabulous, and the owner was there hovering in the room to make sure everything was perfect. I had the white tuna mango roll which was really great, goes down like butter. The spicy tuna is my fave, and the philadelphia roll was nice and smokey. Also you get a free edamame appetizer when you check in and like on Facebook, so we did that too.My sister came in from out of town so there were four of us, and the owner would check in at every service check-point to make sure we were happy. He ended up giving us a free large sake. Also we got the mochi for dessert, which was fresh (I hate it when you order mochi and it's got freezer burn), so every course was very good. When we finished our meal we moved to the bar, and had some top notch cocktails and ethnic beers, and he ended up giving us a free bottle of wine to take to go. This guy knows how to get his customers to return. And who wouldn't want to, with that yummo sushi?!Also, the restaurant itself is super clean, super updated, the bathrooms were well maintained (which is a pet peeve of mine), and everyone is just really nice. I take all of my friends here for sushi when they come out to the sticks in Sunset Park. This is the type of place that is making this neighborhood better. Definite five stars: excellent food, excellent drinks, excellent service, excellent atmosphere/ambiance, and excellent amenities inside restaurant.",5.0
Such great attentive service. The sashimi is very fresh and it melts in your mouth. Kitchen food like the skewers Are juicy and seasoned very well. The atmosphere is very relaxing and casual. What else?? They have a bar and a lot of TVs haha. The boss is very nice and welling to listen to suggestions. The decor of the place is worth the 5 stars itself. Usually a lot of Asian places do not spend money on the decor but this place did. It's very comfortable for both a friends outing. I love it!,5.0
"Asea is a seriously unique spot for the 8th Ave. stretch in Chinatown in that it's the only place you can head out to eat for a evening that feels special. The decor is really a much-needed change of pace.I've had many dishes at Asea so far, most of them have been very good. Though, I personally enjoy their other dishes other than sushi much more. (FYI, have had extremely mediocre sushi delivery experiences, and an absolutely excellent lunch bento delivery. Do with that what you will.)The yakitori is delicious. I've had the squid, beef and pork belly. All cooked perfectly with great flavor. Definitely don't hesitate to order a heap of these with some appetizers for a meal.The Malaysian Seafood Udon Curry soup was CRAZY GOOD. The broth reminded me of my favorite spicy miso ramen dish in the city, and the seafood was perfect. Giant portion and quality for $9. I will be coming back for this bowl.Masaman curry was a bit of a disappointment, though not because it tasted bad. It was just different than other Masamans I've had, so it didn't exactly hit the spot. I've had a General Tso bento lunch box that was super good, as well. The Tso was leaps and bounds better than most of the Chinese delivery restos around here, and all of the bento components were spot on.And don't forget dessert. The green tea ice cream and fried bananas is something serious. Mochi is also good. I'm a big fan of Asea because of delicious food, nice ambiance and really great service. You can tell the owner cares about your experience here. Stop your Seamless order now and just head on in for dinner.",4.0
This place is DELICIOUS!! You can't go wrong with their dancing lobster roll. You won't be disappointed. I highly recommend it and it's pretty affordable.,5.0
"their food is great - that they send their cronies out every couple weeks to decorate the entirety of park slope with their menu is HORRIBLE. Asea  mgmt - it is... 2014. we have, the internet. cut it out with the menu drop - we all know you're there.",1.0
"The food here is very good. Had a bento box lunch special, and some sushi (chirashi). They messed up.my roll order but gave me a free squid-seaweed salad. Very fresh fish. Very nice ambience compared to surrounding places. I can't wait to try their Malaysian dishes....okay, tried them. Excellent.",4.0
"Came in to watch the football game of all things.  I know,  but my wife was getting her hair done across the street.  Very nice and accommodating,  sat for the jet game with some draft beer,  and comp edamame, thanks Joseph! Will come and try the food next time. ..",5.0
Really nice local Asian fusion spot... food was delicious and really affordable. .. def coming back... i recommend the coconut shrimp for appetizers mad good!,4.0
"This is definitely 4 stars for the neighborhood. In three visits everything we've had was solid. It's not Michelin star amazing but it's good. Today I had the Malaysian Curry Laksa Noodle Soup. Spicy, filling, GOOD. Service is great, the ambience is a little bit of Asian-fusiony-fancy everything and too much but it's clean. This place is great for Sunset Park/Boro Park and really reliably good.",4.0
"Finally a decent jap restaurant around brooklyn! Second time here this week, the first time we came they sold out of live uni so we came back today and it was sooo YUMMY!(we got 3 orders) my second time trying uni and im glad this place left a good impression. I've tried almost everything on the menu and everything is delicious. The pizza only comes in four slices so if u come with a big crowd order double, same with the m&m. Had stellar bay oysters for the first time, the first batch we had was yummy the second batch could have been better but the service was remarkable. Love the decor and the vibe of the restaurant, was told every monday there's fresh scallops and weds live uni & starting november 1 there will also be valet cause parking is IMPOSSIbLE there. Will definitely be back :) NEW favorite! goodbye ichi sushi!",4.0
"This is the best sushi place in Sunset Park. We actually order delivery from them all the time, but I think we are just going to go to the restaurant from now on because it's such a nice place. The sashimi was great, the rolls were delish, the sake was fair (could be very good, but I don't have a palate developed for it yet, so I'm not sure), the service was fabulous, and the owner was there hovering in the room to make sure everything was perfect. I had the white tuna mango roll which was really great, goes down like butter. The spicy tuna is my fave, and the philadelphia roll was nice and smokey. Also you get a free edamame appetizer when you check in and like on Facebook, so we did that too.My sister came in from out of town so there were four of us, and the owner would check in at every service check-point to make sure we were happy. He ended up giving us a free large sake. Also we got the mochi for dessert, which was fresh (I hate it when you order mochi and it's got freezer burn), so every course was very good. When we finished our meal we moved to the bar, and had some top notch cocktails and ethnic beers, and he ended up giving us a free bottle of wine to take to go. This guy knows how to get his customers to return. And who wouldn't want to, with that yummo sushi?!Also, the restaurant itself is super clean, super updated, the bathrooms were well maintained (which is a pet peeve of mine), and everyone is just really nice. I take all of my friends here for sushi when they come out to the sticks in Sunset Park. This is the type of place that is making this neighborhood better. Definite five stars: excellent food, excellent drinks, excellent service, excellent atmosphere/ambiance, and excellent amenities inside restaurant.",5.0
Such great attentive service. The sashimi is very fresh and it melts in your mouth. Kitchen food like the skewers Are juicy and seasoned very well. The atmosphere is very relaxing and casual. What else?? They have a bar and a lot of TVs haha. The boss is very nice and welling to listen to suggestions. The decor of the place is worth the 5 stars itself. Usually a lot of Asian places do not spend money on the decor but this place did. It's very comfortable for both a friends outing. I love it!,5.0
