"I went in for a breakfast wrap and they basically have the breakfast wrap of my dreams. It's called the propeller and is egg, jack cheese, avocado, and a hash brown. The staff was super friendly and when I asked for a couple coffees they asked if I'd be okay waiting a few minutes to brew a new pot for me, even though they still had plenty that had been sitting. I really appreciated it.",5.0
Love this place. The sandwiches are creative and delicious. The beer selection is fantastic. The owners/workers are the nicest people you will ever find and have become friends. Just really nothing but good things to say.,5.0
"Wow! ,  superlative Tacos! I just had my best meal { and most inexpensive meal} during my 6 day stay in NY at Chacho's deli.  The Tacos are so delicious,  the shell has a wonderful corn like flavour that is rare to find.  The price is a steal as well.  I would pay double the price for this epitome of Mexican food heaven.  I loved the Tacos so much I ate them two days in a row.  We also tried the falafel pita which was good as well. Tomorrow I'm going to grab the ""breakfast propeller""  which apparently is their house specialty.  Thank you Chacaco's you are a gem!",5.0
"Simple, honest stuff - but it is great food at good prices. I'm certainly going back!",5.0
"Pretty much amazing from breakfast to dinner. Bacon, egg n cheese and spicy BLT-A are my favorites.",5.0
"These dudes are my favorite, Food is always killer and everyone there is so nice.",5.0
"This place is incredible. Staff is so friendly. Their sandwiches, tacos, falafel is all amazing. Can't go wrong with this place.",5.0
"This place is awesome! I just moved in down the street and was praying I had a good local deli, and this place exceeded my expectations. The food menu is really awesome and everything is good from breakfast to dinner (seriously, and I'm picky). The best part is the place is so clean and the staff are extremely friendly and courteous-- two very important things for a good deli!",5.0
