"Grandma pizza here is great! Their sauce is well seasoned. You can tell from the moment you walk in that the pizza here will be good because you can smell garlic in the air. Ahhh. Just remember to brush your teeth after. Kale Caesar salad is also bomb, so you can have your salad on the side of your pizza and feel *healthy*.",5.0
Has to be the best pizza I've tasted since I moved in the neighborhood 6 months ago. Best pizza I've tasted Ina awhile. Will be ordering from here a lot more often.,5.0
"So good! We got some pizza delivery. It came in exactly 30 mins and the delivery guy was really nice. We got a large pie half bacon and spinach and half onions and mushrooms! The two of us ate the whole thing!I got a garden salad as well (but they only gave a small amount of dressing for a fairly large salad) and a coke.For everything it was $28.31! Not bad, will definitely order again!",5.0
"I just so happened to bookmark this spot a few days before, so I decided to stop by since I just got off the A train. I attended a health & wellness fair just a few hours before and was set that I would get back on the wagon and eat healthy again. The name of the place is funny, since they also various types of pizza, which all looked and smelled good. The space has a rustic appeal (Brick walls, aged wooden tables) and was quite empty on that gloomy Saturday. Only a few customers that came in for take out and there were some staff around. I ordered the Kale Caesar with chicken and a butternut squash soup for take out. The salad was Really simple with no way of messing it up. Kale is tough in general but they were coated with just enough dressing to manage. I hate my salads drenched in dressing so it was perfect for me and tasty. This was my first time trying butternut squash soup. It was tasty but needed a few more added seasonings for my palette. Overall the staff were generally friendly and accommodating. I'll go back to try more things on the menu and the definitely the pizza :-)",4.0
"Daddy Greens is all Brooklyn & GREAT food. Stayed in the big Apple for a week and ate at Daddys each & everyday.  They took the time to get to know us and offer a kind hello. There is something for everyone. ..coffee, salads, yummy sandwiches but the pizza keeps ya coming back. Thanks for the terrific service, smiles & did I say awesome food.",5.0
The vegan pizza is awesome and you can get it by the slice!,5.0
"The Stuy's FRESH gem: Grandma's, Margherita, Salads (Garden & Kale Caesar) ALL tastes like each items freshly picked from the garden. The dough's light and airy. Sometimes it's double baked (Grandma) which gives greater texture and a more roasted aroma. Equally fresh is the pungent tomato sauce ladened with cloves on cloves of delicious stinky rose. The salads are not a side note, as they offer a hearty but light kiss to accompany whatever pizza or pasta dish chosen. Great addition to the neighborhood from a born & bred Bed-Stuy native, who knows just what feeds the soul of Brooklyn!",4.0
"Thank you Allen & Momma for the awesome food & awesome service!!!  All their pizzas are great but, highly recommend the Penne a la Vodka pizza and their homemade iced tea!!!Ray Ray",5.0
"This place is one of the best pizzerias I have been to in NYC. But their service is a true lack luster. Let me start off with this.1. I had pizza delivered saturday, took about an hour. NP. My new roommate called, and ask for a delivery, and the VERY RUDE Delivery guy said Sorry we don't deliver there. Wow.2. The Delivery guy, extremely rude, hostile and gives dirty looks. This is something people shouldnt have to deal with this, he was being yelled at. He also expects big tips when hes not willing to walk up steps to meet you at your front door. Regardless if i'm on the 4th floor or not, you just lost a few dollar son your tip. He gave me an attitude one day about not wanting to walk up. I called him lazy to his face as I was a delivery guy at one point in my life and I made sure to go to everyones front door, regardless if they were in a CO OP or apartment. This guy needs to be fired. Sorry, this is a sure lackluster in your business.3. I went there on sunday to eat with my parents, to only find they had exquisite pizza. All I wanted was a regular slice. I never been to a pizzeria that didn't have any single regular slices, or anything even remote to it. Very sad and mad me annoyed.4. My new roomies moved in and said they waited 2 hours for a pizza, complete imbeciles if you delivery is 2 hours late or pickup for that matter. Again, I worked at new park pizza, I handled over 25 deliverys a day, I was quick and adamant about getting pizza on time and not making people wait. This is something that needs to be addressed.5. The owner is actually a really nice guy. I hate to write a bad review about his place of business but everything i've said is the truth. He makes great pizza but he really needs better help or hire more people to ensure your business is flowing, and not making people wait.",2.0
"Quite possibly one of the best slices I've ever had. I've lived and traveled to NYC since I was a kid and I believe we have the best pizza! I wanted a spinach and bacon slice and there wasn't any so he offered to make me one. I waited around ten minutes and it was definitely worth it. The spinach fresh, the bacon crispy and salty porky goodness, not an overwhelming amount either. The cheese was ooey gooey and delicious. The sauce was light and complimented all the other ingredients. My only qualm was the crusty, a bit too crunchy for me, but only at the end. I loved that my cheese didn't fall off the pizza even though it was fresh out of the oven.I took my slice to go but since I had to wait for it to be made I noticed the cashier was very attentive and friendly. She offered me ice cold water while I waited. The pizza man was also very friendly. All in all a pleasant experience for a rushed lunch. I'll def be back next time I'm in Bed-Stuy. Extra star for the name!",5.0
"Grandma pizza here is great! Their sauce is well seasoned. You can tell from the moment you walk in that the pizza here will be good because you can smell garlic in the air. Ahhh. Just remember to brush your teeth after. Kale Caesar salad is also bomb, so you can have your salad on the side of your pizza and feel *healthy*.",5.0
Has to be the best pizza I've tasted since I moved in the neighborhood 6 months ago. Best pizza I've tasted Ina awhile. Will be ordering from here a lot more often.,5.0
"So good! We got some pizza delivery. It came in exactly 30 mins and the delivery guy was really nice. We got a large pie half bacon and spinach and half onions and mushrooms! The two of us ate the whole thing!I got a garden salad as well (but they only gave a small amount of dressing for a fairly large salad) and a coke.For everything it was $28.31! Not bad, will definitely order again!",5.0
"I just so happened to bookmark this spot a few days before, so I decided to stop by since I just got off the A train. I attended a health & wellness fair just a few hours before and was set that I would get back on the wagon and eat healthy again. The name of the place is funny, since they also various types of pizza, which all looked and smelled good. The space has a rustic appeal (Brick walls, aged wooden tables) and was quite empty on that gloomy Saturday. Only a few customers that came in for take out and there were some staff around. I ordered the Kale Caesar with chicken and a butternut squash soup for take out. The salad was Really simple with no way of messing it up. Kale is tough in general but they were coated with just enough dressing to manage. I hate my salads drenched in dressing so it was perfect for me and tasty. This was my first time trying butternut squash soup. It was tasty but needed a few more added seasonings for my palette. Overall the staff were generally friendly and accommodating. I'll go back to try more things on the menu and the definitely the pizza :-)",4.0
"Daddy Greens is all Brooklyn & GREAT food. Stayed in the big Apple for a week and ate at Daddys each & everyday.  They took the time to get to know us and offer a kind hello. There is something for everyone. ..coffee, salads, yummy sandwiches but the pizza keeps ya coming back. Thanks for the terrific service, smiles & did I say awesome food.",5.0
The vegan pizza is awesome and you can get it by the slice!,5.0
"The Stuy's FRESH gem: Grandma's, Margherita, Salads (Garden & Kale Caesar) ALL tastes like each items freshly picked from the garden. The dough's light and airy. Sometimes it's double baked (Grandma) which gives greater texture and a more roasted aroma. Equally fresh is the pungent tomato sauce ladened with cloves on cloves of delicious stinky rose. The salads are not a side note, as they offer a hearty but light kiss to accompany whatever pizza or pasta dish chosen. Great addition to the neighborhood from a born & bred Bed-Stuy native, who knows just what feeds the soul of Brooklyn!",4.0
"Daddy's is the best pizza joint in Bedstuy! I've had a few of the slices and they are all fantastic, but the main way to judge a pizza spot is on its plain slice. Low and behold it's one of the best I've had in NYC. Cheesy, cracker thin, fresh basil on every slice and the main show case is the sesame seed crust. They also have salads, sandwiches, coffee and even dough doughnuts here. Prices are good and they even accept card with no minimum (that means tax is not included in the prices though) I'm going to keep eating here until I get obese and have to worry about a diet.",5.0
"Delicious pizza! The staff is very friendly and the restaurant has a nice atmosphere and free WiFi. It's very difficult to eat just one slice. The Margherita pizza is my favorite. Everything tastes soo fresh, if you're a pizza lover this is your place. The only reason I gave it 4 stars instead of 5 is because the delivery is a bit slow and my pizza arrived cold, even though I live near by.",4.0
"Sauces great, well seasoned, nice crust, pizza's are delicious - definitely you wanna come back for those puppies and their great and terrific customer service. Daddy Greens is all Brooklyn.",5.0
"Its a huge shame when a pizza place that you really like and enjoy just goes to crap. I know you can do great things and you're selling a really bad product under the guise and price of a very good one. you just delivered to me the soggiest, shittiest pie of pizza. You should be ashamed to call yourself a brooklyn pizza spot. this is terrible. the box is soggy and not even holding its shape. Huge pool of oil underneath the pizza, none of the toppings will stay on the pizza. really poor.",1.0
"This is some of the best pizza in Bed-Stuy. Possibly New York City. There is one other place nearby that comes close, Saraghina on Halsey St, but this place is cheaper and the people who work here are really chill and really good neighbors. I came home late from a flight (i live across the street) and stopped here for a slice just before closing, and they gave me a free slice. Be sure to try the buffalo chicken slice and the margherita slice - both are fantastic. Regular cheese is really good too. I'm a fiend for basil, so they could put more on, but any pizza place that puts basil on by default is a good pizza place. Great coffee here too.",5.0
":( I read so many good reviews, and yet I didn't have such a great experience. this review is for their DELIVERY. I ordered my meat lovers (no bacon, no meatballs) pizza at 8:17pm on a Wednesday and didn't receive my pizza until 9:39pm. I can't speak for the business, but how busy are you really, on a Wednesday night? ugh. the delivery guy didn't even apologize for their lateness.maybe ill try them again but instead I'll make the 20/25 min trek to pick up my pizza. :/",1.0
Heeeeyyyyy Daddy Greens!Visited Brooklyn for a long weekend and followed the other Yelper reviews to this spot....also didn't hurt that it was a block away from our brownstone!Cute spot! Good pizza! Great salad! Awesome service! What else is there?!? I actually went there twice in one day! LolSee you next time on the block!,5.0
"I really, really dig this place. It's been an awesome addition to the neighborhood, considering pizza options are scant. The shop itself is very cute, low-key, and you can watch them make the pizza behind the counter which is cool. Some of the pizzas have sesame seeds in the crust, and those are my favorite! Adds a unique flavor and texture. All ingredients used taste fresh, and there are lots of slices to choose from. Their Grandma and White slices are my personal go-tos, as the plum tomatoes and ricotta are so good. They're always playing good tunes in the shop, and along with minimal but cute decor and a very clean bathroom, it makes me wanna hang around here for a long time.",5.0
"Amazing pizza.  Super nice and knowledgeable guy behind the counter and a very sweet cashier. Grandma slice - with spices and stuff on it-maybe the best thing that's ever been near my face. Let alone inside it. So basically, visit here and enjoy.",5.0
"I really want to love this little neighborhood spot but I'm having trouble with the way their flavors are set up in their sauce and how it conflicts with the crust. The environment is nice and laid back and the staff is super friendly, it's just unfortunate that the one thing I want is the one thing they are struggling with. I'm rooting for you guys, but you have to step it up.",3.0
"Daddy's is the best pizza joint in Bedstuy! I've had a few of the slices and they are all fantastic, but the main way to judge a pizza spot is on its plain slice. Low and behold it's one of the best I've had in NYC. Cheesy, cracker thin, fresh basil on every slice and the main show case is the sesame seed crust. They also have salads, sandwiches, coffee and even dough doughnuts here. Prices are good and they even accept card with no minimum (that means tax is not included in the prices though) I'm going to keep eating here until I get obese and have to worry about a diet.",5.0
"Delicious pizza! The staff is very friendly and the restaurant has a nice atmosphere and free WiFi. It's very difficult to eat just one slice. The Margherita pizza is my favorite. Everything tastes soo fresh, if you're a pizza lover this is your place. The only reason I gave it 4 stars instead of 5 is because the delivery is a bit slow and my pizza arrived cold, even though I live near by.",4.0
"Sauces great, well seasoned, nice crust, pizza's are delicious - definitely you wanna come back for those puppies and their great and terrific customer service. Daddy Greens is all Brooklyn.",5.0
"Its a huge shame when a pizza place that you really like and enjoy just goes to crap. I know you can do great things and you're selling a really bad product under the guise and price of a very good one. you just delivered to me the soggiest, shittiest pie of pizza. You should be ashamed to call yourself a brooklyn pizza spot. this is terrible. the box is soggy and not even holding its shape. Huge pool of oil underneath the pizza, none of the toppings will stay on the pizza. really poor.",1.0
"This is some of the best pizza in Bed-Stuy. Possibly New York City. There is one other place nearby that comes close, Saraghina on Halsey St, but this place is cheaper and the people who work here are really chill and really good neighbors. I came home late from a flight (i live across the street) and stopped here for a slice just before closing, and they gave me a free slice. Be sure to try the buffalo chicken slice and the margherita slice - both are fantastic. Regular cheese is really good too. I'm a fiend for basil, so they could put more on, but any pizza place that puts basil on by default is a good pizza place. Great coffee here too.",5.0
":( I read so many good reviews, and yet I didn't have such a great experience. this review is for their DELIVERY. I ordered my meat lovers (no bacon, no meatballs) pizza at 8:17pm on a Wednesday and didn't receive my pizza until 9:39pm. I can't speak for the business, but how busy are you really, on a Wednesday night? ugh. the delivery guy didn't even apologize for their lateness.maybe ill try them again but instead I'll make the 20/25 min trek to pick up my pizza. :/",1.0
Heeeeyyyyy Daddy Greens!Visited Brooklyn for a long weekend and followed the other Yelper reviews to this spot....also didn't hurt that it was a block away from our brownstone!Cute spot! Good pizza! Great salad! Awesome service! What else is there?!? I actually went there twice in one day! LolSee you next time on the block!,5.0
"I really, really dig this place. It's been an awesome addition to the neighborhood, considering pizza options are scant. The shop itself is very cute, low-key, and you can watch them make the pizza behind the counter which is cool. Some of the pizzas have sesame seeds in the crust, and those are my favorite! Adds a unique flavor and texture. All ingredients used taste fresh, and there are lots of slices to choose from. Their Grandma and White slices are my personal go-tos, as the plum tomatoes and ricotta are so good. They're always playing good tunes in the shop, and along with minimal but cute decor and a very clean bathroom, it makes me wanna hang around here for a long time.",5.0
"Amazing pizza.  Super nice and knowledgeable guy behind the counter and a very sweet cashier. Grandma slice - with spices and stuff on it-maybe the best thing that's ever been near my face. Let alone inside it. So basically, visit here and enjoy.",5.0
"I really want to love this little neighborhood spot but I'm having trouble with the way their flavors are set up in their sauce and how it conflicts with the crust. The environment is nice and laid back and the staff is super friendly, it's just unfortunate that the one thing I want is the one thing they are struggling with. I'm rooting for you guys, but you have to step it up.",3.0
"I'm not sure if the other reviewers have had much pizza or if they are all fresh off the boat from Nebraska.The crust was overdone; the sesame seeds are sort of interesting for a minute but ultimately distracting. The sauce is far too sweet.Nice folks, nice place, edible enough, but there is nothing special about this pizzeria in the context of New York pizzerias.",3.0
This place is horrible. Waited over an hour for a salad and the girl on the phone was incredibly rude. Food was mediocre.,1.0
I've been to this location multiple times for pizza and it seems that they only cater to those who are placing large orders...... I came in asking for a coffee paid and told the young lady I'll be in 5 minutes....  I came back about 10 min later and she was still searching for the milk then proceeds to attempt to charge me more because I wanted more milk than coffee (eyes opened) ... After taking multiple sips for taste not only was it nasty but they continued fulfilling orders.... I'm in the customer service industry and I can tell when someone doesn't know what they are doing or how to problem solve... I suggest this establishment continue making pizza and steer away from hiring people who can't make coffee,1.0
"Delivery guy was rude and forgot part of the order . He called and said ""come down and get this"" then wasn't even at my building. Then came walking up the street and told me ""he forgot part of the order but it's no problem call the store and get a refund"". Oh cool. So the delivery guy was rude, my sandwich and soup weren't even hot and my girlfriends salad didn't have the chicken in it I paid extra for. I'll never order from here again!",1.0
Come on. Seriously. Best pizza place in Bed-Stuy. The dudes making the pizza are really into it. Def try the Grandmas Pizza. So effin rad. Seriously nice dudes too. Playing some great hiphop too.,5.0
"This is one of the best pizzas I have ever had. I am always looking for that perfect combo of crust sauce and cheese and this is it. I love it the best when I order in the restaurant because it's hot and crispy there. But ordering delivery is good, too. I have spoken to one of the owners and told him how much I enjoy the pizza and he was such a humble and nice guy. I am happy to have them in Bed-Stuy.",5.0
"Who's giving four and a half stars here??? Are you outta your mind? This is satisfactory...will shut your stomach up in an emergency. Bed-Stuy is in a bad way with pizza...either shitty Rocco's or super pretentious Saraghina...whatever happened to a nice dependable pie? Why Daddy Greens putting sugar in tomato sauce? That's perverted, keep it savory with some garlic and salt. Cheese is well undercooked too...I was hungry and it filled me, so thanks...and it came quicker than seamless said it would. But won't order again until its absolutely necessary",2.0
"This place is the bomb! Wonderful workers and Rodney really seems like give back to the community and provides a positive message to young kids in the neighborhood.  Walking outside, the smells are great and the food is even better. I'm not usually around the neighborhood, but I will definitely be back to this place when I am.  Thanks!",5.0
De-freakin-licious!!! My family and I LOVE the Pizza! and the staff is the best!!!!!The sauce! The Toppings! The love!!! And it's a few blocks away from my Casa! Bed Stuy has a Gem and it better stay :),5.0
Fantastic pizza place. Very modern and good for the neighborhood.The pizza is always cooked impeccably and is great for a rough night. Love all the options here. The only thing I wish for this place is that they'd be open on Sunday. Great day for business.,5.0
"I'm not sure if the other reviewers have had much pizza or if they are all fresh off the boat from Nebraska.The crust was overdone; the sesame seeds are sort of interesting for a minute but ultimately distracting. The sauce is far too sweet.Nice folks, nice place, edible enough, but there is nothing special about this pizzeria in the context of New York pizzerias.",3.0
This place is horrible. Waited over an hour for a salad and the girl on the phone was incredibly rude. Food was mediocre.,1.0
I've been to this location multiple times for pizza and it seems that they only cater to those who are placing large orders...... I came in asking for a coffee paid and told the young lady I'll be in 5 minutes....  I came back about 10 min later and she was still searching for the milk then proceeds to attempt to charge me more because I wanted more milk than coffee (eyes opened) ... After taking multiple sips for taste not only was it nasty but they continued fulfilling orders.... I'm in the customer service industry and I can tell when someone doesn't know what they are doing or how to problem solve... I suggest this establishment continue making pizza and steer away from hiring people who can't make coffee,1.0
"Delivery guy was rude and forgot part of the order . He called and said ""come down and get this"" then wasn't even at my building. Then came walking up the street and told me ""he forgot part of the order but it's no problem call the store and get a refund"". Oh cool. So the delivery guy was rude, my sandwich and soup weren't even hot and my girlfriends salad didn't have the chicken in it I paid extra for. I'll never order from here again!",1.0
Come on. Seriously. Best pizza place in Bed-Stuy. The dudes making the pizza are really into it. Def try the Grandmas Pizza. So effin rad. Seriously nice dudes too. Playing some great hiphop too.,5.0
"This is one of the best pizzas I have ever had. I am always looking for that perfect combo of crust sauce and cheese and this is it. I love it the best when I order in the restaurant because it's hot and crispy there. But ordering delivery is good, too. I have spoken to one of the owners and told him how much I enjoy the pizza and he was such a humble and nice guy. I am happy to have them in Bed-Stuy.",5.0
"Who's giving four and a half stars here??? Are you outta your mind? This is satisfactory...will shut your stomach up in an emergency. Bed-Stuy is in a bad way with pizza...either shitty Rocco's or super pretentious Saraghina...whatever happened to a nice dependable pie? Why Daddy Greens putting sugar in tomato sauce? That's perverted, keep it savory with some garlic and salt. Cheese is well undercooked too...I was hungry and it filled me, so thanks...and it came quicker than seamless said it would. But won't order again until its absolutely necessary",2.0
"This place is the bomb! Wonderful workers and Rodney really seems like give back to the community and provides a positive message to young kids in the neighborhood.  Walking outside, the smells are great and the food is even better. I'm not usually around the neighborhood, but I will definitely be back to this place when I am.  Thanks!",5.0
De-freakin-licious!!! My family and I LOVE the Pizza! and the staff is the best!!!!!The sauce! The Toppings! The love!!! And it's a few blocks away from my Casa! Bed Stuy has a Gem and it better stay :),5.0
Fantastic pizza place. Very modern and good for the neighborhood.The pizza is always cooked impeccably and is great for a rough night. Love all the options here. The only thing I wish for this place is that they'd be open on Sunday. Great day for business.,5.0
"The pizza was excellent! The service was perfect. They really seem like they appreciate their customers and that means a lot to me.  Try the grandma pizza. It was delicious. Also, the Sicilian slice was great because it's not too heavy but fills you up. Also, try the tea w/ lemonade and basil - perfectly sweetened and flavored. I'm going back for sure!",5.0
Great place ... I should say best pizza in Brooklyn . Excellent customer service . You can get any better as you r already the best !,5.0
