I love this pizza spot. The pizza is just delicious. I stumbled across this place because my nail salon is literally next door. I always get a pepperoni slice to go. The crust is my favorite part. The slices are always fresh tasting. Definitely a great place for pizza. I'll be trying there pasta soon So I tried their vodka Sicilian slice & it was finger licking good. I got a side of Mac & cheese just to be greedy The kale salad is just awesome and sooo fresh. Love the grandma slice too.Shoutout to my favorite guy Allen. He is awesome.,5.0
"Really good pizza. I had a plain slice and it was great. Thin crust, sauce packed with flavor and lots of cheese. Not doughy and oily like lots of other NY pizza spots. I also had the mocha cafe donut which was the size of my head lol. It was fresh and fluffy, worth the $3.",5.0
This place is great! I came here just because it looked very nice and I was blown away by the service and the food! Their roasted beet salad is amazing and their selection of different types of pizza and coffee really make this place stand out. I come by every time I'm in the neighborhood!,5.0
"I really enjoy their pizza, correction my whole family really enjoys their pizza! It was a staple for us for a while lol. We all really enjoy the added sesame seeds on the crust, a nice touch!The service is always awesome, everyone chats you up while you are waiting, answers any questions you may have about anything on the menu even on the phone super polite. I never feel like I'm a rushed making an order over the phone (which they certainly prefer to an online order). The only downfall about not being rushed over the food is sometimes the lines are so backed up you may have to call a few times to order. We've recently started branching out and trying other things on the menu. Penne ala vodka was good the kale Caesar salad with anchovies was not. Very very salty anchovies! They should definitely be chopped and tossed with the salad to distribute some of the salt.",5.0
"Eek... I heard great things about this place, but the pizza did not proverbially deliver. Although Daddy Greens is known for it's sesame crust pizza, we opted for the grandma pie - since that's usually our preference. Rocco's Pizza grandma pie on DeKalb has been our go-to pizza delivery spot in Bed-Stuy and their pies are *surprisingly* tasty. But we are always looking for something better - after all this is NYC and new spots are continually opening in Bed-Stuy. When the Daddy Greens grandma pie arrived, I knew it was going to be meh once I opened the box. Why? The grandma pie didn't have fresh basil. Instead, it was sprinkled with dry seasoning... But it got worse with the first bite. It was just blase, what else can I say? The worst part was the cheese/sauce ratio. There was WAY too much cheese and it tasted like bland shredded mozzarella just piled on the pie. The sauce had very little zest or zing.Now, this is not BAD pizza. But then again, you won't find me reviewing Domino's or Papa John's because they are not worth my time. But this was also not GOOD pizza...",2.0
"Excellent, excellent pizza. I can't say enough about it. We had several different kinds of slices and they were all delicious. Mmm....We also ordered mac-n-cheese...I took one bite (MAD GOOEY AND GOOD!) and had to pack it 'to go'. My eyes were definitely bigger than my stomach 'cause that shit is sitting in a brown bag in my fridge!  I'm gonna make a mac-n-cheese omelette for breakfast! The service was great. The dude treated us as if we were at his house for a family dinner. I loved it! Be back soon!",5.0
"I walk past this place once or twice a day, but never stopped in until last weekend. Pizza is surprisingly good. I've had some bad by the slice and I guess I wasn't expecting much by the Utica stop, but I was so wrong. They had a lot to choose from and portions were GENEROUS. Service was super quick and everyone who worked there was pretty laid back.",4.0
"My favourite place for takeout pizza in bedstuy, my go-to is the white Nona (though I'd love more grandma slices, the basil kills my stomach).  Staff are friendly, so I prefer to go to the store rather than have delivery.  Delivery takes ~45-55 mins on average so be aware if you're hungry!",5.0
Just had a fantastic grilled chicken sandwich from Daddy greens pizza. Prompt courteous service. Can't wait till I'm in the area again.,5.0
My pizza had more dry herb on it than a dorm room floor. It looked like Michael J. Fox tried to shake-weight with a box of dry basil atop my pie.,2.0
"Who am I to complain or take it personally when they've never gotten it right. (seriously, after a dozen orders, not once have they sent a correct order)It was simple or so I thought. I am deathly allergic to walnuts and yet even when I ordered weekly on three out of five occasions they put them in. Then I asked for extra dressing and said I'd be willing to PAy for it and again, more often than not, they never did. It got so I felt horrible for the delivery people and tried to pay them twice for running back.Needless to say, a dozen is beyond anyone's limit of ""second chances"". I wanted this neighborhood place to work, we needed it, but if they can't get this right....why bother at all.",1.0
"Um...I ate here everyday for like 2 weeks when I visited NYC. The people here are so friendly and laid back. The pizza is one of the best in NYC all there food is really fresh. The salads are all so good (kale Caesar/beat salad) my personally favorites. They have coffee to which is suprise fly reallllly good; which is a plus because the atmosphere in here is very ""cafe"" style. Brick walls and warm lighting. This place is A true gem and I amA customer for life! (Atmosphere check! Amazing Food check! Freshness check! Customer service check! ) A+",5.0
"Call before you come and save yourself a trip. The hours listed on the website says this place opens at 11:30 it's now 2:30 and guess what? Its CLOSED. You can't make this stuff up, SMFH...",1.0
"The place is clean and the staff are friendly. I got there when the store opened and there was already a line of hungry people waiting to order but it moved quickly. I ordered 3 slices: the grandma slice, pepperoni and margarita as well as the eggplant sandwich. All were good but the grandma slice was exceptional. I love how the pizza has a sesame seed crust. It makes those non-pizza crust eaters like myself actually enjoy that part of the pizza!",5.0
"This place is a special pizza place, not just your run of the mill plain slice place. They have sesame seed crust which is a really good way to make everyone's least favorite part of the pizza more interesting. All the slices me and a friend tried were really good and they have a really nice atmosphere and very attentive/friendly staff. Will be going back here for sure!",4.0
"A wonderful addition to the neighborhood! There is finally a pizza place that accepts credit cards, delivers and provides a chill/hip vibe if you decide to dine in. Very reasonable prices as well.I ordered the Margherita and it was delicious. The sesame crust is a tasty treat too!Will definitely be back!",4.0
"I'm only bummed that I didn't discover Daddy's Greens sooner! The most insane/delicious Margherita pizza I've ever tasted. Sesame seed crust takes it over the edge.We also had garlic knots and the Super Mario ( a white pie with green veggies) Both very tasty. I love the overall vibe- great pizza and not a lot of frills. Cans of soda, coffee if you want it, super nice staff... I'm sold.",5.0
The food is great.   Staff is extra friendly.   Prices are decent.   Seating area are good.,4.0
I definitely liked the atmosphere and space. The pizza was great although both slices I chose buffalo chicken and pepperoni had sesame seed crust. That's crust isn't my style or my preference but it apparently has a pretty big following because they are known for it. Never the less I would definitely go back and the staff were friendly and print. Slices came right out quick.,4.0
It's like heaven. In my mouth. Also Rodney gave my nephew a job.,5.0
"Who am I to complain or take it personally when they've never gotten it right. (seriously, after a dozen orders, not once have they sent a correct order)It was simple or so I thought. I am deathly allergic to walnuts and yet even when I ordered weekly on three out of five occasions they put them in. Then I asked for extra dressing and said I'd be willing to PAy for it and again, more often than not, they never did. It got so I felt horrible for the delivery people and tried to pay them twice for running back.Needless to say, a dozen is beyond anyone's limit of ""second chances"". I wanted this neighborhood place to work, we needed it, but if they can't get this right....why bother at all.",1.0
"Um...I ate here everyday for like 2 weeks when I visited NYC. The people here are so friendly and laid back. The pizza is one of the best in NYC all there food is really fresh. The salads are all so good (kale Caesar/beat salad) my personally favorites. They have coffee to which is suprise fly reallllly good; which is a plus because the atmosphere in here is very ""cafe"" style. Brick walls and warm lighting. This place is A true gem and I amA customer for life! (Atmosphere check! Amazing Food check! Freshness check! Customer service check! ) A+",5.0
"Call before you come and save yourself a trip. The hours listed on the website says this place opens at 11:30 it's now 2:30 and guess what? Its CLOSED. You can't make this stuff up, SMFH...",1.0
"The place is clean and the staff are friendly. I got there when the store opened and there was already a line of hungry people waiting to order but it moved quickly. I ordered 3 slices: the grandma slice, pepperoni and margarita as well as the eggplant sandwich. All were good but the grandma slice was exceptional. I love how the pizza has a sesame seed crust. It makes those non-pizza crust eaters like myself actually enjoy that part of the pizza!",5.0
"This place is a special pizza place, not just your run of the mill plain slice place. They have sesame seed crust which is a really good way to make everyone's least favorite part of the pizza more interesting. All the slices me and a friend tried were really good and they have a really nice atmosphere and very attentive/friendly staff. Will be going back here for sure!",4.0
"A wonderful addition to the neighborhood! There is finally a pizza place that accepts credit cards, delivers and provides a chill/hip vibe if you decide to dine in. Very reasonable prices as well.I ordered the Margherita and it was delicious. The sesame crust is a tasty treat too!Will definitely be back!",4.0
"I'm only bummed that I didn't discover Daddy's Greens sooner! The most insane/delicious Margherita pizza I've ever tasted. Sesame seed crust takes it over the edge.We also had garlic knots and the Super Mario ( a white pie with green veggies) Both very tasty. I love the overall vibe- great pizza and not a lot of frills. Cans of soda, coffee if you want it, super nice staff... I'm sold.",5.0
The food is great.   Staff is extra friendly.   Prices are decent.   Seating area are good.,4.0
I definitely liked the atmosphere and space. The pizza was great although both slices I chose buffalo chicken and pepperoni had sesame seed crust. That's crust isn't my style or my preference but it apparently has a pretty big following because they are known for it. Never the less I would definitely go back and the staff were friendly and print. Slices came right out quick.,4.0
It's like heaven. In my mouth. Also Rodney gave my nephew a job.,5.0
"This is my second visit here and once again I left full and happy.  First visit I had the meat slice and they definitely  weren't skimpy with the meat. Today I went for the white slice and it didn't dissapoint. The slice had chunks of ricotta cheese with lots of flavor. The sesame seeds on the crust give it an extra pop of flavor, I usually don't eat the crust but here it's a must. Ginger lemonade is good but I wouldn't recommend it if you're looking for a traditional lemonade taste. I have to mention that the bathroom is nice and clean (as somebody whose work takes them all around the city and never indoors this is important). Best part of this place is the people who run it, what a great friendly staff.",5.0
I love their grandma slice and their salads are great. Now if they will just take my advice and do a slice and salad deal. I'd pay $2-$3 for a salad as a topping on a slice.,4.0
Pizza is sooooooo good!!!! Fast delivery service!! We love the basil on the classic cheese pizza. We get extra cheese and it's delicious!!!!,5.0
"Had a really excellent experience here last night.The two gentleman working were very friendly.  You could tell that they cared about their pizza and about their customers.  They were very courteous and accommodating including discussing the various pizza options and even giving us an extra slice to sample.The cheese slice was definitely a good value at $2.50 - cooked right with excellent flavors--not dollar slice cheese.The margherita was even better--there was a sesame type crust (reminds me a little bit of Abbot's Pizza in Venice Beach or even the Hungry Howie's of my youth, I hope they keep experimenting with crusts) and some great ingredients again.I'm really glad to have a place like this in the neighborhood and echo Ken W.'s sentiment that Daddy Greens deserves to succeed.  Definitely worth your time to check out.",5.0
"Wow, sad now (again) that my girlfriend moved out of Brooklyn.  This place has DAMN good pizza.  Like people say, try the Super Mario (mushrooms and garlic and all sorts of good stuff) if you haven't, but also get the spinach.Again, like people say, the big drawback is that their pizza is hot as hell, and all the toppings tend to slide off their wedge slices.  Their square pizzas are a little more stable, so if you want to play it safe, go with one of those.  A total gem!EDIT: Also, they have sesame seeds on the crusts, which I really enjoyed!EDIT #2: So some people are complaining that compared to the rest of NYC, this isn't THE best pizza.  Well, sure, that's definitely true.  But I stand by my five stars--this is definitely the best pizza in BEDSTUY, and probably most of the surrounding area in Brooklyn as well.",4.0
"Ordered a sausage, tomato, pesto pie here last weekend. The ingredients were great- loved the fact that they scatter basil over every pie! The crust was really thin and flavorful, the only problem was that our pizza was too wet so it was very difficult to pick up a slice. All the toppings went sliding off! The sausage was delicious and juicy.Service is pretty disorganized, though. The staff seem distracted and occasionally lose pies (according to one argument amongst themselves!) and then needed to be reminded of what we had ordered, 25 minutes later. I think it's a good neighborhood joint but just a few tweaks would make it really great. Here's hoping they iron out their service issues and make a sturdier crust!",3.0
"Really wish I could give them a better review, bc I've eaten their pizza many times and it's really quite good!But my first attempt at delivery was such a disaster!  In short, it took two hours for the food to be delivered. And when it arrived of course the pizza was cold bc it had been sitting, which makes for not such great pizza. Sometimes things happen, so the long delivery time isn't even the worst part to me. It's that the restaurant seems completely unconcerned about it. I called twice and was not offered an apology at any point. During the first call the lady on the phone said the delivery was taking a while bc their guy was on a bike and they wanted to limit his time in the cold. Ok, but that's really odd bc 30 min after that call he arrived in a car. Tip to the restaurant - offer you customer a little something when you mess up. It shows you care. At a minimum refund the $3 delivery fee!! How ridiculous is that?!",3.0
"Seriously. Far and away, the best pizza in Bed-Stuy. I'm sitting here right now, eating a buffalo chicken slice, and it's blowing my mind. So damn good.",5.0
"Ordered this pizza for my class of 3rd grade students. I ordered 6 cheese pies for them and 2 ""adult"" pies - Grandma Nonna & Super Mario - for the grown ups in the room. The students LOVED their cheese pies. The pies were advertised as 16"" but they were huge and filling. They were a little picky about the basil on top (""I don't want broccoli strings!"") but it was actually a pretty great teachable moment. Who knows, maybe they'll start a herb garden? The Grandma Nonna tasted just like the pizza my grandma would make: thin crust, and lots of ricotta to top it off.. The Super Mario is a white pie with garlic, spinach, cheese and mushrooms. Definitely the teacher's room favorite...overall, everything was fresh, timely, and delicious.Quick tip about ordering - I placed it through eat24, but depending on the size of the order you might be able to save some $$ if you just call them!I can't wait to visit the actual store and try everything else!",5.0
I ordered the grandma pizza and it was delicious! My first time here and I'll order again!,4.0
"This is my second visit here and once again I left full and happy.  First visit I had the meat slice and they definitely  weren't skimpy with the meat. Today I went for the white slice and it didn't dissapoint. The slice had chunks of ricotta cheese with lots of flavor. The sesame seeds on the crust give it an extra pop of flavor, I usually don't eat the crust but here it's a must. Ginger lemonade is good but I wouldn't recommend it if you're looking for a traditional lemonade taste. I have to mention that the bathroom is nice and clean (as somebody whose work takes them all around the city and never indoors this is important). Best part of this place is the people who run it, what a great friendly staff.",5.0
I love their grandma slice and their salads are great. Now if they will just take my advice and do a slice and salad deal. I'd pay $2-$3 for a salad as a topping on a slice.,4.0
Pizza is sooooooo good!!!! Fast delivery service!! We love the basil on the classic cheese pizza. We get extra cheese and it's delicious!!!!,5.0
"Had a really excellent experience here last night.The two gentleman working were very friendly.  You could tell that they cared about their pizza and about their customers.  They were very courteous and accommodating including discussing the various pizza options and even giving us an extra slice to sample.The cheese slice was definitely a good value at $2.50 - cooked right with excellent flavors--not dollar slice cheese.The margherita was even better--there was a sesame type crust (reminds me a little bit of Abbot's Pizza in Venice Beach or even the Hungry Howie's of my youth, I hope they keep experimenting with crusts) and some great ingredients again.I'm really glad to have a place like this in the neighborhood and echo Ken W.'s sentiment that Daddy Greens deserves to succeed.  Definitely worth your time to check out.",5.0
"Wow, sad now (again) that my girlfriend moved out of Brooklyn.  This place has DAMN good pizza.  Like people say, try the Super Mario (mushrooms and garlic and all sorts of good stuff) if you haven't, but also get the spinach.Again, like people say, the big drawback is that their pizza is hot as hell, and all the toppings tend to slide off their wedge slices.  Their square pizzas are a little more stable, so if you want to play it safe, go with one of those.  A total gem!EDIT: Also, they have sesame seeds on the crusts, which I really enjoyed!EDIT #2: So some people are complaining that compared to the rest of NYC, this isn't THE best pizza.  Well, sure, that's definitely true.  But I stand by my five stars--this is definitely the best pizza in BEDSTUY, and probably most of the surrounding area in Brooklyn as well.",4.0
"Ordered a sausage, tomato, pesto pie here last weekend. The ingredients were great- loved the fact that they scatter basil over every pie! The crust was really thin and flavorful, the only problem was that our pizza was too wet so it was very difficult to pick up a slice. All the toppings went sliding off! The sausage was delicious and juicy.Service is pretty disorganized, though. The staff seem distracted and occasionally lose pies (according to one argument amongst themselves!) and then needed to be reminded of what we had ordered, 25 minutes later. I think it's a good neighborhood joint but just a few tweaks would make it really great. Here's hoping they iron out their service issues and make a sturdier crust!",3.0
"Really wish I could give them a better review, bc I've eaten their pizza many times and it's really quite good!But my first attempt at delivery was such a disaster!  In short, it took two hours for the food to be delivered. And when it arrived of course the pizza was cold bc it had been sitting, which makes for not such great pizza. Sometimes things happen, so the long delivery time isn't even the worst part to me. It's that the restaurant seems completely unconcerned about it. I called twice and was not offered an apology at any point. During the first call the lady on the phone said the delivery was taking a while bc their guy was on a bike and they wanted to limit his time in the cold. Ok, but that's really odd bc 30 min after that call he arrived in a car. Tip to the restaurant - offer you customer a little something when you mess up. It shows you care. At a minimum refund the $3 delivery fee!! How ridiculous is that?!",3.0
"Seriously. Far and away, the best pizza in Bed-Stuy. I'm sitting here right now, eating a buffalo chicken slice, and it's blowing my mind. So damn good.",5.0
"Ordered this pizza for my class of 3rd grade students. I ordered 6 cheese pies for them and 2 ""adult"" pies - Grandma Nonna & Super Mario - for the grown ups in the room. The students LOVED their cheese pies. The pies were advertised as 16"" but they were huge and filling. They were a little picky about the basil on top (""I don't want broccoli strings!"") but it was actually a pretty great teachable moment. Who knows, maybe they'll start a herb garden? The Grandma Nonna tasted just like the pizza my grandma would make: thin crust, and lots of ricotta to top it off.. The Super Mario is a white pie with garlic, spinach, cheese and mushrooms. Definitely the teacher's room favorite...overall, everything was fresh, timely, and delicious.Quick tip about ordering - I placed it through eat24, but depending on the size of the order you might be able to save some $$ if you just call them!I can't wait to visit the actual store and try everything else!",5.0
I ordered the grandma pizza and it was delicious! My first time here and I'll order again!,4.0
"Thank you Allen & Momma for the awesome food & awesome service!!!  All their pizzas are great but, highly recommend the Penne a la Vodka pizza and their homemade iced tea!!!Ray Ray",5.0
"This place is one of the best pizzerias I have been to in NYC. But their service is a true lack luster. Let me start off with this.1. I had pizza delivered saturday, took about an hour. NP. My new roommate called, and ask for a delivery, and the VERY RUDE Delivery guy said Sorry we don't deliver there. Wow.2. The Delivery guy, extremely rude, hostile and gives dirty looks. This is something people shouldnt have to deal with this, he was being yelled at. He also expects big tips when hes not willing to walk up steps to meet you at your front door. Regardless if i'm on the 4th floor or not, you just lost a few dollar son your tip. He gave me an attitude one day about not wanting to walk up. I called him lazy to his face as I was a delivery guy at one point in my life and I made sure to go to everyones front door, regardless if they were in a CO OP or apartment. This guy needs to be fired. Sorry, this is a sure lackluster in your business.3. I went there on sunday to eat with my parents, to only find they had exquisite pizza. All I wanted was a regular slice. I never been to a pizzeria that didn't have any single regular slices, or anything even remote to it. Very sad and mad me annoyed.4. My new roomies moved in and said they waited 2 hours for a pizza, complete imbeciles if you delivery is 2 hours late or pickup for that matter. Again, I worked at new park pizza, I handled over 25 deliverys a day, I was quick and adamant about getting pizza on time and not making people wait. This is something that needs to be addressed.5. The owner is actually a really nice guy. I hate to write a bad review about his place of business but everything i've said is the truth. He makes great pizza but he really needs better help or hire more people to ensure your business is flowing, and not making people wait.",2.0
"Quite possibly one of the best slices I've ever had. I've lived and traveled to NYC since I was a kid and I believe we have the best pizza! I wanted a spinach and bacon slice and there wasn't any so he offered to make me one. I waited around ten minutes and it was definitely worth it. The spinach fresh, the bacon crispy and salty porky goodness, not an overwhelming amount either. The cheese was ooey gooey and delicious. The sauce was light and complimented all the other ingredients. My only qualm was the crusty, a bit too crunchy for me, but only at the end. I loved that my cheese didn't fall off the pizza even though it was fresh out of the oven.I took my slice to go but since I had to wait for it to be made I noticed the cashier was very attentive and friendly. She offered me ice cold water while I waited. The pizza man was also very friendly. All in all a pleasant experience for a rushed lunch. I'll def be back next time I'm in Bed-Stuy. Extra star for the name!",5.0
