"I really really like this place.  The first time I visited Iris Cafe, I noticed a sense of country-type calm (and I'm from the country, so I knows country-type calm when I sees it).  It reminded me of my favorite little restaurant upstate (including the please-clear-your-own-plates policy.)  The coffee is amazing, and the toast...ooohhhh the toast...with softboiled eggs is lovely (albeit expensive, but I figure I'm really paying for the atmosphere, not the eggs).  I realized when I got home and looked the place up on Yelp that the lovely tranquil feeling I had at Iris was probably because of the refreshing no laptops policy.  It was such a nice change to sip coffee surrounded by people reading the paper, jotting down notes with PENCILS, and having actual, *gasp*, conversation.  Remember conversation you guys?  Like, with the human sitting across from you?  I'll for sure be back to Iris.  It was a delight.",4.0
"ok, this place gets the two stars it does because my server was kind and the decor is lovely.  now, for my problems: if you have a ""no laptop"" policy, do everyone a favor and post that on your website for all to see. don't wait until i've ordered an expensive coffee beverage and set up shop to condescendingly tell me so.  the woman who informed me was not my server, and it wasn't totally clear to me what role she was playing in the cafe at all.  additionally, it was 2pm, and there were many free tables, so this was just on principle.  on a slightly picky note, the latte was a bit milky for my taste (this happens from time to time, so not a big deal), the price point was a little unreasonable (4.25 for a latte means i'm paying for your restoration hardware decor) and the place is cash only.  i can understand why people like this place--their food looks great, and the street is beautiful and quiet--but i felt unwelcome.  this kind of shop belongs in westchester.",2.0
"I love this tiny place! I stayed nearby at a hotel and was looking for a nice place to get breakfast and some good coffee. I searched yelp for something near me and Iris Cafe popped up. I was not let down. After a little wandering around I found the cafe. They have great coffee - Stumptown, I had not had it prior to this visit, but now I look for it when I am out. For breakfast, I ordered a sandwich that had hard boiled eggs, Serrano ham and some greens, it was exactly what I wanted. I sat here for a couple of hours reading until the crowds started coming in, then I left to make room for others. It is a nice place to try out and if I am in the area again I will definitely make the effort to go back.",4.0
"Walking to Iris Cafe is like entering another world, full of adorable little streets and lovely Brooklyn Heights townhouses. And walk you will, because Iris Café is practically under the BQE. Perhaps it's its distance from the fray of Court Street that keeps Iris Café so welcoming and neighborly--you'll always find a seat here, likely due to their no-laptop rule (which, as a reader and crossword puzzler and not a freelancer, I love).The food is similarly exquisite: I've ordered a different pastry with every visit, and I've yet to be disappointed. And I haven't even gotten to the sandwich menu yet, of which I have heard raving reviews!My only gripe is that the staff of Iris Café likes to keep the front door propped open, even in our current deadly dead of winter. I get that the folks by the kitchen must be hot, but GAH, we are all freezing over here. Oh well. Gives me something to talk about with the strikingly good-lookin' people who frequent this place.",5.0
"The short:The food is awesome. Everything is farm fresh and organic. Portions are intriguing, creative, piquant and healthy sized! Prices are a bargin for the quality of the food. Waitstaff and cooks are incredibly friendly and knowledgable and the restaurant atmosphere is cozy, hip and welcoming. The long:I was in town from Boston and my friend had strongly recommended that I try Iris, I made the trip from Manhattan with a large party and was blown away. The restaurant has an open concept, the dining room and the kitchen are connected and separated only by the bar, which adds for a very charming and amicable feel. Upon entering you are greeted by extremely cordial employees, from the waitstaff to even the cooks (if you are lucky enough to sneak some eye contact when they're not prepping the food). The menu is very creative with daily original specials, the prices are extremely fair for the quality of the food you're receiving as most is from local farmers.My party started with oysters from long island, followed by the smoked trout pate, roasted vegetables and young greens. My partner and I followed with the fish in broth and the pasta of the day, which was a broccoli rabe pesto. We finished with the cheese plate, with local farm cheeses, the chocolate tarte, which was beautifully complemented with sea salt to add an invigorating contrast, and the posset of the day that was made with lavender and some how magically made without eggs and served with crunchy cookies which we were certain to use as spoons. I strongly recommend. Try to go with a large party so you can try a little bit of all the menu, there is so much ingenuity and such little stomachs! I really enjoyed my meals and my experience and it was not too hard on the wallet.",5.0
"This place is a staple for Saturday brunch in an otherwise dull neighborhood for restaurants. Brooklyn Heights is an awful neighborhood for food unless you like mediocre places, but Iris is great on all fronts. It's cute, well-priced, and the food is fantastic. Favorites include the huevos rancheros, which are so tasty and fresh; and the avocado toast with poached eggs. I have never had a pastry or biscuit here I didn't love either. The service is attentive also, no complaints. This place does get pretty busy so I am always impressed at how busy the staff is yet how quick they are. Usually don't have too much of a wait perhaps with a few exceptions. The one thing I don't care for though is the set up- primarily when the temperature is not ideal outside. The lack of one of those canvas restaurant doors in front means every time you open the door either cold air rushes in, in winter, or hot air rushes in, in summer. The heat or AC just don't have a chance against it's power. It also doesn't help that just about everyone coming in insists on standing in the doorway holding the door open with their bodies, or the staff does this as well. It's a minor detail, but I have had notably miserable brunches there because of it. My suggestion to Iris is - put up the door addition at least when it is cold out please!",4.0
"I lived above this cafe for a couple years and watched it make its transition from full-service cafe to restaurant. It's definitely found it's footing.Located on the more ""happening"" street of adorable Willow Town, Iris Cafe is the perfect spot to meet a friend for conversation over breakfast or lunch. I was surprised by how reasonable the prices are; considering the high quality of food and location in bougie Brooklyn Heights.If you don't have time to sit down and stay then make sure to visit their to-go/grocery location down the street.",4.0
"A cute little cafe on the edge of Brooklyn Heights. It has decent food, good beverages, and a really good vibe. It almost feels like the quintessential Brooklyn cafe that you might see in a movie. A nice little place to go for brunch or coffee.",4.0
Excellent salad nicoise. Great atmosphere. Had a really good gluten free sandwich from the takeaway store as well. If I lived in bk heights id be here a lot.,4.0
"A friend brought me here and introduced me to their lox and eggs sandwich. Simply put, it is to die for. Ingredients all seemed very fresh and worked well together. The eggs added both flavor and texture to the sandwich, and complemented the lox and the just-crunchy enough bread very well.The dining area is small, but it is well-lit and actually feels spacious. It's rather relaxing and makes for a great space for conversations.I'm only traveling through NYC, but I will definitely make my way back for breakfast before I leave the city!",5.0
"I really really like this place.  The first time I visited Iris Cafe, I noticed a sense of country-type calm (and I'm from the country, so I knows country-type calm when I sees it).  It reminded me of my favorite little restaurant upstate (including the please-clear-your-own-plates policy.)  The coffee is amazing, and the toast...ooohhhh the toast...with softboiled eggs is lovely (albeit expensive, but I figure I'm really paying for the atmosphere, not the eggs).  I realized when I got home and looked the place up on Yelp that the lovely tranquil feeling I had at Iris was probably because of the refreshing no laptops policy.  It was such a nice change to sip coffee surrounded by people reading the paper, jotting down notes with PENCILS, and having actual, *gasp*, conversation.  Remember conversation you guys?  Like, with the human sitting across from you?  I'll for sure be back to Iris.  It was a delight.",4.0
"ok, this place gets the two stars it does because my server was kind and the decor is lovely.  now, for my problems: if you have a ""no laptop"" policy, do everyone a favor and post that on your website for all to see. don't wait until i've ordered an expensive coffee beverage and set up shop to condescendingly tell me so.  the woman who informed me was not my server, and it wasn't totally clear to me what role she was playing in the cafe at all.  additionally, it was 2pm, and there were many free tables, so this was just on principle.  on a slightly picky note, the latte was a bit milky for my taste (this happens from time to time, so not a big deal), the price point was a little unreasonable (4.25 for a latte means i'm paying for your restoration hardware decor) and the place is cash only.  i can understand why people like this place--their food looks great, and the street is beautiful and quiet--but i felt unwelcome.  this kind of shop belongs in westchester.",2.0
"I love this tiny place! I stayed nearby at a hotel and was looking for a nice place to get breakfast and some good coffee. I searched yelp for something near me and Iris Cafe popped up. I was not let down. After a little wandering around I found the cafe. They have great coffee - Stumptown, I had not had it prior to this visit, but now I look for it when I am out. For breakfast, I ordered a sandwich that had hard boiled eggs, Serrano ham and some greens, it was exactly what I wanted. I sat here for a couple of hours reading until the crowds started coming in, then I left to make room for others. It is a nice place to try out and if I am in the area again I will definitely make the effort to go back.",4.0
"Walking to Iris Cafe is like entering another world, full of adorable little streets and lovely Brooklyn Heights townhouses. And walk you will, because Iris Café is practically under the BQE. Perhaps it's its distance from the fray of Court Street that keeps Iris Café so welcoming and neighborly--you'll always find a seat here, likely due to their no-laptop rule (which, as a reader and crossword puzzler and not a freelancer, I love).The food is similarly exquisite: I've ordered a different pastry with every visit, and I've yet to be disappointed. And I haven't even gotten to the sandwich menu yet, of which I have heard raving reviews!My only gripe is that the staff of Iris Café likes to keep the front door propped open, even in our current deadly dead of winter. I get that the folks by the kitchen must be hot, but GAH, we are all freezing over here. Oh well. Gives me something to talk about with the strikingly good-lookin' people who frequent this place.",5.0
"The short:The food is awesome. Everything is farm fresh and organic. Portions are intriguing, creative, piquant and healthy sized! Prices are a bargin for the quality of the food. Waitstaff and cooks are incredibly friendly and knowledgable and the restaurant atmosphere is cozy, hip and welcoming. The long:I was in town from Boston and my friend had strongly recommended that I try Iris, I made the trip from Manhattan with a large party and was blown away. The restaurant has an open concept, the dining room and the kitchen are connected and separated only by the bar, which adds for a very charming and amicable feel. Upon entering you are greeted by extremely cordial employees, from the waitstaff to even the cooks (if you are lucky enough to sneak some eye contact when they're not prepping the food). The menu is very creative with daily original specials, the prices are extremely fair for the quality of the food you're receiving as most is from local farmers.My party started with oysters from long island, followed by the smoked trout pate, roasted vegetables and young greens. My partner and I followed with the fish in broth and the pasta of the day, which was a broccoli rabe pesto. We finished with the cheese plate, with local farm cheeses, the chocolate tarte, which was beautifully complemented with sea salt to add an invigorating contrast, and the posset of the day that was made with lavender and some how magically made without eggs and served with crunchy cookies which we were certain to use as spoons. I strongly recommend. Try to go with a large party so you can try a little bit of all the menu, there is so much ingenuity and such little stomachs! I really enjoyed my meals and my experience and it was not too hard on the wallet.",5.0
"This place is a staple for Saturday brunch in an otherwise dull neighborhood for restaurants. Brooklyn Heights is an awful neighborhood for food unless you like mediocre places, but Iris is great on all fronts. It's cute, well-priced, and the food is fantastic. Favorites include the huevos rancheros, which are so tasty and fresh; and the avocado toast with poached eggs. I have never had a pastry or biscuit here I didn't love either. The service is attentive also, no complaints. This place does get pretty busy so I am always impressed at how busy the staff is yet how quick they are. Usually don't have too much of a wait perhaps with a few exceptions. The one thing I don't care for though is the set up- primarily when the temperature is not ideal outside. The lack of one of those canvas restaurant doors in front means every time you open the door either cold air rushes in, in winter, or hot air rushes in, in summer. The heat or AC just don't have a chance against it's power. It also doesn't help that just about everyone coming in insists on standing in the doorway holding the door open with their bodies, or the staff does this as well. It's a minor detail, but I have had notably miserable brunches there because of it. My suggestion to Iris is - put up the door addition at least when it is cold out please!",4.0
"Very cute neighborhood spot.  Feels very Berkeley (Bay Area shout-out).  Stumptown coffee here.  Nice windows to let in light.  Had the poached eggs with ""soldiers,"" which are little strips of toast for dipping.  Yeah this toast?  Delicious!  It was like some wheat/rye/multigrain bread.  Went perfectly and those soldiers went down one by one as they were dipped into the molten egg and then in my belly!  mmmmm.Main gripes -- cafes need more pastries.  Like Tazza.  Tazza has great pastries.  But poor coffee.  Iris Cafe has good coffee but pretty much no pastries.  The sandwiches look good, albeit a bit pricey I'd say.  But I will say this.  Best coffee in Brooklyn Heights.  Not hard since we're dealing with Connecticut Muffin, Sbux, and Tazza.  I can def see myself coming here more often.  Good place to go on a weekend and read.  And the communal tables?  Good touch -- perfect for interacting with fellow Brooklyn Heights peeps.",4.0
"This place is adorable. That goes without saying. When it first opened, it quickly became my New Favorite Place. Great coffee (how cute is the flower they swirl into the cappuccinos?) and tasty, rustic sandwiches. The decor has an organic-hipster-farmer vibe, and all of the employees are really sweet.Then it became overrun with laptops and people who read the rave New York Magazine reviews. So I stopped going. Because it was a circus. And life is too short.By the time I came back, they had outlawed computers but had also taken my favorite sandwich -- The Ploughman -- off the menu. At that point, all of the cafe's other shortcomings started to become more obvious. It takes forever to get your food half the time. They need a more efficient system. Also, they turned the original Plated Breakfast (which was a perfect combination of soft-boiled eggs and serrano ham) into one of the most disgusting things I've ever eaten. I ordered it without looking at the new description, so it was totally my fault. But still, they should at least call it The Plated Breakfast 2.0 or something.I recently heard that the Ploughman is back on the menu, so I'll go back soon and give the place a fresh review.",3.0
"This place is really sweet! The baked goods are awesome and everything I've tried on their menu has always been delicious. It's never more than a few minutes wait to get a table, even on Saturday and Sunday mornings for brunch. This is a neighborhood staple for me!",4.0
"MMMMM! Just right! Cozy, homey surroundings. Great coffee. A menu with enough variety to keep you interested but not so much that it loses focus. Well executed simple food -- avocado sandwich with quick pickles was perfect -- sweets were homemade and delicious -- coffee was out of this world. A+",4.0
"Don't even bother going anywhere else. Ever.  Since the mysterious disappearance of ""Crop to Cup"" - Iris Cafe is easily the best espresso bar around. The food has always been and will always be top notch and unbeatable. Young owner with an experienced vision of food and atmosphere. Definitely recommend brunch or a late lunch here. Get there soon before it becomes too popular for us regulars!",5.0
"(Audrey starts with review with a  * * * * rating ).Having an awesome cafe in your neighborhood makes you wake up with a smile, thinking, ""Ohh, shall I go to the cafe this morning?"".  Comparing this cafe to another place that serves stumptown in a nearby hood, I should really give this place five stars.  Not just because they have AWESOMELY NICE people who work there, but because they actually know how to properly handle the stumptown beans.  They can pull a shot correctly and most deliciously.  I also have to give them a pat on the back for serving some kick-ass menu items considering their limited kitchen. And I also admire them for not kicking me out because I'd like to feed my child outside food (aka, baby food).  But the icing on the cake is that they act as a small n'hood grocer- they sell local milk/eggs/yogurt.  Ok, I'm bumping them up to five stars.  (Audrey changes the rating to * * * * *). Bravo Iris, for being a true neighborhood cafe!",5.0
The quintessential neighborhood cafe in Brooklyn Heights.,4.0
This place is the only legitimate cafe in all of Brooklyn Heights. Beautiful interior and Stumptown coffee made to perfection. If only they accepted credit cards and allowed laptops during off peak hours.,4.0
"When I ran by here the other day and saw the Stumptown sign in the window it was as if the clouds parted above me and angels began trumpeting. Quality coffee, in my neighborhood? Steps from the dog run? Surely life cannot be this good.Yes, it can. And my husband said his breakfast sandwich was the best he's ever had. While he is given to hyperbole, I still take that as a rousing endorsement. Neighbors, please go and keep this place afloat, I implore you!",4.0
"Quaint, cosy...and casual!The sandwiches, salads and pastries are all prepared with the utmost love! Everyone is warm and friendly- definitely worth the trip to Brooklyn Heights!Must have: Any sandwich, salad or pastry! Pair with their perfect cortado's.",5.0
"Very cute neighborhood spot.  Feels very Berkeley (Bay Area shout-out).  Stumptown coffee here.  Nice windows to let in light.  Had the poached eggs with ""soldiers,"" which are little strips of toast for dipping.  Yeah this toast?  Delicious!  It was like some wheat/rye/multigrain bread.  Went perfectly and those soldiers went down one by one as they were dipped into the molten egg and then in my belly!  mmmmm.Main gripes -- cafes need more pastries.  Like Tazza.  Tazza has great pastries.  But poor coffee.  Iris Cafe has good coffee but pretty much no pastries.  The sandwiches look good, albeit a bit pricey I'd say.  But I will say this.  Best coffee in Brooklyn Heights.  Not hard since we're dealing with Connecticut Muffin, Sbux, and Tazza.  I can def see myself coming here more often.  Good place to go on a weekend and read.  And the communal tables?  Good touch -- perfect for interacting with fellow Brooklyn Heights peeps.",4.0
"This place is adorable. That goes without saying. When it first opened, it quickly became my New Favorite Place. Great coffee (how cute is the flower they swirl into the cappuccinos?) and tasty, rustic sandwiches. The decor has an organic-hipster-farmer vibe, and all of the employees are really sweet.Then it became overrun with laptops and people who read the rave New York Magazine reviews. So I stopped going. Because it was a circus. And life is too short.By the time I came back, they had outlawed computers but had also taken my favorite sandwich -- The Ploughman -- off the menu. At that point, all of the cafe's other shortcomings started to become more obvious. It takes forever to get your food half the time. They need a more efficient system. Also, they turned the original Plated Breakfast (which was a perfect combination of soft-boiled eggs and serrano ham) into one of the most disgusting things I've ever eaten. I ordered it without looking at the new description, so it was totally my fault. But still, they should at least call it The Plated Breakfast 2.0 or something.I recently heard that the Ploughman is back on the menu, so I'll go back soon and give the place a fresh review.",3.0
"This place is really sweet! The baked goods are awesome and everything I've tried on their menu has always been delicious. It's never more than a few minutes wait to get a table, even on Saturday and Sunday mornings for brunch. This is a neighborhood staple for me!",4.0
"MMMMM! Just right! Cozy, homey surroundings. Great coffee. A menu with enough variety to keep you interested but not so much that it loses focus. Well executed simple food -- avocado sandwich with quick pickles was perfect -- sweets were homemade and delicious -- coffee was out of this world. A+",4.0
"Don't even bother going anywhere else. Ever.  Since the mysterious disappearance of ""Crop to Cup"" - Iris Cafe is easily the best espresso bar around. The food has always been and will always be top notch and unbeatable. Young owner with an experienced vision of food and atmosphere. Definitely recommend brunch or a late lunch here. Get there soon before it becomes too popular for us regulars!",5.0
"(Audrey starts with review with a  * * * * rating ).Having an awesome cafe in your neighborhood makes you wake up with a smile, thinking, ""Ohh, shall I go to the cafe this morning?"".  Comparing this cafe to another place that serves stumptown in a nearby hood, I should really give this place five stars.  Not just because they have AWESOMELY NICE people who work there, but because they actually know how to properly handle the stumptown beans.  They can pull a shot correctly and most deliciously.  I also have to give them a pat on the back for serving some kick-ass menu items considering their limited kitchen. And I also admire them for not kicking me out because I'd like to feed my child outside food (aka, baby food).  But the icing on the cake is that they act as a small n'hood grocer- they sell local milk/eggs/yogurt.  Ok, I'm bumping them up to five stars.  (Audrey changes the rating to * * * * *). Bravo Iris, for being a true neighborhood cafe!",5.0
The quintessential neighborhood cafe in Brooklyn Heights.,4.0
This place is the only legitimate cafe in all of Brooklyn Heights. Beautiful interior and Stumptown coffee made to perfection. If only they accepted credit cards and allowed laptops during off peak hours.,4.0
"When I ran by here the other day and saw the Stumptown sign in the window it was as if the clouds parted above me and angels began trumpeting. Quality coffee, in my neighborhood? Steps from the dog run? Surely life cannot be this good.Yes, it can. And my husband said his breakfast sandwich was the best he's ever had. While he is given to hyperbole, I still take that as a rousing endorsement. Neighbors, please go and keep this place afloat, I implore you!",4.0
"Quaint, cosy...and casual!The sandwiches, salads and pastries are all prepared with the utmost love! Everyone is warm and friendly- definitely worth the trip to Brooklyn Heights!Must have: Any sandwich, salad or pastry! Pair with their perfect cortado's.",5.0
