"I was referred to Cafe Iris by a colleague who lives in the neighborhood. He described it as a relatively unknown gem that doesn't receive the attention it deserves because it is tucked out of the way on Colombia Pl, a little side street in Brooklyn Heights. He told me the food, breakfast, lunch, and dinner was all spectacular.He also told me that no matter the day of the week I should be able to just walk in. It sounded too good to be true.But he was right.We ordered a Hen of the Woods mushroom appetizer and a lobster burrata appetizer, each fresh, rich, and expertly prepared. The main wad what really made our evening: beef short rib cooked for 2 days sous vide and then finished browned and incredibly crisp. It was like eating meat butter. I could have eaten another order (and the portion was already generous!)This restaurant is a unicorn in the NY food scene, go check it out!",5.0
"Delicious brunch and coffee. Avocado toast! Smallish seasonal menu. Open for dinner now too with great cocktails. Very tasty old fashioned.Had an excellent cheese plate, good portion sizes served with giant pieces of warm bread. Chef also sent out a taste of the scallion and dill pancake with burrata. So good",5.0
"Delicious food, charming place, friendly staff.  The avocado toast was amazing!  Beautiful spot for breakfast!  I recommend it for a great start to your day!",5.0
"Great staff, excellent ambiance in the Cobble Hill area of Brooklyn. Oh and the pastrami sandwich was amazing. I definitely recommend this spot if you're in the area.",5.0
"This is a nice place for lunch- and there are surprisingly few weekday lunch options nearby.  I had the Farro Cobb salad and it was lovely.  However, their iced tea is dreadful.  It had that old sock smell that iced tea gets from sitting around for a day or two and it was weird and cloudy.  How hard is it for an allegedly upscale cafe to brew a batch of fresh iced tea every day?",3.0
"Really great coffee!!  Strong but not bitter/burnt!!  One of the best in town!!  Brunch is really nice, i had Chilaquiles...  Great combination of textures and flavors of the corn tortillas with salsa verde and fresh avocado and creme fraiche...  The bloody mary is also amazing, i can taste some pickling flavor from a secret ingredient!!  The Pastrami sandwich is also very nice!!",4.0
"I had avocado toast. It was ok. It needed parmesan IMO, it fell flat somehow. Had potential to be good but was just....eh. Also tiny portion for the price.Cute restaurant, boring food.",3.0
"Just had dinner at this charming, Brooklyn cafe and I just have to say wow - I was pleasantly surprised.  I loved that it wasn't crowded and had such a relaxed, cozy ambiance.  I ordered the brussel sprouts (delicious!), filet mignon (seasoned perfectly) and halibut with butternut squash (so light and fresh.)  I've been finding it's so hard to eat out in NYC because everyone drowns their dishes in salt and butter which makes me feel so sick after.  My friend and I walked out of Iris and both remarked at how good we felt after the meal - not sickeningly full and swollen from unnecessary salt/butter.  I would definitely come back - such a hidden gem!",5.0
"Very charming restuarant in cobble hill. We sat at the bar for brunch and ordered directly with one of the co-owners who seem to switch off daily - very nice guy. The latte and coffee were delicious (la columbe?) and so was the food. We shared the chilaquiles and the smoked salmon dish and they were both excellent. I especially recommend the chilaquiles with the egg on top. We also shared a nutella muffin which sounded better than it tasted. All in all a very nice experience with good food, charming service, and fun people watching. Nice place for a date.",4.0
"I had a day off and always wanted to get breakfast and spend the day walking around NYC. My expectations were high based on the impression I saw on a TV show, I think  it was on a segment of 'Best thing I ever ate' on the food channel. I was disappointed that the honey buns are only served on weekends. I visited on a Monday :( I ordered a coffee and the smoked salmon. The portions was very small to my liking. The smoked salmon tasted like the amce smoked salmon I bought from Costco which is pretty good. The english muffin tasted like Thomas's and the poached eggs tasted like you what.... The plate also came with some pickled onion thing which was blah and a dab of butter.The sum of each component tasted like what it supposed to which lead to my disappointment. I have to agree with other reviewers that I could have made this if wasn't so lazy. Starting my day off here coming from Jersey and dropping $21 (tax and tip) for breakfast and leaving hungry was a big let down. I can't blame them for such average food but I took stars away because of the price ($3 for a cup of coffee), small portion, and they did away with soft boiled eggs. I paid in cash but would flipped out if this place was cash-only.",2.0
"I was referred to Cafe Iris by a colleague who lives in the neighborhood. He described it as a relatively unknown gem that doesn't receive the attention it deserves because it is tucked out of the way on Colombia Pl, a little side street in Brooklyn Heights. He told me the food, breakfast, lunch, and dinner was all spectacular.He also told me that no matter the day of the week I should be able to just walk in. It sounded too good to be true.But he was right.We ordered a Hen of the Woods mushroom appetizer and a lobster burrata appetizer, each fresh, rich, and expertly prepared. The main wad what really made our evening: beef short rib cooked for 2 days sous vide and then finished browned and incredibly crisp. It was like eating meat butter. I could have eaten another order (and the portion was already generous!)This restaurant is a unicorn in the NY food scene, go check it out!",5.0
"Delicious brunch and coffee. Avocado toast! Smallish seasonal menu. Open for dinner now too with great cocktails. Very tasty old fashioned.Had an excellent cheese plate, good portion sizes served with giant pieces of warm bread. Chef also sent out a taste of the scallion and dill pancake with burrata. So good",5.0
"Delicious food, charming place, friendly staff.  The avocado toast was amazing!  Beautiful spot for breakfast!  I recommend it for a great start to your day!",5.0
"Great staff, excellent ambiance in the Cobble Hill area of Brooklyn. Oh and the pastrami sandwich was amazing. I definitely recommend this spot if you're in the area.",5.0
Met an old friend for brunch in Brooklyn here. It was adorable and even better the food was AH-MAZING. I had the cinnamon sugar french toast and was absolutely blown away. The fresh ricotta cheese still makes my mouth water!,4.0
"Iris has become a steady favorite of mine. Located on a quaint street it is small and rarely crowded for dinner. It blows my mind that people haven't figured out how incredible this place is for dinner, but it's fine with me because we always have a seat when we arrive. The menu is fresh and constantly changing and the atmosphere is cozy and warm. I have never tried their brunch because it's always so packed for brunch, but I'm sure it matches the high quality of their dinner. Oh! And the servers and very nice and knowledgeable!",5.0
Came here for brunch on Sunday with the lady. Getting in:- walked in and they had seats at the bar. There was a short wait for a table. We love sitting at the bar so we were good to go Food:- avocado toast was great. Went with two eggs which were perfectly poached- chilaquiles were fantastic. Very tasty with a poached egg. Will def get again- bacon was great Service:- service was great. I got splashed with some beer out of the tap and they comped my beer as an apology and gave us a discount for the inconvenience Other:- great location by Brooklyn bridge park- nice quite side street - great chill atmosphere- look forward to returning again,5.0
"Iris Cafe is a homey and cozy coffee shop in Brooklyn Heights - unless it's crowded they won't rush you out. They have daily fresh baked muffins and scones which they serve with cinnamon butter (which is the best!). The staff is friendly and helpful. My friends and I have had the smoked salmon on english muffin, chilaquiles and toast with bacon -- all were delicious! Also, a nice place to stop by for coffee or tea after a walk on the promenade.",4.0
"Quality neighborhood brunch spot. A little off the beaten path, but that's part of the charm. Super friendly staff, and they have great coffee options (they serve Stumptown!)Love the design of the place - tin ceilings, exposed brick on three sides, big windows. Everyone on the menu looked amazing.I ended up just having the turkey sandwich and a cappuccino. The cold cuts were fresh, and I loved the chipotle mayo. Bread was fresh too.My friend had the smoked salmon and really enjoyed that as well.Everything was very reasonably priced.",5.0
"After waiting for a little while for a table, we sat for brunch and had a lovely time! The service was excellent, and our meal was really delicious!Everything we ordered was fresh and flavorful, although I will say the portions are on the smaller side. I would definitely come here again for the lovely atmosphere and great service!",4.0
"LOVE Iris Cafe.So I ended up here after reading so many great yelp reviews. So with a friend we decided to brave the waiting times and go give it a try. Well people, it is so worth the wait!!They just get it here. We waited for a good 40 minutes which is long. HOWEVER; as soon as we sat down, the waitress acknowledged our wait. ""Thank you so much for your patience, I know you have been waiting for a while. what can I get started for you?""This is all I needed to forget all about the long wait. A sincere acknowledgement of it and then let's move on.I had the eggs benedict with the scallion pancakes. I mean drool:). My friend had the avocado toast with poached eggs. Yumminess allover. Great coffee!! The waitress was friendly, efficient and knowledgeable.I am such a fan and will be back here many many times!! Go try it!",5.0
"We have come here on 2 occasions and were slightly disappointed both times - while the food was definitely good, they ran out of peppers the first time we came, and forgot to add cheese to the chilaquiles on our latest visit.",2.0
"Cocktails were great. The bartender also works at a well known lounge in the city. Dinner - this isn't just a breakfast/brunch spot. You have a great dinner chef with unique, delicious tapas and entree style options. I was pleasantly surprised. I'll throw a party here one day.",5.0
"Brunch is wonderful. Never knew you could do so many great things with poached eggs and avocado. Vibe is great, low key and the coffee is FANTASTIC.",4.0
Met an old friend for brunch in Brooklyn here. It was adorable and even better the food was AH-MAZING. I had the cinnamon sugar french toast and was absolutely blown away. The fresh ricotta cheese still makes my mouth water!,4.0
"Iris has become a steady favorite of mine. Located on a quaint street it is small and rarely crowded for dinner. It blows my mind that people haven't figured out how incredible this place is for dinner, but it's fine with me because we always have a seat when we arrive. The menu is fresh and constantly changing and the atmosphere is cozy and warm. I have never tried their brunch because it's always so packed for brunch, but I'm sure it matches the high quality of their dinner. Oh! And the servers and very nice and knowledgeable!",5.0
Came here for brunch on Sunday with the lady. Getting in:- walked in and they had seats at the bar. There was a short wait for a table. We love sitting at the bar so we were good to go Food:- avocado toast was great. Went with two eggs which were perfectly poached- chilaquiles were fantastic. Very tasty with a poached egg. Will def get again- bacon was great Service:- service was great. I got splashed with some beer out of the tap and they comped my beer as an apology and gave us a discount for the inconvenience Other:- great location by Brooklyn bridge park- nice quite side street - great chill atmosphere- look forward to returning again,5.0
"Iris Cafe is a homey and cozy coffee shop in Brooklyn Heights - unless it's crowded they won't rush you out. They have daily fresh baked muffins and scones which they serve with cinnamon butter (which is the best!). The staff is friendly and helpful. My friends and I have had the smoked salmon on english muffin, chilaquiles and toast with bacon -- all were delicious! Also, a nice place to stop by for coffee or tea after a walk on the promenade.",4.0
"Quality neighborhood brunch spot. A little off the beaten path, but that's part of the charm. Super friendly staff, and they have great coffee options (they serve Stumptown!)Love the design of the place - tin ceilings, exposed brick on three sides, big windows. Everyone on the menu looked amazing.I ended up just having the turkey sandwich and a cappuccino. The cold cuts were fresh, and I loved the chipotle mayo. Bread was fresh too.My friend had the smoked salmon and really enjoyed that as well.Everything was very reasonably priced.",5.0
"After waiting for a little while for a table, we sat for brunch and had a lovely time! The service was excellent, and our meal was really delicious!Everything we ordered was fresh and flavorful, although I will say the portions are on the smaller side. I would definitely come here again for the lovely atmosphere and great service!",4.0
"LOVE Iris Cafe.So I ended up here after reading so many great yelp reviews. So with a friend we decided to brave the waiting times and go give it a try. Well people, it is so worth the wait!!They just get it here. We waited for a good 40 minutes which is long. HOWEVER; as soon as we sat down, the waitress acknowledged our wait. ""Thank you so much for your patience, I know you have been waiting for a while. what can I get started for you?""This is all I needed to forget all about the long wait. A sincere acknowledgement of it and then let's move on.I had the eggs benedict with the scallion pancakes. I mean drool:). My friend had the avocado toast with poached eggs. Yumminess allover. Great coffee!! The waitress was friendly, efficient and knowledgeable.I am such a fan and will be back here many many times!! Go try it!",5.0
"We have come here on 2 occasions and were slightly disappointed both times - while the food was definitely good, they ran out of peppers the first time we came, and forgot to add cheese to the chilaquiles on our latest visit.",2.0
"Cocktails were great. The bartender also works at a well known lounge in the city. Dinner - this isn't just a breakfast/brunch spot. You have a great dinner chef with unique, delicious tapas and entree style options. I was pleasantly surprised. I'll throw a party here one day.",5.0
"Brunch is wonderful. Never knew you could do so many great things with poached eggs and avocado. Vibe is great, low key and the coffee is FANTASTIC.",4.0
"Came here with a friend for brunch. She ordered the Huevos Rancheros and I ordered the Avocado Toast with Soft Egg and Ham and Cheese Biscuit.The Establishment- Very cozy, cute cafe- Pretty busy around brunchtime- The waitresses are dressed like normal people - no easy to tell way of knowing who works there and who doesn't. There's also no pedestal or anything when you enter. So we were awkwardly standing near the entrance for a while before a waitress came. It's small, I get it -- but we felt like fish out of a fishbowl for a good two minutes (slight exaggeration). - You also have to be willing to share tables. They have bench-like setups and there isn't a lot of privacy. Most people are sharing tables.The Food- Everything is in small servings. Do not come here expecting a sizable brunch. In fact, the largest dish is probably my friend's Huevos Rancheros. And even that is small by Essex standards.- My friend said the Huevos Rancheros were delicious but nothing to write home about. There was many different flavors that complemented very well.- The Avocado Toast was absolutely delicious. Creamy and perfect. I would've given Iris four stars based on this alone... until I discovered Iris Take Away has the same thing for cheaper.- Not a fan of the soft-boiled egg. Really had nothing to contribute to the toast at all. Sure it made the toast a little yolky, but it just covered up the deliciousness of the avocado.- I got the Ham and Cheese biscuit because I knew I'd still be hungry. It was surprisingly not a normal biscuit with ham and cheese. The two were baked into the biscuit. I could barely taste the cheese, and there wasn't much ham. It was awful... and they call it their 'specialty biscuit'.The Service- It took them quite a while to get our orders out. So go with good company. They will have to entertain you.- Service in general is pretty appalling. We had to wait to get a water refill (which you will need quite often because the bottle of water is pretty small for a party of 2)- When we got the check, they messed up my order. Probably because the person who got our check was different from our original waitress -- please fix this.- At least they fixed my check by giving me cash to account for the mistake.Very overhyped by the Yelp community. It's a decent place to come for brunch as long as you aren't that hungry and willing to shell out for a pretty pricey place. Will I come back again? Probably just for the Avocado Sandwich, but that's it.",3.0
"went here in search of a nice breakfast/brunch place. the place is tiny and was pretty much packed. there were spots at the bar so we decided to stay and eat at the bar because judging by yelp reviews this place was very worth it. first minus - they don't have special brunch/breakfast deals. everything comes separately. it's fine since the prices aren't that high. but I love to have a side of fries or salad or fruits with my morning sandwich.they had potato chips as a side. after ordering it - realized these were just regular chips in a bag vs fries that I initially thought they are. oh well. returned that. got a comment back from the waiter/maybe also a manager that chips are chips in america and not fries. ok.pepperment ice tea was very nice though. and after everyone around us was served including a couple who came after us, we were offered extra drinks on the house. nice touch.avocado sandwich was very good. blt was ok.staff somehow doesn't feel happy and looks like they're all operating on their own w/o communication between each other...",3.0
"Romantic and hip atmosphere in a beautiful cobblestones Brooklyn neighborhood. We were with a large group and were able to sample almost everything on the menu. We were all blown away by the presentation and flavor of the dishes. Very gluten-free and dairy-free friendly, we left very full and indulged but feeling healthy happy and light. The desserts were out of this world, without being too sweet. I highly recommend!",5.0
The food is OK. Pricy for the quality though. Nothing to brag about. Service sucked! The place wasn't even busy. The waitress had attitude.,1.0
"i've been to iris cafe a couple of times now with my boyfriend's family and we all leave content. the staff suggests you order appetizers to share, which can be pretty expensive when you're with a large group of people (and that's without the cost of the main course and/or dessert). usually we order all of the appetizers to share, but my personal favorites are the carrots with pistachio vinaigrette (absolute favorite!), asparagus with cheese and egg, kale croquettes, and brussels sprouts when they have them. my boyfriend likes their mushrooms with ricotta and honey, which is also pretty good. overall, their appetizers reflect a wonderful and curious palette - even if something seems like it won't taste good, the flavors almost always mesh well together and leave you wanting more. appetizers aside, the main courses are rather small and pricey for the amount you get. their tagliatelle, lamb belly, and short rib are all delicious, but, mind you, portions run on the small side. dessert is negligible.",4.0
"I took my brother here for his birthday dinner and as a thank you for (once again) helping me move apartments. The ambiance was absolutely lovely - small place, very quiet, but not pretentious in the least! We split all of our plates, as per the suggestion of the very nice waitress. For me, the winner was the homemade tagliatelle with chantrelles and tomatoes.  My brother's favorite was the buratta on scallion pancakes (which I also adored). We also got the shishito peppers which were super yummy, the octopus in tomato confit (the octopus was cooked to perfection, but the other elements were just OK), and the hen of the woods mushroom with homemade ricotta (probably our least favorite dish, but still very tasty). We also split a bottle of cava, which really hit the spot and worked wonderfully with all the dishes. Dinner was a little less than 2 hours, and the service got a little slow towards the end as they got busier, but overall a very nice spot. I will definitely go back!",4.0
"I used to live around the corner from this place, and it was the highlight of my day when I got to come here. I've enjoyed the coffee, cappuccinos and cookies here. I had an amazing biscuit here on a few occasion and just could spend the day here. This is the place I miss most after moving out of Brooklyn.",5.0
A friend who used to work here introduced me to this little havenAll roads lead to Rome meaning there are no bad choices on this little taste journey,5.0
"Great place for brunch! Very busy, usually a wait outside, and small portions - but delicious!",5.0
"Decent food- strange beyond strange service. The waitstaff tried hard to be cool & pounded me when I signed the cc receipt. It's like they didn't know what to do with this queer fag femme. Tacky!For a $4 tea I at least expect a hot water refill or a check in once in a while to see what's happening at the table. Especially after asking our group to wait outside in the cold while a table became available. Absolutely meh. Luckily I always eat with amazing people who made brunch worth the frigid temps, haphazard, clumsy & awkward service. I just think the staff is young & still figuring things out (personality & food service wise) but for the sweet space, decent food- a little mentoring of their young & a few experienced people working tables can go a long way to making Iris a better meal all around.",2.0
"Came here with a friend for brunch. She ordered the Huevos Rancheros and I ordered the Avocado Toast with Soft Egg and Ham and Cheese Biscuit.The Establishment- Very cozy, cute cafe- Pretty busy around brunchtime- The waitresses are dressed like normal people - no easy to tell way of knowing who works there and who doesn't. There's also no pedestal or anything when you enter. So we were awkwardly standing near the entrance for a while before a waitress came. It's small, I get it -- but we felt like fish out of a fishbowl for a good two minutes (slight exaggeration). - You also have to be willing to share tables. They have bench-like setups and there isn't a lot of privacy. Most people are sharing tables.The Food- Everything is in small servings. Do not come here expecting a sizable brunch. In fact, the largest dish is probably my friend's Huevos Rancheros. And even that is small by Essex standards.- My friend said the Huevos Rancheros were delicious but nothing to write home about. There was many different flavors that complemented very well.- The Avocado Toast was absolutely delicious. Creamy and perfect. I would've given Iris four stars based on this alone... until I discovered Iris Take Away has the same thing for cheaper.- Not a fan of the soft-boiled egg. Really had nothing to contribute to the toast at all. Sure it made the toast a little yolky, but it just covered up the deliciousness of the avocado.- I got the Ham and Cheese biscuit because I knew I'd still be hungry. It was surprisingly not a normal biscuit with ham and cheese. The two were baked into the biscuit. I could barely taste the cheese, and there wasn't much ham. It was awful... and they call it their 'specialty biscuit'.The Service- It took them quite a while to get our orders out. So go with good company. They will have to entertain you.- Service in general is pretty appalling. We had to wait to get a water refill (which you will need quite often because the bottle of water is pretty small for a party of 2)- When we got the check, they messed up my order. Probably because the person who got our check was different from our original waitress -- please fix this.- At least they fixed my check by giving me cash to account for the mistake.Very overhyped by the Yelp community. It's a decent place to come for brunch as long as you aren't that hungry and willing to shell out for a pretty pricey place. Will I come back again? Probably just for the Avocado Sandwich, but that's it.",3.0
