"Iris is a neighborhood favorite of mine (and the significant other) for both brunch and dinner. The local-favorite tipped me to give it five, rather than four, stars.The ambience is casually beautiful and quirky without being too fussy or overly twee (although I could see where others' notions of too-much-twee might vary). But, for me, it's the perfect balance of nice but not too formal that seems like the sweet spot for dates. And the waitstaff is always friendly and is generally attentive and efficient.But the food is the point. And the food is very good. For brunch, we tend to get the chilaquiles or the avocado and cheese sandwich. Both are fairly simple but are prepared with care using great ingredients.For dinner, we've tried most of the items on the menu and all of the mains have been tasty. In particular, the mushroom dashi for the salmon is incredibly full of flavor. For starters, although it might not sound super special, try the warm sourdough with hummus. It has an almost mustardy undertone that is interesting and delicious. And the desserts are awesome, particularly the panna cotta (if/when it comes back) and the chocolate torte with orange zest.",5.0
"Really cute cafe with friendly staff and a warm atmosphere- mostly attended by local families and residents.The dinner menu is pretty limited in my opinion, and I don't think there is good value for the price.The hummus appetizer comes with the smallest portion of hummus and three pieces of bread (these were decently sized.)The brown rice pasta was a hearty portion but drenched with oil which really took away from the dish (photo attached).Overall it's a cute place, but I wouldn't come back unless in the area--maybe the brunch experience is different.",3.0
"Great casual brunch spot. I especially liked the decor inside, with wooden branches sprawling across the walls. The turkey breast sandwich reminded me of a Vietnamese bahn mi, with its carrots and cucumbers. The goat cheese salad was simply delicious.I personally liked their mimosa better than the mojito, which was a bit too sweet for my liking. But overall, good food that can't go wrong. I took one star off because the server was too quick with us, and walked away while we were still ordering.When we showed up at 2 pm, the place was packed. By the time we left at 3, it had emptied out - so pick a good time to avoid waiting!",4.0
"This quaint, cute cafe should only be known to locals. Thank the gods for Yelp! Swung by for some artisanal coffee and a light brunch. The boo ordered a turkey sammy which has slight nuisances of a banh mi and I ordered the avocado toast and 2 eggs any way. The ambiance and locals makes for a relaxing and delicious time for a low key date or even a nonchalant rendezvous.Staff was slow and easy going but given the location, it's well expected. The fast paced life of NYC takes a time out here at Iris. Enjoy the avocado toast, stay for the memories.",4.0
"My 100th review goes out to this brunch gem. Really cute place for brunch with simple, healthy options. I had friends visiting from out of town who wanted to walk the Brooklyn bridge. We wandered around by Brooklyn bridge park and found this spot. They wanted to go somewhere that wasn't ""standard,"" and this place fit the bill nicely. Everything was reasonably priced between $10-$15. I liked that they had fresh, healthy options instead of fattening brunchy foods. You can even order a huge bowl of fresh berries for $6.I got the chilaquiles, which came in a skillet. They were really delicious and very filling. One of my friends got an English muffin with fresh ricotta and honey, which she liked.",5.0
"Venue - Cute rustic cafeBrunch - Chilaquiles comes in a hot skillet, topped with poached egg and avocado. Has a nice little kick to it. Unfortunately I didn't get to try anything else since the entire table ordered chilaquiles.Service - A bit lacking in that it was slow and confused.",4.0
"Lovely little café in Brooklyn Heights. Small, well chosen menu starting with breakfast at 8am. Very good coffee. Sandwiches are very good value for their quality and quantity. We had a Roast Beef Sandwich, Avocado Toast with poached eggs and Yoghurt with homemade granola and berries. From my perspective the Avocado Toast was a bit over priced, with 11$. The Granola was good, but with 10$ also a bit too pricy from our perspective. Thus, only 4 star rating.",4.0
"Cute place for brunch with lots of instagrammable elements like exposed brick, window-side seating, and water served in vintage-y wine bottles. That being said, for the amount of food you're getting, you end up paying way too much. Food tastes okay, nothing to rave about. Tastes like something your friend's mom would make for you if you slept over their house. Ordered the avocado toast with poached eggs (nice touch of flavor from the dijonnaise under the avocado), smoked salmon with pickled onions (the onions couldn't save this bland and over-salted disappointment) and the french toast (this took forever to come out and was completely burnt on one side). Would I have brunch here again? Probably not. Maybe if someone was treating me.",3.0
"A cute cafe in Brooklyn Heights for brunch. This is a great spot if you want to hang out in DUMBO or near the Brooklyn Bridge. The area is quaint and cute, and this small cafe fits right in.food+ BISCUITS: Essentially a biscuit sandwich with jam in between, these biscuits were perfect, thin, and not too heavy. They were almost like biscuit muffin tops? A little crunch on top but still flaky, warm, and soft.+ YOGURT: This yogurt is deceivingly huge. I guess at $9, the price is justified. There is more than enough granola and almonds to cover all the yogurt on the plate, and generous amounts of blueberries and strawberries.+ CHOCOLATE SCONE: Really great. The filling had melted chocolate, that wasn't too sweet, with a crunchy exterior. - CHALIQUILES: This dish is beautifully presented on an iron skillet, but the flavor was missing. The tortilla chips got soggy from the sauce, but nothing about the flavors redeemed the dish. Also, the poached eggs were more hard boiled than poached. ~ FARRO COBB: A very fresh, light, clean brunch option that was like a cobb salad. serviceThe host was really friendly and attentive while our server was just all over the place. We had snacks at the bar and were told we could have the bill transferred to the table, but she forgot. When we asked about our bill, she had to ask her manager whether it was included or not. She spilled water all over the table and didn't clean it up. She placed a hot coffee in front of my friend that had coffee spilled all over the saucer. It was Sunday morning, so I'm sure she was just tired or hungover, but she did not try to clean up when she had made her mistakes.",3.0
"I'm drooling just thinking about this place.My family and I came here on a frigid Saturday morning. This is a tiny (and very warm!) cafe that is hidden away right near Brooklyn Bridge Park. We were welcomed by a very friendly and attentive waitress who was very receptive to my family's--err---special requests (i.e., ""let's substitute x out of y""). Onto the food. I ordered a cappuccino, and my god, if that wasn't the best cap I'd ever drank. But that paled in comparison to my smoked salmon. Let me put it this way, I had every intention to take a picture and upload it to Yelp. THAT DID NOT HAPPEN. Why? Because I  inhaled that dish. So much smoked salmon, so much cream and pickled onions. The combination was heavenly. I would come back here in a second if I didn't live in California.My family was also quite pleased with their food, though my mother was a bit put out that the edges of her french toast were burned. Just a side note. Nonetheless, that french toast was delicious. I would like to know where they got the bread for the toast and order it in bulk.",5.0
"Good days start with good coffee and breakfast! Thank you Iris Cafe for just that! My boyfriend and I went for Breakfast around 10:30 and that was right before the late morning rush on a Tuesday. The menu is small but everything that we ordered was very tasty. We had the smoked salmon with poached eggs, Chilaquiles and avocado toast. Everything was presented beautifully, our meal came out quick and was cooked very well. My only complaints are that the prices are a bit high and I really wanted more toast! They give you two tiny pieces to put the salmon on which is not enough so we got the avocado toast as well. The restaurant is decorated super cute and the service was great. Definitely stop by if you have some free time in the Brooklyn Heights area!",4.0
"I know Instagram has latergrams but does Yelp have later reviews?? Cause that's what this is. My wife and some friends of ours found this little spot while looking for a place with some gluten free fare that didn't insult our flavor receptors. The service here good but the gf sandwiches are great. Can't remember what I had specifically but there were 4 of us and we had three different sandwiches and they were all worth the stop. The exposed brick and rustic feel is commonplace  any more but their little twist made it feel like you were hanging out in the kitchen of an old world cook with drying spices and the like hanging in the windows.If you are in the area, stop by. You won't regretit. Oh! and I had some tea as well. Can't remember the flavor, but if you like tea you will probably order the same one I did. Or not. Who knows. Let me know what tea you got and maybe I'll remember. Til then!",4.0
To be honnest I don't remember what I had because I went to Iris Cafe like 2 years ago (will need to come back to try it again)However I  remember it was pretty good. Also it was the place where I met one of my best Friend in New York and actual roommate. So I will remember this place as being a special place for me!( I think I got egg benedict with salmon or maybe she did and it was very good!!!),4.0
"If you're looking for a picture-perfect, well-priced restaurant in Brooklyn near the park, this is for you.For brunch, my group had brussel sprout croquettes, shashuka, the farro cobb (my favorite) and the chilaquiles. Everything was excellent--can't complain. Service was great, too, and we had a delightful time.Warning: It's small, so there's going to be a wait during peak brunch hours. Also, there's only one bathroom. So that could be an...issue when everyone has to go, if you know what I'm saying.",4.0
"After a nice stroll with the baby across the Brooklyn Bridge one afternoon, I yelped a close by brunch place with four stars and more, and VOILA - Iris Cafe. We walked about 25 minutes to get there from the bridge. Upon arriving, there were no seats available inside but the waitress was extremely nice and kept us posted while we waited outside. It was a nice day in the 50s, so we didn't mind, plus the neighborhood is eye candy any way. We were seated by the window (arguably the best seat in the house in my opinion). I had to laugh when baby's slouchy beanie blended right in with the sea of slouchy beanies in the cafe. I ordered the avocado toast, hubby got the smoked salmon, and we shared a scone. With all the good reviews, we were underwhelmed with both the toast and the salmon, but the scone was delicious! If you are hungry, the avocado toast ends up only occupying a small portion of your tummy, so highly recommend getting something else to fill up.Bottom-line: Cute cafe, not a lot of seating, okay food, chill atmosphere.",3.0
"The food at Iris Cafe is very simple and downright good.  I have stopped by for several times for brunch, and their avocado toast is great, as well as their yogurt & granola.  My boyfriend loves their turkey sandwich.  (3 stars since I find their portions to be small.)",3.0
Love the ambience and vibe if this cafe. Great brunch options. The turkey sandwich was perfect. Highly recommended if your in the neighborhood.,4.0
"Very cute, unassuming little cafe tucked away in a small street in Brooklyn Heights. It's close enough to the Brooklyn piers to enjoy a lovely, scenic stroll after your meal! It is not obvious from the outside that this cafe is here, so beware that it's a little hard to find, and that there isn't a big sign that says ""IRIS CAFE"". The menu here is short and sweet. Dishes are simple, yet poignant pairings of good ingredients, and everything just feels so good. My friend and I split the chilaquiles and smoked salmon toast, and both dishes were rustic perfection. Lovely place to catch up with a girlfriend or enjoy a leisurely afternoon with good company.",4.0
A quirky spot. No prices on the menu outside.  Strange... What are they trying to hide? I went in anyway.  My poached eggs and avocado toast were a smallish portion for the price.  One piece of toast? Really?,2.0
"Nothing special. 3:00 on a chilly Wednesday afternoon. There were only 2 other tables besides my own. 6 people total. The waitress never checked on us and my dirty plate sat in front of me long enough for my napkin to stick to it.And the dirty coffee cups never left the table either.I had the salmon/scallion pancake dish and it was ok. The salmon was fresh...but I can't say it left an impression. Neither did the cafe. Not likely that I would return.With love,NicoleGetUnstuckNYC.com",3.0
"Good days start with good coffee and breakfast! Thank you Iris Cafe for just that! My boyfriend and I went for Breakfast around 10:30 and that was right before the late morning rush on a Tuesday. The menu is small but everything that we ordered was very tasty. We had the smoked salmon with poached eggs, Chilaquiles and avocado toast. Everything was presented beautifully, our meal came out quick and was cooked very well. My only complaints are that the prices are a bit high and I really wanted more toast! They give you two tiny pieces to put the salmon on which is not enough so we got the avocado toast as well. The restaurant is decorated super cute and the service was great. Definitely stop by if you have some free time in the Brooklyn Heights area!",4.0
"I know Instagram has latergrams but does Yelp have later reviews?? Cause that's what this is. My wife and some friends of ours found this little spot while looking for a place with some gluten free fare that didn't insult our flavor receptors. The service here good but the gf sandwiches are great. Can't remember what I had specifically but there were 4 of us and we had three different sandwiches and they were all worth the stop. The exposed brick and rustic feel is commonplace  any more but their little twist made it feel like you were hanging out in the kitchen of an old world cook with drying spices and the like hanging in the windows.If you are in the area, stop by. You won't regretit. Oh! and I had some tea as well. Can't remember the flavor, but if you like tea you will probably order the same one I did. Or not. Who knows. Let me know what tea you got and maybe I'll remember. Til then!",4.0
To be honnest I don't remember what I had because I went to Iris Cafe like 2 years ago (will need to come back to try it again)However I  remember it was pretty good. Also it was the place where I met one of my best Friend in New York and actual roommate. So I will remember this place as being a special place for me!( I think I got egg benedict with salmon or maybe she did and it was very good!!!),4.0
"If you're looking for a picture-perfect, well-priced restaurant in Brooklyn near the park, this is for you.For brunch, my group had brussel sprout croquettes, shashuka, the farro cobb (my favorite) and the chilaquiles. Everything was excellent--can't complain. Service was great, too, and we had a delightful time.Warning: It's small, so there's going to be a wait during peak brunch hours. Also, there's only one bathroom. So that could be an...issue when everyone has to go, if you know what I'm saying.",4.0
"After a nice stroll with the baby across the Brooklyn Bridge one afternoon, I yelped a close by brunch place with four stars and more, and VOILA - Iris Cafe. We walked about 25 minutes to get there from the bridge. Upon arriving, there were no seats available inside but the waitress was extremely nice and kept us posted while we waited outside. It was a nice day in the 50s, so we didn't mind, plus the neighborhood is eye candy any way. We were seated by the window (arguably the best seat in the house in my opinion). I had to laugh when baby's slouchy beanie blended right in with the sea of slouchy beanies in the cafe. I ordered the avocado toast, hubby got the smoked salmon, and we shared a scone. With all the good reviews, we were underwhelmed with both the toast and the salmon, but the scone was delicious! If you are hungry, the avocado toast ends up only occupying a small portion of your tummy, so highly recommend getting something else to fill up.Bottom-line: Cute cafe, not a lot of seating, okay food, chill atmosphere.",3.0
"The food at Iris Cafe is very simple and downright good.  I have stopped by for several times for brunch, and their avocado toast is great, as well as their yogurt & granola.  My boyfriend loves their turkey sandwich.  (3 stars since I find their portions to be small.)",3.0
Love the ambience and vibe if this cafe. Great brunch options. The turkey sandwich was perfect. Highly recommended if your in the neighborhood.,4.0
"Very cute, unassuming little cafe tucked away in a small street in Brooklyn Heights. It's close enough to the Brooklyn piers to enjoy a lovely, scenic stroll after your meal! It is not obvious from the outside that this cafe is here, so beware that it's a little hard to find, and that there isn't a big sign that says ""IRIS CAFE"". The menu here is short and sweet. Dishes are simple, yet poignant pairings of good ingredients, and everything just feels so good. My friend and I split the chilaquiles and smoked salmon toast, and both dishes were rustic perfection. Lovely place to catch up with a girlfriend or enjoy a leisurely afternoon with good company.",4.0
A quirky spot. No prices on the menu outside.  Strange... What are they trying to hide? I went in anyway.  My poached eggs and avocado toast were a smallish portion for the price.  One piece of toast? Really?,2.0
"Nothing special. 3:00 on a chilly Wednesday afternoon. There were only 2 other tables besides my own. 6 people total. The waitress never checked on us and my dirty plate sat in front of me long enough for my napkin to stick to it.And the dirty coffee cups never left the table either.I had the salmon/scallion pancake dish and it was ok. The salmon was fresh...but I can't say it left an impression. Neither did the cafe. Not likely that I would return.With love,NicoleGetUnstuckNYC.com",3.0
"Iris reminds me a lot of the more-popular brunch hangout spot close by, Vinegar Hill House, minus the ridiculous wait and inflated bill. Iris' menu doesn't provide too many options (which may be your thang) for brunch - a couple sandwich and salad options, avocado toast for $7, the usual high Brooklyn fare. Fortunately, their portions are surprisingly large and the food tastes good. Simple, yet delicious. Tourists visiting the area should steer away from Brooklyn Heights Cafe, Theresa's, other the other overpriced traps on Montague. Go to Iris and you'll thank Scott later.",4.0
"We wanted to grab brunch on a Sunday morning and I thought this place was cute given the Yelp reviews. We waited maybe 20 minutes to be seated in a quaint little cafe, which I didn't mind. Maybe we ordered the wrong things, but holy crap are the portions small. For $11 of avocado toast, I kid you not I got one tiny slice of bread with some avocados on it and two tiny poached eggs. We also got the chilaquiles served on the skillet. Tiny. I am okay with small portions, but we ordered extremely hearty items. I'm usually stuffed for brunch, but I walked out of there hungry. I was totally not expecting that from a regular neighborhood cafe. If you have those prices for such small portions, either the food or the presentation better blow my mind. Neither was true for this place. I rather pay a few dollars more to be full. Bread, eggs and avocado are not expensive and requires minimum prep. Service was fine, but not overly friendly to make up for the disappointing portions. Rarely does Yelp fail me, but I probably won't be back to this one. There are a lot of great things that I love about Brooklyn, but I think I'll stick to lower east for brunch. Tons of other people seems to love this place though so I'm sure I won't be missed. Just not for me. All yours Brooklyn hipsters! I did enjoy the 2 tacos I ate somewhere else afterwards because I was so hungry.",2.0
"3.5 Stars is more accurate. More of a snack spot. Iris Cafe is a very small restaurant. So small that they have an open kitchen in the back where a team of chefs work together to put together a dish. My companion here was here for brunch just before walking around the neighborhood. We ordered the Avocado Toast, Smoked Salmon with Poached Eggs, and Biscuit with Jam and Butter. Portions are very small that I would say it's more of a snack spot.Avocado Toast - a toast cut into triangle halves and topped with avocado slices. This was a very simple dish but pretty tasty. I wished there was more!Smoked Salmon with poached eggs - very fresh tasting and from the oil on the fish. Poached eggs were topped with red pepper powder which is not too bad tasting but too raw for my taste.Biscuit with Jam and Butter - biscuit was still warm and really soft. The jam was really sticky and came with big chunks. You definitely need to wash your hands after this! Service was friendly. Our hostess sat me down while my companion was still looking for parking and she did not rush me to order right away. I appreciate this!Overall, it's a pretty interesting cafe with tasty foods. I really love the old-fashion look of the restaurant. This cafe is more of a snack spot where you get a small sandwich or some eggs before a workout or if you do not want a big meal.",3.0
"I used to come here when in the neighborhood. I think ownership must have changed because things have really gone downhill. The three changes I've been most disappointed by:1-  my fave bartender is gone 2-The servers have been dismissive, hungover, rude, or some combination of those lately3-The portions! So small! Not worth it, even for a neighborhood bar. Also there was a funky smell coming from the kitchen when I went for an early brunch. I swear it was cannabis. Which is fine but meh maybe not if you charge that much for avocado toast.",1.0
I've been here a few times for brunch now as it's just round the corner. I think the coffee is great and the hostess is so friendly and welcoming. Last time I had the smoked salmon which was delicious my only complaint is that the poached eggs were v overlooked and the yolk was hard. I've also has the chaquiles dish which I didn't think tasted v good. Will def go back loved the atmosphere and the staff.,4.0
"Cute little coffee shop nestled on a quiet street in Brooklyn Heights. We walked in here on a cold winter day after walking around Brooklyn Bridge Park. Their coffee is delicious! We split a turkey sandwich, as well. The food all looked and smelled delicious. It also looks like they serve breakfast/brunch all afternoon.I loved the rustic charm inside. There were vines all along the wall and a cool tin/metal ceiling. I'll try to make my way back here when I'm in Brooklyn Heights again!",4.0
"A cozy and quaint cafe. Open kitchen and staff is incredibly friendly. Almost feels like you've entered your friend's home for a meal. Enjoyed the earthly decor the place brings with the vines crawling up the wall to the steel coated celings. Foodwise, they offer simple dishes such as avacado toast or smoked salmon with a poached egg. Rather, these arent dishes. They are snacks. snacks with a high price tag. Overall, a cute place with a special feel. I'd come back if I were in the area but not often.",3.0
food is delicious. coffee is great. drinks are awesome. need I say more? guess I must cus yelp tells me so lol. the staff is friendly and super personable. Jeremy makes some great coffee and the kitchen hooks up some pretty tasty dishes. I've had the smoked salmon with poached eggs. very very good. I've tried the fresh ricotta with honey and salt. the combination is great. I've tried a few drinks here. I just tell the bartender what I'm in the mood for and he hooks it up. wish I remembered the names of the drinks but who cares they were good and potent. come  eat drink and be merry.,5.0
"Had dinner here last night. Totally average but so incredibly overpriced. The $27 (or was it $28?) salmon was perfectly acceptable--not overcooked--but nothing memorable at all. The brussel sprouts salad was a bit more interesting, with a touch of sweetness, but again, rather perfunctory. The Malbec was tasty and at $10 actually the most reasonable thing I had last night. The place was almost completely empty which I think means that people have caught on to what a total rip off this spot has become. A far cry to the cute and earnest neighborhood morning coffee spot it once was. Too bad. So many better options in the hood.",2.0
Hidden gem ! Delicious brunch ! Friendly staff ! The smoked salmon dish was mouthwatering ! The teas are a real deal !,5.0
