It had been a very very very long time since I had had any Thai in NYC 1. Because I am always in Manhattan and let's face it there are tons of Thai restaurants 2. Because I had a terrible experience at song.That being said Joya converted me back. I walked in on a Sunday afternoon for lunch with my mom and sister. We were absolutely delighted with the food. I was extremely impressed by the flavored and quality of food. Not to mention how reasonably priced their menu is. Some of my favorites are pad see ew (I wish they made this with shrimp I'll ask next time I'm there) spicy seafood fried rice and of course the pad Thai. The calamari is super fresh and yummy. My mom couldn't stop raving about how fresh it tasted and how you could tell their oil wasn't super old and overused. On another occasion my husband ordered the chicken garlic entree with the jasmine rice... Super scrumptious!! Go to Joya!I can't wait to go back again! Not cash only anymore :),5.0
Typically had great experiences at this Thai Place but the first time I met rude owner Andrew will be the last time I eat here. I was absolutely embarrassed and mortified when he told my children they can't sit at the booth because they would ruin the furniture. This is not a child friendly restaurant. I wonder if this is a store policy for all children?,1.0
"This is one of my close friends favorite places. I am not a huge fan but the food is good for the most part. I think that my biggest grievance here is the service, its OK and that's it. I have been here at least 4 times and that is the general vibe I get. They plaster on smiles and just try and get people in and out. I do think it is partially a language barrier, as most the staff I have interacted with had heavy accents and did not seem to be native English speakers.Again the food is decent and if you are craving Thai and in the neighbor is not the worst stop that you could make.",3.0
"I really enjoyed Joya.To start, the ambiance, tables, lighting, etc. is great. This place is CLEAN and classy - perfect for date night. Or just any kind of nice dinner, I suppose.We ordered a large order of calamari ($12) - the thai chili sauce it came with was delicious and the portion was huge. Unfortunately, the calamari itself wasn't the tastiest. It was a little on the chewy/tasteless side. But nonetheless, it was good for the price. And smothering the calamari in the yummy sauce helped.We shared on thai iced tea - so good. The flavors were on point and it came in a large glass, so it was perfect for sharing. As an entree, I ordered the Kang Masaman - chicken curry with zucchini, peppers, carrots. It came with a good portion of rice. It was spicy and hd a lot of flavors. I've never been a fan of cooked carrots, so I took those out, but everything else was good. I probably would not order this again, but I am happy I tried it. I have leftovers for dinner tomorrow night :)My boyfriend enjoyed his entree as well - something with brown sauce, chili paste and shrimp. Our bill was about $44 with tip. Not bad. I look forward to coming back and trying some noodles.",4.0
"Just came here and was so disappointed. I've been coming here for years and now, they have changed their food's flavor profile to mostly sweet and salty. No spiciness whatsoever when we order something specifically called ""spicy squid noodles."" Thai food is supposed to be spicy. Also, multiple bowls of rice and their fried rice was cooked totally wrong. It was hard and disgusting.",2.0
"Amazing food! I don't live in Brooklyn so I'm not familiar with this place, but my cousin lives around the corner and says the food is always really good.... I shared an appetizer with him and it was fried shrimp with a good sauce on the side. I ordered a dish and it had chicken and I think potatoes, with a coconut curry sauce. It wasn't spicy and it wasn't too sweet. I ate the whole thing, and it was a good sized bowl with rice on a separate plate. There was a lot of the curry sauce and the consistency was like a broth. I just took the spoon and a lot of the sauce on it as well as the chicken and ate it that way. I guess you could put the rice in the bowl and eat it like more of a soup if you wanted. My cousin ordered noodles with beef and some vegetables. The noodles weren't in the classic spaghetti shape. I could've eaten his plate too. If you're going to have wine, you're better off ordering a bottle instead of by the glass if you want a couple glasses. Also, we called to make a reservation and since they were so busy they said we had to come in and put a name on the list and wait there. Very very busy but obviously for a reason. The wait was worth it, but it's just something to keep in mind. Maybe they take reservations over the phone when it's less busy. Definitely looking forward to eating from here again.",4.0
"So very happy we decided to try this place. Just a couple stops away from home so we ventured out into the cold to get our Thai fix. Definitely not disappointed.To start, we had summer rolls. I would skip this. The sauce it comes with seemed ill fitting and there was nothing particularly good about this appetizer..On to the entrees:We ordered two specials: the prawn pad Thai with avocado and the chicken (white meat) panang (I think) curry with flat noodles. SO delicious. Both of them.I wanted to lick the plates and order two more entrees. I really really had to exercise all the self control in me not to order more.Service was decent and interior was nice. Looked fairly clean, though the dishes and silverware were kinda dirty-- expected anywhere you eat out. The space is a sort of long railroad-style resto. I think there are individual bathrooms, but the place isn't that big so I don't think they'd need to have multiple stalls. The bar is in the front and the dining area extends and opens up as you walk further in.Definitely will return and order a different app. Can't wait for the mains, yum!",4.0
"We went here because of soo many friends suggesting it and they were right!Other posted pics are accurate. If your not looking for it you will miss it. Clean, fresh, friendly and great Thai food. We got Calamari, it's a light batter and needs the sauce they give. We also got Shrimp Pad Thai and Spicy Seafood Fried Rice, both were great!Bar is basic, no great deals or great beers. They have outdoor seating in the back and would love to come back when that's open. Bathroom is sharp and clean. Prices for what we got were reasonable. $29 for the 3 dishes and we took a Togo bag. We will go back!",5.0
"I love joya. The food is cheap and the drinks are good. I'm pretty sure they're cash only, though. I wish they had other kinds of red wine by the glass. We ordered mojitos and they were very good, not too sweet. My boyfriend and I ordered the fried calamari. It came with a sweet sauce that had hot pepper flakes, which gave it a bit of a kick. It was delicious. We shared the spicy noodles with chicken and a beef stir fry dish with vegetables in a chili basil sauce. The noodles were amazing! They weren't too spicy. The other beef dish was also delicious. I loved the variety of vegetables and it just had so much flavor. Overall, joya is a great place for dinner with drinks.",4.0
"The decor is industrial-chic with simple, clean lines - we loved Joya the moment we stepped in. I always judge an Asian restaurant by how it executes the pork, and was impressed by the tender, juicy and lean slices in my pad see ew. The BF loved his pad thai, and his chicken was just as tender. The lunch prices are very reasonable, while the portion size is more dinner-like. I had plenty of leftover noodles to take home, but devoured all the yummy pork and leafy greens in one sitting, ha.",4.0
"Let me start with saying I have being spoiled by Somtum Der, which was recently awarded a one Michelin star, and all the other amazing Thai places in Manhattan (Kiin Thai eatery, Pinto, etc.). I have certain standard for Thai - basically just that I don't like bland Thai dishes. SO if my review sounds overly hash, do my a favor, go eat at Somtum Der. After watching a movie nearby, we did our research and decided to give this place a try. We got here around 6:30pm on a Saturday night, it was already pretty busy. Luckily a table was just leaving so we only had to wait for a little over 5min to be seated. We got the Thai spare ribs, spicy noodle with shrimp and pad thai with chicken. Thai spare ribs were very well flavored, meat was juicy and tender and fell right off the bone. Unfortunately, it just went downhill from there. My spicy noodle was a complete failure: (1) it was not spicy AT ALL, (2) it lacked the complex flavors from Thai dishes I'm used to, and (3) shrimp in there was definitely NOT fresh and it had certain ammonia after taste. To be fair, our waiter did ask whether I wanted spicy sauces, so I guess at least they acknowledge that ""spicy noodle"" was not spicy. Pad Thai, in comparison to spicy noodle, was better. Instead of being bland, it was overly vinegary. I've never tasted any Pad Thai being that sour. Once again, not trying to sound like a snob, but this proves my theory that due to lack of competition in BK, I need to discount ratings by at least one star for a restaurant. In this particular case, a four-star Thai place in Cobble Hill is probably equivalent to a 2 star in Manhattan.The positive? Two drinks, one appetizer and two entrees, the total bill with tip was less than $70. THAT is something Manhattan cannot compete with. But I'd rather pay up and enjoy something way better.",2.0
This place is usually a good time. My favorite dish is the drunk noddles with shrimp and I get it with extra egg and no vegetables. The calamari is also pretty good here. Everything is very reasonably priced and the quality of the food makes it a great place. The staff are also very friendly and helpful which is hard to find now in days.,5.0
"Yum, yum, yum!My friends and I came in here for a quick dinner before heading to the movies. Beautiful area, beautiful scenery, and beautiful decor in the restaurant. The food was fantastic! We all enjoyed our meals. I ordered a margarita for $9 and it was good. Not sure it was worth $9 though. More like $6 or $7. The food is very inexpensive and our bill came out to under $40 for three meals, plus my drink! This place has good food for cheap. My only peeve was that since we sat outside we were greeted by mosquitoes, bees, and flies. Not exactly the most pleasant eating experience. However, the food and atmosphere is so nice that the bugs do not pose a major problem. I will definitely make an effort to come back here before the summer's end. The food is delicious and they give you a great portion for the price!",4.0
"I want to start off this review by saying the food and it's pricing is awesome I would have given this place five stars but I have to be honest there were two bartenders on duty one male one female The female that work the bar February 26, 2016 PM shift was very rude to me and a coworker she was very cold and came across like she didn't want to serve us we were about to walk out but the manager must have noticed and got us seated quickly the rest of the staff was A+ and friendly definitely made up for the rudeness of the female bartender Definitely have plans on coming back but don't think I'll be paying homage to the bar anytime soon.",3.0
"This is definitely a great date night spot or even just a girls night with your friends. The ambience is so chill and the decor is phenomenal. The veggie spring rolls are AMAZING. Also, try the pad Thai. The serving presentation was beautiful as well.",5.0
"The ambiance in here was very nice.I do like the fact I seen kids in here so at least I know its kids friendly.The place is very neat and clean,the service was pretty quick.Overall a good experience,the staff could of been a little more friendly but wasnt too bad",4.0
First time here. You can choose to sit inside or outside. Serving are really helpful and friendly. Had a nice steak fried rice here :),5.0
"Great place to eat and relax! Im big on prices BANG FOR MY BUCK and this gives it!!! i like that you can order things that might not be on the menu .. For example, i ordered the red coconut curry sauce with flat noodles which combines the rice sauce with the noodle medium!  Its only around $7-8 so for me, that's a bang for my buck! The calamari is pretty good here too. They offer two different sizes which is a great idea. Will def come again whenever Im in BK! This is my favorite Thai place!!!",5.0
"I live close to a Thai neighborhood in Queens but I still wish Joya is closer to me. I eat Thai food all the time and I have to say, Joya makes the best Americanized Thai food ever.Because of jury duty, I was able to go to Joya, so far, 3 times this week. If it was next to the courtroom, I think I would gone to Joya even more!I went to Joya for lunch one day because we had a really long lunch break during jury duty. It is about a 15 minute brisk walk to Joya from the Brooklyn U.S. District Courthouse at Cadman Plaza East, according to Google Maps, it's .8 miles from the courthouse. I sat down and when the waitress gave me the menu...I didn't see a lunch menu, so I asked if there were lunch specials. She pointed to the menu and used her finger to indicate some of the items have lunch specials but she was not really specific!!!! I think she said the lunch entree includes a soup or salad. When she said this, I couldn't even comprehend what she was saying because she was mumbling. I could not tell if she said soup AND salad or soup OR salad. I found out the entree only comes with one or the other because I got only the soup. There was no other customers around so why is service so bad?!! They really need to print out some lunch special menus. The waitress didn't even mention how much the lunch special is. I didn't even know how much it was until the bill came, $10.02 including tax. Lunch service is haphazard. It's pretty annoying. They are just lucky I love the food or I would never come back! I am not a person who even likes Pad Thai but I like it here. I've had the chicken and the tofu Pad Thai's at Joya and love both. I also had the Tom Ka soup with chicken which I loved. Next time I am going to try the Tom Ka with tofu. I am just not a fan of chicken in general but the chicken really doesn't add anything to the soup...matter of fact I thought it detracted from the soup. The Woon Sen was okay. Nothing I would order again because the Pad Thai is a much better noodle dish...man, my mouth is watering as I write this review!My jury duty adventures continue...",4.0
"I love this place. Ive been coming to joya for over seven years now since I went to school in downtown brooklyn.  The must try is there spring rolls, those vegetable spring rolls are so amazing it comes with this dipping sauce thats the perfect split between sour and sweet. I mean I parked illegaly in front to run in and get some on the drive home from work?! There that awesome. The skewers and Thai rib appetizers are okay but definitley not worth it... munch on those spring rolls. When the fryer was broken one time out of the over 100 times ive orderd from there they acommodated me! There really amazing!! The lady that rolls the spring rolls has been there forever, and they dont use the frozen rice paper its the real deal. The Pad See Ew Is amazing just so authentic! My standard order is mix it up a bit! Add that extra brown sauce, american brocolli and a side of white rice and watch as the hungry monster in your belly smiles and dances! Its just so great!The thai tea is just so authentic and good. The workers and the cooks are really from thailand. After traveling in thailand for about  a month in the villages and markets I can justifiably say that there food is authentic.Its so reasonable in regards to pricing. I mean 2 orders of spring rolls. 2 cokes. 2 entrees. Tip. APPROXIMATLEY 40 dollars. Like really?THEY ACCEPT CREDIT CARD***The owners are sweethearts! The interior decor is trendy with music, with a splash of romantic candle light and white tables. its always packed on the weekends but they take care of you and seat you as fast as possible.The outdoor seating area has cushions, benches,tables, two really huge romantic trees. Candle light. I mean its an outside oasis. So romantic.Definitley will continue to be a regular.",5.0
"Let me start with saying I have being spoiled by Somtum Der, which was recently awarded a one Michelin star, and all the other amazing Thai places in Manhattan (Kiin Thai eatery, Pinto, etc.). I have certain standard for Thai - basically just that I don't like bland Thai dishes. SO if my review sounds overly hash, do my a favor, go eat at Somtum Der. After watching a movie nearby, we did our research and decided to give this place a try. We got here around 6:30pm on a Saturday night, it was already pretty busy. Luckily a table was just leaving so we only had to wait for a little over 5min to be seated. We got the Thai spare ribs, spicy noodle with shrimp and pad thai with chicken. Thai spare ribs were very well flavored, meat was juicy and tender and fell right off the bone. Unfortunately, it just went downhill from there. My spicy noodle was a complete failure: (1) it was not spicy AT ALL, (2) it lacked the complex flavors from Thai dishes I'm used to, and (3) shrimp in there was definitely NOT fresh and it had certain ammonia after taste. To be fair, our waiter did ask whether I wanted spicy sauces, so I guess at least they acknowledge that ""spicy noodle"" was not spicy. Pad Thai, in comparison to spicy noodle, was better. Instead of being bland, it was overly vinegary. I've never tasted any Pad Thai being that sour. Once again, not trying to sound like a snob, but this proves my theory that due to lack of competition in BK, I need to discount ratings by at least one star for a restaurant. In this particular case, a four-star Thai place in Cobble Hill is probably equivalent to a 2 star in Manhattan.The positive? Two drinks, one appetizer and two entrees, the total bill with tip was less than $70. THAT is something Manhattan cannot compete with. But I'd rather pay up and enjoy something way better.",2.0
This place is usually a good time. My favorite dish is the drunk noddles with shrimp and I get it with extra egg and no vegetables. The calamari is also pretty good here. Everything is very reasonably priced and the quality of the food makes it a great place. The staff are also very friendly and helpful which is hard to find now in days.,5.0
"Yum, yum, yum!My friends and I came in here for a quick dinner before heading to the movies. Beautiful area, beautiful scenery, and beautiful decor in the restaurant. The food was fantastic! We all enjoyed our meals. I ordered a margarita for $9 and it was good. Not sure it was worth $9 though. More like $6 or $7. The food is very inexpensive and our bill came out to under $40 for three meals, plus my drink! This place has good food for cheap. My only peeve was that since we sat outside we were greeted by mosquitoes, bees, and flies. Not exactly the most pleasant eating experience. However, the food and atmosphere is so nice that the bugs do not pose a major problem. I will definitely make an effort to come back here before the summer's end. The food is delicious and they give you a great portion for the price!",4.0
"I want to start off this review by saying the food and it's pricing is awesome I would have given this place five stars but I have to be honest there were two bartenders on duty one male one female The female that work the bar February 26, 2016 PM shift was very rude to me and a coworker she was very cold and came across like she didn't want to serve us we were about to walk out but the manager must have noticed and got us seated quickly the rest of the staff was A+ and friendly definitely made up for the rudeness of the female bartender Definitely have plans on coming back but don't think I'll be paying homage to the bar anytime soon.",3.0
"This is definitely a great date night spot or even just a girls night with your friends. The ambience is so chill and the decor is phenomenal. The veggie spring rolls are AMAZING. Also, try the pad Thai. The serving presentation was beautiful as well.",5.0
"The ambiance in here was very nice.I do like the fact I seen kids in here so at least I know its kids friendly.The place is very neat and clean,the service was pretty quick.Overall a good experience,the staff could of been a little more friendly but wasnt too bad",4.0
First time here. You can choose to sit inside or outside. Serving are really helpful and friendly. Had a nice steak fried rice here :),5.0
"Great place to eat and relax! Im big on prices BANG FOR MY BUCK and this gives it!!! i like that you can order things that might not be on the menu .. For example, i ordered the red coconut curry sauce with flat noodles which combines the rice sauce with the noodle medium!  Its only around $7-8 so for me, that's a bang for my buck! The calamari is pretty good here too. They offer two different sizes which is a great idea. Will def come again whenever Im in BK! This is my favorite Thai place!!!",5.0
"I live close to a Thai neighborhood in Queens but I still wish Joya is closer to me. I eat Thai food all the time and I have to say, Joya makes the best Americanized Thai food ever.Because of jury duty, I was able to go to Joya, so far, 3 times this week. If it was next to the courtroom, I think I would gone to Joya even more!I went to Joya for lunch one day because we had a really long lunch break during jury duty. It is about a 15 minute brisk walk to Joya from the Brooklyn U.S. District Courthouse at Cadman Plaza East, according to Google Maps, it's .8 miles from the courthouse. I sat down and when the waitress gave me the menu...I didn't see a lunch menu, so I asked if there were lunch specials. She pointed to the menu and used her finger to indicate some of the items have lunch specials but she was not really specific!!!! I think she said the lunch entree includes a soup or salad. When she said this, I couldn't even comprehend what she was saying because she was mumbling. I could not tell if she said soup AND salad or soup OR salad. I found out the entree only comes with one or the other because I got only the soup. There was no other customers around so why is service so bad?!! They really need to print out some lunch special menus. The waitress didn't even mention how much the lunch special is. I didn't even know how much it was until the bill came, $10.02 including tax. Lunch service is haphazard. It's pretty annoying. They are just lucky I love the food or I would never come back! I am not a person who even likes Pad Thai but I like it here. I've had the chicken and the tofu Pad Thai's at Joya and love both. I also had the Tom Ka soup with chicken which I loved. Next time I am going to try the Tom Ka with tofu. I am just not a fan of chicken in general but the chicken really doesn't add anything to the soup...matter of fact I thought it detracted from the soup. The Woon Sen was okay. Nothing I would order again because the Pad Thai is a much better noodle dish...man, my mouth is watering as I write this review!My jury duty adventures continue...",4.0
"I love this place. Ive been coming to joya for over seven years now since I went to school in downtown brooklyn.  The must try is there spring rolls, those vegetable spring rolls are so amazing it comes with this dipping sauce thats the perfect split between sour and sweet. I mean I parked illegaly in front to run in and get some on the drive home from work?! There that awesome. The skewers and Thai rib appetizers are okay but definitley not worth it... munch on those spring rolls. When the fryer was broken one time out of the over 100 times ive orderd from there they acommodated me! There really amazing!! The lady that rolls the spring rolls has been there forever, and they dont use the frozen rice paper its the real deal. The Pad See Ew Is amazing just so authentic! My standard order is mix it up a bit! Add that extra brown sauce, american brocolli and a side of white rice and watch as the hungry monster in your belly smiles and dances! Its just so great!The thai tea is just so authentic and good. The workers and the cooks are really from thailand. After traveling in thailand for about  a month in the villages and markets I can justifiably say that there food is authentic.Its so reasonable in regards to pricing. I mean 2 orders of spring rolls. 2 cokes. 2 entrees. Tip. APPROXIMATLEY 40 dollars. Like really?THEY ACCEPT CREDIT CARD***The owners are sweethearts! The interior decor is trendy with music, with a splash of romantic candle light and white tables. its always packed on the weekends but they take care of you and seat you as fast as possible.The outdoor seating area has cushions, benches,tables, two really huge romantic trees. Candle light. I mean its an outside oasis. So romantic.Definitley will continue to be a regular.",5.0
