Came with the wife had a great time...the wait was going to be long but we sat at the bar. I love the vibe of the Resturant first off but my wife got pad Thai which was absolutely amazing I can't believe it tasted that good and the size is the perfect amount I got the red curry with shrimp and eggplant which was great also had a nice amount of spice along with good amount of shrimp it was so delicious. I can't imagine another Thai Resturant worth visiting,5.0
"What's all the fuss about the calamari? It was the most bland calamari I've had. I suppose if you want a hip looking restaurant for very reasonable prices (starting about $8 an entree) in Brooklyn, this is a great spot. But I guess that is actually an asset because that kind of restaurant is tough to find in NYCBut the food is nothing to rave about. We enjoyed our red snapper. It was good, not great. Great tender fish, not much flavor.The ambiance is quite noisy. Not a great spot if you actually want to hear your partner talking... but if you're date is going awful... perfect ... you have some annoying music to fill in the silence between your bland conversation",3.0
"I REALLY wanted to like this place, I really did, but the food not only disappointed me, but it disappointed all of my friends. The décor and service were outstanding and they also have an outdoor dining area towards the back of the restaurant. There's also a full bar right near the front entrance. For a restaurant with a full bar, you would think they'd accept credit cards, but WOMP! CASH ONLY. The food is mediocre. The flavor lacked authenticity and should not be labeled as ""THAI FOOD.""I had the pad thai which tasted like it was drowned in tamarind and fish sauce. My boyfriend had the steak which was on their special menu and it tasted just like the pad thai- drowned with tamarind and fish sauce. Not only that, the food were all very salty. After my experience with food in New York, I believe California is the one of the few states in the nation that has the best cuisine of EVERYTHING!!!",1.0
"I've now completed 2/3 of the trifecta of Thai restaurants in BoCoCa (the other two are Song and National).Like the others, food at Joya is inexpensive and service is quick. There's also a nice sized backyard dining area.The kitchen is completely open and there's an angled mirror so you can watch them work, which is incredibly impressive. I don't know how they do it, but even with a ton of delivery orders, it didn't take any longer than 10 minutes for our appetizers, and another 5 for our entrees.The menu is basically the same thing at all three locations. I had the grilled salmon and Brussels sprouts special (just because I wanted to see what Thai Brussels sprouts would be like). It was really good. The sauce had a sweetness to it, and the sprouts were tender (and there were a LOT of them).All in all, Joya is a great place when you're short on time or cash. Oh, and it's cash only!",4.0
"Not the most authentic Thai restaurant, but it's hard to find anything authentic in this area - making it good enough to venture into if you're hungry. It's also pretty affordable, but not as affordable as authentic Thai restaurants typically are.",3.0
Good portions and affordable. I always find myself ordering the drunken noodles every time I'm here.Downside: long waits during primetime dinner hours and weekends.and cash only.,4.0
"I've been here many times past but it has been a few years since coming back to this place and I must say that they have not lost their quality of great tasting food. Tonight I took no pics yikes! but, I had a delicious serving of chicken curry puffs as an appetizer and spicy seafood fried rice as my entrée. Everything was so delish and now I'm reminded of why I fell in love with this place years ago. I will be back soon. Oh btw you can get a full meal for under $10 and end up with leftovers :-) awesome!!!!!",4.0
"A solid 3.5 star place. Lively, fast, loud, cheap, but with food that won't poison you. Definitely a place to meet up with a group of friends to have a quick dinner, and definitely for a younger demographic. The place is loud but you don't have to raise your voice to speak with others at your table. Came here mid week for dinner and it was packed. Turn over was quick, waited only a few minutes for a table. Got the curry puffs and the ribs as apps. Ribs had an outside reminiscent of sandpaper, would never order again. Puffs were really thick and filling, with a hint of curry. I don't think go well as an app in a Thai place, at least not these, because they are too heavy to be followed with some noodles etc. would get it as take out maybe not a sit down meal. For mains tried the masaman, their ""spicy"" noodles and the pork kraprow. Best was the masaman even though the beef was a bit tough, there was a lot of it. There was nothing spicy about the noodles and they were a bit overlooked and mooshy. Kraprow was ok. Also forgettable really. Food was super bland and especially for Thai food. Was really strange they didn't have any hot sauces on the table. I looked around at other tables thinking maybe ours was just missing this, but didn't see any on other tables either. I looked over the reviews for their sister restaurant Song, and noticed they have this there but on request. Maybe it's the same here, I'm not sure. But kind of weird to keep this a secret especially when the food is so bland. Either way, it's a decent solid spot to know about for quick dinner with friends.",3.0
"Excellent Thai food! After staying in Thailand, I'm so proud that Brooklyn often offers better meals than one might find in the motherland albiet more pricey. They have a $10 lunch special try the spicy noodle and thom yum soup for an authentic bite.",5.0
"This is by far my favorite Thai spot ever. I've been to some Thai spots in California, and Joya still beats it by far. My favorite dish is the spicy drunken noodles with shrimp. Pure heaven!!!",5.0
"Imagine a restaurant that uses fresh ingredients, not to heavy with the fat content, and cost about what a meal at McD would cost (minus the booze)...now imagine the food was actually good, now open your eyes...you are in Joya!",5.0
Still one of my favorite places to go to eat on Court Street. Went in last night around 6:40 PM and we were seated immediately. We started with drinks. A Thai iced tea for me (seems like the glass was larger than I remembered) and a glass of wine for my friend. Next up were appetizers. We decided on calamari. It came out fast. Lightly fried. Could have had a bit more seasoning but the sweet dipping sauce made up for it. Our entrees were good as well. I had the pad see ew with beef and my friend tofu curry. Both dishes were delicious. By the time we were leaving the place was more crowded with people waiting for tables. As always the music was loud but we managed to make conversation and not disturb the people next to us too much.  All in all an old favorite that I can always come back to!,5.0
"Joya is a neighborhood staple that's always crowded, especially on the weekend. The Court Street restaurant offers out door dining in the backyard and the decor on the inside is modern. The calamari was fried perfectly but needed salt however my entree-Kang Panang Gai (cocunut curry sauce) would be pretty darn good if it offered more chicken. Overall, it's not heavily commercialized like Lemon Grass but decent Thai. Oh and it's CASH ONLY.",3.0
"Delicious cheap Thai food!! Inside is a little bit loud but you will see the kitchen with all the flames -pretty impressive. The outside area is quite and really romantic.I had dinner with a friend at 9:30pm: two big plates of fried rice with shrimp and vegetables, and noodles. Chai teas, and we spent $21!I will definitely go back.",5.0
This is the sister restaurant to Song in Park Slope. Very simple modern Thai restaurant. The food is very good and flavorful. Will definitely go back if in the neighborhood.,4.0
Tried and true,4.0
"Very impressed with  their backyard outdoor seating. Super relaxing and cozy with the pillows and umbrellas. Plus you don't get to constantly smell the kitchen inside. Not a huge fan of their Thai ice tea. Came in good portion but a little too ""chemically"" sugary for my taste. Their appetizers are really what stands out. The fresh thai summer rolls tasted sooo refreshing with the cucumber, shrimp in tamarind sauce.  Great presentation as well. Loved the calamari dish!! Never had them come out  so crispy without having being oily. You could basically grab one without needing to wipe your hands. The plum sauce it came with  was the perfect. accoutrement. We ordered a small for 2 and we were starting to feel full by the end of it. For entrees, I ventured out of my comfort zone and ordered the Kang Panang Gaibeef which included sliced beef with peppers crushed kaffier leaves in panang sauce.  My friend had the Kang Kyo Whan Gai with sliced chicken, eggplants, zuchini  in the green curry sauce, Both sauces were more watery than what we were used to but still had taste. Found the Panang to be more flavorful than Green curry. In both dishes, the meats were overcooked and lacked flavor (my beef slices were slightly tough and her chicken slices were white and blend) . Some of the vegetables were kinda old as well (carrots and eggplant were slightly browning). Overall, the entrees we had weren't that great (to say the least), but then again they weren't indigestible. I will still eat my leftover for lunch tomorrow. I think they kinda win with the seasoning on their sauces..cause it made me  forget about the other ingredients in the dish. Or it could be  I'm just a sucker for thai sauces...Haha!I looooove their portion sizes and their price. You can honestly be full and satisfied from the apps, share an  entree and still have enough to take home. For 2 apps, 2 entrees and 3 thai iced teas, our total came out to $38Service was not great.  Our server lack any opinion and seemed more preoccupied with us getting our orders in quick. I can see why people complain of lack of service when this place gets packed. 4 stars for decor3 for food2 for serviceStill look foward to coming back for more lunches.Oh and like everyone says, CASH ONLY",3.0
"Although it can get pretty packed, the food is always amazing. I've been here numerous times and always waited patiently to dine. The staff is really friendly, courteous, and always checks in (and not annoyingly so). The duck, fab. Calamari, cooked perfectly. Pad Thai, yes please. It's all great. And the drink selection is great. I definitely recommend.I gave them four stars because of the wait to be seated and how quickly it can get crowded. And, also because it's cash only. But other than that Joya is joyous.",4.0
Best Thai food ever!  Amazing spring rolls. I always get spicy chicken basil and my wife always gets chicken Penang curry at any Thai restaurant. Neither of us were disappointed. But surprisingly I loved her Penang curry too.  Everyone in our group of 6 agree that this was the best Thai food we've had.,5.0
"This is by far my favorite Thai spot ever. I've been to some Thai spots in California, and Joya still beats it by far. My favorite dish is the spicy drunken noodles with shrimp. Pure heaven!!!",5.0
"Imagine a restaurant that uses fresh ingredients, not to heavy with the fat content, and cost about what a meal at McD would cost (minus the booze)...now imagine the food was actually good, now open your eyes...you are in Joya!",5.0
Still one of my favorite places to go to eat on Court Street. Went in last night around 6:40 PM and we were seated immediately. We started with drinks. A Thai iced tea for me (seems like the glass was larger than I remembered) and a glass of wine for my friend. Next up were appetizers. We decided on calamari. It came out fast. Lightly fried. Could have had a bit more seasoning but the sweet dipping sauce made up for it. Our entrees were good as well. I had the pad see ew with beef and my friend tofu curry. Both dishes were delicious. By the time we were leaving the place was more crowded with people waiting for tables. As always the music was loud but we managed to make conversation and not disturb the people next to us too much.  All in all an old favorite that I can always come back to!,5.0
"Joya is a neighborhood staple that's always crowded, especially on the weekend. The Court Street restaurant offers out door dining in the backyard and the decor on the inside is modern. The calamari was fried perfectly but needed salt however my entree-Kang Panang Gai (cocunut curry sauce) would be pretty darn good if it offered more chicken. Overall, it's not heavily commercialized like Lemon Grass but decent Thai. Oh and it's CASH ONLY.",3.0
"Delicious cheap Thai food!! Inside is a little bit loud but you will see the kitchen with all the flames -pretty impressive. The outside area is quite and really romantic.I had dinner with a friend at 9:30pm: two big plates of fried rice with shrimp and vegetables, and noodles. Chai teas, and we spent $21!I will definitely go back.",5.0
This is the sister restaurant to Song in Park Slope. Very simple modern Thai restaurant. The food is very good and flavorful. Will definitely go back if in the neighborhood.,4.0
Tried and true,4.0
"Very impressed with  their backyard outdoor seating. Super relaxing and cozy with the pillows and umbrellas. Plus you don't get to constantly smell the kitchen inside. Not a huge fan of their Thai ice tea. Came in good portion but a little too ""chemically"" sugary for my taste. Their appetizers are really what stands out. The fresh thai summer rolls tasted sooo refreshing with the cucumber, shrimp in tamarind sauce.  Great presentation as well. Loved the calamari dish!! Never had them come out  so crispy without having being oily. You could basically grab one without needing to wipe your hands. The plum sauce it came with  was the perfect. accoutrement. We ordered a small for 2 and we were starting to feel full by the end of it. For entrees, I ventured out of my comfort zone and ordered the Kang Panang Gaibeef which included sliced beef with peppers crushed kaffier leaves in panang sauce.  My friend had the Kang Kyo Whan Gai with sliced chicken, eggplants, zuchini  in the green curry sauce, Both sauces were more watery than what we were used to but still had taste. Found the Panang to be more flavorful than Green curry. In both dishes, the meats were overcooked and lacked flavor (my beef slices were slightly tough and her chicken slices were white and blend) . Some of the vegetables were kinda old as well (carrots and eggplant were slightly browning). Overall, the entrees we had weren't that great (to say the least), but then again they weren't indigestible. I will still eat my leftover for lunch tomorrow. I think they kinda win with the seasoning on their sauces..cause it made me  forget about the other ingredients in the dish. Or it could be  I'm just a sucker for thai sauces...Haha!I looooove their portion sizes and their price. You can honestly be full and satisfied from the apps, share an  entree and still have enough to take home. For 2 apps, 2 entrees and 3 thai iced teas, our total came out to $38Service was not great.  Our server lack any opinion and seemed more preoccupied with us getting our orders in quick. I can see why people complain of lack of service when this place gets packed. 4 stars for decor3 for food2 for serviceStill look foward to coming back for more lunches.Oh and like everyone says, CASH ONLY",3.0
"Although it can get pretty packed, the food is always amazing. I've been here numerous times and always waited patiently to dine. The staff is really friendly, courteous, and always checks in (and not annoyingly so). The duck, fab. Calamari, cooked perfectly. Pad Thai, yes please. It's all great. And the drink selection is great. I definitely recommend.I gave them four stars because of the wait to be seated and how quickly it can get crowded. And, also because it's cash only. But other than that Joya is joyous.",4.0
Best Thai food ever!  Amazing spring rolls. I always get spicy chicken basil and my wife always gets chicken Penang curry at any Thai restaurant. Neither of us were disappointed. But surprisingly I loved her Penang curry too.  Everyone in our group of 6 agree that this was the best Thai food we've had.,5.0
"Have been here several times. The food tastes great everytime, the service is good and they are very inexpensive. But they are in dire need of a CREDIT CARD MACHINE. Cash is a thing of the past",4.0
"Great night with my wife, food was  excellent and the service was very good.  Cannot beat the price for what you get.",4.0
"This place is always packed. Get ready to wait to be seated during meal hours. Lots of tables and seats tho. And in warmer days they open their backyard for some al fresco dining. The kitchen is opened so you can see the cooks doing their magic.The food - is CHEAP and YUMMY. We love the curries, and the noodles (I always order the Pad Kee Mao with extra veggies) and the calamari.Bring cash - this place does not take plastic.",5.0
"I used to work near Joya and currently live not far from Joya. My ex-co-workers and I have probably have gotten food from Joya numerous times for dine-in and take-out during the day and during week nights. I really like the dimmed atmosphere at night and it is quite busy between Friday to Sunday evenings. As compared with other thai restaurants within Smith and Court Streets, I can tell you that Joya dominates as far as the amount of patrons, turnover, and price of food. I love Joya for the convenience, consistency, and the quantity of food for the price lower than all its competitors. Their foods are delicious but on the salty side. The service is hit and miss depending on how busy the place is. Ordering food on the phone is easy but not as helpful when you ask about substitution and other adjustments. The quality is on par but not the best. If you are looking for quality, I would recommend you going to Pok Pok or Kao Soy. SPICE on Smith and Warrent St is ok but I tend to stay away from chain restaurants if I am in South Brooklyn area. I have tried most of the food options on the menu and I like the skewered chickens and pai thai the most. Lastly, remember to bring CASH.",5.0
"Along with the generous portions, the contemporary decor, and the attentive service, what I liked most about Joya was that my food was not too sweet. I find sometimes Thai food, especially Pad Thai, can be too sweet for me, but the food at Joya was delicious and very inexpensive. The only reason I left a star off was that it was cash only.",4.0
"This place is addictive. It's on the cheap side, without a cheap environment. It's got a nicely intimate atmosphere, great for conversation.The food is so tasty! I usually get the drunken noodles and a Thai tea. The Thai tea is really good - a lot of places water it down too much, but if you like the tea sweet and milky and fragrant, like me, you'll like it. I don't live in the neighborhood, but I get Joya cravings often.",4.0
"For ambiance alone, Joya deserves a 4: It's very inviting and romantic both indoors and outdoors in their patio area, but it really messed with our experience that the service delivery was on rabid-high the night we went.  We were constantly pegged to order even though we asked for more time to look at the menu.  Each time we did that, our server would reappear within 30 seconds .into order in to order.  Quite annoying because there wasn't anyone other than us seated outdoors and a few tables indoors so we couldn't understand the rushing.  We started off with the Salmon Spring Roll and the Chicken Massaman Curry special.  The Massaman Curry itself is very tasty, but the sauce was far too runny - so much so that the chicken looked like it was swimming around in a watered down yellow sauce and really took away from the visual appeal of the dish.  The Salmon Spring Roll was very mediocre - salmon wasn't all that fresh and the accompaniments were rather awkward.  We were still a bit hungry so we also ordered the Thai Calamari Salad.  This was my favorite dish of the night - very light, refreshing and they were generous with the calamari.  Joya is a good place to go if you're looking for something extremely quick, but don't want to do McDonald's/Burger King or any of the other fast food joints and the environment provides great romantic potential, but you'll be disturbed many times throughout your meal.",2.0
"If you want a drink, beer will cost you $5-$7. The dinner menu is about $10 max and the amount of food is great. You really don't need the appetizers because you'll be full real quick. Overall this place is great. We got seated quick and served within 10 minutes. I'd defiantly be back here.",5.0
"Great place with AMAZING food at an inexpensive price. The atmosphere is chill, very nice decor and scenery.  They load your plate full of food, LOTS of food. So you get more than your money's worth. Unique sauces and spices that go perfectly with the food. There's nothing left to say, I'm am now a loyal customer.",5.0
"If you enjoy having flies (yes, more than one!) go into your food while eating then this is the place for you! Seriously gross.",1.0
"Have been here several times. The food tastes great everytime, the service is good and they are very inexpensive. But they are in dire need of a CREDIT CARD MACHINE. Cash is a thing of the past",4.0
"Great night with my wife, food was  excellent and the service was very good.  Cannot beat the price for what you get.",4.0
"This place is always packed. Get ready to wait to be seated during meal hours. Lots of tables and seats tho. And in warmer days they open their backyard for some al fresco dining. The kitchen is opened so you can see the cooks doing their magic.The food - is CHEAP and YUMMY. We love the curries, and the noodles (I always order the Pad Kee Mao with extra veggies) and the calamari.Bring cash - this place does not take plastic.",5.0
"I used to work near Joya and currently live not far from Joya. My ex-co-workers and I have probably have gotten food from Joya numerous times for dine-in and take-out during the day and during week nights. I really like the dimmed atmosphere at night and it is quite busy between Friday to Sunday evenings. As compared with other thai restaurants within Smith and Court Streets, I can tell you that Joya dominates as far as the amount of patrons, turnover, and price of food. I love Joya for the convenience, consistency, and the quantity of food for the price lower than all its competitors. Their foods are delicious but on the salty side. The service is hit and miss depending on how busy the place is. Ordering food on the phone is easy but not as helpful when you ask about substitution and other adjustments. The quality is on par but not the best. If you are looking for quality, I would recommend you going to Pok Pok or Kao Soy. SPICE on Smith and Warrent St is ok but I tend to stay away from chain restaurants if I am in South Brooklyn area. I have tried most of the food options on the menu and I like the skewered chickens and pai thai the most. Lastly, remember to bring CASH.",5.0
"Along with the generous portions, the contemporary decor, and the attentive service, what I liked most about Joya was that my food was not too sweet. I find sometimes Thai food, especially Pad Thai, can be too sweet for me, but the food at Joya was delicious and very inexpensive. The only reason I left a star off was that it was cash only.",4.0
"This place is addictive. It's on the cheap side, without a cheap environment. It's got a nicely intimate atmosphere, great for conversation.The food is so tasty! I usually get the drunken noodles and a Thai tea. The Thai tea is really good - a lot of places water it down too much, but if you like the tea sweet and milky and fragrant, like me, you'll like it. I don't live in the neighborhood, but I get Joya cravings often.",4.0
"For ambiance alone, Joya deserves a 4: It's very inviting and romantic both indoors and outdoors in their patio area, but it really messed with our experience that the service delivery was on rabid-high the night we went.  We were constantly pegged to order even though we asked for more time to look at the menu.  Each time we did that, our server would reappear within 30 seconds .into order in to order.  Quite annoying because there wasn't anyone other than us seated outdoors and a few tables indoors so we couldn't understand the rushing.  We started off with the Salmon Spring Roll and the Chicken Massaman Curry special.  The Massaman Curry itself is very tasty, but the sauce was far too runny - so much so that the chicken looked like it was swimming around in a watered down yellow sauce and really took away from the visual appeal of the dish.  The Salmon Spring Roll was very mediocre - salmon wasn't all that fresh and the accompaniments were rather awkward.  We were still a bit hungry so we also ordered the Thai Calamari Salad.  This was my favorite dish of the night - very light, refreshing and they were generous with the calamari.  Joya is a good place to go if you're looking for something extremely quick, but don't want to do McDonald's/Burger King or any of the other fast food joints and the environment provides great romantic potential, but you'll be disturbed many times throughout your meal.",2.0
"If you want a drink, beer will cost you $5-$7. The dinner menu is about $10 max and the amount of food is great. You really don't need the appetizers because you'll be full real quick. Overall this place is great. We got seated quick and served within 10 minutes. I'd defiantly be back here.",5.0
