"Pros:---The pad thai is good---The pad thai is cheap (SEVEN dollars for a dinner?)---Nice decor---Good service---The atmosphere is fun, loud, kinda like a barCons:---The atmosphere is fun, loud, kinda like a bar.  I wouldn't bring my grandmother here, but it'd be good for a big group of friends.---There can be a wait ---If you try to order delivery, prepare to get a busy signal.  If you actually get through, their delivery is very prompt.I like this place quite a lot, all in all.  Sadly, so does everyone else.  :P",4.0
"Okay, my love affair with Joya has cooled a bit. Two things: 1.) They never answer their phone, or you get a busy signal when you call, forcing you to call back repeatedly for about 20 minutes before getting through or giving up, and 2.) The food is hit-or-miss much of the time. Like, one night the woon sen will be light and stir-fried to perfection and overflowing with delicious veggies and meat...and then the next time it will be super heavy and dripping with grease and scanty on the veggies and meat and just generally sort of bad.We still call them when we're up for a night of sodium-induced unquenchable thirst, but there's other comparable Thai in the neighborhood...and most of the other restaurants answer their phone, too.Still pretty okay but not as good as it could be.",3.0
"On my way back from the Westminster Dog Show, I thought it would be nice to fill my tummy with some Thai Food.  Off to Joya in Brooklyn which came highly recommended.This place is very 'Grown and Sexy' with their exposed brick wall, dj booth and recessed lighting.  I felt bad that I left my turtleneck at home - I would've fit right in.Anyway, for food I ordered the chicken wings and the sliced pork in chili sauce. The wings had a nice tangy sauce and the chicken was ok but not too memorable.  The sliced pork was very dry, and had absolutely no spice.  My Baby Mama ordered the spicy noodles which were not spicy but very salty.  Maybe it said salty noodles and she mis read the menu...The best part of the meal was the Blue Moon Beer on tap.  It came with a tiny orange slice.  Deeeelicious.I don't think I'll be back.",2.0
Food was solid but not memorable. Atmosphere was maybe too open for date night - think TGIF.,3.0
"Joya=Thai place with a DJ. For the Thai food, it gets 5 stars, it was almost a perfect representation of what I've eaten in Thailand, except for the portion sizes (bigger of course).For the DJ, it gets -1. No offense to the DJ, he was a good DJ, there is just something unsettling about listening to loud house music while I'm eating. The Kang Panang Gai is my favorite, it's extremely spicey-hot. A delicious Fire in your mouth. My husband (heehe) had the Pad See Yue and it was very delicious as well (not spicy). Prices are excellent.",4.0
"be prepared to lose your hearing, and feel rushed while you enjoy some good food.really cheap, pretty good food.",3.0
Went once and the spicy noodles were mediocre at best. Maybe the place was talked up to me and then failed to meet my expectations or they just had an off night. Either way I love Thai food and I've had MUCH better anywhere else. I'll give them one more try but if it tends to be hit or miss it is definitely not worth it to me.UPDATEWent again and the food was still mediocre...nothing to write home about.Want really good Thai?? Check out Ghang Thai on Smith Street...now that's some good thai food! (especially if you like it spicy),2.0
"When I use to live in Cobble Hill, this place opened across the street from me.  Most restaurants in New York open and have loads of people come the first month or so and then it tapers out after everyone has tried it.  Joya has been around for a good 10 years and the crowds have never let up since their opening night and for good reason.  If you want a place that has a nice (low lights) look, it's perfect for a date or friends night out.  They have gone through periods of DJ's and not but regardless the place is always jumping.  Nothing on the menu (and it is a miracle it has remained this way since they opened) costs more than 7.95!  (Almost to find a place this hot in New York with this low prices and great atmosphere is unheard of!)  I've gotten to know the owners over the years and could not meet a nicer bunch of guys.  The food is top rate Thai.  There is nothing on the menu I could complain about.  Personal favorites are the Spicy Noodles with chicken.  Mango salad (and I'm not a salad lover but this one is great!)  And - you will see a one page list of 'specials' that is handed to you when you sit down.  (Note: the 'specials' prices are higher than the menu's nothing more than 7.95 price - but well worth it and mostly in the 13.95 range).  I personally love their Skirt Steak (which always seems to be on their 'specials' page cooked with various Thai style veggies).  If I had to say anything critical it would be that - at times it feels almost 'rushed' to clear your food and have you on your way.  Given the high volume of people each night (Monday nights can be as crowded as Saturday nights) it's understandable why they need to keep the turn over going.  It's not exactly the place where you can sit and talk for a while after dinner (unless you do so at their bar which in itself is a great spot to hang.)  The white wine is cheap and good and after such a fun night of incredibly good food - and dining - you'll feel like you just left a party and can't wait to go back again.  Hence - the crowds - but you'll love being a part of it.  (Note:  if you are not in Cobble Hill and find yourself in Park Slope - go to their sister restaurant called SONG - same owners - same menu policy - same great food - slightly less appealing lighting (florescent strip lighting on walls) but all the same great crowds, fun and fantastically deliciously cheap food!)Update:  They now have a another restaurant in Fort Green called ""National"".  Same as everything above except the space itself is much smaller.  I forgot to mention that all 3 restaurants offer outdoor seating - nice in the warmer months!",5.0
"I enjoy going out to eat as much as anyone.......but last time I checked my surname isn't Rothschild, so I can appreciate an affordable meal without cooking it myself at home.Joya provides tasty Tai food and a decent ambiance at a third of the price you would pay to dine out in  the city. Not to mention that one plate can easily serve two people. Dishes are generally under $10 and I recommend the: Shrimp Fried Rice $6.50 or Pad Tai $6.95 Our bill was under $50 for 4 ppl and I got to let someone else clean the dishes when we were done (sweeeeeet).",4.0
"Great Thai food in cobble hill. Good selection of food. The stand out dish was a special for that day, the fried duck spring rolls. It was a little greasy but was delicious. Good lively atmosphere indoors, the small out door dining area was a little more relax and quiter, perfect date setting on a warm night.",4.0
"Pros:---The pad thai is good---The pad thai is cheap (SEVEN dollars for a dinner?)---Nice decor---Good service---The atmosphere is fun, loud, kinda like a barCons:---The atmosphere is fun, loud, kinda like a bar.  I wouldn't bring my grandmother here, but it'd be good for a big group of friends.---There can be a wait ---If you try to order delivery, prepare to get a busy signal.  If you actually get through, their delivery is very prompt.I like this place quite a lot, all in all.  Sadly, so does everyone else.  :P",4.0
"Okay, my love affair with Joya has cooled a bit. Two things: 1.) They never answer their phone, or you get a busy signal when you call, forcing you to call back repeatedly for about 20 minutes before getting through or giving up, and 2.) The food is hit-or-miss much of the time. Like, one night the woon sen will be light and stir-fried to perfection and overflowing with delicious veggies and meat...and then the next time it will be super heavy and dripping with grease and scanty on the veggies and meat and just generally sort of bad.We still call them when we're up for a night of sodium-induced unquenchable thirst, but there's other comparable Thai in the neighborhood...and most of the other restaurants answer their phone, too.Still pretty okay but not as good as it could be.",3.0
"On my way back from the Westminster Dog Show, I thought it would be nice to fill my tummy with some Thai Food.  Off to Joya in Brooklyn which came highly recommended.This place is very 'Grown and Sexy' with their exposed brick wall, dj booth and recessed lighting.  I felt bad that I left my turtleneck at home - I would've fit right in.Anyway, for food I ordered the chicken wings and the sliced pork in chili sauce. The wings had a nice tangy sauce and the chicken was ok but not too memorable.  The sliced pork was very dry, and had absolutely no spice.  My Baby Mama ordered the spicy noodles which were not spicy but very salty.  Maybe it said salty noodles and she mis read the menu...The best part of the meal was the Blue Moon Beer on tap.  It came with a tiny orange slice.  Deeeelicious.I don't think I'll be back.",2.0
"Was recommended by a local to try Joya to get the best Thai food experience ever.  They did warn me it would be extremely loud and that it was.  I wouldn't recommend going here to catch up with friends but I would recommend it if you're looking to indulge your Thai side.  I was beyond satisfied with my meal!  The atmosphere is very 'swanky' yet casual.  Love the centerpieces at the bar.  On the down side, the waitresses were not attentive and the seating is snug.  Other than that, great food!  Wished I lived closer.",4.0
The selections were great at one point.. Not sure what happened. I think it instantly became a lounge once people realized they had a full bar & loud music. The wait is always overwhelming +  long. I typically order take out which is really quick & well organized despite the restaurant's crowd. I always go with a special- there are better thai places in bk.. ie. manee thai..but this may be one with the better ambiance + decor. Trendy rating - A+,3.0
"I just simply love love love this place. I always order the same thing but just because is soooo good I dont want to try anything else; their pad thai, fried rice, papaya salad and fried calamari are just to die for, I get hungry just thinking about this place! so worth the trip to Brooklyn, yummy yummy yummy. I've must've been to this place more than 15 times since I found out about it. This place is CASH only and gets super packed on the weekends. I always get there early so I dont have to wait... If it is passed 8PM I won't even bother going because smelling all that delicious food while waiting for an hour to get a table would just drive me insane.",4.0
"Foods are decent. Only the reason why i giving 2 star instead of 4 star: manager or owner(?) he was plain rude. I asked for a baby high chair and then with an attitude he said ""???? I'll show you"" i didn't understand what he said exactly. In a while, another staff brought it with a kindness. Lastly,i walked to the counter for a pay, he was giving me an another attitude: i said""give me $10 back please"", he goes count the monies takes a while. I asked one more time ""just give me $10 back"" he said ""I KNOW!, I HAVE ????????? TIP"" i thought he was trying to say "" I KNOW, BUT I HAVE TO CALCULATE MONEY FOR THE TIP FIRST!"". Ok i understood, but he shouldn't said like that. He could be nicer than what he did. He also never said like ""thank you"" or ""how was it?...""no even eye contact'. It's obviously shame on Joya if he is the owner of this restaurant.Overall, good foods, good atmosphere, good server, good location, reasonable price, ONLY THE MANAGER OR OWNER.",2.0
"I like this place a lot, but I can't help but notice that they are slipping a bit in their takeout department. The last time I ordered from here, I noticed that their takeout wasn't as fresh as it normally is--the meat in my massaman curry was very tough, and the chicken in my spicy noodles smelled a little off. Maybe it was an off-night. In terms of on-site dining, the price is definitely right--where else can you get a 3 course meal AND drinks all for under 25 dollars a person? Also their outdoor patio is adorable, and their atmosphere is great for both group dining and date nights.",3.0
Two words..Massaman Curry.  Went to Joya while visiting because it was close and it made it on my list to go to again before I left.  Definetly a place i will return to each and every time i am in NYC,5.0
I loved the food I ordered and it was very inexpensive.  My boyfriend wasn't as big of a fan because his food was not quite as spicy as expected as well as a little on the sweet side.  Still a great place for Thai.,4.0
"Love this place. The Pad Thai, Panang Curry, and Ginger Chicken all standouts. Delivery is always fast and correct, a huge plus when you're starving after work.Plus, if you decide to dine in, the decor is great and the service is efficient.",5.0
"This the best Thai food I have ever had!  It's often extremely crowded, but well worth the wait.  The prices are good.  They have a cute outdoor space.  I go here every time I'm in Brooklyn.",5.0
"Joya is an amazing deal, fabulous ambiance (a bit hard to talk/hear the other person) and some of the best Thai food I've had in NY. Highly recommend checking it out! The longest we've had to wait was 30 minutes on a Friday night at 10:30 PM (late dinner). During the summer, they have outdoor seating that's pretty nice too. Service is o-k, not amazing but definitely fast.",5.0
"Was recommended by a local to try Joya to get the best Thai food experience ever.  They did warn me it would be extremely loud and that it was.  I wouldn't recommend going here to catch up with friends but I would recommend it if you're looking to indulge your Thai side.  I was beyond satisfied with my meal!  The atmosphere is very 'swanky' yet casual.  Love the centerpieces at the bar.  On the down side, the waitresses were not attentive and the seating is snug.  Other than that, great food!  Wished I lived closer.",4.0
The selections were great at one point.. Not sure what happened. I think it instantly became a lounge once people realized they had a full bar & loud music. The wait is always overwhelming +  long. I typically order take out which is really quick & well organized despite the restaurant's crowd. I always go with a special- there are better thai places in bk.. ie. manee thai..but this may be one with the better ambiance + decor. Trendy rating - A+,3.0
"I just simply love love love this place. I always order the same thing but just because is soooo good I dont want to try anything else; their pad thai, fried rice, papaya salad and fried calamari are just to die for, I get hungry just thinking about this place! so worth the trip to Brooklyn, yummy yummy yummy. I've must've been to this place more than 15 times since I found out about it. This place is CASH only and gets super packed on the weekends. I always get there early so I dont have to wait... If it is passed 8PM I won't even bother going because smelling all that delicious food while waiting for an hour to get a table would just drive me insane.",4.0
"Foods are decent. Only the reason why i giving 2 star instead of 4 star: manager or owner(?) he was plain rude. I asked for a baby high chair and then with an attitude he said ""???? I'll show you"" i didn't understand what he said exactly. In a while, another staff brought it with a kindness. Lastly,i walked to the counter for a pay, he was giving me an another attitude: i said""give me $10 back please"", he goes count the monies takes a while. I asked one more time ""just give me $10 back"" he said ""I KNOW!, I HAVE ????????? TIP"" i thought he was trying to say "" I KNOW, BUT I HAVE TO CALCULATE MONEY FOR THE TIP FIRST!"". Ok i understood, but he shouldn't said like that. He could be nicer than what he did. He also never said like ""thank you"" or ""how was it?...""no even eye contact'. It's obviously shame on Joya if he is the owner of this restaurant.Overall, good foods, good atmosphere, good server, good location, reasonable price, ONLY THE MANAGER OR OWNER.",2.0
"I like this place a lot, but I can't help but notice that they are slipping a bit in their takeout department. The last time I ordered from here, I noticed that their takeout wasn't as fresh as it normally is--the meat in my massaman curry was very tough, and the chicken in my spicy noodles smelled a little off. Maybe it was an off-night. In terms of on-site dining, the price is definitely right--where else can you get a 3 course meal AND drinks all for under 25 dollars a person? Also their outdoor patio is adorable, and their atmosphere is great for both group dining and date nights.",3.0
Two words..Massaman Curry.  Went to Joya while visiting because it was close and it made it on my list to go to again before I left.  Definetly a place i will return to each and every time i am in NYC,5.0
I loved the food I ordered and it was very inexpensive.  My boyfriend wasn't as big of a fan because his food was not quite as spicy as expected as well as a little on the sweet side.  Still a great place for Thai.,4.0
"Love this place. The Pad Thai, Panang Curry, and Ginger Chicken all standouts. Delivery is always fast and correct, a huge plus when you're starving after work.Plus, if you decide to dine in, the decor is great and the service is efficient.",5.0
"This the best Thai food I have ever had!  It's often extremely crowded, but well worth the wait.  The prices are good.  They have a cute outdoor space.  I go here every time I'm in Brooklyn.",5.0
"Joya is an amazing deal, fabulous ambiance (a bit hard to talk/hear the other person) and some of the best Thai food I've had in NY. Highly recommend checking it out! The longest we've had to wait was 30 minutes on a Friday night at 10:30 PM (late dinner). During the summer, they have outdoor seating that's pretty nice too. Service is o-k, not amazing but definitely fast.",5.0
"Really yummy and pretty big portions.  Also, the outdoor seating is awesome.",5.0
"One of my favorite favorite Thai restaurant. I usually order something off their special menu, for example grilled salmon over Chinese broccoli, Skirt Steak with shrimp, along with Som Tom and Fresh spring roll. Fried calamari & mussels are delish!What I love about this place is that they offer Thai hot sauce(especially the one with finely chopped chili pepper in fish sauce).  Unfortunately lot of Thai places in NYC don't carry it.Also I find staff there pretty friendly and I avoid going there after 9 PM 'cause it turns into loud throbbing, thumping club with bridge & tunnel people(Fri/Sat). During the day and early evening is nicer; music more rock-n-roll/alternative w/ locals.12/28/2013 Haven't been here in a while since I moved out of Cobble Hill. So sad that Joya no longer carries MY FAVORITE dish, Spicy squid salad. I was sitting at the bar, drinking white wine, but disturbed by little girls playing patty-cakes nonstop behind me.",5.0
"Delicious Thai food and incredibly affordable. I haven't had anything on the menu that has not been good. The portions are big and we always go home with a doggy bag. They have a decent selection of beer on tap (for a Thai restaurant). Only negative is that the service can be a little slow when it comes to drinks and clearing plates. Additionally, make sure you bring cash, as they do not accept credit cards (I found out the hard way).",4.0
"Delicious, fresh-tasting, fast and affordable!",4.0
"Calling Joya for delivery usually feels as futile as calling into a radio station for free concert tickets. Actually going to Joya itself is even worse. It is vaguely infuriating in the same way it is to go to an obnoxious club where you have to wait on line, the music is too loud, and the drinks are weak. I don't recommend going but I do recommend bearing the tedium of calling for delivery because the food is really good, the price is great, and the service tends to be quite prompt.",3.0
"Really don't understand why this place generates so much traffic. Cheap, standard, greasy, more than likely MSG ridden Thai food. And the wait is just unbearable...",2.0
"Good Thai food in Brooklyn - never thought I would find it.  The red curry was yummy, as was the Thai iced tea.  Must go back one of these days and try something different.",4.0
"This place never lets me down.  The service is quick and attentive, the food is great and the prices are insanely cheap.  $7.50 for a Thai curry!  The decor is modern and cool.  Not surprisingly the place is always busy, so there is usually a short wait for a table.  The only complaint would be the cocktails were always a bit weak, but I just switched to wine, which is better value....nice large glass of pinot for $7, not bad.",5.0
Worth the 15 minute wait for a table! Can't beat the prices (8 dollar entrees) and the serving sizes were plenty for a meal (and maybe leftovers). Loved the veggies in red curry! Could've done without the summer roll appetizer. Fairly loud inside. Guessing the outdoor patio was quieter. Will definitely go back for more!,4.0
"Amazing food, amazing service, and amazing prices. Exactly how a restaurant should be. I love Joya",5.0
"Really yummy and pretty big portions.  Also, the outdoor seating is awesome.",5.0
"One of my favorite favorite Thai restaurant. I usually order something off their special menu, for example grilled salmon over Chinese broccoli, Skirt Steak with shrimp, along with Som Tom and Fresh spring roll. Fried calamari & mussels are delish!What I love about this place is that they offer Thai hot sauce(especially the one with finely chopped chili pepper in fish sauce).  Unfortunately lot of Thai places in NYC don't carry it.Also I find staff there pretty friendly and I avoid going there after 9 PM 'cause it turns into loud throbbing, thumping club with bridge & tunnel people(Fri/Sat). During the day and early evening is nicer; music more rock-n-roll/alternative w/ locals.12/28/2013 Haven't been here in a while since I moved out of Cobble Hill. So sad that Joya no longer carries MY FAVORITE dish, Spicy squid salad. I was sitting at the bar, drinking white wine, but disturbed by little girls playing patty-cakes nonstop behind me.",5.0
"Delicious Thai food and incredibly affordable. I haven't had anything on the menu that has not been good. The portions are big and we always go home with a doggy bag. They have a decent selection of beer on tap (for a Thai restaurant). Only negative is that the service can be a little slow when it comes to drinks and clearing plates. Additionally, make sure you bring cash, as they do not accept credit cards (I found out the hard way).",4.0
"Delicious, fresh-tasting, fast and affordable!",4.0
"Calling Joya for delivery usually feels as futile as calling into a radio station for free concert tickets. Actually going to Joya itself is even worse. It is vaguely infuriating in the same way it is to go to an obnoxious club where you have to wait on line, the music is too loud, and the drinks are weak. I don't recommend going but I do recommend bearing the tedium of calling for delivery because the food is really good, the price is great, and the service tends to be quite prompt.",3.0
"Really don't understand why this place generates so much traffic. Cheap, standard, greasy, more than likely MSG ridden Thai food. And the wait is just unbearable...",2.0
"Good Thai food in Brooklyn - never thought I would find it.  The red curry was yummy, as was the Thai iced tea.  Must go back one of these days and try something different.",4.0
"This place never lets me down.  The service is quick and attentive, the food is great and the prices are insanely cheap.  $7.50 for a Thai curry!  The decor is modern and cool.  Not surprisingly the place is always busy, so there is usually a short wait for a table.  The only complaint would be the cocktails were always a bit weak, but I just switched to wine, which is better value....nice large glass of pinot for $7, not bad.",5.0
Worth the 15 minute wait for a table! Can't beat the prices (8 dollar entrees) and the serving sizes were plenty for a meal (and maybe leftovers). Loved the veggies in red curry! Could've done without the summer roll appetizer. Fairly loud inside. Guessing the outdoor patio was quieter. Will definitely go back for more!,4.0
"Amazing food, amazing service, and amazing prices. Exactly how a restaurant should be. I love Joya",5.0
"Food was tasty, great prices",3.0
"went here in november while we visiting my bf's sister in brooklyn. nicely priced thai food especially in NY when everything can get so expensive and portions are generous as well.  I had that pad thai. Similar to other pad thai but with the cheap price, makes it seem better. the calamari was surprisingly delious as well. however one thing that irked was that no one helped us when we walked in the door, had to go find someone and also, lighting was bad. I could barely see my food. definitely must try if in the area!",4.0
"This is some of the best Thai I have ever had. The ingredients are fresh and everything is cooked superbly. Any of the noodle dishes or curries are slamming. You can also choose your level of spicy, which is great when not everyone wants the same kick with their meal. Prices are super reasonable; most plates range around $7 or $8 with ample food. The service is not too great, but usually because the place is packed. You might have to wait a half hour or so on weekends to get a table, but it's worth it. Also a great date night restaurant since they have a low-lighted, modern decor.",5.0
