Fantastic food ! Great menu! Lovely atmosphere and great decor and design . High quality cocktails !! Never a let down at this charming spot !,5.0
"One of my favorite spots in Williamsburg and here's why:Great space - equally suitable for a night out with the guys or an intimate date, nice ambianceMy current favorite Burger in Williamsburg, and it's reasonably priced. Comes with hand cut fries or a side salad which is exceptional. Pickled Daikon is quite simply amazing. So their food is most definitely on-point. Cast iron skillet chicken is great as well...Proper cocktails, great beer selection, decent wines by the glassStaff are knowledgeable and welcoming (especially the bartenders), but coming during peak hours (Friday or Sat night, brunch) is a bit of a crapshoot. Luckily I live walking distance and show up at random times for a great experience =]",5.0
"I love this place. Each time we have been to Lighthouse we've gotten both drinks and dinner, and not once have we been disappointed.  Every cocktail we've had (my husband and I always trade so we can try each other's) has been really, really delicious, and the food is always just as good.  Even on a slammed Saturday night we still got seats at the bar and were plenty entertained with drinks while we waited for a table.  Service has always been super friendly and efficient.  Great place for hanging out with friends, a date, or even just a cozy solo drink.",5.0
Food is always great. Service is always great. I've always had a good experience eating or drinking here.,5.0
"Great place. I have been coming there for the past five years, its always great, the food, the music the atmosphere. The owners Assaf and his sister Neama, knows how to make you feel comfortable, at home. They care about the food they serve, where it sourced from. And they always update the menu with seasonal food. You should also try their brunch its amazing!!Assaf is also an amazing bartender, they make great drinks there, you'll never be disappointed !!",5.0
Literally across the street from my friend's apartment. Nice spot for a glass of wine. Didn't order any food but it smelled good. French music was playing in the background.,4.0
"*This is a review based on food I tried from TASTE Williamsburg Greenpoint*Freekeh Bowl from LighthouseThis healthy and hearty plate of grains mixed in with colorful and fresh tomatoes, grilled corn, scallion, and cilantro with a side of creamy eggplant yogurt was so delicious that I kept coming back for more. The chef told me that this particular item is not on the restaurant's menu, but I strongly suggest that they make this their signature dish!",5.0
"Everything is solid about this place but the service, which was nuts the night we were there.  They appear to be doing some sort of free for all style of service, which resulted in a ton of confusion.  A while after we had ordered, around the time we were starting to wonder about apps, the server came over and said they were out of an entree we had ordered.  (Actually, they said they were out of chicken, because we ordered a chicken sandwich, and Melanie was pissed when the table next to us got roasted chicken like an hour later.  I knew what they meant, but she has a point.)I digress.  So we ordered something else, to replace the entree, and it came out immediately, well before our apps.  Then, our server came over and asked if we had decided what we wanted to replace the sandwich with.  I was like, ""yeah, we're eating the replacement right now"" and ""where is the rest of the food we ordered?"".  She went away, someone else came back and asked what else we ordered, a third person brought it to us shortly after--which was nice that they got it to us quickly.  Server B came by and asked us how it was, then seriously 30 seconds later, server A came by and asked the same thing.I won't even get started on my experience asking for a description of one beer.  Ok, I will: it was like asking what a pepsi tastes like and having the person very clearly describe a sprite.  How do you say, ""I know what you are telling me is incorrect"" when you are the one asking the question!Good place though.  I'll go back.  I'll manage my server more closely though.  And I'll be very sad if they take away the broccolini.",2.0
"Beautiful space, friendly service, no wait for brunch on Sunday at 12. Really wanted to like it! However, my shakshuka turned up lukewarm and very bland. It was essentially a can of crushed tomatoes and a couple of undercooked poached eggs topped with giant parsley sprigs. Trout looked more promising, as did the burger.",2.0
"great little place, comfortable table seating,freindly wait staff.I had Ceviche and roast chicken,wife had hanger steak and salad & bottle of wine.everything was really good no complaints also has a nice bar area.",4.0
Excellent chicken sandwich and 'Good & Plenty ' tequila based drink! Good service too.,5.0
"I frequently stop in for a quick cocktail... or two, during the week. I am a big Old Fashion fan and every bartender I have had here makes it perfectly. Not just that but once I've had my fix, but want to stay in the whiskey/bourbon area, the bartenders make something of their own creation and I have yet to not enjoy one. The owner as well is extremely nice and really knows his business. The food I am not as well versed on but can comment on the oysters, salad, and roasted peppers app. Oysters are fresh and they have multiple regions to choose from and for a few bucks its a good deal to me to get a few. The salad we had was just a mixed greens but well made with a tasty dressing, two of us shared it. The peppers were good, not my favorite, but good and actually when paired with a bite of the salad they were amazing.",5.0
"Healthy, tasty, creative, this place rocks! Must gets: the kolorabi and the squash.",5.0
"Good cheeseburger! Best I've had in a while and good ambiance.  The worst service I've ever had... We didn't get seated even though it was late and there were 2 tables open and no one ahead of us, no water or napkins given to us until we asked, drinks were slow, and our food was sitting and waiting under the heaters for a long time, and we had to stand up and go up to our waitress to ask for the check as she was sitting and hanging out at the bar. The other people there were helpful, but our waitress was the pits.",2.0
"We came as part of the LOADed Cocktail passport. The bar is in the middle of the intersection which is pretty cool. It's very cosmopolitan and with dark wood and large windows! We went around midnight, and there wasn't much of a crowd. And as a result, our bartender was a little busy flirting with a customer - so service was slow. Unfortunately, the drinks were only average. We got Laird's Applejack and Perry's Tot Gin based cocktails. The drinks were okay, but not as good as Donna and Randolph Brooklyn. But good atmosphere and great reviews on the food - unfortunately the kitchen was closed so I can't really address that aspect!",3.0
"Tonight, First visit with mom and girlfriend. Warm welcome at the door by a staff member (maybe owner?). Then seated right away. Server friendly without overtly trying to friend us. Started with a nice selection of Lager Beers, followed by Masabacha and Shishito Peppers appetizers... Y-u-m-m-y! Simple yet so tasty. Good conversation was accompanied by delicious steak salad and not too loud music. Generous on the greens, nicely topped with a simple vinaigrette and the steak. Wish it had a bit more steak though.Food was so good we finished off with another appetizer! Fennel with manchego. Hmm. Hmmm. Off to sleep.",5.0
"This is corner resturant you should visit when in Brooklyn. The eclectic menu offers a variety of fresh oysters (a must try) small plates and dinners. Experienced the heirloom tomato salad that was earthy and delicious. Also had the baked chicken with Israeli couscous/potatoes with tomato (this dish takes sometime to cook but well worth it). The meal was crisp and comfort food at its finest!This place is on point and must have, especially the chicken dish and oysters!",4.0
"Dear God, if the food in heaven could be from here, that'd be great. If you come to Brooklyn and don't eat here, you have made a huge error. EAT THE OCTOPUS",5.0
"This place has never disappointed me. I live close by and it is my go to when friends are in town. I would describe the food as farm fresh that is superbly prepared. One of my favorite plates is the ""Big Salad"" its light refreshing but also filling, perfect for summer!",5.0
"The food here was amazing. There are flavor a that we could not put our finger on but had such depth. We had the ribs, shishito peppers, big salad, chickpea dish, and fries. All had a distinctly Mediterranean flavor with a freshness that is hard to come by. My favorite was the chickpea dish. It was a fair portion and was packed with flavors that kept me wanting more.",5.0
Excellent chicken sandwich and 'Good & Plenty ' tequila based drink! Good service too.,5.0
"I frequently stop in for a quick cocktail... or two, during the week. I am a big Old Fashion fan and every bartender I have had here makes it perfectly. Not just that but once I've had my fix, but want to stay in the whiskey/bourbon area, the bartenders make something of their own creation and I have yet to not enjoy one. The owner as well is extremely nice and really knows his business. The food I am not as well versed on but can comment on the oysters, salad, and roasted peppers app. Oysters are fresh and they have multiple regions to choose from and for a few bucks its a good deal to me to get a few. The salad we had was just a mixed greens but well made with a tasty dressing, two of us shared it. The peppers were good, not my favorite, but good and actually when paired with a bite of the salad they were amazing.",5.0
"Healthy, tasty, creative, this place rocks! Must gets: the kolorabi and the squash.",5.0
"Good cheeseburger! Best I've had in a while and good ambiance.  The worst service I've ever had... We didn't get seated even though it was late and there were 2 tables open and no one ahead of us, no water or napkins given to us until we asked, drinks were slow, and our food was sitting and waiting under the heaters for a long time, and we had to stand up and go up to our waitress to ask for the check as she was sitting and hanging out at the bar. The other people there were helpful, but our waitress was the pits.",2.0
"We came as part of the LOADed Cocktail passport. The bar is in the middle of the intersection which is pretty cool. It's very cosmopolitan and with dark wood and large windows! We went around midnight, and there wasn't much of a crowd. And as a result, our bartender was a little busy flirting with a customer - so service was slow. Unfortunately, the drinks were only average. We got Laird's Applejack and Perry's Tot Gin based cocktails. The drinks were okay, but not as good as Donna and Randolph Brooklyn. But good atmosphere and great reviews on the food - unfortunately the kitchen was closed so I can't really address that aspect!",3.0
"Tonight, First visit with mom and girlfriend. Warm welcome at the door by a staff member (maybe owner?). Then seated right away. Server friendly without overtly trying to friend us. Started with a nice selection of Lager Beers, followed by Masabacha and Shishito Peppers appetizers... Y-u-m-m-y! Simple yet so tasty. Good conversation was accompanied by delicious steak salad and not too loud music. Generous on the greens, nicely topped with a simple vinaigrette and the steak. Wish it had a bit more steak though.Food was so good we finished off with another appetizer! Fennel with manchego. Hmm. Hmmm. Off to sleep.",5.0
"This is corner resturant you should visit when in Brooklyn. The eclectic menu offers a variety of fresh oysters (a must try) small plates and dinners. Experienced the heirloom tomato salad that was earthy and delicious. Also had the baked chicken with Israeli couscous/potatoes with tomato (this dish takes sometime to cook but well worth it). The meal was crisp and comfort food at its finest!This place is on point and must have, especially the chicken dish and oysters!",4.0
"Dear God, if the food in heaven could be from here, that'd be great. If you come to Brooklyn and don't eat here, you have made a huge error. EAT THE OCTOPUS",5.0
"This place has never disappointed me. I live close by and it is my go to when friends are in town. I would describe the food as farm fresh that is superbly prepared. One of my favorite plates is the ""Big Salad"" its light refreshing but also filling, perfect for summer!",5.0
"The food here was amazing. There are flavor a that we could not put our finger on but had such depth. We had the ribs, shishito peppers, big salad, chickpea dish, and fries. All had a distinctly Mediterranean flavor with a freshness that is hard to come by. My favorite was the chickpea dish. It was a fair portion and was packed with flavors that kept me wanting more.",5.0
"Alright - this place is beautiful - we noted that immediately. The cocktail ""Dark & Stormy"" was perfectly gingered for a super cold, windy night. Now, we had a terrible experience with our waiter. My roommate and I wanted to go to a cool place just for a drink and maybe a side on a Friday night (Around 9:50). Our waiter at Lighthouse was first easygoing & friendly, then solicitous and then just openly passive aggressive! He disliked us immediately when he realized we were not going to order food - just drinks and a shared dessert. We just never had such an experience anywhere else with any wait staff person. He didn't bother concealing that he was pissed! When my roommate politely asked if we could get the check - he first flatly replied ""No!"" and then finally said Yes as if we didn't actually deserve that. Perplexed - I still am - a day later.",3.0
"This place is wonderful. I've been here several times since it opened a few years ago because I can't stay away from the pickle assortment. And the pie. If you leave without trying the pie, you've made a mistake.  Recently came here with a very large group for a company dinner on a weekend evening and they really went over the top in making sure the whole meal and event was perfect from start to finish.",5.0
This place is great. Dined here 3 times now and service and food are always excellent. Get the half chicken.,5.0
"I've spent two great nights here. One was with a good friend and her mom, the other with a good guy. It was a nice, cozy setting for a relaxing night out with friends and also a great experience for a date. The food was delicious, unique and well prepared. The service was great both times. The second time, I sat at the bar. The bartender was amazing. Suggested dishes and wines to match, was extremely interesting and taught us about the different wines we tried.The venue is adorable, it is kind of a triangle in a median between two streets. Cute, rustic tables with chic decor and large window frames that made the quaint place feel larger than it is.Great place for a date or a girls night!",5.0
"Came in for dinner last night with a group of 6 in the evening around 9pm. We didn't have to wait long for a table and overall we had an excellent experience.  The wait staff were friendly and one gentleman in particular recommended some great wine for the table. Every dish was really exceptional. Between all of us we had the ceviche, brussel sprouts, tortilla soup (specials menu), skirt steak and short ribs (specials). Had a great evening! Thank you to everyone at Lighthouse :)",5.0
Went for brunch on Sunday. Food was pretty good. Lack of two stars because of service.,3.0
Supergood always. Everything tastes fresh and homemade and slightly different than the usual. And nice staff.,5.0
"I have only been here for the dinner and will come back to try brunch ( there is still some hope left there). The service and ambiance  were great-- they let our large party hang out well after we paid and kept refilling our waters (very European, not typical for NYC). The food was disappointing-- we ordered a bunch of the veggie plates and they were not seasoned well. The sauces were underwhelming, but the saving grace was the fennel for me. My friends ordered the chicken and they were very happy with it, so if you are a meat eater, check this place out. The drinks were solid and they had a lot of options.",3.0
"I absolutely love this restaurant for brunch & for dinner. It's so chill for groups or on a date. I consistently have the tastiest meals- everything is so fresh, inventive, and healthy. The staff is incredible, love the owners, wait staff, and bartenders. Everyone has a smile & is super helpful. Love to Nama & Rob last night for a killer dinner!Such a great spot in Williamsburg",5.0
"Easily my favorite restaurant in Brooklyn, I've visited dozens of times and have never been disappointed (which is quite a feat for any restaurant). The food is fresh, seasonal, delicious and most of all tastes like it is prepared with love. The staff is warm, welcoming, and professional, hitting the perfect balance between a casual and fine dining experience. I find myself returning again and again, and whether it's dinner, brunch or lunch I always know I'm going to leave happy. I can't recommend then highly enough, you'll be glad you went. And you have to try the Pa Pie...",5.0
"Alright - this place is beautiful - we noted that immediately. The cocktail ""Dark & Stormy"" was perfectly gingered for a super cold, windy night. Now, we had a terrible experience with our waiter. My roommate and I wanted to go to a cool place just for a drink and maybe a side on a Friday night (Around 9:50). Our waiter at Lighthouse was first easygoing & friendly, then solicitous and then just openly passive aggressive! He disliked us immediately when he realized we were not going to order food - just drinks and a shared dessert. We just never had such an experience anywhere else with any wait staff person. He didn't bother concealing that he was pissed! When my roommate politely asked if we could get the check - he first flatly replied ""No!"" and then finally said Yes as if we didn't actually deserve that. Perplexed - I still am - a day later.",3.0
"This place is wonderful. I've been here several times since it opened a few years ago because I can't stay away from the pickle assortment. And the pie. If you leave without trying the pie, you've made a mistake.  Recently came here with a very large group for a company dinner on a weekend evening and they really went over the top in making sure the whole meal and event was perfect from start to finish.",5.0
This place is great. Dined here 3 times now and service and food are always excellent. Get the half chicken.,5.0
"I've spent two great nights here. One was with a good friend and her mom, the other with a good guy. It was a nice, cozy setting for a relaxing night out with friends and also a great experience for a date. The food was delicious, unique and well prepared. The service was great both times. The second time, I sat at the bar. The bartender was amazing. Suggested dishes and wines to match, was extremely interesting and taught us about the different wines we tried.The venue is adorable, it is kind of a triangle in a median between two streets. Cute, rustic tables with chic decor and large window frames that made the quaint place feel larger than it is.Great place for a date or a girls night!",5.0
"Came in for dinner last night with a group of 6 in the evening around 9pm. We didn't have to wait long for a table and overall we had an excellent experience.  The wait staff were friendly and one gentleman in particular recommended some great wine for the table. Every dish was really exceptional. Between all of us we had the ceviche, brussel sprouts, tortilla soup (specials menu), skirt steak and short ribs (specials). Had a great evening! Thank you to everyone at Lighthouse :)",5.0
Went for brunch on Sunday. Food was pretty good. Lack of two stars because of service.,3.0
Supergood always. Everything tastes fresh and homemade and slightly different than the usual. And nice staff.,5.0
"I have only been here for the dinner and will come back to try brunch ( there is still some hope left there). The service and ambiance  were great-- they let our large party hang out well after we paid and kept refilling our waters (very European, not typical for NYC). The food was disappointing-- we ordered a bunch of the veggie plates and they were not seasoned well. The sauces were underwhelming, but the saving grace was the fennel for me. My friends ordered the chicken and they were very happy with it, so if you are a meat eater, check this place out. The drinks were solid and they had a lot of options.",3.0
"I absolutely love this restaurant for brunch & for dinner. It's so chill for groups or on a date. I consistently have the tastiest meals- everything is so fresh, inventive, and healthy. The staff is incredible, love the owners, wait staff, and bartenders. Everyone has a smile & is super helpful. Love to Nama & Rob last night for a killer dinner!Such a great spot in Williamsburg",5.0
"Easily my favorite restaurant in Brooklyn, I've visited dozens of times and have never been disappointed (which is quite a feat for any restaurant). The food is fresh, seasonal, delicious and most of all tastes like it is prepared with love. The staff is warm, welcoming, and professional, hitting the perfect balance between a casual and fine dining experience. I find myself returning again and again, and whether it's dinner, brunch or lunch I always know I'm going to leave happy. I can't recommend then highly enough, you'll be glad you went. And you have to try the Pa Pie...",5.0
"Love this place. Solid cocktails, good atmosphere. Usually not over-crowded.",5.0
"I miss this neighborhood gem! Sweetest people ever run it and food is top notch.My favorites are the skewers, the breakfasts and the salads. Drinks are also tops",5.0
The service is great.Loved sitting outside on a breezy summer night.Go for the mussels. It's like a second meal when you get to eat the potatos and broth at the bottom.,4.0
"Nothing crazy special about the menu, but they do their cheeseburgers right. Fries were legit, too. Sit at the bar. Cocktails were gross.",3.0
"WHAT AN AWFUL EXPERIENCE. There were a few problems. First, the service was horrendous. I waited 15 minutes for the waiter to bring me ketchup for my rather basic tasting cheeseburger and fries. Second is the quality of food. Not only was my meal subpar, leaving much to be desired, but my friend's Pasta dish lacked flavor and was portioned for a five year old after a midday snack. Lastly, upon trying to pay for our meal, we were informed that ""their system was down and they couldn't take card-only cash"". Would have been nice to know that BEFORE we sat down to eat our mediocre meal served at a roaring snails pace. I wouldn't recommend Lighthouse to anyone, not even my worst enemies and I promised myself as I left the restaurant that I would never, ever go back.",1.0
Great dollar oyster happy hour. Fantastic fries. Brunch is perfection. And plenty of outdoor seating!,5.0
Underwhelming and Overpriced.  Lighthouse is yet another example of a soulless Williamsburg bar/restaurant.  The menu is not cohesive and there was not one thing on it that I wanted.  I got a 14 dollar salad that was somehow overdressed but yet had no flavor.  The service (except for guy who brought my food) was not good. The staff would go out to smoke and then come back in so that I was inhaling their smoke smell while eating my shitty salad.  wont' be back.,2.0
"A friend who frequents lighthouse all the time finally look me so I could experience it for myself. He always has great things to say, and that is saying something, since he is a cook himself and can be critical.Lighthouse seems to be a very neighborhood type place. It's warm, inviting, and the interior really seems to speak to you: ""please, come in, enjoy yourself."" There is a bar area with lots of seats and small tables, mostly with bench seating. The cocktails here are not to be missed. Their old fashioned is top notch, one of the best I've had. I can't say I tried other cocktails, but they were gulped down without hesitation by others.The menu isn't large, but there is lots of variety. Oysters, small appetizers, some salads that were mostly vegetarian, some larger dishes like a half chicken with israeli couscous (what I ordered), a quarter pounder burger on a sesame seed bun (not big, but with a few sides, plenty of food). It doesn't come with fries. Most of the food and dishes here are meant to be on the side of more healthful and balanced. No fat on fat food here.The cauliflower side and broccali rabe were awesome. The chicken is so moist and awesome and the couscous is crisp from the skillet it's served in.After you are done eating your main courses, get the pa pie. Just do it, don't ask questions, do not pass go, do not collect your $200. It's like the momofuku crack pie, but better. Pecan pie minus the pecan part and with a side of a hybrid creme fraiche/sour cream. The prices are reasonable, the staff is warm and friendly,  and everything I tried was awesome.",5.0
Awesome atmosphere. Bumped into this gem while exploring the hood for graffiti. Very hipster-cool. Fantastic wait staff (James M rocked). The big salad did not disappoint. Total yum.,5.0
"Food is exceptional, atmosphere is great, service is stellar, their staff is really sweet and knowledgable. One of my favorite places in BK. Ps. Do yourself a favor and order the pa pie for dessert.",5.0
"Love this place. Solid cocktails, good atmosphere. Usually not over-crowded.",5.0
