Fantastic food ! Great menu! Lovely atmosphere and great decor and design . High quality cocktails !! Never a let down at this charming spot !,5.0
"I've been there twice and great food and vibe. The cheeseburger and the pulled pork bacon muffin special were amazing. It's one if those more understated places I find, and a great option for the area.  Can't wait to go back again.",5.0
"The burger and the chilequiles which me and my friends had are both very delicious and satisfying meals, I think a good value for money.The place itself is well lit during the day, not too crowded or loud, perfect atmosphere for a relaxed brunch.I would've given this place a 5 star, if not for the service.The 2 meals that my friends ordered (one of which was a burger) arrived at least 20 minutes before my burger arrived, even though we ordered them together. By the time my burger arrived they already were long past their meals. They clearly realized that they forgot about my order by the time the other ones were ready. We noticed BTW that the same thing happened at other tables. So there's a clear problem with meal tracking and general organization.The waiters were nice, but there was a strong feeling that there was not enough of them. Between ordering meals, drinks, check or just about anything it took them usually at least 15 minutes to approach us. We wound up spending much more time there then we expected for a meal and 2 drinks.The only reason I'm considering going back there is because the burger was so good. I'm hoping that this disorganization was a one time thing and not systemic, and that the managers realize that such issues drive customers away.",3.0
"Having walked past a couple of times I finally stopped in for a drink last night & very glad I did. This place was made for warm summer evenings. I didn't try the food but it looked great. Basically I just fell in love with the feel of the place - chilled out, warm & inviting what more could you want on a relaxed sunday evening?!I will definitely be back",4.0
"Shit was beat. We were the only table in the restaurant. Ordered some oysters and dude put in the order literally 15 minutes after ordering - how do I know this? Because I came up to the bar to ask if the oysters had to be cooked and I saw that they had JUST STARTED putting them on ice. Did I mention that we were the only table? The ""chefs"" were chilling talking shit. Finally the oysters arrived. We had no water, and no utensils. We asked for the check and he didn't come grab it until I stoop up to remind him that we were ready. There was an UP charge for my UP Manhattan. Fucking blowing it. Oysters were yummy though, hence the one star!",1.0
Someone is cooking with Lots of love at this lighhouse.Food is fresh and Lots of FlavorI love it!!,4.0
"Ive had literally everything on the menu and tell everyone about this place. Its my goto spot, they have everything i want and need.  Nama and Assaf, the sister/brother duo behind the restaurant, are great people as well, theyve made a fantastic restaurant that is by far the best in the area. The cocktails, the food, its all all outstanding. You need to go to there, often.",5.0
"I love that you can walk in and almost always get a table right away. I love that they have healthy and delicious options on the menu, a beautiful salad, a great quinoa dish. This is my go-to place in the hood and I rue that day that it is eventually ""discovered"" and mobbed by the hordes (already kinda happening actually)  My only qualm is they sometimes play very loud club music at brunch time which makes it hard to talk, even to one person sitting across the table from you. Don't know why they do that...",4.0
"Borinquen Place is a stretch of road in South Williamsburg that is still a bit nascent like Bushwick.  It is what would be Grand st if it did not veer off, heading straight for and then bisected by the BQE.It feels like WillyB back in 99 or 2000.  That's really what it was like folks.  No fancy places, just few bodegas, and that's it.Lighthouse is a new addition to the block at the corner of Keap.  I stopped in here with a friend for a cocktail, and boy did they deliver.I had a foggy dog, birds eye infused Plymouth Gin, fresh grapefruit and salt.  And spicy, I'm tellin ya!  Definitely hit the spot, and the place is super chill.  Few people eating dinner, and a few at the bar, good spot to warmup the night with.",4.0
"This place is inviting, delicious and the service is great!I'll start off with drinks;  Their cocktail list is unique and inventive and best of all they're really good.  Decent wine list too.The menu is perfect for the size of this place; it's diverse and allows for sharing and trying out all the flavours they have to offer.  Do not underestimate the sides, they are delicious - forget any preconceived notion you may have about brussel sprouts, they're amazing here, as is the side of broccolini, potatoes...  Take your time looking a the menu, ask for help the staff likes that.  You can create your own meal because they have skewers of fish and various other proteins, but they are small portions, but if you pair it with a side then you're set!  The salads are inventive and delicious.  The pickle platter is a wonderful starter share plate.  Always ask about the specials if you haven't been told about them.  The food is just so fresh, fun and just exquisite!  The one and only criticism I have is that the burger is so thin that asking how you'd like it prepared is useless, as such a thin patty will cook right through every time.  But that's not to say to not try it out, it's really quite delicious.  Just make sure to get a side with it. Unless you're a lade then the burger alone just might do.Oh and the music got bizarre towards the end, it made me want to leave, fast.  Dubstep is not eating music, actually it's not even music so don't!All in all the quality, preparation and presentation of the food is amongst the best in the city.",5.0
"Living above the Lighthouse has made it all too convenient for my fiance and I to avoid cooking at least once a week.  We're fortunate to live in such close proximity to an incredible restaurant.  We have tried most of the things on their menu, and many specials, and have literally never been disappointed.   Some favorites include The Big Salad, chicken skewer, any steak they ever make and the Pa pie.  Definitely get the Pa Pie. While we love to order pick up, the laid back atmosphere,spot-on old fashions, and kind service keeps us downstairs.",5.0
"I've been there twice and great food and vibe. The cheeseburger and the pulled pork bacon muffin special were amazing. It's one if those more understated places I find, and a great option for the area.  Can't wait to go back again.",5.0
"The burger and the chilequiles which me and my friends had are both very delicious and satisfying meals, I think a good value for money.The place itself is well lit during the day, not too crowded or loud, perfect atmosphere for a relaxed brunch.I would've given this place a 5 star, if not for the service.The 2 meals that my friends ordered (one of which was a burger) arrived at least 20 minutes before my burger arrived, even though we ordered them together. By the time my burger arrived they already were long past their meals. They clearly realized that they forgot about my order by the time the other ones were ready. We noticed BTW that the same thing happened at other tables. So there's a clear problem with meal tracking and general organization.The waiters were nice, but there was a strong feeling that there was not enough of them. Between ordering meals, drinks, check or just about anything it took them usually at least 15 minutes to approach us. We wound up spending much more time there then we expected for a meal and 2 drinks.The only reason I'm considering going back there is because the burger was so good. I'm hoping that this disorganization was a one time thing and not systemic, and that the managers realize that such issues drive customers away.",3.0
"Having walked past a couple of times I finally stopped in for a drink last night & very glad I did. This place was made for warm summer evenings. I didn't try the food but it looked great. Basically I just fell in love with the feel of the place - chilled out, warm & inviting what more could you want on a relaxed sunday evening?!I will definitely be back",4.0
"Shit was beat. We were the only table in the restaurant. Ordered some oysters and dude put in the order literally 15 minutes after ordering - how do I know this? Because I came up to the bar to ask if the oysters had to be cooked and I saw that they had JUST STARTED putting them on ice. Did I mention that we were the only table? The ""chefs"" were chilling talking shit. Finally the oysters arrived. We had no water, and no utensils. We asked for the check and he didn't come grab it until I stoop up to remind him that we were ready. There was an UP charge for my UP Manhattan. Fucking blowing it. Oysters were yummy though, hence the one star!",1.0
Someone is cooking with Lots of love at this lighhouse.Food is fresh and Lots of FlavorI love it!!,4.0
"Ive had literally everything on the menu and tell everyone about this place. Its my goto spot, they have everything i want and need.  Nama and Assaf, the sister/brother duo behind the restaurant, are great people as well, theyve made a fantastic restaurant that is by far the best in the area. The cocktails, the food, its all all outstanding. You need to go to there, often.",5.0
"I had been here before & got amazing flank steak skewers, pickles, and a cocktail at a bar with a friend. It was chill vibes, albeit pretty expensive, but I enjoyed doing something different for meeting up for drinks. I have never been for dinner proper though.I went back recently--late night--hoping the kitchen was still open (it wasn't) so my friend and I decided to stay around for a drink. First off, the bartender hardcore botched our cocktails, like maybe accidentally poured the wrong ingredients in there? The already too-expensive cocktails were more expensive than menu price because of ""tax""--which could be totally-legit-them-paying-taxes & me-not-knowing-tax-laws but I don't know anywhere in NYC that charges tax at the bar, esp. when they aren't serving any food at the time. Lastly, the music was so so so so so so so bad. The vibe made me feel like at any moment I might be murdered. Ugh.So, maybe I will come back for dinner at some point to get a proper steak, but if you go after hours... well, godspeed.",3.0
Stupid. Overpriced. Went to Sunday brunch here and they were out of a lot of classic items. They had potatoes but no fries. WTF? I got the grilled cheese but there was no cheese to be found and the crust was burnt. My friend got a mimosa but it arrived with a big fly in it. The side salad didn't have lettuce. It was made of Italian and and regular parsley.,1.0
"Tucked away past the busier streets of Williamsburg, this restaurant is a gem with good service and really tasty food. It was the perfect location for a birthday party for my friend as there are large and welcoming communal tables but in an intimate setting. The cocktail and wine list is comprehensive and the food is like more delicate and curated gastropub fare, such as beautifully arranged plates of pickled vegetables, garlic baguette bread and not to be missed oysters.",4.0
"Lighthouse could not have been better named - lofty, floor-to-ceiling, west-facing window sheets color early afternoon brunch bright and warm. As an evening bar situated at the triangular apex of Borinquen Place, it's a literal beacon, beckoning softly to Bushwick: ""I may be new, but I'm not a child of post-gentrification Williamsburg. I'm East-meets-West. I straddle the past and the future.""Which would be true - there's minimal pretension and maximum good, friendly service abound in this rustic, spacious cafeteria. Food is a palatable ~$10-$20 (and of decent, if not extraordinary quality); cocktails are well-prepared. There was a DJ this past Sunday morning, which was weird, but inoffensive. Add this one to the repertoire, kids.",4.0
"Overpriced and nothing special.  Lovely place and friendly staff but the venue is deceptive in terms of the quality of the food you get. Had the cheeseburger.  The bun was stale. Friend had the grilled cheese. Pretty standard but for a hefty price tag. They seem to do a few dishes well, everything else is just thrown into the mix. Better options for similar / less price in the area. Won't return here though to be honest. I felt ripped off when the bill came.",3.0
"Following a similar playbook to St. Anselm - foods grilled simply and packed with massive flavor - Lighthouse is likely to go the route of that other Williamsburg destination soon enough.  Meaning, I can't believe I even got a table on a Friday night.The abbreviated menu has all you need for a great meal -  raw oysters, fresh, daring salads, several types of pickles, four delicious sides (the brussels sprouts, tinged with bleu cheese, and the cauliflower, were both excellent), and, of course, the meat.  There's a whole fish, lamb, a sirloin, and a pork.  The grass-fed sirloin was lean and flavorful; the lamb less lean but even more flavorful. For dessert, a chocolate torte, not oversweet, totally delicious.Overall I would rank everything but the meat dishes of Lighthouse above St. Anselm, which isn't to say the meat isn't quite good - it's just not quite on the level of St. Anselm.  However, it also seems a bit healthier.  There is a solid list of cocktails and a well-edited, and reasonably priced, wine list that focuses mostly on Europe, as it should to keep the value strong.I'm hoping that this being on the ""other"" side of the BQE means it can remain a local favorite for awhile, before Manhattan's hordes get to it!",5.0
"I arrived earlier in the afternoon from San Francisco without a solid dinner plan.  We found an airbnb loft type spot the night before.  We walked around the neighborhood and nothing really grabbed us.  This place caught our eye from across the street as there are windows on one entire side of the building.  Upon entering we were greeted with smiles.  We grabbed seats at the bar.  The crew on staff instantly made us feel comfortable!  We ordered pan seared bass and the big salad, planning to split the two.  This was perfect portions for the two of us.  Although I don't drink alcohol my sister ordered a stout plus a glass of white wine.  What a gem to stumble upon.",5.0
"I discovered the Lighthouse with my husband a couple of years ago and it instantly one of our favorite places. We have celebrated New Years Eve, birthdays, anniversaries and the purchase of our first apartment here. We have brought friends, parents, co-workers and neighbors to the Lighthouse and always had wonderful experiences. Both dinner and brunch are excellent. Lighthouse is one of the few places in neighborhood to have really great drinks  and amazing food. I can highly recommend the big salad and the chicken, the specials are always really good too. (Full disclosure) Over time we have become good friends with the owners (brother and sister, Asaf & Naama) and their staff. Nick the head chef is so talented, I could eat his food everyday of the week. The whole team is here is so welcoming and warm, Naama is literally one of the nicest people I have ever met and the most gracious host. My only hesitation is writing this review is that the Lighthouse will become too popular and we won't be able to get a table!",5.0
"So this the low down of this place...The food is really good. I mean I am still thinking about their brussel sprouts right now, every minute. In saying that.. this place is expensive and not expensive in a weird way. Let me explain: All the sides are 5-6 bucks and the steak/chicken skewers are 5 bucks. The sides are large and shareable along with the skewers. So when I usually go there with friend/friends we order sides (big!!) with some skewers for each of us which comes with a yogurt sauce to die for. For some reason, the entrees jump to 28-30 dollars. Nothing in between.But in all honesty, the sides are amazing and so tasty. The wine is 8-11$ glass and the beer around 6$.The space is beautiful and I really like the music (they play mostly vinyl).So all in all, I will come back. I do not know if I will order their entrees any time soon but I def willl go for their generous portions of their gorgeous sides.",4.0
"We had lamb, whole fish, interesting fresh cocktails, brussels sprouts, pickled rutabaga, and great service (informal and friendly, but very efficient; water glasses were refilled within moments of becoming empty). It was a 95-degree night and the place isn't air-conditioned, but the massive fans overhead and the shutters open to the sidewalk kept us cool. The music was interesting.The only downside was that we didn't realize quite how much we were eating. When we got up we were so full that we had to walk all the way across the Williamsburg bridge back to Greenwich Village... not too much fun on one of the hottest nights in history.So... order carefully because everything is so delicious that you'll probably finish it!",5.0
"I had been here before & got amazing flank steak skewers, pickles, and a cocktail at a bar with a friend. It was chill vibes, albeit pretty expensive, but I enjoyed doing something different for meeting up for drinks. I have never been for dinner proper though.I went back recently--late night--hoping the kitchen was still open (it wasn't) so my friend and I decided to stay around for a drink. First off, the bartender hardcore botched our cocktails, like maybe accidentally poured the wrong ingredients in there? The already too-expensive cocktails were more expensive than menu price because of ""tax""--which could be totally-legit-them-paying-taxes & me-not-knowing-tax-laws but I don't know anywhere in NYC that charges tax at the bar, esp. when they aren't serving any food at the time. Lastly, the music was so so so so so so so bad. The vibe made me feel like at any moment I might be murdered. Ugh.So, maybe I will come back for dinner at some point to get a proper steak, but if you go after hours... well, godspeed.",3.0
Stupid. Overpriced. Went to Sunday brunch here and they were out of a lot of classic items. They had potatoes but no fries. WTF? I got the grilled cheese but there was no cheese to be found and the crust was burnt. My friend got a mimosa but it arrived with a big fly in it. The side salad didn't have lettuce. It was made of Italian and and regular parsley.,1.0
"Tucked away past the busier streets of Williamsburg, this restaurant is a gem with good service and really tasty food. It was the perfect location for a birthday party for my friend as there are large and welcoming communal tables but in an intimate setting. The cocktail and wine list is comprehensive and the food is like more delicate and curated gastropub fare, such as beautifully arranged plates of pickled vegetables, garlic baguette bread and not to be missed oysters.",4.0
"Lighthouse could not have been better named - lofty, floor-to-ceiling, west-facing window sheets color early afternoon brunch bright and warm. As an evening bar situated at the triangular apex of Borinquen Place, it's a literal beacon, beckoning softly to Bushwick: ""I may be new, but I'm not a child of post-gentrification Williamsburg. I'm East-meets-West. I straddle the past and the future.""Which would be true - there's minimal pretension and maximum good, friendly service abound in this rustic, spacious cafeteria. Food is a palatable ~$10-$20 (and of decent, if not extraordinary quality); cocktails are well-prepared. There was a DJ this past Sunday morning, which was weird, but inoffensive. Add this one to the repertoire, kids.",4.0
"Overpriced and nothing special.  Lovely place and friendly staff but the venue is deceptive in terms of the quality of the food you get. Had the cheeseburger.  The bun was stale. Friend had the grilled cheese. Pretty standard but for a hefty price tag. They seem to do a few dishes well, everything else is just thrown into the mix. Better options for similar / less price in the area. Won't return here though to be honest. I felt ripped off when the bill came.",3.0
"Following a similar playbook to St. Anselm - foods grilled simply and packed with massive flavor - Lighthouse is likely to go the route of that other Williamsburg destination soon enough.  Meaning, I can't believe I even got a table on a Friday night.The abbreviated menu has all you need for a great meal -  raw oysters, fresh, daring salads, several types of pickles, four delicious sides (the brussels sprouts, tinged with bleu cheese, and the cauliflower, were both excellent), and, of course, the meat.  There's a whole fish, lamb, a sirloin, and a pork.  The grass-fed sirloin was lean and flavorful; the lamb less lean but even more flavorful. For dessert, a chocolate torte, not oversweet, totally delicious.Overall I would rank everything but the meat dishes of Lighthouse above St. Anselm, which isn't to say the meat isn't quite good - it's just not quite on the level of St. Anselm.  However, it also seems a bit healthier.  There is a solid list of cocktails and a well-edited, and reasonably priced, wine list that focuses mostly on Europe, as it should to keep the value strong.I'm hoping that this being on the ""other"" side of the BQE means it can remain a local favorite for awhile, before Manhattan's hordes get to it!",5.0
"I arrived earlier in the afternoon from San Francisco without a solid dinner plan.  We found an airbnb loft type spot the night before.  We walked around the neighborhood and nothing really grabbed us.  This place caught our eye from across the street as there are windows on one entire side of the building.  Upon entering we were greeted with smiles.  We grabbed seats at the bar.  The crew on staff instantly made us feel comfortable!  We ordered pan seared bass and the big salad, planning to split the two.  This was perfect portions for the two of us.  Although I don't drink alcohol my sister ordered a stout plus a glass of white wine.  What a gem to stumble upon.",5.0
"I discovered the Lighthouse with my husband a couple of years ago and it instantly one of our favorite places. We have celebrated New Years Eve, birthdays, anniversaries and the purchase of our first apartment here. We have brought friends, parents, co-workers and neighbors to the Lighthouse and always had wonderful experiences. Both dinner and brunch are excellent. Lighthouse is one of the few places in neighborhood to have really great drinks  and amazing food. I can highly recommend the big salad and the chicken, the specials are always really good too. (Full disclosure) Over time we have become good friends with the owners (brother and sister, Asaf & Naama) and their staff. Nick the head chef is so talented, I could eat his food everyday of the week. The whole team is here is so welcoming and warm, Naama is literally one of the nicest people I have ever met and the most gracious host. My only hesitation is writing this review is that the Lighthouse will become too popular and we won't be able to get a table!",5.0
"So this the low down of this place...The food is really good. I mean I am still thinking about their brussel sprouts right now, every minute. In saying that.. this place is expensive and not expensive in a weird way. Let me explain: All the sides are 5-6 bucks and the steak/chicken skewers are 5 bucks. The sides are large and shareable along with the skewers. So when I usually go there with friend/friends we order sides (big!!) with some skewers for each of us which comes with a yogurt sauce to die for. For some reason, the entrees jump to 28-30 dollars. Nothing in between.But in all honesty, the sides are amazing and so tasty. The wine is 8-11$ glass and the beer around 6$.The space is beautiful and I really like the music (they play mostly vinyl).So all in all, I will come back. I do not know if I will order their entrees any time soon but I def willl go for their generous portions of their gorgeous sides.",4.0
"We had lamb, whole fish, interesting fresh cocktails, brussels sprouts, pickled rutabaga, and great service (informal and friendly, but very efficient; water glasses were refilled within moments of becoming empty). It was a 95-degree night and the place isn't air-conditioned, but the massive fans overhead and the shutters open to the sidewalk kept us cool. The music was interesting.The only downside was that we didn't realize quite how much we were eating. When we got up we were so full that we had to walk all the way across the Williamsburg bridge back to Greenwich Village... not too much fun on one of the hottest nights in history.So... order carefully because everything is so delicious that you'll probably finish it!",5.0
