I'm the type of person who always says they are going to write a review but then never does. Except for now. I came here with a date and we were both hungry. So we ordered The brussels sprouts appetizer and also the burrata appetizer. The Brussels sprouts were delicious although it was a small portion. And the burrata...oh my goodness. It was one of the best appetizers Ive ever had. My date thought the same. So well seasoned. We both said that we would order a burrata appetizer for each of us next time. We also ordered the mushroom pizza. Also sooo delicious. Thin crust heaven.  Very light. I could've probably eaten the whole thing by myself...if I was at home..with no one watching. Can't wait to return!,5.0
"One word: SALTY!I would really give this place about a 3.5. I came here yesterday with my boyfriend, who lives in the neighborhood. We were excited that there is a new, hip place in the area and headed here when it opened (promptly) at 5:30pm. From when it opens until 7pm, the happy hour is going on - for draft beer it was $2 off, which is great! They had about 5 draft beers on the menu and about the same number in can/bottle. Excellent.Eventually we ordered the brussells sprouts and the olive pizza. The brussells sprouts were $8, and you get a VERY small amount for it. It tasted delicious, but there were probably about 4 sprouts cut in half in this portion. FOR EIGHT DOLLARS! I would say its not worth more than $6. They need to add WAY more sprouts to this dish, or lower the price. It was salty but manageable.Then came the olive pizza which also had cheese, kale and onions. From the first bite it was salty, but as you continued through it became almost unbearable. I like salty foods but this was ridiculous. I'm not sure where the extreme saltiness even came from - sure, olives are salty, but not this much! I can't get over how salty it was. Later that night after we left, both my bf and I felt sick and we think it was from the salt. BlechThe bartenders were nice, and we stayed there for about four hours and the place attracted many different people. By the time we left, it was filling up in the back. We will definitely be back for beers; if you are a cocktail drinker, the $$$ will add up here quickly. We may try one more pizza, the plain mozzerrella one just to see if its less salty. My other complaint would be the hours. They are closed Mondays but every other day they open at 5:30pm. Which during the week is fine, but shouldn't it be open more/earlier during the weekends? Especially with the warmer weather coming up.Ultimately beware of the salt lick you will experience by eating here. However lets keep visiting it so it stays open, and they have a chance to work on their menu.",4.0
"Decided to try this place for takeout one night. The staff was friendly and polite... From the person who took my phone order to the security guy seated at the door to the hostess who escorted me to the back of the bar to pick up my order. However... My lamb sausage pizza was subpar. The crust was too soft and the lamb sausage was too salty. I let a friend try it to get a second opinion and he wasn't enthused either. The best part of the pizza were the caramelized onions.  Maybe I'll return to try another pie, maybe I won't... *kanye shrug*",2.0
"Came here for a cast party and had a great time.There's a guy at the door welcoming you as you enter and really went the extra mile by coming over to small talk and make you  feel comfortable. We ordered a pepperoni pizza which was only $12. It was thin and tasty, but don't expect a huge pie ! (Big enough for two people to share )The barista's were happy to adjust their orders to what you wanted also. Parkside has great customer service!Parkside also has great music taste and add a suitable volume where you're not screaming to the person next to you.  The bar it is dimly in a good way    And has plenty of seating . Overall I would come back and I recommend others to try this bar. :) Get yo draaaaank on.",5.0
"Seriously love this place!It was my first, and definitely not my last time coming here, last night. It's been bookmarked for months and I finally got a chance to come here. It's hard to get parking nearby if you are driving and if you do, it's pretty tight, so beware. It is very easy to get to as there is a bus stop (B41) right next to the establishment.  I met up with my good friend to have a drink and some good food in our neck of the woods. The ambiance and lighting are wonderful. Kind of out of place for the neighborhood lol, but nonetheless, needed and a nice addition. You can tell the neighborhood is right in the thick of the gentrification process.We sat at the bar which has a lovely selection of cocktails and knowledgeable and friendly bartenders, who we were greeted by upon entering. There is a ""guard"" standing inside by the entrance to help weed out those that are not welcome. (Two homeless people tried to get in and ask patrons for money, which was quite uncomfortable but not really the restaurant's fault) They do their best to make sure it does not escalate. Even with all that, this place is a gem. Let me get into the food.My friend and I both ordered pizzas. They are oven style and large! The size of the pizzas when they came out really intimidated us and we thought we could have and should have ordered 1 to share, but half-way through our dishes, we realized the pizzas have a very thin crust so even someone as tiny as me can eat the whole thing in one sitting, which I did ;)I ordered the Mussels Pizza and my friend ordered the Mozzarella. Both were FREAKING DELICIOUS!! We pretty much wolfed them down. The mussels were perfectly cooked and every ingredient on the pizza was fresh and flavorful. You could taste every ingredient! Really awesome stuff. They have other items on their menu that do not include pizza, which is great. I will be coming back to try out some of their other dishes. For drinks, my friend had the Williams Colliins and I had the Good Vibrations. Each was $12 and tasted pretty good. I do wish they had a happy hour time slot though :( Would have been even better to have discounted drinks :)We had a great time talking the night away with the ambiance, lighting, excellent food, and great drinks. This place really is a gem! I cannot wait to come back. Really satisfied and highly recommend Parkside.",5.0
"The pizza is cool the trendy Euro-Italian version in this case with a bit too much sauce, the dim light is nice, the furniture a bit bulky maybe easier to clean, the plain wall maybe because it is new, the music.......ouch. Elton John's ""I guess That's Why They Call it the Blues"" was just one of the many out of place choices that reminded of bad radio in bum-f.ck Connecticut.",3.0
"Short Review - the ambience is nice and rustic. The staff is very attentive and friendly. The pizzas were amazing (Get the Lamb Sausage), didn't really care for the drinks. Definitely a great spot and I will be back again.Long Review -  Me and my girlfriend came here on a Wednesday night around 7pm. It was about half full, so we were seated right away. I didn't see if they had more seating in the back, but there were about 30 seats that I saw, including the bar. So the restaurant might be on the smaller side, I'll check to see if there is more seating next time I go. I really like the decor, the parties are seated kind of close together, but still feels very intimate at the same time. For drinks, I had the Jungle Bird, which was supposed to have pineapple, lime, Campari and rum, but I got all Campari (which is pretty bitter). My Girlfriend got the Fancy Free (which was mostly bourbon, so that was a win for her lol) I would try some of the other drinks to see how they come out.I do wish the menu had more option like some of the other pizza places I've been to, but the pizzas we ended up ordering both tasted amazing. I ordered the Lamb Sausage, my girlfriend ordered the Mussels. The dough is on the lighter side, really thin with a really nice crispness too it. All the ingredients on both pizzas melded together really well. Overall an amazing experience. I would definitely recommend this place.",4.0
"Pizza is tongue satisfying. Artisan if you will. You could eat a whole one to yourself and be satisfied. Pepperoni was very good. Lamb more satiating, cheesier. Both very distinct.Ambience is cool!Food service unbearably slow. Several tables in the same predicament. Don't waste your night sitting, waiting 40 minutes for your order to come out. They need to move faster. Not sure we'd come back due to the slow food service.",3.0
"It's a hit! Quaint, relaxed ambiance, accommodating staff,  well thought out antipasto & pizza menus, cocktail, beer wine list! brick -oven Lamb sausage  pizza is a must;Ask about specials, incl Polenta with beef bolognese sauce",4.0
"Yes! As a resident of PLG I am ecstatic about this place. We are in desperate need of bars and restaurants and this is a great addition. The pizza is out of this world!! I dare say it's even better than Barboncino in Crown Heights, my previous favorite pizza close to my house. Ive had the mushroom pizza and it was amazing, very flavorful, made with great ingredients with care and purpose. The wait staff is well trained and attentive, the drinks are good. The prices are a bit high. $14 for mushroom pizza, but it's well worth it. The house wine is pretty good too! They need to work a little on decor and fill the empty peach colored walls with some art, but other than that this place is great!",5.0
"Good pizza - had the mushroom and it had a nice depth with the shredded cheese on top - a musty flavor if that makes sense. The sauce was nice too, a little tangy but still good. And perfect crust, although a little thin on the center of the pizza, almost to the point of the mushrooms coming through the dough. Good flavor on the mushrooms, which were I believe porcini? The temperature was a little too cold for my taste - I like pipping hot pizzas so I can smell the aroma before digging in. Good vibe - simple spot - we sat at the bar and had a Koelsch beer. A little pricey but that's where the neighborhood is going.",4.0
"Just opened! Owners are super nice. Drinks are delicious and interesting. The beer selection is good, but the cocktails are what's up.Food selection is good with antipasti and really tasty pizzas. We went with traditional pepperoni and were not disappointed.",5.0
"An unexpected and surprising addition to Prospect Lefferts Gardens. (PLG) Prior to Parkside, there were three ""italian"" restaurants in the immediate community. All three were similar in atmosphere, single slice pizza and a borderline fast food experience, a needed niche. Parkside breaks through and provides a unique Italian dining experience to PLG. The stylish interior is complimented with low lighting and a clean display of food and drink options. The menu offers a perfect selection of food without being overwhelming. My girlfriend and I enjoyed two sides, as a starter: -Meatballs and -Brussel Sprouts. Both arrived in clean white dish-ware. The Brussel Sprouts were delicious but the meatball was phenomenal. For our entrée we split their -Pepperoni Pizza. The pizza was fresh and incredibly flavorful. Left us both very full. We will certainly be back for more.",5.0
"A friend and I went for an early dinner and drinks on a weeknight. Place was really crowded by the time we left, but got excellent, quick service when we sat at the bar. Not too many beers, but the bartender let me try some that I had never heard of. We split two pizzas between us and it was a good amount of food. Crust was crispy, ingredients were fresh, and the pizza was tasty. Overall, a very good experience.",4.0
"Good healthy/clean pizza for a $12 potato pizza.  it was salty in a good way and wasn't drowning in tomato sauce like other pizza.  We also ordered the brussels sprout that came with a very good white sauce/puree.  It's a good local place, but they only have pizza and appetizers.  They will need to make a few more dish if you want to come back here all the time.",4.0
"Wood/brick oven pizza combined with craft cocktails, what more could you ask for!!! To start we had the crostini which in my opinion was the best I've ever had. The ricotta cheese with olive oil and sea salt made it really stand out and was a great addition to the fresh bread. For pizzas we had a traditional mozzarella, and the lamb sausage which was great.Now onto the cocktails. I recommend the junglebird and the conjugal visit. The jungle bird reminded me of a spiced punch and the conjugal visit had great flavors of honey,strawberry and Coconut. The staff were very friendly and the whole place just had a great relaxed vibe. Can't wait to visit this spot when I'm in the area again!",5.0
I couldn't resist so I went back to my new favorite restaurant PARKSIDE. Just as before the owners/staff were so nice! This time I tried the pepperoni and it was delicious. People near and far come meet this great group of people and eat their tasty pizza. Oh and the drinks on the money. GOOD!!,5.0
Went here on a date tonight A+ drinks and mozzarella pizza.  I met the owner and was completely blown away that he was my bartender which shows he is still all about the people.  I will definitely be back.,5.0
"Nice new addition to the neighborhood. Was excited about this place opening as we need more restaurants in the PLG area. Durning my second visit, we decided to have pizza. The lamb sausage pizza is good, however the pepperoni is not. It's bland and compares most to a Little Johns pizza if you will. Disappointing but it is just pizza, right? The pizzeria across the street makes a much better pepperoni slice. This place serves ""specialty"" cocktails which means small off the wall cocktails for $12.00, but they don't pack a punch and lacks vodka which I find odd. I think this place has potential but needs to find its comfort zone. They need to have a better wine selection and maybe introduce more veggies and a salad or two ! Secondly, a better DIVERSE playlist would be appreciated considering the neighborhood surrounding is predominantly West Indian and is pretty mixed.  I frequent the few restaurants/bars in the neighborhood and Parkside will be my third go to for now. I wish them luck in finding their footing.",3.0
"Excellent mussels pizza, lovely ambiance and cool hOwner.  Definitely one of the best pizza I had.",4.0
"Good pizza - had the mushroom and it had a nice depth with the shredded cheese on top - a musty flavor if that makes sense. The sauce was nice too, a little tangy but still good. And perfect crust, although a little thin on the center of the pizza, almost to the point of the mushrooms coming through the dough. Good flavor on the mushrooms, which were I believe porcini? The temperature was a little too cold for my taste - I like pipping hot pizzas so I can smell the aroma before digging in. Good vibe - simple spot - we sat at the bar and had a Koelsch beer. A little pricey but that's where the neighborhood is going.",4.0
"Just opened! Owners are super nice. Drinks are delicious and interesting. The beer selection is good, but the cocktails are what's up.Food selection is good with antipasti and really tasty pizzas. We went with traditional pepperoni and were not disappointed.",5.0
"An unexpected and surprising addition to Prospect Lefferts Gardens. (PLG) Prior to Parkside, there were three ""italian"" restaurants in the immediate community. All three were similar in atmosphere, single slice pizza and a borderline fast food experience, a needed niche. Parkside breaks through and provides a unique Italian dining experience to PLG. The stylish interior is complimented with low lighting and a clean display of food and drink options. The menu offers a perfect selection of food without being overwhelming. My girlfriend and I enjoyed two sides, as a starter: -Meatballs and -Brussel Sprouts. Both arrived in clean white dish-ware. The Brussel Sprouts were delicious but the meatball was phenomenal. For our entrée we split their -Pepperoni Pizza. The pizza was fresh and incredibly flavorful. Left us both very full. We will certainly be back for more.",5.0
"A friend and I went for an early dinner and drinks on a weeknight. Place was really crowded by the time we left, but got excellent, quick service when we sat at the bar. Not too many beers, but the bartender let me try some that I had never heard of. We split two pizzas between us and it was a good amount of food. Crust was crispy, ingredients were fresh, and the pizza was tasty. Overall, a very good experience.",4.0
"Good healthy/clean pizza for a $12 potato pizza.  it was salty in a good way and wasn't drowning in tomato sauce like other pizza.  We also ordered the brussels sprout that came with a very good white sauce/puree.  It's a good local place, but they only have pizza and appetizers.  They will need to make a few more dish if you want to come back here all the time.",4.0
"Wood/brick oven pizza combined with craft cocktails, what more could you ask for!!! To start we had the crostini which in my opinion was the best I've ever had. The ricotta cheese with olive oil and sea salt made it really stand out and was a great addition to the fresh bread. For pizzas we had a traditional mozzarella, and the lamb sausage which was great.Now onto the cocktails. I recommend the junglebird and the conjugal visit. The jungle bird reminded me of a spiced punch and the conjugal visit had great flavors of honey,strawberry and Coconut. The staff were very friendly and the whole place just had a great relaxed vibe. Can't wait to visit this spot when I'm in the area again!",5.0
I couldn't resist so I went back to my new favorite restaurant PARKSIDE. Just as before the owners/staff were so nice! This time I tried the pepperoni and it was delicious. People near and far come meet this great group of people and eat their tasty pizza. Oh and the drinks on the money. GOOD!!,5.0
Went here on a date tonight A+ drinks and mozzarella pizza.  I met the owner and was completely blown away that he was my bartender which shows he is still all about the people.  I will definitely be back.,5.0
"Nice new addition to the neighborhood. Was excited about this place opening as we need more restaurants in the PLG area. Durning my second visit, we decided to have pizza. The lamb sausage pizza is good, however the pepperoni is not. It's bland and compares most to a Little Johns pizza if you will. Disappointing but it is just pizza, right? The pizzeria across the street makes a much better pepperoni slice. This place serves ""specialty"" cocktails which means small off the wall cocktails for $12.00, but they don't pack a punch and lacks vodka which I find odd. I think this place has potential but needs to find its comfort zone. They need to have a better wine selection and maybe introduce more veggies and a salad or two ! Secondly, a better DIVERSE playlist would be appreciated considering the neighborhood surrounding is predominantly West Indian and is pretty mixed.  I frequent the few restaurants/bars in the neighborhood and Parkside will be my third go to for now. I wish them luck in finding their footing.",3.0
"Excellent mussels pizza, lovely ambiance and cool hOwner.  Definitely one of the best pizza I had.",4.0
"Love park side! The pizza is delish, the potato is my favorite and they always have amazing specials (try the warm kale salad or the Brussels sprouts). Plus they have amazing cocktails and cute bartenders",5.0
"Great new spot! Great pizza, drinks, sides, service, kid friendly- delighted to have this in the neighborhood.",5.0
"I live in this neighborhood.  While it is coming up and more exciting places are opening, the last thing I would normally have said we needed was a pizzeria.  This is no ordinary pizza spot.  In fact, it is more of a bar that serves brick oven pizza - as if the pizza part of the business model was just to enhance the bar concept.  The pizzas are created by Park Slope favorite ""Franny's"" chef.  In that knowledge I knew these weren't gonna be lacking.  THEY ARE AMAZING and well priced for what they are - 12"" pizzas for $10-$14.  Not bad.The pizza and antipasti items are the only things on the menu.  Again this is more of a cocktail lounge that serves pizza - a very nice marriage that could start a new trend - the pizza bar.",4.0
"I went here on Valentine's Day, because being single, I find a good meal is good comfort. I got the lamb sausage pizza and later the meatballs.  All was excellent.  A little pricey, but given the neighborhood is changing this is to be expected.  They have a nice rotation of beers though I think they rotate different flavors so if you have a favorite it may not be there.  They also have many cocktails too, if you like that.  The environment is very ambiant and the service is great.",5.0
"Very pleased. Nice, neighborhood-y vibe so far. Definitely trying to be upscale (copper countertops, exposed-filament bulbs, more than one type of fancy bitters) but also sensitive to PLG prices.Highly recommend the fresh ricotta crostini. So happy to have them in the neighborhood!",5.0
"If mixology, fresh ingredients, and quality service are important to you there's really no other choice. The ambiance is wonderful. The staff are friendly and attentive. I don't post on Yelp very often, but I can tell the owner takes pride in ""getting it right"" and I appreciate that. I went for the first time last night with a friend for cocktails and the pepperoni pizza and everything was delicious. As a Flatbush native/4 year Lefferts Garden transplant, I'd say PARKSIDE is a refreshing addition to the neighborhood. Can't wait to go back.",5.0
"Been here 4 times in the last few weeks- small menu, but perfect for what's offered. Love the burrata, meatballs and pepperoni pizza (with mushrooms added ofcourse). Billy, the mixologist is an awesome mixologist- the jungle bird is my go to, though everything is delicious. Great addition to the area. See you there!!!",5.0
"I just had to update my review to be more specific, since i just had an EXCELLENT experience there (...and pretty much every week for the past few months, ha). But this place is really coming into its own. Any awkward growing pains that happen from a restaurant's recent opening have been overcome. previously it had seemed like there might have been an understaffed kitchen (read: one guy cooking all the pizzas) but now there seems to be some help back there; the pies come out hot and flawless. Also, this is a place that always changes and expands the menu! Specials sometimes get added to the permanent repertoire depending on how awesome they are (like the bresaola pizza--with a light sprinking of fresh horseradish!). I always try to order a special when i can, because i am often pleasantly surprised. Also, i've learned a new appreciation for the Reverent cocktail after speaking with the excellent knowledgeable bartender--I'm no abstinthe fan, but it turns out an absinthe rinse is just the touch of unusual tastiness your cocktail needs. More over, the soundtrack is always varied but tasteful, ranging from old school reggae to instrumental covers of sam cooke classics. I cannot recommend this place highly enough, especially on a date night. go get em!",5.0
A great place to have a drink in this neighborhood! The cocktails are great! And the pizzas are good. Good atmosphere!,5.0
"A great place in the neighborhood. Cool ambiance, great food and chill vibes. Not too loud (think bar) but not super quiet (think fine dining). Somewhere in the middle which is how I like it. The bar/wait staff is super helpful and the pizza is thin and crispy. If you're in the area this is definitely a place to find some good eats.",5.0
"Love park side! The pizza is delish, the potato is my favorite and they always have amazing specials (try the warm kale salad or the Brussels sprouts). Plus they have amazing cocktails and cute bartenders",5.0
"Great new spot! Great pizza, drinks, sides, service, kid friendly- delighted to have this in the neighborhood.",5.0
"I live in this neighborhood.  While it is coming up and more exciting places are opening, the last thing I would normally have said we needed was a pizzeria.  This is no ordinary pizza spot.  In fact, it is more of a bar that serves brick oven pizza - as if the pizza part of the business model was just to enhance the bar concept.  The pizzas are created by Park Slope favorite ""Franny's"" chef.  In that knowledge I knew these weren't gonna be lacking.  THEY ARE AMAZING and well priced for what they are - 12"" pizzas for $10-$14.  Not bad.The pizza and antipasti items are the only things on the menu.  Again this is more of a cocktail lounge that serves pizza - a very nice marriage that could start a new trend - the pizza bar.",4.0
"I went here on Valentine's Day, because being single, I find a good meal is good comfort. I got the lamb sausage pizza and later the meatballs.  All was excellent.  A little pricey, but given the neighborhood is changing this is to be expected.  They have a nice rotation of beers though I think they rotate different flavors so if you have a favorite it may not be there.  They also have many cocktails too, if you like that.  The environment is very ambiant and the service is great.",5.0
"Very pleased. Nice, neighborhood-y vibe so far. Definitely trying to be upscale (copper countertops, exposed-filament bulbs, more than one type of fancy bitters) but also sensitive to PLG prices.Highly recommend the fresh ricotta crostini. So happy to have them in the neighborhood!",5.0
