"Streets BK definitely met our expectations. Although new, the restaurant seemed really organized and well run. Most importantly,  the food was delish! The idea of professional, diverse street food is interesting. As a starter, we shared the Bake and Shark, which was fresh and tasty. Being of Caribbean descent, bakes is something we're familiar with. Actually, Mom has perfected the recipe, which is her secret that everyone begs her to share. So, it means something when I say it was good. Not as puffy as the usual bake, but that makes sense as this flatter, more flaky style holds up better for a sandwich.  The shark was well seasoned. The dipping sauces were notably fresh and tasty. Warning: That homemade pepper sauce in the cork topped bottle is HOT!We also ordered the Bento style dish and the jerk pork. Both really good, although the jerk pork sauce was a wee bit salty. Although I look forward to trying another entree next time, I'm tempted to get the Bento again. It was that good. Our side of coconut jasmine rice was perfect!  Wrapped nicely in some sort of banana leaf, it was really warm and flavorful.Our waiter was friendly, comfortable and helpful to us first-timers. Loved how diverse both the diners and staff were.Overall, attractive space, friendly service and great food. We'll be returning.",5.0
"I first went with my Three friends and couldn't wait to take my Boyfriend! We are major foodies and he always finds the best restaurants in the City, we traveled from Manhattan for this and he was so amazed by how Good the food was ""I won the best restaurant"" My friends loved it and so did he we have a bunch of friends on social media ready to run there for the chance at that food. Peri Peri wings and the Steak with the Kale salad are to Die for!! Judging his expression the pain killer drink was a bit too. Can't wait to go back!!!!",5.0
I really like this place. Its very chic and has quite a bit of space. The service was great and everyone was very attentive. The food came out quick and was very fresh. The Peri Peri wings were great and so were the Korean Beef Tacos. But the Pao de Queijo were out of this world amazing! Like seriously amazing!,5.0
"We took my baby (now 18 year old) brother here for his farewell dinner, as he heads off to college. We were warmly greeted by the maitre d' and seated promptly. I ordered the painkiller, which was amazing, and did somewhat dull the pain of my brother leaving for college (yes, i know, i'm dramatic)! My wife ordered some whiskey drink, not sure how much she liked hers, because I was drowning my pain.We got two shark sandwiches (SO GOOD) but my mom texted to tell me sharks are endangered! why does my mother try to ruin such a perfect sandwich? We also had the peri peri chicken wings, which were the melt in your mouth wings, and not the crispy fried skin wings. I loved them and all the sauces that they came with. When the waitstaff warns you that one of the sauce is SUPER hot, take them seriously!We also had the chicharones, which just melted in your moth, but are super heavy. like eating chunks of fried butter. Not a huge fan of the malt vinegar it came with, but i dipped mine with the cilantro sauce that came with the shark sandwich.We were super awkwardly full after, and could not even attempt to eat dessert!",5.0
"My boyfriend and I went here for our anniversary dinner and absolutely loved it ! We started off with drinks and tried the Signature Painkiller drink. So good ! It is a must try . For dinner we went with the chicken roti, bake and shark , and the mariscadas seafood stew . We shared all the plates and were stuffed , but with just enough room to try the Guinness chocolate cake ( from the servers description sounded like it would be overwhelmingly sweet , but it an amazing combination for chocolate lovers) and apple pie egg rolls .  We enjoyed EVERYTHING! The Caribbean aspect of this place is on point and reminded me a lot of my families cooking. The portions were perfect , and I would say that you can definitely get full off of a slew or  the small plates . I don't recall our waitresses name , but she was helpful and attentive . This place is worth the trip to Brooklyn , for sure .",5.0
"Had dinner here last night with the wife. Lamar was our server . The service was excellent from beginning to end. We had the doubles and Mexican corn to start....best doubles I have ever had, and the corn was delicious. We then had the catch of the day and fish in the banana leaf. 5 stars on both accounts . We then finished it off with the Apple pie and soursop con tres leches. The soursop was my favorite but both were delicious!. Now I must say they are a little pricey but when you consider the quality of food, service and atmosphere it was well worth it, mind you we did choose some of the higher priced items on the menu. I highly recommend this place. To top it off I was offered10% off the next time I dine.",5.0
"Great place, awesome concept of serving street food from different parts of the world. The service was excellent and the food was flavorful and accurate to their home country flavor. The only thing I could think to say as a critism is that the prices are bit high when the cost of most these food items are quite low, but that is expected for the Williamsburg area. Still a great experience will definitely go back there again.",4.0
"Food: Pretty much everything was a disappointment. The dishes were neither authentic, to our knowledge, nor improved upon. I know they wanted to charge restaurant prices for foods that are usually cheap so they fancied them up. Its just that none of them ended up being very successful. Some of them didnt have much flavor. Others were overly sweet.Service: No complaints. Our server, Aidan, was very nice.Decor: Think modern, urban brewpub decor. Cement floors. Faux applebox type wood detailing. Large space, though. More tables than NYC usual.",3.0
"This is my first review and for a well desired restaurant. We had the peri peri wings, corn soup (this was rich. U can taste the coconut milk & flavors. The dumplings were soft & moist), doubles (the sauces were great), catch of the day ( I had red snapper. It was seasoned well through the fish), steak & fries (I heard this was great too. I tasted the kale salad served with it and I'm trying to mimic the flavor at home. The quinoa on the kale is a nice touch. Fries were home made. Solid!), dal bahji (loved the flavor) and we took home curry chicken roti ( the curry was flavored with garlic & ginger & the roti was light & buttery) & Peri peri wings( I still have some sauce in the fridge). Everything was on point. Hats off to the chefs!!!!I took my boyfriend and friends here last Saturday. My boyfriend who is a vegetarian most of his life and a food sceptic, enjoyed all his dishes and he's looking forward to coming back. You have no idea how happy that makes me as a foodie. I'm a fan of chef Roble & hope one day to have him cook for us, until then, we'll be eating at streets.",5.0
Love the variety of food! From the Cuban Sammy to the shark sandwich and chicken wings...sooooo good. Just at one place and one setting you get to enjoy food from around the And I love the decor and the cleanliness of the restaurant along with the friendly staff. Coming back fasho!,5.0
"Streets BK definitely met our expectations. Although new, the restaurant seemed really organized and well run. Most importantly,  the food was delish! The idea of professional, diverse street food is interesting. As a starter, we shared the Bake and Shark, which was fresh and tasty. Being of Caribbean descent, bakes is something we're familiar with. Actually, Mom has perfected the recipe, which is her secret that everyone begs her to share. So, it means something when I say it was good. Not as puffy as the usual bake, but that makes sense as this flatter, more flaky style holds up better for a sandwich.  The shark was well seasoned. The dipping sauces were notably fresh and tasty. Warning: That homemade pepper sauce in the cork topped bottle is HOT!We also ordered the Bento style dish and the jerk pork. Both really good, although the jerk pork sauce was a wee bit salty. Although I look forward to trying another entree next time, I'm tempted to get the Bento again. It was that good. Our side of coconut jasmine rice was perfect!  Wrapped nicely in some sort of banana leaf, it was really warm and flavorful.Our waiter was friendly, comfortable and helpful to us first-timers. Loved how diverse both the diners and staff were.Overall, attractive space, friendly service and great food. We'll be returning.",5.0
"I first went with my Three friends and couldn't wait to take my Boyfriend! We are major foodies and he always finds the best restaurants in the City, we traveled from Manhattan for this and he was so amazed by how Good the food was ""I won the best restaurant"" My friends loved it and so did he we have a bunch of friends on social media ready to run there for the chance at that food. Peri Peri wings and the Steak with the Kale salad are to Die for!! Judging his expression the pain killer drink was a bit too. Can't wait to go back!!!!",5.0
I really like this place. Its very chic and has quite a bit of space. The service was great and everyone was very attentive. The food came out quick and was very fresh. The Peri Peri wings were great and so were the Korean Beef Tacos. But the Pao de Queijo were out of this world amazing! Like seriously amazing!,5.0
"We took my baby (now 18 year old) brother here for his farewell dinner, as he heads off to college. We were warmly greeted by the maitre d' and seated promptly. I ordered the painkiller, which was amazing, and did somewhat dull the pain of my brother leaving for college (yes, i know, i'm dramatic)! My wife ordered some whiskey drink, not sure how much she liked hers, because I was drowning my pain.We got two shark sandwiches (SO GOOD) but my mom texted to tell me sharks are endangered! why does my mother try to ruin such a perfect sandwich? We also had the peri peri chicken wings, which were the melt in your mouth wings, and not the crispy fried skin wings. I loved them and all the sauces that they came with. When the waitstaff warns you that one of the sauce is SUPER hot, take them seriously!We also had the chicharones, which just melted in your moth, but are super heavy. like eating chunks of fried butter. Not a huge fan of the malt vinegar it came with, but i dipped mine with the cilantro sauce that came with the shark sandwich.We were super awkwardly full after, and could not even attempt to eat dessert!",5.0
"My boyfriend and I went here for our anniversary dinner and absolutely loved it ! We started off with drinks and tried the Signature Painkiller drink. So good ! It is a must try . For dinner we went with the chicken roti, bake and shark , and the mariscadas seafood stew . We shared all the plates and were stuffed , but with just enough room to try the Guinness chocolate cake ( from the servers description sounded like it would be overwhelmingly sweet , but it an amazing combination for chocolate lovers) and apple pie egg rolls .  We enjoyed EVERYTHING! The Caribbean aspect of this place is on point and reminded me a lot of my families cooking. The portions were perfect , and I would say that you can definitely get full off of a slew or  the small plates . I don't recall our waitresses name , but she was helpful and attentive . This place is worth the trip to Brooklyn , for sure .",5.0
"Had dinner here last night with the wife. Lamar was our server . The service was excellent from beginning to end. We had the doubles and Mexican corn to start....best doubles I have ever had, and the corn was delicious. We then had the catch of the day and fish in the banana leaf. 5 stars on both accounts . We then finished it off with the Apple pie and soursop con tres leches. The soursop was my favorite but both were delicious!. Now I must say they are a little pricey but when you consider the quality of food, service and atmosphere it was well worth it, mind you we did choose some of the higher priced items on the menu. I highly recommend this place. To top it off I was offered10% off the next time I dine.",5.0
"Great place, awesome concept of serving street food from different parts of the world. The service was excellent and the food was flavorful and accurate to their home country flavor. The only thing I could think to say as a critism is that the prices are bit high when the cost of most these food items are quite low, but that is expected for the Williamsburg area. Still a great experience will definitely go back there again.",4.0
"Food: Pretty much everything was a disappointment. The dishes were neither authentic, to our knowledge, nor improved upon. I know they wanted to charge restaurant prices for foods that are usually cheap so they fancied them up. Its just that none of them ended up being very successful. Some of them didnt have much flavor. Others were overly sweet.Service: No complaints. Our server, Aidan, was very nice.Decor: Think modern, urban brewpub decor. Cement floors. Faux applebox type wood detailing. Large space, though. More tables than NYC usual.",3.0
"I came her for my birthday this past weekend with my girlfriend. As a chef myself and a fan of both chef Roble and chef Arthur I had extremely high expectations. First I loved the service, very attentive and our waiter was able to keep up with my girlfriend and I playful banter. Second, we ordered the roti canai, doubles, duo prawns and pato de whatever lol to start.The roti was delicious, perfect not overly spicy.The duo prawns were huge, and delicious. Both sauces were excellent and well seasoned.The doubles were great. Not usually a huge fan and I'm trunk but I throughly enjoyed them.The cheese bread I can do without. It was free though(thanks yelp)For entrees I ordered the chili lobster and my girlfriend had the fish in banana leaf.My chili lobster was delicious but it wasn't the chili flavoring I was expecting or looking for. It was a little on the sweet side.The fish in banana leaf was flavorful and good nothing to rave about but she enjoyed it. Chef Arthur came over and presented my dessert and we chatted for a while. Much respect for that. The only issue I had was as chef was talking to me he presented us with the specials after our meal. Our waiter didn't even inform us of the specials!!!! I was turned off by that because I would of definitely ordered a few of them. Other than that I would definitely go back. The food was great.",4.0
"This place is IT! The food. I ordered the Costa Rican breakfast which included some flour tortillas, steak, scrambled eggs, mixed black rice and beans and some plantains. Boy was this on point. The steak was marinated so deliciously, the plantains were sweet and hot, the tortillas were hot (though a bit thin) and the rice and beans were just right. I put everything minus the plantains in the tortilla and ate it that way. I'm Honduran and put hot sauce on a lot things (I could've used some hot sauce here) but I didn't ask for it because I wanted to taste the food for what it was--and it was good. Next time, I'm asking for the hot sauce. My friend barely nibbled on her Mexican street corn and so me being one to not let food go to waste, I ate it. OMG---so good! I can't. I need more. I'm going back for more. In addition to this, I had a watermelon puree vodka based drink that did not disappoint. It definitely didn't lack vodka and was super refreshing. The atmosphere is a mix of rustic and modern. I went on a Sunday around noon and besides the other two parties, we had the place to ourselves. We received excellent customer service by our server and the other employees.",5.0
"We went 3 times. Appetizers in order of most delicious; Octopus, 2 way Prawns , Cerviche, & the Arancini. Entrees; THE LOBSTER  (OMG!), Lamb Shank, Mariscada, & way in the distance the Bento Box. Loved the baccalo.",4.0
"Streets BK is by far one of the best restaurants I have been to in a long time. We ordered several small plates that were so delicious - South African Peri Peri Wings, Bulgogi Tacos, Roti Canai, doubles and malt fries and they were alll delicious.!!! Yoli was amazing and quick and perfect and made us these divine cocktails and we had the delicious dessert . I highly recommend Streets BK!! Make sure you head there if ur in Williamsburg",5.0
"I have been terrible with my yelping lately so this should help me get back in the groove. I went to Streets last Sunday for girls night out. We had 7pm reservations and we got there a bit early. We were seated immediately and to our surprise it was fairly empty. Maybe because it was a beautiful Sunday with gorgeous weather. Any who about our experience....We ordered different appetizers or small plates as they refer to it. I had the Ceviche Escuatoriano (I am sure I spelled that wrong). I enjoyed it! It's shrimp, snapper, and calamari served cold with a little bag of chips. The shrimp was whole and cold almost cocktail style while the calamari and snapper was diced into a blend. It had a nice chilled citrus flavor. My entreé was the jerk pork. Now normally I would try something different but I'm trying to get my boyfriend to try different foods because I was going to bring him home a little doggie bag. So jerk pork it was. He has to start somewhere. The pork was so tender when I lifted the fork it broke. It's not your typical west indian jerk flavor. Intially It's very soft and subtle and then at the end it's a kick of spice. A BIG KICK! The plantains were cooked to my liking and sweet. The only negative I have is about the dish is the coleslaw or whatever it was served with it. Too salty. I didnt even want dessert but our waitress described a dish that was apple pie inside of an egg roll. I would order that again. A nice sweet balance with some green sauce. The drink I ordered was the blackberry lemonade and it tasted just like juice until I realized I had a little buzz. All of my friends enjoyed their dishes. They ordered Mariscadas, Bake and Shark, Trini Corn Soup, Brazilian Rice, Malt Vinegar Fries (I would recommend skipping that) and our free Pao De Quiejo thanks to yelp. Overall great experience. Out waitress was very helpful, punctual and gorgeous I might add. I'll be going there again to try other things. Cool vibes, great food and nice decor.",4.0
"Can I leave 6 stars?We came for lunch on a Wednesday so it was pretty empty, but the food was phenomenal. We got the whole fish tacos (take small bites and chew slowly as there are bones), and it was amazing! Also, the peri peri wings are recommended, and that's coming from a girl who doesn't really like buffalo wings.This place is huge, so I really hope it does well. It was beautifully decorated as well, with that very trendy hipster vibe, and I hesitate to say hipster. But really, I was impressed that literally every detail of this place was lovely, from the lighting fixtures, to the bar design, to the soap in the bathroom. It looks like a interior designer went over it with a fine tooth comb before they open. Also, every single employee looks like they could be model. Not kidding, they are all gorgeous. The bar, kitchen, and staff are all really great. Fantastic happy hour margaritas and a nice beer selection -- I kinda hope they start carrying Tusker, which is a Kenyan beer. Our server (Malissa?) was incredibly knowledgeable about the menu, which is all different types of street food from all over the world. We had such a hard time deciding what to order because EVERYTHING on the menu sounded so good. Go to their website and just look at that picture of the prawns. We will be back for those!",5.0
"Came here for New Year's dinner and they were running a special: 22oz Rib-eye steak bone in or out with a lobster tail, brussels sprouts and this risotto like side all for $55. Needless to say it was AMAZING!!!!The steak was perfectly cooked (I like medium) and flavorful. They also gave this sauce on the side. You didn't need it, but it was delicious too and had a little kick. The risotto side had a great texture and mixed in with seafood.I also had the apple pie a la mode for dessert. It took a little long to come out, but I think that's because they bake it upon ordering in a small personalized pan. Outside of the drinks bring a little light on the alcohol, everything was perfect. The regular menu had so many tasty sounding treats I must come back here!Highly recommended.",5.0
"Came here with a party of 11 for my graduation. The food and drinks were great, we all ordered a variety of small plates and shared that way everyone got a full taste of what was offered. The painkiller was my favorite drink! Now the reason I didn't give 5 stars Is because our server was horrible. Very disorganized and seemed like she never served a large party before. Thankfully the manager was available and settled everything for us, besides that hiccup I will definitely be back.",4.0
"Ah, I did not see what all the hype was about. Maybe it was because we went on a busy Saturday. The waiter wasn't  attentive at all, we had to order from another person. The manager was extremely rude and defensive. Sheesh, caught us all for surprise. Def won't be back.",2.0
"Amazing spot! Loved the 3 plate tapas! Love the menu - food from all over the world - the staff, the spot and the fact that the kitchen is open on the dinning room also!A must go!",5.0
"I came her for my birthday this past weekend with my girlfriend. As a chef myself and a fan of both chef Roble and chef Arthur I had extremely high expectations. First I loved the service, very attentive and our waiter was able to keep up with my girlfriend and I playful banter. Second, we ordered the roti canai, doubles, duo prawns and pato de whatever lol to start.The roti was delicious, perfect not overly spicy.The duo prawns were huge, and delicious. Both sauces were excellent and well seasoned.The doubles were great. Not usually a huge fan and I'm trunk but I throughly enjoyed them.The cheese bread I can do without. It was free though(thanks yelp)For entrees I ordered the chili lobster and my girlfriend had the fish in banana leaf.My chili lobster was delicious but it wasn't the chili flavoring I was expecting or looking for. It was a little on the sweet side.The fish in banana leaf was flavorful and good nothing to rave about but she enjoyed it. Chef Arthur came over and presented my dessert and we chatted for a while. Much respect for that. The only issue I had was as chef was talking to me he presented us with the specials after our meal. Our waiter didn't even inform us of the specials!!!! I was turned off by that because I would of definitely ordered a few of them. Other than that I would definitely go back. The food was great.",4.0
"This place is IT! The food. I ordered the Costa Rican breakfast which included some flour tortillas, steak, scrambled eggs, mixed black rice and beans and some plantains. Boy was this on point. The steak was marinated so deliciously, the plantains were sweet and hot, the tortillas were hot (though a bit thin) and the rice and beans were just right. I put everything minus the plantains in the tortilla and ate it that way. I'm Honduran and put hot sauce on a lot things (I could've used some hot sauce here) but I didn't ask for it because I wanted to taste the food for what it was--and it was good. Next time, I'm asking for the hot sauce. My friend barely nibbled on her Mexican street corn and so me being one to not let food go to waste, I ate it. OMG---so good! I can't. I need more. I'm going back for more. In addition to this, I had a watermelon puree vodka based drink that did not disappoint. It definitely didn't lack vodka and was super refreshing. The atmosphere is a mix of rustic and modern. I went on a Sunday around noon and besides the other two parties, we had the place to ourselves. We received excellent customer service by our server and the other employees.",5.0
"We went 3 times. Appetizers in order of most delicious; Octopus, 2 way Prawns , Cerviche, & the Arancini. Entrees; THE LOBSTER  (OMG!), Lamb Shank, Mariscada, & way in the distance the Bento Box. Loved the baccalo.",4.0
"Streets BK is by far one of the best restaurants I have been to in a long time. We ordered several small plates that were so delicious - South African Peri Peri Wings, Bulgogi Tacos, Roti Canai, doubles and malt fries and they were alll delicious.!!! Yoli was amazing and quick and perfect and made us these divine cocktails and we had the delicious dessert . I highly recommend Streets BK!! Make sure you head there if ur in Williamsburg",5.0
