"This place is great! I went here during their soft opening and was not disappointed. I was seated quickly and came as a group of 4. The place was packed, but it was a Saturday night so it was expected. The volume was a bit loud so it was a little hard to hear your companions at the table. For dinner, I had the Doubles and it was absolutely delicious. They were short on a few drinks though, ( I wanted the Tao Tsing and if not the Sapporo) so I ordered a Red Stripe. The waitress (Jen?) was very knowledgable about the food and was very kind. I don't know about anyone else, but people who can describe food using words that describe texture, taste, spice, the chef making it, and how to eat it are very impressive to me. That made service a lot better bc I had a decent idea of what the food tastes like. They also had a pretty decent vegetarian selection so that was a plus!! I'm a vegetarian, and was happy they had delicious cultural foods that were available to me. The cons? Well, there isn't much. I just wished they had the beer I wanted. Also the cheesey bread (Pao de Queijo) was pretty gross. Even though they were free with the Yelp coupon, it was not good. At all. It was like eating heart clogging cheese. Echhh!Secondly, this place is sneakily expensive. We all had the SMALL plates, with the addition of my beer and my friends cocktail. The total came up to $85 bc they included tip....yes. No entrees. I don't know how it came to that much, but it did. Also, they serve shark on the menu. Seriously. That pissed me off right there. If you are reading this, and are not aware of the 'over-fishing of sharks for human consumption' problem, look it up right now. I'm not gonna sit here and lecture about the issue, but it really angered me that they would serve shark....a vulnerable species of shark for that matter. I'm sure there are other Trinidadian foods that are just as good, that doesn't advocate this practice. ~_~Other than that, if they take shark off the menu, stock their beverages properly on busy nights, and perhaps serve larger portions of those delicious small plates, this'd be a fun and culturally enriching place to dine with you and your friends!",4.0
"If I could give Streets a 4.5 from my phone, I would.  Came here for a Birthday dinner and had the Peri Peri Wings, Doubles, Fish of the Day, the veggie dish that comes with jasmine rice and Season Vegetables.  We loved the flavor of the wings, the Doubles dish was good, and the Jasmine Rice was amazing.  The veggies were great and the Bok Choy came with fried onions which was a great combination.  The Fish of the Day needed a tad more flavor (maybe salt).  The atmosphere of the restaurant is really comfortable since the space is open and much bigger than most NY food spots. Our waitress, Glorimar, gave excellent recommendations.  Would definitely recommend Streets for a fun outing with foodie friends.",4.0
The place was good. The soup was great (not sure what it's called but it has mashed plantain and corn). I'd come here again for a second try.,3.0
"I entered a sceptic and left satisfied. As someone who hails from the Caribbean, I hold any purveyor of 'my food' to a high standard. I'm happy to say that, based on my brunch time visit on Saturday 11th July, I can easily bring my friends to Streets and introduce them to street food from Trinidad! Keep up your standards Chef Roble and team and my friends and I'll be back!",4.0
I came here on a date the first thing I recognized was the service and the atmosphere. The hostess was very pleasant and the waitress was pleasant and informative. The drinks were really yummy and I enjoying having my meal on a plank of wood it was different. However it was a little expensive it was definitely worth it. I would definitely come back.,4.0
"To me the food didn't live up to the hype. We had the bake n shark n market price seafood, both very avg. I wanted to try the whole chicken, but I don't think I will be back. I do really dig the atmosphere.",3.0
"I went here yesterday with a pal of my mine and was impressed with the design and decore of the restaurant.  Its really a nice space.  The tables are spaced out nicely so people aren't sitting on top of each other and I always make sure to go into a restaurants bathroom ...it doesn't matter if I have to use it or not; I just think a well designed and decorated bathroom says a lot about a place.  Well streets has a nice bathroom...nice space... so lets talk about the ""street food"".I adore a good Mexican corn at a street fare so I ordered it here- I wasn't impressed.  It seemed like they tried to make Mexican corn fancy, cutting back on prime ingredients that makes it great comfort food.  I thought I had better corn at a street fare.I then ordered the bake and shark.  Now Guinese,  Trinadadian, and Bajians make the best shark and bake so I expected a nice fluffy, crisp, slightly greasy pastry, accompanied by a flavorful piece of fried shark.  Well, I didn't get that... I got what tasted like it was bake that was made the day before, It wasn't fluffy, it was crispy, but not like it had just been fried, however.  And the shark, was just ok... I could get better on Fulton Street and Nostrand.Then I ordered the bentibox which consisted of braised short rib, crispy duck, and bacalao, with steamed buns.  The duck wasn't crispy at all, the bacalao was very bland, and the short ribs were nothing to tell my friends about.  Also very regular, not impressed.In between i was trying cocktail after cocktail.  I started off with a bellini mojito, which was tasty.  Then I had the signature drink the Painkiller.  The drink is really pretty but they added coconut and cinnamon to sorrel, rum,and pinnacle juice.  All of those flavors have different characters so my palate was confused.  Wouldn't order that again. Then I had two whiskey sidecars for obvious reasons.  They were really good.I am going to go back and give Streets another try.  Maybe I just ordered the wrong things on the menu.  If nothing else, its a great place to get a whiskey sidecar.",2.0
"I loved this place. I went during the week and it was empty. I'm told you need a reservation during the weekends though. They have an odd happy hour time, that might explain why it was empty. But the food was great. Our server was a little hard to understand but it seemed like her knew what he was talking about. This is a place you will have to go to multiple times and not be afraid to share to taste all the different types of food.",4.0
"I went here on a double date last night and i have zero complaints. GG the waitress was super cute and attentive. She explained the menu well, Kept checking on us. The decor and atmosphere were cool, it was pretty quiet(it was a Tuesday). The food was great. The Chicharrón's were great, the street corn lobster roll and those vinegar fries were really good. I ordered the purple drink, forgot the name  but all the reviews about it were accurate. I will def be returning.",4.0
Been here twice. First time got my socks blown by how good it was; 2nd time around I had to question if I was in the same Resturant. Not going to give s full story but my honest opinion is the drinks are NOT GOOD but the employees stand by them.5 stars to the service & decor4.5 stars for the food 2.5 stars for the drinks,4.0
"My wife and I had an amazing dinner here! We tried the chefs special, Sicilian Arancini, and we're not disappointed. My wife's churrasco was flavorful and cooked perfectly. I had the jerk pork and it was excellent, tender and full of flavor. The drinks were also great. The staff was helpful and attentive. We had a wonderful food experience and will be back!",5.0
"If you're undecided on what type of cuisine to go for this place is a good shout. We went for lunch so a limited menu compared to dinner, but food was good. The ""Doubles"" were good, as were the grilled whole fish taco. I wouldn't go for the Peri Peri wings - they seem to lack something. Overall was OK- the staff were great and squeezed us in just before they closed the kitchen. Cocktails are Good - recommend the whiskey sidecar",3.0
Excellent service and the food is amazing!! I had the trini corn soup for an app and the lamb for an entree. The lamb was really good but had a ton of fat on it so I had to take a star off. I had some kind of clementine drink and it was absolutely delicious!! I will definitely be going back for brunch.,4.0
The food was on point. Excellent service excellent flavors excellent everything. Two thumbs wayyyyyy up. Cocktails were spot on also. I'll definitely be a regular at this joint. Everything I tasted left me wanting for more.,5.0
"Chef Roble is a truth master   he cooks for all not just for stars, the food is great I love ever thing about Streets, me and my boy friends are real foodies, and we enjoyed ever part of eating there.  The bar staff was friendly and know how to mix a drink .    My black berry lemonade was amazing I had three of them, and the lovely young lady that greeted us at the door also made us feel so welcome this restaurant is hip, cool, and great place to dine 10 stars",5.0
"Came to streets in hopes of a great birthday dinner with our church function. We called prior to make reservations and let them know we had cup cakes and they said ""ok"" just to receive our bill with a $25 ""cake"" charge. We asked why this was in there and the manager Jesse stated its mandatory to charge. We explained that we were never fore warned of this fee as we sat here and ate our cupcakes. I understand a cutting fee or charging for small plates but we never received that. So why are we paying for cupcakes we ate in our hands ? His attitude was poor towards us and did not budge and insisted NO you are being charged. I am one Unsatisfied customer and will let everyone know there is no customer service here. Very disappointed streets BK",1.0
"I went here yesterday with a pal of my mine and was impressed with the design and decore of the restaurant.  Its really a nice space.  The tables are spaced out nicely so people aren't sitting on top of each other and I always make sure to go into a restaurants bathroom ...it doesn't matter if I have to use it or not; I just think a well designed and decorated bathroom says a lot about a place.  Well streets has a nice bathroom...nice space... so lets talk about the ""street food"".I adore a good Mexican corn at a street fare so I ordered it here- I wasn't impressed.  It seemed like they tried to make Mexican corn fancy, cutting back on prime ingredients that makes it great comfort food.  I thought I had better corn at a street fare.I then ordered the bake and shark.  Now Guinese,  Trinadadian, and Bajians make the best shark and bake so I expected a nice fluffy, crisp, slightly greasy pastry, accompanied by a flavorful piece of fried shark.  Well, I didn't get that... I got what tasted like it was bake that was made the day before, It wasn't fluffy, it was crispy, but not like it had just been fried, however.  And the shark, was just ok... I could get better on Fulton Street and Nostrand.Then I ordered the bentibox which consisted of braised short rib, crispy duck, and bacalao, with steamed buns.  The duck wasn't crispy at all, the bacalao was very bland, and the short ribs were nothing to tell my friends about.  Also very regular, not impressed.In between i was trying cocktail after cocktail.  I started off with a bellini mojito, which was tasty.  Then I had the signature drink the Painkiller.  The drink is really pretty but they added coconut and cinnamon to sorrel, rum,and pinnacle juice.  All of those flavors have different characters so my palate was confused.  Wouldn't order that again. Then I had two whiskey sidecars for obvious reasons.  They were really good.I am going to go back and give Streets another try.  Maybe I just ordered the wrong things on the menu.  If nothing else, its a great place to get a whiskey sidecar.",2.0
"I loved this place. I went during the week and it was empty. I'm told you need a reservation during the weekends though. They have an odd happy hour time, that might explain why it was empty. But the food was great. Our server was a little hard to understand but it seemed like her knew what he was talking about. This is a place you will have to go to multiple times and not be afraid to share to taste all the different types of food.",4.0
"I went here on a double date last night and i have zero complaints. GG the waitress was super cute and attentive. She explained the menu well, Kept checking on us. The decor and atmosphere were cool, it was pretty quiet(it was a Tuesday). The food was great. The Chicharrón's were great, the street corn lobster roll and those vinegar fries were really good. I ordered the purple drink, forgot the name  but all the reviews about it were accurate. I will def be returning.",4.0
Been here twice. First time got my socks blown by how good it was; 2nd time around I had to question if I was in the same Resturant. Not going to give s full story but my honest opinion is the drinks are NOT GOOD but the employees stand by them.5 stars to the service & decor4.5 stars for the food 2.5 stars for the drinks,4.0
"My wife and I had an amazing dinner here! We tried the chefs special, Sicilian Arancini, and we're not disappointed. My wife's churrasco was flavorful and cooked perfectly. I had the jerk pork and it was excellent, tender and full of flavor. The drinks were also great. The staff was helpful and attentive. We had a wonderful food experience and will be back!",5.0
"If you're undecided on what type of cuisine to go for this place is a good shout. We went for lunch so a limited menu compared to dinner, but food was good. The ""Doubles"" were good, as were the grilled whole fish taco. I wouldn't go for the Peri Peri wings - they seem to lack something. Overall was OK- the staff were great and squeezed us in just before they closed the kitchen. Cocktails are Good - recommend the whiskey sidecar",3.0
Excellent service and the food is amazing!! I had the trini corn soup for an app and the lamb for an entree. The lamb was really good but had a ton of fat on it so I had to take a star off. I had some kind of clementine drink and it was absolutely delicious!! I will definitely be going back for brunch.,4.0
The food was on point. Excellent service excellent flavors excellent everything. Two thumbs wayyyyyy up. Cocktails were spot on also. I'll definitely be a regular at this joint. Everything I tasted left me wanting for more.,5.0
"Chef Roble is a truth master   he cooks for all not just for stars, the food is great I love ever thing about Streets, me and my boy friends are real foodies, and we enjoyed ever part of eating there.  The bar staff was friendly and know how to mix a drink .    My black berry lemonade was amazing I had three of them, and the lovely young lady that greeted us at the door also made us feel so welcome this restaurant is hip, cool, and great place to dine 10 stars",5.0
"Came to streets in hopes of a great birthday dinner with our church function. We called prior to make reservations and let them know we had cup cakes and they said ""ok"" just to receive our bill with a $25 ""cake"" charge. We asked why this was in there and the manager Jesse stated its mandatory to charge. We explained that we were never fore warned of this fee as we sat here and ate our cupcakes. I understand a cutting fee or charging for small plates but we never received that. So why are we paying for cupcakes we ate in our hands ? His attitude was poor towards us and did not budge and insisted NO you are being charged. I am one Unsatisfied customer and will let everyone know there is no customer service here. Very disappointed streets BK",1.0
"Very impressed. Everything I tried was amazing!!! I really enjoyed the tacos and the pork. I haven't tried the dinner menu yet because we were there for lunch, but I'll definitely come to try dinner. Servers were very pleasant",4.0
"Came here and upon entering. The vibe was cool and relaxing. I ordered the peri peri wings and bay bayyyyyyy.. they were to die for. I also ordered the jasmine rice. Their roti dish was good too. Great vibes , I'd definitely come again and recommend this place to everyone.",4.0
I only rate 3 stars because of service the food was EXCELLENT though. Servers I feel need more knowledge on the menu choices. A spot I will visit again on a friends knowledge of food. Peaceful environment and accommodating staff to fit your wants. My visit was July 4th and I enjoyed the meal.,3.0
The food and ambiance were great. The waiter was very attentive. He answered question with a smile.  I would absolutely come here again. One must try the drink streete painkiller. It taste great and it has a hell of a kick,5.0
"Great atmosphere and friendly staff, and a cool crowd. Food was good but we expected more flavor. The Jerk Pork was not very spicy at all, but the Lamb shank was very tender and delicious. So 1 for 1.. but the friendly accommodating staff got them the extra star!",4.0
"Roble' great job brother.  From the food to the dope bucket sinks in the bathroom streets is awesome.  I had the steak and egg burrito brunch with plantains.  It was awesome.  I was served by a brother who looked and sounded like Justin Timberlake, lol.  The wait staff was really good and attentive.  I also had the sorel mimosa and it was great.  To finish I had the apple fried crisp with green tea.  It was a great brunch.  On the way out the hostess also gave a sample of your frangrance.  Good looks...  You will have a great experience if you go here just make sure you make a reservation because it packs up quickly on the weekends.",5.0
"I'm pretty impressed when a restaurant takes the time to get it right. I spoke to the manager Diana and was informed that the oweners sent out their consulting chefs to different parts of the world to learn the recipes. Also, the owners own Negril and are part owners of Soco. I have been to all of those restaurants and can say that this is  hands down the best  of the three. As my friend put it, ""they went into someone's grandma's house to learn these recipes."" That's how it felt at least from the items I tried. I felt like I was taken back to Trinidad as a kid with each taste.The portions were a good size and don't be shy about ordering multiple items. I came with two other friends and it got real when they had to rock paper scissor it out over whether to order the pork or lamb. FYI paper beats rock and they loved the jerk pork. The staff was very friendly and our waiter David was very nice and patient as we proceed to order multiple items off of the menu. How much did we order? Well it had to come out in three stages. Don't judge! Hell if David kept a straight face after we were done to ask if we wanted dessert then we obviously didn't order THAT much.",5.0
"Wow-- what an experience. The concept in and of itself should be enough to draw a crowd. Street food from around the globe with a spin--hell yeah. My best friend and I went to Streets this past Sunday and it was literally one of the best experiences I've ever had at a restaurant. I'll leave the food raving for last, but aside from that, the service was AMAZING, the atmosphere was super impressive and authentic feeling, and the specialty drinks ( we ordered the pina colada martini) were delicious. To reiterate, because that's how impressed we were, the servers were very attentive, knowledgeable and overall just awesome. The FOOD WAS INCREDIBLE. A little pricey, yes, but worth the mouthgasm. We split the Brazilian seafood stew and the Thai chicken, and between the two of us, nothing was left untouched. Our appetites are typically not that voracious, but we couldn't bear watching the plates leave our table with one morsel left.  If I could grade it, Streets would get an A++++++++. That's my word.",5.0
These people r sooooo sweet & hospitable  the food is so unique & awesome! The atmosphere is super chill & simple. Dress up or down & still fit in.great spot but the one thing that bothered me was the $25 they charged for us to bring our own cake & serve it to us :/,4.0
"At first we were hestitant about dinning at this restaurant because the menu seemed a little confusing to us LOL.  As we pulled up to the restaurant we were greeted by a very beautiful young lady who instantly sold us on why we should give this restaurant a try. She was kind enough to answer all our questions about the menu. After reviewing the menu from outside we were sold and decided to give it a try. We were seated and greeted by our waiter, who was Amazing, friendly and explained the menu again.  The ambiance of the place was just right for what we were looking for....we were celebrating our ANNIVERSARY. The Waiter and staff was very attentive, the place very warm brooklyn Rustic feeling ( JUST WHAT WE WERE LOOKING FOR). The bathrooms were sooooo clean, one of the cleanest resturant bathrooms I have come across so far at a restaurant....I have to say LOL. The waiter suggested for me to have  the pain killer drink which was by far one of the best drinks I have had. For appetizer we had the doubles and the corn, very tasteful. Dinner I had the catch of the Day which was Snapper ( My Favorite Fish) and my husband had Lobster roll...Both very delicious.  Snapper was made JUST Right! At the end of dinner...Our waiter suprised us with Dessert which had Happy Anniversary written on there...THAT REALLY WAS THE HIGHLIGHT OF OUR DINNER, VERY THOUGHFUL AND SWEET OF HIM. Dessert Was soooooooooooo delicious...even my Husband was WOWW AND HE IS NOT A DESSERT GUY LOL.  I would HIGHLY recommend this restaurant to Anyone. I will defintely be returning  to this restaurant.  THANK YOU FOR AN AMAZING ANNIVERSARY DINNER.",5.0
"Very impressed. Everything I tried was amazing!!! I really enjoyed the tacos and the pork. I haven't tried the dinner menu yet because we were there for lunch, but I'll definitely come to try dinner. Servers were very pleasant",4.0
"Came here and upon entering. The vibe was cool and relaxing. I ordered the peri peri wings and bay bayyyyyyy.. they were to die for. I also ordered the jasmine rice. Their roti dish was good too. Great vibes , I'd definitely come again and recommend this place to everyone.",4.0
I only rate 3 stars because of service the food was EXCELLENT though. Servers I feel need more knowledge on the menu choices. A spot I will visit again on a friends knowledge of food. Peaceful environment and accommodating staff to fit your wants. My visit was July 4th and I enjoyed the meal.,3.0
The food and ambiance were great. The waiter was very attentive. He answered question with a smile.  I would absolutely come here again. One must try the drink streete painkiller. It taste great and it has a hell of a kick,5.0
"Great atmosphere and friendly staff, and a cool crowd. Food was good but we expected more flavor. The Jerk Pork was not very spicy at all, but the Lamb shank was very tender and delicious. So 1 for 1.. but the friendly accommodating staff got them the extra star!",4.0
"Roble' great job brother.  From the food to the dope bucket sinks in the bathroom streets is awesome.  I had the steak and egg burrito brunch with plantains.  It was awesome.  I was served by a brother who looked and sounded like Justin Timberlake, lol.  The wait staff was really good and attentive.  I also had the sorel mimosa and it was great.  To finish I had the apple fried crisp with green tea.  It was a great brunch.  On the way out the hostess also gave a sample of your frangrance.  Good looks...  You will have a great experience if you go here just make sure you make a reservation because it packs up quickly on the weekends.",5.0
"I'm pretty impressed when a restaurant takes the time to get it right. I spoke to the manager Diana and was informed that the oweners sent out their consulting chefs to different parts of the world to learn the recipes. Also, the owners own Negril and are part owners of Soco. I have been to all of those restaurants and can say that this is  hands down the best  of the three. As my friend put it, ""they went into someone's grandma's house to learn these recipes."" That's how it felt at least from the items I tried. I felt like I was taken back to Trinidad as a kid with each taste.The portions were a good size and don't be shy about ordering multiple items. I came with two other friends and it got real when they had to rock paper scissor it out over whether to order the pork or lamb. FYI paper beats rock and they loved the jerk pork. The staff was very friendly and our waiter David was very nice and patient as we proceed to order multiple items off of the menu. How much did we order? Well it had to come out in three stages. Don't judge! Hell if David kept a straight face after we were done to ask if we wanted dessert then we obviously didn't order THAT much.",5.0
