"Only came for brunch one Sunday but it was SO AMAZINGI ordered the Costa Rican breakfast ($16) and I was full for the rest of the day. The dish came with plantain, scrambled eggs, I added shrimp to the meal but you can also add either steak or chicken I believe, rice and beans and I don't even remember what else but it was WELL worth the money.I also recommend the sorrel mimosa!",5.0
"This was the first time that I dined out as a pescatarian. I have been to Streets BK plenty of times before my diet change and  I enjoyed their food. I remembered they had a vegetarian section on the menu and wanted my Bf (who is a vegetarian) to experience this restaurant.I ordered the shark sandwich. The sandwich looked and smelled SO good, my bf had to turn away. The shark had coleslaw that came with it and I poured tamarind sauce over it...I was talking about this sandwich for days. I'm not sure what my Bf ordered from the vegetarian option, but it came with plantain chips ( that i took off his plate) that I thought was perfect! I ordered additional plantain chips. He was not pleased with the vegetarian options though, he said the descriptions didn't sound appealing. We asked the waitress for assistance and she explained that the option he was looking at would come out looking like an appetizer. He ordered It anyway and was hungry an hour later.I am always pleased when I dine at Streets BK. I come with my parents and brother who also enjoy it, as they rave about the Mexican corn, the coconut brown rice and wings, to name a few and we always come back. My bf would just wish they had better choices for vegetarians.",5.0
"Got invited here by a friend... surprise surprise!  The food here is amazing!  I had zero expectations when I arrived as I had never heard of the spot... but now that I've been I will definitely be back.The location is off the beaten path (basically under the Williamsburg Bridge on the BK side), but I drive so GPS got me there pretty quickly.  Parking is limited so beware.  Once inside, the spot is nice... not great, but nice.  We went for Sunday brunch so it was not very crowded.  Service was fast and good.  Everything me and my brunch date ate was good.  We sampled each other's food and agreed that the chef obviously had magical powers as literally everything tasted good.  I can't remember everything we ordered, but we each ordered three things... again... all good.  I DEFINITELY recommend this place.  It's great for a first date... or any date... or if you're just hungry!  Kudos STREETS!  You have a new fan!",5.0
"I have been so excited to try this place since I have seen Chef Roble on The Chew many times. Well I finally dragged two friends with me and we came here.We had a drink at the bar and the drinks were really good and strong the way I like them. As we were ready to go to our table and wanted to pay for our drinks they told us the tab would just transfer to our table. I really loved that and I wish more restaurants would do that.We decided to start with three appetizer (mini shark, Mexican corn and wings). All three were good but not amazing, I was expecting amazing after all the great reviews.Now for my entrée I got the snapper in a plantain leaf with mashed sweet plantains. I have to say the best part of my meal were the mash plantains since the fish was very bland.Maybe my expectations were too high coming here.",3.0
"Since all the other reviews pretty much sum things up here I'll make this one brief. I had this bookmarked a long time ago and came here I believe in December but didn't have any food so I didn't leave a review.My date and I had the ""two way street"" tapas. We were quite upset that the trini corn soup wasn't available but no one's here to cry over spilled milk. With that said. my tapas meal included the peri peri wings, thai duck salad, and the bake and shark. Meanwhile, my date had the Sicilian arancini, bake and shark, and the doubles. I keep saying this to myself but I REALLY need to stop coming into places with these expectations which only stemmed from reading other reviews (however, this is quite natural).People raved about them peri peri wings and I was so mad I could throw them. Nothing special at all about those damn wings. BUTTTTTT...believe me when I say the highlight of our meals was the bake and shark...VERY GOOD! I can still remember the thai duck salad as well which I could go back for.4 stars because this place has an awesome interior design and is very clean, the service is good, and the drinks are delicious. The food is nothing to complain about if you come in with an open mind and ready to eat some street food. I can honestly come back here over and over again.Sorry not as short as I thought it would be.",4.0
"Love everything about this place!  It's spacious and beautifully designed.  The service was A1.  I started off with the tequila cocktail they had on the menu, which was made with apple and spiced rim.  It's my new favorite cocktail.  We started off with the Tapas Two Street, which is a sample size of the more popular items.  The Peri Peri Wings were my favorite!  Full of flavor and spice.  The Chicharrones was good, but a little too salty for my taste.  The Thai Duck Salad was also a nice fresh change from the rest.  We then got the Mariscadas, which is a big pot of seafood (mussels, crab, shrimp, squid).  It was flavorful, but definitely recommend getting some kind of rice with it- as it is a soupy dish.  However, we got the fries.  They were just OK.We finished up with the cheesecake empanadas.  SO delicious!  I will definitely be back for more!!!",4.0
"Yesterday I visited this gem in Williamsburg and I enjoyed the food a great deal! I ordered the Colombian breakfast with steak and it was delish. The food presentation was different and quite impressive. I also ordered a drink called Pain Killer. They should call it ""Sneak up on ya!"" because that's what it actually did. I can't wait to come here again to try yet another dish.",5.0
"I am so surprised this place doesn't have more reviews! The first time my boyfriend mentioned this place and told me ""it's a restaurant with different types of street food"" I was not excited. Little did I know this would be one of the best culinary experiences I've ever had. Everything was so good. Everything is shareable in my opinion. We got the doubles, Peri peri wings, Mexican corn (which they cut in half to be shared) and the chicken. My favorite were the wings. Perfectly seasoned and crispy. For dessert we got this cupcake in a jar with Jameson custard and baileys whipped cream. And dear god, it was heaven in my mouth! If you're looking for a cute date night idea, this is definitely a go to spot!",5.0
"The vibe is perfect, the food is amazing,the bartender makes the best drinks.  All the employees are friendly and fun and very attentive. Def have the steak, it is BEYOND yummy.recommend this place to old and young comfortable setting for all.",5.0
Was here a couple weeks back... Food was above average and the atmosphere was relaxed.Will definitely be back.,4.0
Great atmosphere!!! Food is yummy our waitress GiGi she was awesome. Definitely a come back,5.0
Not impressed.  Went here because my friend told me they were okay and The only thing I liked was the doubles. My daughter had the jerk pork and only liked the plantains.  The corn soup given to me was cold and had to be sent back. It was in a small stupid wooden thingy. The pina colada wasn't good either.  Left still feeling hungry. Soooo disappointed and unsatisfied. Wasted my Sunday night.,2.0
"A good friend of mine brought me here for lunch this afternoon and I was completely blown away. Everything from the friendly service, industrial/hip interior decór, impressive and interesting list of cocktails, beers and wines right down to the exquisiteness and yumminess of the food. The entire dining experience was sublime. The design in particular is a unique blend of upscale, industrial Brooklyn chíc with a touch of rustic elements displayed by wood paneling and wicker chairs scattered throughout. It served as a warm balance juxtaposed with the exposed beams, ceiling pipes and concrete columns. We felt that the beverages served in mason jars added charm and elegance to the experience. I really adored the eclectic design and vibe of the space in general. I checked in on on Yelp and no sooner did our conscientious server bring us cheese stuffed Brazilian bread. It was warm, soft, chewy, heavenly goodness. We ordered the Peri Peri Wings which were scrumptious; the Thai Duck salad which was a harmony between refreshing, light and flavorful balanced with crispy Duck; finally the Cachapa: essentially a sweet/salty corn cake filled with mozzarella cheese served with a side of maple syrup and butter. They were like velvet.  To drink I had the seasonal IPA (on tap) and my friend ordered the Mezcal Libation (a delicious, spicy tequila.)  We agreed that the adult beverages only added to the experience and complimented the flavors of the food. We balanced out the meal with a four layered dessert that consisted of chocolate cake, vanilla creme, more chocolate and a marscapone-like creme layer on top. I'd highly recommend Streets as a date-night spot for dinner or a small outing with a group of friends. I look forward to coming back and trying more items from the menu.",5.0
"Reservations for 8 made through opentable. Maitre d was very accommodating, and let us sit a partial party. Only 7 of us showed up, maybe because it was a late reservation and there weren't many customers. The place was very nice and so were the employees. Once again, I may attribute this to the establishment not being crowded, but whatever. The food was awesome. No one in my party spoke after the food came out. No need to talk during business time. This was a very rewarding culinary experience and there is no doubt I will be visiting here again. 5 Stars!!!!!",5.0
"Came here for my birthday and had a very nice evening.  The restaurant itself is very cool. We started with a trio of appetizers on one place. The appetizers included the peri wings, Mexican corn and the shark and bake. All were very good although I was not as excited about the corn. The shark and bake was delicious especially the dipping sauce that was served with it. For entrees we went in opposite directions. I had the steamed fish in the banana leaf which was to die for! I could not get enough!  We also had the jerk pork. I can tell why it's one of their best dishes! It was yummy. We also had a free margarita for check in. But had to try their signature drinks. Painkiller and blackberry lemonade. Both good. Ended my meal with a birthday cake. It was pretty but a little dense for my liking. Overall this would have been a four star experience. Service was pretty decent until the end. They could not figure out how to use our gift certificate to pay for the meal. I was exhausted at this time and it took them an additional half an hour to figure out that they did not have the capacity to use their own gift certificate. Our server came to us to tell us that they were working on it and finally the manager came over to help resolve it.  Not the best ending to our otherwise lovely evening.",3.0
Loved this hidden jewel I have been dying to venture too. The waiter that served me and my two girlfriends was phenomenal his name is Lamar. The food was the right portion my drink was heavenly and music fits the atmosphere to a tee.,4.0
"Where's the rest of the stars because this please DEFINITELY needs them! If you look at my profile, I'm not big on leaving reviews unless your service was just flat out shitty however, this place.... This place was, GREAT!!! I ordered the Yan something chicken, AHMAZE ballz!! My cousin order the steak and could not finish it because she was stuck on on the kale salad! Everything was cooked to perfection, and the staff are extremely tentative and savvy. The atmosphere  is just what we had in mind for this beautiful Saturday afternoon in Brooklyn! Already planning our next outting, but this time we're bringing the whole crew! PS- GiGi is the ish! Oh and the little short cute manager.",5.0
Taurus (sure i spelled this wrong) at the bar is engaging and makes a hell of a bloody mary. Came in for brunch and hoping to try the peri peri wings but they were out. Had the special that day which was oxtail bao. delicious...small portion though but delicious. Cute decor,4.0
"Great food, wonderful service and beautiful interior design. What more could you ask for?",4.0
"I took my best friend here to celebrate her birthday because she wanted to dine here based on prior reviews. I am not sure about most but when I walk into an establishment, the décor plays a major role in setting the tone. I must say that the lighting and table layout was exactly what I expected' beautiful! The color scheme and rustic tables and chairs, were brilliant. My friend started with a ginger tea, whilst I started with the Street Seat, a drink that has enough smooth to cater to a sweeter palette customer but packing enough punch for a palette that can handle some powerful GIN. Whoa!! Thankfully, we were in no rush after our dinner; you need a good 1/2 hr. to allow the drink to work its way out your system.I had the fish wrapped in banana leaf, while my friend had the bento box. All in all, the food was decent, not great! The food would have been great, had it not been lukewarm. The woman tending to our table, waited a good 10 minutes, when we were mid-way through with our course to check in. This was not beneficial because we would have benefit from her checking in sooner, as we would have gladly sent back the food. However, after having a jammed packed day, with minimal time to grab, as much as a protein bar; we were famished and devoured as much as possible, more for substance, less to do with the enjoyment of our taste buds. Overall, I am giving the establishment 3 stars, not because of the food or the service. However, the manager who was on shift 2/18, during the time slot of 7:30-9:30pm; was phenomenal! If he weren't there, I would have given the establishment only 1.5 star. He greeted everyone as they walked in and stopped by each diners table to check to see if they were enjoying the ""Streets Experience'. At that time, I made him aware of our unpleasant experience thus far. He immediately jumped into gear, bringing out a new drink, cleared our table, apologized repeatedly, and did everything in his power to guarantee that the remainder of our visit, would be enjoyable- and it was. Bear in mind, this is a new establishment and every new place, needs time to get into the groove. I believe they are still ironing out the kinks. If you are really famished, do not get the bento box, the portion is VERY small.",3.0
Great atmosphere!!! Food is yummy our waitress GiGi she was awesome. Definitely a come back,5.0
Not impressed.  Went here because my friend told me they were okay and The only thing I liked was the doubles. My daughter had the jerk pork and only liked the plantains.  The corn soup given to me was cold and had to be sent back. It was in a small stupid wooden thingy. The pina colada wasn't good either.  Left still feeling hungry. Soooo disappointed and unsatisfied. Wasted my Sunday night.,2.0
"A good friend of mine brought me here for lunch this afternoon and I was completely blown away. Everything from the friendly service, industrial/hip interior decór, impressive and interesting list of cocktails, beers and wines right down to the exquisiteness and yumminess of the food. The entire dining experience was sublime. The design in particular is a unique blend of upscale, industrial Brooklyn chíc with a touch of rustic elements displayed by wood paneling and wicker chairs scattered throughout. It served as a warm balance juxtaposed with the exposed beams, ceiling pipes and concrete columns. We felt that the beverages served in mason jars added charm and elegance to the experience. I really adored the eclectic design and vibe of the space in general. I checked in on on Yelp and no sooner did our conscientious server bring us cheese stuffed Brazilian bread. It was warm, soft, chewy, heavenly goodness. We ordered the Peri Peri Wings which were scrumptious; the Thai Duck salad which was a harmony between refreshing, light and flavorful balanced with crispy Duck; finally the Cachapa: essentially a sweet/salty corn cake filled with mozzarella cheese served with a side of maple syrup and butter. They were like velvet.  To drink I had the seasonal IPA (on tap) and my friend ordered the Mezcal Libation (a delicious, spicy tequila.)  We agreed that the adult beverages only added to the experience and complimented the flavors of the food. We balanced out the meal with a four layered dessert that consisted of chocolate cake, vanilla creme, more chocolate and a marscapone-like creme layer on top. I'd highly recommend Streets as a date-night spot for dinner or a small outing with a group of friends. I look forward to coming back and trying more items from the menu.",5.0
"Reservations for 8 made through opentable. Maitre d was very accommodating, and let us sit a partial party. Only 7 of us showed up, maybe because it was a late reservation and there weren't many customers. The place was very nice and so were the employees. Once again, I may attribute this to the establishment not being crowded, but whatever. The food was awesome. No one in my party spoke after the food came out. No need to talk during business time. This was a very rewarding culinary experience and there is no doubt I will be visiting here again. 5 Stars!!!!!",5.0
"Came here for my birthday and had a very nice evening.  The restaurant itself is very cool. We started with a trio of appetizers on one place. The appetizers included the peri wings, Mexican corn and the shark and bake. All were very good although I was not as excited about the corn. The shark and bake was delicious especially the dipping sauce that was served with it. For entrees we went in opposite directions. I had the steamed fish in the banana leaf which was to die for! I could not get enough!  We also had the jerk pork. I can tell why it's one of their best dishes! It was yummy. We also had a free margarita for check in. But had to try their signature drinks. Painkiller and blackberry lemonade. Both good. Ended my meal with a birthday cake. It was pretty but a little dense for my liking. Overall this would have been a four star experience. Service was pretty decent until the end. They could not figure out how to use our gift certificate to pay for the meal. I was exhausted at this time and it took them an additional half an hour to figure out that they did not have the capacity to use their own gift certificate. Our server came to us to tell us that they were working on it and finally the manager came over to help resolve it.  Not the best ending to our otherwise lovely evening.",3.0
Loved this hidden jewel I have been dying to venture too. The waiter that served me and my two girlfriends was phenomenal his name is Lamar. The food was the right portion my drink was heavenly and music fits the atmosphere to a tee.,4.0
"Where's the rest of the stars because this please DEFINITELY needs them! If you look at my profile, I'm not big on leaving reviews unless your service was just flat out shitty however, this place.... This place was, GREAT!!! I ordered the Yan something chicken, AHMAZE ballz!! My cousin order the steak and could not finish it because she was stuck on on the kale salad! Everything was cooked to perfection, and the staff are extremely tentative and savvy. The atmosphere  is just what we had in mind for this beautiful Saturday afternoon in Brooklyn! Already planning our next outting, but this time we're bringing the whole crew! PS- GiGi is the ish! Oh and the little short cute manager.",5.0
Taurus (sure i spelled this wrong) at the bar is engaging and makes a hell of a bloody mary. Came in for brunch and hoping to try the peri peri wings but they were out. Had the special that day which was oxtail bao. delicious...small portion though but delicious. Cute decor,4.0
"Great food, wonderful service and beautiful interior design. What more could you ask for?",4.0
"I took my best friend here to celebrate her birthday because she wanted to dine here based on prior reviews. I am not sure about most but when I walk into an establishment, the décor plays a major role in setting the tone. I must say that the lighting and table layout was exactly what I expected' beautiful! The color scheme and rustic tables and chairs, were brilliant. My friend started with a ginger tea, whilst I started with the Street Seat, a drink that has enough smooth to cater to a sweeter palette customer but packing enough punch for a palette that can handle some powerful GIN. Whoa!! Thankfully, we were in no rush after our dinner; you need a good 1/2 hr. to allow the drink to work its way out your system.I had the fish wrapped in banana leaf, while my friend had the bento box. All in all, the food was decent, not great! The food would have been great, had it not been lukewarm. The woman tending to our table, waited a good 10 minutes, when we were mid-way through with our course to check in. This was not beneficial because we would have benefit from her checking in sooner, as we would have gladly sent back the food. However, after having a jammed packed day, with minimal time to grab, as much as a protein bar; we were famished and devoured as much as possible, more for substance, less to do with the enjoyment of our taste buds. Overall, I am giving the establishment 3 stars, not because of the food or the service. However, the manager who was on shift 2/18, during the time slot of 7:30-9:30pm; was phenomenal! If he weren't there, I would have given the establishment only 1.5 star. He greeted everyone as they walked in and stopped by each diners table to check to see if they were enjoying the ""Streets Experience'. At that time, I made him aware of our unpleasant experience thus far. He immediately jumped into gear, bringing out a new drink, cleared our table, apologized repeatedly, and did everything in his power to guarantee that the remainder of our visit, would be enjoyable- and it was. Bear in mind, this is a new establishment and every new place, needs time to get into the groove. I believe they are still ironing out the kinks. If you are really famished, do not get the bento box, the portion is VERY small.",3.0
"Came here as a first stop in New York for a late night dinner with friends. The restaurant itself is a great place, pleasant atmosphere, easy to find, and cheerful wait staff. However, the food itself was average or slightly above average in regards to the fusion category.For dinner, my friends and I ordered the following: bulgogi tacos, lamb shank, pork belly, Brazilian green rice, Reuben sandwich and the free cheese bread/appetizer (that's offered if you check in via Yelp). Cons: For the appetizer, the bread was quite bland with no flavor. The dough itself was a bit too dry and overall, not a memorable dish. For the pork belly, this dish was a bit over fried and a bit too salty than expected. For the Reuben sandwich, this was pretty average, the sauce used for the dish had a unique texture to it. The sandwich itself is not too big or small and is pretty filling. Finally, I didn't really know what to expect of the green rice but it tasted like regular rice to me with no particular spices/herbal flavoring to it.Pros: The lamb shank and tacos were amazingly yummy! The tacos were an excellent example of Asian / Mexican food fusion and was very tasty. Sweet and spicy, the tacos were filling with its beef and various veggies. As for the lamb shank, the sides were alright but the lamb itself was super tasty, with the meat being super tender and moist. Overall, service here was pretty average. The waitstaff were friendly but given that it was a slow Thursday night, it did take us awhile to get the bill and such. I would recommend this place if you like tacos/lambs or just want to take a stab at eating fusion food.",3.0
"Overall my experience here at Streets was wonderful.  Everything we tried was amazing.  We had the doubles, bulgogi tacos, shark and bake,Mexican corn, pain killa drink and it was awesome.  Try it some time",5.0
"**came here w/ my family one saturday afternoon day b4 valentine's daycame in with no reservations and was seated immediately my lover started with tea and they had several selections....had a great aroma i ordered the jerkin pork : was disgusted it gave me the taste of a salisbury stake out of a grocery store tv dinner that was warmed and served to me the plantings were ok the small salad or cabbage had lil to much dressingmy lover ordered the ceviche  ecuatoriano : it was alright!! my mother and daughter shared the 3 way street topas w/ peri peri  wings, doubles, sicilian arancini :  good they loved it was really into have a cocktails so we just had watermelonnice cute place to come to everyone was dressed nice (the employees) waiter was very nice nice smooth music going the food isn't that great so dont think we will be back in a rush signedwe luv to eat and we eat out consistently!!mr.von teese & familyxoxox",1.0
