"The Bounty is a welcome addition to Greenpoint, one among many new spots that is raising the bar in the area with excellent food, drink, and ambiance.The menu is a bit small, but provides a variety of tantalizing options, both from the bar and the kitchen alike. The cocktail list is a mix of old and new classics, myself having had an above average old fashioned. And to start we had a great mixed cheese plate that, for once, wasn't so expensive that I had to give my arm, leg, or rights to my first born child.For entrees we ordered the Cobia filet, and the burger, in spite of the fact that most of the menu was seafood (as it is a nautically themed joint). Both were excellent. The Cobia was served with a warm melange of green and white beans, with a lemon puree. The burger, probably the best that I've had in Greenpoint, was perfectly cooked and served on their house baked brioche. The decor and ambiance was classy but relaxed and not douchey. The music was a mix of chill crooners (Nat King Cole makes everything better). The staff were attentive, informative and friendly.Do yourself a favor, and try The Bounty, ASAP!",5.0
"Pros: solid drinks, food and serviceCons: the menu is basic fare - but some nights that's just what you want.Overall: the space is cute and the service attentive - you won't be blow away but that's ok.",4.0
"Just finished my third supper at the bounty. The food, as always, was exquisite.  the sous vide chicken--holy oh my god it's one of the best birds I've ever had. And happy hour oysters is always a nice great for the early birds. Kevin and Brian, the bar men, make yummy cocktails with care, and lance, the owner is gracious and welcoming.  Ambiance is lovely, service is great and most importantly, super excellent food. Nomnomnom!!!",5.0
Excellent food and drinks. Good service. Friends had the cauliflower and said it was amazing. I had the fettuccine which was delicious.,5.0
"We came to the Bounty with a group to celebrate a birthday. The staff were friendly & attentive from the moment we stepped in the door to the minute we left. We enjoyed the expertly crafted cocktails and thoughtful wine list. Our food came out quickly and was made to absolute perfection. I had the burger medium rare--it was delicious. Loved the tomato jam.Our group also loved the vibe. Rustic yet modern, nautical touches, and an amazing bar that you kind of just have to see for yourself. The Bounty is understated cool. It was the perfect place to celebrate a birthday--sophisticated but not fussy. Definitely will be back next time I'm in the area!",5.0
"I know this place just opened, but the menu was pretty bland and pedestrian for the prices and the portions.   Yet another eatery done up in the quintessential Williamsburg salvag-chic style...  We ordered the mussels for an appetizer for eight dollars and got eight mussels lined up with no bread.  They were good enough, but can't compare to the 5 Leaves.   Muscles are notoriously inexpensive. So eight mussels for eight dollars better be high concept.    We had noodles with clams for dinner, one of four entrée options. Again, it was nothing to write home about and overpriced.    I won't say this place is bad. It's fun it's a good atmosphere, but there are so so so so so many better places to eat in a half-mile radius....",2.0
"GET THE WHOLE GRILLED FISHand you better not be shy to eat the head! this skin has the little bits of tasty char from the grillit's crisy & seasoned juuust right mmmmm so good&they paired it w a fennel/dill/grapefruit goodness...i could have eaten 2 or 3 of those... the fish of the day was doradomy partner had the burger and i stole his fries - he said it was good but i seemed way more excited about the fish than he w his burger...heheheoysters - were fresh, i mean... i really dont think you can go wrong w oyster places now a days... i dunno, call me crazySKIP THE DESSERTS!i mean the pot the creme is a pot de creme but it's not an AMAZING pot de cremeand the other cornbread pudding mimic from brittany - skip it, it almost needs a little more moisture and bounce or sauce...it was too grainy and sad..and needed a sweeter kick",5.0
"Best brunch in Greenpoint!! The hubby and I cannot dine here without ordering the homemade biscuits, ricotta and jam as an appetizer -  so fresh and mouth-watering (especially as I write this)! The  sunny fried rice is extremely flavorful and unique. Their savory hollandaise sauce blows away every other florentine in the neighborhood. Lovely atmosphere and tunes, super friendly and attentive staff, bottomless coffee. Always looking forward to coming here for brunch!",5.0
"I've been a longtime yelp user but only a place like The Bounty could actually compel me to leave my first review... it was AMAZING.  My friend and I stumbled upon it one night after being turned away by a 1 hour 45 minute estimated wait time at Paulie Gee's.  We walked down Greenpoint Avenue, peering into the various storefronts until we were drawn into The Bounty by an inviting menu and a super cute ambiance.  Once seated, we asked a question about one of the menu items and the waiter (owner?) explained that all the bread in the restaurant is made in-house by an Asian guy who was standing behind the bar, who also happened to be a craft bartender as well.  With that kind of a skill set, we thought, how could we go wrong?  We both ordered the catfish sandwich and a pair of seasonal drinks and were floored by how delicious our meal was.  The catfish was perfectly breaded, and the bread was soft, buttery and kind of melted in your mouth.  The drinks were really unique and incredibly smooth.  We shared a plate of oysters as well, and in truth, they were okay but not great so we'll probably skip them next time.  Needless to say, we are both dying to go back as soon as possible.  This place is an absolute gem in Greenpoint!",5.0
"this place is fine, i live in the neighborhood and want to like it.  some suggestions:  your eggs benedict, the hollandaise needs to be more tart, its basically just egg and butter sauce on eggs.  I like the idea of pork belly underneath but its lacking a brightness of flavor that you get from traditional cured meat underneath an eggs benedict.  this all makes the dish a little flat... otherwise pleasant place, will try more.",3.0
"The Bounty is a welcome addition to Greenpoint, one among many new spots that is raising the bar in the area with excellent food, drink, and ambiance.The menu is a bit small, but provides a variety of tantalizing options, both from the bar and the kitchen alike. The cocktail list is a mix of old and new classics, myself having had an above average old fashioned. And to start we had a great mixed cheese plate that, for once, wasn't so expensive that I had to give my arm, leg, or rights to my first born child.For entrees we ordered the Cobia filet, and the burger, in spite of the fact that most of the menu was seafood (as it is a nautically themed joint). Both were excellent. The Cobia was served with a warm melange of green and white beans, with a lemon puree. The burger, probably the best that I've had in Greenpoint, was perfectly cooked and served on their house baked brioche. The decor and ambiance was classy but relaxed and not douchey. The music was a mix of chill crooners (Nat King Cole makes everything better). The staff were attentive, informative and friendly.Do yourself a favor, and try The Bounty, ASAP!",5.0
"Pros: solid drinks, food and serviceCons: the menu is basic fare - but some nights that's just what you want.Overall: the space is cute and the service attentive - you won't be blow away but that's ok.",4.0
"Just finished my third supper at the bounty. The food, as always, was exquisite.  the sous vide chicken--holy oh my god it's one of the best birds I've ever had. And happy hour oysters is always a nice great for the early birds. Kevin and Brian, the bar men, make yummy cocktails with care, and lance, the owner is gracious and welcoming.  Ambiance is lovely, service is great and most importantly, super excellent food. Nomnomnom!!!",5.0
Excellent food and drinks. Good service. Friends had the cauliflower and said it was amazing. I had the fettuccine which was delicious.,5.0
"Went here again on Saturday with my best friend and we love this place!  I had the special which was salmon done beef wellington style.  The fish had a pastry shell around it like a beef wellington would, it was in the shape of a volcano with an egg at the top - looked like a work of art I swear I am so sorry I did not take a pic of it.  It was so delicious and my friend had the duck with barley  he loved it.  I usually eat like someone will take the food away but not that night I slowly ate and ate.  We also had the chickpea app to start which was another very tasty dish.  I even got the recipe from the chef I had a Manhattan which I have never had before it was so good.  You cannot beat the Bounty.  The place is awesome to look at and the food is top of the line.  The prices are reasonable.  The people who work here are so nice.",5.0
"They are doing things right at The Bounty! Wonderful food, wonderful atmosphere!The atmosphere was great. The staff was super friendly and sincere. There is an amazing sculptural Alice in Wonderful design for the bar. Even the music made me happy. And to bring it on home, the food was superb. We had the whole grilled fish, and it was excellent, as was the flute ceviche, the buttermilk hush puppies, and the house salad with its perfect mix of greens and a light mustard based dressing. Finally, the dessert was out of this world, an eggy cakey tort with a crazy delicious sour cherry sauce. I agree with the last reviewer. This is our new go-to spot in Greenpoint.",5.0
Love the menu. Love the atmosphere. Quality of both food and drink is great. Service is good as well. All in all this place is one of my favorites in Brooklyn and totally worth the trek into Greenpoint.,5.0
Overall a pleasant experience. The whole fish was much appreciated yet rather overpriced. A nice neighborhood joint with a cosy vibe and pretty good food.,4.0
Eh. That's all I felt when I left. Oysters were good but the two entrees we had were uninspired & dull. Great vibe & cocktails.,2.0
"A restaurant that is willing to host a party of 6 on a Saturday is as rare as the illusive in-unit washer and dryer combo in this city. Thankfully, The Bounty, and more specifically the fantastic staff, was more than willing to host my party and was overly accommodating. Lance was quick to respond and extremely kind; he even remembered my name when I returned for dinner on a different evening (or maybe we were just so obnoxious he just couldn't forget us....hopefully not the latter). Our waitress, Amy, was equally as knowledgable and patient and couldn't have been sweeter. Now for the important food-review stuff: It's all amazing. Everything I've tried, from the grilled watermelon salad, to the oysters, to the cocktails (one of the partners hails from The Drink ), and all of the main dishes I have tried are executed perfectly. Upon ordering the whole-roasted fish, we were shown how to properly de-bone it without looking like a bunch of inexperienced idiots poking around at our dish. A friend who works at Gramercy Tavern said the burger was so good that it was up there (if not exceeding) the quality of the Gramercy Burger (!!!) and the hand-cut fries were perfectly crispy and just salty enough. I recently tried a beet salad, which was honestly one of the best I've ever had (ricotta salata people!). The seared duck breast with cherry sauce, kale, and roasted fingerling potatoes was well crafted and combined the best earthy flavors of fall without overpowering the richness of the duck-breast. Overall, you really can't go wrong here. Take extra note of the cleverly-constructed ""shipwreck"" bar and the sail lining the ceiling. Though the space is the standard size of most Brooklyn restaurants, I love that they have left ample room so that you're not brushing elbows with your neighbors. There's also a backyard, though it doesn't appear that they use it as seating for dining.",5.0
"Get the burger or the grilled tuna sandwich--wow, best burger I've had in Greenpoint! Almost rivals Fritzl's in Bushwick. Staff is so nice, food was so fast,  place is really cozy without being cramped.",5.0
Oysters are a bit overpriced for being so small. But they were tasty. The fettuccine was very good and the service was perfect. Definitely going again.,4.0
"Obviously this is a place best frequented by people who eat seafood (I think they may have a burger on the menu too) Ambiance great, people super friendly. The menu ia small (supposedly they are expanding it) but the food was great and fresh. They make a good Dark N Stormy too.",4.0
"my taller half decided to select a place from ""eater.com"". the Bounty sounds intimidating by it's own name... from the rave reviews, i decided to give it a try! my pallets were looking forward to a party on the cool friday night!! as we parked in a familiar side of brooklyn, we walked right passed the place. we got there around 8pm, not crowded at all. we were seated accordingly, then 5 minutes later it was packed! the decor was unusual... i was surprised by the menu, being so small... i didn't know what to get at a seafood restaurant/bar that only had 4 main entrees on their menu. there choices were:MAINSwhole grilled fishwith a shaved fennel & red grapefruit salad in a pink peppercorn vinaigrette MPpan roasted cobiawith a spring bean & pancetta ragout & a lemon pureé $21fettuccine with clamshouse made fettuccine, served with white wine butter sauce and fresh herbs $15burgeron a house made roll with tomato jam, mayonnaise, red onion & a side of fries $14add grafton 2 year cheddar $1O.oto start off, we ordered some oysters from washington state (which weren't on the menu!).  i settled for a burger, since i'm a carnivore, and she chose the fettuccine with clams. the drink menu was interesting.. i was aiming for a nice ice cold german beer to go with the burger, sure enough - i was reading through the cocktail list, i saw the ""bee's knees!"" just the thing to help my voice, since i lost it last saturday! the oysters - nothing special about it. i asked for sweet...either she needs to learn about oysters or i need to brush my teeth. they were very clean and silky smooth. thank the lord i only ordered 4 to sample. 2 for her, 2 for me - one to taste - the second one to make sure it was... umm...yeh.the fettuccine with clams - don't get me wrong here, but the chef knows what he's doing here!! it is what it is and it was fettuccine with clams... nothing special, nothing to talk about.the burger - i've been eating burgers all month. i came to a seafood restaurant/bar looking for seafood and NOTHING CAUGHT MY EYE, but a burger...i will eat a burger. i ordered the burger medium moo (with blood), and the chef did it again! he was on point with the blood!! again...nothing special with the burger, and it's extra cheese for a dollar.one thing i like about this place is the CHEF. he does what he's told to do, cook!would i come back here? NO.my point is...nothing stands out.",2.0
"Went here again on Saturday with my best friend and we love this place!  I had the special which was salmon done beef wellington style.  The fish had a pastry shell around it like a beef wellington would, it was in the shape of a volcano with an egg at the top - looked like a work of art I swear I am so sorry I did not take a pic of it.  It was so delicious and my friend had the duck with barley  he loved it.  I usually eat like someone will take the food away but not that night I slowly ate and ate.  We also had the chickpea app to start which was another very tasty dish.  I even got the recipe from the chef I had a Manhattan which I have never had before it was so good.  You cannot beat the Bounty.  The place is awesome to look at and the food is top of the line.  The prices are reasonable.  The people who work here are so nice.",5.0
"They are doing things right at The Bounty! Wonderful food, wonderful atmosphere!The atmosphere was great. The staff was super friendly and sincere. There is an amazing sculptural Alice in Wonderful design for the bar. Even the music made me happy. And to bring it on home, the food was superb. We had the whole grilled fish, and it was excellent, as was the flute ceviche, the buttermilk hush puppies, and the house salad with its perfect mix of greens and a light mustard based dressing. Finally, the dessert was out of this world, an eggy cakey tort with a crazy delicious sour cherry sauce. I agree with the last reviewer. This is our new go-to spot in Greenpoint.",5.0
Love the menu. Love the atmosphere. Quality of both food and drink is great. Service is good as well. All in all this place is one of my favorites in Brooklyn and totally worth the trek into Greenpoint.,5.0
Overall a pleasant experience. The whole fish was much appreciated yet rather overpriced. A nice neighborhood joint with a cosy vibe and pretty good food.,4.0
Eh. That's all I felt when I left. Oysters were good but the two entrees we had were uninspired & dull. Great vibe & cocktails.,2.0
"A restaurant that is willing to host a party of 6 on a Saturday is as rare as the illusive in-unit washer and dryer combo in this city. Thankfully, The Bounty, and more specifically the fantastic staff, was more than willing to host my party and was overly accommodating. Lance was quick to respond and extremely kind; he even remembered my name when I returned for dinner on a different evening (or maybe we were just so obnoxious he just couldn't forget us....hopefully not the latter). Our waitress, Amy, was equally as knowledgable and patient and couldn't have been sweeter. Now for the important food-review stuff: It's all amazing. Everything I've tried, from the grilled watermelon salad, to the oysters, to the cocktails (one of the partners hails from The Drink ), and all of the main dishes I have tried are executed perfectly. Upon ordering the whole-roasted fish, we were shown how to properly de-bone it without looking like a bunch of inexperienced idiots poking around at our dish. A friend who works at Gramercy Tavern said the burger was so good that it was up there (if not exceeding) the quality of the Gramercy Burger (!!!) and the hand-cut fries were perfectly crispy and just salty enough. I recently tried a beet salad, which was honestly one of the best I've ever had (ricotta salata people!). The seared duck breast with cherry sauce, kale, and roasted fingerling potatoes was well crafted and combined the best earthy flavors of fall without overpowering the richness of the duck-breast. Overall, you really can't go wrong here. Take extra note of the cleverly-constructed ""shipwreck"" bar and the sail lining the ceiling. Though the space is the standard size of most Brooklyn restaurants, I love that they have left ample room so that you're not brushing elbows with your neighbors. There's also a backyard, though it doesn't appear that they use it as seating for dining.",5.0
"Get the burger or the grilled tuna sandwich--wow, best burger I've had in Greenpoint! Almost rivals Fritzl's in Bushwick. Staff is so nice, food was so fast,  place is really cozy without being cramped.",5.0
Oysters are a bit overpriced for being so small. But they were tasty. The fettuccine was very good and the service was perfect. Definitely going again.,4.0
"Obviously this is a place best frequented by people who eat seafood (I think they may have a burger on the menu too) Ambiance great, people super friendly. The menu ia small (supposedly they are expanding it) but the food was great and fresh. They make a good Dark N Stormy too.",4.0
"my taller half decided to select a place from ""eater.com"". the Bounty sounds intimidating by it's own name... from the rave reviews, i decided to give it a try! my pallets were looking forward to a party on the cool friday night!! as we parked in a familiar side of brooklyn, we walked right passed the place. we got there around 8pm, not crowded at all. we were seated accordingly, then 5 minutes later it was packed! the decor was unusual... i was surprised by the menu, being so small... i didn't know what to get at a seafood restaurant/bar that only had 4 main entrees on their menu. there choices were:MAINSwhole grilled fishwith a shaved fennel & red grapefruit salad in a pink peppercorn vinaigrette MPpan roasted cobiawith a spring bean & pancetta ragout & a lemon pureé $21fettuccine with clamshouse made fettuccine, served with white wine butter sauce and fresh herbs $15burgeron a house made roll with tomato jam, mayonnaise, red onion & a side of fries $14add grafton 2 year cheddar $1O.oto start off, we ordered some oysters from washington state (which weren't on the menu!).  i settled for a burger, since i'm a carnivore, and she chose the fettuccine with clams. the drink menu was interesting.. i was aiming for a nice ice cold german beer to go with the burger, sure enough - i was reading through the cocktail list, i saw the ""bee's knees!"" just the thing to help my voice, since i lost it last saturday! the oysters - nothing special about it. i asked for sweet...either she needs to learn about oysters or i need to brush my teeth. they were very clean and silky smooth. thank the lord i only ordered 4 to sample. 2 for her, 2 for me - one to taste - the second one to make sure it was... umm...yeh.the fettuccine with clams - don't get me wrong here, but the chef knows what he's doing here!! it is what it is and it was fettuccine with clams... nothing special, nothing to talk about.the burger - i've been eating burgers all month. i came to a seafood restaurant/bar looking for seafood and NOTHING CAUGHT MY EYE, but a burger...i will eat a burger. i ordered the burger medium moo (with blood), and the chef did it again! he was on point with the blood!! again...nothing special with the burger, and it's extra cheese for a dollar.one thing i like about this place is the CHEF. he does what he's told to do, cook!would i come back here? NO.my point is...nothing stands out.",2.0
"Back Bar is AMAZING, cabinets all over the place, well done designer builder.... staff was super fun and nice bickering at each other behind the bar and seemed like they were having a good time.  I was at the bar with some friends.  Had the watermelon cooler and it was refreshing but not home run.  I switched to red wine which was $7 a glass and really nice.  The ceviche was good and the cheese was good.  Nothing bad to say and definitely worth a visit.",5.0
"We had the burger. Great tasty charred meat, great buns, yummy fries. I also had the watermelon summer adult beverage that i forgot the name of hahaha. It was very strong but light and refreshing. now about the burger, I would compare it to the five leaves burger in terms of quality, flavor and satisfying moist meaty deliciousness. Thankfully it is much  less overwhelmingly salty (my bf always orders the burger at five leaves and I Honestly can't eat it without a gallon of water afterwards). I'm so excited we can finally both go get a local burger together without encountering a pretentious staff or too crowded interior. We didn't try anything else off the menu yet, but I'm excited to back back very soon. I will revise this to include a fifth star once they make adding bacon to the burger an option and once we've tried more than half of their menu :)",4.0
"We were vacationing in Brooklyn, NY, and selected The Bounty for dinner.  The staff was extremely attentive, everyone in our party was fascinated by the unique decor and best of all the food was yummy. Everything was fresh and well seasoned. The roasted duck breast was perfectly prepared. Kudos to the chef.",5.0
"Decor, service food all awesome.  Laid back stylish vibe, friendly, attentive staff and most importantly everything we had was really good.  The mussels are excellent, gazpacho tasty.  It's also right next door so will be back.  Prices are very reasonable for quality of food..",5.0
"Great place, my new go to spot in the neighborhood.  Great cocktail menu, extremely fresh seafood (love the oysters), and surprisingly for a seafood spot, they have an amazing burger.  My favorite burger so far in greenpoint, beats out the river styx burger hands down!Also to top off the great food, love the decor, makes you feel like you're on an old sailboat.",5.0
fab shrimp ceviche. maybe the best sazerac I've had and a mellow old fashioned too. Loved the boat sail adorning the ceiling.,4.0
"The Bounty is great. A perfect balance is struck here. Great food, not overwrought, but not simple either. Attention to preparation, ingredients, but without micro portion pretense or dilettante foodie bs. The bar is a sleeper hit. True, skilled bartenders, high grade spirits and several house made supportive ingredients. Many other bars around sure, but I have gone here just for cocktails, which are so well made and fairly priced (most at $10) that I've looked for reasons to drink elsewhere but turn up none.",5.0
"Really enjoyed the rosemary aroma of the Alpine seasonal cocktail ($12). Tasty tuna tartar, good kale salad and whole grilled fish (Durado) was excellent. Recommend.",5.0
"Usually don't do reviews but had to leave one bout this place i went thursday night for a late dinner food was amazing highly recommend the grilled fish , drinks were great but sad to say the service wasn't exactly perfect all because the waiter decided to chase me down the street to tell me i didn't tip him funny thing i left him a $20 tip . All together my  experience was great there util that happened i really hope chasing guest down the street was not part of their training .",3.0
