"I made the awful mistake of having ""brunch"" at The Pines yesterday and it was by far my worst dining experience in the 20 years I've lived in NYC.  Let me recap:I arrive solo at 12:45 for a 1pm table of 5.  When I arrive the place was dead, and also ~5 degrees warmer than the heat-waved sidewalk.I ask for a bloody mary and the bartender says I'm lucky bc they only have enough mix left for about 3.  I ask what time brunch ends and she said 3pm. I mentioned that we have a table of 5 coming in and asked if she'd put aside one drink's worth for the bday boy (which she did).  When I mentioned having a reservation she looked puzzled and said that there were no reservations in the book for today.  I should note that a non NYer in my group found this place and made the reservation, and she did so about two weeks back.  I looked at the book with her, which had no entries in the time/date grid, and then spotted our reservation written small in the corner, versus being on the grid.  Odd.Anyhow, I remained optimisted and glanced the menu, which was about as anti-brunch as any brunch menu I've ever seen. A total of seven items -- three of them fish -- with no eggs or anything else remotely brunch-like.  I remained positive while chatting with the bartender and mentioned that it was a very whimsical menu, and asked her what her favorite item was.  She went through the list saying why each dish was great (not what I asked her) and then went on to mention that they might already be out of a couple of their [seven] choices.  Really?! At this point my spidey senses were tingling big time.My party arrives [on time] and we're sat.  By that time a pretty decent crowd had amassed in the dining room, which was somewhat reassuring.  We were given warm, ice-less water (in their hotter-than-outside restaurant) and proceed to sit for -- I shit you not -- 45 minutes with nothing but our warm water.  We asked for ice and they eventually came back with a water pitcher that had a handful of mostly melted ice cubes at the top, and then went on to top off our warm water glasses (making almost no difference to the temp).  To confirm, we did place a drink order about 30 minutes prior, at which time they announced the lack of bloody mix (short of the one they saved for me) and so the rest of the table ordered their only other drink option -- a grapefruit juice mimosa.  After we got our 45 minute melted ice refresh we asked about the drinks, only to find out they they WERE OUT OF GRAPEFRUIT JUICE.  We should have walked out at that point but I refrained from pushing bc I already had the person in my group who chose the place feeling bad, and I could tell she wanted to ride it out and seen if the food brought any redemption (it didn't).  Anyway, we were told that they were at that very moment squeezing fresh OJ to get us drinks (never even asked if orange was ok).  15 minutes later (the ONE HOUR mark), we were brought the most lackluster mimosas ever, most of the let down being the 45 minute wait for the drinks to arrive.  I should also note, btw, that the bloody mary mix was absolute crap: Watery, no horseradish, extremely underwhelming.  Oh, and they used a jigger to measure out the single shot of vodka, so it was both crappy AND stingy.So somewhere in that first hour we placed our food order -- never being told they were out of anything -- and when the meal finally dropped (at 2:15pm -- the first food we've seen all day, including no bread, for our 1pm reservation), we find out that, AFTER ALL THAT TIME, one of the items ordered was out, which amounted to one of us not being served anything.  So four of us sat there with food, sharing portions with the 5th, while the kitchen ""scrambled""  to bring out the alternate dish they recommended to our unlucky party member: some salmon crudo.  It took them 15 minutes to throw together a plate that consisted of 5 pieces of salmon sashimi strewn amidst pieces of torn rye sandwich bread (with a sauce drizzle of some sort).  THAT took 15 minutes??!!  Christ, after all we've been through they should have had that out in 15 SECONDS, especially given what a simple/boring dish it was.  The rest of us were done when the salmon finally arrived.The entire meal should have been comped. It wasn't (very little was).  The Pines should be ashamed of itself for their disgraceful performance. Amateur hour x1000. And all this comes from a bonafide foody with YEARS of fine dining service experience, btw. EDIT: In the interest of fairness I want to point out that the owner has contacted me directly and offered to make amends by way of a refund.  A very professional and classy move, and a greatly appreciated gesture. Had this been offered by the manager yesterday (I don't believe the owner was present) it definitely would have diffused (or altogether squashed) this review.Also, I do want to mention that the lamb bacon (from my Lamb BLT) was stellar.",1.0
"It pains me a little bit to give the Pines 3 stars.  I adore its older seester Littleneck, and I was so excited to give this landlubber sibling a try.  It just did not come close to what we were expecting and left us with a decent, but sadly not a very memorable meal.We got there on a weekend evening around 9 and there was a 40 minute wait.  No big deal, went to Canal Bar for a drink and the Pines staff nicely called within half and hour.  Interior of the restaurant is purposefully shabby rustic, with an antiquey feel throughout.  A few bottles of wine and one of the appetizers were no longer available - ok on the appetizer, but perhaps the wine shortage can be avoided by keeping more in stock, especially on a weekend evening?Started off fun, got the amuse bouche while Biggie's ""Juicy"" was playing.  Orange wedge over a tofu cream, refreshing.  Then we started with the bone marrow appetizer, which is topped with tobiko and chickweed, and served with olive bread.  Olive bread was torn by hand, warm and deliciously crusty.  Scooping the bone marrow on to the bread, it was a nice dish.  I liked the tobiko addition texturally, had no idea why the chickweed was on top as it seemed like a hinderance on the dish to be pushed aside to get to the marrow.  Large bone, not so much marrow, but tasty.   Seemed to need some salt or something to bring out the marrow.  Next, the much touted pici, thick strands of pasta with trotter ragu.  Decent dish, nothing revelatory, simple but a little doughy.  Tiny pieces of pork were tasty but scarce.  Main dishes were decent, especially the skirt steak - beautifully sliced and presented, tasty with beefy flavor.  However, the evening was soured by the pork shoulder dish which was truly a little odd on the palate.  Some of the pieces were very fatty and chewy (not in a good way) and the nduja (a spicy spreadable sausage saucey residue - and lots of it) was really offputting.  Had a cornmeal texture which did not go well with the pork and its spice overwhelmed the delicate pork.  I really think the Pines should rethink this dish, as we love spicy dishes and pork, and especially spicy pork dishes, but this one fell flat.  We did not have dessert which is a choice of gelatos.For the prices the Pines is charging, there needs to be more than a loud soundtrack, beavis and butthead scrawled on a menu, and random ingredients thrown in because they sound exotic.   Things need to come togerher so that a restaurant sticks around past the hype.  Overall, I'd like to give the Pines another shot as its success will be integral to Gowanus' culinary boom, but the night we went was not its night.  Cash only.",3.0
"Sunday night at 6:30 pm.  That's when we walked to The Pines because they don't take reservations for parties under six people and we really really wanted to try the food at The Pines.  We were not disappointed.We started with the La Quercia prosciutto.  Ahhh... buttery good and tasty.  And if it wasn't buttery enough, butter on the plate to slather on the rustic bread that accompanied the meat.Do you like bone marrow?  Then try the dish served up at The Pines.  Soft juicy and scraped from the bone, it was flavorful and wonderful.Pasta called ""pici"" served al dente and with ""trotter"" which from the taste was a rich gamey pork.  Covered in tomato and pecorino cheese. Wow was this dish great!Wine by the glass is very well priced, I had a grenache/carignan combination that was only $12 the glass.  the waitperson warned me that it had ""barnyard"" flavors and offered me a taste first.  I didn't tell her that I knew the taste well, but I was really bowled over by how well it brought out the pig in the pici.  A definite score.Prices are not moderate, but also will not kill your wallet.  A definite five star restaurant.",5.0
"After a wildly negative experience months back, my dining partner-in-crime/BFF and I decided to give The Pines another chance. Why not? We both read some great reviews from trusted sources, so we felt like we must've gotten them on an off night. Or something. So we went back for dinner on a rainy, muggy Tuesday evening, and the place was packed. I did have some flashbacks to being deserted at our table for several minutes, but all anxious thoughts were forgotten soon into this meal.Our plan of attack was one dish from each section (minus the pasta). We had a very attentive and knowledgeable waiter, who even swapped out our first glasses of wine that for us were simply not enjoyable. Apparently they dig the earthy, funky varietals at this place. Okay. So long as I get wine that I can drink, I'm cool with that. The kitchen surprised us with an amuse-bouche - a delightful sorbetto with mint. We got some hudson valley goat/cow's milk cheese blend to start, which comes with a hefty hunk of crusty bread. A promising beginning. We moved onto a spicy octopus with melon. Mmm. Hot and sweet, very nice. We also got a cucumber dish that had different types of cucumbers stacked neatly. Very inventive, simple yet smart and balanced. And finally, duck. With a smoky barbecue-like sauce. It almost tasted as if the duck was smoked in some way, but I think it was just the sauce. Who knows. I do know it was delicious and we demolished the plate, along with everything else. With a surprise dessert from the kitchen to top it off, we left with very good tastes in our mouths (literally and figuratively this time, thankfully). My only complaint was the pacing: the cheese, octopus and cucumber appetizers were thrown at us within three minutes of each other, even though our waiter gave us a bit of an itinerary for the night which specifically involved cheese first, then the other apps as they came out of the kitchen, then the duck. After the onslaught of appetizers, we waited an absurdly long amount of time for our duck entree, to the point that we were a little concerned they had forgotten about it.So now I get it. The Pines serves inventive, creative, well thought-out dishes that with a little more focus as they seem to have now that they've been open for some time, is well worth it.",4.0
"I have been here at least half a dozen times, however never for brunch, the menu changes quite often which is great because i tend to get stuck in routine at my favorite restaurants.  Anyway I especially enjoyed the 2 rabbit dishes, i've never had rabbit before and I was pleasantly surprised!  When i can swing it I always get the Wag-yu steak, they have some secrete way of cooking it that the chef tried to explain to me but I'm no foodie so i cant tell you what it was.  The ""Ants on a log"" desert is probably my favorite of all time, its just so friggin clever!  The rest of the menu is really creative and fun and I have never been totally disappointed in anything i ordered, I would always recommend the salumi plate for starters! I think the food is quite unique even for brooklyn, and the booze selection is quite good (I don't drink wine!).  DON'T TELL ANYONE! but sometimes on the weekends they have a free DIY S'mores bar by the fire pit in the back yard, hardly anyone ever ventures back there, but its a super sweet treat to end any meal! especially if anyone in your group smokes...lol.  My only gripe about this place is that they don't have a burger on the menu, ever! and I'm pretty sure they take credit cards now.",5.0
"Deliciousness all around and server, Josh was a star.  Great vibes, great atmosphere and great assortment of seasonal delectables.",5.0
"Amazing food, amazing people--whiskey with truffles and anything they recommend.",5.0
"I really wanted to like this place, but it fell short. This place isn't on par with Roberta's. I don't know how they managed this, but the pork shoulder and duck breast had an identical consistency. The pork shoulder was good but not fantastic. The duck breast was pretty good. The best part of our meal was the amuse-bouche and the bread (which is incredible). Overall I was disappointed and feel that we overpaid for the quality of food.The wine selection is pretty good. Supposedly the cocktails are great, but I didn't have any...probably should have.",2.0
"WAY too expensive for the amount of  food. I'm not some glutinous American either but it was just shameful for that area. On the other hand, it was very delicious! The interior was really cool, great wines, and amazing cheese appetizer. I got the oxtail entree which was great. My husband got the pork shoulder aka 5 bite sized pieces of fat which was pretty disappointing. It may be difficult to get him to go back for a second try but I thought the quality and pairings of food was interesting. Sadly not the prices:( OH and the menu is the horribly designed, please straiten out the content so people can actually understand what goes with what... apparently the two tables who sat next to us also agree with me on this.",3.0
"an incredible meal was had at the pines. this spot is a little pricey - with 2 drinks (1 mixed, 1 beer) and a shared entree - we still spent $200 with tip. that said, we also made our way through the menu from top to bottom starting with the cheese plate. it comes with an outstanding amount of breads and delicious cheeses. we asked for some of the caraway butter (which comes with the bread dish, not the cheese dish).  I recommend you ask for and taste before leaving. we made our way next to the foie gras which was velvety rich and divine - just like you want and expect your foie gras to be!next we had the persling salad with egg. this was a nice ""in between""  to have after the foi gras and before hitting the next two entrees that we ordered. razor clam pasta was fresh and flavorful (however our least favorite dish of them all). our last dish was the waygu beef with kimchi and it was just melt in your mouth outstanding. too full for dessert, we rolled out of there still talking about the amazing meal that was had at the pines!",4.0
"I made the awful mistake of having ""brunch"" at The Pines yesterday and it was by far my worst dining experience in the 20 years I've lived in NYC.  Let me recap:I arrive solo at 12:45 for a 1pm table of 5.  When I arrive the place was dead, and also ~5 degrees warmer than the heat-waved sidewalk.I ask for a bloody mary and the bartender says I'm lucky bc they only have enough mix left for about 3.  I ask what time brunch ends and she said 3pm. I mentioned that we have a table of 5 coming in and asked if she'd put aside one drink's worth for the bday boy (which she did).  When I mentioned having a reservation she looked puzzled and said that there were no reservations in the book for today.  I should note that a non NYer in my group found this place and made the reservation, and she did so about two weeks back.  I looked at the book with her, which had no entries in the time/date grid, and then spotted our reservation written small in the corner, versus being on the grid.  Odd.Anyhow, I remained optimisted and glanced the menu, which was about as anti-brunch as any brunch menu I've ever seen. A total of seven items -- three of them fish -- with no eggs or anything else remotely brunch-like.  I remained positive while chatting with the bartender and mentioned that it was a very whimsical menu, and asked her what her favorite item was.  She went through the list saying why each dish was great (not what I asked her) and then went on to mention that they might already be out of a couple of their [seven] choices.  Really?! At this point my spidey senses were tingling big time.My party arrives [on time] and we're sat.  By that time a pretty decent crowd had amassed in the dining room, which was somewhat reassuring.  We were given warm, ice-less water (in their hotter-than-outside restaurant) and proceed to sit for -- I shit you not -- 45 minutes with nothing but our warm water.  We asked for ice and they eventually came back with a water pitcher that had a handful of mostly melted ice cubes at the top, and then went on to top off our warm water glasses (making almost no difference to the temp).  To confirm, we did place a drink order about 30 minutes prior, at which time they announced the lack of bloody mix (short of the one they saved for me) and so the rest of the table ordered their only other drink option -- a grapefruit juice mimosa.  After we got our 45 minute melted ice refresh we asked about the drinks, only to find out they they WERE OUT OF GRAPEFRUIT JUICE.  We should have walked out at that point but I refrained from pushing bc I already had the person in my group who chose the place feeling bad, and I could tell she wanted to ride it out and seen if the food brought any redemption (it didn't).  Anyway, we were told that they were at that very moment squeezing fresh OJ to get us drinks (never even asked if orange was ok).  15 minutes later (the ONE HOUR mark), we were brought the most lackluster mimosas ever, most of the let down being the 45 minute wait for the drinks to arrive.  I should also note, btw, that the bloody mary mix was absolute crap: Watery, no horseradish, extremely underwhelming.  Oh, and they used a jigger to measure out the single shot of vodka, so it was both crappy AND stingy.So somewhere in that first hour we placed our food order -- never being told they were out of anything -- and when the meal finally dropped (at 2:15pm -- the first food we've seen all day, including no bread, for our 1pm reservation), we find out that, AFTER ALL THAT TIME, one of the items ordered was out, which amounted to one of us not being served anything.  So four of us sat there with food, sharing portions with the 5th, while the kitchen ""scrambled""  to bring out the alternate dish they recommended to our unlucky party member: some salmon crudo.  It took them 15 minutes to throw together a plate that consisted of 5 pieces of salmon sashimi strewn amidst pieces of torn rye sandwich bread (with a sauce drizzle of some sort).  THAT took 15 minutes??!!  Christ, after all we've been through they should have had that out in 15 SECONDS, especially given what a simple/boring dish it was.  The rest of us were done when the salmon finally arrived.The entire meal should have been comped. It wasn't (very little was).  The Pines should be ashamed of itself for their disgraceful performance. Amateur hour x1000. And all this comes from a bonafide foody with YEARS of fine dining service experience, btw. EDIT: In the interest of fairness I want to point out that the owner has contacted me directly and offered to make amends by way of a refund.  A very professional and classy move, and a greatly appreciated gesture. Had this been offered by the manager yesterday (I don't believe the owner was present) it definitely would have diffused (or altogether squashed) this review.Also, I do want to mention that the lamb bacon (from my Lamb BLT) was stellar.",1.0
"It pains me a little bit to give the Pines 3 stars.  I adore its older seester Littleneck, and I was so excited to give this landlubber sibling a try.  It just did not come close to what we were expecting and left us with a decent, but sadly not a very memorable meal.We got there on a weekend evening around 9 and there was a 40 minute wait.  No big deal, went to Canal Bar for a drink and the Pines staff nicely called within half and hour.  Interior of the restaurant is purposefully shabby rustic, with an antiquey feel throughout.  A few bottles of wine and one of the appetizers were no longer available - ok on the appetizer, but perhaps the wine shortage can be avoided by keeping more in stock, especially on a weekend evening?Started off fun, got the amuse bouche while Biggie's ""Juicy"" was playing.  Orange wedge over a tofu cream, refreshing.  Then we started with the bone marrow appetizer, which is topped with tobiko and chickweed, and served with olive bread.  Olive bread was torn by hand, warm and deliciously crusty.  Scooping the bone marrow on to the bread, it was a nice dish.  I liked the tobiko addition texturally, had no idea why the chickweed was on top as it seemed like a hinderance on the dish to be pushed aside to get to the marrow.  Large bone, not so much marrow, but tasty.   Seemed to need some salt or something to bring out the marrow.  Next, the much touted pici, thick strands of pasta with trotter ragu.  Decent dish, nothing revelatory, simple but a little doughy.  Tiny pieces of pork were tasty but scarce.  Main dishes were decent, especially the skirt steak - beautifully sliced and presented, tasty with beefy flavor.  However, the evening was soured by the pork shoulder dish which was truly a little odd on the palate.  Some of the pieces were very fatty and chewy (not in a good way) and the nduja (a spicy spreadable sausage saucey residue - and lots of it) was really offputting.  Had a cornmeal texture which did not go well with the pork and its spice overwhelmed the delicate pork.  I really think the Pines should rethink this dish, as we love spicy dishes and pork, and especially spicy pork dishes, but this one fell flat.  We did not have dessert which is a choice of gelatos.For the prices the Pines is charging, there needs to be more than a loud soundtrack, beavis and butthead scrawled on a menu, and random ingredients thrown in because they sound exotic.   Things need to come togerher so that a restaurant sticks around past the hype.  Overall, I'd like to give the Pines another shot as its success will be integral to Gowanus' culinary boom, but the night we went was not its night.  Cash only.",3.0
"Sunday night at 6:30 pm.  That's when we walked to The Pines because they don't take reservations for parties under six people and we really really wanted to try the food at The Pines.  We were not disappointed.We started with the La Quercia prosciutto.  Ahhh... buttery good and tasty.  And if it wasn't buttery enough, butter on the plate to slather on the rustic bread that accompanied the meat.Do you like bone marrow?  Then try the dish served up at The Pines.  Soft juicy and scraped from the bone, it was flavorful and wonderful.Pasta called ""pici"" served al dente and with ""trotter"" which from the taste was a rich gamey pork.  Covered in tomato and pecorino cheese. Wow was this dish great!Wine by the glass is very well priced, I had a grenache/carignan combination that was only $12 the glass.  the waitperson warned me that it had ""barnyard"" flavors and offered me a taste first.  I didn't tell her that I knew the taste well, but I was really bowled over by how well it brought out the pig in the pici.  A definite score.Prices are not moderate, but also will not kill your wallet.  A definite five star restaurant.",5.0
