"I'm always dragging my boyfriend out to Gowanus or Carroll Gardens to eat at new places that I read about, and I was glad we made it here! I loved the ambience of the place, from our little table in the back to the lighting and carefully curated decor. This part of Gowanus is growing so fast and it's always exciting to see which new places are popping up. At The Pines, we ordered:-bread with butter-cabbage with boar belly-blade steak-some kind of broccoli (it's not on the menu that's on their website) -a glass of wine each Everything was really good! The only negative that I would mention seems to be something that others have also noticed: high prices and small portions! I'm all for small plates, but these were some pretty small portions that were pretty expensive. We weren't full by the time we finished!Another great thing about The Pines is the backyard! I don't know if a lot of people know about it, but it's awesome! Super laid back and low key. Lights strung above and an assorted array of seating for different types of groups. There is beer by the can and also a bbq grilling up cheap and tasty treats! We went out to back after dinner, had a beer, and enjoyed the summer night. I was hoping we would be able to eat dinner in the back, but they don't serve the full menu there. Overall I really like The Pines and the feel of the restaurant, but it's a bit expensive to be a casual dinner.",4.0
"Food: average to good.  Zero option for friends with slight diet restrictions (e.g., vegan celiac)  Presentation: sickening.  Shishito peppers were smoothed in the sauce on the side of the plate.  Chocolate dessert looked like someone took a dump in the plate.  Cleanliness: sickening too. Glasses were dirty, plates were rough from being badly cleaned.  Service: mediocre to average.  It might be a hipster thing that ugly and dirty and rude is cool.",2.0
"Whatever positive vibes my fiancee and I had after our first visit to The Pines a few months ago--I recall solid drinks and a tasty blade steak--were erased by our last dinner here.  I'm not sure I've ever paid so much for such distinctly unenjoyable food.  The best part of it was the bread we ordered at the beginning with honey butter.  (If I had to guess, the bread seems likely to have come from across the street at Runner & Stone--a much better bet for your dinner.)  The shishito appetizer came next:  preciously plated off-center on a huge plate, the peppers were flabby and dominated by a way-too-creamy romesco.  We then had an hour-plus wait for the mains (as did everyone else around us, it seemed, because no one had food on their tables.  The wait staff did not indicate to anyone what was going on other than to say ""it will be right out."")  We had the duck breast and the pork.  The duck's flavor was quite nice, but they had absolutely cooked the crap out of it.  Skin was crisp to the point of leathery, and the flesh was gray.  But that pork...my god.  ""Bonito"" was the final ingredient listed among seven or eight, but when it arrived, the plate was literally crawling with an enormous mound of bonito flakes reacting to the heat.  The overwhelming fishiness in combination with barbecue sauce, pork, and kimchi...apologies to the chef, but disgusting really isn't too strong of a word.  We ate about five bites of it before giving up (the waitress didn't bat an eye, probably because this reaction is a frequent occurrence).  The chefs may have thought this was a good idea on the chalkboard, but it was truly disturbing in execution.I debated two stars given that my recollection was that we had an above average meal the first time...but no.  I can't even remember what happened anymore because my mouth still tastes like fish flakes.  Slow service, bizarre food, premium prices.  Pass.",1.0
"I came here last night with three other people and felt I needed to write about this place because it was incredibly disappointing.First off, and not to be missed - pricing is out of control. The dishes are small (I get it, it's small plates) but even when you order a bunch, you still leave unsatisfied. Many people have commented on the pricing of this restaurant and I think management should really take a look at it. You are in Gowanus - not midtown, plates are tiny, and the service - oh boy, the service. Service is a whole paragraph in itself.The menu is meat heavy, with little option for people who like things other than meat. There were two things ordered that we were told were sold out for the night. It was 8pm on a Saturday. It wasn't like it was 10:30pm on Saturday and the kitchen was closing, so we really should not have run into the issue of the kitchen running out of items!We ordered 5 appetizers, to which the waiter cleared our plates after the fourth. I asked if we would get new plates for our fifth appetizer and he looked baffled. It was clearly forgotten. We then waited an additional 40 minutes for our entrees to come out. This was a full hour and 15 minutes from when we initially ordered. In my mind, this is absurd and a complete lack of organization of the kitchen to prepare in a timely fashion. Not to forget that the food was really lackluster and nothing to write home about.The waiter was struggling and might consider another profession. The whole night things were just off. One thing that really sticks out is that one person in our group ordered a wine and asked several questions about the wines to make sure she got what she wanted. When the glass of wine arrived, it was the wrong one. The person in our party is a really nice person so said ""its ok, I'll just have this I guess"", and instead of the waiter saying ""no of course not, let me get you the wine you ordered and had so many questions about"", he said ""ok"" and just left the wine. POOOOOR execution, and noted. That was tough, but it all came to a culmination when it came dessert time. We brought a cake to be served, and it was quite large. Probably a cake to feed 10-12 people. We asked him to cut us 4 pieces, and in return he brought the cake out, cut into four quarters. Four giant quarters. My mind was blow. It is still blow, and I am still laughing about this. He brought out coffee and asked if we wanted milk, to which we said yes. The milk arrived 15 minutes later. Hmmmph.When we were finished with the cake (we cut one quarter into fours and had the remaining three quarters to take home) we asked for the box to wrap it back up. The waiter looked at us like a deer in headlights and told us that he threw the box out. I mean....I think you all get the points I'm making on the waiter by now. I'll leave it be.Finally the bill arrives and of course, it is an insane number for what we have just endured. They also slipped in a $25 cake cutting fee. REALLY? It took so much work to cut our cake into quarters, throw out the box and smile unapologetically. For our experience, the food quality, the service and all else, we should have paid atleast half of what we paid.End of the day, this restaurant was pretty bad. So much so that I woke up today still pretty pissed about it. There are so many great restaurants in NY, Brooklyn and so on, and I'm bummed we spent our money here.",1.0
"I have never heard of scales on a fish being ""the way it's cooked"". I can only hope that the person who gave this excuse improvised but failed. I expected more from a $30 fish dish maybe scAles add to the weight?",3.0
"As we were walking in I felt a little nervous about this place. I read a ton of mixed reviews, and I wasn't sure what to expect. When I left I definitely had a very lukewarm feeling about the Pines. I didn't pick the place but we were going on a triple date with out of town friends who had never been to Brooklyn. I was wondering how much this place would affect their view of Brooklyn and their regard for our taste in food. So the dinner was fun and engaging and intellectually stimulating. The service was amazing. Our waitress came by to explain each dish. The servers came by to wipe the crumbs off the tables multiple times. Glasses was constantly filled with cucumber and squash soaked water. They were quick to ask if we ran out of wine or needed more beer. Each dish was beautiful. Looked appetizing. And we had plentiful for it to go around. So why only three stars? Each dish was slightly off. Perhaps I shouldn't read the reviews before going. I definitely felt a little underwhelmed for the price we paid.The food was not horrible, but it was off on some dishes and most dishes were not compelling or amazing. And if you want to charge these prices for food, I would expect a novel surprising experience. THE FOODAmuse bouche of gazpacho with mint oil. The combination did not taste great together. The gazpacho was thick and chunky and the mint oil was barely there. The dressed salad with greens. The vinaigrette was sweet and sour, very appetizing. I liked the hazelnuts that topped this dish.Ripped bread with freshly whipped butter. This was my favorite part of the meal. Crisp crunchy outer crust of a caraway baguette that snaps as you twist it. Soft fluffy white innards of the bread with fluffy, slightly salted butter. Delicious. Sugar snap peas with dill crème fraîche. The sugar snap peas for crisp and sweet, they were the best part of this dish. The dill was light, a fresh take on creme fraîche. Roasted Cauliflower with sautéed red cabbage and smoked bacon. The bacon was savory and delicious, and perfect to the meaty umami flavor of the roasted cauliflower. You could do with or without the red cabbage. The red cabbage was sauteed with the bacon, so there was a smoky lardo flavor. Delicious. This would have been the best dish except there was a slight malodor after the dish was sautéed and the green sauce was too salty. The last four spoonfuls of this dish tasted like a mouthful of salt. We had to forgo the last bits because they were inedible.  Pasta. This dish did not have a description. I saw bits of broccoli Rabe and enoki mushrooms. Simple dish. It would have been good except it was a little over salted as well. The prime rib was medium rare, juicy, well seasoned, and missing a good crust. The roasted fingerlings and mushrooms were a good touch. An even better accompaniment was the cooked mini cast iron of kimchi to go with the prime rib. Very good pairing. The fish had a good crispy skin, was tender and had some peas in the broth. The dessert was raspberry sorbet, chocolate olive oil cake, plum and toasted hazelnuts. The chocolate olive oil cake was a great execution of olive oil cake. You could taste the rich, slightly bitter olive oil and it was paired with a dark chocolate. I loved the toasted hazelnuts. The poached plum was sour, but didn't really fit into the whole dessert. The space looked like someone's abandoned farmhouse/ motel that no one bothered to renovate. The waitress told us that most of the installations were from a restaurant upstate that the owner decided to reopen in Brooklyn. Kinda cool, kinda spooky, kinda run down. I hope the chef would adjust and add new dishes. Its wonderful to hear a restaurant is so buzzed about in this neighborhood. I look forward to the day when his great ideas are consistently executed.",3.0
"We had a good meal at The Pines.  Though I think our experience indicates that this restaurants has a little more work to do to truly hit the mark of excellence.I understand the concept is farm to table.  The service was excellent as our server was able to explain each dish to us and taylor the meal to our party's pace.  However I feel that the menu lacks emphasis and force and overall lacks a theme.We had the Prix Fixe dinner family style which included * great bread with a whipped butter.* Amuse Bouche of Gazpacho with mint oil... Not a bad start to cleanse the pallet* A dressed salad with a bed of what tasted to be Gai Lan?  It was not bad but it was just a salad.* Sugar Snap Peas - Surprisingly my favorite dish of the night as the Peas were really crunchy and full of flavor* Roasted cauliflower with sautéed red cabbage and bacon - Very good in fact I really enjoyed the aroma and the various textures of this dish* A small Pasta bowl - It's pasta* 45 day old dry aged prime rib with a bone marrow - Not bad, nicely cooked but not enough punch* Flaky fish with crispy skin - I loved the oily and crunchiness of the skin.* Raspberry Sorbet, chocolate olive oil cake, plum and toasted hazelnuts - This was delightful actually, not too sweet, not to heavy.  But subtle enough to capture the meal.I think The Pines has work to do, and the pricing is sightly too high for the neighborhood if the menu isn't hitting it out of the park.But I'm hopeful that they'll get there.",3.0
"The Pines, I would love to return to again and again. The only thing I wish I would have done was collect the names of each and every worker there. The Pines has such a beautiful staff of people and one can tell that love goes into each dish.My meal was absolutely fantastic to say the very least. I started my meal with a crisp endive salad with toasted granola and a most savory vinaigrette. I then moved on to a most scrumptious Foie gras which was to die for and I rounded out my meal with sea bass atop fresh mushrooms, garden vegetables in a flavorful seafood broth. Along the way, I ate from a basket of breads that i understand was made right across the street that would make you slap your momma.I was so pleased to hear that they will be opening up another restaurant in Bed-sty Brooklyn in April. I'm very excited because if the food and service is anything like this location, I'm sure I will become a loyal customer for sure.",4.0
"Earth to New York City (and The Pines): OK, so there's a trend of offering plates ""designed for sharing"" at this point in dining history. Then why are are all the portions cut in half? Earth to the Pines: 1. See above; 2. You have such an interesting approach to the food itself. Why not throw caution to the wind and consider your diners' physical comfort? Are you aware that chairs sometimes come with backs and even cushioning? Could you keep your sleevecuffs out of the food?  Do you need to disinfect RIGHT in the middle of dinner service with an overpowering dose of PineSol that permeates the dining room? And I will simply add that you might have applied that same zeal to the restroom with better effect.",1.0
"I found this small gem recently, and I loved  it. The restaurant has a decent craft beer list, and I enjoyed the Hefe. This was accompanied by the bread --normally something I avoid -- which was nothing short of amazing. The caraway baguette with whipped salty butter was enough reason to go here. The treme pasta with grilled shrimp was in the top 10 pasta dishes I've ever experienced, and I would return to The Pine just for this dish. The spicy dish had remnants of an Asian influence while staying true to its Italian pasta origins. My bartender / server was incredibly helpful and knowledgeable while retaining a casual warmth.The restaurant is a bit pricey, but completely worth it in terms of uniqueness and quality.",4.0
"I really do love this place, and I keep coming back, but it needs to come down a notch in pricing. I get that the execution is beautiful, and the ingredients are fresh as can be, but we left here at around $60 a person, without drinks. Don't get me wrong, the service is amazing, and I cant' get enough of the food. It's just with all things considered, the food is exorbitantly overpriced given the venue and location. The servers always suggest 2-3 items per person, (two appetizers and an entree). The appetizers range from $14-16, the pastas are $24-26, and the entrees are $24-26. I guess what I'm saying is that I want this place to be accessible and not luxury, because that's what the food, ambiance, and vibe protrudes, but that's not what the price affords. It scares me when $60 dinners become the norm for casual dining.",4.0
"I have been wanting to go to this place since it opened. I had heard some great things form friends and thought it would be a sure bet. The sure bet was that the food was awful. My wine was quite good; however, every single thing we ordered was just plain terrible. The service was good, but I guess the chef is trying to be creative, but it just came out all wrong.",2.0
"From the service to the decor and the outstanding food, we enjoyed The Pines tremendously. Every dish was thoughtfully prepared and delicious. We enjoyed the grazing format so we got to try more of the dishes.  The duck rillettes were excellent with nice garnishes. I took a chance on the rutabaga soup, and I am glad we did - little bits of blue cheese, croutons and an excellent stock made the root vegetable soup very tasty. The shisito peppers had a fabulous swipe of romesco sauce that I want to figure out how to make. Their little purses mushroom pasta was creamy goodness. To top it off, they had our favorite wine, Lambrusco!  And an interesting list of cocktails (although a bit short). We didn't have dessert, and we were plenty full. All in all, our best meal in the area, definitely. Yes, Yelpers, it is expensive, but it is a quality, not quantity, experience.",5.0
"Bread is good but the foie gras is better. It's served very simply, without any kind of precious presentation. The pastas change frequently; it seems like there will be the same base pasta but with different meats and sauces and vegetables within. Try at least one, such as the borsa vuota. In fact, my recommended dinner for 2 is bread, foie gras, a vegetable, a pasta, and the blade steak and/or another entree.If you're imbibing, the cocktails are great (Air & Sea if you want something lighter, The Pines if you don't mind sipping on Christmas trees) but the wine list is also great. They're all about biodynamic wines and all the servers are good at making recommendations based on what you plan to order.They're on OpenTable but the peak dinner times usually book up a few days prior. Might be worth it to sit at the bar or little bench in the back to wait.",4.0
"One of my favorite restaurants is Gramercy Tavern , as I really enjoy a delicious meal .I recently dined here with my husband and we were both extremely disappointed .First ,there were only only two other customers,yet we waited over an hour for our food.Second,the music was not conducive to eating a nice meal as it was loud rap usually reserved for a nightclub.We were so hungry that we ate our meal despite the fact that it was very ,very salty.The fish portion was on the small side and the wine pour was a third of a glass.Due to food allergies ,I asked for an additional  portion of vegetables listed on the menu and was told they could not serve it to me as they only serve as the menu is written .No accommodations  would be made for food allergies .I have traveled the world eating in critically acclaimed restaurants and have never experienced such poor customer service.OVERPRICED and overly salted food .",1.0
"What an amazing establishment in Gowanus! High-class food without the pretentious attitude. Case in point, I came here around 10pm after spending the previous hour rockclimbing. Despite entering the restaurant pretty late, the GM, Anthony, spent some solid time joking with us, walking us through the menu and kicking off our night with shots of whiskey.First and foremost, you must try the cultured butter. Our favorite dish was Cabbage - which admittedly does not look appealing when simply reading the description on the menu.  Oh man, little did I know how much I appreciate cauliflower. We are definitely coming back and have been recommending the Pines to all our friends.",5.0
"My husband and I first went to The Pines right after they opened and fell in love with the place. So much so that when we saw an apartment open up in the neighborhood, we moved. Friends think we're just lazy and trying to get them to come to Gowanus, but we really have no shame in taking all of our out-of-town guests to The Pines. To this day, I lick the plate of the the squid and cabbage, and the borsa vuota has become my new comfort food.Pines staff: Please bring back that pea pasta from 2013. Also, thank you for being the only other people still listening to JoJo #leavegetout.",5.0
"Amazing spot!!!! All dishes were just delicious!!! The service was friendly and professional, we will come back for sure!!",4.0
"The food really is good, I agree. The service is attentive and knowledgeable. Since its in Gowanus on 3rd Ave you don't expect much, so that was all very nice. the prices are high but reasonable for the food. What's questionable is the managers choice of music, and the very uncomfortable seating. It's a neighborhood place perfect for hanging out but not on such hard, unstable small folding chairs and benches -not a cushion in sight -so  nothing to entice you to hang out, spend more money. This is a mistake. As is the choice of early Kanye West played really loud. Regardless of whether  this is great rap or not, At dinner listening to loud Nigger Nigger this and motherfucker that It's boring and Hilarious in what was an all white customer yuppy restaurant at the "" edge""",4.0
This was incredible. Delicious seasonal foods and cocktails. A great date spot,5.0
"I really do love this place, and I keep coming back, but it needs to come down a notch in pricing. I get that the execution is beautiful, and the ingredients are fresh as can be, but we left here at around $60 a person, without drinks. Don't get me wrong, the service is amazing, and I cant' get enough of the food. It's just with all things considered, the food is exorbitantly overpriced given the venue and location. The servers always suggest 2-3 items per person, (two appetizers and an entree). The appetizers range from $14-16, the pastas are $24-26, and the entrees are $24-26. I guess what I'm saying is that I want this place to be accessible and not luxury, because that's what the food, ambiance, and vibe protrudes, but that's not what the price affords. It scares me when $60 dinners become the norm for casual dining.",4.0
"I have been wanting to go to this place since it opened. I had heard some great things form friends and thought it would be a sure bet. The sure bet was that the food was awful. My wine was quite good; however, every single thing we ordered was just plain terrible. The service was good, but I guess the chef is trying to be creative, but it just came out all wrong.",2.0
"From the service to the decor and the outstanding food, we enjoyed The Pines tremendously. Every dish was thoughtfully prepared and delicious. We enjoyed the grazing format so we got to try more of the dishes.  The duck rillettes were excellent with nice garnishes. I took a chance on the rutabaga soup, and I am glad we did - little bits of blue cheese, croutons and an excellent stock made the root vegetable soup very tasty. The shisito peppers had a fabulous swipe of romesco sauce that I want to figure out how to make. Their little purses mushroom pasta was creamy goodness. To top it off, they had our favorite wine, Lambrusco!  And an interesting list of cocktails (although a bit short). We didn't have dessert, and we were plenty full. All in all, our best meal in the area, definitely. Yes, Yelpers, it is expensive, but it is a quality, not quantity, experience.",5.0
"Bread is good but the foie gras is better. It's served very simply, without any kind of precious presentation. The pastas change frequently; it seems like there will be the same base pasta but with different meats and sauces and vegetables within. Try at least one, such as the borsa vuota. In fact, my recommended dinner for 2 is bread, foie gras, a vegetable, a pasta, and the blade steak and/or another entree.If you're imbibing, the cocktails are great (Air & Sea if you want something lighter, The Pines if you don't mind sipping on Christmas trees) but the wine list is also great. They're all about biodynamic wines and all the servers are good at making recommendations based on what you plan to order.They're on OpenTable but the peak dinner times usually book up a few days prior. Might be worth it to sit at the bar or little bench in the back to wait.",4.0
"One of my favorite restaurants is Gramercy Tavern , as I really enjoy a delicious meal .I recently dined here with my husband and we were both extremely disappointed .First ,there were only only two other customers,yet we waited over an hour for our food.Second,the music was not conducive to eating a nice meal as it was loud rap usually reserved for a nightclub.We were so hungry that we ate our meal despite the fact that it was very ,very salty.The fish portion was on the small side and the wine pour was a third of a glass.Due to food allergies ,I asked for an additional  portion of vegetables listed on the menu and was told they could not serve it to me as they only serve as the menu is written .No accommodations  would be made for food allergies .I have traveled the world eating in critically acclaimed restaurants and have never experienced such poor customer service.OVERPRICED and overly salted food .",1.0
"What an amazing establishment in Gowanus! High-class food without the pretentious attitude. Case in point, I came here around 10pm after spending the previous hour rockclimbing. Despite entering the restaurant pretty late, the GM, Anthony, spent some solid time joking with us, walking us through the menu and kicking off our night with shots of whiskey.First and foremost, you must try the cultured butter. Our favorite dish was Cabbage - which admittedly does not look appealing when simply reading the description on the menu.  Oh man, little did I know how much I appreciate cauliflower. We are definitely coming back and have been recommending the Pines to all our friends.",5.0
