"Cool decor,  feels like your on a giant boat under a sail.  The bar looks like a frozen-in-time scene from the Titanic when the boat starts to go under and all of the cupboards and furniture hang on for dear life.  Had the burger with fries,  was super thick and cooked perfectly.  Poor selection of beers with only one ipa being offered and unfortunately  it's Goose island owned by Anheuser Busch (Budweiser). Ended up getting the bloody Mary,  a little too much tomato  juice without any other noticeable flavors other than pepper corns, not the best.    Very well trained and attentive server, plenty of great suggestions and was extremely friendly.  Would definitely  go back for the food,  not for a beer.",5.0
"The Bounty is cozy and atmospheric, like you stowed away in the  captain 's dining room of a schooner on a storm tossed sea. It seems humble but the cooking is inspired. Our party of four had quite a few items from it' s compact but diverse menu. Oysters  excellent Pierogis  nicely served with pickled mushrooms Roasted CARROTS, BEETS AND GREENS outstanding. The bounty specializes in fish. We had the lip smacking Mackerel. And the chicken rolada was a little gem. Panne cotta dessert delish. The prices are quite moderate per dish but everything is so good that you end up dropping quite a few bucks. The waitress Chevonne was excellent. Definitely a great subtle dining and nautical trip.",5.0
"3.8 on the food richter, but a 4 star still emerges. Came for a nice romantic dinner with my Valentine. The ambiance was nice with a spacious table arrangement given the room's size. The decor was fresh and charming and the kitchen can be seen through it's large service window.  They had numerous whole fish specials including trout, Bronzino, porgy etc plus a monkfish special; all a nice effort to bring some extra culinary muscle on the special day. We opted to kick things off with happy hour oysters and the truffle agnolotti, a more than well thought out dish executed with less than thoughtful seasoning. Super salty blanching water and final seasoning go a long way.The oysters were tasty - served with a house shallot malt vinegar that was reapplied again and again. Wish we ordered more. Pro tip: get in before 7pm to snag them at a $1 each. The Atlantic salmon was just average. It's slightly overcooked execution was the culprit along with the undercooked Brussels. Perhaps the cautious chef had a pesky customer earlier in the night who got rare salmon and farty Brussels, but for me, the salmon needs to be delivered with more attention to detail. The Fresno marmalade was actually the most interesting cog in the machine and was stolen to lend flavor to the roast chicken. Speaking of the devil, the bird was a yin yang dish for me. With its crispy skin and succulent flesh, it was mirrored by the bland spinach stuffing. It was not much of a stuffing at all but rather a bed of tight greens I found underneath the deboned dark meat section. Paired with a loose, slightly warm & under seasoned risotto, one would wish that they used salted butter and more Parm.All aside, it really was a good meal, and I can imagine what it would be like if all of the stars aligned for each dish. Valentine's is a mess in general for a kitchen. I know that they really had a well thought out vision but perhaps less time to devote to each table. It happens. Thank you for the Bounty!",4.0
"They have oyster happy hour every day, but from 5-7, no matter how many times you whine about it and ask them to give you oysters at 4. But that just means you can drink more and fill up on apps like bacon and fries (separate dishes).They attract a brunch crowd on weekends, and make a mean Bloody Mary. A bit steep for $8 (considering it's a small glass), but yummy. Just the right amount of kick.Also had one of their signature vodka cocktails, which was pretty good, but not great. When we first sat down, the owner told us he couldn't mix drinks, so we had to wait until the bartender showed up. Luckily, they also have a handful of beers on tap.Finally got to 5pm and we had two dozen at $1 apiece. They rotate daily offerings, and we had Moonshoals from MA and East Beach Blondes from RI. Both were good, but I preferred the EBB's for their smoothness.All in all, had a good time at the bar. It was in between lunch and dinner so the bartender was able to entertain us with tales about her childhood. Hope to come back to try the food!",5.0
"The Bounty is a lovely place for dinner in Greenpoint, especially with the killer oyster special. EVERYDAY from 5-7pm they have $1 oysters. Sweet! Cocktails and drinks are a little pricey ($6 for just a Narragansett, oof), but the service is friendly and attentive, and unlike most NYC restaurants, the space does not feel cramped. (Bonus points for that compelling Rothko-style painting on the right wall.) Needless to say, the oysters were tasty and cheap, the mains were hearty and filling. I ordered their burger, which featured a home-baked bun and a tomato jam along with cheddar, mayo, onion, and a perfectly cooked medium-done patty. The burger was delicious, but I'm not sure if I'm ready to say if it's the best in BK per se. The fries were also oddly limp, albeit well-seasoned. (I'm crispy fry guy myself.)The roast chicken, however, was across the board excellent. The skin/crust was perfectly crispy, and the risotto with accents of spinach and mushroom made for a perfect complement. Overall, I thoroughly enjoyed my meal at the Bounty and look forward to my return. Great for drinks, dates, or just a place to stay away from the cold.",4.0
"I really enjoyed my meal at The Bounty--from the service to the food and drinks, everything was spot on and wonderful. Came in with a friend on a Wednesday evening during the winter--no reservations were needed and my friend was sat before I arrived (always a plus in my book). You should be able to tell from the name and decor that this is a seafood joint. The menu, while small, had some great items. We both got the clam strips and the salmon burger, and some cocktails. The clam stripes were crisp and I liked the dipping sauces--a good dish to split. The salmon burger was one of the best I've ever had--very fresh and the bread was made in-house. The cocktails were also good and I could see coming here solely for oysters and a drink earlier on.",5.0
"Stopped in for a few drinks. That is all that I can speak to, not the food, but the drinks were great. Modest, yet wonderful beer selection and their mixed cocktails do no disappoint being spirit forward in a good way! Both of the guys behind the bar were great, interactive, attentive and very informative of the establishment and surrounding area. Would love to make this a go to bar joint for a great drink at the end of the day.",4.0
"Glad I finally checked out the Bounty for Friday night date night. It has a comfortable yet interesting vibe with some unique decor (check out the vintage desk built into the ceiling above the bar). Good ambiance for a date or getting a group together as they take reservations, and super easy location right off Greenpoint Ave G. Service was on par. Our waitress told us everything is made to order hence the wait on the food, but it did take quite a while longer than I would have expected. I appreciate that everything is so fresh and that probably explains the prices, but they could consider a bread bowl to make the time go by, especially considering they bake their own bread. The pan seared chicken I ordered was delicious and served very uniquely. The sunchokes were a welcome addition and the sauce was heavenly. I felt the chicken was slightly dry on the inside so if they hadn't skimped on sauce it would have made a big difference. The portion was also quite large but at $22 I would hope they would give a decent size. My husband ordered the lobster pappardelle which I believe was a special. The pasta is incredibly delicious and we could easily tell it was homemade. The portion however was teeny tiny and I felt bad for my beau who finished off his meal while I still had half leftover. He said there was a decent amount of lobster in there though. I will be back because I adore these cute places in the hood and I certainly had a pleasant experience, but with the prices I might save it for a celebration.",3.0
"Went here for a quick dinner with the boy after picking up half-marathon race packets at the Brooklyn Convention Center, and overall the experience was good.  The service wasn't the friendliest -- when we sat at the bar and ordered a main and a side to share, san drinks due to aforementioned half-marathon, we got quite the eye-roll from the bartender.  Relax bro, I'm still going to tip!I had the butternut squash with maple butter and it was ohhhh man heavenly and autumnal as all get out.  It was perfectly cooked with a crisp outside and creamy inside.  The portion looked small for $6, but it was actually quite a bit of squash.The boy had fish and chips, which were satisfying but nothing to write home about.  The fish was super fresh and again, well cooked, but the seasoning was a bit bland and lacking any interesting flavors.  The interior was super cute with lovely lighting; would be a good place for a first date.  The drinks looked fantastic, also, so hopefully we'll make it back on a more drink-y oriented night to try 'em out!",4.0
"Went here for brunch on Easter with my boyfriend and mom who was in town. Super cute place and will definitely be back to try dinner. The steak and eggs were good but nothing special. They also didn't have milk or Kahlua to do a White Russian, which to me for brunch on Easter Sunday seems a little silly. Overall the food was good, not great but I would love to try some other items on the menu. The service was great as well.",3.0
"Was here on a Saturday for their Happy Hour Oyster Extravaganza. They had 3 oyster options for $1 peerrrrrr. We went through a few dozen and tried all 3 different ones. No limits here, you get all the oysters your stomach can handle. All 3 were full of ocean juices, fresh, and delicious. The service was good and the patio in the back was kewl. Will be back for another oyster outing.",5.0
"We were here Saturday night around 8pm. Walked in to a small, lively place.  The host greeted us and sat us immediately. Very simple, cozy dining area.  The drinks were delicious as we looked over the menu, and you want to try everything on it! For appetizers we had the Greenpoint Chowder and bread with ricotta- amazing!!Entrees were a burger and the steak...both outstanding!Staff is very friendly and accommodating, make sure to check this place out!",5.0
"This is one of favorite place in Greenpoint.Great food and drinks‼The staff are kindness and listend to what I need.We went there as a group of 7.Everything on the menu was delicious.Everyone say amazing good, great ambience‼Really great restaurnt.I love it.Also the excellent food I ever had.",5.0
Just drove by here on New Year's Day and decided to check it out based on all the good reviews. Well they were right. Oysters were very fresh. The homemade ricotta and bread - UNBELIEVABLE. Then had the beef Wellington which was EXCELLENT. Huge compliments to the chef. Fresh and amazing food and most importantly consistent it seems. Very friendly staff. Will be back for sure.,5.0
"Excellent service, burger and drinks.  The duck liver mousse was also quite good.  I will cerainly be back to try more foods, particularly the other spreads which all sounded fantastic.  The lighting and ambiance were nice as well. Perfect date spot or place to catch up with a friend.",5.0
$1 oysters during happy hour? You know I'm there!Have been to The Bounty a few times for after work drinks and dinner and have ordered probably over 100 oysters across those visits. They're consistently great.They've also got this awesome whole-fish dish on the menu that Rus and I usually share. It comes with roasted veggies (but beware of the dripping fish oil -- they serve this on a wooden plank) and is more than enough food for two people. They make a pretty good whiskey sour but I'm all about the rosé.Service is good and they have outdoor seating. Factor in the $1 oysters and that makes The Bounty your new summer haunt. You're welcome. ;),5.0
Outstanding ; I have lived across the street from this place for a year and I just went in for the first time. Beautiful decor and dollar oysters and very friendly staff.,5.0
"I fear I miss out because I am not an oyster fan, but I do appreciate seafood so I came here with my parents. I had a few cocktails at the bar that were good - not great - and kind of pricey. We sat for dinner and split the smoked fish balls and the croquettes. The former were rather good but the croquettes were extremely tough and seemingly overcooked. They had pork belly on top that was so overcooked it was not possible to really eat.For mains I had the fish and chips. It was okay. The fish was two rather large pieces of whitefish and not smaller chunks like you would usually get it. As with the appetizers it was somewhat overdone. The tartar sauce was watery and not very flavorful. My father had the burger which he was was fine and my mother had the lobster roe pasta that was alright but really somewhat bland, especially for the price tag. The desert was really the best part of the night. The goat cheese cheesecake with kumquats was outstanding. The space itself is charming with a very unique barback. The service was good, but I had this feeling like I was being judged the whole time and the waitress was a little snooty. Overall it wasn't a horrible experience and some of the food was decent, but for $250 you can do better almost anywhere else.",2.0
"Had an amazing brunch here today: steak and eggs, avocado toast (with egg and Korean peppers), ricotta biscuits and jam, and plenty of sides for the table --fries, bacon and sausage! Everything was amazing and the staff made sure that everything was to our liking and preferences--a demanding bunch with food allergies to boot. They passed with flying colors.The gravy--And I wish could've had their's over their biscuits (I'm gluten free)--was the decor; ship wreck nautical theme with wooden barrel tables, sea glass, and antique cabinets behind the bar referencing the captain's quarters.Loved it--have no complaints and only high praise: will be back for more.",5.0
"Great choice for a ""nice"" dinner in Greenpoint! During the summer there's a cute little patio in the back. Tasty food beautiful decor, amazing drinks! I heard they do brunch too but I've never been but would 100% check out.",4.0
"Was here on a Saturday for their Happy Hour Oyster Extravaganza. They had 3 oyster options for $1 peerrrrrr. We went through a few dozen and tried all 3 different ones. No limits here, you get all the oysters your stomach can handle. All 3 were full of ocean juices, fresh, and delicious. The service was good and the patio in the back was kewl. Will be back for another oyster outing.",5.0
"We were here Saturday night around 8pm. Walked in to a small, lively place.  The host greeted us and sat us immediately. Very simple, cozy dining area.  The drinks were delicious as we looked over the menu, and you want to try everything on it! For appetizers we had the Greenpoint Chowder and bread with ricotta- amazing!!Entrees were a burger and the steak...both outstanding!Staff is very friendly and accommodating, make sure to check this place out!",5.0
"This is one of favorite place in Greenpoint.Great food and drinks‼The staff are kindness and listend to what I need.We went there as a group of 7.Everything on the menu was delicious.Everyone say amazing good, great ambience‼Really great restaurnt.I love it.Also the excellent food I ever had.",5.0
Just drove by here on New Year's Day and decided to check it out based on all the good reviews. Well they were right. Oysters were very fresh. The homemade ricotta and bread - UNBELIEVABLE. Then had the beef Wellington which was EXCELLENT. Huge compliments to the chef. Fresh and amazing food and most importantly consistent it seems. Very friendly staff. Will be back for sure.,5.0
"Excellent service, burger and drinks.  The duck liver mousse was also quite good.  I will cerainly be back to try more foods, particularly the other spreads which all sounded fantastic.  The lighting and ambiance were nice as well. Perfect date spot or place to catch up with a friend.",5.0
$1 oysters during happy hour? You know I'm there!Have been to The Bounty a few times for after work drinks and dinner and have ordered probably over 100 oysters across those visits. They're consistently great.They've also got this awesome whole-fish dish on the menu that Rus and I usually share. It comes with roasted veggies (but beware of the dripping fish oil -- they serve this on a wooden plank) and is more than enough food for two people. They make a pretty good whiskey sour but I'm all about the rosé.Service is good and they have outdoor seating. Factor in the $1 oysters and that makes The Bounty your new summer haunt. You're welcome. ;),5.0
Outstanding ; I have lived across the street from this place for a year and I just went in for the first time. Beautiful decor and dollar oysters and very friendly staff.,5.0
"I fear I miss out because I am not an oyster fan, but I do appreciate seafood so I came here with my parents. I had a few cocktails at the bar that were good - not great - and kind of pricey. We sat for dinner and split the smoked fish balls and the croquettes. The former were rather good but the croquettes were extremely tough and seemingly overcooked. They had pork belly on top that was so overcooked it was not possible to really eat.For mains I had the fish and chips. It was okay. The fish was two rather large pieces of whitefish and not smaller chunks like you would usually get it. As with the appetizers it was somewhat overdone. The tartar sauce was watery and not very flavorful. My father had the burger which he was was fine and my mother had the lobster roe pasta that was alright but really somewhat bland, especially for the price tag. The desert was really the best part of the night. The goat cheese cheesecake with kumquats was outstanding. The space itself is charming with a very unique barback. The service was good, but I had this feeling like I was being judged the whole time and the waitress was a little snooty. Overall it wasn't a horrible experience and some of the food was decent, but for $250 you can do better almost anywhere else.",2.0
"Had an amazing brunch here today: steak and eggs, avocado toast (with egg and Korean peppers), ricotta biscuits and jam, and plenty of sides for the table --fries, bacon and sausage! Everything was amazing and the staff made sure that everything was to our liking and preferences--a demanding bunch with food allergies to boot. They passed with flying colors.The gravy--And I wish could've had their's over their biscuits (I'm gluten free)--was the decor; ship wreck nautical theme with wooden barrel tables, sea glass, and antique cabinets behind the bar referencing the captain's quarters.Loved it--have no complaints and only high praise: will be back for more.",5.0
"Great choice for a ""nice"" dinner in Greenpoint! During the summer there's a cute little patio in the back. Tasty food beautiful decor, amazing drinks! I heard they do brunch too but I've never been but would 100% check out.",4.0
"Has a delicious dinner there again last night, and the best $1 oysters I've ever had! Usually $1 oysters are big, watery and flavorless but these were on point.I had the duck, brussels sprouts and mezcal cocktail with ginger and, though i woke up with a bit of a headache, it was worth it! Our server was lovely and all in all it's definitely going to be a regular spot for us.",5.0
"The oysters were really good. I loved the sea feel of the place. Our server pointed out the mariner aspect. He took a bit to warm up. We are fun people & annoyed by restaurants who take their food to the ""lets talk about serious topics"" level & not, ""you will love this"" with a smile. I would go back.",5.0
"I'm a huge fan of this spot, and plan to be a regular! The ricotta with honey and the burger are both phenomenal. Last night I tried the roast chicken with risotto and also loved it. Service is very friendly and the place has a warm and casual vibe. I also love that you don't have to sit on top of your neighbors- a rare find in NYC! My one suggestion is that the high top tables are not all that comfortable to sit at, you are at a bit of an awkward hight in comparison to the table. So I would recommend sitting in one of the regular tables. Regardless, I'm looking forward to more meals here!",4.0
"We love this place.  We consider it our Brooklyn ""go-to"" dinner restaurant.  The staff is great.  The food is great.  The parking is great.  The outside garden -- weather permitting -- is great.  So why not 5 Stars?  The desserts are poorly conceived.  Popcorn Panna Cotta is ""terrible.""  The deconstructed S'mores are ""awful.""  I should try the goat cheese cheese cake, but two strikes are enough.  They need to do a GREAT pie, a GREAT Cake and ice cream.  The other issue is the coffee.  Any restaurant that does not offer a great espresso, or latte or cappuccino is a real negative.  And they should do regular and decaf versions.  So c/mon people.  Get with it.  Work on the coffees.  And seriously reconsider the desserts.  They are disasters.  Do NOT have dessert.Also, it is super noisy.",4.0
"Excellent discovery with this Greenpoint located place.Good atmosphere, friendly staff, little cosy ambiance, plenty of people who seem to enjoy their own dishes, ok priced wines and good food.Had to try the whole fish catch of the day and it was delish. Slightly grilled and easy to remove bones made this meal perfect. It came with light grilled veggies and a beet salad and made this a good combo. Overall felt very satisfied after having diner there.Tip: try to reserve before coming in, the place was somewhat busy even after 2 services at night. Oh and desert (cheese cake with goat milk), starter was a duck in a blanquet salad, also both good.Would love to come back and try the steak, which i tried and was nicely tasty, and other fish dishes they have. Good find.",4.0
"Literally Over an hour for food when the restaurant was near empty - and not a single item was comped. I basically looked like an a-hole for picking this place for me+ 4 friends.  Good food, but this is such an oversight I just won't be able to return.  Both server and manager only made excuses, but didn't care to even try to make it up to us in any way.  After well over one hour, only one very small appetizer was delivered for 5 people, and then it was another long while before we saw any other food. We actually started eating some fruit out of one person's shopping bags that was meant for bringing to a party later.  Other patrons were walking out due to the long delays. Because of being there for hours - about 20 mins at the end of of our 2 hours time there was spent silently scarfing our food like animals (partly from hunger but partly because we'd been told we had to be off the patio by a certain time) because of all this waiting and waiting, we ended up buying more wine than I normally would have.  Any other restaurant would have comped us that wine that we didn't even really want, but we were just at such a loss as to when food would ever actually come.",2.0
"After living in Greenpoint for a year, not sure how this place slipped my radar. Went last night with a friend for dinner and was beyond blown away. The food was amazing! Best restaurant I've been to in the 'hood. I had the flank steak (SO tender, with amazing celery root puree and bomb steak sauce) and my friend had the chicken. Both were so delicious; I've never tasted chicken so soft and tender before it was almost like tofu (sounds weird but SO good). Drinks were great, service from Cole was awesome too. I will be going back all the time!! It's so cute inside, too. $1 oyster happy hour, brunch... what more can you ask for!!!! Go Geenpoint!",5.0
"What can I say other than I LOVE this place! Ate here several times....and everytime the food is amazing, service is fantastic, and the burger is amazing!!! This is one of my go-to spots for a good meal.",5.0
"My panna cotta don't want none unless it's topped with caramel corn, hun. This is what I sang to my dessert at The Bounty. SO YUM. Perfect way to end a stellar meal.  Hubby and I had a wonderful dinner and evening here. Totally empty (why?!) on a Wednesday night except for a couple people sitting at the bar. I hope this changes or that it was only empty because of the freezing cold and snow, because everything about The Bounty was exactly what I want in a restaurant:-Friendly, attentive, knowledgeable waitress -Delicious cocktails (grapefruit gimlet!)-Oyster happy hour (not just at the bar)-Everything house-made-Lemony whipped ricotta with grilled bread-LAMB RIBS-Great burger (but the lamb won) AND great fries-Sea salt caramel panna cotta with fresh whipped cream and crunchy caramel corn, worthy of a parodic Sir Mix-a-Lot serenadeFor the icing on the list, add in a lovely, quintessentially Brooklyn ambiance with stellar music (Beck, Radiohead, Gorillaz...), and what more can you ask for?",5.0
"The food: Delicious.The cocktails: Spot on & beyond tasty.The service: EXCELLENT. We requested a shooter of vodka, oyster and quail egg with hot sauce and our waitress made it happen.The price: Shockingly reasonable.A hidden gem my boyfriend and I stumbled upon. Him being a chef with 18+ years in restaurants and bars, this was an amazing find. We will be back.",5.0
