"I really wanted to like this place! As a vegetarian, I am always searching for restaurants that have more than just one sad veggie option. This place is just blocks from where I live so I was extremely excited to have found my new go-to brunch spot. Sigh...First, there is something off about the atmosphere. It is awkwardly laid out and cramped. Anyone sitting at the two party tables against the wall is facing the parties in the booths, having to watch them the whole time. The decor is nothing to write home about, in fact it is quite drab and lacks identity and cohesiveness. Now, onto the most important part, the food. My first impression was that they are trying too hard. The dishes are something I think that a ""chef"" would make if on some sort of food network competition. Odd pairings, ingredients used in ""creative"" but failed ways. For example, the avocado fries (battered and deep fried avocado makes for a mushy, greasy, over salted disaster). Just give me good ole potatoes!! And don't get me started on the portions... I don't think people come here for ""gourmet, small portion, more decorative garnishes than food- plates"". This is east Williamsburg for goodness sakes. You're neighbors to a 99 cent store and c-town grocery. But I don't think this place would do well in a more affluent neighborhood because of the hundreds of other restaurants doing what they're trying to do, but doing it right. (I'm looking at you, Blossom on Carmine, love that place!! Trek over and go there people!). Anyway, everything was too salty and underwhelming for the steep prices.I'm also peeved that regular drip coffee is $4.00 for one cup, NO FREE TOP OFFS. Don't say yes to a refill unless you want to pay $8.00 for two cups. The staff was also awkward and made me feel awkward. Just bad vibes all around, I had a bad time and wanted to leave.I'm giving *some* stars because of the attempt to provide vegans and vegetarians brunch options, which is always appreciated! Thanks for trying...*If you're looking for a decent vegan/vegetarian place nearby, go to Champs. The wait is long but it's worth it.",3.0
"OMG, I need this in my life!!!Pleasant brunch experience with friends here. Will definitely be back for more. Their food is gooood!!! I'm talking about fresh, do-your-tastebuds-a-flavor (mouth-watering) gooood!!!  Menu has variety to fulfill everyone's palate too. Nice set of options to choose from.  Service was friendly and professional. Check them out, I highly recommend it!Officially a neighborhood fave!!AWOL Eatery? Yes please!!!!",5.0
Kimchi fried rice is a must!! Tres leches rice pudding is crazy good.Definitely coming back I love that they source from local farmers.,5.0
"We had an excellent evening here at AWOL.  The food is clearly well thought out and the menu changes constantly.  They were very sensitive to any food allergies and it was VERY well priced for all the food we had.  The wine was 1/2 off bottles so we indulged in a nice rose.  Everything we ordered from the shrimp glass noodles to the risotto and the pizza were amazing and literally come from ""All Walks Of Life""  The chef brought out the dessert which were apple and brie filled dumplings (a tad too brown) and a special shoutout to our waiter Jimmy who was an extraordinary waiter.  Shocked to see only a few tables full throughout the night after such an amazing meal.",5.0
The Roast Chicken plus rosé plus fruit cobbler was the perfect dinner date meal. We will definitely be back.  The chef even came out to talk to us and he's really cool.,5.0
"Okay so let me start this off by saying this place is the best kept secret in Williamsburg!Everything on the menu is full of flavor and delicious, whenever I want to eat brunch I come here. My favorite thing to eat on the menu is the corn",5.0
"In search of places that offer gluten-free fare, a friend and I discovered AWOL Eatery, where we had a late lunch/early dinner the other day. Since my friend has to follow a gluten-free diet, everything that we ordered had to be gluten-free; however, we did not feel restricted at all!We each started out our meal with glasses of wine, which later paired well with shares of the truffle aioli fries, the mac and cheese, and the Brussels sprouts. While everything was delicious, the mac and cheese was exceptional. With just enough meat for flavor, it was the perfect amount for two people who do not generally enjoy it.Also, the service was friendly, and the bathrooms were clean. Truly as good as it gets!",5.0
"Nice intimate ambiance, great service, good food and 1/2 price bottles of wine on Monday's! What more can you ask for?Short Rib Mac & Cheese and Grilled Quail were the highlights, as was the Long Island Rose (sorry I don't remember the name)!",4.0
"Another Farm to Fork eatery. It's the uber iteration of the original promise of locally sourced, small farm, organic foods brought from the ground to your table. It doesn't really matter if you are growing the damn veggies or raising that damn cow in a bio dome, what most ""F to F"" eateries fail at is simply making the food taste good. They correlate the quality of the ingredients to a perceived need for uber-health, eschewing common sense in preparing their dishes. Pacific Fine Foods is a great example of this type of thinking : great ingredients put together in weird ways that just don't taste very good, but damn sure are healthy. AWOL is not one of those places. I had the skirt steak here and the meat was quality, that's to be expected when you pay $25+ for a dish. But the execution was terrific... I had asked for a medium piece of skirt steak and it was cooked perfectly. If you've ever tried to cook a piece of skirt steak yourself, you'll know how hard it is but these guys got it right. The dishes here are also all triangular in shape. It's... so outside the box that I can say I've never seen it before. AWOL is easily the best restaurant in East Williamsburg. It combines execution, innovation, fine ingredients and most importantly good taste into one package. Be warned : it's hipster as crap and this place is NOT ideal for big groups or kids.",5.0
"Not to rain on anyone's parade, because this place can be good, but I'm deducting a star because it is overpriced and at times inconsistent.  The food is thoughtfully prepared, but the portions can be too small.  A few times I ordered the pizzas and they were great, a few times they tasted too dry and like cardboard.  I don't mind small plates and paying extra for farm-to-table, organic food, but if you want a great example of that in Williamsburg, check out Traif.  AWOL is just ok.",3.0
"I really wanted to like this place! As a vegetarian, I am always searching for restaurants that have more than just one sad veggie option. This place is just blocks from where I live so I was extremely excited to have found my new go-to brunch spot. Sigh...First, there is something off about the atmosphere. It is awkwardly laid out and cramped. Anyone sitting at the two party tables against the wall is facing the parties in the booths, having to watch them the whole time. The decor is nothing to write home about, in fact it is quite drab and lacks identity and cohesiveness. Now, onto the most important part, the food. My first impression was that they are trying too hard. The dishes are something I think that a ""chef"" would make if on some sort of food network competition. Odd pairings, ingredients used in ""creative"" but failed ways. For example, the avocado fries (battered and deep fried avocado makes for a mushy, greasy, over salted disaster). Just give me good ole potatoes!! And don't get me started on the portions... I don't think people come here for ""gourmet, small portion, more decorative garnishes than food- plates"". This is east Williamsburg for goodness sakes. You're neighbors to a 99 cent store and c-town grocery. But I don't think this place would do well in a more affluent neighborhood because of the hundreds of other restaurants doing what they're trying to do, but doing it right. (I'm looking at you, Blossom on Carmine, love that place!! Trek over and go there people!). Anyway, everything was too salty and underwhelming for the steep prices.I'm also peeved that regular drip coffee is $4.00 for one cup, NO FREE TOP OFFS. Don't say yes to a refill unless you want to pay $8.00 for two cups. The staff was also awkward and made me feel awkward. Just bad vibes all around, I had a bad time and wanted to leave.I'm giving *some* stars because of the attempt to provide vegans and vegetarians brunch options, which is always appreciated! Thanks for trying...*If you're looking for a decent vegan/vegetarian place nearby, go to Champs. The wait is long but it's worth it.",3.0
"OMG, I need this in my life!!!Pleasant brunch experience with friends here. Will definitely be back for more. Their food is gooood!!! I'm talking about fresh, do-your-tastebuds-a-flavor (mouth-watering) gooood!!!  Menu has variety to fulfill everyone's palate too. Nice set of options to choose from.  Service was friendly and professional. Check them out, I highly recommend it!Officially a neighborhood fave!!AWOL Eatery? Yes please!!!!",5.0
Kimchi fried rice is a must!! Tres leches rice pudding is crazy good.Definitely coming back I love that they source from local farmers.,5.0
"We had an excellent evening here at AWOL.  The food is clearly well thought out and the menu changes constantly.  They were very sensitive to any food allergies and it was VERY well priced for all the food we had.  The wine was 1/2 off bottles so we indulged in a nice rose.  Everything we ordered from the shrimp glass noodles to the risotto and the pizza were amazing and literally come from ""All Walks Of Life""  The chef brought out the dessert which were apple and brie filled dumplings (a tad too brown) and a special shoutout to our waiter Jimmy who was an extraordinary waiter.  Shocked to see only a few tables full throughout the night after such an amazing meal.",5.0
The Roast Chicken plus rosé plus fruit cobbler was the perfect dinner date meal. We will definitely be back.  The chef even came out to talk to us and he's really cool.,5.0
"Okay so let me start this off by saying this place is the best kept secret in Williamsburg!Everything on the menu is full of flavor and delicious, whenever I want to eat brunch I come here. My favorite thing to eat on the menu is the corn",5.0
"In search of places that offer gluten-free fare, a friend and I discovered AWOL Eatery, where we had a late lunch/early dinner the other day. Since my friend has to follow a gluten-free diet, everything that we ordered had to be gluten-free; however, we did not feel restricted at all!We each started out our meal with glasses of wine, which later paired well with shares of the truffle aioli fries, the mac and cheese, and the Brussels sprouts. While everything was delicious, the mac and cheese was exceptional. With just enough meat for flavor, it was the perfect amount for two people who do not generally enjoy it.Also, the service was friendly, and the bathrooms were clean. Truly as good as it gets!",5.0
"Nice intimate ambiance, great service, good food and 1/2 price bottles of wine on Monday's! What more can you ask for?Short Rib Mac & Cheese and Grilled Quail were the highlights, as was the Long Island Rose (sorry I don't remember the name)!",4.0
"Another Farm to Fork eatery. It's the uber iteration of the original promise of locally sourced, small farm, organic foods brought from the ground to your table. It doesn't really matter if you are growing the damn veggies or raising that damn cow in a bio dome, what most ""F to F"" eateries fail at is simply making the food taste good. They correlate the quality of the ingredients to a perceived need for uber-health, eschewing common sense in preparing their dishes. Pacific Fine Foods is a great example of this type of thinking : great ingredients put together in weird ways that just don't taste very good, but damn sure are healthy. AWOL is not one of those places. I had the skirt steak here and the meat was quality, that's to be expected when you pay $25+ for a dish. But the execution was terrific... I had asked for a medium piece of skirt steak and it was cooked perfectly. If you've ever tried to cook a piece of skirt steak yourself, you'll know how hard it is but these guys got it right. The dishes here are also all triangular in shape. It's... so outside the box that I can say I've never seen it before. AWOL is easily the best restaurant in East Williamsburg. It combines execution, innovation, fine ingredients and most importantly good taste into one package. Be warned : it's hipster as crap and this place is NOT ideal for big groups or kids.",5.0
"This restaurant did not meet my expectation. I was really disappointed by many things.1/ a little bit pricey for what you get2/ You better not be hungry because there isn't much in your plate3/Food is average. Pizza is just ok. 4/I was there with some friends and we all got cold because they don't heat the place in winter? Really cold especially next to the window.5/The waitress was friendly but not really good at her job (sorry)6/We were 6people and we decided to pay by card and cash. They charged EVERYTHING on my card. that was not professional at all. I was really mad and when they gave me back my cc they kinda laugh (nervously) telling me that they charge the entire bill on my card. they didn't really apologize either.Anyway, it doesn't worth more than a 1/5 to me. I'm sure that other people enjoyed the place more than I did.I just had a terrible experience and I won't recommend this place to my friends.",1.0
"Facts:-they use triangular plates- they change parts of their menu weekly/daily- it's the best god damn restaurant this side of the mason dixon! everything tasted great, the beef tacos were the best I've ever had, and the quality justifies the price.",5.0
"What food should be. Simple and flavorful.Farm to market concept with excellent follow through. Great for family style sharing.The GreatMost everything. The atmosphere is delightful. Understated hipster vibe without pretentious attitude. Hooks under the bar everywhere for purses and coats.  Even the bathrooms were spotless and even smelled nice.The food in general was as good as food gets. The polenta was better than I could imagine.  The asparagus with quail egg was perfect. The mushroom side was fantastic.Fun beer choices - I loved my prohibition pale ale.Service was prompt and friendly from start to finish. We had a 6 yr old and they brought his food out early.Even the knives and dishes were superb. Fun shapes and just the right size.About 30 ft from an L train subway stop.The good The fried pickles and the shishito peppers were my least favorite but still had good notes. The aioli with the fried pickles was nice.The could be betterThe heater really works too well. It was a freezing night. And when the heater came on we joked that not only did we need to take our coats off but we might need to take our shirts off too, if they didn't turn it off.  But the waiter knew the situation and said they would try to manage it well. It seems they did their best and most of the dinner was a few degrees cooler than ideal, but with a coat on it was fine. No big deal.OverallThis is one of the best places I can imagine eating.  If you like food with friends, eat here.",5.0
Delicious food and very gluten free friendly.  We ordered several different dishes for the table and all were great - standout was the kimchi fried rice! The waitress told us that 4 or 5 plates would be enough for the 4 of us but we ordered quite a few more than that (I think 7) and it was the perfect amount of food. Half price bottles of wine on Monday nights!,5.0
"Really enjoyed it here. The kind of place where tables are close together but they kept the music not too loud so it's still good for having a conversation. Music could be a little dimmer but that's just my preference. Staff was very attentive and the food didn't take long. We went on a Friday night at 830 and were surprised that there were several tables open. My boyfriend and I wanted to try everything so despite their advise to only get maybe two plates each we shared the sea bass slider and 5 plates, slightly too much food. The sea bass slider was good but we sort of jumped the gun and didn't realize it would be fried. If you're in the mood for that it was very tasty and came with delicious calamari. We had two of the garden tacos and it wasn't my favorite, probably wouldn't order it again, but I'm just not into that particular flavor. It was cooked and presented fine. We also had the pork belly buns which were standard but really tasty. I love shrimp so we got the shrimp skewers and they were amazing, such a great flavor to them. The quinoa salad them came on was good too. Note there are only three jumbo shrimp on the skewer, but a big heaping of the salad. The stewed sweet potatoes were delicious if you like cumin and coconut milk, which I do. I'll definitely try to replicate that. They were a tad spicy.Also had the vegan meatball which was good, medium sized, and came in a bowl of penne in tomato sauce and veggies. Not very exciting. I would definitely recommend the shrimp skewer, stewed sweet potatoes, pork buns, and the sea bass slider was good too. Everything tastes very fresh and you feel the love put into the place.",5.0
"A tasty addition to the neighborhood with some particularly tasty things that are creative and some relatively tasty things that are pretty standard. Also I really like their weird triangular plates. Very cool.Get the short rib slider. It's a bit overpriced but is really quite extraordinary. Super tender, with some mashed potatoes for good measure. The beef tempura tacos were also interesting and quite tasty.The more mundane stuff included the brussels sprouts and mushrooms. They were in no way bad, but there was nothing super special about them.",4.0
"My roommate and I have been wanting to come here for ages, and we finally pinned down a date to hit it for dinner. We walked in, and were immediately greeted and told it would only be about five minutes. When we sat down, the hostess explained the entire menu and gave us the low down on numerous dishes. The explanations were very helpful and made our decision even more difficult because everything sounded delicious! My roommate got the steak, and it was cooked a perfect medium rare and seasoned very well. I opted for the vegan meatball and the kimchi fried rice. The Kimchi fried rice was a standout, my mouth is watering just thinking about it. Next time I would like to try one of the ""sliders."" They are less like a typical slider, and more like a properly portioned burger. Also, the kitchen and wait staff was extremely diligent regarding my cheese allergy.",5.0
"This place is a gem. I was looking for dinner options in Williamsburg and saw this on Yelp. It had high ratings and the description was in line with the type of places that I like. My date and I went and were both quite impressed. Great ambiance, excellent and friendly service and delicious and interesting food. Lot's of options that fit most any diet: vegetarian, gluten free, etc. We had 4 small plates, which was more than enough food. Included in our choices where the short rib mac 'n cheese (gluten free) and the sweet potatoes that were savory and sweet. Those were the two standout dishes to me, but all four were very good.Definitely check this place out.",5.0
"it's impossible to feel uncomfortable here, so cozy, casual and friendly place  that you want come back many more times.",4.0
"Our food did not arrive for over 1.5 hours,( they said 30-40 minutes), and was cold, soggy, and soaked through the packaging. Tortillas and pizza crust were actually hard from having sat out so long before being delivered. Delivery guy refused to buzz our apartment so he wouldn't have to walk up the stairs, despite a good tip. Complete garbage, will not order again.",1.0
"This restaurant did not meet my expectation. I was really disappointed by many things.1/ a little bit pricey for what you get2/ You better not be hungry because there isn't much in your plate3/Food is average. Pizza is just ok. 4/I was there with some friends and we all got cold because they don't heat the place in winter? Really cold especially next to the window.5/The waitress was friendly but not really good at her job (sorry)6/We were 6people and we decided to pay by card and cash. They charged EVERYTHING on my card. that was not professional at all. I was really mad and when they gave me back my cc they kinda laugh (nervously) telling me that they charge the entire bill on my card. they didn't really apologize either.Anyway, it doesn't worth more than a 1/5 to me. I'm sure that other people enjoyed the place more than I did.I just had a terrible experience and I won't recommend this place to my friends.",1.0
"Facts:-they use triangular plates- they change parts of their menu weekly/daily- it's the best god damn restaurant this side of the mason dixon! everything tasted great, the beef tacos were the best I've ever had, and the quality justifies the price.",5.0
"What food should be. Simple and flavorful.Farm to market concept with excellent follow through. Great for family style sharing.The GreatMost everything. The atmosphere is delightful. Understated hipster vibe without pretentious attitude. Hooks under the bar everywhere for purses and coats.  Even the bathrooms were spotless and even smelled nice.The food in general was as good as food gets. The polenta was better than I could imagine.  The asparagus with quail egg was perfect. The mushroom side was fantastic.Fun beer choices - I loved my prohibition pale ale.Service was prompt and friendly from start to finish. We had a 6 yr old and they brought his food out early.Even the knives and dishes were superb. Fun shapes and just the right size.About 30 ft from an L train subway stop.The good The fried pickles and the shishito peppers were my least favorite but still had good notes. The aioli with the fried pickles was nice.The could be betterThe heater really works too well. It was a freezing night. And when the heater came on we joked that not only did we need to take our coats off but we might need to take our shirts off too, if they didn't turn it off.  But the waiter knew the situation and said they would try to manage it well. It seems they did their best and most of the dinner was a few degrees cooler than ideal, but with a coat on it was fine. No big deal.OverallThis is one of the best places I can imagine eating.  If you like food with friends, eat here.",5.0
Delicious food and very gluten free friendly.  We ordered several different dishes for the table and all were great - standout was the kimchi fried rice! The waitress told us that 4 or 5 plates would be enough for the 4 of us but we ordered quite a few more than that (I think 7) and it was the perfect amount of food. Half price bottles of wine on Monday nights!,5.0
"Really enjoyed it here. The kind of place where tables are close together but they kept the music not too loud so it's still good for having a conversation. Music could be a little dimmer but that's just my preference. Staff was very attentive and the food didn't take long. We went on a Friday night at 830 and were surprised that there were several tables open. My boyfriend and I wanted to try everything so despite their advise to only get maybe two plates each we shared the sea bass slider and 5 plates, slightly too much food. The sea bass slider was good but we sort of jumped the gun and didn't realize it would be fried. If you're in the mood for that it was very tasty and came with delicious calamari. We had two of the garden tacos and it wasn't my favorite, probably wouldn't order it again, but I'm just not into that particular flavor. It was cooked and presented fine. We also had the pork belly buns which were standard but really tasty. I love shrimp so we got the shrimp skewers and they were amazing, such a great flavor to them. The quinoa salad them came on was good too. Note there are only three jumbo shrimp on the skewer, but a big heaping of the salad. The stewed sweet potatoes were delicious if you like cumin and coconut milk, which I do. I'll definitely try to replicate that. They were a tad spicy.Also had the vegan meatball which was good, medium sized, and came in a bowl of penne in tomato sauce and veggies. Not very exciting. I would definitely recommend the shrimp skewer, stewed sweet potatoes, pork buns, and the sea bass slider was good too. Everything tastes very fresh and you feel the love put into the place.",5.0
"A tasty addition to the neighborhood with some particularly tasty things that are creative and some relatively tasty things that are pretty standard. Also I really like their weird triangular plates. Very cool.Get the short rib slider. It's a bit overpriced but is really quite extraordinary. Super tender, with some mashed potatoes for good measure. The beef tempura tacos were also interesting and quite tasty.The more mundane stuff included the brussels sprouts and mushrooms. They were in no way bad, but there was nothing super special about them.",4.0
