"Awol is just down the street from me, but I didn't go in at first because of the trendy-but-cheap looking decor. Low school-child chairs and hard wooden benches that looked silly and uncomfortable to me, and I admit I judged them immediately as a place that values aesthetics over comfort. I finally decided to give it a try though, and I'm very glad I did.The first time I looked over their menu I was impressed and ready for something different, and I wasn't disappointed. Filet mignon tempura tacos- definitely a first for me, with great taste and texture. The roasted brussels sprouts are delicate in size and are done just the way I love them, with the outside brown and crispy. The other day I had the Mac and Cheese, which is gluten-free, btw, and obscenely delicious. It was garnished with thin strips of dried, crispy leek, and all the other dishes have similarly interesting and tasty garnishes. The first time I went, my friend and I ordered way too much, thinking the ""Farm plates"" were typical small plates, but many of the items are perfectly sized for sharing (like the brussels sprouts and mac and cheese). If you are two women or a man and a woman, four farm plates total should be plenty. But of course there are also sliders, and pizza to choose from.Nice service, and they recently added some booths for parties of four. Not too expensive (for Williamsburg), on my last visit our bill was $44 plus tip, which included a glass of wine and a bottle of sparking water.",5.0
Really close to home so I decided to check it out. We asked for a booth since it would be more comfortable but we're told they need to keep those open in case more people come? Okay whatever. Food was pretty good they have a lot of gluten free options which is nice. Overall good place.,4.0
"Went in for dinner last night, the food was  AMAZING!!!! The chef and staff were so fantastic and accommodating of all of my allergies (gluten, red meet & milk) and the food was fantastic!!!!! I got the salmon (which was perfect) with coconut curry rice (also perfect) and yuca (which were like the tastiest potato chips) my friend got the chicken (honestly the best chicken I have ever had; so succulent yet crispy) with roasted potatoes (also great). I was expecting these to be Brklyn portions so we got the roasted brussels sprouts with hazelnuts which where out of this world good so we took home half our food everything was so wonderful. Check it out for yourself!!",5.0
"Yeah... I'm into this place. The food is delicious, unique, and affordable. Also, best waitstaff of my life.",5.0
"If you're looking for a unique and magnificent experience... go to AWOL.  Seriously people, from the art on the walls to the art on the plates, this is not to be missed.  Drinks with truffle salt, food with a tandoori flavor... cocktails with beet juice.  Rad stuff.  I loved loved loved the pizza, and all the veggies are amazingly fresh.  (sweet potatoes, I don't even know what to do).The value is amazing and the service was impeccable.  get involved people.",5.0
"Tried this new place for delivery tonight and was fantastic! Great margherita pizza, tasted so fresh and the crust was just crispy enough, also the creamed kale was delicious! I also appreciated the eco-friendly packaging! I'll definitely be eating here again!",5.0
"We ordered delivery from AWOL when it first opened and really enjoyed it. The only glitch was that they forgot our beverage order. However, the delivery guy apologized and brought the beverages to us within ten minutes with a nice note from the restaurant. We decided to try the delivery again, and it was not as good. The food was okay, but certainly not as good as the first time even though we ordered the same thing. They also forgot our beverages again and did not bring it until over half an hour later with no apology. Most people want to have their beverage with the food they are eating. For this to happen both times we ordered is pretty unacceptable, especially for the prices we are paying. All in all I might dine in, but I will most likely not be ordering delivery again.Update: The general manager called us and personally apologized for the mistake. That was certainly nice enough for me. However, later in the evening the manager delivered some delicious desserts and beverages with a note. I was incredibly impressed with that gesture and the fact that they went above and beyond. Thanks AWOL! You certainly deserve another chance.",5.0
"I just had the most beautiful customer service experience I have ever had in my life.  I just moved into the neighborhood. I placed a order online because I have been craving the fresh farm to table experience I was use to in SF...  I asked if they could please includes plates since I am still unpacking.  I was not expecting one of the owners to come hand deliver my order and gift me actual plates and saucers to make sure I had the right dinning experience.  It was such a sweet gesture I was going to leave a nice review even if the food was bad. But it wasn't... it was incredible.  I'll definitely be coming back and trying more things on the menu.  So far the tempura beef tacos, the brussel sprouts and the pumpkin empanada's were everything I wanted and more.  I'm eyeing those pizza's next. ;)",5.0
"Buyer beware - enter hungry and leave broke.Yes, they're trendy, and the food does taste good overall but 3 stars is the maximum I can surrender here.  Portions are small (overpriced) and the menu is misleading.  For instance: consider their Sliders section.  When one ponders the nature of sliders, he/she/it would expect approximately 3-4 mini-burgers.  At AWOL you get 1 mini-burger, for $14.  Grammatically, sliders doesn't come in a singular form, like shenanigans, or annals.  Moreover, most people don't expect to pay $14 for 1 undersized burger unless its going to land a satellite atop a comet as the side-order.  If you're looking for reasonable beverage options, avoid their North Fork wine, which come at ~$114/bottle.  Though traffic from Long Island is pretty abysmal, transportation cost cannot account for this wallet-gouging option.  The other options are a bit over priced as well, naturally steering one back to beer.  Alas, and we were going for class.",3.0
"Both working and living in the neighborhood, it's always exciting when a new restaurant opens up. AWOL especially stands out with it's farm to table philosophy, which is truly displayed on their ever changing menu. Being an Italian girl from jersey, I'm not ashamed to say I had one of the best pizzas of my life here. Their food is pretty dank, stop screwing around and go try some!",5.0
Had a group of 18 for a surprise birthday party. All the waiters were so nice and the restaurant was extremely organized with the bills. The food was amazing and reasonably priced. I'll be telling all my friends to go there!,5.0
"5 starts for AWOL! Not only is the food absolutely delicious but these guys are super awesome. They never received our Seamless order, and after 2 hrs we called wondering where our food was. They were closing up and the stoves were shut down. They went above and beyond to cook and hand deliver our dinner. They even threw in some delicious surprises to make up for the long wait time. I can't thank them enough! We can't wait to dine in next time.",5.0
"This place rocks! Despite their love of cilantro and their sliders actually only being one medium burger and not a few small ones their food is great and locally sourced. Nice wine list. Awesome brunch. I crave their heuvos, soo good! Their fries are also awesome. Small place that can get rather loud but they also have outdoor seating and it's definitely a chill atmosphere.",5.0
This place rules. Incredible good at extremely reasonable prices. Excellent service to boot. I am delighted. Highly recommended.,5.0
"We went saturday for brunch and everything g was great. Nice service et yummyyyy food, especially the Hilo pizza!! Cherry on the cake: they had a lots of GF and vegan choices. We'll go back for sure !",5.0
"Dinner for 2 couples last night. Excellent space and service. Food is well prepared though a bit under seasoned. Portions are appropriate. Hazelnuts in the Brussel sprouts made the dish. Bison steak and polenta was perfect. Corn off the cob was underwhelming as were the shishito peppers (needed more char). Sweet potato with curry and coconut was well balanced and satisfying. Tempura filet tacos had great texture but taste was reminiscent of Americanized sweet and sour pork Chinese take out.  Dessert was excellent (cheesecake and sweet potato empenada) as was the French press. Overall, I like the farm to table concept but I think the flavors and dishes underwhelm, especially for $190 for 4 (with 4 beers, 2 glasses of wine, and tip).  Would like to see how brunch goes.",3.0
"Had been meaning to stop in since this place opened, and I am so glad I did. I will definitely be coming back a LOT. We tried four of the cocktails, and every single one was unique and expertly made and REALLY good. The food was excellent as well, very flavorful without being heavy or overwhelming. The vibe is casual and super friendly. Great for a date or to hang out with friends. My new favorite neighborhood restaurant, can't wait to go back!",5.0
"I just had the most beautiful customer service experience I have ever had in my life.  I just moved into the neighborhood. I placed a order online because I have been craving the fresh farm to table experience I was use to in SF...  I asked if they could please includes plates since I am still unpacking.  I was not expecting one of the owners to come hand deliver my order and gift me actual plates and saucers to make sure I had the right dinning experience.  It was such a sweet gesture I was going to leave a nice review even if the food was bad. But it wasn't... it was incredible.  I'll definitely be coming back and trying more things on the menu.  So far the tempura beef tacos, the brussel sprouts and the pumpkin empanada's were everything I wanted and more.  I'm eyeing those pizza's next. ;)",5.0
"Buyer beware - enter hungry and leave broke.Yes, they're trendy, and the food does taste good overall but 3 stars is the maximum I can surrender here.  Portions are small (overpriced) and the menu is misleading.  For instance: consider their Sliders section.  When one ponders the nature of sliders, he/she/it would expect approximately 3-4 mini-burgers.  At AWOL you get 1 mini-burger, for $14.  Grammatically, sliders doesn't come in a singular form, like shenanigans, or annals.  Moreover, most people don't expect to pay $14 for 1 undersized burger unless its going to land a satellite atop a comet as the side-order.  If you're looking for reasonable beverage options, avoid their North Fork wine, which come at ~$114/bottle.  Though traffic from Long Island is pretty abysmal, transportation cost cannot account for this wallet-gouging option.  The other options are a bit over priced as well, naturally steering one back to beer.  Alas, and we were going for class.",3.0
"Both working and living in the neighborhood, it's always exciting when a new restaurant opens up. AWOL especially stands out with it's farm to table philosophy, which is truly displayed on their ever changing menu. Being an Italian girl from jersey, I'm not ashamed to say I had one of the best pizzas of my life here. Their food is pretty dank, stop screwing around and go try some!",5.0
Had a group of 18 for a surprise birthday party. All the waiters were so nice and the restaurant was extremely organized with the bills. The food was amazing and reasonably priced. I'll be telling all my friends to go there!,5.0
"5 starts for AWOL! Not only is the food absolutely delicious but these guys are super awesome. They never received our Seamless order, and after 2 hrs we called wondering where our food was. They were closing up and the stoves were shut down. They went above and beyond to cook and hand deliver our dinner. They even threw in some delicious surprises to make up for the long wait time. I can't thank them enough! We can't wait to dine in next time.",5.0
"This place rocks! Despite their love of cilantro and their sliders actually only being one medium burger and not a few small ones their food is great and locally sourced. Nice wine list. Awesome brunch. I crave their heuvos, soo good! Their fries are also awesome. Small place that can get rather loud but they also have outdoor seating and it's definitely a chill atmosphere.",5.0
This place rules. Incredible good at extremely reasonable prices. Excellent service to boot. I am delighted. Highly recommended.,5.0
"We went saturday for brunch and everything g was great. Nice service et yummyyyy food, especially the Hilo pizza!! Cherry on the cake: they had a lots of GF and vegan choices. We'll go back for sure !",5.0
"Dinner for 2 couples last night. Excellent space and service. Food is well prepared though a bit under seasoned. Portions are appropriate. Hazelnuts in the Brussel sprouts made the dish. Bison steak and polenta was perfect. Corn off the cob was underwhelming as were the shishito peppers (needed more char). Sweet potato with curry and coconut was well balanced and satisfying. Tempura filet tacos had great texture but taste was reminiscent of Americanized sweet and sour pork Chinese take out.  Dessert was excellent (cheesecake and sweet potato empenada) as was the French press. Overall, I like the farm to table concept but I think the flavors and dishes underwhelm, especially for $190 for 4 (with 4 beers, 2 glasses of wine, and tip).  Would like to see how brunch goes.",3.0
"Had been meaning to stop in since this place opened, and I am so glad I did. I will definitely be coming back a LOT. We tried four of the cocktails, and every single one was unique and expertly made and REALLY good. The food was excellent as well, very flavorful without being heavy or overwhelming. The vibe is casual and super friendly. Great for a date or to hang out with friends. My new favorite neighborhood restaurant, can't wait to go back!",5.0
"I absolutely love AWOL's concept and will definitely be going back. We split multiple dishes include the corn and avocado pizza, the steak pizza, the zucchini sliders with avocado fries, the ratatouille, and the flan cheesecake! It was the most amazing food I've ever tasted. The staff was nice and very friendly and the menu is very evenly priced. Plus it's right next to the train. I recommend it to all my friends who live in the area!",5.0
"I went to AWOL Friday night for dinner with my boyfriend and his dad.  We did not have to wait for a table and were seated in one of the booths.  The dishes were absolutely delicious.  We had the kimchi fried rice (which we've gotten since - different and excellent flavors), salmon, brussel sprouts, asparagus, beef tacos, pork buns, apple fritters and a bottle of wine -- everything was great!  The meal came to $100 for 3 people which I thought was very reasonable for quality dinner, dessert and drinks for 3 people. They have a few tables in the front for outdoor seating.  Definitely a secret off the Grand Ave stop!",5.0
"OMG, this place is insane!!! The food was nothing short of AMAZING. I've actually been bored lately when it comes to restaurants as it seems like the same old crap. But that's not the case here. Avocado fries, almond crusted tilapia sliders, mini apple pie turnovers, maiz (which sounds boring on the menu but is delicious), and pumpkin cheesecake (by far the creamiest, smoothest cheesecake I've ever eaten) are just some of the delicious things we tried. And everything was reasonably priced. By the end I was stuffed to the gills and I didn't throw down mucho dinero either. Our waiter was funny too. A bonus considering most waiters seem to be going through the motions. I will definitely be back!",5.0
"So excited that AWOL is here! This place is so good and offers a nice variety of menu options. The staff and chef are very nice too! At first glance, the menu looks like the portions might be small with ""plates"" and ""sliders"" but don't be fooled. The portions here are much bigger and great for the price. I look forward to seeing this restaurant succeed!",4.0
"So happy this place opened; it's definitely a welcome addition to the Williamsburg restaurant scene. So far all the things I've tried here are fresh-tasting and original. I'm not usually drawn to vegetarian dishes but the Garden Crema Taco and Maiz corn salad were super tasty.  Also, my friend ordered a slider that came with polenta fries--which I couldn't stop stealing bites of. My other favorite dish was the grilled Argentine pizza--it combines my two favorite things: chimichurri steak and pizza! To drink I had the Locke mimosa. I ordered it mostly out of curiosity because I've never seen organic sake, prosecco and an assortment of fresh juices combined in such a way, but I was pleasantly surprised with how well it all came together. Next I had the Spiked Iced Tea, which I think is my favorite. It's exotic and refreshing and has a little kick to it. On top of how much everyone enjoyed their meal, we all left feeling good about how reasonably priced everything is! In NY it's really hard to find a place that serves great tasting food that is simultaneously unique AND affordable, with good service to boot. I'll be back very soon!",5.0
"I went to this restaurant on a date night and was pleasantly surprised by the staff, ambiance and quality of food of this restaurant. The staff was extremely attentive and accommodating and gave great suggestions around the food as well as drink  pairings.The avocado fries were out of this world.. Suspect at first and convert after. Id highly recommend going to this place as it was top notch all around.",5.0
"Things didn't start off great - we were seated quickly but then forgotten about.  It's their first day, so we figured we couldn't judge them on that, probably just a kink to work out, but I was very hungry and waiting over 20 minutes made me extra grumpy. My boyfriend ended up halting a waiter who was then subjected to my bad attitude. A few minutes later we were brought appetizers and two glasses of proseco on the house, all of which were delicious, and my bad mood immediately vanished.  We had the maiz and garden tacos, followed by the short rib and tilapia sliders. We cleaned our plates and were only charged for the two sliders. Bad service really irks me, but this place went above and beyond to make up for it. Plus it's super cute and, again, the food is great!",5.0
"I ordered a hamburger and it tasted great, but there were a few problems with it. First of all they put cheese on it, which I didn't ask for. They immediately gave a new burger, but this time it had aioli on the bun which sunk into the burger. The aioli was way too strong and garlicky. I asked for pickles, but they only gave me two tiny slices. The waiters were very nice. I would recommend going there, but be very specific when you order.",3.0
"AWOL (All Walks of Life) cater's too all diets and needs. Perfect for dinner or a late night snack (open till 12 on weekends). Without a doubt, the service is impeccable and the food is spectacular. John, the head chef, has created a unique menu with interesting flavor combinations and a circus of mouth-watering specials. Additionally,every cocktail has  their own wow factor, and better yet, they have a considerable selection of wines and beers. The interior creates a calming and intimate environment of pastels and suppressed illumination. I will definitely come back here again!",5.0
"Phenomenal.  As fresh as it gets and incredibly original dishes: Argentine Churrasco pizza, perfectly breaded Tilapia burger, delectable avocado fries, and yummy corn/avocado pizza are just a few highlights.  Accompanied by a few delicious cocktails (I had The Locke - Saki, organic juices and prosecco), and finished off with pumpkin empanadas and cheesecake flan.  Oh and the best part?  All main dishes were around $10 - incredibly healthy and affordable.  New favorite!!",5.0
"I absolutely love AWOL's concept and will definitely be going back. We split multiple dishes include the corn and avocado pizza, the steak pizza, the zucchini sliders with avocado fries, the ratatouille, and the flan cheesecake! It was the most amazing food I've ever tasted. The staff was nice and very friendly and the menu is very evenly priced. Plus it's right next to the train. I recommend it to all my friends who live in the area!",5.0
"I went to AWOL Friday night for dinner with my boyfriend and his dad.  We did not have to wait for a table and were seated in one of the booths.  The dishes were absolutely delicious.  We had the kimchi fried rice (which we've gotten since - different and excellent flavors), salmon, brussel sprouts, asparagus, beef tacos, pork buns, apple fritters and a bottle of wine -- everything was great!  The meal came to $100 for 3 people which I thought was very reasonable for quality dinner, dessert and drinks for 3 people. They have a few tables in the front for outdoor seating.  Definitely a secret off the Grand Ave stop!",5.0
"OMG, this place is insane!!! The food was nothing short of AMAZING. I've actually been bored lately when it comes to restaurants as it seems like the same old crap. But that's not the case here. Avocado fries, almond crusted tilapia sliders, mini apple pie turnovers, maiz (which sounds boring on the menu but is delicious), and pumpkin cheesecake (by far the creamiest, smoothest cheesecake I've ever eaten) are just some of the delicious things we tried. And everything was reasonably priced. By the end I was stuffed to the gills and I didn't throw down mucho dinero either. Our waiter was funny too. A bonus considering most waiters seem to be going through the motions. I will definitely be back!",5.0
"So excited that AWOL is here! This place is so good and offers a nice variety of menu options. The staff and chef are very nice too! At first glance, the menu looks like the portions might be small with ""plates"" and ""sliders"" but don't be fooled. The portions here are much bigger and great for the price. I look forward to seeing this restaurant succeed!",4.0
"So happy this place opened; it's definitely a welcome addition to the Williamsburg restaurant scene. So far all the things I've tried here are fresh-tasting and original. I'm not usually drawn to vegetarian dishes but the Garden Crema Taco and Maiz corn salad were super tasty.  Also, my friend ordered a slider that came with polenta fries--which I couldn't stop stealing bites of. My other favorite dish was the grilled Argentine pizza--it combines my two favorite things: chimichurri steak and pizza! To drink I had the Locke mimosa. I ordered it mostly out of curiosity because I've never seen organic sake, prosecco and an assortment of fresh juices combined in such a way, but I was pleasantly surprised with how well it all came together. Next I had the Spiked Iced Tea, which I think is my favorite. It's exotic and refreshing and has a little kick to it. On top of how much everyone enjoyed their meal, we all left feeling good about how reasonably priced everything is! In NY it's really hard to find a place that serves great tasting food that is simultaneously unique AND affordable, with good service to boot. I'll be back very soon!",5.0
"I went to this restaurant on a date night and was pleasantly surprised by the staff, ambiance and quality of food of this restaurant. The staff was extremely attentive and accommodating and gave great suggestions around the food as well as drink  pairings.The avocado fries were out of this world.. Suspect at first and convert after. Id highly recommend going to this place as it was top notch all around.",5.0
"Things didn't start off great - we were seated quickly but then forgotten about.  It's their first day, so we figured we couldn't judge them on that, probably just a kink to work out, but I was very hungry and waiting over 20 minutes made me extra grumpy. My boyfriend ended up halting a waiter who was then subjected to my bad attitude. A few minutes later we were brought appetizers and two glasses of proseco on the house, all of which were delicious, and my bad mood immediately vanished.  We had the maiz and garden tacos, followed by the short rib and tilapia sliders. We cleaned our plates and were only charged for the two sliders. Bad service really irks me, but this place went above and beyond to make up for it. Plus it's super cute and, again, the food is great!",5.0
"I ordered a hamburger and it tasted great, but there were a few problems with it. First of all they put cheese on it, which I didn't ask for. They immediately gave a new burger, but this time it had aioli on the bun which sunk into the burger. The aioli was way too strong and garlicky. I asked for pickles, but they only gave me two tiny slices. The waiters were very nice. I would recommend going there, but be very specific when you order.",3.0
"AWOL (All Walks of Life) cater's too all diets and needs. Perfect for dinner or a late night snack (open till 12 on weekends). Without a doubt, the service is impeccable and the food is spectacular. John, the head chef, has created a unique menu with interesting flavor combinations and a circus of mouth-watering specials. Additionally,every cocktail has  their own wow factor, and better yet, they have a considerable selection of wines and beers. The interior creates a calming and intimate environment of pastels and suppressed illumination. I will definitely come back here again!",5.0
