"Came here looking for a quiet place to do some work. The reviews on this place mentioned the food was very good. The reviews did not lie. I had an A.B.C egg sandwich (which was a bit overkill for me as I had E& B for breakfast)/. But the sandwich was excellent. It did take longer than I expected but previous reviews did warn me. The avocado was a great touch. I was not expecting the aioli which was alot and I scraped off. The remaining aioli left a slight spice to the sandwich which was a nice touch. The bacon was thick and crispy but not burnt. The atmosphere was nice, a bit bare, music was interesting but a bit loud. I would definitely come back here. If you are on the Paleo diet like I am, you will want to cheat ( which I did). The bread and pastry selection is very tempting.",4.0
"My husband and I eat at Cafe Madeleine often. I always enjoy their Buttermilk biscuit sandwich; rarely do I venture with any other dish. Its consistently delicious with crisp maple bacon, sharp melted cheddar, soft scrambled egg, and melt in your mouth biscuit. The other plates I see come out look equally tasty. The cafe does get crowded in the mornings and around lunchtime, with some snooty hipster folks with a bit of 'tude (including some of the cashiers). Just ignore and enjoy your meal, your coffee, and/or smoothie. Tasty food, but be prepared to pay a little extra. I think my sandwich costs $8.99, a glass of fresh OJ is about $4, and their almond croissants (when I do indulge) is also about four bucks. I'll continue to patronize if they maintain their quality of their food and the cafe has its balance of regular, local folks.",4.0
"Cheddar chive biscuit sandwich! That's all I have to say. My friend put me on it a few weeks ago and I had to come in again to get it. I couldn't help myself, plus their morning shakes are dope. I never had a drink that gave me that much energy at any time in the morning. Service was slow but with the way they cook and prepare the food, it was worth it.",5.0
"awesome looking brekkie bowls.  I can't believe I didn't order them! I got a farmer's biscuit with scrambled eggs/tomatoes on a cheddar chive biscuit. totally delicious with a side of sausage.  after seeing the amazing brekkie -filled with fresh veggies, eggs on a bed of grains- i have to come back and get them.  My latte was perfectly made and delicious.  great spot to hope in and out with the hassle.  cute sit in area in the back and the front- take out service- so remember to bus yourself ;)",4.0
"Cafe Madeleine's is a great place for breakfast or lunch but expect to pay anywhere from 10-16 dollars, especially if you also get a drink. I got several versions of their egg and cheese sandwich. The best is on what they call the ""stretchy"" bread. It's buttery, crunchy and delicious. They also have plenty of healthy choices, like the breakfast bowl. The coffee is very strong and I don't suggest drinking it on an empty stomach. It made me dizzy! The coffee is also expensive and not that big. I never had it but my friend raves about their chicken bacon sandwich, apparently it's the best sandwich he has ever had, so that's next on my list.",4.0
"I enjoyed coming to this restaurant but it does have its ups and downs. The first thing was that the seats in the front were too close to each other so everyone was like on top of each other. It was until I realized the restaurant extended more in the back and the seats there weren't as bad. The way this restaurant works is interesting, you order your food then wait for your name to be called so you can go grab your food. The strawberry smoothie was really good as well as the mango one. It was a bit overpriced though. The sandwiches here are definitely amazing and a must try, big portion too. I had the chicken sandwich which had chicken, avocado, lettuce, and bacon. The potatoes and sweet potatoes were also yummy but I wouldn't recommend it if you're having a sandwich because it's too much to handle!",4.0
"I go to Cafe Madeline when I want to occasionally splurge on breakfast or lunch I don't feel like making. I enjoy the brioche french toast and the roast beef sandwich, and I can usually endure the wait for them.Today, I ordered a simple stuffed bagel with bacon, which shouldn't take long to make. I understand that it's a very busy day with tons of orders. However, it's quite problematic when a simple order like a bagel with bacon takes over a half hour to prepare. I told the cashier that it's unacceptable to be waiting a half hour, and the only response was ""Thank you."" I would have been okay with a simple apology for the wait.",2.0
One of my favorite places on Ditmas Park. Charming and very laid back. Friendly baristas. Enjoyed their cappuccino and fresh OJ. I've gotten the full breakfast before and recently the Madeline poached eggs. One egg poached on top of a nice cut of toasted  sourdough bread with a thick side of bacon. For the price I found the portions to be generous.,4.0
"Cafe Madeleine is a quaint little cafe in the middle of the islander district of Brooklyn. The ambience is very hipsterish with a blackboard lots of different smoothie options and the kitchen right behind the counter. They even have a dish called the hipster bowl. For lunch we ordered the Custard egg with smoked salmon and capers, and also the pressed prosciutto di parma sandwich. Everyone shared and the food was delicious. The salmon is smoked perfectly. Not too strong and not too subtle with a scrambled egg, capers, a large piece of toast and scallions. The combination is delicious  and the toast compliments the baked salmon and egg so well. The sandwich was good not great. The sandwich is served on sourdough with red peppers, spinach, mozarella and prosciutto. The sandwich was a little bland but fresh and filling. I really enjoyed the atmosphere and the quality of food. I will definitely be back if I ever visit Brooklyn again. Wonderful stuff.Peace!",5.0
"Great food, but be prepared to wait. Usually 20+ minutes for one sandwich.  They've gotten better over the last year...I'll give them that. My issue is with the simple things. I'd say about half the times I go in for just a regular ice coffee on the weekend, my order gets lost in all their confusion. I wait for ten minutes and then the barista will ask, ""What are you waiting for?""  I've always paid, but if you want free coffee: go here on the weekend between 10am-3pm, stand for about ten minutes near the cold drinks, and wait for the barista to ask what you're waiting for.  You'll get it. They don't keep track of their orders.",2.0
used my trusty yelp app to find me some good coffee here in Brooklynup comes MadelinesI park near where I believe this place to be...I look aroundI see no Madelinesno Im not going to give up I want my coffeeI see a little place called coffeeeeeeeyes this seems to be Madelines as the number in tile in front is 1603I go on in yes this is clearly a coffee shopthere are mismatched tables all around it looks very friendly and invitinga see pretty pastries in the glass caseI choose a macchiato and a powdered custard donutthis was a very lovely experience my donut was really good the custard inside really goodmy coffee deep and strongthe guy working the counter friendly and niceAND free wifi with a tiny clue this is in fact madeline in the wifi passgo have a cup,5.0
"Food is delicious, people very friendly. But the smell is still really bad. Always smell like fried eggs after spending 30 min there. And it takes FOREVER to get the food. Min. wait time is 15-20 min for one sandwich to go.",3.0
"What a cute small cafe!  Came here around 8 with a friend, and ordered a chai and a smoke salmon sandwich.  The meals are a bit pricey, but will fill you up if you're craving ""a bite.""  The chai = 100% delish.  My only pet peeve last time I visited was that they were cleaning the cafe an hour before it was closing - not cool eating while sniffing that good ol' ammonia.  Still, a nice study place or sit down cafe with friends.",3.0
"* Please instate a no laptop policy during Sat and Sun brunch hours. Your place was slammed and a bunch of kids with empty cups were taking up the good tables.* Figure out how to ventilate the back room. You can literally see the smoke back there and my clothes smell like grease.* Update your menu online. I looked at menupages.com and the menu was totally different. I tried to prepare while waiting in line but ended up having to choose something I did not necessarily want because the cashier had no idea what I was talking about and I had the pressure of dozens of people waiting now behind me to decide.* Just make the menus more visible, like on the front window. You have it at the counter which is not helpful.* Use a number-stand system and stop yelling names into each room and outside.* Food was good! Your place is almost perfect.",3.0
"I'm not crazy about Cafe Madeline. + very poor ventilation+ snobby patrons - hipsters/ stroller moms who shove their strollers with no regard for other people without saying excuse me or sorry or anything.+ cramped space to order & sit+ staff is either friendly or looks super annoyed --------------------------------------------------------------+ they continuously mess up my orders (i mainly order their salads or sandwiches)+ anything with chicken - be prepared for the thinnest slice of chicken ever. + the food takes FOREVER once the order is placed. I'm not trying to wait 45 minutes for a salad. -------------------------------------------------------------+ they've forgotten/lost my order 3x that i've patronized this establishment, and never apologized nor offered anything to me for the time i had to waste for them to correct their mistake. ------------------------------------------------------------+ their mint lemonade is good, can't comment on coffee drinks since i don't drink coffee. + pricey",2.0
"I have to admit I love this place.  The food is top notch, and the staff are incredibly efficient and kind.  I'm assuming he's the owner, but dude in the flip flops IN THE KITCHEN AREA cracks me up.  I don't mind the open-toed situation, but I'm always thinking it's probably not the best attire for the kitchen; hot food/liquids don't seem to exist in harmony.  Anyhoo, my only gripe is with SOME of the folks who frequent the joint: GET YOUR SORRY ASSES UP AND ALLOW OTHERS TO SIT AND PATRONIZE THE BUSINESS.  I've been often enough to see the same cast of characters hogging tables for hours on end without care to those who might want to sit and experience the place, or the business' need to welcome those spending.  As a matter of fact, I've actually found myself just leaving without ordering anything because Bohemian Bobby & Betty laid claim to several tables hours ago. Again, GET YOUR SORRY ASSES UP AND ALLOW OTHERS TO SIT AND PATRONIZE THE BUSINESS!!!",4.0
"I go to Cafe Madeline when I want to occasionally splurge on breakfast or lunch I don't feel like making. I enjoy the brioche french toast and the roast beef sandwich, and I can usually endure the wait for them.Today, I ordered a simple stuffed bagel with bacon, which shouldn't take long to make. I understand that it's a very busy day with tons of orders. However, it's quite problematic when a simple order like a bagel with bacon takes over a half hour to prepare. I told the cashier that it's unacceptable to be waiting a half hour, and the only response was ""Thank you."" I would have been okay with a simple apology for the wait.",2.0
One of my favorite places on Ditmas Park. Charming and very laid back. Friendly baristas. Enjoyed their cappuccino and fresh OJ. I've gotten the full breakfast before and recently the Madeline poached eggs. One egg poached on top of a nice cut of toasted  sourdough bread with a thick side of bacon. For the price I found the portions to be generous.,4.0
"Cafe Madeleine is a quaint little cafe in the middle of the islander district of Brooklyn. The ambience is very hipsterish with a blackboard lots of different smoothie options and the kitchen right behind the counter. They even have a dish called the hipster bowl. For lunch we ordered the Custard egg with smoked salmon and capers, and also the pressed prosciutto di parma sandwich. Everyone shared and the food was delicious. The salmon is smoked perfectly. Not too strong and not too subtle with a scrambled egg, capers, a large piece of toast and scallions. The combination is delicious  and the toast compliments the baked salmon and egg so well. The sandwich was good not great. The sandwich is served on sourdough with red peppers, spinach, mozarella and prosciutto. The sandwich was a little bland but fresh and filling. I really enjoyed the atmosphere and the quality of food. I will definitely be back if I ever visit Brooklyn again. Wonderful stuff.Peace!",5.0
"Great food, but be prepared to wait. Usually 20+ minutes for one sandwich.  They've gotten better over the last year...I'll give them that. My issue is with the simple things. I'd say about half the times I go in for just a regular ice coffee on the weekend, my order gets lost in all their confusion. I wait for ten minutes and then the barista will ask, ""What are you waiting for?""  I've always paid, but if you want free coffee: go here on the weekend between 10am-3pm, stand for about ten minutes near the cold drinks, and wait for the barista to ask what you're waiting for.  You'll get it. They don't keep track of their orders.",2.0
used my trusty yelp app to find me some good coffee here in Brooklynup comes MadelinesI park near where I believe this place to be...I look aroundI see no Madelinesno Im not going to give up I want my coffeeI see a little place called coffeeeeeeeyes this seems to be Madelines as the number in tile in front is 1603I go on in yes this is clearly a coffee shopthere are mismatched tables all around it looks very friendly and invitinga see pretty pastries in the glass caseI choose a macchiato and a powdered custard donutthis was a very lovely experience my donut was really good the custard inside really goodmy coffee deep and strongthe guy working the counter friendly and niceAND free wifi with a tiny clue this is in fact madeline in the wifi passgo have a cup,5.0
"Food is delicious, people very friendly. But the smell is still really bad. Always smell like fried eggs after spending 30 min there. And it takes FOREVER to get the food. Min. wait time is 15-20 min for one sandwich to go.",3.0
"What a cute small cafe!  Came here around 8 with a friend, and ordered a chai and a smoke salmon sandwich.  The meals are a bit pricey, but will fill you up if you're craving ""a bite.""  The chai = 100% delish.  My only pet peeve last time I visited was that they were cleaning the cafe an hour before it was closing - not cool eating while sniffing that good ol' ammonia.  Still, a nice study place or sit down cafe with friends.",3.0
"* Please instate a no laptop policy during Sat and Sun brunch hours. Your place was slammed and a bunch of kids with empty cups were taking up the good tables.* Figure out how to ventilate the back room. You can literally see the smoke back there and my clothes smell like grease.* Update your menu online. I looked at menupages.com and the menu was totally different. I tried to prepare while waiting in line but ended up having to choose something I did not necessarily want because the cashier had no idea what I was talking about and I had the pressure of dozens of people waiting now behind me to decide.* Just make the menus more visible, like on the front window. You have it at the counter which is not helpful.* Use a number-stand system and stop yelling names into each room and outside.* Food was good! Your place is almost perfect.",3.0
"I'm not crazy about Cafe Madeline. + very poor ventilation+ snobby patrons - hipsters/ stroller moms who shove their strollers with no regard for other people without saying excuse me or sorry or anything.+ cramped space to order & sit+ staff is either friendly or looks super annoyed --------------------------------------------------------------+ they continuously mess up my orders (i mainly order their salads or sandwiches)+ anything with chicken - be prepared for the thinnest slice of chicken ever. + the food takes FOREVER once the order is placed. I'm not trying to wait 45 minutes for a salad. -------------------------------------------------------------+ they've forgotten/lost my order 3x that i've patronized this establishment, and never apologized nor offered anything to me for the time i had to waste for them to correct their mistake. ------------------------------------------------------------+ their mint lemonade is good, can't comment on coffee drinks since i don't drink coffee. + pricey",2.0
"I have to admit I love this place.  The food is top notch, and the staff are incredibly efficient and kind.  I'm assuming he's the owner, but dude in the flip flops IN THE KITCHEN AREA cracks me up.  I don't mind the open-toed situation, but I'm always thinking it's probably not the best attire for the kitchen; hot food/liquids don't seem to exist in harmony.  Anyhoo, my only gripe is with SOME of the folks who frequent the joint: GET YOUR SORRY ASSES UP AND ALLOW OTHERS TO SIT AND PATRONIZE THE BUSINESS.  I've been often enough to see the same cast of characters hogging tables for hours on end without care to those who might want to sit and experience the place, or the business' need to welcome those spending.  As a matter of fact, I've actually found myself just leaving without ordering anything because Bohemian Bobby & Betty laid claim to several tables hours ago. Again, GET YOUR SORRY ASSES UP AND ALLOW OTHERS TO SIT AND PATRONIZE THE BUSINESS!!!",4.0
"This is a sweet neighborhood coffee shop with a fun grilled cheese menu and all the baked goods you would expect. Including donuts from Dough, which are delicious. There are plenty of tables, all of them small, so it's good for studying. And there are outlets as well for convenience. One thing though, is that the ventilation is not tremendous, so the place smells strongly of bacon any time they make some. That can be good or bad depending on your taste.",4.0
"I wish I lived in Brooklyn because I'd come here every weekend!  They had such a wide variety on their brunch menu and very decent prices! After a lot of going back and forth, I went for it and chose their poached eggs!  They come on sourdough bread, and with roasted baby tomatoes.  I also opted to put some ham on there.  Very delicious, although the bread was a bit hard to cut through.  Friendly service, pretty quick considering the huge crowd there on a Saturday around brunchtime, and great quality food.  I'll be back the next time I'm in Brooklyn!",5.0
Fresh and healthy! Perfect for a breakfast/brunch. You can even sit outside - there's a large table. Fresh orange juice ++,5.0
"One of my newly discovered favorite spots on Cortelyou. I am a frequent The Farm connoisseur and recently decided to give Cafe Madeline a try. I was so pleasantly surprised. This is a very hip place with SO MANY options for breakfast. I've been twice and about to go again. They serve breakfast all day and close at 8pm. Last time I ordered their biscuit breakfast with bacon, my bf ordered the biscuit with avocado. Both were absolutely delicious. My biscuit was the perfect amount of sweet and light. The second time I got the Cauliflower and Egg breakfast. Loved everything about it, the eggs were over easy and nicely done, the cauliflower was deliciously cooked and the toast with butter and also delicious. Coffee is good too. They have many kinds including cold brew, many kinds of teas and smoothies and a good choice of cold drinks. Definitely recommend going there!",5.0
"Great, friendly community cafe. Good food. Crazy selection of drinks. Could do with ventilation at the back (I would get rid of/move the fridges from the prime area and open it right up at the front) but relaxed enough that you can still get work done if that's why you came - which is a rarity. Big shout to Grant for making a Londoner feel at home in Brooklyn. Will be back!",5.0
"My favorite place in my neighborhood! They know me by name, I go there so much. Best egg and biscuit sandwiches ever",5.0
"I am giving this place one star because it has really poor ventilation. The air is suffocating and filled with the smell of toast, gas, and smoke from cooking. It is very unhealthy. I came here to get work done and was very disappointed with the air. I felt like I was poisoning my lungs. The food is decent and the coffee is good. But they really need to do something with the air. It isn't a cozy comfortable place either. Very cramped.",1.0
"Boy has Cafe Madeline been transformed by Adell, the new owner and Paige, the very capable and friendly General Manager. The food is excellent and the prices very reasonable considering the quality. It is such a joy to have Cafe Madeline located so close to me. I can walk there even in the dead of winter! This is my all-time favorite coffeehouse, hangout space and food joynt. I can't wait until springtime when they are opening up a full-service restaurant right across the street. Yes, it does get crowded, but everyone is patient and understanding.You can order using the square order app which helps with the line.All in all a great Brooklyn experience.",5.0
"This place is great--amazing (although very pricey) food, lovely baristas, and you can stay for ages. I wrote my doctoral exams here. Open early and late. Cons: it's dark, they are constantly (but constantly) playing a Red Hot Chili Peppers album all the way through, and once when I left a library book on a table for half an hour (without leaving the cafe!), they treated it as lost property and let someone else ""borrow"" it.Definitely go. Great smoothies and you eventually get your books back.",4.0
"After a recent shift in my diet, I mostly eat eggs for breakfast.  And not the egg-white omlettes I used to eat, but real pasture raised eggs with orange yolks.  It's not easy finding such eggs in San Francisco, but being a visitor to NYC it's almost impossible.  So I was extremely glad to find Cafe Madeline.  I've been twice, and both times I got the poached eggs, which is a poached egg on sourdough with cheese and cherry tomatoes.  You can add extra eggs for a dollar; both times I added two, which fills the bread (highly recommended).  I rounded out my meals with a pink Harmless Havest coco water, one of the best coco waters on the market, and a hot chocolate (with organic milk, naturally).  In addition to having delicious food, the atmosphere is also very welcoming.  Many of the tables are occupied by people with laptops using the excellent wifi, and the staff is friendly and attentive.  The meal wasn't cheap, but $16 for an amazing breakfast is entirely worth it.Definitely my favorite breakfast place in all NYC so far.",5.0
"This is a sweet neighborhood coffee shop with a fun grilled cheese menu and all the baked goods you would expect. Including donuts from Dough, which are delicious. There are plenty of tables, all of them small, so it's good for studying. And there are outlets as well for convenience. One thing though, is that the ventilation is not tremendous, so the place smells strongly of bacon any time they make some. That can be good or bad depending on your taste.",4.0
"I wish I lived in Brooklyn because I'd come here every weekend!  They had such a wide variety on their brunch menu and very decent prices! After a lot of going back and forth, I went for it and chose their poached eggs!  They come on sourdough bread, and with roasted baby tomatoes.  I also opted to put some ham on there.  Very delicious, although the bread was a bit hard to cut through.  Friendly service, pretty quick considering the huge crowd there on a Saturday around brunchtime, and great quality food.  I'll be back the next time I'm in Brooklyn!",5.0
Fresh and healthy! Perfect for a breakfast/brunch. You can even sit outside - there's a large table. Fresh orange juice ++,5.0
"One of my newly discovered favorite spots on Cortelyou. I am a frequent The Farm connoisseur and recently decided to give Cafe Madeline a try. I was so pleasantly surprised. This is a very hip place with SO MANY options for breakfast. I've been twice and about to go again. They serve breakfast all day and close at 8pm. Last time I ordered their biscuit breakfast with bacon, my bf ordered the biscuit with avocado. Both were absolutely delicious. My biscuit was the perfect amount of sweet and light. The second time I got the Cauliflower and Egg breakfast. Loved everything about it, the eggs were over easy and nicely done, the cauliflower was deliciously cooked and the toast with butter and also delicious. Coffee is good too. They have many kinds including cold brew, many kinds of teas and smoothies and a good choice of cold drinks. Definitely recommend going there!",5.0
"Great, friendly community cafe. Good food. Crazy selection of drinks. Could do with ventilation at the back (I would get rid of/move the fridges from the prime area and open it right up at the front) but relaxed enough that you can still get work done if that's why you came - which is a rarity. Big shout to Grant for making a Londoner feel at home in Brooklyn. Will be back!",5.0
"My favorite place in my neighborhood! They know me by name, I go there so much. Best egg and biscuit sandwiches ever",5.0
