"Great cafe, close to where I was staying in Brooklyn. My party frequented this place like three or four times during our stay visiting family and it was delicious every time. The brunch menu is really varied and interesting. I saw savory oats, which I thought was a neat idea. I ended up trying the Mexican Brekkie Bowl, which was quinoa, chorizo, avocado, and a perfectly cooked egg on top. It was perfect and the best choice for a super long day of walking. I also tried the cardamon latte. It was great as well. My sister got the hot chocolate there and couldn't stop raving about it.The location is a little tight in the front but there is lots of seating in the back. It gets pretty crowded but the line moves quickly.",5.0
"Probably the best café in the neighborhood. And it's where I used to buy my coffee beans. I will upgrade this to five stars AS SOON AS THEY START SELLING STUMPTOWN BEANS AGAIN!Yeah, I've heard it from all the people behind the counter: ""We like the Toby's Estate coffee better. You really have to try it."" Well, I've tried about four varieties now, some of them a couple  of times, including the single East African bean they ever seem to have, and I have not made a cup of coffee that was better than drinkable. They offer another brand, also, but at something like $22 for 12 ounces, I'm not falling for it.And yeah, everyone, you have every right to lambast me for coming from such a place of entitlement and wasting your time with my 1st world problems. I might as well carve GENTRIFIER into my forehead. But look: we're all here reading and writing Yelp reviews for a fancy coffee shop in Brooklyn--so what are the choices?Anyway. I've been walking many blocks down the street to Market for Stumptown's Ethiopian beans, which are in a completely different category.Now some positive stuff, in the interests of fairness. The pastries are excellent. And they do a respectable job with their espresso drinks. Sometimes they're good, other times very good.  I can't comment on the savory dishes.It's is a great place to work away from home, with good wi-fi and enough outlets for everyone (if you don't mind crawling under your neighbor's table to look for one). When my girlfriend and I are both working from home and she kicks me out of the apartment, I come here, and pay rent on my table with pastry, cappuccino, macchiato, and a stream of espressos. It gets a little crowded, and the back-room ambience is a bit challenged (in a basement-cock-fighting-parlor sort of way), but it's a fine place to caffeinate and work.",3.0
"This has become my go-to cafe in the area.  I've been going here for about a year now.  They take cards which is great for a person like me who never carries cash.  It's also why I lean towards going here for a bite instead of Qathra or Milk & Honey who are cash only.Expressos are pretty good.  They carry soy, almond and coconut milk.  The Almond Butter Latte has replaced my morning Starbucks run. They use Justin's almond butter and it tastes so good!  I just did the Whole30 program and this latte is pretty compliant.  They have other unique lattes including hazelnut, cardamom, even an oatmeal latte.  The french butter latte for those who want bulletproof coffee.Food wise, my go to is the Avocado & Egg on a cheddar chive biscuit.  It's just...delicious.  Perfectly filling breakfast sandwich.  The place can get packed, especially on the weekends.  But for a freelancer like me, it can be a good place to get work done when I zone out with my headphones.  I've seen a lot of folks have quick coffee meetings there too.  There are plenty of outlets in the back and free wifi.  Service is friendly. They'll bring your food to you if you're eating in.  They have a 8 person square table out in front if you want to sit outside.",4.0
"Cute cafe to grab a quick bite while finishing work on your laptop! Everything about this place is so cozy and welcoming. The indoor seating is pretty large, extending to the back room. So you'll never wait super long for a table. I ordered a cold matcha drink and it was alright, nothing out of the ordinary. I stayed there for probably around three hours finishing up some homework and no one told me off for overstaying my visit, so that's a plus!  I love how extensive the food AND drink menu is, and I plan on returning to try out more food and drink options!",4.0
"Such a disappointment. I stopped in here on my way to work hoping to be pleased because of all the great yelp reviews and I was sorely disappointed. I got the whitefish bagel with cucumbers and spinach. This sandwich was like $8 and the amount of whitefish was straight disrespectful (check out my pics). The dressing they added to the sandwich was delicious so the flavoring was on point, but it's a whitefish sandwich and I literally had a tablespoon of whitefish on the bagel. If that's the serving size, don't charge $8. Or if you are running out of whitefish let me know so I can order something else.I also got a coffee, it was good but overshadowed by my whitefish bagel experience.",1.0
I've been hearing about Cafe Madeline for a while from friends who live in the neighborhood. They told us that they serve great food and Stumptown coffee so I was very excited! Upon walking in I noticed that it was very busy.... With laptop users. Ugh those darn laptop users ruin everything! But we looked at the huge menu and orders a Ginger Twist tea and a Soy Matcha Latte. They were both big sizes and tasted great. Just wish the matcha had more.... Matcha flavor? I worked with Matcha before it should taste like matcha! This was more diluted but I finished it because it wasn't awful. The staff was fast and friendly. Now the food was fantastic! Cheddar Clive biscuit egg sandwich which was the bomb. And I got the Crispy Eggs with brioche. It came with cubed avocado. It was perfect! On the way out I got a fresh OJ and a Belgium waffle! So so good. Paid about $30 for everything. Not bad for how good everything was.I just knocked one star down because switching coffee suppliers all the time isn't good! They now have Toby's Estate and Parlor. No more Stumptown! You have to keep a consistent! Get one thing and stick to it!  I'll be back to Cafe Madeline!,4.0
"Love this place. I come here to work some days even though I live in Prospect Heights. Food is amazing with a huge selection, and lots of fun albeit diabetes-inducing lattes to choose from (Nutella latte, s'mores latte, almond butter latte, lavender latte, etc.). Food-wise I have ordered the cheddar chive biscuit bowl and the spicy potatoes and eggs bowl. Both amazing. Will be back (many times).",5.0
"I go here sometimes as I go to Brooklyn College a few blocks away. The food is good. The coffee is great. The only complaint I have is the ventilation. The kitchen is always smoking up bacon or chicken and it feels like your basking in oil if U sit in the area across from the counter. I usually sit in the back room. A lot of people do work here because it is quite and nice atmosphere. I've enjoyed the lox bagel, eggs but did not enjoy the eggs Benedict on a biscuit as I expected an English muffin and don't enjoy biscuits.",4.0
"I always come here for breakfast/lunch. Their coffee is really good, food is also really good. The only downfall is that it gets soo packed with so many people & it's so narrow by the seating area to where customers stand in line :(. Also, their kitchen is open so you leave the place smelling like a kitchen lol, but other than those cons, it's really delicious here :)",4.0
"This cafe makes my neighborhood a better place. seriously. its such a cozy gathering place. the food is always amazing and they often add new delicious stuff to the menu.  When the weather is nice, i like sitting at the big table outside and watch people walk by as i sip on my coffee. oh and they always have amazing flavor of coffees. they also have wide selection of really delicious smoothies. my two complaints would be; the price and the indoor seating. yes maybe good food comes pricey ? not sure but it is expensive. also, i can never sit inside. because the kitchen is also behind the counter, it gets stuffy inside and there is not enough air circulation,",3.0
"I was in the mood for a latte and something sweet so I searched for a nearby cafe on the yelp app.  I saw cafe Madeline appeared and it's in my neighborhood so I walked there.  Courtelyou road is very hip place now for dinning, a clean working class type of hip not Williamsburg hipster hip. I like the area so I wanted to check it out.  I got there noonish and it's packed! They got a grill behind the counter and people are cooking! The counter is full of desserts and they all look really good & fresh.  The lady at counter was super friendly and smiled which is not expected from baristas.  Sorry most baristas I encounter have stank attitudes but the service here is customer orientated.  I appreciate good customer service! They made me a latte and heated up the apple turnover for me.  This apple turnover I had was really good! It had a crispy butter crust with an apple pie filling.  Incredible taste.  Also they use stumptowm beans.  As of recently I've noticed that their beans are really good and makes a difference.  The latte was bold with a nice creaminess.  This place is good and has a great vibe.  I'm going back again!",5.0
"This spot is a gem. So many healthy options (New Year's Resolutions what up?!) and delicious coffee and treats. It's by no means inexpensive in comparison to the rest of the ""coffee shops"" in the vicinity but worth every penny. They're Brekkie bowls are bomb. Their plated presentation is on point.  They're always pretty busy so when I drop in for a smoothie I wish it'd come a little bit quicker. But that's probably just a personal problem. Oh. And they have tons of options. From the Brekkie bowls - all come with quinoa, soft-boiled egg, sautéed greens and choice of protein - to their egg sandwiches, grilled-cheese sandwich varieties to salads!!! There is definitely something here for everyone. Cheers!",4.0
"Amazing coffee, great selection and the eggs and greens are so good that your subconscious will replay the meal in your dreams tonight!",5.0
"My namesake cafe that I adore. I'm convinced that it was conducive to my passing my NCLEX exam on the first try. In any case-- super comfortable and the ambience is really inviting. One of the first cafes to pop up in the neighborhood and it's been a staple since. My go to drink is surprisingly not coffee, even though they carry Stumptown. I love the lavender mint tea as it just lightly opens up my nostrils and relaxes me as well. The cheddar chive scone in BOMB. I mean, just... Yes. Also, the bacon, eggs and sourdough with butter and jam is TO DIE FOR. And their cheese quiche is just... Overload. Absolutely delicious. I've apparently been here way too much to count and have just gotten around to writing this review. People, if you're in the area, come and enjoy this lovely little cafe. Disappointment is not possible. As always... Happy Eating. -Marie-Madeleine.",5.0
"Fantastic place for some interesting brunch dishesThey have quite a large menu of sandwiches, bagels, oatmeal, and breakfast bowels- and they are all interesting fresh flavored and combinations We ordered a bacon, maple oatmealA croissant with prosciutto, avocado, egg And my absolute fave grilled goat cheese with apple and fig jam- must tryThe place gets super busy and though there is a lot of seating, it's difficult to find a seat and all the tables are really close to each other. I feel like a sardine there.There is no wait service there and it's packed with hipsters.The place is clean and workers as friendly",5.0
"The slowest service you will find in Brooklyn. Every time I go for a sandwich it somehow takes them 30 minutes to make it. I ordered two sandwiches to go. The sandwiches had four ingredients: chicken, avocado, lettuce, and tahini dressing. Should that really take longer than 10, 15 minutes? There wasn't a line or many people in there. I walked home to eat and there was barely any chicken in the sandwich. Such a letdown. Spend your $20 elsewhere.",1.0
"I liked the coffee here, and occasionally grab something to eat on the run. The high octane Red Eye Brew tastes wonderful and gets you going. The mini quiche they have is pretty awesome, savory and nice flakey pastry crust. The service has been so so.. Depending on who helps you. Some help, I've felt, as if I've inconvenienced them by ordering.. I'd agree with other posters as well, it's a bit pricey.",4.0
"The food here is amazing, but a tiny bit overpriced. I love the big communal outdoor table when there isn't some guy with a dirty laptop taking up half of it, smoking a cigarette. I also am not into this place when it's a stroller wonderland, but off hours in the evenings or late afternoon on weekends it is great. The pastries are incredible and I live for those cheddar chive biscuits.",4.0
"This was our first visit. We went for Sunday brunch. The place is small/narrow and chaotic. As a first timer, it was not so clear where to go for what. Turns out that you order/grab a table first. The seating is first come first served, self service and apparently cutthroat. We ordered the Madeline Breakfast and Grilled Cheese Omelet. While the plates get served to you (after a bit of a wait), the drinks do not. You have to listen for the drinks getting called and grab your own when called. On to the seating... As mentioned before the place is small/narrow so the seating is super cramped. Each chair was touching the back of the chair behind it. I couldn't get up or down without inconveniencing the lady behind me, and vice versa. While seated, I also had the pleasure of getting my foot rolled over by a stroller or two. We received the food and drinks and pure delight. The food was really fresh and delicious. It was for the best because we needed the food to be good to make the experience worth it all. Like really good. Oh and here's a tip - if you think you'll want a cup of water with/after your meal, order it when you order your meal/drinks. If you don't then you'll be added to the end of the current drink queue and may end up waiting 20 or so minutes for an uniced cup of tap. They do have a fridge with bottled water so buying one of them probably would have been faster. Anywho, long story short, the food is really good and there's a lot to choose from, so we'll probably go back to try other things that we were interested in. Though, next time, maybe we'll order for take out instead of enduring their chaotic space.",3.0
"Cafe Madeline is a sweet little getaway that's great for everyone; couples, singles, families, and freelancers. The division of the restaurant into two spaces works really well. Those who are only here to eat can sit up front, and others who want to work and eat, or work and sip coffee usually go to the back. The space in the back is good for groups. Today, I decided to have the eggs and cauliflower. At $7.95 USD it's a good deal. The dish comes with two eggs any style; cauliflower with red onions; and toast with salted butter and jam on the side.I almost left because I thought the AC wasn't working -- it was humid out -- but it kicked in after a while. It's pretty quiet on weekday mornings. However, I've been here on the weekend and it can get loud and crowded. However, the food is always expedited pretty fast. The crew is really sweet and courteous.",4.0
"I was in the mood for a latte and something sweet so I searched for a nearby cafe on the yelp app.  I saw cafe Madeline appeared and it's in my neighborhood so I walked there.  Courtelyou road is very hip place now for dinning, a clean working class type of hip not Williamsburg hipster hip. I like the area so I wanted to check it out.  I got there noonish and it's packed! They got a grill behind the counter and people are cooking! The counter is full of desserts and they all look really good & fresh.  The lady at counter was super friendly and smiled which is not expected from baristas.  Sorry most baristas I encounter have stank attitudes but the service here is customer orientated.  I appreciate good customer service! They made me a latte and heated up the apple turnover for me.  This apple turnover I had was really good! It had a crispy butter crust with an apple pie filling.  Incredible taste.  Also they use stumptowm beans.  As of recently I've noticed that their beans are really good and makes a difference.  The latte was bold with a nice creaminess.  This place is good and has a great vibe.  I'm going back again!",5.0
"This spot is a gem. So many healthy options (New Year's Resolutions what up?!) and delicious coffee and treats. It's by no means inexpensive in comparison to the rest of the ""coffee shops"" in the vicinity but worth every penny. They're Brekkie bowls are bomb. Their plated presentation is on point.  They're always pretty busy so when I drop in for a smoothie I wish it'd come a little bit quicker. But that's probably just a personal problem. Oh. And they have tons of options. From the Brekkie bowls - all come with quinoa, soft-boiled egg, sautéed greens and choice of protein - to their egg sandwiches, grilled-cheese sandwich varieties to salads!!! There is definitely something here for everyone. Cheers!",4.0
"Amazing coffee, great selection and the eggs and greens are so good that your subconscious will replay the meal in your dreams tonight!",5.0
"My namesake cafe that I adore. I'm convinced that it was conducive to my passing my NCLEX exam on the first try. In any case-- super comfortable and the ambience is really inviting. One of the first cafes to pop up in the neighborhood and it's been a staple since. My go to drink is surprisingly not coffee, even though they carry Stumptown. I love the lavender mint tea as it just lightly opens up my nostrils and relaxes me as well. The cheddar chive scone in BOMB. I mean, just... Yes. Also, the bacon, eggs and sourdough with butter and jam is TO DIE FOR. And their cheese quiche is just... Overload. Absolutely delicious. I've apparently been here way too much to count and have just gotten around to writing this review. People, if you're in the area, come and enjoy this lovely little cafe. Disappointment is not possible. As always... Happy Eating. -Marie-Madeleine.",5.0
"Fantastic place for some interesting brunch dishesThey have quite a large menu of sandwiches, bagels, oatmeal, and breakfast bowels- and they are all interesting fresh flavored and combinations We ordered a bacon, maple oatmealA croissant with prosciutto, avocado, egg And my absolute fave grilled goat cheese with apple and fig jam- must tryThe place gets super busy and though there is a lot of seating, it's difficult to find a seat and all the tables are really close to each other. I feel like a sardine there.There is no wait service there and it's packed with hipsters.The place is clean and workers as friendly",5.0
"The slowest service you will find in Brooklyn. Every time I go for a sandwich it somehow takes them 30 minutes to make it. I ordered two sandwiches to go. The sandwiches had four ingredients: chicken, avocado, lettuce, and tahini dressing. Should that really take longer than 10, 15 minutes? There wasn't a line or many people in there. I walked home to eat and there was barely any chicken in the sandwich. Such a letdown. Spend your $20 elsewhere.",1.0
"I liked the coffee here, and occasionally grab something to eat on the run. The high octane Red Eye Brew tastes wonderful and gets you going. The mini quiche they have is pretty awesome, savory and nice flakey pastry crust. The service has been so so.. Depending on who helps you. Some help, I've felt, as if I've inconvenienced them by ordering.. I'd agree with other posters as well, it's a bit pricey.",4.0
"The food here is amazing, but a tiny bit overpriced. I love the big communal outdoor table when there isn't some guy with a dirty laptop taking up half of it, smoking a cigarette. I also am not into this place when it's a stroller wonderland, but off hours in the evenings or late afternoon on weekends it is great. The pastries are incredible and I live for those cheddar chive biscuits.",4.0
"This was our first visit. We went for Sunday brunch. The place is small/narrow and chaotic. As a first timer, it was not so clear where to go for what. Turns out that you order/grab a table first. The seating is first come first served, self service and apparently cutthroat. We ordered the Madeline Breakfast and Grilled Cheese Omelet. While the plates get served to you (after a bit of a wait), the drinks do not. You have to listen for the drinks getting called and grab your own when called. On to the seating... As mentioned before the place is small/narrow so the seating is super cramped. Each chair was touching the back of the chair behind it. I couldn't get up or down without inconveniencing the lady behind me, and vice versa. While seated, I also had the pleasure of getting my foot rolled over by a stroller or two. We received the food and drinks and pure delight. The food was really fresh and delicious. It was for the best because we needed the food to be good to make the experience worth it all. Like really good. Oh and here's a tip - if you think you'll want a cup of water with/after your meal, order it when you order your meal/drinks. If you don't then you'll be added to the end of the current drink queue and may end up waiting 20 or so minutes for an uniced cup of tap. They do have a fridge with bottled water so buying one of them probably would have been faster. Anywho, long story short, the food is really good and there's a lot to choose from, so we'll probably go back to try other things that we were interested in. Though, next time, maybe we'll order for take out instead of enduring their chaotic space.",3.0
"Cafe Madeline is a sweet little getaway that's great for everyone; couples, singles, families, and freelancers. The division of the restaurant into two spaces works really well. Those who are only here to eat can sit up front, and others who want to work and eat, or work and sip coffee usually go to the back. The space in the back is good for groups. Today, I decided to have the eggs and cauliflower. At $7.95 USD it's a good deal. The dish comes with two eggs any style; cauliflower with red onions; and toast with salted butter and jam on the side.I almost left because I thought the AC wasn't working -- it was humid out -- but it kicked in after a while. It's pretty quiet on weekday mornings. However, I've been here on the weekend and it can get loud and crowded. However, the food is always expedited pretty fast. The crew is really sweet and courteous.",4.0
"Lovely little coffee shop, but can get crazy busy. Came here on a Saturday at like 9:30am and it wasn't so bad, but after a couple of hours it was pretty nuts. And only one bathroom. I had the biscuit sandwich for breakfast. The biscuit was about what you'd expect from any place above the Mason-Dixon line (read: not awful, but not up to par with Southern biscuits) but the sammich overall was tasty. The coffee here comes in those wide cups, which, unless you drink coffee like I drink beer at happy hour, the wide cups causes the coffee to cool too quickly. Hate to hate on the environment, but I would order the to-go cups regardless of whether I'm staying in or not.There is a front room and a back room. Overall, pretty spacious. The earlier you get here, the more likely you'll find a seat, probably.",4.0
"It was our final day in New York and we still had not tried a breakfast place. Of course we had bagels but craved more at this point. Since our flight was in about 3 hours we had to go somewhere close in Brooklyn, since we had stayed in Brooklyn. You yelpers helped make this decision and you guys were spot on. This place was hip, alive and energizing, the line was almost out the door but service was quick. The food was fresh and innovative, I had the buttermilk biscuit but they ran out of biscuits and substituted with a croissant which was not a problem at all, in fact I think it was better this way. My partner had the chicken and bacon sandwich which was stuffed with greens and flavor, on top of that we had the freshly squeezed orange juice. If I am in New York again, I will come by.",5.0
"Ordered: Custard egg toast with prosciutto di parmaPros-- The food's presentation was perfection and all the ingredients were very fresh.Cons-- They have the layout set up where you order your food on line, they call out your name, you wave your hand (or something to that effect), and they bring over the food. The issue is that the cafe is so noisy where you can't properly hear your name and crowded to the point where they don't necessarily see you.",4.0
