"There is something so satisfying about finally going to a place that's been on your list and having it not disappoint (that was an awkward sentence but whatever).The food is pretty. damn. good. Yes, it hurts to pay $13 for 3 tacos but when there's basically a whole fried avocado between the three, it lessens the pain. And the rice - it looks like boring-ass Chipotle white rice but damnnnn. It tastes like butter rice and it is delish. The chips & salsa are a decent deal with 3 pretty good salsa variations. Didn't try the guac but I'm intrigued (grapes?! sounds like some crazy NYT recipe but who knows?)Margs are good (strawberry version is on point) but a little small for the price so don't count on ordering too many unless you got $$. But I can't even deduct a star here because I'm too full and satisfied to have any bad vibes about this place.",5.0
"I'm hoping this review will help Don Chingon improve. I walked into the restaurant on a Friday night with a friend to eat dinner. When I called 30 minutes earlier, they told me to come over, that a reservation was not necessary. When we got there we ended up waiting for about 20 minutes for a table. OK, not a big deal. However, when it was our turn to sit down, they mistakenly sat a couple that had just walked in. When we pointed this out, they had to awkwardly fix the situation. We ordered our food, including the chips and salsa, which is as delicious as others have mentioned. We then proceed to wait over one hour to get our food. Since I was catching up with my friend, I really did not mind. But the waiter came over, apologized and mentioned they were understaffed. So how was the food after the long wait? I did not think the chorizo quesadillas were that good. Why am I writing this review? Because I love it when restaurants in the neighborhood succeed. I'm hoping my experience was a rare one, though if it is not, I'm also hoping this review will help Don Chingo fix these issues before they become a problem.",2.0
"Checked this out before a game at Barclays last night.  Not a very big place, but that's not a factor when it comesto the food.I started with a house margarita and it was top of the line.  I liked that it was garnished with a dried chili pepper.  The bartender was extremely friendly and welcoming.  I ordered the carnitas and could see the kitchen preparing the food.  Some of the finest carnitas I have ever eaten.  Small side of rice and black beans accompanied the carnitas and the portion was perfect.The soft corn tortillas were perfectly heated on the grill, the pork was not dry and the added toppings brought out the flavor and did not overpower the pork.I'm considering finding an excuse to go to Barclays again so I can come back and try a quesadilla!!!",4.0
"I'm not sure if a restaurant can accurately be judged on a chorizo quesadilla lunch special, but if it can, I can find no fault with Don Chingon. I came, I sat in the window and looked at the weird modular tower growing behind the Barclays Center, I ate a deliciously greasy* chorizo quesadilla, I chatted with Jose, my very accommodating waiter, and I left. (Oh, I guess I paid $10 + tax and tip before I left too, cause I wouldn't want to be rude to Jose.)And I would do it again anytime. Hell, I'd do it right now, if I wasn't sitting at home in my underwear, too many long, cold blocks away from Don Chingon. You should do it though, if you're dressed.____________*Chorizo is greasy. It's part of what makes it delicious.",5.0
"We were heading to the Barclays center and wanted to do a quick happy hour before hand a bar/restaurant near by so I searched ""happy hour"" on Yelp like I usually do. I called the day before and was informed their happy hours runs from 4-7pm but when we got there at 6:05 we were denied any happy hour specials. The waiter said happy hour ended at 6 and I explained that I called and asked that specific question so he could have given us our margaritas for a discounted price but no. None the less, dinner was great. Our drinks were over priced for the amount of tequila we got but they were really tasty. I had the sweet and sour margarita which had smoked salt on the rim. The food was the reason this small little Mexican joint goes from 3 to 4 stars for me. We started with the chips and salsa trio which was a perfect appetizer to share while we sip on our drinks. Our favorite salsa was the tomatillo salsa for sure. Our two taco platters came out next; one carnitas and one pollo. I personally liked the chicken better but one thing for sure is the taco shells themselves were amazing! Not sure if they make their own or where they get them from but amazing corn soft tortillas. Both platters come with rice and beans and is a great bang for your buck. I finished everything, it was that good. We had two beers during dinner considering we didn't feel a think from our initial drinks. The waiter, probably being apologetic for the happy hour confusion brought out two shots of tequila on the house. The shots tasted a little weak too so maybe they water down their tequila or maybe my mouths were just confused by all the hot sauce I used. Really good place, especially for your money but next time we are coming before 6.",4.0
"I came in last night for dinner around 5:30. This morning, I woke up still satisfied. When I came in at 5:30, it was empty. It was just me, a waiter and a bartender (my friend hadn't arrived yet). A little awkward, but it makes for good service, right? The I put in an order for some appetizers to start, and it came out less than 5 minutes later. The waiter was friendly and attentive. At first, I thought it was just because he was bored and was eager to do something - but he was the same way throughout the whole meal, even when the dinner rush hit. The tables are pretty small, but they did a good job or clearing out our plates to make sure we had room for everything. In hindsight, we may have gotten a little too excited about the food. - Elote ($4 each): not the biggest, but they were tasty! It had a pretty even distribution of spices and cheese on the whole cob - Guac & Chips ($11): a pretty generous serving of chips and guacamole. The chips came out warm, which I appreciate. I ordered without really reading the description on the menu, so the pomegranate and sliced grapes were a nice surprise! - Steak Quesadilla ($15): pretty darn good. You get a hearty quesadilla, salsa, sour cream, guacamole, rice, and beans - all on one plate. I had the toughest time finishing everything",5.0
"We came in one night before the nets game to get some drinks and food. It was about 6:00 when we got in and we were immediately sat. It's a very small place but cozy and I just love a place with an open kitchen - which looked small too so I assume the wait for food on a busy night could get pretty long. Thankfully there weren't too many people in the place so we got our drinks and food out for game time. My boyfriend called the day before asking about their happy hour and he was told it ended at 7. However, we were informed that it ended at 6 when we tried to order the happy hour. So that was a little annoying. Anyways we ordered our drinks saying whatevs. The drinks were delicious! I had the strawberry and mint margarita and my boyfriend ordered the sweet and spicy margarita. Both were tasty and refreshing! BUT - if you're looking to get a little buzz from these drinks just order a couple of beers since they were light on the tequila and very pricy for the size and what little was in it. We started off with the trio of salas which were all packed with flavor. It was between the tomatillo and pineapple salas for my favorite I could have eaten them all night. But since I couldn't I ordered the carnitas tacos. I had been craving tacos all week and what a way to satisfy it! It was soft shell tortillas and I was relieved it wasn't a cheap flour tortilla. The corn tortillas add so much more flavor. I also loved the avocado salsa slathered on the tacos - creamy and spicy!! And the carnitas had some nice crispy pieces of chicharron in them which was a nice surprise. There are many taco options to choose from but I wish they had a sample option so you could try some out. I think our server felt bad about the happy hour thing so we were given 2 shots of the house tequila which was fine by me! All in all, cute place, good food and okay drinks, nice service. Next time I come back here I'm definitely getting a quesadilla. Those things looks AMAZING.",4.0
"My work team and I needed some time to kill before the start of the NY Islanders game over at the Barclays Center and I went on yelp to search nearby places and Don Chingon was a winner amongst my coworkers. I called ahead to make sure they will make a reservation for 6 at last minute and they did with no hesitation and immediately let us know that when we come in that to ask about their happy hour specials #WINNING.Don Chingon is a small cozy spot on the strip of the Flatbush Avenue, they have an open kitchen with the bar area being next to it, very personal and makes you feel comfortable, you know part of the DC family. My coworkers and I ordered a round of drinks, Elotes and their guacamole that comes with pomegranate, what a great touch and went well with the guac. I got their happy hour margarita that was garnish with a chili, another great touch by DC.The majority of us ordered different types of taco dishes; everything that we had was good. The rice was cooked to perfection, no sogginess and not too salty and the black beans were to die for. I especially enjoyed my carne asada tacos. We went at a perfect time, as soon as it was time to head to the game the place started getting packed. I will definitely go back if I'm in the area again.",4.0
"Delicious carnitas tacos! Homemade tortillas, perfectly cooked and seasoned pork, two kinds of salsa, pickled red onions, cilantro... only time I've had better is in Mexico. The rice was good, and the black beans were nice and creamy, but I barely touched any of it because the tacos were filling. Service was nice and I liked the overall feel of the space. Will definitely be back!",5.0
"Found this place on Yelp, and was shocked by how tiny it was when we arrived.The elote (corn) appetizer was really good. My friends had the guacamole, they said it was really good, and the pomegranate was a nice twist. They also had the spicy margaritas, and they all liked those as well.I had the steak quesadilla, and it was good. Not fantastic, but I would go back and have it again. Only on a not so busy night. The wait was a bit much for me, when the food wasn't mind blowing.",3.0
"I actually really liked the food here. However, my initial experience is what triggered my slightly lower rating. This place is very small, only a few tables. My boyfriend and I came in around 7 and our options were to sit at a communal table or at the very narrow table against the window. We tried the window seats but I was super uncomfortable so we moved to the communal table. Luckily, it was only us at the table. Their second downfall was their menu. There was hardly anything on it! Really cliche food - burritos, tacos, quesadillas. That's it. Where's the pollo con mole??? I was looking forward to getting a margarita because they were very small (so I figured not more than $7, but they were all at least $10). I stuck with water. As an appetizer we got the guacamole and chips ($11). This was definitely overpriced, but I have to say it was very good. The guac had pomegranate seeds and grapes in it, which I loved. I could tell it was fresh and we got a lot of guac. The chips were also good with a very decent portion. For dinner, I got the steak quesadilla ($13) Amazing! The steak was of high quality and overall it was just really good. It also came with rice and beans - also good. Our waiter was very attentive; he asked how we liked our food & made sure we always had water. Don't get me wrong, this is a good place for a taco, burrito or quesadilla! All I'm saying is they could update their menu...Variety is always good.",4.0
"From the second we walked in I knew I was going to love this place.The decor, to start with, is absolutely lovely with its dim lighting, rustic wood tables and graphic wallpaper.  Don Chingon kind of gives off a romantic feel - so it'd be perfect for a date night w/ the Hubs.  But it also has a really cool* vibe - so great for a night w/ the gals or a night w/ the guys too. There were plenty of tables open when we arrived on a Friday night so we were able to 'sit anywhere'.  They have 4 or 5 tables along one side, two hightop counters, a community table in the middle of the room, and several seats at the bar - so plenty of options!We started dinner off with an order of chips and salsa for $4.  The basket of chips is plenty big enough to share and the trio of salsas are so good!  The Charro - smoky.  The Verde - refreshing. The Habanero y Pina - sweet with a niiice kick.  Make sure you get to try all three.Hubs ordered up a taco platter, selecting chicken as his protein out of the seven options available.  For $13 he got three corn tortilla shells filled with chipotle chicken, salsa, avocado cream and cilantro & served with a hearty scoop each of rice and black beans.  I chose the quesadilla, 12"" flour tortillas filled with chicken, cheese, tomato salsa, avocado cream and served with scoops of guacamole, rice and black beans.  One of the best quesadillas I've had out at a restaurant.  Perfect marriage of flavors and ingredients.  And with the rice and beans there was so much on the plate.  I was able to take half home for lunch the next day.  $13 verrrry well spent.Total bill, including beer, tax/tip, was about $40.  So I'd say it was $40 well spent.Hubs has already asked when we're going back.  And I can't think of a single reason not to get back there soon. * Check out the wallpaper in the bathroom.  One of my favorite decorative touches.",5.0
"Another place close to Barclays center, small place with a nice ambiance, the drinks are pretty strong and they have a big selection of tequila even though that's not my thing, had the Brooklyn Queso appetizer I found it to be a bit salty for my taste, for entree I had the chicken quesadilla, it came with rice, beans and guacamole, it tasted good but again I found it to be too salty, either way the food was good and I enjoyed it here",4.0
"Came here to waste some time before seeing Ariana Grande at Barclays (don't judge, she's amazing live!) this place is not very large, it's located where two streets intersect at a tight angle and this location fills that space (if that makes sense). There are 2 bar like tables (one against a wall, one facing the outdoors, one large high top, 3 smaller tables, plus the bar. I can't see more than 30 people fitting comfortably to eat. Luckily, it wasn't very full and we were quickly seated at the bar.To start, I had the basic margarita with some chips and salsa. The margarita was very strong, but so little. For $10, I wish it could a bit bigger. Tasted great though and the bartender (he's in my pic) was very nice and very attentive. No beers on tap, only cans or bottles. The chips were great and they're made fresh. You get 3 kinds of salsa, a standard one, a green salsa, and one with a smokey flavor. All were pretty good. Would have gotten guac if it wasn't expensive.For dinner I had a beef burrito. It was a pretty good size, not too messy, and had great flavor. It came with rice and beans. I'm definitely a fan of this place, my only complaint is that it's slightly expensive. Not saying their food is bad (because it's absolutely not) but I've had similar and better Mexican for less money.",4.0
"Being a fan of Mexican slang, I was delighted to walk by the large block letters of this restaurant on Flatbush-- Don Chingon. I needed to know: who is this Mr. Badass?Newly opened, the staff were breezy and attentive. There is a small selection of excellent tequilas and mezcals. The music is a mellow electronica and the walls are lined with red and white tiles.I started with sopa Azteca (tortilla soup), with the deepest, darkest chicken broth, shredded chicken, perfectly ripe avocado, thin slices of red onion and crisp tortillas. Riquísimo. Not enough places in the area serve this, and their version is stellar.Then I had the taco platter, with refried beans and fragrant, sticky rice. The masa is pressed to order, and the tacos are soft and pillowy. The chicken taco was good, loaded with salsa and cilantro, as was the tempura battered pollack, with cabbage, salsa, and pickled onions. But the carne asada was the standout, with habanero, grilled pineapple, and perfectly cooked steak: a great combination of sweet and spice.There is another exit on Bergen and a gorgeous mural outside. A welcome addition to the neighborhood!Buen provecho, badass.",5.0
"I was in the area and had a craving for Mexican food. Don Chignon did not disappoint. I came in around 3 on a Saturday and the place was mostly empty. I was seated and the waiter Marco was really polite and gave me some recommendations on what to order. I ended up going with the Chorizo Quesadillas which came with sides of beans, rice, salsa, and guac. The quesadillas were bigger than I had hoped and were incredible and filling! Atmosphere was very relaxed and I can see this place being a great place for drinks with friends.",5.0
"After reading many reviews on Yelp, I decided to try it out:-). From the incredible service from Angelia, to the wonderful guacamole.... I then enjoyed the avocado taco, you have to try these...incredible!!!  I will be visiting here every time I'm in Brooklyn!Just had my second visit!  It is really nice to walk into a restaurant and not only be remembered, but to be offered to try something new on them:-) I was lucky enough to come on a night that Angelia worked. She greeted me with a ""Thanks for coming back!""  Then remembered were I liked sitting last time and offered me my same table, since it was available. I still have to say the service is incredible!  I tried the poppers this time, and I will be ordering them next time too!  Not to hot, and with incredible flavor. Thanks again for a welcoming and wonderful meal. I see you again in a few weeks!",5.0
"Yeah, so I'm from SoCal and snobby about Mexican food.... yadda yadda yadda. But honestly, the carne asada tacos here were among the best I've had. Somewhat expensive as far as tacos go, but worth it. Beef this good *should* be expensive.Carne asada tacos: 5/5 starsFish tacos: 4/5 starsMargaritas: 3.5/5 stars (The Dulce y Caliente was the standout. The house margarita was only meh.)Nice, casual atmosphere, and the tunes were great (00's indie rock classics).Will definitely be a frequent customer of this place!",4.0
Smart modern take on fresh MexicanNice lunch spot with indoor table and bar seating.Selection of specials daily + full bar.,4.0
"The strawberry mint margarita was very tasty. It came in a small glass and it was very light but it tasty and fresh. The service was great... the waiters were friendly and accommodating. I asked for a drink recommendation. He suggested i tried the Don Julio. His recommendation was on point, smooth and tasty. My friend had the carnita tacos, which seemed delicious. We also order the chips that came with cheese and chips that came with sauce. The chips were alright but i would have rather ordered the tacos instead.  I enjoyed the ambiance. It was relaxed and trendy.",4.0
"I actually really liked the food here. However, my initial experience is what triggered my slightly lower rating. This place is very small, only a few tables. My boyfriend and I came in around 7 and our options were to sit at a communal table or at the very narrow table against the window. We tried the window seats but I was super uncomfortable so we moved to the communal table. Luckily, it was only us at the table. Their second downfall was their menu. There was hardly anything on it! Really cliche food - burritos, tacos, quesadillas. That's it. Where's the pollo con mole??? I was looking forward to getting a margarita because they were very small (so I figured not more than $7, but they were all at least $10). I stuck with water. As an appetizer we got the guacamole and chips ($11). This was definitely overpriced, but I have to say it was very good. The guac had pomegranate seeds and grapes in it, which I loved. I could tell it was fresh and we got a lot of guac. The chips were also good with a very decent portion. For dinner, I got the steak quesadilla ($13) Amazing! The steak was of high quality and overall it was just really good. It also came with rice and beans - also good. Our waiter was very attentive; he asked how we liked our food & made sure we always had water. Don't get me wrong, this is a good place for a taco, burrito or quesadilla! All I'm saying is they could update their menu...Variety is always good.",4.0
"From the second we walked in I knew I was going to love this place.The decor, to start with, is absolutely lovely with its dim lighting, rustic wood tables and graphic wallpaper.  Don Chingon kind of gives off a romantic feel - so it'd be perfect for a date night w/ the Hubs.  But it also has a really cool* vibe - so great for a night w/ the gals or a night w/ the guys too. There were plenty of tables open when we arrived on a Friday night so we were able to 'sit anywhere'.  They have 4 or 5 tables along one side, two hightop counters, a community table in the middle of the room, and several seats at the bar - so plenty of options!We started dinner off with an order of chips and salsa for $4.  The basket of chips is plenty big enough to share and the trio of salsas are so good!  The Charro - smoky.  The Verde - refreshing. The Habanero y Pina - sweet with a niiice kick.  Make sure you get to try all three.Hubs ordered up a taco platter, selecting chicken as his protein out of the seven options available.  For $13 he got three corn tortilla shells filled with chipotle chicken, salsa, avocado cream and cilantro & served with a hearty scoop each of rice and black beans.  I chose the quesadilla, 12"" flour tortillas filled with chicken, cheese, tomato salsa, avocado cream and served with scoops of guacamole, rice and black beans.  One of the best quesadillas I've had out at a restaurant.  Perfect marriage of flavors and ingredients.  And with the rice and beans there was so much on the plate.  I was able to take half home for lunch the next day.  $13 verrrry well spent.Total bill, including beer, tax/tip, was about $40.  So I'd say it was $40 well spent.Hubs has already asked when we're going back.  And I can't think of a single reason not to get back there soon. * Check out the wallpaper in the bathroom.  One of my favorite decorative touches.",5.0
"Another place close to Barclays center, small place with a nice ambiance, the drinks are pretty strong and they have a big selection of tequila even though that's not my thing, had the Brooklyn Queso appetizer I found it to be a bit salty for my taste, for entree I had the chicken quesadilla, it came with rice, beans and guacamole, it tasted good but again I found it to be too salty, either way the food was good and I enjoyed it here",4.0
"Came here to waste some time before seeing Ariana Grande at Barclays (don't judge, she's amazing live!) this place is not very large, it's located where two streets intersect at a tight angle and this location fills that space (if that makes sense). There are 2 bar like tables (one against a wall, one facing the outdoors, one large high top, 3 smaller tables, plus the bar. I can't see more than 30 people fitting comfortably to eat. Luckily, it wasn't very full and we were quickly seated at the bar.To start, I had the basic margarita with some chips and salsa. The margarita was very strong, but so little. For $10, I wish it could a bit bigger. Tasted great though and the bartender (he's in my pic) was very nice and very attentive. No beers on tap, only cans or bottles. The chips were great and they're made fresh. You get 3 kinds of salsa, a standard one, a green salsa, and one with a smokey flavor. All were pretty good. Would have gotten guac if it wasn't expensive.For dinner I had a beef burrito. It was a pretty good size, not too messy, and had great flavor. It came with rice and beans. I'm definitely a fan of this place, my only complaint is that it's slightly expensive. Not saying their food is bad (because it's absolutely not) but I've had similar and better Mexican for less money.",4.0
"Being a fan of Mexican slang, I was delighted to walk by the large block letters of this restaurant on Flatbush-- Don Chingon. I needed to know: who is this Mr. Badass?Newly opened, the staff were breezy and attentive. There is a small selection of excellent tequilas and mezcals. The music is a mellow electronica and the walls are lined with red and white tiles.I started with sopa Azteca (tortilla soup), with the deepest, darkest chicken broth, shredded chicken, perfectly ripe avocado, thin slices of red onion and crisp tortillas. Riquísimo. Not enough places in the area serve this, and their version is stellar.Then I had the taco platter, with refried beans and fragrant, sticky rice. The masa is pressed to order, and the tacos are soft and pillowy. The chicken taco was good, loaded with salsa and cilantro, as was the tempura battered pollack, with cabbage, salsa, and pickled onions. But the carne asada was the standout, with habanero, grilled pineapple, and perfectly cooked steak: a great combination of sweet and spice.There is another exit on Bergen and a gorgeous mural outside. A welcome addition to the neighborhood!Buen provecho, badass.",5.0
