"Previously I reviewed this coffee and lunch spot with a scathing review commenting on the terrible service and my servers ineptitude However, following a private response from him apologizing and assuring me that my lousy service was a result of a lack of staff and an off day for this server, I retracted my previous review and simply reviewed the food.Second time back and here is my understanding of this restaurant:They do not care.After being seated outside for brunch we were forgotten about, despite the garden area (with no plants or music or atmosphere and simply 4 brick walls it would be better described as a prison yard than a garden area) being full of guests. 20 minutes went by and I asked for water and menus. On the menu one of the brunch items, the breakfast sandwich, says in its description that it includes turkey but then offers the option at the end of either turkey or avocado. I asked our server about this and he informed me that choosing turkey simply meant more turkey. I chose the avocado since turkey was already included.My tables order was; one coffee; one latte; one Bellini; 2 breakfast sandwiches.15 minutes later we receive our drinks.30 more minutes and still no food, I go inside to ask about the food and a very lackadaisical female behind the counter shrugged at me. I asked her if she knew anything about where my 2 sandwiches were having been seated now for over an hour, she slumped into the chefs area and checked the tickets and then slumps back to me to tell me ""maybe 5 more minutes?.."".I go back to my seat and our sweet but hardly competent server offers us a round of drinks so I ask for another latte and my boyfriend asks for another Bellini. 10 minutes later the sandwiches come out, no turkey on either. I try to grab the servers attention from across the ""garden area"" and he calls ""yes?"" but doesn't approach me, so I'm left to yell across to him that not only was I waiting over an hour for a sandwich but there's no turkey. He tells me he will see what he can do. The complimentary drinks arrive, 2 black coffees. Wrong again.I send them both back and finally get my latte and a mimosa (at this stage there no point in sending back the mimosa for a Bellini because we're coming up on 2 hours).Once we are finished our sandwiches and are finished our drinks the server comes back with 2 slices of turkey on a brown takeout container.We pay and leave.Overall, consistently terrible service. No atmosphere. Rude staff and sloppy food.",1.0
I recently had the chance to try the tasting menu here and it was amazing. This restaurant is one of the best hidden gems and my new favorite spot in the neighborhood.,5.0
"Had brunch today, the green matcha pancakes were really good , service was decent also. We would go back",3.0
One of the best place to stay and the coffee n the brunch menu are really good..always go over there....,5.0
"Randomly came in after searching for a place to grab breakfast in the area and I loved it! Really cute place, sat in the garden in the back. They had AC going for the folks in the from as well. The staff was very friendly and I enjoyed my veggie sandwich and I don't drink coffee(I know in a coffee shop! ) but they were able to make me iced green tea! Nice addition to the neighborhood! Highly recommend",5.0
"Awesome little coffee shop with a cute patio in the back. Decently priced and delicious coffee and even more delicious food options. Try their sandwiches, you will not be disappointed. Their pastries also looked delicious and the owner joked that if I didn't like the almond croissant he'd comp me (should've taken the challenge! Hah). Speaking of the owner, he is so sweet and goes out of his way to make people feel welcome (can't say that about the other staff). There was a homeless man outside one day that I was there and the owner went and got his coffee order (down to milk preference and number of sugars) and took it out to him. Definitely the kind of business and service I like to support. Can't recommend this place highly enough!",5.0
"We stopped for brunch, on a Sunday and both food and service were great. The reason for 4 stars is because for my glutton siblings the plate sizes and proteins options are limited and they don't serve French fries. Other than that we were very pleased with taste and presentation. Definitely a fair option for a healthy and light brunch.",4.0
"Cozy place, coffee is fine. the staff is super nice! very unpretentious, always smiling and asking how my day is when i go in. Good food too, for a reasonable price. Just a great regular place that isn't overrun with too much hip bullshit.",5.0
"The tasting menu is great, and very reasonably priced for what they are offering. Loved it!",5.0
"Location=======It's hidden among a bunch of small rundown looking shops, and you'll easily miss it if it's your first time.  Interior======Earthy yet modern, reminds me Brooklyn cafes.  They have both indoor and outdoor seating area.  Service======The owner is a fun character to meet.  He was in the middle of creating a new drink when I came in one day, and he sold one to me when I requested it.  Since it was near closing time, he even threw in a few extra goodies to my order.  Food====My salad tasted fresh and homemade, but it was nothing to write home about.Conclusion=========Definitely recommend it if you happen to be in the area.  Come at closing time for possibly extra goodies.",4.0
"I had the same experience as Julia M., minus the impending train.They are so nice and friendly here, and it's got a great, casual ambiance. The coffee's not my favorite - Mixtape is better - but it's good. It's just SO SLOW. My partner and I were the only people in line, and it was eons before we had drinks in hand.I never mind waiting for quality, but it seems a bit overkill here.",3.0
"Did the tasting menu last week. Damn! I've done tasting menus before (mostly at celebrity chef restaurants for $200+) and this was right up there with those (for about a quarter of the price). The braised short ribs were seriously amazing. And a beer pairing too. Double Damn!  So, great food, great beer, great energy and crowd. A+",5.0
Love the salmon bagel and ham & cheese croissant. Nice vibe and brunch area. The owner is a little volatile on a bad day but he's generally friendly and charismatic.,5.0
"I really like this place! The food is incredible! (I really suggest the pancakes) Also, the coffee sizes are very generous, I totally needed it. The place is cozy, kind of an earthy homey feel to it. And the art on the wall I think adds to that. I was really impressed by the employees there too. Very even tempered and helpful. The location is also perfect, right by train station. It is a breathe of fresh air for the area. I had an over all pleasant experience their and would highly recommend it.",5.0
"Rating it on the quality of the coffee here. One of the stars is for the employee who helped me, who was very nice.I got a cold brewed coffee here and it was absolutely disgusting. Not only was it sour, bitter, and over-concentrated, but it tasted like it had been sitting out for too long (which I believe it had, since it was decanted right from a big jug on the table and it was pretty late in the day). Refrigeration is a good thing, guys. It honestly surprised me, seeing the reviews on here; I could've gotten a better cold brewed coffee at Starbucks.",2.0
I fully support Industry! I love the vibe it's brought to my neighborhood. The food is great and sometimes they even have live entertainment. The brunch is the best and apps are awesome. I never had the dinner menu but I will soon.,5.0
Cortado was okay -- nothing memorable. But decent.Almond croissant was kinda dry and stale. Not very good at all.Service was okay -- nothing memorable. Small hole in the wall ambiance. I guess it's a nicer coffee shop in the hood. Shrug.,2.0
"Love this place! Came here when it first opened and I've been back a few times. Some of the coffee is a little pricey for Bushwick, but their breakfast sandwiches are so delicious and well-priced. The Bushwick breakfast is so yummy and filling! The almond croissant is really good too but a little much for me.  Definitely worth a visit. Conveniently located but the subway and super cute backyard for brunch or just hang and do work.",4.0
I recently enjoyed a ten course tasting menu crafted by chef John Creger. All of the dishes were thoughtfully chosen and executed then paired with interesting beer selections. The chef spoke briefly before serving each course. In the small dining room this leant a decidedly intimate and personal feel for the patrons. A top notch experience not to be missed!,5.0
"Location=======It's hidden among a bunch of small rundown looking shops, and you'll easily miss it if it's your first time.  Interior======Earthy yet modern, reminds me Brooklyn cafes.  They have both indoor and outdoor seating area.  Service======The owner is a fun character to meet.  He was in the middle of creating a new drink when I came in one day, and he sold one to me when I requested it.  Since it was near closing time, he even threw in a few extra goodies to my order.  Food====My salad tasted fresh and homemade, but it was nothing to write home about.Conclusion=========Definitely recommend it if you happen to be in the area.  Come at closing time for possibly extra goodies.",4.0
"I had the same experience as Julia M., minus the impending train.They are so nice and friendly here, and it's got a great, casual ambiance. The coffee's not my favorite - Mixtape is better - but it's good. It's just SO SLOW. My partner and I were the only people in line, and it was eons before we had drinks in hand.I never mind waiting for quality, but it seems a bit overkill here.",3.0
"Did the tasting menu last week. Damn! I've done tasting menus before (mostly at celebrity chef restaurants for $200+) and this was right up there with those (for about a quarter of the price). The braised short ribs were seriously amazing. And a beer pairing too. Double Damn!  So, great food, great beer, great energy and crowd. A+",5.0
Love the salmon bagel and ham & cheese croissant. Nice vibe and brunch area. The owner is a little volatile on a bad day but he's generally friendly and charismatic.,5.0
"I really like this place! The food is incredible! (I really suggest the pancakes) Also, the coffee sizes are very generous, I totally needed it. The place is cozy, kind of an earthy homey feel to it. And the art on the wall I think adds to that. I was really impressed by the employees there too. Very even tempered and helpful. The location is also perfect, right by train station. It is a breathe of fresh air for the area. I had an over all pleasant experience their and would highly recommend it.",5.0
"Rating it on the quality of the coffee here. One of the stars is for the employee who helped me, who was very nice.I got a cold brewed coffee here and it was absolutely disgusting. Not only was it sour, bitter, and over-concentrated, but it tasted like it had been sitting out for too long (which I believe it had, since it was decanted right from a big jug on the table and it was pretty late in the day). Refrigeration is a good thing, guys. It honestly surprised me, seeing the reviews on here; I could've gotten a better cold brewed coffee at Starbucks.",2.0
I fully support Industry! I love the vibe it's brought to my neighborhood. The food is great and sometimes they even have live entertainment. The brunch is the best and apps are awesome. I never had the dinner menu but I will soon.,5.0
Cortado was okay -- nothing memorable. But decent.Almond croissant was kinda dry and stale. Not very good at all.Service was okay -- nothing memorable. Small hole in the wall ambiance. I guess it's a nicer coffee shop in the hood. Shrug.,2.0
"Love this place! Came here when it first opened and I've been back a few times. Some of the coffee is a little pricey for Bushwick, but their breakfast sandwiches are so delicious and well-priced. The Bushwick breakfast is so yummy and filling! The almond croissant is really good too but a little much for me.  Definitely worth a visit. Conveniently located but the subway and super cute backyard for brunch or just hang and do work.",4.0
I recently enjoyed a ten course tasting menu crafted by chef John Creger. All of the dishes were thoughtfully chosen and executed then paired with interesting beer selections. The chef spoke briefly before serving each course. In the small dining room this leant a decidedly intimate and personal feel for the patrons. A top notch experience not to be missed!,5.0
Favorite coffee shop in the area thus far. The staff is super friendly and have somehow remembered my uber complicated morning fix. They have the cutest little outdoor garden too which I made my office for a few hours one day. I specifically like this place for their non dairy options and the Almond croissant .. Well mostly the almond croissant,5.0
"Came here based on the 4.5 stars and am really perplexed as to what is so special. Having just eaten my tiny little breakfast sandwich with no side salad or breakfast potatoes, I'm brainstorming where to go next to finish satisfying my hunger as there were no sides available (NOTE: Owner did inform me that they will have fries available next week). My date's savory French toast ""special"" was hardly such, with one hard boiled instead of the advertised soft, annoying when the eggs aren't cooked to spec. Our waiter was very nice though and did his best to accommodate the shortcomings of the kitchen.",3.0
"I want to like this place, but it's kind of a rip off. I went to get a Turkish coffee. Traditionally, you get a small espresso sized cup with a small pot, where you can have 2-3 small cups. They charged me $3 for just one small cup, which was half way filled with grounds. The employee I spoke to about it was very sweet, and asked the manager if she could give me another cup, but the manager refused, and wouldn't even come over to assess the situation. Like I said, I wanted to like this place, and their stuff is good, it's just way too over priced, and the manager wasn't helpful at all.",1.0
"So I stopped by the other day after months. The cafe looked like it had a new layout, it also looked like they had a new staff which was exciting. But of course the service was still average like before. I had an employee come up to me at 5:35 and tell me they're closed...not the best way communicate closing time which by the way was at 6pm...I want to like this place so bad but the mediocre drinks, over priced food and subpar service will not let me!",3.0
"Cool little spot south of Grove. If you're looking for the quintessential brooklyn coffee shop, this is it. Walk past the bar and onto the quiet, vine laden, back patio. Grab some air while you drink your joe :)",4.0
This is absolutely the best place to get coffee near the Myrtle-Wyckoff station.,5.0
My favorite spot !!!coffee is great and food too!the owner is super cool and friendly.Check out the backyard....lovely!,5.0
Awesome service. Great food. Owner is amazingly kind. Electricity was on and off today so there was a delay for our coffee but the owner was not only keeping all of us updated but also gave us a free cookie for the frustration. Super cool place. Will stop by again.,5.0
"Apple & Goat cheese salad & Thai chicken wrap was delicious & filling - actually much better than I'd expected based on the prices. The  back patio is super cute.. just too many biting flies & mosquitos for me. Maybe some sort of insect repellant would've made my first sit down lunch here a bit more enjoyable - the weather today was kind of gross, I will be back on a sunny day",4.0
"New coffee shop in the hood? You know I'm there!This place is very cute and rustic inside, I'm in love with the decor.The owners are also extremely friendly and personable.We ordered a Turkish coffee, a regular coffee and the hummus pita.The hummus is homemade and thick and chunky (just how I like it).It just tasted so fresh and delicious, definitely try it.I was also pretty delighted that they served Turkish Coffee with a Turkish Delight.I feel like few places do that these days. It was really great though.The regular coffee was also pretty good.Quiet coffee shop, right next to the train station, you really can't go wrong.",5.0
Favorite coffee shop in the area thus far. The staff is super friendly and have somehow remembered my uber complicated morning fix. They have the cutest little outdoor garden too which I made my office for a few hours one day. I specifically like this place for their non dairy options and the Almond croissant .. Well mostly the almond croissant,5.0
"Came here based on the 4.5 stars and am really perplexed as to what is so special. Having just eaten my tiny little breakfast sandwich with no side salad or breakfast potatoes, I'm brainstorming where to go next to finish satisfying my hunger as there were no sides available (NOTE: Owner did inform me that they will have fries available next week). My date's savory French toast ""special"" was hardly such, with one hard boiled instead of the advertised soft, annoying when the eggs aren't cooked to spec. Our waiter was very nice though and did his best to accommodate the shortcomings of the kitchen.",3.0
"I want to like this place, but it's kind of a rip off. I went to get a Turkish coffee. Traditionally, you get a small espresso sized cup with a small pot, where you can have 2-3 small cups. They charged me $3 for just one small cup, which was half way filled with grounds. The employee I spoke to about it was very sweet, and asked the manager if she could give me another cup, but the manager refused, and wouldn't even come over to assess the situation. Like I said, I wanted to like this place, and their stuff is good, it's just way too over priced, and the manager wasn't helpful at all.",1.0
"So I stopped by the other day after months. The cafe looked like it had a new layout, it also looked like they had a new staff which was exciting. But of course the service was still average like before. I had an employee come up to me at 5:35 and tell me they're closed...not the best way communicate closing time which by the way was at 6pm...I want to like this place so bad but the mediocre drinks, over priced food and subpar service will not let me!",3.0
"Cool little spot south of Grove. If you're looking for the quintessential brooklyn coffee shop, this is it. Walk past the bar and onto the quiet, vine laden, back patio. Grab some air while you drink your joe :)",4.0
This is absolutely the best place to get coffee near the Myrtle-Wyckoff station.,5.0
My favorite spot !!!coffee is great and food too!the owner is super cool and friendly.Check out the backyard....lovely!,5.0
Awesome service. Great food. Owner is amazingly kind. Electricity was on and off today so there was a delay for our coffee but the owner was not only keeping all of us updated but also gave us a free cookie for the frustration. Super cool place. Will stop by again.,5.0
"Apple & Goat cheese salad & Thai chicken wrap was delicious & filling - actually much better than I'd expected based on the prices. The  back patio is super cute.. just too many biting flies & mosquitos for me. Maybe some sort of insect repellant would've made my first sit down lunch here a bit more enjoyable - the weather today was kind of gross, I will be back on a sunny day",4.0
"New coffee shop in the hood? You know I'm there!This place is very cute and rustic inside, I'm in love with the decor.The owners are also extremely friendly and personable.We ordered a Turkish coffee, a regular coffee and the hummus pita.The hummus is homemade and thick and chunky (just how I like it).It just tasted so fresh and delicious, definitely try it.I was also pretty delighted that they served Turkish Coffee with a Turkish Delight.I feel like few places do that these days. It was really great though.The regular coffee was also pretty good.Quiet coffee shop, right next to the train station, you really can't go wrong.",5.0
"came in for an afternoon bite with friends and ordered the breakfast sandwich with avocado (though you have the option of turkey instead). it was delicious! the chipotle added a nice kick to the pesto/avocado taste. my friend really enjoyed her gluten free waffle with berries, though was missing butter for them (& it wasn't offered). service was fair, considering it doesn't seem there is a dedicated waitress, she didn't come to check on us, but we were ok with that. also tasted some bakery items including the butter crunch cookie (superb!) and the gluten free macaroon (so decadent!) not very visible on the street; seating is a bit tight, but it's got a fantastic play list. definitely coming back.",4.0
"Had to get the Avocado toast because everyone on here raves about it and ohmyGOD it was delicious. Definitely will be getting it again. I also had a toasted almond iced coffee which was also really good. The atmosphere is laid back, I loved LOVED the music selection. Can't wait to go back and try something different. Free WiFi.",5.0
I love their breakfast sandwiches and their coffee. Lovely outdoor seating area in the back. Cool music.,4.0
I am so happy this place is in the area  and it's evolved into a full menu cafe now. This is the only place so far which serves organic/farm fresh produce and meats which makes it the only go to place for me in bushwick. The owner is dedicated to a healthy and better quality food to serve to the community (according to my conversation with him). Everything is delicious there.,5.0
"Nice place, hidden in a not-so-nice area. I would have walked right by had I not been using my phone to locate it. They have a good variety and the staff was friendly!",4.0
"This place is busted AF. First, they got our order wrong. When they finally brought us the correct order it consisted of toast without any kind of condiment, salad without any dressing. Like, ok sure let me eat these leaves with this dry piece of toast. To make matters worse (and dryer) the waitress didn't offer us water and disappeared for our entire meal. The bathroom door is broken. It took forever to get hot sauce and ketchup for our dishes. Their home fries were out of a bag. All of these problems are basics you expect to be met when you pay to eat out. Frankly could have made better versions of these dishes at my house. Oh yeah then they charged us extra for the errors to our order that THEY made.",1.0
Very nice place for breakfast in the neighborhood. From the outside you could never tell that they have an awesome little outdoor patio. Food is good and staff is nice with decent prices. Sadly one of the few hip places in the neighborhood where I havent been mistreated for being latin@.,4.0
"I think I would reconsider using the word ""fair"" in the name of a restaurant because that's exactly what this place is....fair. I gave it a solid effort, about 5 visits but there is always something a little off; weak coffee, out of products, the backyard smells like cat pee....I hate to badmouth salt of the earth establishments, but there are just too many coffee shops in Brooklyn to be this tepid.",2.0
"Very cozy, warm and relaxing place to work/study for couple hours. The owner was very kind along staff. I had the the Avocado Toast and a Roasted Almond Mocha which I really enjoyed the combination. Complimentary Wi-Fi, splendid decoration, plus a backyard. To my luck today it was rainy/snowy so I didn't went out. Definitely come to this place, there's nothing like supporting local coffee shops!",5.0
Love this place! The breakfast sandwich is the best and the backyard is cute. The prices are very fair. My only issue is that the line gets long and the cashiers aren't always on top of things or timely.,4.0
"came in for an afternoon bite with friends and ordered the breakfast sandwich with avocado (though you have the option of turkey instead). it was delicious! the chipotle added a nice kick to the pesto/avocado taste. my friend really enjoyed her gluten free waffle with berries, though was missing butter for them (& it wasn't offered). service was fair, considering it doesn't seem there is a dedicated waitress, she didn't come to check on us, but we were ok with that. also tasted some bakery items including the butter crunch cookie (superb!) and the gluten free macaroon (so decadent!) not very visible on the street; seating is a bit tight, but it's got a fantastic play list. definitely coming back.",4.0
"Had to get the Avocado toast because everyone on here raves about it and ohmyGOD it was delicious. Definitely will be getting it again. I also had a toasted almond iced coffee which was also really good. The atmosphere is laid back, I loved LOVED the music selection. Can't wait to go back and try something different. Free WiFi.",5.0
I love their breakfast sandwiches and their coffee. Lovely outdoor seating area in the back. Cool music.,4.0
I am so happy this place is in the area  and it's evolved into a full menu cafe now. This is the only place so far which serves organic/farm fresh produce and meats which makes it the only go to place for me in bushwick. The owner is dedicated to a healthy and better quality food to serve to the community (according to my conversation with him). Everything is delicious there.,5.0
"Nice place, hidden in a not-so-nice area. I would have walked right by had I not been using my phone to locate it. They have a good variety and the staff was friendly!",4.0
