"THE HOST was a saint! - we had came after class to try to put our name down around 3pm, however the host said it should be ok and come back late. Naturally we come back ( 7pm ) the a swarm of people came while we were waiting for the others to arrive. My friend and I were nervous because ~25 people came in while we were waiting and we thought we weren't going to get seated after all. Luckily since the host remembered us, he ended up seating us right away when our whole party came since we tried coming in before. Came here on Valentines day with my 4 girl friends. We were super excited to hear that Beyonce had eating at this restaurant before...I could see in the corner of my eyes that my friend was super excited about this. However, unfortunately I don't see what he hype is all about. Here is the list of what we ordered:Almond pesto: This dish was ok, little bland, but the cheese they put on top helped bring out the flavor. You can really taste the almond, but the pesto is very light. Sweet Potato (2 orders): AMAZING x 100. This was by far the best dish we had. However I wish they could have given us more! the portions were small. This of this dish as soup dumplings but sweet potato ravioli style. (hope that gives a good visual. It is literally in broth and the texture is not like normal ravioli due to it being submerged in soup, but its VERY GOOD!Octopus salad: This was not bad, however the greens that they used for this salad were actually bitter. The octopus was cooked just right and not too chewy. sausage: this had lot of flavor, you can tell the noodles were made fresh, however if the sausage wasn't in there it would be bland.",3.0
"Excellent service, fantastic food. Our party tried the escarole salad, lentil soup, cheese plate, pasta with sausage, gnocchi, and spaghetti special. Though we were full, we tried the amazing tiramisu and topped it with Stumptown coffee. Definite recommend.",5.0
"Well I went to this place based off yelp reviews and I can't believe how disappointing my experience was.  I only write a review when the experience is super super good or super bad. The food is bland and not just my entree, my wife's entree and the appetizer, and not only was it bland but cold.  Cold pasta, yum!  The menu is so standard too.  Nothing playful or original.  I didn't know what to order cause I was so bored by my options.  The waitress acted like she could give a crap, didn't know answers to some questions and never found out for us.  The place is busy and have no idea why.  Maybe because it's close by and people settle for mediocre food.  When I go spend money at a restaurant I want it to be memorable and fun and new.  Therefor Frankie's does not make my top 3 restaurants in the area and thought it would.  They remain at:1.  The Pines(by far)2.  Battersby(Used to be great but sliding in recent visits)3.  Buttermilk Channel(Always satisfied)",1.0
"This was simply the worst. From the moment we walked in, the bar tender was cold and unhelpful. We ordered 1 dish and it took almost 50 minutes to come. We had to leave to go home to our baby sitter... And asked the waiter to pack the pasta. He forgot and we had to ask to pack the plate into a container. Waste of time and money. Had food there before and should have read ten signs better. Just did not get better.",1.0
"I am done with this place.  My boyfriend and I stopped by in the mid-afternoon for a couple drinks and a snack.  The place (inside and outside) was empty save for my boyfriend and I plus one other table.  The server took forever to greet us, the drinks took 15 minutes to arrive (a glass of wine and a beer) and the server was visibly annoyed that we only ordered 2 rounds of drinks and the olives.  If it were even slightly busy, I could understand it.  However, if we were not there, Mr. Server, you would have missed out on our overly generous 20% tip based on the poor service.  There are plenty of other amazing restaurants in the area with much better service (and food).",1.0
The food was scrumptious and the outside seating was cozy and enjoyable. I would most certainly recommend Frankie's to everyone I know! Definitely coming here again.,5.0
"It doesn't get any better than sitting outside at Frankie's, waiting for your delicious sweet potato ravioli in parmesan broth. I took away one star because the crostini are priced pretty crazy for one tiny crostino.",4.0
"Always a satisfying meal here.  The pastas are great, veggie sides and polenta always top notch and the service is fast!  The house red is actually decent and you are always surrounded by Brooklyn hipsters/ folks taking there out of town parents to dinners!  There can be a really long wait at prime times.",4.0
"If you like waiting two hours and being 'treated like crap, this is the place for you. They won't take reservations. The food is great, I'll give them that much.",3.0
"Frankie's really hits the spot if you're craving some simple yet awesomely prepared Italian food. Salads are delicious, I highly recommend the fennel and celery root salad, so fresh and crunchy. The gnocchi with ricotta and tomato sauce is one of my favorite gnoccis around! They are so light and fluffy, with just enough ricotta cheese and sauce. Super yum!",5.0
"THE HOST was a saint! - we had came after class to try to put our name down around 3pm, however the host said it should be ok and come back late. Naturally we come back ( 7pm ) the a swarm of people came while we were waiting for the others to arrive. My friend and I were nervous because ~25 people came in while we were waiting and we thought we weren't going to get seated after all. Luckily since the host remembered us, he ended up seating us right away when our whole party came since we tried coming in before. Came here on Valentines day with my 4 girl friends. We were super excited to hear that Beyonce had eating at this restaurant before...I could see in the corner of my eyes that my friend was super excited about this. However, unfortunately I don't see what he hype is all about. Here is the list of what we ordered:Almond pesto: This dish was ok, little bland, but the cheese they put on top helped bring out the flavor. You can really taste the almond, but the pesto is very light. Sweet Potato (2 orders): AMAZING x 100. This was by far the best dish we had. However I wish they could have given us more! the portions were small. This of this dish as soup dumplings but sweet potato ravioli style. (hope that gives a good visual. It is literally in broth and the texture is not like normal ravioli due to it being submerged in soup, but its VERY GOOD!Octopus salad: This was not bad, however the greens that they used for this salad were actually bitter. The octopus was cooked just right and not too chewy. sausage: this had lot of flavor, you can tell the noodles were made fresh, however if the sausage wasn't in there it would be bland.",3.0
"Excellent service, fantastic food. Our party tried the escarole salad, lentil soup, cheese plate, pasta with sausage, gnocchi, and spaghetti special. Though we were full, we tried the amazing tiramisu and topped it with Stumptown coffee. Definite recommend.",5.0
"Well I went to this place based off yelp reviews and I can't believe how disappointing my experience was.  I only write a review when the experience is super super good or super bad. The food is bland and not just my entree, my wife's entree and the appetizer, and not only was it bland but cold.  Cold pasta, yum!  The menu is so standard too.  Nothing playful or original.  I didn't know what to order cause I was so bored by my options.  The waitress acted like she could give a crap, didn't know answers to some questions and never found out for us.  The place is busy and have no idea why.  Maybe because it's close by and people settle for mediocre food.  When I go spend money at a restaurant I want it to be memorable and fun and new.  Therefor Frankie's does not make my top 3 restaurants in the area and thought it would.  They remain at:1.  The Pines(by far)2.  Battersby(Used to be great but sliding in recent visits)3.  Buttermilk Channel(Always satisfied)",1.0
"This was simply the worst. From the moment we walked in, the bar tender was cold and unhelpful. We ordered 1 dish and it took almost 50 minutes to come. We had to leave to go home to our baby sitter... And asked the waiter to pack the pasta. He forgot and we had to ask to pack the plate into a container. Waste of time and money. Had food there before and should have read ten signs better. Just did not get better.",1.0
"I am done with this place.  My boyfriend and I stopped by in the mid-afternoon for a couple drinks and a snack.  The place (inside and outside) was empty save for my boyfriend and I plus one other table.  The server took forever to greet us, the drinks took 15 minutes to arrive (a glass of wine and a beer) and the server was visibly annoyed that we only ordered 2 rounds of drinks and the olives.  If it were even slightly busy, I could understand it.  However, if we were not there, Mr. Server, you would have missed out on our overly generous 20% tip based on the poor service.  There are plenty of other amazing restaurants in the area with much better service (and food).",1.0
The food was scrumptious and the outside seating was cozy and enjoyable. I would most certainly recommend Frankie's to everyone I know! Definitely coming here again.,5.0
"First I would like to say the service staff is very attentive. There was not a moment I wanted for water, or felt as though I needed to flag someone down to get what I wanted. Keep up the great work FOH. As for the food... Disappointing is an understatement. We got the antipasti plate. The meats were ok, but nothing memorable. The broccoli rabe was under-seasoned, and the two cheeses were sad. Parmesan was dry and the second cheese tastes like bad American Swiss. The cavatelli boasted brown butter but in the end it just tastes greasy. The pappardelle noodle was well made, but it came in not a sauce but rather a broth, which was rather bland. The saving grace of the meal were decent meatballs and polenta. I have avoided creating a yelp account for so long but I thought this was a dining experience I needed to share. It's unfortunate that Frankie's is taking up so much real estate in NYC with mediocre food, when there are so many establishments doing amazing food that get no attention. Please Frankie, either get better or move your franchise out of a city that knows good food.",2.0
"Had lunch with my husband and a friend here earlier today.  Everything was delicious and the service was great.  My only complaint is that the space is tight and we were seated in the back next to the back door.  The servers were in and out a lot (there must be another kitchen downstairs or something) & it got c-o-l-d with the door opening and closing so often.The food was all delicious.  We started with a cheese appetizer, which was fresh and tasty.  I had the gnocchi for my entree.  Wow.  The sauce & ricotta complimented it perfectly.  So good.  My husband had the meatball hero, which was also really good. I am super picky about my meatballs and usually cannot stand raisins or anything like that in my balls...but this worked.  Delicious.  Our friend had the roast beef sandwich and he very much enjoyed it.  The wine list was also very nice.    The food and service is spot on and we will be back for sure.  You can forgive the tight & uncomfortable space for food of this quality.",4.0
"The stars are almost entirely for the Blue Crab pasta which was actually worth 5 stars. Unfortunately, the rest of the meal brought it down for me- with the exception of the sparkling rosé, but that's not something they actually make, so I can only give so many kudos there.As for the meatballs, while good, I think they pale by comparison to the balls at Ciano and Little Owl. The crostinis, of which we had several were also just okay. The speck and ricotta being the best of the lot. Followed by the mushroom.But dessert was where things really went off the rails. The ricotta cheesecake was a complete waste of calories and did a grave disservice to every other cheesecake in existence that shares its name. It was so dry and flavorless I literally only had a single bite.But WOW, was that pasta good. So was the service. And the decor, simple and somewhat quaint. Nothing too worthy of note. Granted we didn't eat in the barn, which I hear is nice.So, 457... I give you a 3... in stars. Not out of 10. That would be too harsh even for me.",3.0
"Have been going to Frankie's since they opened and liked it so much I had a private party there a few years ago.  Went tonight and won't be coming back.  Was seated in a table under the speakers that was incredibly loud and impossibly dark.  Only way to read the menus was by light of an iPhone.   Staff and manager were remarkably indifferent.  ""The owner wants a certain ambience.""  I can shut myself in a dark room with a boombox and achieve the same thing.  Bye-bye, Frankie's.",1.0
Decided to walk around court st and Frankie's menu caught our eye among the other places. We were greeted promptly and received a phone call within ten minutes for our table. Service was friendly and the atmosphere was very inviting and genuine. The gnocchi was delicious. Fresh ricotta on top! A must dine!!!!,5.0
"Little too hip meaning prices are high; food's not that great. My ravioli sat in not so flavorful liquid. The menu did say it was in broth, but the broth was like pasta water with a little butter or olive oil, & both the broth & the ravioli were bland. My cocktail, tho pricey, was delish. Wish I could remember what else was in it besides iced tea & lemon juice so I could make it @ home! Also, they ""specialize"" in their own olive oil which didn't taste very good to me! Recommend you get drinks @ happy hour @ the restaurant next door if you decide you have to eat at this trendy restaurant.",3.0
"No longer the best meatballs in the city!  Success has finally ruined Frankies.  For years the meatballs have been fresh and homemade.  That made them soft and succulent and full of subtle flavors. Now they are mass produced and frozen. This makes them hard and now, despite the pine nuts and raisins, they only taste of garlic. Like a bad Italian joke. What a shame!Rest of the meal was only OK and the service was rude, as if they were doing us a favor to wait on us.  The Frankies should really go check on their restaurant.",2.0
"Finally I made it to the famous Frankie's, after talking about it for about two years!  Did it live up to the rep?  Maybe--the experience was great, from waiting for our table in the leafy side garden to getting a stellar table right by a window, with a great view of both the backyard and the kitchen action.  The service was fantastic--although they seemed really busy, our waitress was very committed to making sure we had a great experience.  We ordered Frankie's Greens, which is a simple salad with roasted vegetables and was fantastic.  I'd definitely get that again.  We also got Frankie's antipasto which was maybe a mistake; not because it wasn't delicious, but because it was an enormous amount of meats and cheese for two people to finish, even if we weren't also getting pasta (which we were).  I regret not getting the sausage polenta, but went with the sausage cavetelli with browned butter.  I was torn between that and the braised lamb papperdelle and about two second after starting my cavetelli i had major order regret, since i found it to be pretty dry and bland other than the sausage.  Luckily my boyfriend knows me well and had ordered the papardelle so I could taste it too.  He was okay with swapping, so I ended up finishing his dinner.  Needless to say I ate enough meat at Frankie's to last a month, but I would definitely return--just maybe skip the pasta for the other things they have.",4.0
"The menu is very casual and approachable. Alot of veggie dishes and both pannini and sandwhiches.  There cheese dishes are very good but a bit expensive (3 pieces for $15).  The winner is the homemade pastas, especially the cavatelli with sausage and sage butter sauce. Staff is very caring and welcoming.Not a place for a special dinner i.e. anniversary, but a nice place to go when you don't feel like cooking and want well-prepared food with very good ingrediants.",4.0
"Great pasta. Good wine. The antipasto plates aren't great. I would suggest the cavatelli pasta for sure.This place is small, so if you are going with over 4 people make sure you get there earlier than you anticipated.",4.0
"First I would like to say the service staff is very attentive. There was not a moment I wanted for water, or felt as though I needed to flag someone down to get what I wanted. Keep up the great work FOH. As for the food... Disappointing is an understatement. We got the antipasti plate. The meats were ok, but nothing memorable. The broccoli rabe was under-seasoned, and the two cheeses were sad. Parmesan was dry and the second cheese tastes like bad American Swiss. The cavatelli boasted brown butter but in the end it just tastes greasy. The pappardelle noodle was well made, but it came in not a sauce but rather a broth, which was rather bland. The saving grace of the meal were decent meatballs and polenta. I have avoided creating a yelp account for so long but I thought this was a dining experience I needed to share. It's unfortunate that Frankie's is taking up so much real estate in NYC with mediocre food, when there are so many establishments doing amazing food that get no attention. Please Frankie, either get better or move your franchise out of a city that knows good food.",2.0
"Had lunch with my husband and a friend here earlier today.  Everything was delicious and the service was great.  My only complaint is that the space is tight and we were seated in the back next to the back door.  The servers were in and out a lot (there must be another kitchen downstairs or something) & it got c-o-l-d with the door opening and closing so often.The food was all delicious.  We started with a cheese appetizer, which was fresh and tasty.  I had the gnocchi for my entree.  Wow.  The sauce & ricotta complimented it perfectly.  So good.  My husband had the meatball hero, which was also really good. I am super picky about my meatballs and usually cannot stand raisins or anything like that in my balls...but this worked.  Delicious.  Our friend had the roast beef sandwich and he very much enjoyed it.  The wine list was also very nice.    The food and service is spot on and we will be back for sure.  You can forgive the tight & uncomfortable space for food of this quality.",4.0
"The stars are almost entirely for the Blue Crab pasta which was actually worth 5 stars. Unfortunately, the rest of the meal brought it down for me- with the exception of the sparkling rosé, but that's not something they actually make, so I can only give so many kudos there.As for the meatballs, while good, I think they pale by comparison to the balls at Ciano and Little Owl. The crostinis, of which we had several were also just okay. The speck and ricotta being the best of the lot. Followed by the mushroom.But dessert was where things really went off the rails. The ricotta cheesecake was a complete waste of calories and did a grave disservice to every other cheesecake in existence that shares its name. It was so dry and flavorless I literally only had a single bite.But WOW, was that pasta good. So was the service. And the decor, simple and somewhat quaint. Nothing too worthy of note. Granted we didn't eat in the barn, which I hear is nice.So, 457... I give you a 3... in stars. Not out of 10. That would be too harsh even for me.",3.0
"Have been going to Frankie's since they opened and liked it so much I had a private party there a few years ago.  Went tonight and won't be coming back.  Was seated in a table under the speakers that was incredibly loud and impossibly dark.  Only way to read the menus was by light of an iPhone.   Staff and manager were remarkably indifferent.  ""The owner wants a certain ambience.""  I can shut myself in a dark room with a boombox and achieve the same thing.  Bye-bye, Frankie's.",1.0
Decided to walk around court st and Frankie's menu caught our eye among the other places. We were greeted promptly and received a phone call within ten minutes for our table. Service was friendly and the atmosphere was very inviting and genuine. The gnocchi was delicious. Fresh ricotta on top! A must dine!!!!,5.0
"Little too hip meaning prices are high; food's not that great. My ravioli sat in not so flavorful liquid. The menu did say it was in broth, but the broth was like pasta water with a little butter or olive oil, & both the broth & the ravioli were bland. My cocktail, tho pricey, was delish. Wish I could remember what else was in it besides iced tea & lemon juice so I could make it @ home! Also, they ""specialize"" in their own olive oil which didn't taste very good to me! Recommend you get drinks @ happy hour @ the restaurant next door if you decide you have to eat at this trendy restaurant.",3.0
"No longer the best meatballs in the city!  Success has finally ruined Frankies.  For years the meatballs have been fresh and homemade.  That made them soft and succulent and full of subtle flavors. Now they are mass produced and frozen. This makes them hard and now, despite the pine nuts and raisins, they only taste of garlic. Like a bad Italian joke. What a shame!Rest of the meal was only OK and the service was rude, as if they were doing us a favor to wait on us.  The Frankies should really go check on their restaurant.",2.0
"Finally I made it to the famous Frankie's, after talking about it for about two years!  Did it live up to the rep?  Maybe--the experience was great, from waiting for our table in the leafy side garden to getting a stellar table right by a window, with a great view of both the backyard and the kitchen action.  The service was fantastic--although they seemed really busy, our waitress was very committed to making sure we had a great experience.  We ordered Frankie's Greens, which is a simple salad with roasted vegetables and was fantastic.  I'd definitely get that again.  We also got Frankie's antipasto which was maybe a mistake; not because it wasn't delicious, but because it was an enormous amount of meats and cheese for two people to finish, even if we weren't also getting pasta (which we were).  I regret not getting the sausage polenta, but went with the sausage cavetelli with browned butter.  I was torn between that and the braised lamb papperdelle and about two second after starting my cavetelli i had major order regret, since i found it to be pretty dry and bland other than the sausage.  Luckily my boyfriend knows me well and had ordered the papardelle so I could taste it too.  He was okay with swapping, so I ended up finishing his dinner.  Needless to say I ate enough meat at Frankie's to last a month, but I would definitely return--just maybe skip the pasta for the other things they have.",4.0
"The menu is very casual and approachable. Alot of veggie dishes and both pannini and sandwhiches.  There cheese dishes are very good but a bit expensive (3 pieces for $15).  The winner is the homemade pastas, especially the cavatelli with sausage and sage butter sauce. Staff is very caring and welcoming.Not a place for a special dinner i.e. anniversary, but a nice place to go when you don't feel like cooking and want well-prepared food with very good ingrediants.",4.0
"Great pasta. Good wine. The antipasto plates aren't great. I would suggest the cavatelli pasta for sure.This place is small, so if you are going with over 4 people make sure you get there earlier than you anticipated.",4.0
