"Once again a case of my disappearing Yelp reviews so rather than wasting time rewriting will cut to the chase. Been coming here since they opened and learned there are really only 3 things to get here: sausage cavateli, meatball sandwich,  lentil soup.  All are phenomenal and worth the wait to get.  Thankfully they finally take credit cards.",4.0
"Atmosphere: It was a really cute and rustic and intimate place. Really pretty garden in the back that I imagine would be beautiful when the weather gets warmer. The bathroom was really cute too! hahaFood: The food overall was good, not great. The homemade pastas were tasty. Portions were fair (not too big, not too small), definitely can finish in one sitting. There's no complimentary bread or anything and we didn't order any appetizers so we actually ended up hungry soon afterwards. I guess I am more use to having a bigger meal at an Italian restaurant. One thing that turned me off was all the food came out a little luke warm.... Just doesn't taste as fresh when it's room temperature.My friends tried to order 2 different kinds of wines and apparently both were out so they had to substitute.Service:I thought our server could've been more polite. Menus were kind of thrown down on the table. He came and went with our orders, like ""what are you having? Ok. Ok. OK.""  Very curt and gave us weird looks when we asked questions. It also took him a very long time to come get our orders. Everything kind of was slow and we were just very hungry. Overall, I wouldn't recommend this place considering there are SO many great places in Brooklyn. Not a place I'd go back to.",3.0
"Bottom Line: Some of the best restaurants are in Carroll Gardens and Frankies 457 is no exception.I came here on a Friday for dinner based on my friends recommendation. Everyone suggests to get the pasta and it's true. It's that damn good. The portion sizes for the pasta are not huge but will fill you up with the right appetizer.Definitely Get:- Meatballs with Pine Nuts & Raisins (Better than the Meatball Shop)- Cavatelli with Faiccos Hot Sausage & Browned Sage Butter (This was the best damn pasta I've ever ate)- Pappardelle with Braised Lamb, Tomato & Tarragon (Delicious, shredded lamb with big flavor)",4.0
"Tough call on this one I wanted to love it, the restaurant itself is beautiful has alot of characterI respect the kitchen, poor guys cook in the open in a small galley kitchen and put the food out quickly.First strike, full bar with no Jack Daniels....really?Full disclosure I went the day after Palm Sunday, I had a beautiful Italian dinner in my house for the holiday.I dont think any meal would have met my standards but I am afraid Frankies fell short. I ordered 2 antipasto plates, the broccoli rabe on the plate was excellent, the portions were a bit stingy but the quality of the cured meats and cheeses were very good.I had their Eggplant Marinara, I didnt enjoy it all.The eggplant was lightly floured and fried and was layered between marinara sauce. The sauce was good, the eggplant not so much. I was looking for some mozzarella or ricotta. I had a side of gnoochi with marinara and ricotta, marginally better.My guests reviews were mixed.Desserts looked great, I may stop in for coffee and dessert. I wouldnt go back for dinner.",3.0
"- Brunch till 4PM-super limited brunch menu so I say get the ""to die for"" french toast. You will not be disappointed. -Meatball sandwich was good, sort of bordering on the bland but that might be a -good thing if you are not a salt freak like me.-Bloody Mary was nice and spicyBar is nice to chill and read a paper.-Place is huge so even if you have to wait, you won't wait long.did I mention, get the french toast? YUM!",4.0
"I came to this little treasure trove with my boss and co-worker to have a lunch meeting. This is a house turned restaurant. When the weather permits you have a choice of eating indoors or outdoors. Since it was a nice day we chose to sit outside. The inside is very nice with great decor. The front is more for take out but they also have inside sitting in the back of the restaurant. Choosing to sit outside since is was a nice day, we were lead to our table. We were given a complimentary bottle of water. Most of not all of the dishes involved some kind of pasta. I opted for the lump crab with spaghetti with marinara sauce. My co-worker being a diabetic ordered a sweet potato ravioli. Both dishes were extremely good, my lump crab was fresh and you could tell me he marinara sauce was fresh.  As far as the drinks, they offer soda, juice, water, coffee, beer, and wine. Dessert is also an option. I decided on a slice of cake, which was so moist and fluffy. The prices are pretty fair, an entree will cost between $15.00 to $18.00. The dessert between $3.00 to $5.00. The drink was typical of any other restaurant except the wine. The wine was priced based on the type of wine and whether you want a glass or bottle. The staff was nice and friendly but a tid bit slow, but considering the amount to people dining and the number of wait staff it was understandable. If I'm ever in the area during lunch or dinner time, I'll definitely dine here again.",4.0
"Went there for Sat lunch. Friends recommend this place for pasta. But I honestly don't understand why a no meat pasta can charge around $20. I think it's over price and not something very special. We only tried 2 pasta so maybe some thing better out there. Properly will not go back as home made pasta should be a lot better.  It's tasty, but not very special to blow my mind. I am 108lbs but 1 serving of pasta cannot fill me up. It's not worth the money.",2.0
Host did not let us sit down for wine and she would not let us sit at the bar either. Outcome: we left the place. You should appreciate someone that comes to enjoy a glass of wine possibly coming to get something to eat. You suck at your job.,1.0
"I don't know where to start with this one. This is the restaurant that really opened my eyes to what food should taste like. I started eating here a year or two after they opened and knew right away they would be here to stay for a while. 12 years later and nothing has really changed. Simply Excellent. Walk in the door open the curtains and Frankies 457 hits you like a first round upper cut from Tyson. The amazing aromas that come out of that tiny little kitchen can not be duplicated. At least not anywhere in the states that I've eaten at. Some of my family and even my wife having been to Italy/ Sicily say this is the closest I'm going to get unless I go myself.  And they nailed the rustic vibe a decade before anyone else. A little about me. I've had to have eaten at over 5 maybe 600 restaurants, I've lost count. That's probably low ball. I have bookmarked around 200 places I've been to that are memorable and started yelping about them. 457 is my most memorable. I can't recall how many times I've eaten here because it's my go to spot. I find myself going to Frankie's more now after eating someplace that's just not good or mundane and I need to redeem my faith that there is great food out there. Sometimes we end up there the same night after a bad meal somewhere else. The whole Frankie's experience from walking through that curtain takes you to someplace special. Someplace that heightens all for your senses. Everything is Super Delicious. Here are my favorite dishesAll of the crostini especially the ricotta honey and black pepper. I still don't know how anyone can get a beet avocado salad to taste like that. The meatballs how my Sicilian granma used to make with pine nuts and raisins. Pappardelle and lamb amazing. No matter what else we are in the mood for that night we always get the cavatelli, either as an appetizer to split or as a main dish. My opinion the best pasta dish in the city.Dessert. Do Not Leave without having the red wine prunes.",5.0
"Lovely dinner at Frankie's 457 in Carroll Gardens. Be prepared to WAIT! On a Friday night around 7 pm, the wait for a table was an hour and a half. We gave our phone number and then went to hang out at a nearby bar. We were called back an hour later and ran to claim our table!The restaurant is tiny and beautiful, with dim lighting making for a romantic, special atmosphere. The waitstaff were friendly and attentive and the food was excellent. Favorites of the night included the superb meatballs (you MUST order these), the outstanding pork braciola (served only Friday to Sunday), and the perfectly textured gnocchi. Also lovely was the appetizer of soft, creamy mozzarella. While the pasta with sage and hot sausage was delicious, it was too heavy on my stomach, as portions were hearty. Regardless, everything was wonderful and I am very happy we finally had dinner at Frankie's.",5.0
"The warm spring air and the dim lit atmosphere allows for a wonderful experience in the courtyard. With the stones playing in the background, and the puscetto perfectly baked for appetizers there is still plenty of food to come. Hard cheeses and cooked vegetables follow, all before perfectly cooked pasta and sausage, meatballs, and branzino with the skin still on are marks of a high quality restaurant. All the while wine flows liberally. There will be many beautiful experiences this spring and summer in the outdoor area.",5.0
"I heard of this place through a friend and was excited to check it out. We didn;t have reservations and walked right in to be seated promptly at 6:30  pm. The restaurant is quite small with an outdoor garden which looked beautiful. The kitchen is smack in the middle of the restaurant which does make the inside a little toasty. We ordered the buffala salad to start- average but tasty and two glasses of white wine. For the entrees we got the pappardelle with braised lamb which was a little bit on the peppery side; in addiiton to the eggplant parmigiana which was amazing. I would have had a second portion.The dishes are not large, not like you would find in more commercial Italian restaurants.So after an appetizer , entree and bread I was still hungry. We shared the chocolate tart which wasn't great. The place does fill up and gets quite loud ( LOTS of young children) but I would definitely come back to try the other pasta options; the products all very very fresh and well made. Not too expensive either.",4.0
"Ever since I read in the NYTimes that the owners of Frankies conceive their food ideas via marijuana, nytimes.com/2010/05/19/d…, I was intrigued... After an hour wait, I *finally* dined at Frankies and was not disappointed. The highlights were the OLIVE OIL and the HOMEMADE PASTA and SAUCE. My spouse and I sat in the backyard and the ambiance was so romantic and gorgeous. Pebbled ground, rustic wood tables, beautiful lush trees and branches, lights strewn all over. It was a much more refined version of iCi's backyard (Fort Greene, BK). We ate family style and ate off the same plate, as we usually do.The olive oil was un-f***ingbelievable. My favorite item. I told my spouse that I may come back just to buy a bottle of that Sicilian olive oil and warned him that I may douse it all over him. I said this because I didn't enjoy the bread at all...too hard, stale-ish crusts... I was envisioning other ways to devour the oil in large quantities. DRINKS:My spouse ordered the cocktail with the ginger and fennel and he really enjoyed it. I think it tastes exactly like the liquid form of Supari (the fennel mixture you spoon into your mouth for digestion after a Desi meal). I had a great glass of red. The Dolcetto D'Alba - I asked to taste the funk, the dirt, the earth... and mentioned my love of Cote Rotie and they served up exactly what I asked for (It went SO well with the pasta).SALAD:We ordered the Braised Octopus with Dandelion Greens salad. The octopus was cooked very well, absolutely no rubber. The greens were not bitter as dandelion usually is and the castelvetrano olives actually had a flavor! They were lemony. It was a nice salad. Not punch me in the face amazing, but nice. We also ordered the Broccoli Rabe side to accompany our pasta. It was *bitter*, much more so than the dandelion greens. I have never had rabe that tasted like that before - but I am not a rabe expert. Not bad, not great. I do know that bitters are loaded with nutritional value - so I treated it as a welcomed medicinal food. PASTA:Since I don't eat meat (only fish/seafood), I asked for a veggie pasta recommendation. Note, their pastas are made fresh, in-house. I was told to order the linguini with fava beans, tomatoes, garlic and lightly toasted breadcrumbs. It was JAW-DROPPING GOOD. Did I mention their homemade sauce? I had no clue that tomato sauce could have so many delicate layers and still remain light. Wow. Their pastas are on par with Rucola. You cannot come here and not order one of them. After all, it's what Italians do best, right? DESSERT:Tiramisu with ladyfingers that were actually soaked in espresso!!!! Such a relief. It was really tasty, though the creme layer was too thick. But still much better than 90% of the Tiramisu's that I have tried in the City.We also added some Amaro to cap off the meal. The Montenegro was great - easy to drink, notes of saffron, coriander, orange, pepper, licorice. The Cynar - a bitter amaro made from artichokes was a no-go, too bitter... but SO glad we tried it. The staff, from the maitre d', the drink specialist, to our server, were all really nice, helpful and accommodating. Another solid restaurant to assuage future pasta cravings.",4.0
"This place is yummmmmmmmmmy. I ordered the most delicious pasta, and wasn't disappointed at all when it arrived and I scarfed it down. There was actually so much on my plate that I had to take some home!The only downside was my drink. I can't remember the name of it, but it was something alcoholic with apple in it, maybe? When it arrived, the glass was only filled up less than halfway. When I asked the waiter, he said that's the way the drink was made. I was pretty disappointed to be paying $12 for a drink when there was very little to it, and not much alcohol in it either. He came back about 10 minutes later to say he talked to the bartender AND the manager, and they confirmed that the drink was made correctly... which was nice, but a little unnecessary. I would've rather just had him fill the glass up the whole way instead of getting the confirmation from a bunch of people. Either way, otherwise it was a pleasant experience. It's a little tight, space-wise, but it's gorgeous inside: candles everywhere and a romantic ambience, staff is pleasant, food is fabulous.",4.0
I luckily came across this place. The service was good but the food was great. I had the octopus salad which was fresh and light. The tuna crostini wasn't anything spectacular but the cannelli crostini was delicious! The gnocchi was incredible. I could've eaten it without the marinara or ricotta! They were luck fluffy pillows that perfectly melted in your mouth. The meatballs were very soft and were served in their perfect marinara sauce. All around great dinner.,5.0
"I've been coming to this place for the longest and it never disappoints, the staff is great and accommodating, genuinely friendly..I always get the fennel celery root salad, lentil soup and the parpadelle  pasta.. Lovely atmosphere for a date, family or if you just feel like sitting at the bar and read the New York Times! Love it!",5.0
"Why is the staff so rude ?I've lived in Carroll gardens for 5 years , I don't care how popular a resto is; I've gone to a million restaurants with better food and more polite staff walking distance away . Customer is paying for your service , you are not paying us !",1.0
"My boyfriend and I arrived on a busy late dinner Thursday evening, there was a 40 minute wait. Once we got in, the restaurant seemed cozy. We got to sit in a separate patio room, which had a very romantic ambiance. We ordered the Frankies Antipasto, which came promptly. The board itself had roasted cauliflower, broccoli rabe, olives, cheese and a large amount of cured meats. Their special neon green olive oil is certainly a acquired taste, only one of us liked it. For our entrees we got the Linguini with Blue Crab Tomato Sauce, Chili & Basil, and the Cavatelli with Faiccos Hot Sausage & Browned Sage Butter. The linguini was tender and delicate. It had a good amount of crab, but it was a little too salty and heavy on the sauce. The cavetelli was nice an dense and tasted housemade. The sausage was nice and peppery.Pros: Good date spot, romantic patio, intimate, great antipasto, large wine selection, and great pasta textureCons: A little heavy handed with seasoning, and crowded Overall, Frankies is simple Italian done very well, just expect a wait during dinner hours.",4.0
"This place is a unicorn restaurant.  Everything is so right about this place.  The price, the food, the decor, the atmosphere, the people.  Everything.  Anything you order will be good.  If you have to wait for a table, enjoy a glass of wine across the street.  This place is so worth the wait.",5.0
"Frankies was definitely off of the beaten path for me coming from Williamsburg; however, my friend talked me into trekking over to his neighborhood to give this place a try.  We stopped by on a Saturday night around 8pm and were pretty alarmed when we saw a huge crowd standing outside.  Luckily for us we found 2 bar seats immediately upon walking in - avoiding the 1+hour wait.The bartender made a great old fashioned and my buddy ordered a couple of house cocktails (apologies, don't remember what) and they were both great as well.  Dishes: I opted for the cavatelli with the spicy sausage and my friend went with their last plate of rabbit.  Both dishes were absolutely amazing and cooked to perfection. In addition, the service was top notch and I hear they have a great outdoor space for the summer!",5.0
"The warm spring air and the dim lit atmosphere allows for a wonderful experience in the courtyard. With the stones playing in the background, and the puscetto perfectly baked for appetizers there is still plenty of food to come. Hard cheeses and cooked vegetables follow, all before perfectly cooked pasta and sausage, meatballs, and branzino with the skin still on are marks of a high quality restaurant. All the while wine flows liberally. There will be many beautiful experiences this spring and summer in the outdoor area.",5.0
"I heard of this place through a friend and was excited to check it out. We didn;t have reservations and walked right in to be seated promptly at 6:30  pm. The restaurant is quite small with an outdoor garden which looked beautiful. The kitchen is smack in the middle of the restaurant which does make the inside a little toasty. We ordered the buffala salad to start- average but tasty and two glasses of white wine. For the entrees we got the pappardelle with braised lamb which was a little bit on the peppery side; in addiiton to the eggplant parmigiana which was amazing. I would have had a second portion.The dishes are not large, not like you would find in more commercial Italian restaurants.So after an appetizer , entree and bread I was still hungry. We shared the chocolate tart which wasn't great. The place does fill up and gets quite loud ( LOTS of young children) but I would definitely come back to try the other pasta options; the products all very very fresh and well made. Not too expensive either.",4.0
"Ever since I read in the NYTimes that the owners of Frankies conceive their food ideas via marijuana, nytimes.com/2010/05/19/d…, I was intrigued... After an hour wait, I *finally* dined at Frankies and was not disappointed. The highlights were the OLIVE OIL and the HOMEMADE PASTA and SAUCE. My spouse and I sat in the backyard and the ambiance was so romantic and gorgeous. Pebbled ground, rustic wood tables, beautiful lush trees and branches, lights strewn all over. It was a much more refined version of iCi's backyard (Fort Greene, BK). We ate family style and ate off the same plate, as we usually do.The olive oil was un-f***ingbelievable. My favorite item. I told my spouse that I may come back just to buy a bottle of that Sicilian olive oil and warned him that I may douse it all over him. I said this because I didn't enjoy the bread at all...too hard, stale-ish crusts... I was envisioning other ways to devour the oil in large quantities. DRINKS:My spouse ordered the cocktail with the ginger and fennel and he really enjoyed it. I think it tastes exactly like the liquid form of Supari (the fennel mixture you spoon into your mouth for digestion after a Desi meal). I had a great glass of red. The Dolcetto D'Alba - I asked to taste the funk, the dirt, the earth... and mentioned my love of Cote Rotie and they served up exactly what I asked for (It went SO well with the pasta).SALAD:We ordered the Braised Octopus with Dandelion Greens salad. The octopus was cooked very well, absolutely no rubber. The greens were not bitter as dandelion usually is and the castelvetrano olives actually had a flavor! They were lemony. It was a nice salad. Not punch me in the face amazing, but nice. We also ordered the Broccoli Rabe side to accompany our pasta. It was *bitter*, much more so than the dandelion greens. I have never had rabe that tasted like that before - but I am not a rabe expert. Not bad, not great. I do know that bitters are loaded with nutritional value - so I treated it as a welcomed medicinal food. PASTA:Since I don't eat meat (only fish/seafood), I asked for a veggie pasta recommendation. Note, their pastas are made fresh, in-house. I was told to order the linguini with fava beans, tomatoes, garlic and lightly toasted breadcrumbs. It was JAW-DROPPING GOOD. Did I mention their homemade sauce? I had no clue that tomato sauce could have so many delicate layers and still remain light. Wow. Their pastas are on par with Rucola. You cannot come here and not order one of them. After all, it's what Italians do best, right? DESSERT:Tiramisu with ladyfingers that were actually soaked in espresso!!!! Such a relief. It was really tasty, though the creme layer was too thick. But still much better than 90% of the Tiramisu's that I have tried in the City.We also added some Amaro to cap off the meal. The Montenegro was great - easy to drink, notes of saffron, coriander, orange, pepper, licorice. The Cynar - a bitter amaro made from artichokes was a no-go, too bitter... but SO glad we tried it. The staff, from the maitre d', the drink specialist, to our server, were all really nice, helpful and accommodating. Another solid restaurant to assuage future pasta cravings.",4.0
"This place is yummmmmmmmmmy. I ordered the most delicious pasta, and wasn't disappointed at all when it arrived and I scarfed it down. There was actually so much on my plate that I had to take some home!The only downside was my drink. I can't remember the name of it, but it was something alcoholic with apple in it, maybe? When it arrived, the glass was only filled up less than halfway. When I asked the waiter, he said that's the way the drink was made. I was pretty disappointed to be paying $12 for a drink when there was very little to it, and not much alcohol in it either. He came back about 10 minutes later to say he talked to the bartender AND the manager, and they confirmed that the drink was made correctly... which was nice, but a little unnecessary. I would've rather just had him fill the glass up the whole way instead of getting the confirmation from a bunch of people. Either way, otherwise it was a pleasant experience. It's a little tight, space-wise, but it's gorgeous inside: candles everywhere and a romantic ambience, staff is pleasant, food is fabulous.",4.0
I luckily came across this place. The service was good but the food was great. I had the octopus salad which was fresh and light. The tuna crostini wasn't anything spectacular but the cannelli crostini was delicious! The gnocchi was incredible. I could've eaten it without the marinara or ricotta! They were luck fluffy pillows that perfectly melted in your mouth. The meatballs were very soft and were served in their perfect marinara sauce. All around great dinner.,5.0
"I've been coming to this place for the longest and it never disappoints, the staff is great and accommodating, genuinely friendly..I always get the fennel celery root salad, lentil soup and the parpadelle  pasta.. Lovely atmosphere for a date, family or if you just feel like sitting at the bar and read the New York Times! Love it!",5.0
"Why is the staff so rude ?I've lived in Carroll gardens for 5 years , I don't care how popular a resto is; I've gone to a million restaurants with better food and more polite staff walking distance away . Customer is paying for your service , you are not paying us !",1.0
"My boyfriend and I arrived on a busy late dinner Thursday evening, there was a 40 minute wait. Once we got in, the restaurant seemed cozy. We got to sit in a separate patio room, which had a very romantic ambiance. We ordered the Frankies Antipasto, which came promptly. The board itself had roasted cauliflower, broccoli rabe, olives, cheese and a large amount of cured meats. Their special neon green olive oil is certainly a acquired taste, only one of us liked it. For our entrees we got the Linguini with Blue Crab Tomato Sauce, Chili & Basil, and the Cavatelli with Faiccos Hot Sausage & Browned Sage Butter. The linguini was tender and delicate. It had a good amount of crab, but it was a little too salty and heavy on the sauce. The cavetelli was nice an dense and tasted housemade. The sausage was nice and peppery.Pros: Good date spot, romantic patio, intimate, great antipasto, large wine selection, and great pasta textureCons: A little heavy handed with seasoning, and crowded Overall, Frankies is simple Italian done very well, just expect a wait during dinner hours.",4.0
