"Ok I feel bad about this but truth must prevail! Mushroom hummus is best I have ever had but that's about it. Hence 2 stars.... I had chicken and cous cous and I swear they did something to it... It was Not edible! Cous cous was overcooked mush! And I wasn't only one since everyone else @my table said same thing. My party also tried lamb pie thingy and salmon. Lamb was gamey which to me is bad-send-it-back-to-kitchen sign but I guess some of us r nicer. Salmon was bland! Not sure if chef was off that day or it was last min change since food took forever to come out for everyone! I think waitress realized we were not happy and gave us free poutin balls, which tasted like straight rum. I'd go back for that hummus, but that's about it!",2.0
This is a very nice intimate little spot in courtelyou road. The food tastes really good . The hostess lets you know the approximate/close to exact time u will seat down. It has few tables and can accommodate maybe around 20 people or less. I come here for brunch and dinner. It does not disappoint. They will give a wine bottle size glass in each table. The food wait is maybe 15-20 minutes. I am a fan of thier Semolina pancake with honey and butter on the side. YummyThis is a place to grab your Sunday brunch and just want some peace..,5.0
"I have heard whisperings about Mimi's Hummus for a long time, but never had the occasion to visit. With that, a friend and I were all set to have brunch at Castello Plan a couple of a weekends back, but I requested a last minute change of venue so we could try Mimi's instead. I am generally obsessed with Middle Eastern cuisine and was ready to do the insufferable ""Is it, or is it not better than what I ate in Israel?"" spiel, but I was silenced by how simply divine the food at Mimi's is. We popped in around 11:30 on a Sunday morning and were lucky enough to snag a table right away in their small, smartly decorated space. With only six or seven tables, I think this place fills up fast, and I could see why. Mimi's is open for brunch with a fairly unique (at least for brunch-time) menu including egg dishes, pancakes, hummus (obvi) and more. My friend and I shared an order of masabache hummus which was served with huge, warm pitas. The hummus is bracing, fresh with lemon juice, and olive oil and whole chickpeas on top. I ordered the green shakshuka for my main which was amazing. A hearty stew of swiss chard, topped with sunny side-up eggs and salty Bulgarian cheese (similar to feta). It was served with more pitas (which I kept eating), and the portion was huge for the price. Service was friendly and fast, with lots of refills on my coffee, which I love. Mimi's is a happening spot on Cortelyou Road and a terrific addition to this strip of stores and restaurants. Have you ever thought of branching out, Mimi? We could use more restaurants like this in NY!",5.0
Amazing,5.0
Tasty!,5.0
"Great meal! The hummus was very tasty. The souvlaki was the absolute best and I loved the dates and coconut dessert that came with the order! Even though the delivery guy got lost initially, the food was worth the wait. Special shout to the wonderful hostess/waitress who took my order and went above and beyond to ensure we got our food immediately!! Will definitely recommend and return.",4.0
"Mimi's Hummus is a small, quaint little spot on Cortelyou. Great food. Mint lemonade was refreshing and a definitely enjoyed the meat hummus. I'd rate higher however if it wasn't for the waitress I encountered when my friends and I dined here.She asked if the service wasn't good because I didn't leave a huge tip. She mentioned that good service deserves a 20% tip. I thought this was a terrible faux pas on her part.Exceptional service gets 20%. Good service gets a 15% tip and as I explained, I just put an arbitrary number that I thought was reasonable. Working out the math, I left a tip of 13.24%. You know what a 15% tip would've been on that bill? $1 more than what I tipped. $1? Really? In the scheme of things, discussing the tip with a customer when it's a matter of $1 is a little ridiculous.I felt like she was trying to guilt trip me into tipping more. That exchange left a sour taste in my mouth and I'm not interested in dining here again. This is not how you win customers. That was the first time a waitress ever did that when I dined somewhere. My friends and I looked at each other, bewildered by the exchange. Then we left. We said goodnight to the staff without them saying a word. Awkward to say the least. Not to mention rude.The food did rock though. So I'm conflicted. I hope she's not the only waitress there. If she is... Yeah. No thanks.",2.0
"Been here twice...about a year apart. The food is good; even if a little bland. I like the menu options and the specials. Pita (choice of white or wheat) is always served warm. Service is friendly yet basic. I don't like the tiny water glasses and especially don't like the warm tap water served in bottles.  We had to request ice (which I believe came from next door). Our empty water bottle sat there empty. What I had forgotten from my first visit, and remembered immediately upon sitting down, was the lack of air in the place. Both times I was there were on warm summer days and the A/C was off. Not a problem but some air movement via a fan would make a world of difference.",3.0
"I want to like this place...I REALLY want to like this place. I love hummus and the hummus here is exceptional! The fava beans, the mushroom/onion hummus are all EXCELLENT. However -- and I am not one to leave a ""negative"" review based on one person/waitress/experience -- this place leaves a LOT to be desired. As others have stated the waiting staff is more often than not a be haughty for some really strange reason. I don't understand why personally because I'd take their job no problem. They work in a small, beautiful, and easy setting (I am not knocking waiting but in a smaller environment with a kitchen an arm's reach away from some tables, it's a huge place) but alas, they aren't which leads to a problem with tipping as, again, others have stated. Anyway, I usually forego all this for the food! I am a nutritionist (yes, selfish plug) and a big food advocate in terms of organic, biodynamic, blah blah hippie dippie stuff and I swear that the quality of everything but the hummus -- maybe even the hummus and I am, still, too enamoured by it -- went downhill. Shakshuka used to be my fave thing to order here as I don't partake in meat or fish BUUUUT the other day, I saw one of the  cooks run out to buy eggs and viola! cheapest, nastiest, sickliest ""regular"" eggs (the ones that come in a blue carton). You're on CORTELYOU RD...you have the co-op right there, and for a single dollar more you can obtain organic eggs. Or, the Key Food on Newkirk has Pete and Gerry's certified humane, free grazing, cage free, and organic eggs for 3 dollars a DOZEN (yes, all the keywords us ""hippies"" salivate over). My dinner-mate only brought this to my attention when we ate the shakshuka and I asked if it was bland and she said ""yeah, look at the garbage: it's a cheap carton of eggs"".  I was very disappointed in that.  And, honestly? Hummus Place in the city charges less for shakshuka and use organic eggs (I don't know which kind, truth be told) which means that they could afford to spend a dollar more for a dozen eggs, which equates to about 8.2 cents per customer. I think i'll stick to ordering the hummus alone and taking it home with me for next time.I hope no one gets butthurt from the establishment reading this but I am not making a big deal over a missing napkin here, either :) Peace and Love",3.0
"Word to the wise, wait until your entire party is there before you try to get a seat in this tiny restaurant.  That being said, once you do sit down, prepare for delicious food to wow you!I was there with three other friends and we started with the fava bean hummus.  I asked for cucumber on the side (I'm gluten free) and it was $2 extra (which is fine, I am just glad they had it).  I ordered their special for the night which was roasted eggplant stuffed with ground lamb and feta cheese w/tomatoes.  Umm, really?  was it necessary to be that awesome!!!  It was sooo good!My girlfriends drank the lavender lemonade and loved it.  I can't wait to go back and try more!  The staff are great, the food is awesome, and the prices are moderate.  Check it out!",4.0
"This is the lightest, fluffiest Hummus I've had in New York, so Far. It also has less salt than most Mediterranean joints.  It may even rival my favorite spot Soom Soom, if it wasn't all the way in Brooklyn.   For dessert I had the cake, which came wading in a pool of fresh lemon and honey. More sweet than tart it had a great moist texture. Overall the food was fresh and good.",4.0
"Every friend I take to Mimi's loves it. I could live off their small plates alone. For me, an ideal meal at Mimi's consists of the following:* Cauliflower salad with parsley and tahini dressing* Eggplant ""caviar"" with parsley, tahini and honey* Beet with onion and parsley* Labane cheese with za'atar and olive oil (they sell these first two next door)* Warm whole wheat pita* Coconut-rolled chocolate balls aka Punchim (do not omit the h before googling this.)But everything else I've tried is good.They also deliver. When I lived in the neighborhood, I used to order a few small plates that would last me two to three meals. They make great fillings! Just spoon leftovers into a hunk of baguette. Mmm.",5.0
"I've been going to Mimi's for a few years now and mainly eat their mabache hummus, which is divine, however they stopped serving pickles with it and now serve some pickled veggies that are too spicy and just not very good.I decided to try something different and went with the Chicken patties with cous cous and was very disappointed. The patties were tasteless, made with what seemed to be tomato paste. The cous cous wasn't seasoned at all.",3.0
"Went here because another place was closed, but we were sure glad we did. Great great pita bread. Got the special of Iraqi beet soup with beef dumplings. Wow. Best stuff I've put in my mouth in a while. Small but intimate and tastefully so.  Nice neighborhood date spot. Very nice and polite service. We went on looking for something cheap. But in the end ordered the special because looked too good. Still made it out of there at ten or so a person. Very good and very reasonable. Worth coming to from outside the neighborhood as well.",5.0
Stopped here with my BF and had a nice quiet lunch and this lovely little place. It was nice to have hummus hat actually tasted like i was in israel.,5.0
"Loved this place! The salad was impeccably seasoned and the hummus was delicious. The entree wasnt your average Mediterranean cuisine seasoning, it was chock full of good stuff like orange peel and mint. Really good quality food overall.In spite of my 5 stars i will say though that we splurged for the dessert since Im a chocolate addict...the chocolate balls were not too good....very perfume-y tasting.",5.0
"Great place in the hurt of BK.The Hummus is good, the atmosphereis good and the people are nice.The food made me feel like i was at my parents house and my mother was cooking ;)Give it a try!",5.0
"Great food, especially the hummus. Best from any restaurant I've ever been to. The pita is also a must-try.",5.0
"I tried mimi's a few months ago and I'm still raving about the mushroom hummus. Best hummus I've ever had. I can't remember the other dishes I had but if you only come for the hummus, you won't be disappointed.",5.0
"Word to the wise, wait until your entire party is there before you try to get a seat in this tiny restaurant.  That being said, once you do sit down, prepare for delicious food to wow you!I was there with three other friends and we started with the fava bean hummus.  I asked for cucumber on the side (I'm gluten free) and it was $2 extra (which is fine, I am just glad they had it).  I ordered their special for the night which was roasted eggplant stuffed with ground lamb and feta cheese w/tomatoes.  Umm, really?  was it necessary to be that awesome!!!  It was sooo good!My girlfriends drank the lavender lemonade and loved it.  I can't wait to go back and try more!  The staff are great, the food is awesome, and the prices are moderate.  Check it out!",4.0
"This is the lightest, fluffiest Hummus I've had in New York, so Far. It also has less salt than most Mediterranean joints.  It may even rival my favorite spot Soom Soom, if it wasn't all the way in Brooklyn.   For dessert I had the cake, which came wading in a pool of fresh lemon and honey. More sweet than tart it had a great moist texture. Overall the food was fresh and good.",4.0
"Every friend I take to Mimi's loves it. I could live off their small plates alone. For me, an ideal meal at Mimi's consists of the following:* Cauliflower salad with parsley and tahini dressing* Eggplant ""caviar"" with parsley, tahini and honey* Beet with onion and parsley* Labane cheese with za'atar and olive oil (they sell these first two next door)* Warm whole wheat pita* Coconut-rolled chocolate balls aka Punchim (do not omit the h before googling this.)But everything else I've tried is good.They also deliver. When I lived in the neighborhood, I used to order a few small plates that would last me two to three meals. They make great fillings! Just spoon leftovers into a hunk of baguette. Mmm.",5.0
"I've been going to Mimi's for a few years now and mainly eat their mabache hummus, which is divine, however they stopped serving pickles with it and now serve some pickled veggies that are too spicy and just not very good.I decided to try something different and went with the Chicken patties with cous cous and was very disappointed. The patties were tasteless, made with what seemed to be tomato paste. The cous cous wasn't seasoned at all.",3.0
"Went here because another place was closed, but we were sure glad we did. Great great pita bread. Got the special of Iraqi beet soup with beef dumplings. Wow. Best stuff I've put in my mouth in a while. Small but intimate and tastefully so.  Nice neighborhood date spot. Very nice and polite service. We went on looking for something cheap. But in the end ordered the special because looked too good. Still made it out of there at ten or so a person. Very good and very reasonable. Worth coming to from outside the neighborhood as well.",5.0
Stopped here with my BF and had a nice quiet lunch and this lovely little place. It was nice to have hummus hat actually tasted like i was in israel.,5.0
"Loved this place! The salad was impeccably seasoned and the hummus was delicious. The entree wasnt your average Mediterranean cuisine seasoning, it was chock full of good stuff like orange peel and mint. Really good quality food overall.In spite of my 5 stars i will say though that we splurged for the dessert since Im a chocolate addict...the chocolate balls were not too good....very perfume-y tasting.",5.0
"Great place in the hurt of BK.The Hummus is good, the atmosphereis good and the people are nice.The food made me feel like i was at my parents house and my mother was cooking ;)Give it a try!",5.0
"Great food, especially the hummus. Best from any restaurant I've ever been to. The pita is also a must-try.",5.0
"I tried mimi's a few months ago and I'm still raving about the mushroom hummus. Best hummus I've ever had. I can't remember the other dishes I had but if you only come for the hummus, you won't be disappointed.",5.0
can't believe I had never heard of this place. it is excellent. some of the best food I've had in a while.,5.0
"It's ok. A bit expensive, but food wise it's all there. Nothing to fuss about though.",4.0
"This place is tiny! I like how you can see into the kitchen and everything they are preparing. Our waitress was so sweet and attentive and knowledgeable about the dishes. I tried the cauliflower salad (meh, I don't like cauliflower and expected Mimi's to somehow make it palatable but it still isn't), grape leaves (bite sized and delicious), standard and meat hummus (very good and the warm wheat pitas make it even better) and the cheese dip (my favorite). We used a Blackboard coupon and even though Mimi's is very affordable, it made it an extra good deal. A very yummy option for lunch or dinner in this 'hood. I only with the pepper stuffed with lamb was available or this lamb pie that the other reviewers were talking about... guess they were out of lamb even though it was early in the night.",4.0
"This is my go-to spot for brunch with a friend. The food is great and unique and always spot on in quality.The downside is how tiny it is (which, they do the best they can with what they have) but more so the issues with waiting staff. They tend to just forget about you and it can be a real struggle to get them to your table (which is bizarre given how tiny the place is). I may well have just run into a few new folks when I've gone so focus more on the food portion of this review and let your own experience write it self.",4.0
Great hummus. Great food. The only things that keeps me from giving it a fifth star is it's lack of falafel.,4.0
"I went to this place for lunch today and it was so refreshing on a hot, muggy day! The waitress quickly told us the beer special, which my friend jumped on, and I had a Lagunitas Pale Ale. We then shared their traditional hummus, cauliflower salad, and grape leaves. Everything was delicious! I loved that they had both whole wheat and white pitas, and their pickled veggies were.to.die.for! It's the perfect little lunch place, and is super fresh and healthy. The only downside is that it's super small, so I bet it's hard to get a table during dinnertime.",5.0
"This place is so, so good. An amazing brunch spot! The hummus is perfect (and I am incredibly picky about hummus), the pita is great, the shakshuka is delicious.",4.0
"I chose to return to Mimi's for my 2011 birthday celebration and it remains one of my favourite Middle Eastern dining choices. It's a small little space, but the ambiance is intimate and cozy. Things can definitely get crowded in here at peak times but the little Brooklyn food store next door is a great place to wait. My go-to items here: the tahini hummus - so creamy, so satisfying. The cauliflower salad is not to be missed and the eggplant caviar is divine. They were out of it for my bday dinner, so I went with the tabouli. Very fresh, lemony, crisp. Healthy, delicious, authentic.",5.0
"Loved it ! Absolutely in LOVE !I had to commute an hour from Queens and my trip was totally worth it because the food we had was phenomenal!The hummus with mushroom was so creamy and so flavorful, and the pita breads, so soft and fluffy! And the beef sandwich was spectacular as well!I am willing to travel all the way to Brooklyn just for the food from there, so will definitely go again!Also, the service was good too.. The place was so quaint and homely :) A very pleasant experience!",4.0
Amazing food. Must try the hummus however they have plenty of other great dishes. The small plate salads are also really good. Furthermore really warm atmosphere and the staff is very friendly. Definitely recommend this place.,5.0
can't believe I had never heard of this place. it is excellent. some of the best food I've had in a while.,5.0
"It's ok. A bit expensive, but food wise it's all there. Nothing to fuss about though.",4.0
"This place is tiny! I like how you can see into the kitchen and everything they are preparing. Our waitress was so sweet and attentive and knowledgeable about the dishes. I tried the cauliflower salad (meh, I don't like cauliflower and expected Mimi's to somehow make it palatable but it still isn't), grape leaves (bite sized and delicious), standard and meat hummus (very good and the warm wheat pitas make it even better) and the cheese dip (my favorite). We used a Blackboard coupon and even though Mimi's is very affordable, it made it an extra good deal. A very yummy option for lunch or dinner in this 'hood. I only with the pepper stuffed with lamb was available or this lamb pie that the other reviewers were talking about... guess they were out of lamb even though it was early in the night.",4.0
"This is my go-to spot for brunch with a friend. The food is great and unique and always spot on in quality.The downside is how tiny it is (which, they do the best they can with what they have) but more so the issues with waiting staff. They tend to just forget about you and it can be a real struggle to get them to your table (which is bizarre given how tiny the place is). I may well have just run into a few new folks when I've gone so focus more on the food portion of this review and let your own experience write it self.",4.0
Great hummus. Great food. The only things that keeps me from giving it a fifth star is it's lack of falafel.,4.0
"I went to this place for lunch today and it was so refreshing on a hot, muggy day! The waitress quickly told us the beer special, which my friend jumped on, and I had a Lagunitas Pale Ale. We then shared their traditional hummus, cauliflower salad, and grape leaves. Everything was delicious! I loved that they had both whole wheat and white pitas, and their pickled veggies were.to.die.for! It's the perfect little lunch place, and is super fresh and healthy. The only downside is that it's super small, so I bet it's hard to get a table during dinnertime.",5.0
"This place is so, so good. An amazing brunch spot! The hummus is perfect (and I am incredibly picky about hummus), the pita is great, the shakshuka is delicious.",4.0
"I chose to return to Mimi's for my 2011 birthday celebration and it remains one of my favourite Middle Eastern dining choices. It's a small little space, but the ambiance is intimate and cozy. Things can definitely get crowded in here at peak times but the little Brooklyn food store next door is a great place to wait. My go-to items here: the tahini hummus - so creamy, so satisfying. The cauliflower salad is not to be missed and the eggplant caviar is divine. They were out of it for my bday dinner, so I went with the tabouli. Very fresh, lemony, crisp. Healthy, delicious, authentic.",5.0
"Loved it ! Absolutely in LOVE !I had to commute an hour from Queens and my trip was totally worth it because the food we had was phenomenal!The hummus with mushroom was so creamy and so flavorful, and the pita breads, so soft and fluffy! And the beef sandwich was spectacular as well!I am willing to travel all the way to Brooklyn just for the food from there, so will definitely go again!Also, the service was good too.. The place was so quaint and homely :) A very pleasant experience!",4.0
Amazing food. Must try the hummus however they have plenty of other great dishes. The small plate salads are also really good. Furthermore really warm atmosphere and the staff is very friendly. Definitely recommend this place.,5.0
"I had never heard of shakshuka until Mimi's Hummus (or as I lovingly refer to it, Himi's Mummus...try saying it, you know u like it) and now my mate and I are big shakshuka fans. Shakshuka at mimi's is like a tomato-y stew with eggs. It comes with a little side Israeli salad (diced tomatoes, cucumbers, red onions). The hummus here is also delicious, creamy and fresh. The pita bread is soft, thick, fluffy, and warm. The kind of bread my dreams are made of, if you really want to know.This place is very small, but the wait has never been that bad when I've come in. Get yourself some Mimi's.",5.0
"What can I say, the hummus is off the chain. This tiny hole in the wall serves excellent food.",5.0
My new favorite. This place is amazing. The food is so delicious and everything has the perfect flavor. I hope they never change a thing. We got the filo which was so tasty and the shakshuka was perfect. Fresh tomatoes were cooked perfectly and the whole warm wheat pita tasted like it was baked that hour. We also go the cauliflower salad which was a treat. I dont know who thought of putting it in tahini but he/she is a genius. I cant wait to go back and try everything on the menu. The place is pretty small (around 5 tables) but its cute and looks really clean. A+!,5.0
"Loved it.  Highly recommended. Great hummus, perfect labane (perfect!), really tasty salads (tried the cauliflower salad and the beet)...  but rather than going into details about these items, I want to focus your attention on one thing: chocolate balls.  You would be doing yourself a disservice if you came here and did not finish off your meal with a serving of these tasty balls.  Order them.  Eat them.  Eat these tender, chewy balls.  They will not disappoint you.  Maybe, in your life, at some point, you have been disappointed by balls, either yours or someone else's?  If so, you should make it a point to try these balls, for they will restore your faith.  In balls.  Chocolate balls.  Eat them.  Order some to takeaway and share them with your family.  Give your kids some balls to eat.  Your parents.  Your neighbors.(One note, for Mimi: Mimi, please change your menu to use grass-fed or free-range meat.  Pretty please?)",4.0
One of the best humus i had. I leave 4 stars and not 5 because the place needs more ventillation in order not to have the kitchen smells while eating.,4.0
Delish and creamy hummus. Don't hesitate!,4.0
"Terrific food, small but cozy space and friendly staff. I love the mushroom hummus.  They always have new and unique specials, as well as a rotating beer and wine.  As others have mentioned: please don't go here.  I want to get a seat without waiting!",5.0
