"This is a tiny, cosy little spot, but you're in luck if you manage to snag a table. I think by now I've had everything on the menu and it's all been delicious. My dad loves to eat out, but always wants something healthy, so this is his favorite spot when he comes to visit. Not a lot of places on Corteyou serve dessert (which causes me much heartache), but this is the sort of the place where you should just order all the options and split it. The service is always good, since the staff is always within 20 feet of you, so it's not like they're going to forget about your table.",5.0
"Wanted this place to be my Ditmas Park go to comfy neighborhood spot but alas. Experience was uneven.Opted for the dinner tasting menu. Delicious & lively Carrot Salad was easily the best thing we had, sadly the size of a tea-cup saucer. Disappointing & mushy Lamb Pie was texturally un-appealing, sadly the size of Fido's doggie-bowl.The Hummus was most tasty. Yet despite dipping pita like it was a ladle had to keep reordering, at a dollar per, it's just annoying. Shouldn't be hard to send out corresponding amounts. Dessert was an odd 1 mini-choco/coconut doughnut. Tasty but again 1 bite morsel.Considering as well the sparsity and density of the interior, stiff bistro chairs the open kitchen 20 feet away, it's not really an ambiance to wanna relax in. But yet the bill would reflect you had a more substantial evening at $30/per when you get an entree and shared hummus/small plates. All things considered, mostly tasty but pricey for the experience and small plates of largely vegetables and beans.",2.0
"Recently (last weekend) I brought a friend visiting from out of town to MiMi's and I must say, the visit was pretty awful. The service was slow moving as molasses, and when I got my dish (beef kebab with herbed rice) I was rewarded with crunchy, undercooked rice. The waitress quickly amended this issue but, c'mon...undercooked rice?!?My friend had the shawarma and was fairly underwhelmed with the seasoning level of the dish. I think the sweet spot for Mimi's is the shashuka, which I've had before (with similarly slow service) and was completely delicious.",2.0
"Cute place, fresh delish food, friendly service - what else can you ask for!? Try their humus and other dips, everything is really good here. The place is pretty small, so it wouldn't work for a large parties.",4.0
"The food was nothing less than amazing. Interesting spices. Generous portions. It was so unbelievably delicious. It's a homey little hole in the wall. We just happened upon it, but really glad we did.",5.0
"After reading the superb Yelp reviews aided by NY Magazine's glowing one I expected more. I had their signature dish, the basic hummus. It was good, not great. Had a lemony buzz to it, but none of the smokiness that defines great hummus. In fact, the hummus I buy at Sahadi's is much better. However, it's a cute little place, the waitress was very nice and I'd return to try other things. Nice to know its there.What's shocking is how this stretch of Cortelyou Rd. has become developed, i.e. gentrified, with bars, cafes and chi chi little joints. Probably out of the reach of the majority of the working class residents on the poorer side of the street.",3.0
"I love this place.  The food is consistently great and the waitresses are the friendliest in town.  Some of my favorite things to get are the mushroom hummus, labne, shakshuka, chicken w/couscous, and kebab.  The only way you'll be disappointed is if you can't get a seat because space is limited.",5.0
I've now had brunch and dinner here and I think Mimi's has been cemented as a neighborhood favorite for me. The flavors of the food are just awesome. I had the Iraqi breakfast brunch dish today and it was an arrangement of simple ingredients with varied textures and flavors to great effect. Fresh pitas are puffy and delicious. Space is cute and the seating arrangement is good- they fit a good amount of people in a small space without feeling like communal tables. Will be back!,5.0
Just got the hummus with mushrooms. SO GOOD. I went thought a pretty extensive cheap hummus phase in college as a broke vegetarian so I though I was done with the mashed chickpeas for good. Then somehow I got a craving and got Mimi's. I forgot hummus could be so DELICIOUS. Bonus points to buy this and take it to Sycamore bar across the street!,4.0
"Just a good simple middle eastern food place. The limited seating makes for a good atmosphere with great service. Our waiter Noura, took very good care of us; being highly attentive and informed, yet not overbearing. Cauliflower salad and green shakshuka are both musts. Also there's always a great selection of beer from the shop next-door that they bring to your table. And on top of that, your receipt here gives you a discount there, huge steal. I highly recommend it for putting together a small picnic to take out and bring to the park.",4.0
"Visited with a friend and her small child,  under 3. Our waitress was very friendly.  However,  I sensed some animosity between her and what seemed to be her (rather rude) boss. The 'boss' had a very unattractive air about her and screwed up her face just as I was about to ask her something. Not sure what her problem was and the attitude was unbecoming. Starters of hummus and pita were quite good. Cauliflower salad was tasty.  My main was rather lacking.  I ordered salmon,  very bland and the Freekeh was actually the worst thing I have tasted in a long time. Tasted fermented and was totally unpalatable.  I'm usually pretty good at eating things that aren't to my taste but I wanted to gag. The nice waitress saw my bleek face and offered couscous instead. 100 times better. We asked for the check and were told their machine wasn't working so had to scramble together cash (they could have mentioned it earlier!) The check came... and the total wasn't added up. Very strange. We paid and left. I won't be going back. Nice waitress gets 4/5. The rest 2/5. It's quite stuffy in there.",2.0
"Best hummus in NYC, by far. I love this place. Everything on the menu is excellent. Get the mushroom hummus and the cauliflower salad. The beets are pretty fantastic too... Hell, it's all good. Just order everything.",5.0
"Pros: -Food was great. My partner is a carnivore, I'm a vegetarian, & I don't think we've ever eaten at a place that had an equal amount of (good) options for both of us. -The ambience was really lovely. Great tunes (Aaliyah, old Alicia Keys), lighting, etc.Cons:-service was eh. We were asked to get up in the middle of our meal and move to a different table to accommodate a table of four. Not the end of the world, but when we were like, ""no problem, can we have the two-top by the window?"" (which was empty) we got some attitude from the waitress about it needing to be bussed, etc. Just to be clear: we were already eating, and were asked to get up and move (which we were totally nice about), and then got some weird flack for wanting to choose which table we relocated to. It was kind of bizarre.Moral: will definitely go back, hopefully when the waitress will be in a better mood.",4.0
"I ordered lunch from Mimi's today. Mimi you let me down ;'{I live and work in the neighborhood. I always pass Mimi's but never went there to eat since it's kind of small inside and I don't like being super close to other people when I'm trying to inhale mah food. Service: Audrey was pleasant. Food: UGH. WAHHHH ;( I've looked at their menu countless times... and their pictures (cuz i'm a creep) and I decided to order the beef sandwich lunch special with cauliflower salad and a lavender lemonade (total $16.33 w tax)BEEF SANDY: i don't know. I just don't. SO BLAND. Maybe i'm spoiled because im used to eating seasoned  ETHNIC food. This is a Mediterranean restaurant, right? ~Hummus spread : tasted like nothing. so bland. The sabra hummus from the supermarket has a better taste. ~ Pan fried eggplant : BLAND~ Beef: BLAND ~ The pine nuts were overkill. ~ KUDOS for the  raw red onions, outstanding LMAO. ---- The Beef sandwich was dripping with oil, had absolutely NO flavor. The only thing i could taste was the red onion. It was like eating something but you don't even know what it is because you can't identify any one flavor because IT HAD NO FLAVOR. CAULIFLOWER SALAD: very tasty. I would order this again. LAVENDER LEMONADE: it was alright. Mimi, you hurt me. You really did. Not only was your food overpriced, but it didn't showcase any flavors AT ALL. I've visited Morocco and their cheapest, low grade sandwiches taste a million times better than what I had from MiMi's -- because it ACTUALLY TASTED LIKE SOMETHING.If you want decent Mediterranean food  - there are many places on Coney Island Avenue that serve delicious, FLAVORFUL, authentic dishes. I might return. Only to try the Shakshuka tho ... bcuz i like eggs.",2.0
"The food was nothing less than amazing. Interesting spices. Generous portions. It was so unbelievably delicious. It's a homey little hole in the wall. We just happened upon it, but really glad we did.",5.0
"After reading the superb Yelp reviews aided by NY Magazine's glowing one I expected more. I had their signature dish, the basic hummus. It was good, not great. Had a lemony buzz to it, but none of the smokiness that defines great hummus. In fact, the hummus I buy at Sahadi's is much better. However, it's a cute little place, the waitress was very nice and I'd return to try other things. Nice to know its there.What's shocking is how this stretch of Cortelyou Rd. has become developed, i.e. gentrified, with bars, cafes and chi chi little joints. Probably out of the reach of the majority of the working class residents on the poorer side of the street.",3.0
"I love this place.  The food is consistently great and the waitresses are the friendliest in town.  Some of my favorite things to get are the mushroom hummus, labne, shakshuka, chicken w/couscous, and kebab.  The only way you'll be disappointed is if you can't get a seat because space is limited.",5.0
I've now had brunch and dinner here and I think Mimi's has been cemented as a neighborhood favorite for me. The flavors of the food are just awesome. I had the Iraqi breakfast brunch dish today and it was an arrangement of simple ingredients with varied textures and flavors to great effect. Fresh pitas are puffy and delicious. Space is cute and the seating arrangement is good- they fit a good amount of people in a small space without feeling like communal tables. Will be back!,5.0
Just got the hummus with mushrooms. SO GOOD. I went thought a pretty extensive cheap hummus phase in college as a broke vegetarian so I though I was done with the mashed chickpeas for good. Then somehow I got a craving and got Mimi's. I forgot hummus could be so DELICIOUS. Bonus points to buy this and take it to Sycamore bar across the street!,4.0
"Just a good simple middle eastern food place. The limited seating makes for a good atmosphere with great service. Our waiter Noura, took very good care of us; being highly attentive and informed, yet not overbearing. Cauliflower salad and green shakshuka are both musts. Also there's always a great selection of beer from the shop next-door that they bring to your table. And on top of that, your receipt here gives you a discount there, huge steal. I highly recommend it for putting together a small picnic to take out and bring to the park.",4.0
"Visited with a friend and her small child,  under 3. Our waitress was very friendly.  However,  I sensed some animosity between her and what seemed to be her (rather rude) boss. The 'boss' had a very unattractive air about her and screwed up her face just as I was about to ask her something. Not sure what her problem was and the attitude was unbecoming. Starters of hummus and pita were quite good. Cauliflower salad was tasty.  My main was rather lacking.  I ordered salmon,  very bland and the Freekeh was actually the worst thing I have tasted in a long time. Tasted fermented and was totally unpalatable.  I'm usually pretty good at eating things that aren't to my taste but I wanted to gag. The nice waitress saw my bleek face and offered couscous instead. 100 times better. We asked for the check and were told their machine wasn't working so had to scramble together cash (they could have mentioned it earlier!) The check came... and the total wasn't added up. Very strange. We paid and left. I won't be going back. Nice waitress gets 4/5. The rest 2/5. It's quite stuffy in there.",2.0
"Best hummus in NYC, by far. I love this place. Everything on the menu is excellent. Get the mushroom hummus and the cauliflower salad. The beets are pretty fantastic too... Hell, it's all good. Just order everything.",5.0
"Pros: -Food was great. My partner is a carnivore, I'm a vegetarian, & I don't think we've ever eaten at a place that had an equal amount of (good) options for both of us. -The ambience was really lovely. Great tunes (Aaliyah, old Alicia Keys), lighting, etc.Cons:-service was eh. We were asked to get up in the middle of our meal and move to a different table to accommodate a table of four. Not the end of the world, but when we were like, ""no problem, can we have the two-top by the window?"" (which was empty) we got some attitude from the waitress about it needing to be bussed, etc. Just to be clear: we were already eating, and were asked to get up and move (which we were totally nice about), and then got some weird flack for wanting to choose which table we relocated to. It was kind of bizarre.Moral: will definitely go back, hopefully when the waitress will be in a better mood.",4.0
"I ordered lunch from Mimi's today. Mimi you let me down ;'{I live and work in the neighborhood. I always pass Mimi's but never went there to eat since it's kind of small inside and I don't like being super close to other people when I'm trying to inhale mah food. Service: Audrey was pleasant. Food: UGH. WAHHHH ;( I've looked at their menu countless times... and their pictures (cuz i'm a creep) and I decided to order the beef sandwich lunch special with cauliflower salad and a lavender lemonade (total $16.33 w tax)BEEF SANDY: i don't know. I just don't. SO BLAND. Maybe i'm spoiled because im used to eating seasoned  ETHNIC food. This is a Mediterranean restaurant, right? ~Hummus spread : tasted like nothing. so bland. The sabra hummus from the supermarket has a better taste. ~ Pan fried eggplant : BLAND~ Beef: BLAND ~ The pine nuts were overkill. ~ KUDOS for the  raw red onions, outstanding LMAO. ---- The Beef sandwich was dripping with oil, had absolutely NO flavor. The only thing i could taste was the red onion. It was like eating something but you don't even know what it is because you can't identify any one flavor because IT HAD NO FLAVOR. CAULIFLOWER SALAD: very tasty. I would order this again. LAVENDER LEMONADE: it was alright. Mimi, you hurt me. You really did. Not only was your food overpriced, but it didn't showcase any flavors AT ALL. I've visited Morocco and their cheapest, low grade sandwiches taste a million times better than what I had from MiMi's -- because it ACTUALLY TASTED LIKE SOMETHING.If you want decent Mediterranean food  - there are many places on Coney Island Avenue that serve delicious, FLAVORFUL, authentic dishes. I might return. Only to try the Shakshuka tho ... bcuz i like eggs.",2.0
"Lovely experience here at this homey spot. 7 tables and it's a right squeeze. So, come early or late so you don't have to wait.Started with the chickpea hummus and cauliflower salad- both terrific and just about full- especially after the pita. Entrees- lamb stuffed peppers and shakshuka- both very tasty- but we were so full that we just shoveled the food in our mouth. Dessert- milk pudding with grapefruit and pistachios- spectacularThis chef definitely has a nice touch. Good service and cozy ambience. Will def be back for sure!",5.0
"Finally made it here and so glad I did. Food was fantastic. We got cauliflower salad, mushroom hummus and a meat entree. Everything tasted perfect and the quality was fresh. Service was spot on and very attentive but not overwhelming. They have a decent beer and wine selection. Perfect neighborhood spot for dinner. Will be back for brunch.",5.0
"I loved this spot. Small and intimate, with awesome food that isn't a budget drain. The vibe is what stays with me most, a place where you want to go and talk and eat and hang.",5.0
"Love the shakshuka and israeli salad.  Mimi does a great job of bringing authentic Israeli food to the neighborhood.  Ofcourse, it helps that she is Israeli.",5.0
"Mimi's Hummus is a really great and reasonably priced place to get delicious Middle Eastern food.  There aren't too many places in the area that serve hummus this good.  It's a very small and quaint space, so I don't recommend going with a large group.  Service was great and our server was very friendly and attentive.  We started out with the tahini hummus which was amazing!  I could have eaten that alone.  Next, I had the chicken couscous which came with chicken patties, couscous, zucchini, and asparagus.  The vegetables were so fresh and perfectly seasoned.  I didn't get to try anything on the dessert menu, but everything sounded amazing.  I'll definitely be back!",4.0
"Everything was pretty good that was served to my group, but the most important item on the menu, the hummus...was nothing more than lackluster. I seriously have made a better hummus.The shakshuka, beef stuffed in filo, and chicken platter all had proper seasoning and tasted pretty darn good...but the portions were small. Its funny that a place on cortelyou is trying to portion food for yuppies, seeing the demographics. Our server was nice on the exterior, but extremely phoney. One could spot out that she wasn't a happy person who was only looking to push expensive food on our group. It left an awful aura on the meal experience.Would I go back...No.",2.0
"Nice small joint in ditmas park, very cozy. We had the mushroom hummus which was really good, Mujaddara (interesting also good), and Shaksuka (nice and light without the sausage). I'm vegetarian BTW. Also friendly service.",4.0
"A cute little place with plain but interesting decor. The food was good but a little over priced.  The waitress was very friendly but the service was extremely slow. We were the only ones in there, we really did not expect to wait for a simple chicken gyro plate. It was definitely interesting to visit and see what the hype is all about. The food was good, but it really did not remind me of middle eastern cuisine. It was more of a glorified healthier version of the gyro food trucks you see on Cortelyou Rd. I am glad I experienced it, but I would not come back.",3.0
"Enroute to visiting Ditmas Park, a friend suggested Mimi's for brunch. Actually - it was more like he commanded us to go to Mimi's for brunch. Never ones to turn down a strong recommendation, Mimi's was our first stop.We started with Stumptown coffee and told our waitress that we were to share all the plates between the two of us - which was a plentiful amount for a hungry couple. Cauliflower salad was ordered and brought out first along with Israeli salad and spicy pickled veggies for our green Shasuka. The ""green"" coming from Swiss chard. Unlike the more traditional Shasuka, aside from the chard, this one was also topped with goat cheese. The yogurt based cauliflower salad was cold and refreshing alongside the Shasuka, which was hearty.When at Mimi's hummus, it would be in bad taste to leave without sampling the hummus (duh). We opted for the mushroom style which was topped with a mushroom stew. The hummus at Mimi's is a traditional base (chick peas) and is just as creamy as promised. The topping is what sets each option apart. I can see why Refinery 29 said this was a top notch spot for a NYC brunch. This was waaaaaay better than the trendy Mediteranian brunch I had in soho recently. Worth the trip down Courtelyou.",5.0
"Needed to grab some quick to go food before heading to Penn Station and decided to pick a tabouleh and some grape leaves from Mimi's. While not necessarily super cheap, the food was really good!!Would be back.",4.0
"Lovely experience here at this homey spot. 7 tables and it's a right squeeze. So, come early or late so you don't have to wait.Started with the chickpea hummus and cauliflower salad- both terrific and just about full- especially after the pita. Entrees- lamb stuffed peppers and shakshuka- both very tasty- but we were so full that we just shoveled the food in our mouth. Dessert- milk pudding with grapefruit and pistachios- spectacularThis chef definitely has a nice touch. Good service and cozy ambience. Will def be back for sure!",5.0
"Finally made it here and so glad I did. Food was fantastic. We got cauliflower salad, mushroom hummus and a meat entree. Everything tasted perfect and the quality was fresh. Service was spot on and very attentive but not overwhelming. They have a decent beer and wine selection. Perfect neighborhood spot for dinner. Will be back for brunch.",5.0
"I loved this spot. Small and intimate, with awesome food that isn't a budget drain. The vibe is what stays with me most, a place where you want to go and talk and eat and hang.",5.0
"Love the shakshuka and israeli salad.  Mimi does a great job of bringing authentic Israeli food to the neighborhood.  Ofcourse, it helps that she is Israeli.",5.0
"Mimi's Hummus is a really great and reasonably priced place to get delicious Middle Eastern food.  There aren't too many places in the area that serve hummus this good.  It's a very small and quaint space, so I don't recommend going with a large group.  Service was great and our server was very friendly and attentive.  We started out with the tahini hummus which was amazing!  I could have eaten that alone.  Next, I had the chicken couscous which came with chicken patties, couscous, zucchini, and asparagus.  The vegetables were so fresh and perfectly seasoned.  I didn't get to try anything on the dessert menu, but everything sounded amazing.  I'll definitely be back!",4.0
"Everything was pretty good that was served to my group, but the most important item on the menu, the hummus...was nothing more than lackluster. I seriously have made a better hummus.The shakshuka, beef stuffed in filo, and chicken platter all had proper seasoning and tasted pretty darn good...but the portions were small. Its funny that a place on cortelyou is trying to portion food for yuppies, seeing the demographics. Our server was nice on the exterior, but extremely phoney. One could spot out that she wasn't a happy person who was only looking to push expensive food on our group. It left an awful aura on the meal experience.Would I go back...No.",2.0
"Nice small joint in ditmas park, very cozy. We had the mushroom hummus which was really good, Mujaddara (interesting also good), and Shaksuka (nice and light without the sausage). I'm vegetarian BTW. Also friendly service.",4.0
"A cute little place with plain but interesting decor. The food was good but a little over priced.  The waitress was very friendly but the service was extremely slow. We were the only ones in there, we really did not expect to wait for a simple chicken gyro plate. It was definitely interesting to visit and see what the hype is all about. The food was good, but it really did not remind me of middle eastern cuisine. It was more of a glorified healthier version of the gyro food trucks you see on Cortelyou Rd. I am glad I experienced it, but I would not come back.",3.0
"Enroute to visiting Ditmas Park, a friend suggested Mimi's for brunch. Actually - it was more like he commanded us to go to Mimi's for brunch. Never ones to turn down a strong recommendation, Mimi's was our first stop.We started with Stumptown coffee and told our waitress that we were to share all the plates between the two of us - which was a plentiful amount for a hungry couple. Cauliflower salad was ordered and brought out first along with Israeli salad and spicy pickled veggies for our green Shasuka. The ""green"" coming from Swiss chard. Unlike the more traditional Shasuka, aside from the chard, this one was also topped with goat cheese. The yogurt based cauliflower salad was cold and refreshing alongside the Shasuka, which was hearty.When at Mimi's hummus, it would be in bad taste to leave without sampling the hummus (duh). We opted for the mushroom style which was topped with a mushroom stew. The hummus at Mimi's is a traditional base (chick peas) and is just as creamy as promised. The topping is what sets each option apart. I can see why Refinery 29 said this was a top notch spot for a NYC brunch. This was waaaaaay better than the trendy Mediteranian brunch I had in soho recently. Worth the trip down Courtelyou.",5.0
"Needed to grab some quick to go food before heading to Penn Station and decided to pick a tabouleh and some grape leaves from Mimi's. While not necessarily super cheap, the food was really good!!Would be back.",4.0
"So happy this place has opened in the 'hood! Ordered a delivery of mushroom hummus, beet salad and cauliflower salad. Loved the hummus: the consistency was light and creamy, and the mushrooms were yummy as well. The salad part had a bit unusual flavor for my palate, but I still found it enjoyable. The most exciting part is that all dishes are so healthy.The courtesy and professionalism of the staff must be noted as well: it's nice that they care.",5.0
