"I've read some great reviews about this place so I was pretty excited to try it out with my family. Unfortunately, it did not turn out as I had hoped. The place was extremely small with 3 people manning the tables. I felt very unwelcomed and awkward here. The wait staff completely ignored our table, serving other tables (people who came in after us) with water and bread before us. I understand you have ""regulars,"" but try not to ignore the new customers because i definitely will not be coming back. I don't want to see waiters showing customers pictures on their phone or family disputes in front of customers . What I wanted to see were waiters who would refill my water instead of ignoring the empty cups on our table and some sort of answer for waiting over an hour for our dishes to be served. I understand that this is an ""authentic"" restaurant and that everything is made to order, but when we asked what was taking so long, do not blame the customers that we ordered complicated dishes. I understand that each pasta dish has its own sauce, but after seeing multiple dishes being served to other tables (who were seated after us) I don't really believe it was because ours was more complicated. And they definitely shouldn't tell customers that we should have came earlier if we wanted food before 9. Not once did our waiter check up on us or update us on what was taking so long with our food. Actually they never really apologized for the wait. They just repeated the same line, ""everything is made to order and to be patient."" I think waiting over an hour is being pretty patient.We waited an hour and 45 minutes before our dinner was served. I don't even know why we waited this long. The waiter claimed that the ""wait would be worth it"" and I have to be honest, I didn't find the wait worth it. The dishes seemed to be rushed. The pasta was undercooked in one of the dishes, the chicken was dry and I found nothing special about any of the sauces that went with the pasta. Although I wasn't wowed with the main dishes, the calamari was pretty good. I've been to plenty of other authentic Italian restaurants and I have never been treated so rudely as this restaurant. The service we received was insulting. We shouldn't have to be ""regulars"" to get good service. I will definitely not be coming back here.",1.0
"I was there twice, and both of time I felt myself like I'm asking food for free ) I can understand that waiters are old and they were very slow, but it's not a reason to be rude with customers. I ordered pasta to take out, women on the phone told me that they will call me when it's ready, coz I live just few steps away from this place, after one hour I called back to ask if my pasta is ready, they hang up with no answer ) ok, I thought, they might be very busy and may be they going to call me, but after another half hour I couldn't wait anymore and I walked in, my pasta which I ordered one and half hour before WASN'T READY! Because they said it's almost ready, I decided to stay in restaurant. Waiters was soooooooooo slow, sooooooo rude for answers, they didn't even want to show me where I can have a seat. I had my pasta, homemade red wine, desert and couple tea with lemon. When I said that I want tea with lemon, waiter who was serving me said that I have to ask another waiter for tea, coz HE DOESN'T MAKE TEA! For every order they spent another half hour. If you don't want to wait soooooo long, you have to know what to order before you go there, and after you had table order everything in the beginning ) I wanted to finish everything fast and run from this place as fast as I can. I felt myself like I was an unwanted guest and it was a ""message"" that says DO NOT GO THERE NEVER EVER!!!!!",1.0
"I love this place. It's very small and quaint. The food is huge and delicious. The cold antipasto salad is so good. There homemade salad dressing amazing it is a must. Chicken parm is huge, you can't possibly finish it. There vodka sauce is delicious. Everything in this place is really good.",5.0
Been coming here for 6 years. The best is the fish salad. Filling and delicious. Don't expect a quick dining experience. Come here ready to talk with the person you came with. Great for dates!  Big portions.,5.0
"Two stars for decent food. Went for dinner for the first time to celebrate friends bday. Grew up in the neighborhood and have never been plus yelp has good reviews also many commenting on the large portions. We go in and are seated immediately to the left of the door next to an old school telephone that kept ringing for the entire 1 and half hr that we sat there waiting for bread to be served to us. (Waiter took our order impatiently) so back to ordering. There's a sign that says $5 cover charge for shared entrees. That was fine. So we order an appetizer and an entree it was just two grls how much could we possibly eat? and waiter says to us, ""you can't share entrees"" I pointed to the sign. He says ""let me ask"". He comes back and points to the bottom of the menu where it says no sharing for dinner.  Since when do you dictate what customers order???",2.0
"I lived around the corner from Ortobello for six years, seen the crowd it attracts, and never tried until recently.  The place is a hole in the wall with 1970s decor - mirrors and that pressed board made to look like white stone, and tacky hand written signs all over the walls.After two visits I can safely say NEVER AGAIN!  It was crowded the night of our first visit. we were seated and waited about 15+ minutes for water and menus, and another 15+ minutes for drinks.  From the moment we came in the waiters and hostess kept apologizing about the delay.   We waited well over an hour for our meal.  The food was just ok, nothing exceptional.   My friend actually didn't care for his Penne Vodka and barely touched it.  We gave Ortobello a second chance one night when it was not busy.  Still the excruciating wait for food and the apologies.  I ordered a veal chop medium, it was huge and tasty but raw near the bone.  I expect better for $44.  My attorney is old school Brooklyn Italian and recently asked me about  ""that place on your corner.""  He told me that people raved about it for years, they finally tried it and the food was nothing special.  And of course, a long wait!  I don't know what the attraction is, maybe something about coming back into the old neighborhood.  Not for me.",1.0
"Another 2.5-3 star Italian Restaurant. I really had high hopes regarding this place being a hidden gem after the talking up I got from my sister and her boyfriend. Unfortunately, my expectations fell far short of reality. The food was okay, the service okay, and the decor/atmosphere pleasant/cozy. A place certainly fitting for a date except the mediocre food. Compared to the other Italian restaurants that I have been to, this was a disappointment. I will not be coming back. My recommendation: come here for your neighborhood Italian restaurant if your from the area and don't want to leave but there are better elsewhere.",2.0
A friend took me here for the first time last year.  I have returned many many times and I am never disappointed.  Don't go here for the ambiance ....go for the old style Italian food.  The dishes are not cheap but the servings are huge and I usually have food leftover.  Feel free to share so you can taste a variety of delicious items from the massive menu.,5.0
"It is very close to authentic homemade italian food. The way that you are served is very traditional in italian culture where you get the appetizer and then you get soup or salad and then you get your main course with a side and finally a dessert (if you do the special) BUT you have plenty of time in between courses to talk and just sit around (so you dont get all your food at once and you dont get it back to back either). Its a small place but its very nice.I had stuffed mushrooms, which were fantastic, salad, which was good, ziti, which was pretty good and chicken marsala which was filling and yummy. The portions are big (their steaks are bigger than a baby) and its yummy. Upsides: good taste, good portions, friendly serviceDownsides: not good for groups, not good if you want a quick bite because it takes quite a while I would recommend eating here.",4.0
"Man, I must have passed Ortobello over a thousand times in my time in Brooklyn and never thought much of it until I got a recommendation from a friend. This place is a no-frills real old school Italian place. It's got a good feel to it, and that's part of what I love about it. It's not modern, and certainly not trying to be. It just is what it is. Lets the negatives out of the way : The menu is unoriginal and fairly straight to the point. You won't find any curveballs. Also, no credit cards accepted as of fairly recently. That kind of detracts from the experience as many of us get points for dining. But again, if I want to go here that won't stop me. Orrechette abbruzesse was very good, sometimes I  find that if the quality of the sausage isnt quite up to snuff the whole dish suffers, but that wasn't the case here. It came together really well. Also the chicken piccata was one of the best I've had, but granted that's a hard dish to mess up. Watch out for one factor though...the portions are excessively large. And there is some cardinal rule about sharing that they have written on the menu if I'm not mistaken. So expect to have some extra lunch for work the next day. In a city of the up and coming Italian places trying so hard to be trendy and hip (and failing), it's good to have a place that has a real vibe and some real good food.",4.0
"I've read some great reviews about this place so I was pretty excited to try it out with my family. Unfortunately, it did not turn out as I had hoped. The place was extremely small with 3 people manning the tables. I felt very unwelcomed and awkward here. The wait staff completely ignored our table, serving other tables (people who came in after us) with water and bread before us. I understand you have ""regulars,"" but try not to ignore the new customers because i definitely will not be coming back. I don't want to see waiters showing customers pictures on their phone or family disputes in front of customers . What I wanted to see were waiters who would refill my water instead of ignoring the empty cups on our table and some sort of answer for waiting over an hour for our dishes to be served. I understand that this is an ""authentic"" restaurant and that everything is made to order, but when we asked what was taking so long, do not blame the customers that we ordered complicated dishes. I understand that each pasta dish has its own sauce, but after seeing multiple dishes being served to other tables (who were seated after us) I don't really believe it was because ours was more complicated. And they definitely shouldn't tell customers that we should have came earlier if we wanted food before 9. Not once did our waiter check up on us or update us on what was taking so long with our food. Actually they never really apologized for the wait. They just repeated the same line, ""everything is made to order and to be patient."" I think waiting over an hour is being pretty patient.We waited an hour and 45 minutes before our dinner was served. I don't even know why we waited this long. The waiter claimed that the ""wait would be worth it"" and I have to be honest, I didn't find the wait worth it. The dishes seemed to be rushed. The pasta was undercooked in one of the dishes, the chicken was dry and I found nothing special about any of the sauces that went with the pasta. Although I wasn't wowed with the main dishes, the calamari was pretty good. I've been to plenty of other authentic Italian restaurants and I have never been treated so rudely as this restaurant. The service we received was insulting. We shouldn't have to be ""regulars"" to get good service. I will definitely not be coming back here.",1.0
"I was there twice, and both of time I felt myself like I'm asking food for free ) I can understand that waiters are old and they were very slow, but it's not a reason to be rude with customers. I ordered pasta to take out, women on the phone told me that they will call me when it's ready, coz I live just few steps away from this place, after one hour I called back to ask if my pasta is ready, they hang up with no answer ) ok, I thought, they might be very busy and may be they going to call me, but after another half hour I couldn't wait anymore and I walked in, my pasta which I ordered one and half hour before WASN'T READY! Because they said it's almost ready, I decided to stay in restaurant. Waiters was soooooooooo slow, sooooooo rude for answers, they didn't even want to show me where I can have a seat. I had my pasta, homemade red wine, desert and couple tea with lemon. When I said that I want tea with lemon, waiter who was serving me said that I have to ask another waiter for tea, coz HE DOESN'T MAKE TEA! For every order they spent another half hour. If you don't want to wait soooooo long, you have to know what to order before you go there, and after you had table order everything in the beginning ) I wanted to finish everything fast and run from this place as fast as I can. I felt myself like I was an unwanted guest and it was a ""message"" that says DO NOT GO THERE NEVER EVER!!!!!",1.0
Ok I used to come here all the time but moved out of state so this is my first time back in a long while. The Caesar salad was fantastic as always. ( 2nd only to new corners) the dinners were hit and miss. The vodka sauce was separating as we ate it and turned into an oily mess. The beef  Braciole  was good but not worth the price ( very small serving in a place that usually goes big) I'll be back and I hope it goes back to normal. It's a real old school place and the owner is a hoot.,3.0
Just say wow to this restaurant. It looks like a diner from the outside but go in and order the food you think you were at Carmine's. The food portions are HUGE but are fantastic. The service by the husband and wife are just great. They make you feel like you are sitting at an Italian family dinner on Sunday's (anyone who has or been to one knows how much food is served).Been there 4 times in the past year and will go back many many times,5.0
I must have walked by this restaurant almost everyday going to take the subway to work. Today i decided to give it a try with my family. Of all days today was the busiest day all tables were full and we had to wait outside. Decor: when going in the restaurant it looked pretty small inside. There was properly 10 tables and the back is where all the magic happens AKA the kitchen. At first glance of the restaurant it look like a old school Italian restaurant. The inside looked old school too i was fine with it. Food: We got the Calamari which was awesome and tasty and got the baked clams and mussels was also very good and lovely. We also got the seafood Linguini which was amazing and flavorful and also had a nice texture to it. We also got the farfalla al salmone was my favorite dishes and it was packed with flavors and well seasoned.Overall the service was on point and i will be coming back here soon. i recommend getting the calamari and the farlalla al salmone. One of the best Italian restaurant i have ever ate at. So what you waiting for?,5.0
We have been looking for a great restaurant for awhile well we found it.  Ortobello is fantastic food was so good I felt like I was eating at home.  Service was great friendly.  I took my mom out for dinner they gave us so much food we could not finish it all.  I highly recommend coming here we will be back,5.0
"I found myself checking this place out recently as it is located right next to my haircut salon. I regret not checking it out earlier as it is completely amazing! I've never been in a real Italian restaurant before whose food is cooked by Italians themselves. It is a family owned business so you can expect some traditional food. During my visit there I recently was in the mood for some pasta and stake as most people on here recommend it. I expected the portions to be small, those of a fast food perhaps. I was totally mistaken; the portions were larger than expected. Surprisingly, I was pretty full as I find myself walking out hungry from most places I visit. The staff is warm hearted and treat you like family. The tables are spotless and the place itself overall is taken care of very nicely. I highly recommend checking this place out for some authentic Italian food as you will be astonished by the fresh quality of their food :)",5.0
"Ortobello is AMAZING!! The clams, the artichokes, the pasta, everything is so good! My boyfriend and I like to come here maybe just 3-4 times a year, but each time has been nothing short of exceptional. My only suggestion would be to maybe serve oil with the bread instead of butter. Other than that though, I would suggest this place to anyone who wants amazing Italian food with a charming and low-key atmosphere :)",5.0
"From the mussels marinara, baked clams,mozzarella logs (yes LOGS because they are HUGE and DELICIOUS), the stuffed artichoke, to the eggplant parmigiana , pasta primavera (my fav) to the tiramisu and cannoli, the food here is EXCELLENT!!!!! You can have a bunch of appetizers and it would be enough because the portions are a very generous size OR try any one of the many dishes that I have tried, and you will be satisfied , guaranteed to leave with a full stomach and a doggie bag of leftovers !! This is food you don't want to let go to waste ! It's a great atmosphere with the old school decor, Italian music playing in the background and you never feel rushed to leave.If you haven't been here yet, I highly recommend it !!! Buon appetito!",5.0
"Yelp reviews do not lie. This place was great, classic Italian joint. Arugula salad is delicious and tremendous, loaded with fresh arugula, crunchy tomatoes, red onion, garlic and picked vegetables and pepperocini. Stuffed artichoke was gluttonous and had a yummy broth which disappeared into the filling making for cheesy amazingness gooey crumbs, easily scooped up by their warm bread. Finally, arrabiata, perfect AL dente linguini, topped with piping hot, perfectly spicy sauce.",5.0
"4 stars for great food. The place is old looking with old wooden chairs and the upper half of wall is mirrored. The waiter may have been part asleep because he took our food to wrap and forgot to give it back to us claiming we didn't ask for 2 half full plates to be wrapped...what an idiot. Salmon farfalle was good with fresh salmon that was cooked perfect. Pasta was a bit over cooked. Order it al dente. Portions are very big and you can share with 3 ppl, at least. Chicken and shrimp portio? was great and shrimp were fresh and big...very tasty. Def check out this spot if you want to eat good with no frills.",4.0
I was definitely surprised here at this joint! I had the chicken parm and it was a huge platter which I actually couldnt finish. This place is completely no frills from the outside but inside its old school italian. The waiter was very nice but seemed to lack body awareness and kept leaning on us and was just overall not very coordinated. I would come here again for the chicken parm but if I was close by and craving.,4.0
Ok I used to come here all the time but moved out of state so this is my first time back in a long while. The Caesar salad was fantastic as always. ( 2nd only to new corners) the dinners were hit and miss. The vodka sauce was separating as we ate it and turned into an oily mess. The beef  Braciole  was good but not worth the price ( very small serving in a place that usually goes big) I'll be back and I hope it goes back to normal. It's a real old school place and the owner is a hoot.,3.0
Just say wow to this restaurant. It looks like a diner from the outside but go in and order the food you think you were at Carmine's. The food portions are HUGE but are fantastic. The service by the husband and wife are just great. They make you feel like you are sitting at an Italian family dinner on Sunday's (anyone who has or been to one knows how much food is served).Been there 4 times in the past year and will go back many many times,5.0
I must have walked by this restaurant almost everyday going to take the subway to work. Today i decided to give it a try with my family. Of all days today was the busiest day all tables were full and we had to wait outside. Decor: when going in the restaurant it looked pretty small inside. There was properly 10 tables and the back is where all the magic happens AKA the kitchen. At first glance of the restaurant it look like a old school Italian restaurant. The inside looked old school too i was fine with it. Food: We got the Calamari which was awesome and tasty and got the baked clams and mussels was also very good and lovely. We also got the seafood Linguini which was amazing and flavorful and also had a nice texture to it. We also got the farfalla al salmone was my favorite dishes and it was packed with flavors and well seasoned.Overall the service was on point and i will be coming back here soon. i recommend getting the calamari and the farlalla al salmone. One of the best Italian restaurant i have ever ate at. So what you waiting for?,5.0
We have been looking for a great restaurant for awhile well we found it.  Ortobello is fantastic food was so good I felt like I was eating at home.  Service was great friendly.  I took my mom out for dinner they gave us so much food we could not finish it all.  I highly recommend coming here we will be back,5.0
"I found myself checking this place out recently as it is located right next to my haircut salon. I regret not checking it out earlier as it is completely amazing! I've never been in a real Italian restaurant before whose food is cooked by Italians themselves. It is a family owned business so you can expect some traditional food. During my visit there I recently was in the mood for some pasta and stake as most people on here recommend it. I expected the portions to be small, those of a fast food perhaps. I was totally mistaken; the portions were larger than expected. Surprisingly, I was pretty full as I find myself walking out hungry from most places I visit. The staff is warm hearted and treat you like family. The tables are spotless and the place itself overall is taken care of very nicely. I highly recommend checking this place out for some authentic Italian food as you will be astonished by the fresh quality of their food :)",5.0
"Ortobello is AMAZING!! The clams, the artichokes, the pasta, everything is so good! My boyfriend and I like to come here maybe just 3-4 times a year, but each time has been nothing short of exceptional. My only suggestion would be to maybe serve oil with the bread instead of butter. Other than that though, I would suggest this place to anyone who wants amazing Italian food with a charming and low-key atmosphere :)",5.0
"From the mussels marinara, baked clams,mozzarella logs (yes LOGS because they are HUGE and DELICIOUS), the stuffed artichoke, to the eggplant parmigiana , pasta primavera (my fav) to the tiramisu and cannoli, the food here is EXCELLENT!!!!! You can have a bunch of appetizers and it would be enough because the portions are a very generous size OR try any one of the many dishes that I have tried, and you will be satisfied , guaranteed to leave with a full stomach and a doggie bag of leftovers !! This is food you don't want to let go to waste ! It's a great atmosphere with the old school decor, Italian music playing in the background and you never feel rushed to leave.If you haven't been here yet, I highly recommend it !!! Buon appetito!",5.0
"Yelp reviews do not lie. This place was great, classic Italian joint. Arugula salad is delicious and tremendous, loaded with fresh arugula, crunchy tomatoes, red onion, garlic and picked vegetables and pepperocini. Stuffed artichoke was gluttonous and had a yummy broth which disappeared into the filling making for cheesy amazingness gooey crumbs, easily scooped up by their warm bread. Finally, arrabiata, perfect AL dente linguini, topped with piping hot, perfectly spicy sauce.",5.0
"4 stars for great food. The place is old looking with old wooden chairs and the upper half of wall is mirrored. The waiter may have been part asleep because he took our food to wrap and forgot to give it back to us claiming we didn't ask for 2 half full plates to be wrapped...what an idiot. Salmon farfalle was good with fresh salmon that was cooked perfect. Pasta was a bit over cooked. Order it al dente. Portions are very big and you can share with 3 ppl, at least. Chicken and shrimp portio? was great and shrimp were fresh and big...very tasty. Def check out this spot if you want to eat good with no frills.",4.0
I was definitely surprised here at this joint! I had the chicken parm and it was a huge platter which I actually couldnt finish. This place is completely no frills from the outside but inside its old school italian. The waiter was very nice but seemed to lack body awareness and kept leaning on us and was just overall not very coordinated. I would come here again for the chicken parm but if I was close by and craving.,4.0
