"came here for dinner with my colleague.She recommend this spot, it's her regular family dinner spot for Italian food.I have to say this is by far the more authentic Italian place i been to and best flavor.Colleague ordered a bacon spaghetti and i had the lasagna.They were both good, pasta made fresh in the kitchen when you order!!!!  a huge +++++I do want to point out though, my lasagna was too salty, they could go light on the sauce.We have cappuccino and tiramisu for desert even though we cannot finish out big plates of food.  lol  BUT, this cup of cappuccino was the best!  yes, it was a bit heavy with wimp cream, it was a great treat. Tiramisu actually had a shot of espresso in it!  WOW!  i was shocked and amazed and grateful.  It was worth every penny.Def recommend this place and i will be back!",4.0
"Zuppa Di pesce is so good with octopus, clams, vegetableAll their noodle is so goodFried calamari i like it so much",4.0
"This seems like an authentic classic old school Italian restaurant. It's small with a homey vibe. Looks like a family run business. To start we had the mussels marinara. The portions were huge and the marinara sauce was great. We dipped the free bread that they gave us in the sauce and it was wonderful. For entrée, we had the pollo marsala, which is chicken in marsala wine sauce with mushrooms. This I wasn't a fan of. The taste was light and not a flavorful dish. But, if you prefer something light this is a good choice to get. Also ordered the tortellini bolognese. I love the bolognese sauce, which is like a minced meat and tomato sauce. The tortellini is a type of pasta stuffed with cheese. I didn't know that it had cheese filling or I would've chose something else. It wasn't the type of cheese that I like either, so it was too much cheese for me. I would've enjoyed it much more if it were a different type of pasta with no filling. And last, we had the shrimp marinara. You can't go wrong with this dish. It has big shrimps and clams in the dish. The spaghetti coated in marinara sauce was just delicious. The portions here are so big that we couldn't finish everything and had to take the leftovers to go. I highly advise you to not over order. One entrée can definitely be shared between 2 people. Even the appetizers are humongous. They accept credit cards, but tips need to be in cash. Prices are in the $20's, which is reasonable for the portions that they give.",3.0
"We made a reservation at the restaurant several days before. Upon arrival, an older, blond hostess/owner  informed us that there was no space available. When I told her we had a reservation, she told me I was lying. I found the card with the reservation information on it, and she still refused to believe that I had a reservation. We left in shock as she chased us down the street looking to start an argument.!!!!  "" Fratelli d'Italia"" Avoid this place at all costs. We went to a different restaurant, Europa, at 6423 20th avenue, where we were treated very nicely.",1.0
"I might've had my expectations set a little too high for this restaurant. I was expecting something out of this world but it was just good old Italian food. Don't get me wrong, I love Italian food but didn't think it was anything out of the ordinary.  The only dish that I absolutely loved was the seafood salad. This refreshing dish is perfect for a hot summer.  Actaully, it'll be good on any given day. It's super light and tangy. Everything else was pretty good but not jaw dropping good. Prices are fairly steep for a Brooklyn restaurant but I guess the large portion makes it worth it. I also really liked the fact that this place is run by Italians who can actually speak Italian. It feels extra authentic. I would definitely be returning to try more dishes and of course for that yummy seafood salad.",4.0
"Incredible Italian restaurant, a hidden gem hope in the wall with the best tasting food you will ever eat!  Reasonably priced, great service.",5.0
"Place seems very authentic. It's small so just keep that in mind when going there. The food is to die for! They have huge servings as you can see in the pics, so feel free to share or just come with a big appetite.",3.0
"This place is authentic. It is So authentic that when I walked in with my family...we felt like we don't belong and only the Italians should come here. Warning: they got BIG portions!!!!!Me, my wife and our two kids ordered the Mozzarella Logs, mussels in white sauce and baked clams as starters; then we had spaghetti with meat ball, seafood risotto and chicken cutlet with mozzarella cheese and salad over it..... The portions were so huge that we barely made a dent, so be mindful when you order. Let's talk food: The mozzarella logs are not your typical mozzarella sticks! These logs are HUGE! One log is probably equal to 3-4 of the regular sticks combined and a order comes with like 8-10 of them..... We each had one and packed the rest. The mussels..... I normally don't eat mussels...its my wife and daughter's thing. But these mussels were sitting in a buttery sauce loaded with garlic, fused with lemon that is simply irresistible. The baked clams.... Hmm.... Where do I begin? These are not your average Joe stuff either! Fresh clams stuffed with garlic and stuffings baked to perfection on top of garlic sauce ...did not expect this level of foods coming out of this small, old local restaurant. ---------------------------------------Main course:Spaghetti with meatball: the meatballs pack a subtle yet elegant flavor.... Not the best I have had but definitely sits in the top 5. The sauce is really what made it special. I like my spaghetti just a little hard so I felt their spaghetti was a bit over cooked and soft. Seafood risotto- OMG!!!!!! Soooo good!!!! Shrimp, mussels, octopus, abalone!!! The flavor was incredible! So delicious. All the yumminess of the seafood got soaked into the rice..... Need I say more? For $30 it is a gigantic plate!!!!! Mozzarella + salad over fried chicken cutlet was decent but nothing special, although it is good I would still say skip it and order something else. Our waiter has to be at least 60. Good, old fashioned clean service with that true local flare. Love it love it.  He came by and said ""if you guys finish all the food I buy you cheese cake on the house!"" Laughs and walks away. Hahahah. Great dinner, great service, great food. These local jewels need to stick around for at least a few more generations.",4.0
"Warning - you will wait for what feels FOREVER.... But it will be some of the best food you've ever had.. EVER! One of the closest tastes to Italy I've ever had in the states!It's a tiny restaurant on a Bensonhurst corner. Have some wine will you wait because every item is made fresh to order. You will become addicted! My personal favorites are the pasta fagoli, stuffed mushrooms, capellini primavera and farfalle al salmon. I love the feel of this restaurant. My uncle was an Italian artist and it reminds me of being in his studio. They also make awesome hero sandwiches perfect for incredible lunch takeout!",5.0
"One of my friends recommended me coming to this place for authentic Italian food. Boy was I amazed by the food here. This place is by far the  best Italian food I have had and I live in the neighborhood and I never knew about it. I wish I knew about this place earlier !The portions are huge here, just like your regular family style Italian restaurant. The waiters are also very friendly here and always checking up on you if you need anything.I don't think I wanna write any description or how good the food are because I don't want to spoil for you guys! You guys should definitely their pepper orreganto, penne vodka , bowtie pasta with salmone, and their steak. They are all excellent. The pasta sauces here are all homemade, they are very rich in flavor. Trust me, you guys will come back again like me!",5.0
"Oh dear Ortobello. Why is your food so good? If you're famished, you should skip this spot, because quality food does take a while here. However, if you manage to stay alive with the complimentary bread, then you will reap the benefits of a hearty and yummy meal. The portions are gigantic. I got the veal parm and it was bigger than my face. Their seafood linguine is ginormous! It could've feed all six of us! They don't skimp on the amount of seafood or the variety. Our seafood linguine had mussels, clams, squid, octopus, fish, and this other shell fish that I can't think of the name. When the guy brought out the dish, he even took the scenic route to make sure all the other patrons saw the dish before arriving to our table. I think most people who venture out to this part of Brooklyn will probably flood to another more notable restaurant, but wait until more discover Ortobello!",5.0
"A very cozy family run Italian restaurant. Very authentic. Foods are awesome, taste to perfection, not overly salted (for those salty eaters, you might think it's not salty enough).very big portions!!!  Aware for small eaters... Lolz.We went in as a table for 3 and ordered the Zuppa de Pesce...  OMG!! That dish can feed 5!!! Super big!!Stuffed mushrooms were good, descent size and I loved the sauce.I also ordered a Caesar salad with grilled chicken, big plate.3 orders, 3 ppl, besides the mushrooms... Everything else was pack home.Lastly... Dessert... Cappuccino with whipped cream on top drizzled with chocolate syrup!!!  OMG! Soo good! Very nice Italian spot in bensonhurst area...  Its worth a try.",4.0
"Never have I ever...1) knew this place existed in Brooklyn (even when I was parked across the street)2) regretted walking in on a Thursday night after work to eat dinner there with some friends3) questioned my friend who ordered the shrimp and chicken parmigiana          A. The chicken and shrimp parm was family                   style and some of the best parm I've had.                Ever.4) had a better mozzarella stick in my life. Ever. Breaking and mozzarella was just perfecto! Che Bella!5) tartufo tre colore (three colors aka flavors) was delicious! Tiramisu as well in addition to my cappuccino! We mangia that entire place!Family style portions, a little pricey, but my gosh who knew authentic Italian existed so close to home!",4.0
"Huge Portions! Wonderful wait staff and the floor manager for the night was super friendly. He had a pleasant smile and was great to every table and patrons. It's bare bones decor but you really come here for the food. Had nicely fried up and huge portions of fried calamari. Went nicely with the house sauce which you see had chunks of tomato in it. Ceasar salad was good. Lot's of parmesean and ceasar sauce that enveloped every green leaf. The chicken parm was the standout. Crispy edges, a wonderful sauce, and the melted mozz on top had the right amount of crisp. The chicken masala tended to be a bit salty but the chicken itself was cooked perfectly with huge mushrooms. Plenty for dinner and for leftovers the next day. I'll be back.",4.0
"Slow service but really good homey italian cuisine. Everything was delicious. We had the calamari,  veal parmagiana with mussels and ortobello linguini. The sauces are all made in house. We will return. Portions are huge we had to pack up most of our food to go.",4.0
"Lucio Battisti playing in the background, the pleasant, peaceful  ambiance and warm friendly people: Ahhh... There is no other place I want to be right now. Mussels and calamari for an appetizer? But of course! You better bring your appitito. You can fill up on this alone, the portions are multo grande, the way it use to be years ago. Main course:Shrimp Parmigiana and Veal Sorrentino: I asked Roberto (our waiter) ""Are you trying to kill us with these large portions?"" He laughed and said, ""No, and don't reheat it at home in the microwave, use the stove"". To say the food here is good would be an understatement, it is ""Multo Bene"" (magnificent).The owner came over to our table and asked us if we enjoyed our dinner. I wanted to grab him, give him a big hug and a kiss, but I know I will be back... I don't want things to get weird. ""Everything about your place is beautiful"" I said, he smiled and walked away. The last time I was there was a long time ago... I'm so glad some things never change. Ortobello is the epitome of what a small gourmet Italian restaurant should be. I am very happy this is a local gem in my neighborhood... Abbondanza!!!",5.0
I came here because my friend was raving about this place and said this is the closest I'll get to authentic Italian food. I stopped by one Friday night with some friends and I'll definitely be coming back here again!It felt very homey inside and everyone was very friendly. The food took a little longer than I expected but I didn't mind because it was delicious. Can't wait to come back here again! :),4.0
"Came here one Sunday afternoon with the bf and his parents to try it out for the first time. I've lived in Bensonhurst my whole life and used to pass this place on the way to school on the bus each morning, never thinking it was a place to eat. It has one of those old rusted looking signs, but that just added to the authenticity of how long it's been there.We walk into a small but intimate space with an ""at Nonna's* house"" type of feel (exercising my 7 years of school taught Italian and Bensonhurst upbringing ). We must've gotten lucky because no one else was there so we had free choice of seating. Only half way through our meal did a couple walk in for their lunch.We ordered the ""best mussels in town"" in red sauce, baked clams, linguini with red clam sauce, chicken parm and rigatoni alla vodka and a bottle of wine($35).The mussels were ok, but was a large portion and the sauce was very good. The baked clams were great! Tender and the breading and sauce were delicious. The linguini with clam sauce was also very good with good flavor. The rigatoni was good, but a little too creamy. The chicken parm was heaping and pretty good as well. Most things were priced decently for the portion size and they also have 3 course meals where you can pick an app, entree and dessert starting at around $27.50 and I believe you can also get this to go. Portions were big so we had some leftovers for lunch Wouldn't mind trying it again and would definitely get the baked clams!",4.0
"WOW! I'm blown away by this place. It has an old school mob family kinda feel. The chef is great. Friendly guy with a big personality. The food is even better! Huge proportions you will not finish in one sitting. Definitely will carry out a doggy bag. When you take a bite out of the food, you will feel like you're Goldilocks and find it to be ""just right!""",5.0
"Just returned from Ortobello's Restaurant and I have to say, this will always be my favorite Italian restaurant. Today I was with mom and sis and the two of them chose to go with the chicken parm. There are no wrong/bad choices at this restaurant because everything is amazing. The staff is beyond friendly and they have all of my respect. As for myself, I went with a dozen baked clams to start and followed that up with their famous zuppa di pesce. Now I need to say that the zuppa di pesce is the biggest vessel of food I have ever seen. I tried to take it down but I hit the infamous food wall and had to tap out. You will see the before and after pic that Andy (the owner) took. Ortobello's is family owned and operated. It will be a while until I am fully recovered from this food beating I took today... but it was well worth it! Until we meet again, thank you so much Ortobello's!",5.0
"Oh dear Ortobello. Why is your food so good? If you're famished, you should skip this spot, because quality food does take a while here. However, if you manage to stay alive with the complimentary bread, then you will reap the benefits of a hearty and yummy meal. The portions are gigantic. I got the veal parm and it was bigger than my face. Their seafood linguine is ginormous! It could've feed all six of us! They don't skimp on the amount of seafood or the variety. Our seafood linguine had mussels, clams, squid, octopus, fish, and this other shell fish that I can't think of the name. When the guy brought out the dish, he even took the scenic route to make sure all the other patrons saw the dish before arriving to our table. I think most people who venture out to this part of Brooklyn will probably flood to another more notable restaurant, but wait until more discover Ortobello!",5.0
"A very cozy family run Italian restaurant. Very authentic. Foods are awesome, taste to perfection, not overly salted (for those salty eaters, you might think it's not salty enough).very big portions!!!  Aware for small eaters... Lolz.We went in as a table for 3 and ordered the Zuppa de Pesce...  OMG!! That dish can feed 5!!! Super big!!Stuffed mushrooms were good, descent size and I loved the sauce.I also ordered a Caesar salad with grilled chicken, big plate.3 orders, 3 ppl, besides the mushrooms... Everything else was pack home.Lastly... Dessert... Cappuccino with whipped cream on top drizzled with chocolate syrup!!!  OMG! Soo good! Very nice Italian spot in bensonhurst area...  Its worth a try.",4.0
"Never have I ever...1) knew this place existed in Brooklyn (even when I was parked across the street)2) regretted walking in on a Thursday night after work to eat dinner there with some friends3) questioned my friend who ordered the shrimp and chicken parmigiana          A. The chicken and shrimp parm was family                   style and some of the best parm I've had.                Ever.4) had a better mozzarella stick in my life. Ever. Breaking and mozzarella was just perfecto! Che Bella!5) tartufo tre colore (three colors aka flavors) was delicious! Tiramisu as well in addition to my cappuccino! We mangia that entire place!Family style portions, a little pricey, but my gosh who knew authentic Italian existed so close to home!",4.0
"Huge Portions! Wonderful wait staff and the floor manager for the night was super friendly. He had a pleasant smile and was great to every table and patrons. It's bare bones decor but you really come here for the food. Had nicely fried up and huge portions of fried calamari. Went nicely with the house sauce which you see had chunks of tomato in it. Ceasar salad was good. Lot's of parmesean and ceasar sauce that enveloped every green leaf. The chicken parm was the standout. Crispy edges, a wonderful sauce, and the melted mozz on top had the right amount of crisp. The chicken masala tended to be a bit salty but the chicken itself was cooked perfectly with huge mushrooms. Plenty for dinner and for leftovers the next day. I'll be back.",4.0
"Slow service but really good homey italian cuisine. Everything was delicious. We had the calamari,  veal parmagiana with mussels and ortobello linguini. The sauces are all made in house. We will return. Portions are huge we had to pack up most of our food to go.",4.0
"Lucio Battisti playing in the background, the pleasant, peaceful  ambiance and warm friendly people: Ahhh... There is no other place I want to be right now. Mussels and calamari for an appetizer? But of course! You better bring your appitito. You can fill up on this alone, the portions are multo grande, the way it use to be years ago. Main course:Shrimp Parmigiana and Veal Sorrentino: I asked Roberto (our waiter) ""Are you trying to kill us with these large portions?"" He laughed and said, ""No, and don't reheat it at home in the microwave, use the stove"". To say the food here is good would be an understatement, it is ""Multo Bene"" (magnificent).The owner came over to our table and asked us if we enjoyed our dinner. I wanted to grab him, give him a big hug and a kiss, but I know I will be back... I don't want things to get weird. ""Everything about your place is beautiful"" I said, he smiled and walked away. The last time I was there was a long time ago... I'm so glad some things never change. Ortobello is the epitome of what a small gourmet Italian restaurant should be. I am very happy this is a local gem in my neighborhood... Abbondanza!!!",5.0
I came here because my friend was raving about this place and said this is the closest I'll get to authentic Italian food. I stopped by one Friday night with some friends and I'll definitely be coming back here again!It felt very homey inside and everyone was very friendly. The food took a little longer than I expected but I didn't mind because it was delicious. Can't wait to come back here again! :),4.0
"Came here one Sunday afternoon with the bf and his parents to try it out for the first time. I've lived in Bensonhurst my whole life and used to pass this place on the way to school on the bus each morning, never thinking it was a place to eat. It has one of those old rusted looking signs, but that just added to the authenticity of how long it's been there.We walk into a small but intimate space with an ""at Nonna's* house"" type of feel (exercising my 7 years of school taught Italian and Bensonhurst upbringing ). We must've gotten lucky because no one else was there so we had free choice of seating. Only half way through our meal did a couple walk in for their lunch.We ordered the ""best mussels in town"" in red sauce, baked clams, linguini with red clam sauce, chicken parm and rigatoni alla vodka and a bottle of wine($35).The mussels were ok, but was a large portion and the sauce was very good. The baked clams were great! Tender and the breading and sauce were delicious. The linguini with clam sauce was also very good with good flavor. The rigatoni was good, but a little too creamy. The chicken parm was heaping and pretty good as well. Most things were priced decently for the portion size and they also have 3 course meals where you can pick an app, entree and dessert starting at around $27.50 and I believe you can also get this to go. Portions were big so we had some leftovers for lunch Wouldn't mind trying it again and would definitely get the baked clams!",4.0
"WOW! I'm blown away by this place. It has an old school mob family kinda feel. The chef is great. Friendly guy with a big personality. The food is even better! Huge proportions you will not finish in one sitting. Definitely will carry out a doggy bag. When you take a bite out of the food, you will feel like you're Goldilocks and find it to be ""just right!""",5.0
"Just returned from Ortobello's Restaurant and I have to say, this will always be my favorite Italian restaurant. Today I was with mom and sis and the two of them chose to go with the chicken parm. There are no wrong/bad choices at this restaurant because everything is amazing. The staff is beyond friendly and they have all of my respect. As for myself, I went with a dozen baked clams to start and followed that up with their famous zuppa di pesce. Now I need to say that the zuppa di pesce is the biggest vessel of food I have ever seen. I tried to take it down but I hit the infamous food wall and had to tap out. You will see the before and after pic that Andy (the owner) took. Ortobello's is family owned and operated. It will be a while until I am fully recovered from this food beating I took today... but it was well worth it! Until we meet again, thank you so much Ortobello's!",5.0
Amazing service.. Even better food taste and sounds like Nonna's kitchen.... You guys must try this place!!!,5.0
Amazing food! chicken farm and pollo fettuccine alfredo were nothing short of spectacular. The baked clams to start was simply delightful. Will definitely be back.,5.0
"Huge portions and good flavor. I went with the chicken parm. However, there were parts of the chicken that were rubbery and straight up inedible. At first I thought it was just one piece but I found such pieces throughout the entire chicken. That turned me off enough to discard the entire thing. Sorry, but that's incredibly unforgivable. For $21, I expected so much more. I want my money back.",2.0
"Just got home from a great dinner at Ortobello's. Doesn't look like much from outside but it was very nice inside. Pretty small place so parties of over 2-3 might want to call ahead. We (2 people) got there about 745ish and about 20 min later the place was full. Food: for an appetizer we got mozzarella in carozza. Wasn't like the usual carozza I've had at many other restaurants. This was in a butter and wine sauce maybe? Whatever it was it was great. Huge portions! About the size of a brick of mozzarella. And we got two huge bricks. So 1 came home with us. My girlfriend got veal sorentino. Very good. The veal was cooked very nicely. The eggplant was tender and the prosciutto was a nice addition. After seeing all the pictures of chicken parm on yelp I had to try. Again huge portions. Never seen a cutlet that big. Cheese was smothering the chicken and the sauce was great. Both entrees came with a side of either pasta, potato croquettes or a salad. Croquettes were great and the pasta was al dente and nice amount of sauce. After so much food we really didn't want dessert so we decided to get an espresso each. Extremely surprised when we were brought a pot of espresso and a bottle of sambucca. Price was about 20-25 an entree and the appetizers ranged from about 15-25. The espresso was 10 but we got a whole. Prices may seem steep but the amount of food you get is enough for leftovers for.the next day. Overall, a great time with great food. Be warned though... this is like an old school Italian place so expect to be there 1-2 hours. There was about 10 min between the dishes to breathe a little. Definitely will be back to try the other dishes there.",5.0
