Came here right before closing time on a Saturday. My fiancé and I both ordered a hot Cappuccino and they were rich and delicious. I can only write about my cappuccino (because that's all I had) and I would definitely recommend this place.,4.0
"Road tripping last week up the east coast and stayed in this wonderful neighborhood of Williamsburg in Brooklyn.  Hotel Le Jolie was our bed for the night which I will review next.  Anyway, we checked in around noon and were pretty hungry.  So we walked around the corner to this little spot.  Appearance: clean and hip.  Took a look at the large menu up above the cash register and fell in love with the items described.  The two very attentive guys that greeted us also answered my questions about the menu items.  I was tied between the Avocado toast and the Balkan.  One of the gentlemen recommended the Balkan and said it's a local favorite.  I believe he said it's his too.  So, I took his recommendations.  Other orders for our group were the Schnitzel and the PB & homemade jam (we had a child in the house). Sat down and enjoyed the ample view of the town through the large top to bottom windows that encircle this corner cafe.  Oh, I forgot to mention that I ordered tap water and was directed to these tin jugs for self serve water.  They were filled with delightful lemon-lime enhanced tap.  Already this place had 3 stars in my book just by appearance and service.  Now about the food...So, our order came out pretty quickly.  The guy who helped us in the front also brought our food to the table.  Our plates looked presentable, clean and yummy.  Now for the taste.  I have to say that my sandwich was the best I've had in quite some time.  I was overly impressed!  It was overstuffed (never a bad thing) with perfectly seasoned and grilled eggplant, caramelized onions, fresh arugula and tomatoes, tahini and smothered with a cheese which was described as Turkish feta but tasted like the most creamy, delicious goat cheese.  I'm still thinking about this amazing sandwich 4 days later.  The schnitzel was perfect as well.  I tasted it and it was delicious.  Also tasted the PB&J and it was great!  Overall, I was so impressed with this little place that I came back the next morning and enjoyed a delicious breakfast.  The same gentleman was there that morning and took our order.  What a nice guy!  I did not get his name but he was so courteous and just plain cool!  Breakfast: lattes!  So good!  I had an almond milk hot latte In a nice cup with some foam art on top.  (I love all foods but I have a knack of sticking mostly to vegan or vegetarian foods) Almond croissant and chocolate croissant were fresh and so good.  My hubs ordered an iced latte which was served in a mason jar and the shakshuka which I tasted and was out of this world!  If I lived in Brooklyn, I'd have breakfast and lunch here everyday!  Can't say enough about this little joint.  Next time I'm in NY this will be first on my list, no doubt!  YES!!!!",5.0
"UPDATE: The owner, Eldad, responded to say they were making changes in their crew and were working towards greater consistency. I'm happy to say it's a success :) my drink is now way more consistent and I don't have to worry about how my coffee is going to taste that particular morning!--this is my coffee place before work, and i always get the same thing during the summer, iced soy latte. i've come to learn that depending on who the barista is, it'll taste different - sometimes it's actually perfect, and sometimes, like today, a new barista pulls a weak ass shot and it's like kiiinda coffee-flavored milk (like, was that a double?), or it's over/underextracted and bitter or sour. i've come to get kinda scared when people i've never seen before are working the espresso machine cause i never know what i'm going to get.i love the oatmeal raisin scones. croissants are from balthazar, and they make solid plain ones but the almonds are really bready in the center, and i prefer mine flaky. that's just personal preference though. beautiful shop, nice people, near work = i'm a repeat customer, but i do wish baristas would be more consistent.",5.0
"I live really close to re.union and am a regular customer. The food is really high quality and I love that it's a coffee shop meets restaurant. The owner is always around and the place has really nice ambiance. The only thing that bothers me is that they have a no laptop rule on weekends, which I understand to some degree if it was busy. But I came here this morning to get some work done and enjoy their food and was surprised when a bus boy asked me to put my laptop away. The place wasn't remotely full or busy. It was off-puting, as the reason I love this place so much IS that it's a coffee shop with great food.",4.0
"Reunion is my trusted neighborhood coffeeshop. The coffee can't be beat, all of the staff is super friendly and nice and the food is delicious. Also a great spot for weekend brunch, with more varied and elaborate options than your typical bacon and eggs - great middle eastern treats. The Jerusalem burger and the cafe au lait doughnut (weekends only) are highly recommended. Coolest cafe in Williamsburg - can't miss.",5.0
Re:Union gives a tour de force performance with their skillet pancake. Moist and fluffy with a healthy dose of chocolate chips; butter and syrup is not needed for this sweet take on breakfast. I recommend this breakfast item for anyone with a morning sweet tooth.,5.0
I would go here for the Shakshooka-- I give that 5 starts. As for the rest I'm not quit sure what to make of the place.  I have never seen a a bunch of people there so I was also reluctant to go in. The coffee is great but not so good to make me go back. The yogurt and granola was good-- but that is something I can make home and save the $6 bucks. I love the black board wall-- Very creative.,3.0
"Wanted to like this place because it's close to where we live, but I have mixed feelings. Decor is nice, but the food and drink quality is inconsistent, especially considering the premium prices you pay. Espresso drinks and iced coffee are too weak and not up to par with other nearby cafés like Gimme. Some of the dishes are pretty tasty, but others are only mediocre and seem overpriced for what you get.",3.0
No complaints here. Great lunch spot on a Monday afternoon. Just the right amount of busy-ness and energy. Pricey but worth every penny. Had the avocado toast and it was delicious. Good vegetarian options.,5.0
"Much respect for the people that work here very patient . Interior is modern and clean would like separate tables that just me. Ordered take away/ French toast, grill cheese , big salad , everything has fresh made no quick in & out worth the wait .",4.0
Came here right before closing time on a Saturday. My fiancé and I both ordered a hot Cappuccino and they were rich and delicious. I can only write about my cappuccino (because that's all I had) and I would definitely recommend this place.,4.0
"Road tripping last week up the east coast and stayed in this wonderful neighborhood of Williamsburg in Brooklyn.  Hotel Le Jolie was our bed for the night which I will review next.  Anyway, we checked in around noon and were pretty hungry.  So we walked around the corner to this little spot.  Appearance: clean and hip.  Took a look at the large menu up above the cash register and fell in love with the items described.  The two very attentive guys that greeted us also answered my questions about the menu items.  I was tied between the Avocado toast and the Balkan.  One of the gentlemen recommended the Balkan and said it's a local favorite.  I believe he said it's his too.  So, I took his recommendations.  Other orders for our group were the Schnitzel and the PB & homemade jam (we had a child in the house). Sat down and enjoyed the ample view of the town through the large top to bottom windows that encircle this corner cafe.  Oh, I forgot to mention that I ordered tap water and was directed to these tin jugs for self serve water.  They were filled with delightful lemon-lime enhanced tap.  Already this place had 3 stars in my book just by appearance and service.  Now about the food...So, our order came out pretty quickly.  The guy who helped us in the front also brought our food to the table.  Our plates looked presentable, clean and yummy.  Now for the taste.  I have to say that my sandwich was the best I've had in quite some time.  I was overly impressed!  It was overstuffed (never a bad thing) with perfectly seasoned and grilled eggplant, caramelized onions, fresh arugula and tomatoes, tahini and smothered with a cheese which was described as Turkish feta but tasted like the most creamy, delicious goat cheese.  I'm still thinking about this amazing sandwich 4 days later.  The schnitzel was perfect as well.  I tasted it and it was delicious.  Also tasted the PB&J and it was great!  Overall, I was so impressed with this little place that I came back the next morning and enjoyed a delicious breakfast.  The same gentleman was there that morning and took our order.  What a nice guy!  I did not get his name but he was so courteous and just plain cool!  Breakfast: lattes!  So good!  I had an almond milk hot latte In a nice cup with some foam art on top.  (I love all foods but I have a knack of sticking mostly to vegan or vegetarian foods) Almond croissant and chocolate croissant were fresh and so good.  My hubs ordered an iced latte which was served in a mason jar and the shakshuka which I tasted and was out of this world!  If I lived in Brooklyn, I'd have breakfast and lunch here everyday!  Can't say enough about this little joint.  Next time I'm in NY this will be first on my list, no doubt!  YES!!!!",5.0
"UPDATE: The owner, Eldad, responded to say they were making changes in their crew and were working towards greater consistency. I'm happy to say it's a success :) my drink is now way more consistent and I don't have to worry about how my coffee is going to taste that particular morning!--this is my coffee place before work, and i always get the same thing during the summer, iced soy latte. i've come to learn that depending on who the barista is, it'll taste different - sometimes it's actually perfect, and sometimes, like today, a new barista pulls a weak ass shot and it's like kiiinda coffee-flavored milk (like, was that a double?), or it's over/underextracted and bitter or sour. i've come to get kinda scared when people i've never seen before are working the espresso machine cause i never know what i'm going to get.i love the oatmeal raisin scones. croissants are from balthazar, and they make solid plain ones but the almonds are really bready in the center, and i prefer mine flaky. that's just personal preference though. beautiful shop, nice people, near work = i'm a repeat customer, but i do wish baristas would be more consistent.",5.0
"I live really close to re.union and am a regular customer. The food is really high quality and I love that it's a coffee shop meets restaurant. The owner is always around and the place has really nice ambiance. The only thing that bothers me is that they have a no laptop rule on weekends, which I understand to some degree if it was busy. But I came here this morning to get some work done and enjoy their food and was surprised when a bus boy asked me to put my laptop away. The place wasn't remotely full or busy. It was off-puting, as the reason I love this place so much IS that it's a coffee shop with great food.",4.0
"Reunion, you really outdid yourself this morning. These pancakes are blowing my mind and I have to tell the world. Happy 1 yr anniversary!",5.0
Really cute coffee shop! Re.union has all your typical cafe stuff (including Dough doughnuts!) plus a small breakfast and lunch menu that's Mediterranean inspired. I had the shakshooka (which came with a small israeli salad and yogurt) and my fiance ordered the herb omelette sandwich. Both are highly recommended. Will definitely be one of my go-to cafes in the neighborhood.,5.0
"A $20 breakfast should be more than a luke warm cup of coffee, some untoasted bread and over-poached eggs.",2.0
"Very nice place, pretty new in the neighborhood.   We ordered the apple tart breakfast item with a Turkish coffee and cold brew.  They have big seating area, great brunch options and free wifi.   It's a nice little place to go for a break or to read a book but it's not a cheap place.   Even on a rainy day, it's kept clean.   Definitely worth a couple of return trips.",5.0
"If re.union was a one-night-stand, I would definitely recommend having breakfast with her in the morning. I will try to keep it a weekdays thing though and make no life commitment.",4.0
"UPDATE: The owner sent me a message apologizing for the burn; he was the one who gave me the towel at the counter. Apparently the employee who forgot to mention the heat was new. But he was accompanied to our table by another female employee...Still, for the apology I will go back up to 4. ----------------There are so many things I liked/wanted to like about this place, but then I got burned. Literally. I ordered the incredible green breakfast, which came with a delicious salad with fresh cheese, a frittata-like egg thing with potatoes and greens, and some sweet pesto on the side that was great on top of the eggs. My friends both ordered the schnitzel sandwich, which had some kind of lemony delicious on it. They very much liked theirs too! And they gave us a sweet bread bowl for the table that even included a croissant that was quite nice. The vibe of the place was cute, and we barely had to wait in a line even on a Sunday at 1:30 pm. It was a little confusing in terms of how the food would come to us/how much to tip when you came to the counter. I was thinking it would be something where they'd call out your name, but it turned out to be that they brought it to the table. Just a heads up on that. So I would have given them 4 stars for sure, but here's what went down: when they brought my food to the table they sat down all our food in front of us/we said thanks/they headed away. We all began to dig in. And then I bumped my hand on the handle of the cast iron pan on my plate containing my eggs. And SCREAMED! It burned me. A day later, I've still got a red spot on my palm. For all the times I have gone to restaurants in which the waiter tells me to be careful, the plate is hot (while they hold it with their own hands) and it's really not that bad, this one time in which an INCREDIBLY hot object is put in front of me, no warning. Additionally, when I went up and asked for some ice for my palm, no one apologized, even the person who had sat it in front of me without a warning. They did give me ice and a towel, though! Maybe because the manager-looking guy was over there when I asked for the ice they didn't want to reveal their error? If they had apologized, I probably would have gone 4 stars. I'm definitely not writing them off, as the food and experience were overall good. It seems like the employees maybe just need to work a little more on their game.",4.0
"Yum! I've lived in NYC for 22 years and last Saturday was my first time in Williamsburg. I was overwhelmed by all the cute cafes in the area, but my friend suggested we meet here :)The inside is so cute. It's small, but manages to get so much sunlight, so it's nice and cozy and has great natural lighting. I'm a huge carnivore so I was a little distressed when trying to pick something to eat (they don't have any meat dishes). I got the avocado toast which was honestly very very good, and the side potatoes were perfectly cooked and seasoned.I'm not a huge coffee/espresso drinker because I have a weak stomach (7/10 my stomach can't handle coffee) so whenever I drink a coffee/espresso and don't have to run to the bathroom is a good day. It was a good day. I ordered a mocha and it was perfect. Not too sweet and just... perfect. HAHA. I'm honestly surprised that there aren't many reviews for this place. Would absolutely recommend! :)",4.0
"I just had the best pumpkin spice latte I've ever had. What a gem! We stumbled upon this place while staying near Williamsburg and chose it as our pre-airport/last breakfast spot. So glad we did!! The iced latte and the black coffee are also 5/5 stars. The almond croissant made my dreams come true...the perfect flaky pastry to sweetness ratio. My companion raved about the steel cut oatmeal and I wish I could take it back home and save it for a cold winter morning. It was topped with roasted apples! My other friend got an omelette sandwich and described it as ""fresh and savory with a well crafted, soft bread."" Lastly, the yogurt and granola was a classic that stood up against the other delicious treats we had. Creamy, tart, fresh berries, dates and honey. We are in breakfast food heaven!! The ambiance (relaxed mix of students and elders, English and French, laptops and paperbacks) added to this peaceful, blissful, and necessary Brooklyn morning. Thanks re.union!",5.0
"Pictures are truly misleading. This is just a coffee shop (such as starbucks) not a sit down restaurant. Nothing I consumed was good. Had a bland egg sandwich, avocado toast, awful burnt tasting coffee, and I nibbled on what they called a salad (it's just a side topping aka salsa). Nothing had flavor and my avocado wasn't all that great (a bit bitter), I could see the rotting parts on it as they just mashed it in. Overall I'd say if you want extremely expensive cafe junk then this is for you, if not then keep far away.",2.0
"This is a review about the atmosphere and not the food, since I didn't order any, though I've heard the brunch is very good.I went here on a Sunday afternoon. It was crowded, though one spot was open. (There are shared wooden benches as well as single chairs, small tables for 2, maybe 3 people.) I ordered a decaf coffee (around $3.45) and was going to sit down and do some work when I learned that laptops are prohibited on weekends. I don't know if this is a Williamsburg trend or what, but it was disappointing, and I find the laptop ban at coffee shops / cafes pretentious. I would understand the ban at a fancier restaurant.I'm having difficulties finding a cozy coffee shop or cafe in Williamsburg where I can read and use my laptop on my days off, which happen to be weekends. The experience today (not my first in this neighborhood) made me want to move back to Manhattan. No offense, to all the Williamsburg fans out there.Also, the staff at re.union were not rude but not warm, either. No smiles. When I asked for a napkin, the man working behind the counter seemed annoyed that I didn't see the napkins on the shelf by the milk. And when I asked for my coffee to go, he handed me a cup and didn't mention where the lids were. Maybe he thought I was a regular customer and was supposed to know how everything works there.",2.0
"Reunion, you really outdid yourself this morning. These pancakes are blowing my mind and I have to tell the world. Happy 1 yr anniversary!",5.0
Really cute coffee shop! Re.union has all your typical cafe stuff (including Dough doughnuts!) plus a small breakfast and lunch menu that's Mediterranean inspired. I had the shakshooka (which came with a small israeli salad and yogurt) and my fiance ordered the herb omelette sandwich. Both are highly recommended. Will definitely be one of my go-to cafes in the neighborhood.,5.0
"A $20 breakfast should be more than a luke warm cup of coffee, some untoasted bread and over-poached eggs.",2.0
"Very nice place, pretty new in the neighborhood.   We ordered the apple tart breakfast item with a Turkish coffee and cold brew.  They have big seating area, great brunch options and free wifi.   It's a nice little place to go for a break or to read a book but it's not a cheap place.   Even on a rainy day, it's kept clean.   Definitely worth a couple of return trips.",5.0
"If re.union was a one-night-stand, I would definitely recommend having breakfast with her in the morning. I will try to keep it a weekdays thing though and make no life commitment.",4.0
"UPDATE: The owner sent me a message apologizing for the burn; he was the one who gave me the towel at the counter. Apparently the employee who forgot to mention the heat was new. But he was accompanied to our table by another female employee...Still, for the apology I will go back up to 4. ----------------There are so many things I liked/wanted to like about this place, but then I got burned. Literally. I ordered the incredible green breakfast, which came with a delicious salad with fresh cheese, a frittata-like egg thing with potatoes and greens, and some sweet pesto on the side that was great on top of the eggs. My friends both ordered the schnitzel sandwich, which had some kind of lemony delicious on it. They very much liked theirs too! And they gave us a sweet bread bowl for the table that even included a croissant that was quite nice. The vibe of the place was cute, and we barely had to wait in a line even on a Sunday at 1:30 pm. It was a little confusing in terms of how the food would come to us/how much to tip when you came to the counter. I was thinking it would be something where they'd call out your name, but it turned out to be that they brought it to the table. Just a heads up on that. So I would have given them 4 stars for sure, but here's what went down: when they brought my food to the table they sat down all our food in front of us/we said thanks/they headed away. We all began to dig in. And then I bumped my hand on the handle of the cast iron pan on my plate containing my eggs. And SCREAMED! It burned me. A day later, I've still got a red spot on my palm. For all the times I have gone to restaurants in which the waiter tells me to be careful, the plate is hot (while they hold it with their own hands) and it's really not that bad, this one time in which an INCREDIBLY hot object is put in front of me, no warning. Additionally, when I went up and asked for some ice for my palm, no one apologized, even the person who had sat it in front of me without a warning. They did give me ice and a towel, though! Maybe because the manager-looking guy was over there when I asked for the ice they didn't want to reveal their error? If they had apologized, I probably would have gone 4 stars. I'm definitely not writing them off, as the food and experience were overall good. It seems like the employees maybe just need to work a little more on their game.",4.0
"Yum! I've lived in NYC for 22 years and last Saturday was my first time in Williamsburg. I was overwhelmed by all the cute cafes in the area, but my friend suggested we meet here :)The inside is so cute. It's small, but manages to get so much sunlight, so it's nice and cozy and has great natural lighting. I'm a huge carnivore so I was a little distressed when trying to pick something to eat (they don't have any meat dishes). I got the avocado toast which was honestly very very good, and the side potatoes were perfectly cooked and seasoned.I'm not a huge coffee/espresso drinker because I have a weak stomach (7/10 my stomach can't handle coffee) so whenever I drink a coffee/espresso and don't have to run to the bathroom is a good day. It was a good day. I ordered a mocha and it was perfect. Not too sweet and just... perfect. HAHA. I'm honestly surprised that there aren't many reviews for this place. Would absolutely recommend! :)",4.0
"I just had the best pumpkin spice latte I've ever had. What a gem! We stumbled upon this place while staying near Williamsburg and chose it as our pre-airport/last breakfast spot. So glad we did!! The iced latte and the black coffee are also 5/5 stars. The almond croissant made my dreams come true...the perfect flaky pastry to sweetness ratio. My companion raved about the steel cut oatmeal and I wish I could take it back home and save it for a cold winter morning. It was topped with roasted apples! My other friend got an omelette sandwich and described it as ""fresh and savory with a well crafted, soft bread."" Lastly, the yogurt and granola was a classic that stood up against the other delicious treats we had. Creamy, tart, fresh berries, dates and honey. We are in breakfast food heaven!! The ambiance (relaxed mix of students and elders, English and French, laptops and paperbacks) added to this peaceful, blissful, and necessary Brooklyn morning. Thanks re.union!",5.0
"Pictures are truly misleading. This is just a coffee shop (such as starbucks) not a sit down restaurant. Nothing I consumed was good. Had a bland egg sandwich, avocado toast, awful burnt tasting coffee, and I nibbled on what they called a salad (it's just a side topping aka salsa). Nothing had flavor and my avocado wasn't all that great (a bit bitter), I could see the rotting parts on it as they just mashed it in. Overall I'd say if you want extremely expensive cafe junk then this is for you, if not then keep far away.",2.0
