"Don't be intimidated by the long lines- this place is definitely worth the wait.The combination of delicious food at super cheap prices is already difficult to find, but to find it in a trendy-ish setting is even more rare.We did have to wait almost an hour to be seated on a Friday night, but the $4 beers eased our impatience. I ordered the spicy noodles and my friend had the pad see ew- both were delicious and were served in generous portions. It is cash only though, so make sure you hit the ATM before coming.",4.0
"Great food, prices, atmosphere. Open one in Philadelphia, PLEASE?! Try the panaang curry, it was delish.Oh! Cash only.",5.0
"With the only problems being that the place is a bit loud if you want to come on a Sunday to eat (although I guess I wouldn't normally do chic Thai on a Sunday), the food here is definitely bargain price (nearly everything is under 10, and most are under 8 it seems). Their sauces really seem to do well under the enormous heat generated in that semi-open kitchen (we got seats right by there and it was enlivening, a constant fire coming from about 6 woks in a row). I've used three parentheses already, so I'll try not to for the rest of the review (...ok ok). Their sauces are very good, and it turns the pad see ew from normal to something I'd eat every time I come here. The noodles are nice and soft and while the beef is fairly good, I do love chinese broccoli when it's super tender. The place itself is kinda sleek, with a small bar in the front with the actual bar lit up and all blue and purple. Once you hit the tables, it's an open forum with horrendous acoustics (this place is loud, even without the blaring music). The backyard is really a treat, I wish it wasn't raining so we could have sat outside.I'll be grabbing the menu from Joya very soon, I'd definitely consider this a must on my take out.",4.0
"Have mercy, Park Slope.Stopped in today at Song (on 5th Ave. between 1st and 2nd) for an early dinner - coconut-based soup with tofu (instead of chicken) and scallions for $3.25 and a delicious vegetable curry in a red coconut sauce with steamed rice for $6.95. Outstanding food (and it's just as good the next day), really nice decor - I dig the periwinkle and dark wood vibe.  Also looks like there's a spot for some uber-awesome Thai DJing, too.  The soup was so filling I barely had room for any of my entree, so if you're just looking for a snack or are perhaps a rexie, try it!",5.0
"Eh. Not really authentic Thai restaurant, but whatever the chefs and staffs were having definitely smelled like the real deal. I wish I could just move my chair to their table and eat with them. Just looking at the food I had on the table with my friends' orders made me want to slap myself for coming in here. The waitresses were nice but I could understand that they and the chefs were laughing at how stupid Americans keep paying loads money for ripoff and still thinking they are in for a real Thai experience. Oh, same thing applies to Chinese takeout or taco ""hell"". Anyways, I asked for super spicy for drunk men noodle, or pad kee mao, and I've had few serious super spicy Thai food that made me choked with first bite! Not this one! If the plate I got was considered extra spicy, and then people would find mild salsa extremely spicy! Now whatever they were cooking for their own lunch smelled so fragrant and spicy that we started coughing and tearing just from smelling it. That was the Real deal. Everything on the menu were overpriced and lack of real flavor. The restaurant itself is not that bad with the dining area, bar, as well as backyard. However, no amount of decor or liquor selection is going to make up an authentic food experience for me personally.",3.0
"If you want good affordable Thai food, Song is the place for you. The prices can't be beat and with that in mind, the food, while not of epicurean proportions, is consistently delicious. I don't think I've ever been disappointed with my dinners here and I still get some pleasure from getting the check and seeing that ""OMG! it's only $25 for both of us!"" Hey, I love a good deal.The music here truly is too loud for us older folk [21+] and the hostesses need to get the sticks out of their asses, but ""OMG! it's only $25 for both of us"" and the food is darn good, so I can put up with the other inconveniences.",4.0
"I have to say, aside from the prices, I'm not sure I understand the allure this place seems to hold for so many people.Song seems to me to have a personality disorder. I cannot decide if it is a cheap Thai joint, a serious eatery, a bar, or a disco club. Individually, these things could work, but together the whole is not greater than the sum of the parts.The food was okay. We had a pretty good spring roll and my dining companions liked the mango salad quite a bit. The entrees weren't as great. Worse, I think the food may have been off because I got a bit sick.I did like the bar, though. It seemed like a nice place to hang out.",2.0
Great vegetarian dishes! The vegetables are always cooked perfectly. The sauces get a bit salty if you soak all of your rice in it but are still very flavorful. The only negative is that the curry puffs aren't on the regular menu! Best curry puffs I've had but they only have them once in a while. Should definitely be a permanent appetizer!,4.0
"A large group of friends and I went here for a late lunch after a Prospect Park pickup football game.  The food and service were both solid, but nothing that rocked my socks.  However the fact that 12 of us could get a table without a wait at 2:30 was great.",3.0
"I dream of Song when I'm away from home.  Seriously.  The Nuur Kratiam is delicious...as is mostly everything I have eaten there.  The service is so-so, and it gets PACKED at night.  However, the combination of low prices and great food is usually enough incentive to be patient.I recommend going for lunch, they have a great lunch menu and 2 people can usually eat for under $20. PS. CASH ONLY",5.0
"I was incredibly disappointed by my experience at Song.  It's a cute place, nice decor, cheap prices, short wait time... but all of that was ruined by my awful service experience.  We were sort of rushed into ordering and I hadn't finished looking over my menu.  I'm all for a game time decision, so I was up to the challenge: what to have for dinner?  We were given a main menu and a specials menu.  I ordered the mango salad off the main menu, which I was clearly holding in my hands and using as a reference while I spoke to the waitress.  After I said 'mango salad,"" the waitress said ""Just the mango salad?"" I said yes, although I wasn't entirely sure what she meant.  The dishes arrived within fifteen minutes, when I discovered that the meal I thought I ordered was missing 2 elements - sticky rice (which was honestly the reason I ordered the dish) and chicken.  I asked the waitress about these items, and she said, ""Oh no, you ordered mango salad.""  I agreed with her and told her that the mango salad I ordered came with chicken and sticky rice.  She more or less sassed me in return and informed me I ordered ""just the mango salad,"" from the specials menu.  She did ask me if I wanted to order something else but she did not offer any refund, so I declined.I don't think I'll be going back.",2.0
"So if you know anything about me, you'd know the whole in-your-face, ridiculously loud and crowded club scene really gets under my skin, which is why Song only gets 4-stars. To be fair, it's a restaurant, not a club, but it's trying really hard with it's DJ in the dining area, darkly lit swank bar to bridge the gap. The good news, the food is good. Really good. And cheap. A downer that it only takes cash, but as is the life of Brooklyn. I recommend lunch or early dinner, on a nice day, the back patio is a major boon to this establishment.",4.0
"Hmmmm.I have heard that this place was fantastic, but my experience was just ok.The bar, people, atmosphere were very nice.Food....disappointed.I usually order spicy noodle at any Thai restaurant, and this one was not good at all. It was very salty and the type of noodle they used was not the same as other places. It may work for somebody, though.I have tasted chicken and broccoli that my friend ordered, it was very salty too.Everything on the menu was very very affordable. Thai iced tea was wonderful!",3.0
"Love! Love! Love! The spicy noodles are my favorite. Nice outdoor seating in good weather. The service isn't always the best, but the great food makes up for it.",5.0
"Me and my wife and some friends went to Song on Sunday around 5:00 pm... there was no wait and we were seated immediately. We ordered the larger calamari. It was tender and delicious and more then enough for 4 of us. I ordered the mix veg in red curry sauce, the portion  enough for two. It was very tasty. My wife had the shrimp and veg in red curry sauce. She was very happy with the dish. One of our friends ordered the Calamari fried rice, seasoned just right and again the calamari was tender and delicious. Our friends ordered the shrimp with garlic sauce..also no complaints. And the vegetable spring rolls very good. We also shared a bottle of California Riesling, nicely priced. Overall the food is great and the protions are huge. We will return..",4.0
"I eat Thai food a LOT (esp pad thai) and I'm not that picky, so it's not that hard for me to be happy with Thai.  With most restaurants, I start at zero and add up the stars; with Thai I tend to start at 5 and subtract as necessary.  So really, I was really inclined to crown Song with top accolades, what with its simple-chic decor, low low prices (even for Thai), enormous portions, and convenient location.  Alas -- I knock off a star for the exceedingly loud volume and the food.Song is not actually as trendy as people make it sound.  No one one here boasts a snobby attitude and it's not a beautiful-people-only spot.  It's easy on the eyes, but Song has a casual vibe that just happens to be set in a mod dining room.  Yes, there's a DJ booth, but on neither of my two Friday night visits was the music blaringly LOUD.  My boyfriend and I actually stopped to note the fact that the music was not pumping bc we couldn't figure out why the heck else the noise level was so high at Song!  Sitting just across the small table from each other, we had to lean across and scream to be heard!  (Of course, that's probably the problem other diners had too, contributing to the problem.)  Come warm weather, I'd like to try the backyard patio, which should be quieter!Anyway, I had the chicken + shrimp pad thai (which I had last time and when I ordered in, too) and my bf had the garlic sliced beef.  I actually like my pad thai on the sweet side, but the pad thai at Song was a bit too sugary even for me.  Similarly, my bf's garlic beef was too salty w/o eating a bite of rice at the same time.  The spring rolls, however, were pretty damn good, even though they only give you 2 (compared to other Thai restaurants).  But the fact that the entree portions are so big ROCKS, and I can't really complain too much about pad thai at dinnertime costing only $6.95.Whew, that was long!  Usually my 4-star reviews are short and full of praise, so I feel bad.  Song is actually pretty great and I'll def keep coming back for more, but those are 2 things I wish they'd fix!",4.0
"Really stellar Thai food at great prices. A very popular night and weekend spot, so expect a bit of wait. Nice waitstaff, but usually quite busy and can be slightly unattentive. Cash only.",4.0
Great vegetarian dishes! The vegetables are always cooked perfectly. The sauces get a bit salty if you soak all of your rice in it but are still very flavorful. The only negative is that the curry puffs aren't on the regular menu! Best curry puffs I've had but they only have them once in a while. Should definitely be a permanent appetizer!,4.0
"A large group of friends and I went here for a late lunch after a Prospect Park pickup football game.  The food and service were both solid, but nothing that rocked my socks.  However the fact that 12 of us could get a table without a wait at 2:30 was great.",3.0
"I dream of Song when I'm away from home.  Seriously.  The Nuur Kratiam is delicious...as is mostly everything I have eaten there.  The service is so-so, and it gets PACKED at night.  However, the combination of low prices and great food is usually enough incentive to be patient.I recommend going for lunch, they have a great lunch menu and 2 people can usually eat for under $20. PS. CASH ONLY",5.0
"I was incredibly disappointed by my experience at Song.  It's a cute place, nice decor, cheap prices, short wait time... but all of that was ruined by my awful service experience.  We were sort of rushed into ordering and I hadn't finished looking over my menu.  I'm all for a game time decision, so I was up to the challenge: what to have for dinner?  We were given a main menu and a specials menu.  I ordered the mango salad off the main menu, which I was clearly holding in my hands and using as a reference while I spoke to the waitress.  After I said 'mango salad,"" the waitress said ""Just the mango salad?"" I said yes, although I wasn't entirely sure what she meant.  The dishes arrived within fifteen minutes, when I discovered that the meal I thought I ordered was missing 2 elements - sticky rice (which was honestly the reason I ordered the dish) and chicken.  I asked the waitress about these items, and she said, ""Oh no, you ordered mango salad.""  I agreed with her and told her that the mango salad I ordered came with chicken and sticky rice.  She more or less sassed me in return and informed me I ordered ""just the mango salad,"" from the specials menu.  She did ask me if I wanted to order something else but she did not offer any refund, so I declined.I don't think I'll be going back.",2.0
"So if you know anything about me, you'd know the whole in-your-face, ridiculously loud and crowded club scene really gets under my skin, which is why Song only gets 4-stars. To be fair, it's a restaurant, not a club, but it's trying really hard with it's DJ in the dining area, darkly lit swank bar to bridge the gap. The good news, the food is good. Really good. And cheap. A downer that it only takes cash, but as is the life of Brooklyn. I recommend lunch or early dinner, on a nice day, the back patio is a major boon to this establishment.",4.0
"Hmmmm.I have heard that this place was fantastic, but my experience was just ok.The bar, people, atmosphere were very nice.Food....disappointed.I usually order spicy noodle at any Thai restaurant, and this one was not good at all. It was very salty and the type of noodle they used was not the same as other places. It may work for somebody, though.I have tasted chicken and broccoli that my friend ordered, it was very salty too.Everything on the menu was very very affordable. Thai iced tea was wonderful!",3.0
"Love! Love! Love! The spicy noodles are my favorite. Nice outdoor seating in good weather. The service isn't always the best, but the great food makes up for it.",5.0
"Me and my wife and some friends went to Song on Sunday around 5:00 pm... there was no wait and we were seated immediately. We ordered the larger calamari. It was tender and delicious and more then enough for 4 of us. I ordered the mix veg in red curry sauce, the portion  enough for two. It was very tasty. My wife had the shrimp and veg in red curry sauce. She was very happy with the dish. One of our friends ordered the Calamari fried rice, seasoned just right and again the calamari was tender and delicious. Our friends ordered the shrimp with garlic sauce..also no complaints. And the vegetable spring rolls very good. We also shared a bottle of California Riesling, nicely priced. Overall the food is great and the protions are huge. We will return..",4.0
"I eat Thai food a LOT (esp pad thai) and I'm not that picky, so it's not that hard for me to be happy with Thai.  With most restaurants, I start at zero and add up the stars; with Thai I tend to start at 5 and subtract as necessary.  So really, I was really inclined to crown Song with top accolades, what with its simple-chic decor, low low prices (even for Thai), enormous portions, and convenient location.  Alas -- I knock off a star for the exceedingly loud volume and the food.Song is not actually as trendy as people make it sound.  No one one here boasts a snobby attitude and it's not a beautiful-people-only spot.  It's easy on the eyes, but Song has a casual vibe that just happens to be set in a mod dining room.  Yes, there's a DJ booth, but on neither of my two Friday night visits was the music blaringly LOUD.  My boyfriend and I actually stopped to note the fact that the music was not pumping bc we couldn't figure out why the heck else the noise level was so high at Song!  Sitting just across the small table from each other, we had to lean across and scream to be heard!  (Of course, that's probably the problem other diners had too, contributing to the problem.)  Come warm weather, I'd like to try the backyard patio, which should be quieter!Anyway, I had the chicken + shrimp pad thai (which I had last time and when I ordered in, too) and my bf had the garlic sliced beef.  I actually like my pad thai on the sweet side, but the pad thai at Song was a bit too sugary even for me.  Similarly, my bf's garlic beef was too salty w/o eating a bite of rice at the same time.  The spring rolls, however, were pretty damn good, even though they only give you 2 (compared to other Thai restaurants).  But the fact that the entree portions are so big ROCKS, and I can't really complain too much about pad thai at dinnertime costing only $6.95.Whew, that was long!  Usually my 4-star reviews are short and full of praise, so I feel bad.  Song is actually pretty great and I'll def keep coming back for more, but those are 2 things I wish they'd fix!",4.0
"Really stellar Thai food at great prices. A very popular night and weekend spot, so expect a bit of wait. Nice waitstaff, but usually quite busy and can be slightly unattentive. Cash only.",4.0
"The Pad Thai is addictive! I'm writing this review and I'm craving more! The food is great, the portions are huge, the service is good, the prices are even better!!!! Will go back real soon! I hope they remain consistent! I'm definitely a fan!!!!!",5.0
Love love love this place!!!,5.0
"My boyfriend and I ate at Song this past week while visiting New York. I wanted something on the lighter side to eat and I wanted to sit outside, so I felt, based on other Yelp reviews, that Song was probably a good choice.Our appetizers were the best part of the meal in my opinion. We had the house salad with their peanut dressing (very good, and good portions- we shared!) and the summer rolls (served with a delicious mustard sauce and a plum sauce of some kind).I ordered the vegetarian spicy noodles, but I'm pretty sure they brought me the vegetarian pad see ew... or the spicy noodles weren't very spicy at all. My boyfriend ordered the coconut green curry with vegetables which he says was ""awesome, fantastic in his opinion"". I tried it and it was very good.The service was very slow. We had to wait for about 20 minutes after eating for our waitress to come over so we could get our check.On the upside, the weather was nice and we loved the patio. Very cute.I think it'd be a better choice for appetizers and drinks outdoors than for a full dinner.",3.0
"I thought I wrote a review for this, but I guess not. One of my fav thai spots. Inexpensive, yummy and consistant. Came a couple of time for lunch and dinner. The lines are really long for friday/saturday dinner. So when I want to go on a weekend I usually go for lunch. The menu items generally looks the same with the choice of chicken/beef/ seafood and vegetables. What I usually get here is the calamari, pad thai, and the curry dishes. I haven't tried a dish that was bad. They have a back yard patio for the summer time but I must warn you to not sit back there because there are misquotes lurking everywhere.. Ended up with 3 bites after dinner on a nice summer day last yr. So I don't sit there anymore. I will visit it again.",4.0
"Service was fast! Had a chicken salad, which was amazing. Will go again",3.0
"I love song food but was really put off by our waitress--undoubtedly the rudest and unfriendliest waitress there. Scowling she was when she took our order and plopped the plates down. We had to ask her twice for a refill and even though we requested more napkins, she didn't bring them. She later bumped into me from behind as I was waiting for the restroom and I almost lost it. Beware the asian tomboy waitress with short hair! She can manage to ruin otherwise good food!",3.0
"Meh, i am not the best judge of alt-asian cuisines.  I prefer to stick with Chinese or Japanese.  Tried SONG last night.  It was good, not great.  I would have liked to see more vegetables in the fried rice and pad thai dishes we ordered.  The curry chicken samosa was quite tasty.  The calamari was crispy outside and nicely done inside.  The chicken dish we ordered, gai kratiam, was also kind of light on the key ingredient.  Bottom line...i will never go head over heels over thai food, but this place was better than most that i have tried.  What i like best about Thai food is the iced coffee.",3.0
"Tasty cheap food brought to your table quickly. Way too loud, don't go if you are planning on catching up/getting to know someone...",3.0
"Man does this place need a reality check.So a few friends and I were in the mood for some yummy Thai and after reading the reviews decided on this place. Mistake number one.From the minute they stuck us in the corner (is it because we are gay) things went down hill. Our server, on multiple occasions pretended the music was too loud to hear us...and just walked away mid sentence. Example: ""Can I please get a coke with lemon?"" Server: ""It's so loud in here (as she is walking away)After the whole drink issue was finally resolved out came two of the four entrees we ordered, approx. 15 minutes later the other two came out. Who doesn't love to have their food 15 minutes before the rest of the table receives their food? On to the actual food.I ordered Pad Thai, which I am guessing is the most ordered dish on their menu or at least ordered very often... Completely raw, uncooked noodles was what I got.Not kinda cooked, not mostly cooked with a few minor mistakes, totally uncooked. I called the waitress over, told her the problem and instead of asking me if I would like a different entree she just picked up the plate and walked away as she was mumbling ""I will take it off the bill"". Are you serious??Let's not forget the staring and whispering coming from our server and her kitchen friend as she was packing up my friends leftovers. Amazing. In addition (if that whole shpeel wasn't enough) they accept cash only, yes 2010 and a restaurant accepts cash only.All in all skip it, there are much better eating options in that area minus the attitude and undercooked food.",1.0
"Respectable Thai for reasonable prices, in gigantic portions. I've been here twice and didn't have a wait either time, which to me is a mostly acceptable tradeoff to how much the staff here hurry you through your meal in their quest to turn tables. It does get pretty loud when the dining room is full. I get that hard-edged modern lines are part of their aesthetic, but does ear-piercing volume have to be as well? All it would take to temper the noise is investing in a few soft surfaces.",3.0
"The Pad Thai is addictive! I'm writing this review and I'm craving more! The food is great, the portions are huge, the service is good, the prices are even better!!!! Will go back real soon! I hope they remain consistent! I'm definitely a fan!!!!!",5.0
Love love love this place!!!,5.0
"My boyfriend and I ate at Song this past week while visiting New York. I wanted something on the lighter side to eat and I wanted to sit outside, so I felt, based on other Yelp reviews, that Song was probably a good choice.Our appetizers were the best part of the meal in my opinion. We had the house salad with their peanut dressing (very good, and good portions- we shared!) and the summer rolls (served with a delicious mustard sauce and a plum sauce of some kind).I ordered the vegetarian spicy noodles, but I'm pretty sure they brought me the vegetarian pad see ew... or the spicy noodles weren't very spicy at all. My boyfriend ordered the coconut green curry with vegetables which he says was ""awesome, fantastic in his opinion"". I tried it and it was very good.The service was very slow. We had to wait for about 20 minutes after eating for our waitress to come over so we could get our check.On the upside, the weather was nice and we loved the patio. Very cute.I think it'd be a better choice for appetizers and drinks outdoors than for a full dinner.",3.0
"I thought I wrote a review for this, but I guess not. One of my fav thai spots. Inexpensive, yummy and consistant. Came a couple of time for lunch and dinner. The lines are really long for friday/saturday dinner. So when I want to go on a weekend I usually go for lunch. The menu items generally looks the same with the choice of chicken/beef/ seafood and vegetables. What I usually get here is the calamari, pad thai, and the curry dishes. I haven't tried a dish that was bad. They have a back yard patio for the summer time but I must warn you to not sit back there because there are misquotes lurking everywhere.. Ended up with 3 bites after dinner on a nice summer day last yr. So I don't sit there anymore. I will visit it again.",4.0
"Service was fast! Had a chicken salad, which was amazing. Will go again",3.0
