"I'm a creature of habit.  I love thai food and I love trying new dishes.  However, the two don't seem to mesh well when dining out for thai food.  I seem to always pick the same few noodle dishes when eating at thai restaurants.  On my visit to Song, I choose one of my favorites, Pad Woosen with shrimp.  I totally struck out.  The fucked up thing is that this third time in a row I have struck out with Thai food (in each case I ordered one of my usual favorites). I'm going to take this as a sign.  A sign from the thai food deities that its time to branch out to other dishes.  Luckily, the whole meal wasn't a total loss.  My cousin ordered a green curry dish that was nice and spicy and absolutely delicious.  Our appetizers were delish as well, especially the curry pasty/puff pastries.  The spring roll appetizer was good as well, and kudos to the waitress to having them prepare it to share.  I must admit this place seems misleading, or at least to me.  You walk in and its this nice swanky looking place with a turntables and sleek furniture.  Then you look at the prices.  What?  How is this so cheap, especially for Brooklyn!?!?  Thai back at home is more expensive than this (and for lesser surroundings).  Service was spot on as well, despite us being on a time constraint.  So overall, Song wasn't a total loss.  It did its job, therefore its a-ok in my book...I just have to remember to venture away from my old, and tired, choices.  **cash only**",3.0
"GREAT vegetarian pad see ew and red curry and unbeatable value. The Thai iced tea is tasty and the service is quick, plus waiters do not rush you out after eating although the place is bustling even on a weeknight. We didn't have trouble being seated despite the no-reservations policy. My only complaint, as a vegetarian, is that there was no vegetarian duck (my favorite for Thai) even though I called ahead and was told there is. I'm not sure if this is typical or not - I was told there normally is vegetarian duck, but it wasn't on the menu and wasn't available that night. Highly recommended anyway!",4.0
"This is Joya's sister restaurant on 5th Ave. What a joya indeed (sorry). I was half-expecting a hole-in-the-wall takeout counter with a grouchy and dour non-Thai server/order taker. Instead, I walked into a near-replica of Joya: hip, modern interior with a darkened dining room; small, geometric tables; and a DJ booth. The garden outside is very pleasant and surprisingly spacious.The food was strong--all four people were satisfied. My massaman curry was fresh, spicy-sweet, and delicious. The green curry was well executed, too, as was the pad thai (a fair measure of any decent Thai eatery). The mango salad was decent and I gobbled up the spicy octopus salad. The food tastes even better on the way down when you see the prices--this is one of the best dining values in New York City. The specials, averaging about double the price of an entree, hover in the very low end of any moderately priced restaurant. And, as any respectable Thai restaurateur knows, symmetrically priced wines are a great bonus.",5.0
"My husband and I thought this place was just okay. We've both had better thai good. I got the chicken pad thai and it was fresh, but not my favorite I've had. My main complaint is that we were in for a late lunch and the server was pretty grumpy and everything took a long time for there only being three tables occupied. The other thing that sucked was this place is cash only, since we ordered from a paper lunch special menu which didn't say it, we didn't know until we went to pay. So be advised!",3.0
"Several years ago I order takeout from Song and it wasn't great, wasn't awful so I put that knowledge in my back pocket and continued to search for other options in the area. This week, in the mood for Thai, I decided to give it another chance given the continual stellar reviews received. Big mistake. It might just have been the worst meal I've had in 14 years in NY. First, what is the obsession with the lemon. It was in each of the mains ordered and by the time we sat down to eat, everything had been completely overwhelmed with the lemon flavor. For the beef dish, it might have actually improved it because as best I could tell, all they did was boil some nasty beef and throw it into a container. I basically ate a bite of each for taste and chucked the rest in the garbage. Just writing this review makes me so angry. How can places get away with this and where are the others reviewing this place going? Is it some alternate universe I don't have access to or do people like beef boiled in lemon water. Erasing from me memory in 3.2.1....",1.0
"Superb meal for a great price! Delicious. Absolutely amazing Thai food. BUT service is not great, not even good, it's just...well...it's just ok and at times frustrating. With that being said, I'm still going. What's most important to me is the food and atmosphere. Ideal ambiance. They even have garden seating which is always a plus on Summer days.It's not pricey!!! For 2 people you will spend $50 or less. Depending on how much you eat of course. ;)",4.0
"I think this place is great for large parties. The food is inexpensive and delicious. I was there with 10ish people and the bill was minimal. The drinks, which are well made, is where they get you on the bill. Also, I waited so long for a table, I think a birthday passed. But to be fair, Im impatient. (but it was a long wait).",4.0
"Don't let the cheap prices fool you, this food is anything but cheap. Great flavors, huge portions, what more can you ask for. Even bottles of wine are cheap compared to other restaurants.Big fan of the kang massaman, fried calamari with that spicy tangy sauce and their fried rice dishes are excellent as well.Service can be a bit slow especially on busy nights but overall a must place to try, it won't disappoint.By the way, CASH ONLY",4.0
"A fellow coworker convinced me that this was the ""HOT"" spot for Thai food. Well I wasted no time in trying it out so I went there today!I was looking for a sign outside that read ""Song"" and there was none!  It was a bit strange how to get inside, since there are 3 doors and it's the door on your right that opens to let you in. Looking around inside the restaurant, it had a full bar, dim lighting with candles on tables, a DJ booth and an outdoor garden with table and chairs. I placed my order and returned back in 10 minutes. I know it's not the same as eating in... but hey, it was convenient and I didn't have to go home and cook.Well for starters here's what I ordered : The Fresh Thai Summer Roll, Fried Calamari and the Shrimp Pad Thai.I can't tell you that the drive home with a shopping bag filled with Thai food was indeed making me hungry. I wanted so bad to sneak something out of the bag at the next red light.The calamari had all small ringlets (no legs) and a really nice spicy sauce served with it. The Pad Thai was nutty and really good. The Summer Roll had a mustard and sweet sauce on it. The food was indeed very fresh and yummy! Oh, I did notice at the bar these small pieces of paper in a glass and when I asked what they were for the waitress replied ""You write your drink order on it and give it to the bartender"", Ah ha...It makes sense with the DJ playing the bartender will get the order right. The food quality, presentation was very good and the price was right! BTW, No credit cards and Cash only!Will I come back, sit down and enjoy a nice meal with a glass of wine? Well as the Terminator said....""I'LL BE BACK!""",4.0
"It really pays to be a regular here so that the hostess knows your face and seats you ahead of the crowd. With the 10 million thai restaurants on 5th, I think it really speaks volumes that this (equally cheap) place is still always packed. In case you're a non-believer, here's what I like:Spicy noodles. Solid every time. And the place is authentic enough to bring you one of those thai spice caddies on request.The whole fish special. Usually deep-fried in some sort of sauce over noodles. Always excellent.Calamari. Cliche, I know. But they're always crispy and the chili sauce is so good.The peanut sauce: on thai house salad, on your finger... delicious.Curry chicken puffs. When they are on the menu, they're the best version of this little fried appetizer. Go with your friends so you can order a table full of food and gorge yourselves for like $12 a person.",5.0
"Dear song, For long I have heard of your melodious praises, actually that was for your, I suppose, better tasting step sister, Joya? Haven't been there yet, and I'm not too sure I will even venture a go, after all you are related, and if that includes the cooking, I think that will be one meal I will not regret not having..,so! Dear song, I came to you starving, STARVING, and your food didn't taste good, and everything tastes good when you're starving, right?! NO, sadly no. I know you're cheap, and I guess you think that somehow makes up for not having any vegetables in your ""vegetable spring rolls"", and makes you far above cooking your rice noodles in your pad thai till they're actually cooked, I mean who wants cooked noodles anyway! Totally overrated I know. And I know, I know, I'm sure you think no one can tell you didn't bother rinsing your rice noodles so they don't wind up being mushy on the outside while still not being cooked on the inside...I know, again, waste of your precious time, which I'm sure you rightly equate to money, but if that's the only thing you care about, which I'll take a wild guess it is, cause your food is like the Panda Express of Thai cuisine, then invest in your precious ""time is money"" mantra and put a little more time into getting the finer details that customers notice, that takes a dish from passable to unbeatable, that makes a customer WANT to come back, and in the long run, you will get your money and more!...take pride in your establishment! Put some love into that food! Take a vacation! Something! Go to Thailand! Get that passion and drive for making the BEST thai food you can make. After all a spring roll is not JUST a spring roll is it? May you find your thai soul again...",1.0
"Service is fast but bad, the waiter never brought our drinks and fill up our waters until 30mn later we had our food. The  food is good enough for the price but there are being really cheap on what ever meat you order with your noodle, like woon sen with shrimp comes with a lot of noodle and 4 tiny pieces of shrimp, same goes for noodle with chicken. I order grilled salmon with mango salad which was triple the price of the mango salad just because I had a grilled salmon on top...We order mango salad and we had hair in it. Overall the experience ok. But good be much better. The outdoor is really nice even though they have something that looks like a toilet cabinet, weird...",2.0
Amazing food great prices great music and ambience .. Try everything and get a bottle of wine,5.0
"Would someone please help me and tell me what I'm missing. I've been to Song four time and have yet to be anything other than unsatisfied and/or disgusted. Why did I keep going back? Low, low prices!I've had better tom-yum soup from stands, better red curry from packets and better service in Macy's. . .on black Friday. Ok no, I'd never go to Macy's on black Friday but you get the gist. Song is loud. Too loud. It's quick. Too quick. And it's bad. Too bad? Oh and I found a hard piece of plastic in a noodle broth one day. Their response? 'Ew.' Yeah, mine too.",2.0
"Oh, Lordy Lou..Song.  Song, Song, Song.It's incredibly busy.It's incredibly loud.But that's because everyone loves it, and is having a great time.I doubt that I'll be saying anything new here:  The food is really good, and absurdly cheap compared to every other place in the neighborhood.  And the food is REALLY good.  No, I didn't already say that.  REALLY DAMN good!  Also the staff is awesome.  We got caught on the patio in the rain, and she helped us hustle everything inside.  I really want to go back.  Immediately. Anyone hungry?",5.0
"Fantastic, cheap, filling, yummy, and size-able portions! This is a go-to place if you are ever in the mood for thai. The back garden seating is amazing, perfect for a date or even a nice gathering with friends. I started off with a large calamari - yea, they weren't kidding about the large part. There was more than enough calamari to go around, I would say this is good for 4-6 people. The calamari did not taste super greasy or overly fried. The batter was light and crispy. The squid was very tender. Great taste. The dipping sauce added a nice flavor to the calamari, my only complaint is that they need more dipping sauce for that huge plate! I also ordered the spicy noodles. Wow, unless you eat obscene amounts, you can share most of the entrees with one other person. There was a lot of soft, wide rice noodles mixed in with big chunks of tofu (instead of chicken or beef). I really liked the big triangular pieces of tofu because they soaked up a lot of the sauce and spice - yummy! Great dish. I will definitely be coming back!",4.0
Great food and a fun place - very reasonable prices.  Nothing over $10.,4.0
"FOR UPDATED REVIEW SEE LAST PARAGRAPH!Really a 3.5. What I liked:* The food ~ good (not great but very good) * It is one of the few reasonably priced restaurants in Park Slope* The big portions* The back garden (which we almost ate in but because they don't seat     partial parties, which makes sense on a Saturday night, we had to sit   inside because two of our party got delayed on the subway).Which brings me to what I did not like:* The inside of the restaurant is loud. Really loud when the table next to  you decides shouting is the best way to communicate with each other.* Our waitress did not get our order right..two of us asked for extra spicy  and were served mild dishes (we surmised that  because it was so   loud that she really did not hear either of us ask)* The service...we had to ask for more water and our waitress really did   not seem to care if we liked our meal or not (a good wait person   knows how to at least fake caring!* The hostess needs to get off her cell phone and talk to those waiting   for a table. I'd go back, but on a weekday or at night when the backyard garden has a table available in less than an hour (they do not take reservations)Last night we went back and sat in the backyard. Len who sat us down was great, the service was great and the food this time was great, so I've raised my review to four stars because if you eat inside Song is a 3 star restaurant but if you sit in the backyard where it is very pleasant, it is a 5-star restaurant!",4.0
"Fresh ingredients, huge portions, cheap prices. My favs are the mussels, calamari, green curry and pad thai.  Can't go wrong.  This place is out of this world.  I could eat here every day.",5.0
"I always think of Thai food as being healthy, with nice fresh flavors of cilantro, lime, and ginger, and usually in a nice, relaxing setting.  Well, you won't find those flavors or any peace here. The pad thai is so greasy, not in a sesame greases way, but saturated in a cheap, bland oil without any basic flavors.  Really foul!  The veggies in red coconut sauce weren't bad, but not worth going back for.  I'd rather spend more money for a better meal.",1.0
"Dear song, For long I have heard of your melodious praises, actually that was for your, I suppose, better tasting step sister, Joya? Haven't been there yet, and I'm not too sure I will even venture a go, after all you are related, and if that includes the cooking, I think that will be one meal I will not regret not having..,so! Dear song, I came to you starving, STARVING, and your food didn't taste good, and everything tastes good when you're starving, right?! NO, sadly no. I know you're cheap, and I guess you think that somehow makes up for not having any vegetables in your ""vegetable spring rolls"", and makes you far above cooking your rice noodles in your pad thai till they're actually cooked, I mean who wants cooked noodles anyway! Totally overrated I know. And I know, I know, I'm sure you think no one can tell you didn't bother rinsing your rice noodles so they don't wind up being mushy on the outside while still not being cooked on the inside...I know, again, waste of your precious time, which I'm sure you rightly equate to money, but if that's the only thing you care about, which I'll take a wild guess it is, cause your food is like the Panda Express of Thai cuisine, then invest in your precious ""time is money"" mantra and put a little more time into getting the finer details that customers notice, that takes a dish from passable to unbeatable, that makes a customer WANT to come back, and in the long run, you will get your money and more!...take pride in your establishment! Put some love into that food! Take a vacation! Something! Go to Thailand! Get that passion and drive for making the BEST thai food you can make. After all a spring roll is not JUST a spring roll is it? May you find your thai soul again...",1.0
"Service is fast but bad, the waiter never brought our drinks and fill up our waters until 30mn later we had our food. The  food is good enough for the price but there are being really cheap on what ever meat you order with your noodle, like woon sen with shrimp comes with a lot of noodle and 4 tiny pieces of shrimp, same goes for noodle with chicken. I order grilled salmon with mango salad which was triple the price of the mango salad just because I had a grilled salmon on top...We order mango salad and we had hair in it. Overall the experience ok. But good be much better. The outdoor is really nice even though they have something that looks like a toilet cabinet, weird...",2.0
Amazing food great prices great music and ambience .. Try everything and get a bottle of wine,5.0
"Would someone please help me and tell me what I'm missing. I've been to Song four time and have yet to be anything other than unsatisfied and/or disgusted. Why did I keep going back? Low, low prices!I've had better tom-yum soup from stands, better red curry from packets and better service in Macy's. . .on black Friday. Ok no, I'd never go to Macy's on black Friday but you get the gist. Song is loud. Too loud. It's quick. Too quick. And it's bad. Too bad? Oh and I found a hard piece of plastic in a noodle broth one day. Their response? 'Ew.' Yeah, mine too.",2.0
"Oh, Lordy Lou..Song.  Song, Song, Song.It's incredibly busy.It's incredibly loud.But that's because everyone loves it, and is having a great time.I doubt that I'll be saying anything new here:  The food is really good, and absurdly cheap compared to every other place in the neighborhood.  And the food is REALLY good.  No, I didn't already say that.  REALLY DAMN good!  Also the staff is awesome.  We got caught on the patio in the rain, and she helped us hustle everything inside.  I really want to go back.  Immediately. Anyone hungry?",5.0
"Fantastic, cheap, filling, yummy, and size-able portions! This is a go-to place if you are ever in the mood for thai. The back garden seating is amazing, perfect for a date or even a nice gathering with friends. I started off with a large calamari - yea, they weren't kidding about the large part. There was more than enough calamari to go around, I would say this is good for 4-6 people. The calamari did not taste super greasy or overly fried. The batter was light and crispy. The squid was very tender. Great taste. The dipping sauce added a nice flavor to the calamari, my only complaint is that they need more dipping sauce for that huge plate! I also ordered the spicy noodles. Wow, unless you eat obscene amounts, you can share most of the entrees with one other person. There was a lot of soft, wide rice noodles mixed in with big chunks of tofu (instead of chicken or beef). I really liked the big triangular pieces of tofu because they soaked up a lot of the sauce and spice - yummy! Great dish. I will definitely be coming back!",4.0
Great food and a fun place - very reasonable prices.  Nothing over $10.,4.0
"FOR UPDATED REVIEW SEE LAST PARAGRAPH!Really a 3.5. What I liked:* The food ~ good (not great but very good) * It is one of the few reasonably priced restaurants in Park Slope* The big portions* The back garden (which we almost ate in but because they don't seat     partial parties, which makes sense on a Saturday night, we had to sit   inside because two of our party got delayed on the subway).Which brings me to what I did not like:* The inside of the restaurant is loud. Really loud when the table next to  you decides shouting is the best way to communicate with each other.* Our waitress did not get our order right..two of us asked for extra spicy  and were served mild dishes (we surmised that  because it was so   loud that she really did not hear either of us ask)* The service...we had to ask for more water and our waitress really did   not seem to care if we liked our meal or not (a good wait person   knows how to at least fake caring!* The hostess needs to get off her cell phone and talk to those waiting   for a table. I'd go back, but on a weekday or at night when the backyard garden has a table available in less than an hour (they do not take reservations)Last night we went back and sat in the backyard. Len who sat us down was great, the service was great and the food this time was great, so I've raised my review to four stars because if you eat inside Song is a 3 star restaurant but if you sit in the backyard where it is very pleasant, it is a 5-star restaurant!",4.0
"Fresh ingredients, huge portions, cheap prices. My favs are the mussels, calamari, green curry and pad thai.  Can't go wrong.  This place is out of this world.  I could eat here every day.",5.0
"I always think of Thai food as being healthy, with nice fresh flavors of cilantro, lime, and ginger, and usually in a nice, relaxing setting.  Well, you won't find those flavors or any peace here. The pad thai is so greasy, not in a sesame greases way, but saturated in a cheap, bland oil without any basic flavors.  Really foul!  The veggies in red coconut sauce weren't bad, but not worth going back for.  I'd rather spend more money for a better meal.",1.0
"The food here is dynamite, the prices reasonable, but the ambiance sucks. Some friends and I arrived around 7pm on a Saturday and were told it would be an hour long wait. We agreed to get a drink at the bar and wait it out. Fortunately, the bar tender took FOREVER to even see us and get our drinks, so the time went by pretty quick. The restaurant itself is a big downer. Drab decor and futuristic lighting make for a very pretentious scene. If I hadn't been with friends, I wouldn't have bothered to stay--simply due to the Faux-Shite feel of the place. It makes me wish they'd open up a simpler restaurant nearby without all the modern bullshit.Later after we'd gotten seats and ordered, our whole table was pretty speechless at how awesome our food was. FANTASTIC. Though I'm not sure if we were all just crazy hungry due to the stupidly long waiting time. Sate shrimp was awesome, Spicy noodles were good (though not spicy enough) and the pad see yue was fantastic. One dish that i never understand at thai restaurants is fried calimari...but this was one of the best i've had. seriously worth it, especially if you hate fried calimari...it will change your mind.",4.0
"It's good, it's cheap.  It's inconsistent though and the pictures of giant crying babies make the inside atmosphere sorta weird...  But outside it's nice.",3.0
"Their spicy basil noodles are like crack. Seriously. Delicious smoky flavor and the perfect amount of spice and veggies. I also love their mango salad.Pros - delicious and inexpensive food, outdoor seatingCons - wait staff isn't very friendly, noise levels can get VERY loud (hard to hear the people at your table), cash only",4.0
Was much better a few years ago. Extremely disappointed in this place. All the noodles were burnt and they definitely decreased their quality.  I will not be coming here anymore.,1.0
"I agree with Sarah W's term ""suspiciously cheap"" but in the end there was nothing suspect about Song, which towers above any other Thai competitors in the Park Slope area. It did take awhie to get seated, as it seems Park Slopers nostalgic for their single days living in Manhattan have recreated a small slice of hip/late-night bar/restaurant scene and placed it on 5th Avenue.All that anyone need care about, though, is the qualify of the food, and the eggplant curry, pad thai, thai spicy soup and spring rolls were all very good and well worth the wait. Perhaps I'll just order for pickup next time.",5.0
"Thai food has never been this good.The Beef Pad-see-u is the best dish!  I like to mix it up with the Spicy Chicken or Pad Thai but I always end up coming back to the Beef Pad-see-u. Start off with the fried Calamari and perhaps a mango salad. The Riesling makes it all wash down real nice.The best part is the price...what price? A meal for 3 runs you about $20.00 (minus drinks). Where can you get great quality food that costs close to nothing? Oh right, Song!",5.0
"I love National, I love Joya, and now I love Song.Delicious food, quick and friendly service, and outdoor space. What more could you ask for? Oh ya, GREAT PRICES on food and bottles of wine!!!Nothing is every greasy or oily. I love it here. Excellent flavor in all of their thai food. The noodle dishes are all yummy. All Veg based dishes are always crisp and fresh. My faves are green mango salad, pad thai, soups, and the veg in garlic sauce. Wash it all down with a bottle of Reisling, and you are all set!Thanks Song, Joya, and National----I love you.",4.0
