"I most often take Song to go so my review is just of the food which is great and inexpensive - my favorite Thai place! (*note this the twin-sister restaurant of Joya in Cobble Hill).Dining in can be loud and busy, but usually still enjoyable.My favorites:Pad See YuMassaman CurryChicken and Broccoli *check out the specialsNot my favorites (but still good):fried calamaripad thai",5.0
"Lovely setup, good atmosphere, Helpful wait staff! This was an impromptu decision to do Thai for dinner and this pops up. A little difficult to find because they got a piece of paper on their door mentioning the name. Once inside, you are greeted to the beautiful setup. They also have an outdoor table service but it was closed when i had been there. It was a little noisy and I couldn't have asked for a better atmosphere.Food was delicious. Try anything with the chilly basil sauce. It will not disappoint. Their house wine is among the few good wines I have tasted so far. Needless to say, Im not much of a wine drinker.P.s It was not very spicy.",4.0
"A couple week ago I was in Brooklyn visiting family. We had spent the whole day walking around, sightseeing and shopping. The whole day passed us quickly and before we knew it, it was 9:30 and we were starving. Someone recommended Song as a great place to get some Thai food. Big portions and low prices too. I couldn't say no to that so off we went. When we arrived they were about an hour out from closing. The restaurant was still pretty busy but we were seated quickly. I ordered the glass noodles, my sister ordered the pad thai, and my brother ordered the yellow curry. The food came pretty fast and they weren't kidding about the large portions. Holy cow! The food was pretty delicious, nothing to complain about there. The curry was the perfect amount of spicy. Sometimes I notice curry is either too spicy or not spicy enough. I did feel a little rushed towards the end of the meal but I can't really blame the staff, I know they want to go home too. We paid our tab and left with our leftovers (which made a great breakfast that next morning). I really enjoyed my meal and I'll definitely go back when I'm in the area.One tip, stay away from the house red. I ordered it and couldn't stand the taste. :(",4.0
"My friend recommended this place so i decided to bring my family here for dinner one night. We didnt have rsvp and it was a wkend.. but only waited abt 5-8 mins (we got lucky i guess! Cos it was def a full house). I do have to say i dont think their vents are good enough becos it was very smokey inside the restaurant and i felt it in my eyes. The tables were pretty small or their dishes were too big.. Becos we were strugglin w space..Their thai iced tea is really good as it is not too milky or too sweet like most thai places. I can actually say one of the best thai iced teas ive had.My bf really liked their curry, my son and i enjoyed their steak and my sis really liked her pad thai. The appetizers were also very good, puff pastry, calamari, and mussels.Customer svc was decent--it was a full house so we did hafto wait here and there to get our orders taken down and to get condiments/utensils and check. Perhaps they can arrange more waitress/waiters on busy nights.. Think i only saw 2 walkin around.They have an outdoor area but too bad it was too chilly and didnt get to explore it. We will definitely be back when the weather gets warmer :)",4.0
"I love love love Song.  The food is so tasty, the ambiance is hip & sexy and the price is very reasonably.   Great date night spot in a budget, but you will feel like you're at an expensive restaurant.  If you want to this should be you're #1 place!!",5.0
"On a cold February day when everyone had the good sense to stay indoors, I linked with a friend to eat some Thai. Song was the choice and there will be another and another because Song's food was delightful. They do the known Thai dishes with respect and with a little extra flair. Mango Salad: refreshing & fillingBasil Noodles (without egg): meaty, warm, smokey from open fire preperation, seasoned perfectlyGive this place a try. It is the perfect staple when you aren't feeling to try someplace new.",4.0
"I come here for the chicken curry puffs and the Pad Thai. In that regard, this place is excellent. Various friends who order different dishes have also had really good things to say. I tend to eat here when I'm craving Thai and I'm in slope. Their sister restaurant, Joya, in Carroll Gardens is equally scrumptious. Their portions are humongous, their prices are cheap and the service has always been pretty good with each visit. For Thai, I'd recommend Song if you find yourself in the nabe.",4.0
Try the whiskey sour...and get the fried calamari for the app...that's all I gotta say.,5.0
"Great find in Park Slope. My girlfriend and I were looking to find a nice spot for a large group of people for her birthday. My only gripe about the restaurant is that they don't take reservations in advance, but rather walk-in reservations instead. It can be a wait on a Saturday night but that's to be expected. Otherwise the food was GREAT. Portions were big and the prices were very good. I'd definitely recommend this place for if a couple were to just go out to eat together or for a date night with another couple. During the warmer months there is a small patio area and seems very nice to eat there too. I'm sure we will be back here again very soon. Definitely a little gem worth checking out",4.0
"Went for lunch with a friend. Pad Thai was sooooo goood, I didn't need to add any sauces. The spicy chicken and pineapple fried rice was good too. I have to go back. Two entrees were 24 bucks (with tax)",4.0
"My favorite place for Pad Thai. I've brought many of my friends here and not surprisingly, they fell in love with the Pad Thai too. There is a perfect balance between the sweetness, sourness, and saltiness. Palate party! The Panang curry is my second go to entree. The Tom Yum soup is very good on cold days. The prices are very affordable but Song only accepts cash. The place has a hip modern feel. I don't like the pictures on the wall very much but everything else is very nice. Both bathrooms are modern and usually clean. The back outdoor seating is comfortable and cute but the tiny pebbles are awkward to walk on.I love the transparency of the kitchen. You can see the cooks at work from the inside as well as the outside.",5.0
"We ate here last night for the first time, and will definitely be going back. Good service, excellent food and a really friendly manager who impressed us with his delicate handling of a tricky situation involving a couple letting their child run around on the furniture. We had the bbq wings for starters, then three entrees between us (masaman beef curry, gai kraprow and amazing pad thai, which was just as good for leftovers the next day.) the whole bill was less than $40. our server was polite and attentive, just what you need.",4.0
"Good Thai and not crazy expensive like some other places in Park Slope/Prospect Heights. Great tom yum. Decent spicy noodles - though not really that spicy and a little soggy at the bottom (also, I asked to add broccoli and I think that helped).",4.0
"You know, I'm originally from Queens and my wife and I always go out of our way to find awesome Thai food! This place is definitely the best thai food place in Brooklyn! The portion sizes are pretty large, the prices are cheap and the ambiance is pretty hipster. I always order the Pad Thai Beef which can't ever go wrong, but my wife has tried a handful of other dishes and loves the Red, Panang Curry with Rice! Their chicken curry puffs are pretty bomb too. Calamari to start off (can feed 4) is not a bad option either :) Ask for the ""spice rack"" and try the powder pepper on your pad thai for an extra kick!",5.0
"What happened to the service? had to break a neck and arm to get a refill of water and it wasn't even busy. the people that came after us that ordered the same dish as me got their food first.food here has always been good, but I'm super disappointed in the  service.",3.0
"Inexpensive, delicious food. Poor service. I tend to be very forgiving about service, but throughout our meal at Song I was truly distracted by our server's inattention. Fifteen or twenty minutes after I wanted to order a second drink, we managed to get his attention and I ordered it, not even sure if I wanted it anymore. Didn't matter. He never brought the drink. In addition to being frustrating to me the customer,  this would anger me if I were his boss, as it's a loss of money to the restaurant! Smh. I really enjoyed my dish of grilled shrimp pad thai with avocado, and my Better Half had a half chicken cooked perfectly falling off the bone, served with just-right crunchy brussels sprouts. Were I rating Song on the food alone, I'd add a star. Too bad.",3.0
"I just don't get it. I've been to Joya in Cobble Hill and loved it. I've been to National in Fort Greene and loved it. But for some reason Song in Park Slope (from the same people) just isn't as good.Service was lackluster. There was nobody at the front desk to seat us when we walked in because of how the kitchen is on the other side of the big wall.The food wasn't great. The shrimp pad thai was sour for some reason (this was without the addition of the lemon on the side). The chili/basil mussels were okay, but not great. Lots of unopened ones.I also had the crispy half duck in coconut curry. It was plentiful, and most of the duck sure was crispy. But it lacked any kick.But at least this location accepts credit cards.",3.0
"My personal experience on valentine day was quite horrible at song. They were out of shrimp steam dumplings and mango drinks. A restaurant running out of food, that's cool. Forget those minor things, the thing that pissed me off was the fact that other people came after us and had their appetizer and entree before my boyfriend and myself. I then realized that the waiter forgot to put in our food orders, I don't know why but it wasn't that busy to forget a couple that's sitting center stage in the midst of your restaurant. We're weren't hard to miss , for god sake we were like the only black couple there. Oh! When they realized they forgot about our food order ; immediately they rushed to the back and conjured up what I could only describe as a half ass meal not properly prepared. Thanks a lot guys . I won't be seeing you anytime soon.",1.0
"First off, this place used to be cash only and they have now started taking credit cards, except Amex. Came in on a Saturday evening, no wait but it was very busy inside. Water, utensils and menus were placed instantly on the table but there was a long wait to place an order. Looking around, there were only 2 waiters so we left it alone and enjoyed our conversation. Ordered calamari to start and I had the Spicy Seafood fried rice. It was just as delicious as I last remembered it to be. My husband had the Gai Pad Khing, chicken w peppers, onions, cabbage, carrots, and mushrooms in ginger sauce. It was our first time trying this dish and it was really good! My daughter had the mussels. Seems like they changed the sauce that they used to use because this time around it was more like a coconut curry sauce as opposed to spicy basil from the past. That was our mistake for not looking at the menu and just asking for it off hand. It wasn't to our liking but everything else was great! Huge portions.",4.0
"Hmm, where shall I begin... I think this place deserves 4 star. Mainly because of the price of the food. The atmosphere was really nice. I really couldn't tell that it was a thai food restaurant. I always like restaurants with dim-light atmosphere. It feels sophisticated and somewhat fancy. I ordered thai house salad (?) and it was just a bunch of greens and a little bit of peanut sauce. Then I also got the chicken puffs? I think that was the best and it tasted really good. The entrees were good as well. except the fact mine had more vegetables than noodles. I ordered spicy noodles w/ chicken. For the price, I would say it's fairly decent. It's only like a dollar more than what you would normally get at like a run down thai restaurant. They don't have a dessert menu because they only have like 2 choices which is a bummer because Im a dessert maniac. From what I recall it was something like mango sticky rice and like some fried banana. I Would come back if im near the area again.",4.0
"My favorite place for Pad Thai. I've brought many of my friends here and not surprisingly, they fell in love with the Pad Thai too. There is a perfect balance between the sweetness, sourness, and saltiness. Palate party! The Panang curry is my second go to entree. The Tom Yum soup is very good on cold days. The prices are very affordable but Song only accepts cash. The place has a hip modern feel. I don't like the pictures on the wall very much but everything else is very nice. Both bathrooms are modern and usually clean. The back outdoor seating is comfortable and cute but the tiny pebbles are awkward to walk on.I love the transparency of the kitchen. You can see the cooks at work from the inside as well as the outside.",5.0
"We ate here last night for the first time, and will definitely be going back. Good service, excellent food and a really friendly manager who impressed us with his delicate handling of a tricky situation involving a couple letting their child run around on the furniture. We had the bbq wings for starters, then three entrees between us (masaman beef curry, gai kraprow and amazing pad thai, which was just as good for leftovers the next day.) the whole bill was less than $40. our server was polite and attentive, just what you need.",4.0
"Good Thai and not crazy expensive like some other places in Park Slope/Prospect Heights. Great tom yum. Decent spicy noodles - though not really that spicy and a little soggy at the bottom (also, I asked to add broccoli and I think that helped).",4.0
"You know, I'm originally from Queens and my wife and I always go out of our way to find awesome Thai food! This place is definitely the best thai food place in Brooklyn! The portion sizes are pretty large, the prices are cheap and the ambiance is pretty hipster. I always order the Pad Thai Beef which can't ever go wrong, but my wife has tried a handful of other dishes and loves the Red, Panang Curry with Rice! Their chicken curry puffs are pretty bomb too. Calamari to start off (can feed 4) is not a bad option either :) Ask for the ""spice rack"" and try the powder pepper on your pad thai for an extra kick!",5.0
"What happened to the service? had to break a neck and arm to get a refill of water and it wasn't even busy. the people that came after us that ordered the same dish as me got their food first.food here has always been good, but I'm super disappointed in the  service.",3.0
"Inexpensive, delicious food. Poor service. I tend to be very forgiving about service, but throughout our meal at Song I was truly distracted by our server's inattention. Fifteen or twenty minutes after I wanted to order a second drink, we managed to get his attention and I ordered it, not even sure if I wanted it anymore. Didn't matter. He never brought the drink. In addition to being frustrating to me the customer,  this would anger me if I were his boss, as it's a loss of money to the restaurant! Smh. I really enjoyed my dish of grilled shrimp pad thai with avocado, and my Better Half had a half chicken cooked perfectly falling off the bone, served with just-right crunchy brussels sprouts. Were I rating Song on the food alone, I'd add a star. Too bad.",3.0
"I just don't get it. I've been to Joya in Cobble Hill and loved it. I've been to National in Fort Greene and loved it. But for some reason Song in Park Slope (from the same people) just isn't as good.Service was lackluster. There was nobody at the front desk to seat us when we walked in because of how the kitchen is on the other side of the big wall.The food wasn't great. The shrimp pad thai was sour for some reason (this was without the addition of the lemon on the side). The chili/basil mussels were okay, but not great. Lots of unopened ones.I also had the crispy half duck in coconut curry. It was plentiful, and most of the duck sure was crispy. But it lacked any kick.But at least this location accepts credit cards.",3.0
"My personal experience on valentine day was quite horrible at song. They were out of shrimp steam dumplings and mango drinks. A restaurant running out of food, that's cool. Forget those minor things, the thing that pissed me off was the fact that other people came after us and had their appetizer and entree before my boyfriend and myself. I then realized that the waiter forgot to put in our food orders, I don't know why but it wasn't that busy to forget a couple that's sitting center stage in the midst of your restaurant. We're weren't hard to miss , for god sake we were like the only black couple there. Oh! When they realized they forgot about our food order ; immediately they rushed to the back and conjured up what I could only describe as a half ass meal not properly prepared. Thanks a lot guys . I won't be seeing you anytime soon.",1.0
"First off, this place used to be cash only and they have now started taking credit cards, except Amex. Came in on a Saturday evening, no wait but it was very busy inside. Water, utensils and menus were placed instantly on the table but there was a long wait to place an order. Looking around, there were only 2 waiters so we left it alone and enjoyed our conversation. Ordered calamari to start and I had the Spicy Seafood fried rice. It was just as delicious as I last remembered it to be. My husband had the Gai Pad Khing, chicken w peppers, onions, cabbage, carrots, and mushrooms in ginger sauce. It was our first time trying this dish and it was really good! My daughter had the mussels. Seems like they changed the sauce that they used to use because this time around it was more like a coconut curry sauce as opposed to spicy basil from the past. That was our mistake for not looking at the menu and just asking for it off hand. It wasn't to our liking but everything else was great! Huge portions.",4.0
"Hmm, where shall I begin... I think this place deserves 4 star. Mainly because of the price of the food. The atmosphere was really nice. I really couldn't tell that it was a thai food restaurant. I always like restaurants with dim-light atmosphere. It feels sophisticated and somewhat fancy. I ordered thai house salad (?) and it was just a bunch of greens and a little bit of peanut sauce. Then I also got the chicken puffs? I think that was the best and it tasted really good. The entrees were good as well. except the fact mine had more vegetables than noodles. I ordered spicy noodles w/ chicken. For the price, I would say it's fairly decent. It's only like a dollar more than what you would normally get at like a run down thai restaurant. They don't have a dessert menu because they only have like 2 choices which is a bummer because Im a dessert maniac. From what I recall it was something like mango sticky rice and like some fried banana. I Would come back if im near the area again.",4.0
"Smooth martini, speedy and kind customer service, yummy spicy noodles. Salmon wasn't seasoned and a little dry for my taste.Over all, I would go back!",4.0
"Really enjoyed the atmosphere. Service was fast. Portions were small for the price, but the food was delicious. Had the Mango salad, green curry, and pad thai.",4.0
"I am giving this place 5 stars because it is 1) trendy 2) tasty 3)cheap! Came here with a friend and ordered the Chicken Pad thai ($8.50) and he ordered the Shrimp fried rice ($8). In less then 15 minutes our food came out even though it was a full house. Food was great , not bland at all. Gave a lot too.The restaurant has a outdoor seating area and inside every table has candles.There is art on the walls-- really a nice atmosphere. The staff is super nice and do not rush you at all, they let you take your time.  For the prices,the dining experience and food quality Song has earned its stars .",5.0
"Oh my my .... Price and quality of food match . They are not hard on your pocket . But don't expect greatness either . Can't complain . You get what you pay for. Atmosphere here,is great . Very busy I think it's more of a young vibe , since the young does not have a great palette but sure loves to be where it's happening and it's happening here they love it. Too bad it's not happening in the food .",1.0
"*This review is broken up into Overall Verdict (Summary), Experience/Service and Food details.---------Overall Verdict:Service: QuickVenue: Open and modern - indoor and outdoor seating availableFood: Cheap and big portionsAdditional details: CASH ONLY so for those who love plastic like I do, make sure you stop by a bank or have friends who like paper.Verdict: With its delicious and affordable food, efficient service and modern atmosphere, Song easily sings at least 4 stars and deserves an encore. ---------Experience/Service:Came here with a group of 6 on a Saturday night around 9pm. It was packed, but we were seated within 15 - 20 minutes so not bad. Our orders were taken immediately, and we were served in about 10 - 15 minutes.---------Food:We tried the Spicy Noodles with Shrimp and Pad See Eu. I recommend the Spicy Noodles for those who want their taste buds excited; the Pad See Eu was a tad too sweet for me (and I generally like sweet food [This is actually my go-to Thai dish.]). These also came in big portions so our grumbling stomachs were overly-satisfied (and we still had leftovers, which was good for our guy friends who could eat some more). One of us ordered Chicken with Broccoli, but it wasn't up to par with Song's usual-portion size; even when he asked for extra chicken, the plate wasn't filled.",4.0
"The atmosphere here is really cute and cozy, and there's also outdoor seating! For lunch, I ordered the Kai Gang red curry and my friend ordered the Pad See Ew. I was impressed. The portions were big and in my curry, there was a healthy portion of tender veggies, including eggplant, squash, peppers, and bamboo shoots. The chicken pieces were tender and the base was creamy. Other Thai places I've been to do not cook the veggies through, which bugs me because it feels like they're thrown in in a rush. Def would go back and try out other things on their menu! Didn't get any pics of the food, but I'm always sold on atmosphere.",5.0
"Definitely a hidden paradise! This is now, by far my favorite Thai restaurant in Brooklyn! They are cash only, but you gotta be cool with what the restaurant wants. It's totally affordable to carry cash to this place. The menu is super cute but they got casual with their specials menu which was just a colored piece of construction paper with hand written items. Hey, I love it when it gets casual! :) The mussels are delicious and I'm not always a mussels person. But they cook it in the peanut Thai sauce that is just super yummy. And it's a great dish to share as an appetizer. We got the Spicy Noodles with shrimp and the Kang Panang Nuur (Beef in coconut curry with Kaffir leaves) SUPER DUPER YUMMY!! It's also spicy - we ate it like it was soup! Loved it! LOL! The spicy noodles were not spicy for me at all, but they were delicious which made it all ok. The staff were great and friendly. Take a date here and sit on the patio. It is so adorable and you really do feel like you have stepped out of Brooklyn for a minute. I almost knocked them a star for not really having any heat in their Spicy noodles, but that should have been on me to tell them I can handle the Thai spice and to kick it up a notch. ;)",5.0
"Charming Thai restaurant in park slope! Food: Overall a 4 /5.spicy noodles with shrimp - generous portions of shrimp. The vegetables and herbs that were used complemented the dish. Rich in flavor, but it was a tad saltier than what I'm used to. These were the flat rice noodlesMussels - huge portions and the sauce was deliciousPad see-ew - it was full of flavor but i thought it was ok. Half way through, I wanted to try a new flavor. It didn't stand out compared to other pad see-ews. These were the flat rice noodles. Pad Thai - I have to admit, it's among one of the best pad thai dishes I've tasted. Excellent flavor and portion size. The only thing is...there's too much bean sprouts, but you can always push it aside. Service: It was ok. My family came on a Saturday night at 7pm. We waited for about 45 minutes. They were extremely busy, so they did the best they can. I was glad that they refilled our waters without us flagging them down. They came by once to see how our meals were and if we needed anything else. Ambiance: Pretty modern. They have a small section for bar seating. There is indoor and outdoor seating. I recommend trying the outdoor seating on a cool night.  Their menus are on construction paper and the specials are handwritten, which is rather unique. Tips: They do not take reservations and it's CASH ONLY!",4.0
"Best Thai place in Brooklyn for sure. Perfect atmosphere for family dinner or date night; outdoor seating is great, too. Best dishes are the pad thai and spicy noodles or any of the curry choices. I've brought many friends here and my whole family (who hates eating out) and everyone has loved it as much as I have. What makes this place really great is the prices, much cheaper than what you would assume. With a short wait, good service, and flavorful food, Song is definitely one of my favorites.",5.0
