"We have been to Song at least 20 or 30 times and tonight was the last time.  It was one of our ""go-to"" spots for a cheap and tasty meal.  It's kind of like you get what you pay for, but all the servers are usually friendly, the crowd is unpredictable but tolerable, and the music is loud but drowns out the kids and annoying diners.Tonight was our last meal at Song.  First, the table next to us left because of a giant roach sighting.  (I saw that she posted a comment already on here!)Then, we noticed lots of flies on the walls and eventually landing on our uneaten food.Last, we were about to leave when my son and the boy at the table next to us started drumming their chopsticks on the booth bench.  Out of nowhere a short, white guy pops out and wags his finger at us all and mumbles that he's just had the chairs cleaned or something. (I obviously can't hear him due to the loud music which I love/hate.)I ask my child to stop and he does.  The child nextdoor continues.  The manager returns and wags his finger at me again.  I jumped up and explained that the other boy does not belong to me and he goes off on this rampage about how it cost him $8000 to replace the torn upholstery in the bench.  Really?  This is the first time I've seen this guy in all the times we've been to Song.  I'm assuming from prior reviews that customer service / putting on a happy face is not his strong suit.  But now that I know that such an obnoxious person is running the show we will no longer be supporting them.  I feel bad because the waitstaff is usually very sweet.  However, there are plenty of other cheap and tasty Thai options in the neighborhood to choose from that will turn a blind eye to (1-minute's-worth of) drumming chopsticks.",1.0
The neighbourhood has a lot of good thai and this isn't particular better or worse than the others. Quite good nonetheless.,4.0
"i didn't like this place at first but it's really close to our house and was the only decent thai place in park slope. after awhile i realized the awesomeness that is SONG.The restaurant is roomy, modern and they have a beautiful backyard. Club music plays because thats just how all asian places roll. The service is meh but again that is very common in asian restaurants. They want you in and out! But the food. Oh. My. God.They have THE BEST pad see ew. Soft noodles covered in rich brown sauce steaming hot. I don't know what they put in this noodle dish but it is amazing. Don't worry it's not super salty, just really flavorful. Their curries are really good too. The green curry is tasty, the veggies are fresh and great huge portions! Their roast chicken is ok, there's a Thai place in manhattan that does it better but SONG's is decent. The Thai fried rice is great, a little sweet, perfect meat to rice to veggies ratio. The beef fried rice is very good as well.Their prices are unfreakin-believeable!!!!  How do they afford to stay in business charging people so little for such amazing food with huge portions?!!! Maybe its a mob front. That's the only explanation. But I don't care I hope SONG stays the same forever because I will be going there for Thai food forever.",5.0
I have been this place several times. Food is great. service is horrible. It seems that they don't care. I wouldn't have come back here after first bad experience if that was not for my family. My mom likes their food.,2.0
I cannot believe that two people can consume dinner and drinks (with tip) for under 30$...,3.0
"Best Thai food restaurant in the city!! (from what's I've tried at least). The only down side is the wait time.  If you come after 7-8pm, you may be waiting 30mins to 1 hour. They have a bar area when you enter and you may also sit in the outdoor area when the weather is warm enough.The food is awesome! The price is cheap!  The portion is big! What else can you ask for?Note: they are cash onlySuggestion:Pad see yeuPad Thai******Fried calamari*******",5.0
"This has to be my 2nd fave Thai restaurant. I tend to order from their specials opposed to the regular menu. They have a great bar and good lychee martinis. The drawback is that they only accept cash. Which I can understand it keeps costs lower but I never carry cash! But, other than that the food is great. I continue to go back.",4.0
Very good food and the prices are cheap!!! Huge portions too. It gets a bit unorganized when it is packed.,4.0
"So I came here last night with my wife and another couple. We walk In to the place trying to think positive because of what we have heard about it...... Once you talk to one of these people instantly ruined they are so rude there, its impossible to not want to punch them in the throat. After sitting us at our table, we waited for about 20 mins before someone came to take our order. During the ordering process the waiter was acting like he was bothered he was rushing us to order. The only reason this place got 2 starts Is because of the some of the food was pretty good and the prices are great. ... but the thai ribs weren't good at all, horrible! ! I will not be coming back here !!!!",2.0
"Downgrading after a previous upgrade bc of the absolutely terrible customer service. I tried to,order delivery the other night and was constantly hung up on when I didn't get a busy signal. Two telephones continually redialing for fifteen minutes and we never got thru. Busy signals and hang ups. Like, I could here people talking in the background and then disconnected.What is up with this place???",2.0
"We have been to Song at least 20 or 30 times and tonight was the last time.  It was one of our ""go-to"" spots for a cheap and tasty meal.  It's kind of like you get what you pay for, but all the servers are usually friendly, the crowd is unpredictable but tolerable, and the music is loud but drowns out the kids and annoying diners.Tonight was our last meal at Song.  First, the table next to us left because of a giant roach sighting.  (I saw that she posted a comment already on here!)Then, we noticed lots of flies on the walls and eventually landing on our uneaten food.Last, we were about to leave when my son and the boy at the table next to us started drumming their chopsticks on the booth bench.  Out of nowhere a short, white guy pops out and wags his finger at us all and mumbles that he's just had the chairs cleaned or something. (I obviously can't hear him due to the loud music which I love/hate.)I ask my child to stop and he does.  The child nextdoor continues.  The manager returns and wags his finger at me again.  I jumped up and explained that the other boy does not belong to me and he goes off on this rampage about how it cost him $8000 to replace the torn upholstery in the bench.  Really?  This is the first time I've seen this guy in all the times we've been to Song.  I'm assuming from prior reviews that customer service / putting on a happy face is not his strong suit.  But now that I know that such an obnoxious person is running the show we will no longer be supporting them.  I feel bad because the waitstaff is usually very sweet.  However, there are plenty of other cheap and tasty Thai options in the neighborhood to choose from that will turn a blind eye to (1-minute's-worth of) drumming chopsticks.",1.0
The neighbourhood has a lot of good thai and this isn't particular better or worse than the others. Quite good nonetheless.,4.0
"i didn't like this place at first but it's really close to our house and was the only decent thai place in park slope. after awhile i realized the awesomeness that is SONG.The restaurant is roomy, modern and they have a beautiful backyard. Club music plays because thats just how all asian places roll. The service is meh but again that is very common in asian restaurants. They want you in and out! But the food. Oh. My. God.They have THE BEST pad see ew. Soft noodles covered in rich brown sauce steaming hot. I don't know what they put in this noodle dish but it is amazing. Don't worry it's not super salty, just really flavorful. Their curries are really good too. The green curry is tasty, the veggies are fresh and great huge portions! Their roast chicken is ok, there's a Thai place in manhattan that does it better but SONG's is decent. The Thai fried rice is great, a little sweet, perfect meat to rice to veggies ratio. The beef fried rice is very good as well.Their prices are unfreakin-believeable!!!!  How do they afford to stay in business charging people so little for such amazing food with huge portions?!!! Maybe its a mob front. That's the only explanation. But I don't care I hope SONG stays the same forever because I will be going there for Thai food forever.",5.0
I have been this place several times. Food is great. service is horrible. It seems that they don't care. I wouldn't have come back here after first bad experience if that was not for my family. My mom likes their food.,2.0
"The place is trendy, rather cheap for Park Slope, but is cash only. I went here years ago and, overall, I think the quality has declined. Don't get me wrong, the food was good, but not good enough to keep me from exploring. For instance, the beef was dry and over-sauced. The curry puffs (my absolute favorite thing to order at a Thai restaurant) were a bit soggy. Is it good, solid, Thai food? Yes. Is it worth going out of your way for? I'd say no.",3.0
"We went here on a Saturday afternoon during lunch when it was not too busy, and we ordered the pad thai and beef massaman curry.  I really did not like the food, and and I felt this way even when I was pretty hungry (which is a bold statement because everything tastes good when I'm hungry).  The pad thai was way too sour and  the shrimp was overcooked. The beef in the massaman curry was overcooked and had no favor (it could have been mystery meat for all I know), and I feel like it should have had some more vegetables (at least some onions, and maybe some peppers like i've seen at  other restaurants).  the only redeeming factor is that this place is pretty cheap but i'd rather pay an extra dollar per entree and go eat at Mee thai just down the street on 5th ave for good thaiCool atmosphere, and they have a lot of space which I guess makes this place more kid-friendly.  Still, it wasn't enough to make up for the bad food and indigestion i had all day long.",2.0
*This place is Cash Only**It's been years since I ate here. I have also visited their sister locations Joya and National. I prefer Song and Joya over national. Really good Thai food. We decided to dine ere for lunch. I ordered Ton Kha Gha soup which was very refreshing (everyone does not make it the same). I also purchased Pad Woon Sen. Definitely didn't disappoint and service was decent. I like coming here for lunch because it's really laid back.,4.0
"WHY IS YELP HIDING MY REVIEW??? The owner of Song is racist, sexist and rude. Multiple reviewers have stated this objectively. Yelp please leave our reviews alone and let people know about this owner. Thank you. 5/16/2015 2015 Racism lives well in Brooklyn. I just left Song on 295 5th Ave. Brooklyn, NY with my best friend. The owner sat 3 white couples that came after us ahead of us. I know we were ahead of them because when they each came in they asked us if we were already being helped. We said yes we were signed in already. The owner called all three white couples ahead of myself and the two black females who were ahead of us. I asked owner, white male, why did he seat 3 groups of white customers ahead of us? He said \\\""they are regular customers that eat here a lot. I can do whatever I want in my restaurant. I don't know you, I know them."" I'm pretty sure he lied about knowing the 3 white customers due to the nature of their interaction. They gave him their names and he wrote it down on his little notepad. If he knew them and they were regular customers who spend a lot of money, as he explained, he would've known their names. He said I own 3 restaurants. JOYA included. We got into a verbal argument. I could not believe he felt comfortable telling me that he could do whatever he wanted in his restaurant. I informed him that there were laws against discrimination and I would take the necessary action. I told the 8 Black people waiting what happened. I said you guys really need to not eat here. Including the two black women who were ahead of us. None of them made a move to leave. I've eaten at song and joya several times but I've never ever experienced this kind of blatant racism and rude behavior from a business owner. I would like to pursue whatever actions I can against this business owner.",1.0
"First time eating here, ordered take out. The bartender who was at the front and was not friendly at all when taking my order and happened to forget to give me the rest of my change (I asked her what the total was and then gave me the rest). I ordered the spicy noodle. The dish itself was not very good. The dish wasn't quite spicy and wasn't savory and to top it off, I found a piece of hair in it. So my advice is, don't get the spicy noodle unless you're looking for a dish that has an identity crisis. And don't expect smiling servers when you walk in. Keep those expectations low.",1.0
"3 entrees, 3appetizers, salad and a carry out appetizer all for $65? Yup. Good was off the hook excellent! Good service too!",5.0
"I have to say Song has been a favorite cheap places to go in the neighborhood but honestly this visit disappointed a bit.  First off it is cash only and pretty cheap, cheap is great cash only makes me feel unprepared.  Second, the fried calamari was chewy and lacking flavor.  The portion size is big but nothing was so great about this appetizer.  Next I got a veggie fried rice, lacking flavor so much and featuring maybe even frozen veggie that to eat it I had to douse it in soy sauce.  It is still cheap and fast just not so great.",3.0
"Ignorant, racist owner beyond disrespectful. Called my friend a ""stupid white bitch"" because she dropped change on the floor. No joke. Will never be back again.",1.0
Thai food that tickles the palate and warms the cockles of my heart.,4.0
"This restaurant has a nice Vibe though I have to say the huge water bug cockroach on the wall made me lose my appetite. We ended up having to leave and couldn't enjoy the meal,",1.0
"The place is trendy, rather cheap for Park Slope, but is cash only. I went here years ago and, overall, I think the quality has declined. Don't get me wrong, the food was good, but not good enough to keep me from exploring. For instance, the beef was dry and over-sauced. The curry puffs (my absolute favorite thing to order at a Thai restaurant) were a bit soggy. Is it good, solid, Thai food? Yes. Is it worth going out of your way for? I'd say no.",3.0
"We went here on a Saturday afternoon during lunch when it was not too busy, and we ordered the pad thai and beef massaman curry.  I really did not like the food, and and I felt this way even when I was pretty hungry (which is a bold statement because everything tastes good when I'm hungry).  The pad thai was way too sour and  the shrimp was overcooked. The beef in the massaman curry was overcooked and had no favor (it could have been mystery meat for all I know), and I feel like it should have had some more vegetables (at least some onions, and maybe some peppers like i've seen at  other restaurants).  the only redeeming factor is that this place is pretty cheap but i'd rather pay an extra dollar per entree and go eat at Mee thai just down the street on 5th ave for good thaiCool atmosphere, and they have a lot of space which I guess makes this place more kid-friendly.  Still, it wasn't enough to make up for the bad food and indigestion i had all day long.",2.0
*This place is Cash Only**It's been years since I ate here. I have also visited their sister locations Joya and National. I prefer Song and Joya over national. Really good Thai food. We decided to dine ere for lunch. I ordered Ton Kha Gha soup which was very refreshing (everyone does not make it the same). I also purchased Pad Woon Sen. Definitely didn't disappoint and service was decent. I like coming here for lunch because it's really laid back.,4.0
"WHY IS YELP HIDING MY REVIEW??? The owner of Song is racist, sexist and rude. Multiple reviewers have stated this objectively. Yelp please leave our reviews alone and let people know about this owner. Thank you. 5/16/2015 2015 Racism lives well in Brooklyn. I just left Song on 295 5th Ave. Brooklyn, NY with my best friend. The owner sat 3 white couples that came after us ahead of us. I know we were ahead of them because when they each came in they asked us if we were already being helped. We said yes we were signed in already. The owner called all three white couples ahead of myself and the two black females who were ahead of us. I asked owner, white male, why did he seat 3 groups of white customers ahead of us? He said \\\""they are regular customers that eat here a lot. I can do whatever I want in my restaurant. I don't know you, I know them."" I'm pretty sure he lied about knowing the 3 white customers due to the nature of their interaction. They gave him their names and he wrote it down on his little notepad. If he knew them and they were regular customers who spend a lot of money, as he explained, he would've known their names. He said I own 3 restaurants. JOYA included. We got into a verbal argument. I could not believe he felt comfortable telling me that he could do whatever he wanted in his restaurant. I informed him that there were laws against discrimination and I would take the necessary action. I told the 8 Black people waiting what happened. I said you guys really need to not eat here. Including the two black women who were ahead of us. None of them made a move to leave. I've eaten at song and joya several times but I've never ever experienced this kind of blatant racism and rude behavior from a business owner. I would like to pursue whatever actions I can against this business owner.",1.0
"First time eating here, ordered take out. The bartender who was at the front and was not friendly at all when taking my order and happened to forget to give me the rest of my change (I asked her what the total was and then gave me the rest). I ordered the spicy noodle. The dish itself was not very good. The dish wasn't quite spicy and wasn't savory and to top it off, I found a piece of hair in it. So my advice is, don't get the spicy noodle unless you're looking for a dish that has an identity crisis. And don't expect smiling servers when you walk in. Keep those expectations low.",1.0
"3 entrees, 3appetizers, salad and a carry out appetizer all for $65? Yup. Good was off the hook excellent! Good service too!",5.0
"I have to say Song has been a favorite cheap places to go in the neighborhood but honestly this visit disappointed a bit.  First off it is cash only and pretty cheap, cheap is great cash only makes me feel unprepared.  Second, the fried calamari was chewy and lacking flavor.  The portion size is big but nothing was so great about this appetizer.  Next I got a veggie fried rice, lacking flavor so much and featuring maybe even frozen veggie that to eat it I had to douse it in soy sauce.  It is still cheap and fast just not so great.",3.0
"Ignorant, racist owner beyond disrespectful. Called my friend a ""stupid white bitch"" because she dropped change on the floor. No joke. Will never be back again.",1.0
Thai food that tickles the palate and warms the cockles of my heart.,4.0
"This restaurant has a nice Vibe though I have to say the huge water bug cockroach on the wall made me lose my appetite. We ended up having to leave and couldn't enjoy the meal,",1.0
"Good food, fresh, we had calamari, fried rice. excellent.",4.0
One of my favorite Thai places a short distance from the Brooklyn bridge. The food is delicious and unbelievably fresh not to mention incredibly affordable. After dinner do yourself a favor a walk over the bridge. Makes for a great date night.,4.0
"This place is always an inexpensive place, great atmosphere, and good food. I always get the calamari for appetizer, followed by the skirt steak in garlic sauce with white rice. The skirt steak is not always on the menu, I once seen it on the special menu and since then have requested it, they never have a problem making it for me and its always consistent. The waitstaff could be a little more attentive and nicer, but I have experienced worse.",5.0
Song is an excellent Thai restaurant worthy of the high marks it always receives on all the blogs and review sites.  It's a great value  for the freshly prepared quality authentic Thai food you enjoy.  It's a unique and trendy atmosphere inside.  It's nice to see the open kitchen where you can see your dish being prepared.  I have been here numerous times over the years and even stop in for a carry-out when commuting from Brooklyn to Manhattan.  It's worth the extra time and effort to get outstanding food from this place.  My favorites are the massaman chicken and the Tom Kha soup.  I've had these at other Thai places and Song makes themThe best!  THEY ACCEPT CREDIT CARDS EFFECTIVE MAY 2014,5.0
"song is deliciousfood poisoning? never hereuntil now, biatch",4.0
"I've been living away from Park Slope for a couple years and just now returned and reconnecting with all of my delivery spots in park slope. this used to be my go to favorite for thai.  before song it was lemongrass, but i tired of them quickly and stayed with song for a few years.Something has changed dramatically in the past couple years. I've ordered there 3 times now and everything has been just ordinary.  Not what I remembered at all.  Just recently I order the ribs which came completely plain and dried out, no flavor, except for a dipping sauce.  Summer rolls were tasteless.  Couple other things I ordered were tasteless too.  Menu format has changed so I wonder if they're under new ownership.I don't know what happened here cause this was always my go to place for thai.  So many other places in north slope just mediocre. Regrettably.  Song too.",2.0
"I highly doubt that you'll find excellent Thai in park slope....that being said, this is def a good option. The decor is very chill, the service is attentive and prices are cheap. I've had better thai....but if I want to stay local, this place will do. CASH ONLY!",3.0
"Really inexpensive, good quality, nice atmosphere, very cool garden seating area, and hardworking staff!",5.0
"Song ranks top 2 for the best Thai restaurant in Brooklyn for me. It's such a relaxing place to have dinner with a friend. The ambience is just lovely. We were seated outside the patio. They had so many cute pillows on the seats very comfy. They blasted the music pretty loud during the night, felt like a party going on. It was really busy on a Saturday night. Bar area, restaurant, and patio was packed, but we got seated rather quickly. Food came out in a good pace. Our server looks like he had a long day but he was nice and met our needs. NOTE: CASH ONLY! The -prices are reasonable and portions are huge.We had:1. Salmon Wontons - Had a nice crisp to it, nice salmon filling, and perfect with the sweet dipping sauce.2. BBQ Shrimp Kabob - This is so much fun to eat and look at, had a peeled shrimp, cherry tomato, broccoli, and pineapple.3. Skirt Steak - This was sooo good!! Very tender, came with Asian veggies and potatoes, very generous portions.4. Chicken Pad Thai - Very good!5. Mango Mojito - Refreshing, highly recommended!6. Mussels - Simply delicious!",4.0
"They need to fix their menu on all major websites (yelp, menupage, OpenTable and so on). There was an almost 2 dollar difference on all menus and when asked, whoever was on the other side was very defensive about it. Food is okay.",1.0
"Good food, fresh, we had calamari, fried rice. excellent.",4.0
One of my favorite Thai places a short distance from the Brooklyn bridge. The food is delicious and unbelievably fresh not to mention incredibly affordable. After dinner do yourself a favor a walk over the bridge. Makes for a great date night.,4.0
"This place is always an inexpensive place, great atmosphere, and good food. I always get the calamari for appetizer, followed by the skirt steak in garlic sauce with white rice. The skirt steak is not always on the menu, I once seen it on the special menu and since then have requested it, they never have a problem making it for me and its always consistent. The waitstaff could be a little more attentive and nicer, but I have experienced worse.",5.0
Song is an excellent Thai restaurant worthy of the high marks it always receives on all the blogs and review sites.  It's a great value  for the freshly prepared quality authentic Thai food you enjoy.  It's a unique and trendy atmosphere inside.  It's nice to see the open kitchen where you can see your dish being prepared.  I have been here numerous times over the years and even stop in for a carry-out when commuting from Brooklyn to Manhattan.  It's worth the extra time and effort to get outstanding food from this place.  My favorites are the massaman chicken and the Tom Kha soup.  I've had these at other Thai places and Song makes themThe best!  THEY ACCEPT CREDIT CARDS EFFECTIVE MAY 2014,5.0
"song is deliciousfood poisoning? never hereuntil now, biatch",4.0
