"This place is amazing. The search for best pizza has ended here. It's fresh, delicious, and huge. Well worth every penny unlike these other places. The other entrees are great as well. I haven't had a bad meal from here. It's always consistent which is important. I highly recommend this place to anyone who loves pizza/ Italian food. It's a small eat in space, but they do offer take out options which is great if you are in a rush. I love this place and can't wait to come back.",5.0
"Table 87 was great as usual, my girlfriends and I came for a late lunch/early dinner. We started off with a glass of wine for me and my friend ordered a blue moon. The drinks came out very quick. We had an order of rice balls as an appetizer, they came out as 6 rice balls which tasted great, and SOO fresh! I ordered the  sweet soppressata sandwich with a side salad .. AMAZING, and my girlfriend ordered the grilled eggplant panini. We both loved our food! Our server Jason was awesome, he was very attentive to us and all his other tables. I'll definitely be back to table 87 again",5.0
We regularly drive 40 mins from Jersey to get our pizza here because it's our favorite pizza in the entire NYC area. Their coal oven margherita is beyond delicious. They also sell by the slice. The hot peperoncini and roasted garlic sides are soooooooo good!,5.0
"Man... I used to love this place... Until last night. It took two hours and 2 phone calls to finally get our pizza. When we called we were rushed off the phone. They asked for the address, clearly didn't even look for the order and just said it was on its way. The pizza showed up 2 hours and 15 minutes after ordering. It was smashed on one side and cold. No apologies from the delivery guy either. I'm bumbed because their pizza is amazing and every other delivery has been quick. But, this is clearly not an isolated incident after reading some reviews. I'll probably give them another shot to hopefully get back on the right track.",3.0
Bartender is friendly. Pizza was delicious. Garlic and hot pepper condiments were great too. A walking tour group came in after us and enjoyed the pizza. Nice atmosphere.,5.0
"It's become a tradition that after I get a massage that I go here to grab a 20-inch margarita pizza to go. The pizza is delicious and costs $24. The crust is thin and nicely blistered in the coal oven. Beautiful fresh mozzarella and basil. If you're buying a pizza to go, they only sell the margarita. If you want toppings, you need to eat in.",4.0
"I'm a pizza snob from New Haven. This is the best pie I've had living in Brooklyn for over a year now. I'll update that #1 ranking if I find something better, but it may be awhile. I've had most of the known greats around here! Cooked to perfection and perfect sauce. Place is cool, clean, and the people are friendly. If it was closer to my house, I'd be there every day.",5.0
Amazing everything. From the salat to the coffee and everything in between. Pizza is one of the best I ever had. Must try.,5.0
"The absolute best!!!!!!! The food is incredible. What makes it even better is the service. Jason is the star of Table 87. We have never had a server more attentive and fabulous as he. We ask for him every time. If I were to open a restaurant I would make him manage it in a heart beat. Love this place. Try everything, there isn't anything that is below exceptional here.",5.0
"REALLY good.. Stopped in today for a few slices, went with two margherita.. They were awesome.  Light, a lil crisp on the crust, a fresh sweet marinara sauce, and just the right amount of cheese and basil. If you liked Lombardi's, you'll enjoy here too without the headache commute!! They also gave a nice bar inside, so maybe a great place for a nightcap and end of night slice!",5.0
"Ever since I moved away from the neighborhood the main thing I miss is my old pizza joints... and this is the one I miss the most!The pizza is excellent, the sides perfect.The only reason not 5 stars is because of the frozen pizza that you can buy in the grocery store - its very disappointing. Way too thin and too small. it doesnt do the restaurant justice!The pizza is excellent, the garlic and spicy pepper sauce is awesome!",4.0
"The pizza is great.  But, the service is terrible. Both in-house and delivery.  I ate here not long after the place opened and had a pretty bad experience - appetizers never came, my dinner was served 25 minutes before husband's was, etc... no apologies, nothing was comped.  We were kinda pissed but, we figured it was due to a new restaurant starting out and having some issues getting it together.  Since then we've ordered delivery a handful of times and it's been fine.  It always takes a about 30 minutes longer than most other pizza shops, but no big deal.Tonight we ordered a pizza for delivery.  90 minutes later a mess showed up.  Cold, soggy, and totally mangled, folded over, etc.  (I wish I could post a photo to this review) My husband called to see what happened and the first person he spoke to said, ""we can give you a new pizza but we have to pick up the old one first."" As if we were lying!! We were shocked. Asked to speak to the manager.  He was rude on the phone.  My husband asked for a refund and he said he couldn't do that because we ordered through grub hub.  ""It's refund or replacement.  Those are the only options.  And you can't get a refund so the only option is we can send someone to pick it up."" No ""sorry for the inconvenience"" or ""we'll give you a credit on another pizza"" or anything that any normal, respectful, restaurant would offer a repeat customer.  My husband ended up driving there with the pizza to show them so we didn't have to wait another 2 hours to eat. And then, they offered a him refund and a new pizza to save face in front of the other customers there.  In the end they made it right (hence 2 stars) but it took my husband driving there and confronting them in person in front of customers for them to do so.",2.0
"With such great reviews and only a few blocks from my apartment, I was excited to make this my go-to pizza place. Unfortunately, I was less than impressed by the pizza. I've tried their pizzas twice, and both times, it fell flat. There was nothing special. The prosciutto pizza is too dry and the toppings were just flying off the pizz.However, the prosciutto/ricotta cheese calzone was delicious - the perfect amount of prosciutto and cheese. With so many great pizza places nearby, I won't be revisiting for any of the slices - but the calzone - worth a trip back.",3.0
"Just the best. Amazing pizza that haunts me in my dreams. Have never had a bad thing here. Came here once and ordered the stuffed pepper special, which may or may not have changed the course of my earthly existence. Had a cannoli that made me question if I should have kids just so I could introduce them to something so wonderful. If I had to eat all the carbs, I would like to eat them here.",5.0
The Pizza was not bad. There's something disappointing about ordering from a place that's highly rated on Yelp only to find out that's it's subpar. What's more frustrating is for the pizza to arrive more than an hour later (at least double the promised time) tasting like something you could have bought from the deli across the street. Good luck running a business like that in this great city!,2.0
"It's become a tradition that after I get a massage that I go here to grab a 20-inch margarita pizza to go. The pizza is delicious and costs $24. The crust is thin and nicely blistered in the coal oven. Beautiful fresh mozzarella and basil. If you're buying a pizza to go, they only sell the margarita. If you want toppings, you need to eat in.",4.0
"I'm a pizza snob from New Haven. This is the best pie I've had living in Brooklyn for over a year now. I'll update that #1 ranking if I find something better, but it may be awhile. I've had most of the known greats around here! Cooked to perfection and perfect sauce. Place is cool, clean, and the people are friendly. If it was closer to my house, I'd be there every day.",5.0
Amazing everything. From the salat to the coffee and everything in between. Pizza is one of the best I ever had. Must try.,5.0
"The absolute best!!!!!!! The food is incredible. What makes it even better is the service. Jason is the star of Table 87. We have never had a server more attentive and fabulous as he. We ask for him every time. If I were to open a restaurant I would make him manage it in a heart beat. Love this place. Try everything, there isn't anything that is below exceptional here.",5.0
"REALLY good.. Stopped in today for a few slices, went with two margherita.. They were awesome.  Light, a lil crisp on the crust, a fresh sweet marinara sauce, and just the right amount of cheese and basil. If you liked Lombardi's, you'll enjoy here too without the headache commute!! They also gave a nice bar inside, so maybe a great place for a nightcap and end of night slice!",5.0
"Ever since I moved away from the neighborhood the main thing I miss is my old pizza joints... and this is the one I miss the most!The pizza is excellent, the sides perfect.The only reason not 5 stars is because of the frozen pizza that you can buy in the grocery store - its very disappointing. Way too thin and too small. it doesnt do the restaurant justice!The pizza is excellent, the garlic and spicy pepper sauce is awesome!",4.0
"The pizza is great.  But, the service is terrible. Both in-house and delivery.  I ate here not long after the place opened and had a pretty bad experience - appetizers never came, my dinner was served 25 minutes before husband's was, etc... no apologies, nothing was comped.  We were kinda pissed but, we figured it was due to a new restaurant starting out and having some issues getting it together.  Since then we've ordered delivery a handful of times and it's been fine.  It always takes a about 30 minutes longer than most other pizza shops, but no big deal.Tonight we ordered a pizza for delivery.  90 minutes later a mess showed up.  Cold, soggy, and totally mangled, folded over, etc.  (I wish I could post a photo to this review) My husband called to see what happened and the first person he spoke to said, ""we can give you a new pizza but we have to pick up the old one first."" As if we were lying!! We were shocked. Asked to speak to the manager.  He was rude on the phone.  My husband asked for a refund and he said he couldn't do that because we ordered through grub hub.  ""It's refund or replacement.  Those are the only options.  And you can't get a refund so the only option is we can send someone to pick it up."" No ""sorry for the inconvenience"" or ""we'll give you a credit on another pizza"" or anything that any normal, respectful, restaurant would offer a repeat customer.  My husband ended up driving there with the pizza to show them so we didn't have to wait another 2 hours to eat. And then, they offered a him refund and a new pizza to save face in front of the other customers there.  In the end they made it right (hence 2 stars) but it took my husband driving there and confronting them in person in front of customers for them to do so.",2.0
"With such great reviews and only a few blocks from my apartment, I was excited to make this my go-to pizza place. Unfortunately, I was less than impressed by the pizza. I've tried their pizzas twice, and both times, it fell flat. There was nothing special. The prosciutto pizza is too dry and the toppings were just flying off the pizz.However, the prosciutto/ricotta cheese calzone was delicious - the perfect amount of prosciutto and cheese. With so many great pizza places nearby, I won't be revisiting for any of the slices - but the calzone - worth a trip back.",3.0
"Just the best. Amazing pizza that haunts me in my dreams. Have never had a bad thing here. Came here once and ordered the stuffed pepper special, which may or may not have changed the course of my earthly existence. Had a cannoli that made me question if I should have kids just so I could introduce them to something so wonderful. If I had to eat all the carbs, I would like to eat them here.",5.0
The Pizza was not bad. There's something disappointing about ordering from a place that's highly rated on Yelp only to find out that's it's subpar. What's more frustrating is for the pizza to arrive more than an hour later (at least double the promised time) tasting like something you could have bought from the deli across the street. Good luck running a business like that in this great city!,2.0
Margherita and Funghi Personal Pies Were Both Fabulous. Luv the Crispness of the Dough. Service was Courteous and Friendly (And Fast!),5.0
"Very nice pizza slice, price $ 4 or 4.50 but I guess in this City you can't excape from high prices... I would cut the slice a bit larger at least! Enjoy.Ps. Maybe the slice is so expensive so you buy a whole pizza which might be worth?! I'll think about it.",4.0
"Great addiction to the neighborhood, and so glad they offer delivery, unlike other so called fancy pizzerias in the neighborhood.The pizza is simply delicious! Cole cooked, thin sliced, delicious cheese, good amount of sauce, and fresh basil on top. Just the way I like my pizza, a true New York pizza! Reminded me a lot of difara's & grimaldis, which is a HUGE compliment, considering there considered to be the best. Welcome to the neighborhood, and for a delicious dinner :-)",5.0
"I love the food here. I've come here about three times and have eaten the margarita pie, the orecchiette pasta dish and linguine with white clam sauce and all dishes were fantastic. Service is friendly and personable even though the restaurant gets busy you never feel like you're being rushed out. The only reason it's not 5 stars for me is because of how loud it is, usually because of screaming/ wandering kids (there was a boy flossing at his table last time I went). If this doesn't deter you then go for it, I will definitely be returning here!",4.0
"Just happened to stumble upon this gem.  First, the atmosphere is charming and inviting.  The staff was very knowledgable and kind.  Did i mention thier draft beer list, is impressive for a pizza joint.  CANT FORGET THE FOOD!  Thier pizza has a classic and delicious flavor, but with a modern twist.  We ordered the prosciutto and arugula pizza, delicious and expertly crisp.  Just like pizza should be.  The baby greens salad is simple, but simply delectable.  So fresh!  We had a great time here, and are very glad we stumbled into this place.  Will definitely frequent this spot!",5.0
"This is a place that cares for their food. Every plate comes out fresh and presented with care. I would give this place 5 stars but they advertise a pizza with Sicilian fried eggplant but it is not the Sicilian version (it was supposed to be thick slices and the skin included).With that being said I am hooked, great food and great service.",4.0
"Food is good, but the pizza did not stand out compared to their food. Their pastas were delicious as were their appetizers. Their pizza tasted fine but it got soggy fast or right away. We got plenty of the 12"" and one 20"" pies and we were unable to hold them in our hands at all. That's a big no no for NYC pizza I think. The price was fair for the pizza and when you add toppings, they put a good amount. The different pizzas all tasted similar. The flavors weren't that distinctive. They are still getting 4 stars because their other foods were better and service is great. We had their clams appetizer which was delicious, but small. Seafood salad is so good. Lasagna, pappardelle with steak tips, and the ossobucco were DELICIOUS! We also had the fennel sausage roll which was okay.",4.0
"I love Table 87's food, decor and service.  Dine in or take out, the food is always on point.  I don't know why I haven't been coming to this place longer - it is of the best pizza I've ever had in any borough.What's makes 87 unique, is their classy menu and garlic oil accouterments. This stuff is out of control.  It makes me wish there was more crust to spread the garlic on.  Everything we had was great.  The salad was crisp and not over dressed.  The calamari was tender and not over breaded.  The pizza... I mean - wow.  Piping hot, cripsy, cheesy, fresh ingredients.  It was a symphony.  87 is great for dine in or take out.  What's neat, too, is that we got a parking spot across the street.The service was attentive and warm.  I will definitely be back.",5.0
"Makes me sad to write this review because I so badly wanted to like it here! I've driven by and walked by a bunch of times and decided to finally walk in last night. The service was just really bad - even if the food were amazing they would get 3 stars.We were forced to eat at the bar and not given an option to wait for a table. Ignored by the bartender for 5 minutes at an empty bar as well. Girlfriend ordered what may have been the most expensive salad in all of Brooklyn. If you're curious, 10 bucks gets you a small amount of steak, not even enough to fill up a 100 pound woman. The timing of the food delivery topped it off. The steak salad came out first, ten minutes later I got a side of sauce for my calzone. 5-6 minutes later I got my meal. As you might imagine, watching my girlfriend eat for 15 minutes, then having her watch me eat wasn't too enjoyable. Honestly it doesn't take much to impress me at a restaurant and I rarely leave negative reviews. An ""I'm sorry"" any time through dinner would have gone far.",2.0
Delicious to dine in and delicious to take out.  I love this pizza. It's not your typical 2am slice -- and thats what I love about it. It's upscale without being pretentous and the coal oven really makes the difference. Toppings are high quality and the dough is great -- not too chewy!,4.0
Margherita and Funghi Personal Pies Were Both Fabulous. Luv the Crispness of the Dough. Service was Courteous and Friendly (And Fast!),5.0
"Very nice pizza slice, price $ 4 or 4.50 but I guess in this City you can't excape from high prices... I would cut the slice a bit larger at least! Enjoy.Ps. Maybe the slice is so expensive so you buy a whole pizza which might be worth?! I'll think about it.",4.0
"Great addiction to the neighborhood, and so glad they offer delivery, unlike other so called fancy pizzerias in the neighborhood.The pizza is simply delicious! Cole cooked, thin sliced, delicious cheese, good amount of sauce, and fresh basil on top. Just the way I like my pizza, a true New York pizza! Reminded me a lot of difara's & grimaldis, which is a HUGE compliment, considering there considered to be the best. Welcome to the neighborhood, and for a delicious dinner :-)",5.0
"I love the food here. I've come here about three times and have eaten the margarita pie, the orecchiette pasta dish and linguine with white clam sauce and all dishes were fantastic. Service is friendly and personable even though the restaurant gets busy you never feel like you're being rushed out. The only reason it's not 5 stars for me is because of how loud it is, usually because of screaming/ wandering kids (there was a boy flossing at his table last time I went). If this doesn't deter you then go for it, I will definitely be returning here!",4.0
"Just happened to stumble upon this gem.  First, the atmosphere is charming and inviting.  The staff was very knowledgable and kind.  Did i mention thier draft beer list, is impressive for a pizza joint.  CANT FORGET THE FOOD!  Thier pizza has a classic and delicious flavor, but with a modern twist.  We ordered the prosciutto and arugula pizza, delicious and expertly crisp.  Just like pizza should be.  The baby greens salad is simple, but simply delectable.  So fresh!  We had a great time here, and are very glad we stumbled into this place.  Will definitely frequent this spot!",5.0
"This is a place that cares for their food. Every plate comes out fresh and presented with care. I would give this place 5 stars but they advertise a pizza with Sicilian fried eggplant but it is not the Sicilian version (it was supposed to be thick slices and the skin included).With that being said I am hooked, great food and great service.",4.0
"Food is good, but the pizza did not stand out compared to their food. Their pastas were delicious as were their appetizers. Their pizza tasted fine but it got soggy fast or right away. We got plenty of the 12"" and one 20"" pies and we were unable to hold them in our hands at all. That's a big no no for NYC pizza I think. The price was fair for the pizza and when you add toppings, they put a good amount. The different pizzas all tasted similar. The flavors weren't that distinctive. They are still getting 4 stars because their other foods were better and service is great. We had their clams appetizer which was delicious, but small. Seafood salad is so good. Lasagna, pappardelle with steak tips, and the ossobucco were DELICIOUS! We also had the fennel sausage roll which was okay.",4.0
"I love Table 87's food, decor and service.  Dine in or take out, the food is always on point.  I don't know why I haven't been coming to this place longer - it is of the best pizza I've ever had in any borough.What's makes 87 unique, is their classy menu and garlic oil accouterments. This stuff is out of control.  It makes me wish there was more crust to spread the garlic on.  Everything we had was great.  The salad was crisp and not over dressed.  The calamari was tender and not over breaded.  The pizza... I mean - wow.  Piping hot, cripsy, cheesy, fresh ingredients.  It was a symphony.  87 is great for dine in or take out.  What's neat, too, is that we got a parking spot across the street.The service was attentive and warm.  I will definitely be back.",5.0
"Makes me sad to write this review because I so badly wanted to like it here! I've driven by and walked by a bunch of times and decided to finally walk in last night. The service was just really bad - even if the food were amazing they would get 3 stars.We were forced to eat at the bar and not given an option to wait for a table. Ignored by the bartender for 5 minutes at an empty bar as well. Girlfriend ordered what may have been the most expensive salad in all of Brooklyn. If you're curious, 10 bucks gets you a small amount of steak, not even enough to fill up a 100 pound woman. The timing of the food delivery topped it off. The steak salad came out first, ten minutes later I got a side of sauce for my calzone. 5-6 minutes later I got my meal. As you might imagine, watching my girlfriend eat for 15 minutes, then having her watch me eat wasn't too enjoyable. Honestly it doesn't take much to impress me at a restaurant and I rarely leave negative reviews. An ""I'm sorry"" any time through dinner would have gone far.",2.0
Delicious to dine in and delicious to take out.  I love this pizza. It's not your typical 2am slice -- and thats what I love about it. It's upscale without being pretentous and the coal oven really makes the difference. Toppings are high quality and the dough is great -- not too chewy!,4.0
Food and service was great will return and recommend to friends. The establishment is very well keep !,5.0
"The pizza tasted good , but they got my delivery order wrong. I asked for a pizza with arugula, prosciutto and San Marino tomatoes- like the take out menu says . I received a pizza with basil only and the pizza must have tipped at some point in the journey since it was pretty messed up by the time it arrived .",3.0
The food was awesome. Seems like a family owned business. Tiny little dining room in the back. Pizza was great.,4.0
"You don't realize how freaking big a 20 inch pizza is until it lands on your table. It's huge!! We ordered a simple marguerite and it was yum. Think crust, not overly cheesy, nice tomato sauce and fresh basil leaves. It doesn't get much better than that simple pleasure!  I also loved the homemade roasted garlic and chilli toppings too.  Yum!Watermelon salad was ok. I'm chalking it up to a lousy winter which has resulted in mediocre watermelon. Server was great. Poor guy had to spiel off the long list of specials which I lost track of but he was helpful and checked in on us. He also tried to fix our wabbly table and let us take some garlic and chilli toppings home with out leftover pizza!",4.0
"Second time here.  Great food, excellent service.  Pizza is amazing. We shared the Margherita Pizza (the roasted garlic the give you as an optional topic is delicious).  We also sgare the fettuccine with roasted eggplant and the grilled watermelon salad  (from the specials menu).  Highly recommend these choices.",5.0
Very cozy place with decent pizza.  Had the margarita with a carafe of Chianti wine.  Service was excellent and the atmosphere in the dinning room was very inviting.  Great place for a couple or small group to have an intimate meal.  My wife believes the pizza is as good as Julianna's.,4.0
The service was great! We didn't get his name but the server with the glasses and beard super attentive and friendly. the pizza was the bomb.com. Holy crap the soppressata was amazing and the sausage too. Def would recommend  worth the walk for sure.,5.0
"90 minute delivery. No apologies from the person on the phone at the pizzeria. The pizza arrived crushed because there was nothing to hold it up. The only nice thing that happened was that the driver offered to have the pizza replaced. But, when would that have arrived? After ordering from them many times from our previous address, this first time at our new address was a failure.",2.0
"Wow. Incredible pizza. Highest quality ingredients, gold star service and cleanliness. Worth the trip Gowanus!",5.0
