"Nice little brunch spot in the restaurant row of Cortelyou. We came on a Monday so it wasn't too packed, but I can definitely imagine a wait on the weekends here. There are about 15 tables or so within the restaurant. I ordered the hummus, which was flavorful and hearty for an appetizer and had the English muffin burger as my entree. My fiancé ordered the grits which were smooth and creamy. The burger I had was perfectly cooked to my requested medium rare and was not greasy at all. Definitely will be coming back.",5.0
I was so happy when this opened up right in my neighborhood. Now I don't have to travel downtown or to the city for some brunch. Went here with my boyfriend on a Sunday afternoon and it was PACKED. I put my name down on a list but luckily two seats opened up at the bar and we sat there. The bartender was very friendly and observant. Our food came quick and it was really good. Nice to have a good spot to eat in my hood!!,4.0
Love this place. So homey. So good. My husband and I love their burger! The desserts are always changing and yummy. I like the slight changes to the menu month to month or season to season. They are such a wonderfully family-welcoming establishment! They're always great whenever we'd arrive with our infant/toddler! Waiters/waitresses are super nice too. They always make you feel welcome!,5.0
"I LOVE BLOODY MARYS and something about the Bloody Mary here makes it the best one I've ever had while brunching all over nyc The adult grilled cheese is dangerously good, the waitstaff and the girl behind the bar are awesome, whatever you order you must get the toast with goat butter and maple sugar on the side. Do it!",5.0
"Been here several times and always enjoyed my meals. I've been here only during brunch hours so i can only review on the food during that time. Theres usually a minimal wait on the wkends, i remember waiting about 30 mins max (which is totally acceptable). Their menus change every now and then but there are always healthy but tasty options available. I really really loved their fisherman's eggs dish. That was my fav but it was removed from their menu recently (i almost cried). Im guessing itll return when the warmer weather is here. Customer service is always good. Our glasses are always filled and when i need something, i know someone will catch me starring at them and they come right over almost immediately. I will continue to come back as this is listed as one of my fav brunch spots. Just please bring back fisherman's eggs asap!!!",4.0
"The host tonight in this place was plain awful. I can understand if there are a lot of people waiting, he would wait to seat the party until everyone arrived. But it's a Tuesday on 8:45pm. The restaurant was half empty. I simply wanted to sit down with my son to order some food while waited for my husband and our cousin, who would be arriving in 5 min. I asked twice, and maybe I was not in my best mood. But, I was definitely not disruptive. I was told if I ""acted like this (being upset and rude to him), then he would ask me to leave.""  I was treated as if he was doing me a favor.  As If I was a little kid and that I should put in a time out chair because I didn't listen.  This was not necessary and honestly, not how to treat a customer who patronize your place often.  Literally last week, I was seated at around 7:30 on a Tuesday while waiting for my friend.  It could have been resolved without me being humiliated. Customers are not always right, but if possible, should be accommodated. Tonight, it's a perfect example of this situation. It's the first time in my life being asked to leave a restaurant.  How horrible! This is a neighborhood restaurant, then you treats the customers as if they are your neighbors.",2.0
"The food is awesome. If the staff was as awesome as the food then that would make for a wonderful experience. I have been living in Brooklyn for most of my life, and I have never experienced such service. We need to consider how we speak to people. You telling me that the wait is 30 minutes, and following up with, I don't think you would want to wait is unacceptable.",2.0
"HM, This spot is on it's A Game for brunch but for dinner it was just mediocre. I'm not sure what could've been done to be better but I think it's still a decent spot.",3.0
"Everyone hypes up the brunch, but their dinner is just as great. We ordered a ravioli dish, the burger and eggplant tempura for an appetizer. All of it was great. A little expensive, but worht it.",5.0
"That French toast, omg omg omgIts as if God himself came down from the heavens and sprinkled some perfection on it before it reached my plate. And then I knew what perfection meant, how it felt, tasted, looked. It was in the form of 2 pieces of bread covered in what appeared to be caramelized apples. But then you bite into it, and you knew it was meant to be! That connection between that bite and your soul was all worth it.Ok, now that that's done I'll review everything else. Mimosa was a bit pricy and not worth it in my opinion. But the burger was delicious; I got it with everything, egg, bacon, cheddar. And those fries with curry mayo were absolutely delicious. Definitely a must try for brunch; especially that French toast!",4.0
"The best burger in the area, maybe even NYC.  As a carnivore who is quite picky about what meats I eat, I have been delighted by the quality they serve.  The steaks are butchered in house and are amazing.  The aforementioned burgers are amazing as well.  In general, they get the farm-to-table concept done right.  There are a few details that keep me from giving 5 stars though.  Charging $1 extra for tomato on a $14 burger is patently ridiculous.  Unless that tomato is an heirloom from the person who invented tomatoes...but I don't think it is.  I'd expect that from a diner, but not a restaurant like this.  The breakfast sausage is also very bland compared to the rest of the food there.  But the eggs are consistently great, and coffee is excellent as well.",4.0
"Great place for lunch. The decor is naturally that rustic farm look & feel. The staff here are sweet and attentive (even though at first our waitress forgot our order of coffee, but I won't hold it against her since it was very busy...prime lunch time). The food was delicious. We started with the warm Chocolate Bread w/ sea salt & butter ($3) - so buttery, chocolaty and flavorful with just a hint of sea salt. Don't let it sit long though because it doesn't taste as good when it has cooled off. Portobello sandwich and the smoked pollock cake were great. My bf had the Farm Burger which wasn't flavorful at all; almost had no taste to it. I would suggest you order something else instead. The curry mayo sauce that came with the fries was pretty addicting though. The prices are very reasonable, average of about $10 for your entree. All in all, a solid place to go to for lunch which will leave you feeling full and won't break your wallet.",4.0
"Wonderful vibe and wonderful food. The adult grilled cheese, egg sandwich with eggplant (added onions) and the burger with bacon and cheddar was delicious. Sat in the back in a hidden yard in Brooklyn. A little slow on service getting refills on drinks but the waitstaff was so nice.",4.0
"I love this place for brunch- they make mean bloody Mary's and great mimosas, good brunch food. The place usually gets packed. It's good for groups and families, very accommodating staff. I wasn't in love with their dinner menu/food, but they also change their menu by season so I will definitely try it again.",3.0
"Wonderul food from scratch. I had the pollack and Nick, shown in the pic, had the I"" I could eat 2"" farm burger . Food arrived quickly and parking was a breeze at this end of the street.",5.0
"The food here just embodies what this Brooklyn neighborhood is all about! The food is fresh, unique with an interesting selection, and kind of vegetarian? And expensive? I ended up getting these butternut squash ravolis in buttered brown sauce (aka artery clogging cholesterol straight to my mouth) for $16. Deliciousssss! Would recommend. Service is also very attentive so that's a plus. But then again.. we were really the only ones that decided to come at 11p when they were about to close. My friend ended up getting a burger with fries for $12. Seems reasonable. Also got a drink for $4. I believe it was  apple cider but the drinks varied (with weird and interesting flavors). I'd recommend this place yo anyone looking for something more gourmet!",5.0
"The food is awesome. If the staff was as awesome as the food then that would make for a wonderful experience. I have been living in Brooklyn for most of my life, and I have never experienced such service. We need to consider how we speak to people. You telling me that the wait is 30 minutes, and following up with, I don't think you would want to wait is unacceptable.",2.0
"HM, This spot is on it's A Game for brunch but for dinner it was just mediocre. I'm not sure what could've been done to be better but I think it's still a decent spot.",3.0
"Everyone hypes up the brunch, but their dinner is just as great. We ordered a ravioli dish, the burger and eggplant tempura for an appetizer. All of it was great. A little expensive, but worht it.",5.0
"That French toast, omg omg omgIts as if God himself came down from the heavens and sprinkled some perfection on it before it reached my plate. And then I knew what perfection meant, how it felt, tasted, looked. It was in the form of 2 pieces of bread covered in what appeared to be caramelized apples. But then you bite into it, and you knew it was meant to be! That connection between that bite and your soul was all worth it.Ok, now that that's done I'll review everything else. Mimosa was a bit pricy and not worth it in my opinion. But the burger was delicious; I got it with everything, egg, bacon, cheddar. And those fries with curry mayo were absolutely delicious. Definitely a must try for brunch; especially that French toast!",4.0
"The best burger in the area, maybe even NYC.  As a carnivore who is quite picky about what meats I eat, I have been delighted by the quality they serve.  The steaks are butchered in house and are amazing.  The aforementioned burgers are amazing as well.  In general, they get the farm-to-table concept done right.  There are a few details that keep me from giving 5 stars though.  Charging $1 extra for tomato on a $14 burger is patently ridiculous.  Unless that tomato is an heirloom from the person who invented tomatoes...but I don't think it is.  I'd expect that from a diner, but not a restaurant like this.  The breakfast sausage is also very bland compared to the rest of the food there.  But the eggs are consistently great, and coffee is excellent as well.",4.0
"Great place for lunch. The decor is naturally that rustic farm look & feel. The staff here are sweet and attentive (even though at first our waitress forgot our order of coffee, but I won't hold it against her since it was very busy...prime lunch time). The food was delicious. We started with the warm Chocolate Bread w/ sea salt & butter ($3) - so buttery, chocolaty and flavorful with just a hint of sea salt. Don't let it sit long though because it doesn't taste as good when it has cooled off. Portobello sandwich and the smoked pollock cake were great. My bf had the Farm Burger which wasn't flavorful at all; almost had no taste to it. I would suggest you order something else instead. The curry mayo sauce that came with the fries was pretty addicting though. The prices are very reasonable, average of about $10 for your entree. All in all, a solid place to go to for lunch which will leave you feeling full and won't break your wallet.",4.0
"Wonderful vibe and wonderful food. The adult grilled cheese, egg sandwich with eggplant (added onions) and the burger with bacon and cheddar was delicious. Sat in the back in a hidden yard in Brooklyn. A little slow on service getting refills on drinks but the waitstaff was so nice.",4.0
"I love this place for brunch- they make mean bloody Mary's and great mimosas, good brunch food. The place usually gets packed. It's good for groups and families, very accommodating staff. I wasn't in love with their dinner menu/food, but they also change their menu by season so I will definitely try it again.",3.0
"Wonderul food from scratch. I had the pollack and Nick, shown in the pic, had the I"" I could eat 2"" farm burger . Food arrived quickly and parking was a breeze at this end of the street.",5.0
"The food here just embodies what this Brooklyn neighborhood is all about! The food is fresh, unique with an interesting selection, and kind of vegetarian? And expensive? I ended up getting these butternut squash ravolis in buttered brown sauce (aka artery clogging cholesterol straight to my mouth) for $16. Deliciousssss! Would recommend. Service is also very attentive so that's a plus. But then again.. we were really the only ones that decided to come at 11p when they were about to close. My friend ended up getting a burger with fries for $12. Seems reasonable. Also got a drink for $4. I believe it was  apple cider but the drinks varied (with weird and interesting flavors). I'd recommend this place yo anyone looking for something more gourmet!",5.0
"I've tried a lot of great brunch spots. But this was one of the best meals, in general, that I've had in a long time. Don't forget to try the grilled cheese with apple and caramelized onions - big and amazing! French toast is delicious too. Cant wait to go back!",5.0
"So this place is a staple of Ditmas Park and for good reason. Everything I've ordered from this establishment has been superb, often exceeding my expectations. My go to meal is definitely the cheddar burger on an English muffin with the curry mayo. Absolute perfection. Service is always great and you can't beat the simplicity of the menu. If it ain't broke, don't fix it and The Farm proves that what they lack in extravagance they make up for with a fresh, delicious, and hearty menu.",5.0
"When am I going to learn sticking a fried egg on a burger doesn't automatically make it awesome??? Case in point again this morning for brunch at The Farm, where I ordered the burger that reviewers on Yelp! have touted as being delicious. Well, I don't know what 's happened, but the burger at the Farm needs to be left on the farm and not carried to their restaurant!!! It was soooo lackluster that I hate I had to pay for it--dry bread (what a disappointment), overcooked, dry meat (I ordered medium rare), no tomato, etc... I mean, it looked super good; just take a look at the pic I posted. Oh, how I wanted to love it, but it just didn't pass for me :(Another thing that disappointed at The Farm was the chocolate bread. Dry, dry, dry! Beware of this. It didn't look anywhere close to the delicious-looking pics I've seen of it on Yelp! Also, if you order anything else besides the burger, beware that portions are small-ish. If you're taking a group of burly men, think twice.Things that the Farm have going for them include the fries (they were crunchy and tasty), the cheese polenta (but, folks, be real, it's simply cheese grits--just call it what it is, the northerners WILL eat it), the dessert (the chocolate banana dessert was yummy), and the service (the hostess, the bartender, and waiter were super nice).As for atmosphere, note that this play is super small, and it gets crowded fast... so plan on a wait for a table.*Just realized I didn't get curry mayo w/ my fries... nor a plastic animal toy w/ my check... did I get gypped at The Farm today??? (Is it okay to say gypped?) :-P",2.0
This place gets five stars!! The food was amazing as well as the service! The waitress was very kind and attending to the groups needs and wants. I definitely recommend it if you're in the area!,5.0
"Adorable place. I stopped in solo for a quick lunch at the bar. I went with the poached eggs and grits with a side of sausage. Grits are new to me I am still not sure how I feel but the sausage was amazing. Lunch cost me $19 bucks, I left happy and full.  The waitress/ bar tender really knew her stuff she  could tell me where everything on the menu came from. Pretty cool..",5.0
Still a great place to eat brunch. Awesome outside seating area and good service. Friendly staff. Awesome fries. Great coffee! Would recommend. Have never tried the dinner menu but I'm sure it's great.,4.0
"so delicious for brunch. good and quick service. one thing that was weird, they somehow delivered our food before our bloody mary's. but i will chalk that one up to a random mistake. the bar tender was great and let me sit at the bar with a coffee (that he added to my tab at the table without charging me for more coffee) while i waited for my friend to arrive.",5.0
Easily the best restaurant on Cortelyou road if you like seasonal dishes that are cooked with love.,5.0
"If there is any review of mine on Yelp that is way, way overdue , it's the review of the Farm on Adderley. This restaurant/bar/movement has been a personal favorite of mine for years now, for brunch, dinner or for it's bar to just stop in and have a great draft or cocktail, but I've never gotten around to writing the warranted 5-star review. In fact, for a lot of my favorite spots, I tend to never get around to posting anything up and I really cant say why. Maybe it's a subconscious tendency that wants to have a place like the Farm all to myself; less stars and less reviews means less people waiting to get their grubby hands on the food I want so badly . I don't know what it is, but this phenomenon persists. This really should have been my first Yelp review, not my 90-somethingth review.  So here is my review of the casual dining and restaurant portion of the experience. I also got married here. I guess I really do like this place, but that's going to be a review for another day. I've been coming to the Farm every so often since 2009, with brunch being the overwhelmingly common timeslot of attendance. Not to say I like dinner here any less, I just happen to have fallen too deep into brunch-life over the past few years. I don't want to bore you with long-winded paragraphs so I'll make a list. People love lists. And if they don't, they should. What I Love-Farm to table is an awesome, laudable concept, and the Farm has been up to par with the quality of their local and natural ingredients for a long time; way longer than many others who followed . The menu changes based on seasons, availability, harvests and other factors. This makes eating here fairly guilt-free. -The rustic, white brick décor had me from day one. There is something outright relaxing about sitting here, just from the ambience of the space. The backyard is great , but makes it easy to overextend your visit by a bit.-Coming here during off-peak hours is possible is advisable. Friday and Saturday nights get packed, and reservations help. Saturday and especially Sunday brunch gets very busy, too. Sometimes, that's just when you can make it out with your friends, and so be it. But during the week, while there is a crowd in the evenings, during the daytime, like all very popular restaurants, you will really get your essential Farm experience in. -Service has never been anything besides good or great. -The craft  beer selection , while not tremendous in the number,  always revolves including more than a handful that will have something for everybody. Whiskeys and spirits are not the usual brands you're used to but low-key, more local names of seriously high quality. - In terms of menu items that stand out, I have to say for dinner the farm burger (also available for brunch), the filet mignon (when available) are personal favorites. For brunch/lunch , the Pollock cake and the red flannel hash are fantastic , as well. I have honestly never regretted order any particular item.  The French dip is a lunch favorite of mine and a few friends who have tried it; they've really mastered the jus that its served with. While I can't recall all the items I've ordered over the years, they've all been outstanding and delicious. -Chocolate bread with their coffee is an ideal way to close off any meal, but can equally be used to start any meal. Or just right in the middle. Point is, the chocolate bread rules. It's restaurants like the Farm on Adderley that helped turn Brooklyn into a culinary destination and I hold gratitude for this for as long as I shall live.",5.0
The burger and fries for lunch is what I go for here. Haven't had anything else. They are both solid. It's hipster pricey for sure. The patio is stellar on cooler days.,4.0
"I've tried a lot of great brunch spots. But this was one of the best meals, in general, that I've had in a long time. Don't forget to try the grilled cheese with apple and caramelized onions - big and amazing! French toast is delicious too. Cant wait to go back!",5.0
"So this place is a staple of Ditmas Park and for good reason. Everything I've ordered from this establishment has been superb, often exceeding my expectations. My go to meal is definitely the cheddar burger on an English muffin with the curry mayo. Absolute perfection. Service is always great and you can't beat the simplicity of the menu. If it ain't broke, don't fix it and The Farm proves that what they lack in extravagance they make up for with a fresh, delicious, and hearty menu.",5.0
"When am I going to learn sticking a fried egg on a burger doesn't automatically make it awesome??? Case in point again this morning for brunch at The Farm, where I ordered the burger that reviewers on Yelp! have touted as being delicious. Well, I don't know what 's happened, but the burger at the Farm needs to be left on the farm and not carried to their restaurant!!! It was soooo lackluster that I hate I had to pay for it--dry bread (what a disappointment), overcooked, dry meat (I ordered medium rare), no tomato, etc... I mean, it looked super good; just take a look at the pic I posted. Oh, how I wanted to love it, but it just didn't pass for me :(Another thing that disappointed at The Farm was the chocolate bread. Dry, dry, dry! Beware of this. It didn't look anywhere close to the delicious-looking pics I've seen of it on Yelp! Also, if you order anything else besides the burger, beware that portions are small-ish. If you're taking a group of burly men, think twice.Things that the Farm have going for them include the fries (they were crunchy and tasty), the cheese polenta (but, folks, be real, it's simply cheese grits--just call it what it is, the northerners WILL eat it), the dessert (the chocolate banana dessert was yummy), and the service (the hostess, the bartender, and waiter were super nice).As for atmosphere, note that this play is super small, and it gets crowded fast... so plan on a wait for a table.*Just realized I didn't get curry mayo w/ my fries... nor a plastic animal toy w/ my check... did I get gypped at The Farm today??? (Is it okay to say gypped?) :-P",2.0
This place gets five stars!! The food was amazing as well as the service! The waitress was very kind and attending to the groups needs and wants. I definitely recommend it if you're in the area!,5.0
"Adorable place. I stopped in solo for a quick lunch at the bar. I went with the poached eggs and grits with a side of sausage. Grits are new to me I am still not sure how I feel but the sausage was amazing. Lunch cost me $19 bucks, I left happy and full.  The waitress/ bar tender really knew her stuff she  could tell me where everything on the menu came from. Pretty cool..",5.0
Still a great place to eat brunch. Awesome outside seating area and good service. Friendly staff. Awesome fries. Great coffee! Would recommend. Have never tried the dinner menu but I'm sure it's great.,4.0
"so delicious for brunch. good and quick service. one thing that was weird, they somehow delivered our food before our bloody mary's. but i will chalk that one up to a random mistake. the bar tender was great and let me sit at the bar with a coffee (that he added to my tab at the table without charging me for more coffee) while i waited for my friend to arrive.",5.0
Easily the best restaurant on Cortelyou road if you like seasonal dishes that are cooked with love.,5.0
