"Believe the hype! A friend who used to live close by told me this was an excellent place to get breakfast during the week. Yes, it's a bit out of the way, but after tasting The Farm's french toast, I'll will find a way to get back for more. The boy had the Fisherman's Eggs and I looked upon them with envy after stealing a few bites (but he also looked upon my french toast with envy, they were both excellent dishes.) We even shared the Almond Butter cake for dessert (why not!) and that helped bring the meal to a great end. I'm dying to try their burger and all the other items on the menu.",5.0
"I've been here a few times and never had a wow experience.  By and large the place is nicely put together, clean, has a nice and attentive staff but the food is nothing to rave about.It tends to be better for brunch, but the speed at which the food arrives sometimes raises eyebrows: as in, there was not really enough time to cook what was ordered.  I'm not a big fan of thinking I'm paying good money for food that was kept on a hot plate somewhere.  I can get that at the golden arches!For dinner it's a packed house, so expect a wait if you did not reserve.  OK, fine, but I don't really care for reserving if the food isn't going to warrant making the effort.  The quality of the food is good, good ingredients, but sometimes not all that warm when it reaches the table.The bar is a full bar and will have pretty much any cocktail you want.  The wine list, however, needs some serious thought.  It's overpriced and does not offer a wide selection.By and large, it's a good place run by good people, but I think that they feel they are better than they really are.",3.0
"I have been to the Farm twice now for brunch and as well as the food being delicious, the service from the staff is impeccable . Always friendly, polite and cheerful I feel that as well as the good it's the service that makes a place and I think they deserve 5 stars.",5.0
"Place was eh, just eh. I ordered a dish that was delivered so tasteless and possibly spoiled, that I had to request a different one, I got a sandwich, which :) was eons better, but not worth the price tag. I did like the drinks and the ambiance.",3.0
"I came to the farm after my roommate forced me. I was getting pretty tired of the ""farm-to-table"" phenomena so I wasn't exactly outrunning my bootstraps to get here. Anywho, onto the review.I had the red flannel hash that was pretty good, though not mindblowing as I had expected it to be based on other reviews. I could tell that is wasn't prepared to order but seeing their brunch crowd, it wasn't totally ludicrous to understand. I also had the toast with goat butter and maple sugar. That, on the other hand, was yummy! Now, on to why they're getting a two-star review from me:The service was ca-ca!! For those who don't understand what that means, it sucked! If any of you follow my reviews (I'm sure you don't I just have delusions of grandeur) you'll know that I'm a server and I will ALWAYS give another server the benefit of the doubt when their service is sub-par. In this case, she just seemed to not give a [bleep]. Our waitress wasn't attentive at all! We constantly had to flag her down to get something we needed and when we finally got her attention she seemed almost annoyed that we were asking her to, well, do her job! I could go on about this for another paragraph or so but I'll spare you and skip to the nail in the coffin.At the end of our meal we asked to see a dessert menu but we were promptly told ""I'm sorry, but the kitchen closes for brunch at 3:30."" I then checked the time to see that it was only 3:35! And even if it had been 5 in the afternoon how do you not offer me a complete meal, including dessert?! And to add insult to injury, a solid 15 mins after she claimed the kitchen would make an exception and brought us the chocolate mousse we ordered (Which was entirely too sweet and the salted cream was wayyyy too salty) my roomie and I see her bring dessert menus to another table!!! Are you serious?! I was majorly insulted and felt as though she tried to play us for suckers. I would mention her name in this review but the purpose is to educate, not humiliate. I would suggest that the waitstaff at the farm be more concerned with actually serving people instead of basking in their own 'TRENDINESS'",2.0
"so we had reservation for 10 at 5pm.A couple of us were a few minutes late and we had to all stand there looking at the table until our entire party showed up.That's one way to start a meal.So lets have a drink you say?Sure! I  need one now! Who wants wine, ahh we all love wine!i'll just pick something from the...gasp, list?  maybe we should just go by the glass.You know in all fairness it really is hard to sell a bottle of wine (in south brooklyn!) for less than $55!!!Upscale manhattan ok no prob, but really are you trying to get people to drink in your restaurant or not?Ok screw it, i'll have your fancy gin cocktail.hmmm, that was not that fancy. this is not going wellwell then on to the meal!!oh menu is very meaty and well yea ok i guess that's their, ""thing"", (eye roll).i guess i'll have the one dish that's not meat, yes the ravioli.and some mushroom tempura to start.bread at the table was actually good.and both dished were actually pretty good.would i come back though, no.dining out is a total experience, and i don't usually go to places where i can only order one thing on the menu.ok there were a couple odd fish dishes too. But i'm just not feeling this place.",2.0
"They say 40 is the new 30 and 30 is the new 20...well if that's the case, then Brooklyn is the new Manhattan or at least that's how it felt when I came here for brunch on a Sunday afternoon!!As quite as a Sunday might be for some, this place was buzzing lively with people pouring out onto the street, just waiting to hear their name called. This restaurant was definitely chic and trendy. It was completely packed on the inside and their backyard patio looked absolutely charming. I ended up ordering their Fisherman's eggs ($10). My poached eggs were on the smaller end, but it was cooked perfectly. The smoke trout was very yummy but I felt it shouldn't have been mixed w/ my greens since the heat of the fish weathered most of my mixed salad and made it look unattractive and unappetizing. However, their coffee ($2.50) was really yummy; it was full of flavor and best of all, it's unlimited so I was pretty wired up by the end of my meal.Either case, all of my friends' food looked great and I like the idea that the restaurant makes their own sausage. Therefore, this restaurant is surely a place that I would want to venture back to, not only to try their other dishes, but also because of the great hospitality that this restaurant displayed when I was there!! Their service was excellent!",4.0
"This is a great place to get a steak, or other mid-price-range ($15-$25 entrees) Americana food.  They use a lot of local and high quality ingredients.  This is reflected in the food, which is often simple and traditional with small creative twists.  The place can get a bit crowded at times, and can occasionally have a 15 minute wait, but it's worth it! They also have a great brunch menu for reasonable prices (under $15 per person). I love the corned beef and beet hash.  They have a nice selection of craft beers, and in the summer, have a pretty outdoor patio in the back.",5.0
"Definitely the grand finale of my trip to Brooklyn this weekend. Went with a party of four around 10:30 A.M and had no wait at all. Between the four of us I'd say half the brunch menu was tried and we were amazed with every dish. The poached eggs, grilled cheese, egg sandwich, kale salad, the fries, the bacon, the CHOCOLATE BREAD!! Even without the awesome bloody mary I was sold on the place, and our server Caitlin was extremely pleasant while bustling all over her section. This place made my drive back home much more enjoyable.",5.0
"This place is five minutes from the home and I use to frequent here every Sunday. The food was great and the wait on Sundays was ridiculous!!!  After visiting a month straight the service began to go downhill, my wait time was quoted 10-20 minutes and the hostess forgot about me and sat other parties that came after me before me, when we finally sat down to eat I ordered my food (I usually get the farm burger). The waiter never came back to my table to refill my coffee, he never came back to check on our food period. He only came by to drop off the check. I usually tip 20% but only gave him 10% I felt as if I was too gracious. I've never been back, I'm giving them time to shape up",3.0
"Nice neighbourhood restaurant, decent food!",3.0
The only restaurant I've ever been in that I can not find one thing wrong. Everything there is perfect and the food is to die for. The bloody Mary's are the best I've ever tasted. The adult grilled cheese is a sandwich I wouldnt have thought up in a million years. I'm dying to try their dinner menu,5.0
"How can bread (brioche), tomatoes (heirloom), and mayo illicit an emotional reaction?I don't know, I just don't.",5.0
"Place was eh, just eh. I ordered a dish that was delivered so tasteless and possibly spoiled, that I had to request a different one, I got a sandwich, which :) was eons better, but not worth the price tag. I did like the drinks and the ambiance.",3.0
"I came to the farm after my roommate forced me. I was getting pretty tired of the ""farm-to-table"" phenomena so I wasn't exactly outrunning my bootstraps to get here. Anywho, onto the review.I had the red flannel hash that was pretty good, though not mindblowing as I had expected it to be based on other reviews. I could tell that is wasn't prepared to order but seeing their brunch crowd, it wasn't totally ludicrous to understand. I also had the toast with goat butter and maple sugar. That, on the other hand, was yummy! Now, on to why they're getting a two-star review from me:The service was ca-ca!! For those who don't understand what that means, it sucked! If any of you follow my reviews (I'm sure you don't I just have delusions of grandeur) you'll know that I'm a server and I will ALWAYS give another server the benefit of the doubt when their service is sub-par. In this case, she just seemed to not give a [bleep]. Our waitress wasn't attentive at all! We constantly had to flag her down to get something we needed and when we finally got her attention she seemed almost annoyed that we were asking her to, well, do her job! I could go on about this for another paragraph or so but I'll spare you and skip to the nail in the coffin.At the end of our meal we asked to see a dessert menu but we were promptly told ""I'm sorry, but the kitchen closes for brunch at 3:30."" I then checked the time to see that it was only 3:35! And even if it had been 5 in the afternoon how do you not offer me a complete meal, including dessert?! And to add insult to injury, a solid 15 mins after she claimed the kitchen would make an exception and brought us the chocolate mousse we ordered (Which was entirely too sweet and the salted cream was wayyyy too salty) my roomie and I see her bring dessert menus to another table!!! Are you serious?! I was majorly insulted and felt as though she tried to play us for suckers. I would mention her name in this review but the purpose is to educate, not humiliate. I would suggest that the waitstaff at the farm be more concerned with actually serving people instead of basking in their own 'TRENDINESS'",2.0
"so we had reservation for 10 at 5pm.A couple of us were a few minutes late and we had to all stand there looking at the table until our entire party showed up.That's one way to start a meal.So lets have a drink you say?Sure! I  need one now! Who wants wine, ahh we all love wine!i'll just pick something from the...gasp, list?  maybe we should just go by the glass.You know in all fairness it really is hard to sell a bottle of wine (in south brooklyn!) for less than $55!!!Upscale manhattan ok no prob, but really are you trying to get people to drink in your restaurant or not?Ok screw it, i'll have your fancy gin cocktail.hmmm, that was not that fancy. this is not going wellwell then on to the meal!!oh menu is very meaty and well yea ok i guess that's their, ""thing"", (eye roll).i guess i'll have the one dish that's not meat, yes the ravioli.and some mushroom tempura to start.bread at the table was actually good.and both dished were actually pretty good.would i come back though, no.dining out is a total experience, and i don't usually go to places where i can only order one thing on the menu.ok there were a couple odd fish dishes too. But i'm just not feeling this place.",2.0
"They say 40 is the new 30 and 30 is the new 20...well if that's the case, then Brooklyn is the new Manhattan or at least that's how it felt when I came here for brunch on a Sunday afternoon!!As quite as a Sunday might be for some, this place was buzzing lively with people pouring out onto the street, just waiting to hear their name called. This restaurant was definitely chic and trendy. It was completely packed on the inside and their backyard patio looked absolutely charming. I ended up ordering their Fisherman's eggs ($10). My poached eggs were on the smaller end, but it was cooked perfectly. The smoke trout was very yummy but I felt it shouldn't have been mixed w/ my greens since the heat of the fish weathered most of my mixed salad and made it look unattractive and unappetizing. However, their coffee ($2.50) was really yummy; it was full of flavor and best of all, it's unlimited so I was pretty wired up by the end of my meal.Either case, all of my friends' food looked great and I like the idea that the restaurant makes their own sausage. Therefore, this restaurant is surely a place that I would want to venture back to, not only to try their other dishes, but also because of the great hospitality that this restaurant displayed when I was there!! Their service was excellent!",4.0
"This is a great place to get a steak, or other mid-price-range ($15-$25 entrees) Americana food.  They use a lot of local and high quality ingredients.  This is reflected in the food, which is often simple and traditional with small creative twists.  The place can get a bit crowded at times, and can occasionally have a 15 minute wait, but it's worth it! They also have a great brunch menu for reasonable prices (under $15 per person). I love the corned beef and beet hash.  They have a nice selection of craft beers, and in the summer, have a pretty outdoor patio in the back.",5.0
"Definitely the grand finale of my trip to Brooklyn this weekend. Went with a party of four around 10:30 A.M and had no wait at all. Between the four of us I'd say half the brunch menu was tried and we were amazed with every dish. The poached eggs, grilled cheese, egg sandwich, kale salad, the fries, the bacon, the CHOCOLATE BREAD!! Even without the awesome bloody mary I was sold on the place, and our server Caitlin was extremely pleasant while bustling all over her section. This place made my drive back home much more enjoyable.",5.0
"This place is five minutes from the home and I use to frequent here every Sunday. The food was great and the wait on Sundays was ridiculous!!!  After visiting a month straight the service began to go downhill, my wait time was quoted 10-20 minutes and the hostess forgot about me and sat other parties that came after me before me, when we finally sat down to eat I ordered my food (I usually get the farm burger). The waiter never came back to my table to refill my coffee, he never came back to check on our food period. He only came by to drop off the check. I usually tip 20% but only gave him 10% I felt as if I was too gracious. I've never been back, I'm giving them time to shape up",3.0
"Nice neighbourhood restaurant, decent food!",3.0
The only restaurant I've ever been in that I can not find one thing wrong. Everything there is perfect and the food is to die for. The bloody Mary's are the best I've ever tasted. The adult grilled cheese is a sandwich I wouldnt have thought up in a million years. I'm dying to try their dinner menu,5.0
"How can bread (brioche), tomatoes (heirloom), and mayo illicit an emotional reaction?I don't know, I just don't.",5.0
"Like it , it is in brooklyn not close to me but is inexpensive and organic breakfast. It was delicious I had croque monsieur and hubby had the farm breakfast both great and the best part inexpensive. Want something fresh and on a budget.. come to the farm!Worth the trip from the city, great organic inexpensive brunch",4.0
"I'm afraid that if I write too glowing a review, then you'll all flock here and I will never be able to get a table.What to do, what to do.Okay, fine.I cannot remark about brunch or dinner (but I will when I return, for that is inevitable), as I've only been here for lunch several times. The food is local and fresh so the menu changes from time to time based on availability. From their website:""The restaurant aims to bring thoughtfully produced food and ingredients to our community in a totally accessible way. Much of the way The Farm has evolved has been to pursue the principles of supporting local farmers, artisans, entrepreneurs as much as possible, making delicious food from that, and serving it in a completely honest way.""How can one not support that? They have an excellent burger, from what my dining companions have expressed to me (that, and their clean plates). Oh, and the fries that come with the burger have curry mayo on the side....and I can never stop stealing them off my friends' plates. I've tried the crunchy beet salad (with sunflower seeds), the hummus plate, the portobello sandwich and all are flavorful and filling. The service is always prompt and attentive too.I'm glad it's within walking distance from my apartment because that way I can roll myself home afterward....",5.0
"So I started going to this place for brunch about 5 years ago( would invite co workers from all over nyc) way before it started getting way too crowded every sat and sun filled with yuppies HOWEVER that isn't the worst possible thing that can happen especially for a popular brunch spot ( and the Farm is def very popular in my area) The service is HORRIBLE for a few months i've noticed all these new waiters and they're just so rude and it was never like that at this place, that once had humble beginnings, it just kinda sucks when you've been going to a brunch spot for so long and because of popularity the service suffers. It's like they feel like they no longer have to try since business is booming but with bad service business will suffer. I'm OVER the FARM on ADDERLEY bye",2.0
"Where should I start? The lovely, rustic-meets-city decor? The fine level of service? The absolutely delicious Grilled Char? I don't know where to begin...Among the 6 of us, we ordered several apps and mains. We were disappointed that they'd sold out of the scallops, but no bigs...Like I said, the Grilled Char was phenomenal. So tender, moist, flaky and seasoned to perfection. The Cauliflower side dish served w/porchetta was another major hit. Escarole salad - muy delicioso. Upstate Carrots - mouthwatering.I ordered the Maitake Mushroom Tagliatelle. The noodles were fresh and al dente, served with buttery maitake. Unfortunately, I'd porked all over the apps earlier and was too full to finish my pasta. We were all super pleased with our experience at The Farm.",4.0
"Attended a wedding here.  Ends up none of the meal choices were served with a carb (except the pasta).  When the food arrived and we realized this, one guest at our table asked the waiter if she could have some bread or something.  Explaining she was diabetic to the waiter, why it was needed, and asking nicely, she was met with a reply of ""Sorry this is the lunch service, we do not serve any bread or anything else"".The salad was incredible and that is why I gave 2 stars, but the steak of the day was somehow over and under cooked at the same time with a very odd texture.  Most persons at the table who had the steak agreed.  I understand a seared outside and reddish inside, which is how I LOVE my steak.  But very rare inside with a burnt top/bottom is unacceptable, especially when it was not just one.Can not see myself going back to this restaurant to eat.",2.0
"Our hotel recommended this nice restaurant for brunch. The food and service was excellent as advertised! We especially loved the chocolate brioche. A special thanks to our server Yael, who was most pleasant to visit with. You will not be disappointed with your meal in this quaint location.",5.0
"I came here for brunch, terribly hungover with some college friends, and ordered the farmer's breakfast.  It brought me back to life with its silken scrambled eggs, fortifying swiss chard and hearty taters.  Seriously, I've never had scrambled eggs that were so creamy and delicious, I'd come back just for them!    I washed it all down with some of their Moroccan Mint Green Tea, and afterwards finally had the wherewithal to drag myself to the subway and make the trek home.",4.0
"I came here with a girlfriend for brunch this Sunday and we loved it. Minimal wait time at 11:00 am, maybe ten minutes, though it was raining out.  Staff were accommodating (my friend needed stroller space) and our food was delicious and perfectly seasoned, IMO. She ordered red flannel hash with a side of parmesan grits, I had sausage & eggs.  Both came with a nice mesclun salad which didn't seem like an afterthought - the dressing was tasty and we both cleaned our plates. The house-made sausage was some of the best breakfast sausage I've ever had, and the grits were a-maz-ing - so creamy! The place is loud enough that a few minutes of baby fussing went fairly un-noticed, but we still felt like we could have a conversation. I would return!",4.0
We went to the Farm for Mothers Day so it was obviously pretty busy. We got there when they opened and just had to wait to be seated.  The food was awesome and the service was very good too.,4.0
Great 'breakfastish' soul food! French toast with apples were excellent.,5.0
"Like it , it is in brooklyn not close to me but is inexpensive and organic breakfast. It was delicious I had croque monsieur and hubby had the farm breakfast both great and the best part inexpensive. Want something fresh and on a budget.. come to the farm!Worth the trip from the city, great organic inexpensive brunch",4.0
"I'm afraid that if I write too glowing a review, then you'll all flock here and I will never be able to get a table.What to do, what to do.Okay, fine.I cannot remark about brunch or dinner (but I will when I return, for that is inevitable), as I've only been here for lunch several times. The food is local and fresh so the menu changes from time to time based on availability. From their website:""The restaurant aims to bring thoughtfully produced food and ingredients to our community in a totally accessible way. Much of the way The Farm has evolved has been to pursue the principles of supporting local farmers, artisans, entrepreneurs as much as possible, making delicious food from that, and serving it in a completely honest way.""How can one not support that? They have an excellent burger, from what my dining companions have expressed to me (that, and their clean plates). Oh, and the fries that come with the burger have curry mayo on the side....and I can never stop stealing them off my friends' plates. I've tried the crunchy beet salad (with sunflower seeds), the hummus plate, the portobello sandwich and all are flavorful and filling. The service is always prompt and attentive too.I'm glad it's within walking distance from my apartment because that way I can roll myself home afterward....",5.0
"So I started going to this place for brunch about 5 years ago( would invite co workers from all over nyc) way before it started getting way too crowded every sat and sun filled with yuppies HOWEVER that isn't the worst possible thing that can happen especially for a popular brunch spot ( and the Farm is def very popular in my area) The service is HORRIBLE for a few months i've noticed all these new waiters and they're just so rude and it was never like that at this place, that once had humble beginnings, it just kinda sucks when you've been going to a brunch spot for so long and because of popularity the service suffers. It's like they feel like they no longer have to try since business is booming but with bad service business will suffer. I'm OVER the FARM on ADDERLEY bye",2.0
"Where should I start? The lovely, rustic-meets-city decor? The fine level of service? The absolutely delicious Grilled Char? I don't know where to begin...Among the 6 of us, we ordered several apps and mains. We were disappointed that they'd sold out of the scallops, but no bigs...Like I said, the Grilled Char was phenomenal. So tender, moist, flaky and seasoned to perfection. The Cauliflower side dish served w/porchetta was another major hit. Escarole salad - muy delicioso. Upstate Carrots - mouthwatering.I ordered the Maitake Mushroom Tagliatelle. The noodles were fresh and al dente, served with buttery maitake. Unfortunately, I'd porked all over the apps earlier and was too full to finish my pasta. We were all super pleased with our experience at The Farm.",4.0
