"Have to do it. the 5 stars don't lie. Great ambience. Felt local authentic, white brick but homey.Not only the food is sourced locally but so is the beer.For brunch considering how popular the place is 10 bucks a meal is reasonably priced.Food was fantastic. Wife got farmers omelet. Almost tasted like french onion soup inside and was delicious. I got what is essentially a crab cake but with white fish and harissa sauce with a sunnyside egg on top. Food came very fast great service. Definitely went people visit I will take them here. Just go OFF PEAK as the place is ALWAYS packed and you will wait",5.0
"After three other times coming here and being disappointed, this place is on a downhill slope. We aren't fans of one of the bartenders, and the food ticket times have just become way too long for us to justify this place as one of value.Love that the owner reached-out, and really cares about the full experience. 4 star.",4.0
"Hungry and missing breakfast en route home from IKEA, I decided I grab something on the way. 'Disappointed I was unable to introduce my Lady to a nearby (hint, hint) venue I decided to give the Farm a shot!   So upon entry we're greeted with a smile () and were seated in the rear of this pretty small venue where we then discover there's an outdoor space (open during the S/S season). That was cool and it didn't hurt we were receiving an abundance of natural light from the window while decided what to order.   The menu was very limited, yet concise. I didn't mind at all as I'm not very difficult. My date however ... uhh yeah so we then decide to order and while she went with the farm omelet (cheddar, caramelized onion, market greens, & Yukon gold potatoes) holding the onions. I ordered the egg sandwich (scrambled egg & cheddar on a ciabatta) and substituted the ciabatta for whole grain. I also ordered a side of toast w/ goat butter & maple sugar which really caught me by surprise! My taste buds jumped as the sweetness kicked my palate on the first bite. In any case it was all good as it became more bearable with every following bite. And no, I don't have a sweet tooth if you're wondering. It tasted more like a pastry than anything.   Service was very much up to par as our glasses remained filled with water and everyone exhibited a smile with exuberant energy(just how I like my food establishments)! We received our food and man oh man as we began diving in and terrorizing our dishes we became full faster than usual! I loved it and had no complaints!   My dish was delish! My egg sandwich was stuffed(understatement) with bright yellow egg and cheddar and it was absolutely appetizing! I liked that the check came with a small toy farm animal used as a paper weight and there were lots of coloring activities to keep a kid busy if one was brought along.   Needless to say, I would definitely come back here and or refer it to a friend! I can't wait to come back when it gets nicer out and the outdoor dove is open to patrons! Kudos to The Farm on Adderley!",4.0
"Great food & good service! - I'm all about service, if that isn't right then my whole experience is shattered.  Here the service is impeccable.  Server had a great attitude and was attentive. Food: I had the schnitzel which is laid on top of a bed of greens ( forgot what greens it was but it was good lol) with anchovies and a egg on top. I came for brunch so I liked the egg being there.  The chicken + egg + anchovies came well together.  It was so freaking good. Also got the fries which came with their curry mayo.  Yeah the dipping sauce was good but it's not like OMG good like other reviews make it - Wifey got a omlet with home fries and those home fries were so moist and delicious.  They took it to another level.  Coffee is good too - pricy but you get unlimited refills so it was worth it.  Overall experience  - their prices are average - food is good and service is great.  Will I come back? Yes I would.Lastly I got the chocolate bread and No it's not overly salty and Yes it's freakin amazing!",5.0
"The selections were pretty standard for brunch, but I felt the quality was above-standard and on the leaner side than most brunch places. I got the Sausage & Eggs, which came with very lean house-made breakfast sausage, fluffy scrambled eggs, breakfast potatoes, and a very fresh side of baby greens. I didn't care much for the potatoes (I would have preferred them crispier), but everything else on the plate was delicious. Other members of my table had the Farm Burger and the Farmer's Breakfast. The burger was delicious. The patty was made of very high-quality beef, seasoned and grilled perfectly and served on a toasted house-made English muffin. The fries could have been crispier, but they seemed freshly cut and came with some delicious house-made ketchup. The Farmer's Breakfast also looked really good. It was very crowded when we got there. We were placed on a 20-minute wait. Although there is not a lot of waiting room in the restaurant, we found a coffee shop nearby and hung out there before checking back on our table. The atmosphere is very nice, and the service is pleasant. I definitely enjoyed my brunch here and felt the pricing was reasonable. It's a very solid option for brunch in Brooklyn.",4.0
"I dug it. Visiting my son,who's a local,meant imbibing and burgers. Enter The Farm.Staff was friendly.Friday night, busy, but they found us a table.Burgers because always burgers unless its brunch then burgers with eggs on top.Crafty beers.Price fit the location...pricey but ok because burger was good so definitely doable again.",4.0
"Delightful brunch place in the heart of Ditmas Park! My boyfriend and I came here last week for a low key late brunch. We luckily got seated before they closed for dinner service. The wait wasn't terrible at 30 minutes. Seating is tight like most brunch places are, but service is efficient.I ordered too many things for us to sample. We got the French fries and chocolate bread based on the reviews here. Neither of them disappointed! The curry mayo dip was delicious! I mean, even without consulting Yelp, chocolate bread and French fries sound amazing but I would probably skipped them both and saved the calories for something else hahahah.I ordered the omelette with market greens and my boyfriend ordered their giant breakfast platter. Both dishes came out quickly! My eggs were cooked to perfection and the onions in my omelette were caramelized and seasoned well. The omelette was about the size of my forearm and I was able to stuff myself with half of it before calling it quits; that's how good it was!I would most definitely come back here again for brunch. It's only a few neighborhoods away, the area has not been hit that hard by gentrification (yet) and so it's still got a lot of its original, authentic Brooklyn charm to it. Job well done, Farm!",5.0
"We located this place due to the power of Yelp and it did not disappoint! It is a farm to table kind of place, which I really like. We arrived for brunch and the place was full but we weren't waiting long for a table. Once we were seated, we ordered and the food came out so fast! Literally 5-10 mins after we ordered. It was a unseasonably warm day so it was nice to see the doors onto the yard were open. I ordered eggs with sausage and my fellow diner ordered the hash. Both meals were excellent. My sausage was more like a patty, so it was quite large. It tasted great, but was a tiny bit greasy. The potatoes were also really tasty. My husband enjoyed the hash and from what I sampled it tasted great too. We ordered some of the salted chocolate bread as a side and it was a decent portion size, easily enough to share between two as a side to your meal. It was enjoyable but not too memorable. Service was friendly and quick and I would visit again if in the area. I liked that you are given a small farm animal figure with your cheque, very cute!",4.0
"Came here on a sunday night for dinner with my wife.  Street parking was not too difficult to find.  Restaurant was fairly empty and we were seated immediately.  Our server greeted us and notified us what was unavailable from the menu and also told us the specials of the day.We tried their appetizer special, which was fingerling potatoes with caviar.  We had their polenta with a side of brussel sprouts and the pork shoulder.  The appetizer was a littler bigger than i expected.  Tasted good and unique.  The polenta was ok but had a lot of weird vegetables in it.  Tasted a little funny but was pretty good.  Brussel sprouts were a little tasteless and can probably pass on that.  The pork shoulder was delicious.  Nice soft and tender meat that was flavorful.  In the end, we shared the upside down cake.  Tasted a little on the sweet side but good.  The cake portion kind of tasted like a banana cake.Great food to go along with good service.  Menu is a little small but everything sounded really good.  Would like to come back to try their brunch.",4.0
"Woke up this morning with a starving belly and needed to get my brunch awn stat!I browsed online to see who has food I'd be in the mood of, close enough to pick it up and still be good by the time I get home. The Farm on Adderley won. I call them up and this absolutely amazing young man, Jason, took my order. He was super friendly, informative and a pleasure to deal with on a freezing Saturday morning. I ordered the Tuna Sandwich, Egg Sandwich, Fries, Chocolate Bread, Oatmeal & PB & Chocolate mousse dessert & two coffees. The tuna sandwich was heavenly. Packed to the brim with delicious tuna, capers and olives and super fresh bread. You absolutely must get the chocolate bread. It is so different, I have never had anything like that before. I do have one small complaint though. The coffees came black. I only realized it once I got home and luckily I had milk at home. But I'd be super bummed if I'd have come home and not been able to drink my coffee. Not very sure why it did come milkless. The price was super right for the items I bought. I will definitely be coming back to try some more dishes.",4.0
"Came here for brunch and had an enjoyable meal. The red flannel hash was an interesting take with the beets adding a delicious and different take on a classic.The top notch ingredients and prep that goes into making the dish is evident as everything was delicious. Fries are perfectly executed and the portions are of a well balanced proportion.The staff are all super friendly and the atmosphere and decor is perfect for being ""The Farm"", never coming off as trying too hard.This is definitely a gem on this street.",4.0
"So, being fairly new at YELPING I like to make sure I grab as much bites from spots in my neighborhood as much as I can (hard to keep up tho, there's a new 1 every month or so )   Anyways , I trekked about 15mins so I could work up an appetite for this restaurant .. It was a good idea because I I was fullllll by the end of my meal   Very nice and inviting atmosphere .. I sat by the bar and had a shot of 1776 whiskey (whiskey at 1pm, yum) I had a well done farm burger (everything's organic or straight from the farmers market) with eggs and extra bacon which was all very good and very nice size portions ... I also had a bowl of granola which was delicious but I like more fruits .. My only setback was the fact that they wrap it up at 3pm! For a 2hr break",3.0
"i have literally been DYING to go here for brunch. Unfortunately my work schedule isn't brunch friendly so its taken me a while but holy crap was it worth the wait!super cute place, random location. They have a nice patio outback which would be great in the summer but prob even useful during this winter heat wave.we came here on a wednesday at noon and it was pretty busy, i would say at least half of the tables were takenFood:-coffee: true to bk form its local blah blah blah. coffee was good but it was like $4 for a cup which is pretty steep for just plain coffee. They also only have whole milk & real sugar fyi-fries: oh em gee to die for! huge portion, super crispy, totally amazing. I know everyone raved about the curry mayo but i didn't really like it. also kinda pricey at $7-egg sandwich: so yummy! i added on caramelized onions which were really fantastic. It was ooey gooey cheesy and delicious. the eggs were really well cooked, big portion. Ciabatta was a bit chewy but i think that's just ciabatta in general. The side salad was really great, their vinaigrette was so light & mustard-y i loved it-corque monsieur: boyfriends choice, he said it was great. He was very impressed that the cheese & ham were juicy but the bread managed to stay crispy despite such advisaries-chocolate bread: holy crap this stuff is like crack. reminded me of babka. its super dense, could probably knock someone out, & super chocolatey but the salt makes it not overwhelming. really big portion, enough to share with 2peoplefantastic brunch spot, great farm to table options, a bit hipster but so delicious! will def be coming back",5.0
"Found this place on Yelp and thoroughly enjoyed my experience here. Their brunch menu wasn't too extensive, but that isn't a bad thing. I ordered the farm omelet which had cheese and caramelized onions in it. The entree also came with a small side salad and potatoes. It was pretty darn filling! To me, I thought the onions in the omelet made it a little too sweet for my liking. Other than that, everything came out good and fresh.The servers were all welcoming and friendly. I liked how they checked on us frequently to make sure we were okay.Would definitely recommend this place to people if they're in this neck of the woods and wanting to do brunch. Also, would like to try this place for dinner the next time I'm in town.",4.0
"Wonderful restaurant! This was the first place I ate at when my boyfriend and I explored Ditmas Park a few months ago. We came in for brunch and it was delicious! Portions were good and the potatoes were fantastic. Everyone was super friendly and we were able to get a table in the back patio, which was lovely. There were string lights up above and we could see the houses in the neighborhood above the fence. Everyone there seemed to be in great moods and we loved that the restaurant was classy and down to earth at the same time. We went back for dinner with a group of five on Saturday night and it was just as great we remembered! It was relatively empty when we arrived around 6 but more and more people came in while we were eating. The atmosphere inside is warm and inviting. The music wasn't too loud and it was easy to hold conversations even when it started getting more crowded. Our waitress was really sweet and didn't mind repeating the descriptions of the specials when we asked her too. I got the chicken--it was super juicy and flavorful. It was a big portion and I got pretty full halfway through. The complimentary bread is AMAZING!! The fries with curry ketchup are really yummy as well. Everyone seemed to enjoy their food! We also got a slice of apple pie and the honey chestnut ice cream for dessert, both of which were really good. The apple pie was especially delicious.",5.0
"I've been looking forward to brunching here for a while now since I've seen the great reviews and it's been sitting in my Yelp bookmarks for quite some time. I really hoped I would enjoy this place more. Cute restaurant in a quiet neighborhood. Staff is very friendly and offers an overall enjoyable brunch experience. Menu is a small and a little basic. Our table ordered the burger, the chicken schnitzel, the hash and I had the pollock which was probably the best dish of the bunch. The pollock was cooked very well and the accompanying mayo was a very nice touch. The schnitzel and hash were a little dry and no comments on the burger since I didn't have a taste of that. The fries it came with were done nicely though and the curry mayo was a pleasant surprise. Overall, the food was good but not outstanding. Not sure if I would go out of my way to come back to this brunch spot though. Cute touch with the little farm animals that come with the bill though! :)",3.0
"My girlfriend and I decided to try this place for brunch on a Sunday afternoon and to be fair, I wasn't exactly happy about the decision, I'm resistant to change when it comes to brunch because I have such a good arsenal of places already. We walked in and this place was bumping, it was a thirty minute wait, but it was warranted.Finally, we were seated and ordered the chocolate bread for an appetizer. I could not wait! I love chocolate bread,and in my opinion, its the perfect opener for a Sunday brunch. I was disappointed, the salt was way too strong and the sweetness was more on the bitter side.For entrees we ordered the burger with an egg on top, and a side of bacon.The portions were huge. The flavors were awesome, and the integrity of the food was spot on.This was one of those places were i was greeted with a longer wait and a mediocre apptizer and started off on the wrong foot....but our brunch was so FREAKING Delicious that I have no issue forgetting about those issues and recommending this place.Plus we saw a celeb there and was seated next to us (Trevor from suits)",4.0
"The farm has a uniqie ambiance of old school  charm combined with fresh and healthy food. The Kale salad beyond this earth, so is the 100% grass fed burger. Anythis you order is sure to make you feel good and won't  leave you feeling heavy.  The wine is well  selected and to try several you can order 1/2 caraffe. In the summer the cute back yard is open. The staff are helpfull and courteous. The best place to eat when  your in the area.",5.0
"Worth the wait, this place is amazing for brunch!",5.0
"I really enjoy farm fresh ingredients and quaint little brunch places and this place is the quintessential brunch place of my dreams. My boyfriend and I came to the farm on adderly on Sunday around 1pm - prime brunch hour. They advised that it was going to be a half hour wait and we were seated right about half an hour later. The menu is pretty small and my boyfriend and I were thrown off by the lack of options. We both picked the burger with fries and a side of bacon to share and chocolate  bread with sea salt and butter to share as well. When the food came out we were surprised at how huge the portions were. Chocolate bread with sea salt & butter -  sounds like a dream but the reality is that it is too salty. Next time I would ask for the salt on the side so you can personally cater the taste. Burger on English muffin - although I was surprised that the medium was on the medium rare side, it was juicy and delicious. I especially like that it was on an English muffin, therefore, it was soft and juicy. The fries were good as well. Bacon on the side -  we got the side of bacon for $5 to share because putting bacon on our burgers was going to cost $2/person. We decided to get a side for $5. It was huge and we couldn't finish it. But the bacon was great. Altogether I would definitely come back to the farm, especially since it is one of the closest brunch options to me. Also, I love the atmosphere and would love to try the outdoor area when it gets warmer. I highly recommend this place for brunch!",4.0
"Came here for brunch and had an enjoyable meal. The red flannel hash was an interesting take with the beets adding a delicious and different take on a classic.The top notch ingredients and prep that goes into making the dish is evident as everything was delicious. Fries are perfectly executed and the portions are of a well balanced proportion.The staff are all super friendly and the atmosphere and decor is perfect for being ""The Farm"", never coming off as trying too hard.This is definitely a gem on this street.",4.0
"So, being fairly new at YELPING I like to make sure I grab as much bites from spots in my neighborhood as much as I can (hard to keep up tho, there's a new 1 every month or so )   Anyways , I trekked about 15mins so I could work up an appetite for this restaurant .. It was a good idea because I I was fullllll by the end of my meal   Very nice and inviting atmosphere .. I sat by the bar and had a shot of 1776 whiskey (whiskey at 1pm, yum) I had a well done farm burger (everything's organic or straight from the farmers market) with eggs and extra bacon which was all very good and very nice size portions ... I also had a bowl of granola which was delicious but I like more fruits .. My only setback was the fact that they wrap it up at 3pm! For a 2hr break",3.0
"i have literally been DYING to go here for brunch. Unfortunately my work schedule isn't brunch friendly so its taken me a while but holy crap was it worth the wait!super cute place, random location. They have a nice patio outback which would be great in the summer but prob even useful during this winter heat wave.we came here on a wednesday at noon and it was pretty busy, i would say at least half of the tables were takenFood:-coffee: true to bk form its local blah blah blah. coffee was good but it was like $4 for a cup which is pretty steep for just plain coffee. They also only have whole milk & real sugar fyi-fries: oh em gee to die for! huge portion, super crispy, totally amazing. I know everyone raved about the curry mayo but i didn't really like it. also kinda pricey at $7-egg sandwich: so yummy! i added on caramelized onions which were really fantastic. It was ooey gooey cheesy and delicious. the eggs were really well cooked, big portion. Ciabatta was a bit chewy but i think that's just ciabatta in general. The side salad was really great, their vinaigrette was so light & mustard-y i loved it-corque monsieur: boyfriends choice, he said it was great. He was very impressed that the cheese & ham were juicy but the bread managed to stay crispy despite such advisaries-chocolate bread: holy crap this stuff is like crack. reminded me of babka. its super dense, could probably knock someone out, & super chocolatey but the salt makes it not overwhelming. really big portion, enough to share with 2peoplefantastic brunch spot, great farm to table options, a bit hipster but so delicious! will def be coming back",5.0
"Found this place on Yelp and thoroughly enjoyed my experience here. Their brunch menu wasn't too extensive, but that isn't a bad thing. I ordered the farm omelet which had cheese and caramelized onions in it. The entree also came with a small side salad and potatoes. It was pretty darn filling! To me, I thought the onions in the omelet made it a little too sweet for my liking. Other than that, everything came out good and fresh.The servers were all welcoming and friendly. I liked how they checked on us frequently to make sure we were okay.Would definitely recommend this place to people if they're in this neck of the woods and wanting to do brunch. Also, would like to try this place for dinner the next time I'm in town.",4.0
"Wonderful restaurant! This was the first place I ate at when my boyfriend and I explored Ditmas Park a few months ago. We came in for brunch and it was delicious! Portions were good and the potatoes were fantastic. Everyone was super friendly and we were able to get a table in the back patio, which was lovely. There were string lights up above and we could see the houses in the neighborhood above the fence. Everyone there seemed to be in great moods and we loved that the restaurant was classy and down to earth at the same time. We went back for dinner with a group of five on Saturday night and it was just as great we remembered! It was relatively empty when we arrived around 6 but more and more people came in while we were eating. The atmosphere inside is warm and inviting. The music wasn't too loud and it was easy to hold conversations even when it started getting more crowded. Our waitress was really sweet and didn't mind repeating the descriptions of the specials when we asked her too. I got the chicken--it was super juicy and flavorful. It was a big portion and I got pretty full halfway through. The complimentary bread is AMAZING!! The fries with curry ketchup are really yummy as well. Everyone seemed to enjoy their food! We also got a slice of apple pie and the honey chestnut ice cream for dessert, both of which were really good. The apple pie was especially delicious.",5.0
"I've been looking forward to brunching here for a while now since I've seen the great reviews and it's been sitting in my Yelp bookmarks for quite some time. I really hoped I would enjoy this place more. Cute restaurant in a quiet neighborhood. Staff is very friendly and offers an overall enjoyable brunch experience. Menu is a small and a little basic. Our table ordered the burger, the chicken schnitzel, the hash and I had the pollock which was probably the best dish of the bunch. The pollock was cooked very well and the accompanying mayo was a very nice touch. The schnitzel and hash were a little dry and no comments on the burger since I didn't have a taste of that. The fries it came with were done nicely though and the curry mayo was a pleasant surprise. Overall, the food was good but not outstanding. Not sure if I would go out of my way to come back to this brunch spot though. Cute touch with the little farm animals that come with the bill though! :)",3.0
