"One night, one of us was craving for a chorizo pizza. We checked Yelp, read a lot of good reviews about this place, & decided to check it out. We were here on a Thursday night around 8pm. Street parking is easy to find. The place was somewhat busy but we didn't have to wait for a table. We were seated immediately. Casual place with a wood fire place. Great for one of those cold winter nights. We got the salame piccante & the pizza con cipolle. They were definitely delicious. The salame piccante has the spicy chorizo but definitely not spicy. We had to ask for some crushed pepper. The portion were decent. The pizza is about 12"". We weren't stuffed but definitely satisfied. If you have a big appetite or starving, it's best if you add an extra sides or maybe even an extra pie. Overall, we like the pizza here. The service was attentive. The food came pretty quickly. All total, our bill came out to about $30. This place have live music on Monday. If you're around the area, this place is definitely worth checking out.",4.0
"Nice ambiance, good food, good music, good service.Our pizza was a little charred, but otherwise very tasty.My roommate and I love that it's open late.CASH ONLY",4.0
This is the best PIZZA in town. No doubt about it. I love also the kale salad and burrata appetizers.I eat almost everytime at the bar drinking a glass of the red house wine ( get the Lagrain)!Just be aware that the weekends it gets REALLY packed so worthed to make a reservation or go early! Enjoy!!!!,5.0
"Solid pizza but definitely needs some work. Burrata and Prosciutto were great except for the really sad side of wonder bread they serve it with, literally I am certain this is store bought sliced bread... gross. On to the pizza, we ordered one of the specials with gorgonzola, mozzarella, italian sausage, red onion and tomato sauce, really great, great balance of ingredients and the dough was good. We also ordered the Cipolle, their version of a cheese pizza, but they ruined it by putting an insane amount of white onion, made the pizza bitter and overpowered the cheese (even the gorgonzola!).Service left a lot to be desired, they just seemed to be interested in turning tables and not very friendly. Music was very loud and the waiter had a hard time hearing me but made no effort to lean in or speak up... really strange service in general. Also it is cash only which sucks... Especially cause this is a place where a bill can really add up. Wine selection a-ok.Roberta's is still the best pizza by a mile (and they take cards!), but this is a solid choice if you don't want the wait. Will probably order take out next time.",3.0
"Absolutely incredible pizza with cherry tomatoes and actual mozzarella! I also loved the ricotta cheesecake, though I wish I had gotten the panna cotta. The atmosphere and the servers are lovely!",5.0
"I will start off by saying that in general I am not a fan of pizza but this place was amazing. The pizza is like none I have ever had, it's fresh and so tasty! I had the pizza with Italian sausage and mozzarella cheese, I definitely recommend it! The mixed salad also tasted fresh. But the best part was dessert! I had the panna cotta. By far the best one I've had in a long time. The kind waiter also recommended a red wine which was so good that I had a second glass and I'm not much of a drinker. The service was great, I felt attended to at all times. We were there for a while and it was busy but we never felt like we were being rushed out. Overall I definitely recommend this place!",5.0
this place has a great vibe.  nice decor and has a great reasonably priced Menu. My favorite is the asparagus and onon pizza,4.0
Great place. Great drinks awesome bartenders and amazing food What more would u want. The perfect spot oin brooklyn for good food and drinks with great hospitality :) i was very pleased,5.0
Union Pizza Work's industrial facade disguises the laid back familial atmosphere and delicious Italian food within. Step inside and you'll be rewarded.See More:photos.nooklyn.com/union…,5.0
"I love this place. It's an open gastropub. They have a good selection of beer local, domestic and foreign. It's a great spring, summer and fall spot due to the outdoor seating. The owner is amazing. He greets you and engages in conversation. We enjoy dinning here because of his hospitality. On our first visit he treated my husband and I to dessert. We ordered the Tiramisu and it was delicious. We usually order the brick oven pizzas. They are always consistent in delivering great quality pizza. I usually go for the margherita, salame picante and salsiccia pizza. I highly recommend all of them. The salame picante is spicy for those who enjoy it. The location offers highly quality pizza similar to Robertas without the long lines. The wood that they use provides a different smokey flavor to the pizza that I enjoy. Overall I highly recommend this place to anyone visiting the area.",5.0
"One night, one of us was craving for a chorizo pizza. We checked Yelp, read a lot of good reviews about this place, & decided to check it out. We were here on a Thursday night around 8pm. Street parking is easy to find. The place was somewhat busy but we didn't have to wait for a table. We were seated immediately. Casual place with a wood fire place. Great for one of those cold winter nights. We got the salame piccante & the pizza con cipolle. They were definitely delicious. The salame piccante has the spicy chorizo but definitely not spicy. We had to ask for some crushed pepper. The portion were decent. The pizza is about 12"". We weren't stuffed but definitely satisfied. If you have a big appetite or starving, it's best if you add an extra sides or maybe even an extra pie. Overall, we like the pizza here. The service was attentive. The food came pretty quickly. All total, our bill came out to about $30. This place have live music on Monday. If you're around the area, this place is definitely worth checking out.",4.0
"Nice ambiance, good food, good music, good service.Our pizza was a little charred, but otherwise very tasty.My roommate and I love that it's open late.CASH ONLY",4.0
So good and the ambience is the best. definitely just as good as robertas but more low key,4.0
"If you don't mind waiting at the bar for 45 minutes after you place your order only to be told your pizza hasn't been put in the oven...then I highly recommend. I should also note that I was the only person at the bar and the place wasn't busy. . Other than the unhinged service it's got a pretty nice vibe. Pizza to go never taste good IMO - it was cold, unsliced - yes unsliced, clear evidence of non New Yorker's making pizza - and under cooked. Perhaps the bartender was pushing the oven cook to rush my order but still no excuse for unsliced undercooked pizza. Was told after sitting 50 minutes that it was cash only, at that point after I expressed my distress did they buy my glass of Chianti. While waiting in the cold on a shady street alone at an atm, did I realize how ridiculous this place is - also confirmed by hearing another couple saying they were walking out due to bad service, they said they bolted! Also one of the tall bearded waiters, of which there happens to be  many, pushed past me and told me to ""watch out""Do we not know about service and etiquette, Roberta's certainly does. 40 bucks for take out and bad attitude - FAIL. Entitlement and attitude needs to cease in north Brooklyn restaurants it makes for an unpleasant dining experience- we pay to live here and have dedicated good service like you would have in Manhattan or brownstone Brooklyn. I don't need attitude from some 22 year old from Middletown CT",1.0
"The food was delicious, the space quite pleasant, and the prices absolutely reasonable. I'd love to give them five stars, but the waiter who ignored us to chat with another table for ten minutes after we'd asked him for the check makes me feel I can't. Better luck next time!",4.0
"I really enjoyed this cute little pizza place. Went with a small group of friends. It was a great environment for just having some good pizza and hanging out  with a couple friends. Also a great date night spot. The patio is really nice and on a warm night it's perfect. It is cash only but they have an atm in the front for a  worst case scenario. The pizza was delicious! In a group of three we got two pizzas an a side pasta dish and it worked out great. There were not many options of different kinds of pizzas, but honestly they all look so yummy and there's definitely something for everyone. The next time I went here I got myself a mixed drink off the menu and it was very tasty. I would highly recommend this place to anyone in the area. I will definitely be back with more friends.",5.0
"I was in need of a good pizza to go, and Union Pizza Work was just perfect. The service was quick and nice. I waited at the bar for my order, drinking a Peroni, admiring the nice design and atmosphere.My margherita was delicious. I especially enjoyed the mozzarella cheese, as it seems and taste really traditional (not smoky or other sort of strange type.)The dough was also really good, type of dry crunchy one, not smoochy or oily.Will save this place for a proper sit-down dinner as it seems really nice!",5.0
"Service is terrible , the Waiter after a I reorder another bottle of wine he just place it to the table with out pour any wine at my party , not even asking if we where neglect us all night we had to wave our hands , to get their attention , not coming back at all",3.0
"I tried the salme picante pizza and it was delicious! The salame had a nice kick to it. However the red sangria was very watery. I wouldn't recommend it. The waiter wasn't very attentive either. Other than that, i wouldn't mind coming back to try their other selections of pizza.",3.0
"With all due respect, I just don't get it.Devastated verde coal oven closed, I thought Union pizza could fill my brick oven pizza void......yet they they have failed.Crust is just ok, sauce is ok...everything was just ok.But for 15 dollar personal pie I want it to be awesome, and awesome it wasn't.Get it together guys, make better pizza, you can do it! I know this neighborhood has transplants bussed in each day who've never tried non-dominoes pizza  and yeah they are gonna love your product, but it's  about time you step it up cause they ain't gonna be in the dark for long.",2.0
"I've been here at least 5x since I've moved to Brooklyn a couple months ago and they have yet to disappoint. In fact, their pizza rivals any pizza I've had while in Italy itself! Friendly staff, great atmosphere and fresh ingredients. I recommend the margherita pizza or the funghi with prosciutto. And if you like sangria theirs is a must-have! It's a white sangria and I'm obsessed.In short, if you're in town and craving good pizza at a sit down restaurant with a non-traditional atmosphere, this is the spot!",5.0
"Stumbled upon this culinary gem walking round one evening with a friend. The food was absolutely fantastic and the house wine was amazing as well. Unfortunately the place is cash only, which was not advertised nor were we informed until AFTER we got our check. Absolute inconvenience and not sure why a restaurant of this calibur would do that. In any case , the atmosphere was warm, dimly lit and inviting; clean bathrooms ; and the food was of a good quality . a bit pricey but not bad either.",4.0
So good and the ambience is the best. definitely just as good as robertas but more low key,4.0
"If you don't mind waiting at the bar for 45 minutes after you place your order only to be told your pizza hasn't been put in the oven...then I highly recommend. I should also note that I was the only person at the bar and the place wasn't busy. . Other than the unhinged service it's got a pretty nice vibe. Pizza to go never taste good IMO - it was cold, unsliced - yes unsliced, clear evidence of non New Yorker's making pizza - and under cooked. Perhaps the bartender was pushing the oven cook to rush my order but still no excuse for unsliced undercooked pizza. Was told after sitting 50 minutes that it was cash only, at that point after I expressed my distress did they buy my glass of Chianti. While waiting in the cold on a shady street alone at an atm, did I realize how ridiculous this place is - also confirmed by hearing another couple saying they were walking out due to bad service, they said they bolted! Also one of the tall bearded waiters, of which there happens to be  many, pushed past me and told me to ""watch out""Do we not know about service and etiquette, Roberta's certainly does. 40 bucks for take out and bad attitude - FAIL. Entitlement and attitude needs to cease in north Brooklyn restaurants it makes for an unpleasant dining experience- we pay to live here and have dedicated good service like you would have in Manhattan or brownstone Brooklyn. I don't need attitude from some 22 year old from Middletown CT",1.0
"The food was delicious, the space quite pleasant, and the prices absolutely reasonable. I'd love to give them five stars, but the waiter who ignored us to chat with another table for ten minutes after we'd asked him for the check makes me feel I can't. Better luck next time!",4.0
"I really enjoyed this cute little pizza place. Went with a small group of friends. It was a great environment for just having some good pizza and hanging out  with a couple friends. Also a great date night spot. The patio is really nice and on a warm night it's perfect. It is cash only but they have an atm in the front for a  worst case scenario. The pizza was delicious! In a group of three we got two pizzas an a side pasta dish and it worked out great. There were not many options of different kinds of pizzas, but honestly they all look so yummy and there's definitely something for everyone. The next time I went here I got myself a mixed drink off the menu and it was very tasty. I would highly recommend this place to anyone in the area. I will definitely be back with more friends.",5.0
"I was in need of a good pizza to go, and Union Pizza Work was just perfect. The service was quick and nice. I waited at the bar for my order, drinking a Peroni, admiring the nice design and atmosphere.My margherita was delicious. I especially enjoyed the mozzarella cheese, as it seems and taste really traditional (not smoky or other sort of strange type.)The dough was also really good, type of dry crunchy one, not smoochy or oily.Will save this place for a proper sit-down dinner as it seems really nice!",5.0
"Service is terrible , the Waiter after a I reorder another bottle of wine he just place it to the table with out pour any wine at my party , not even asking if we where neglect us all night we had to wave our hands , to get their attention , not coming back at all",3.0
"I tried the salme picante pizza and it was delicious! The salame had a nice kick to it. However the red sangria was very watery. I wouldn't recommend it. The waiter wasn't very attentive either. Other than that, i wouldn't mind coming back to try their other selections of pizza.",3.0
"With all due respect, I just don't get it.Devastated verde coal oven closed, I thought Union pizza could fill my brick oven pizza void......yet they they have failed.Crust is just ok, sauce is ok...everything was just ok.But for 15 dollar personal pie I want it to be awesome, and awesome it wasn't.Get it together guys, make better pizza, you can do it! I know this neighborhood has transplants bussed in each day who've never tried non-dominoes pizza  and yeah they are gonna love your product, but it's  about time you step it up cause they ain't gonna be in the dark for long.",2.0
"I've been here at least 5x since I've moved to Brooklyn a couple months ago and they have yet to disappoint. In fact, their pizza rivals any pizza I've had while in Italy itself! Friendly staff, great atmosphere and fresh ingredients. I recommend the margherita pizza or the funghi with prosciutto. And if you like sangria theirs is a must-have! It's a white sangria and I'm obsessed.In short, if you're in town and craving good pizza at a sit down restaurant with a non-traditional atmosphere, this is the spot!",5.0
"Stumbled upon this culinary gem walking round one evening with a friend. The food was absolutely fantastic and the house wine was amazing as well. Unfortunately the place is cash only, which was not advertised nor were we informed until AFTER we got our check. Absolute inconvenience and not sure why a restaurant of this calibur would do that. In any case , the atmosphere was warm, dimly lit and inviting; clean bathrooms ; and the food was of a good quality . a bit pricey but not bad either.",4.0
"This place rules. Came here with a friend, he got the funghi pizza (which I obviously mooched on) and I got the mussels. The pizza was excellent -- dough was perfectly cooked and had a great texture, toppings were spot on. But the mussels were what made my evening. They came with some sort of garlic-tomato sauce, perfect for bread-dipping. I licked the bowl clean and even then, when the waiter took it away, I felt a deep sorrow and unbearable anguish...Moving on, my friend and I each got a glass of the house cabernet which was also delicious.We finished off with the chocolate mousse -- smooth, dark, flavorful. Definitely coming back here as soon as I can!",5.0
Excellent pizza! Come here all the time. Super friendly staff. Owners are usually here working as well and say hello and ask how your doing. Cozy environment and a working wood fireplace going in the winter months.The only drawback is their salads can be over dressed and sometimes a little strange.,5.0
"Went for dinner on 10/10.  We tried two pizzas and the polpette.  The pizzas are baked in a wood oven.  Delicious is all I have to say!  Even though the edges of the crusts on both pizzas were charred, we ate them anyway.  What made this place ever better is that we were not charged for either pizza when we brought this to the attention of the waitress. Most places would apologize and maybe offer a free dessert, but they didn't charge us for the pizzas. Definitely a place we will frequent.",5.0
"This place is so nice and sophisticated. So clean and the staff was super courteous. I've had bad experiences at other pizza places in the neighborhood so I was so excited for this place to open up!!!! The food was not too pricey, great crust, and great toppings. Definitely will return",5.0
"Good service. Real Italian. The dough needs some work in my opinion. Still, a solid choice if you're in the neighborhood.",4.0
I've been living in the neighborhood for a while now an only now started to explore it. I've seen this place before just passing by on my bike and finally decided to stop by. Because I had dinner right before I only came for drinks. The atmosphere here is so nice! Such friendly people (the people who work here as well as other customers)!!! Priscilla and Giovanni were very friendly and made me feel like a regular customer even though it was my first time there. Very highly recommended and I will make an update once I try the food!,5.0
"I come here all the time... Yes, it's pricey but it's also freshly made and brick oven made!",4.0
Amo este lugar +++++,5.0
"I am on a vacation from California, and I was staying with a friend in Bushwick. I woke up at the early hour of 3:30 pm, and craved pizza terribly. Found this place, and couldn't have been more delighted! The service is friendly and authentic. The menu is small, but everything sounds simple and delicious. We ordered the Caprese Salad, Prosciutto, Mozzarella and Focaccia, and the Eggplant and Zucchini Pizza, and had more than enough for two. The coffee is also delicious. We ended the meal with a bottle of Prosecco and stayed for the ambience. Will definitely come back!!",5.0
Solid pizza spot.  Had the Margherita pizza which was great. will try others next time. Like the inside too.  Large space with industrial feel.  Good decor for the area.,4.0
"This place rules. Came here with a friend, he got the funghi pizza (which I obviously mooched on) and I got the mussels. The pizza was excellent -- dough was perfectly cooked and had a great texture, toppings were spot on. But the mussels were what made my evening. They came with some sort of garlic-tomato sauce, perfect for bread-dipping. I licked the bowl clean and even then, when the waiter took it away, I felt a deep sorrow and unbearable anguish...Moving on, my friend and I each got a glass of the house cabernet which was also delicious.We finished off with the chocolate mousse -- smooth, dark, flavorful. Definitely coming back here as soon as I can!",5.0
Excellent pizza! Come here all the time. Super friendly staff. Owners are usually here working as well and say hello and ask how your doing. Cozy environment and a working wood fireplace going in the winter months.The only drawback is their salads can be over dressed and sometimes a little strange.,5.0
"Went for dinner on 10/10.  We tried two pizzas and the polpette.  The pizzas are baked in a wood oven.  Delicious is all I have to say!  Even though the edges of the crusts on both pizzas were charred, we ate them anyway.  What made this place ever better is that we were not charged for either pizza when we brought this to the attention of the waitress. Most places would apologize and maybe offer a free dessert, but they didn't charge us for the pizzas. Definitely a place we will frequent.",5.0
"This place is so nice and sophisticated. So clean and the staff was super courteous. I've had bad experiences at other pizza places in the neighborhood so I was so excited for this place to open up!!!! The food was not too pricey, great crust, and great toppings. Definitely will return",5.0
"Good service. Real Italian. The dough needs some work in my opinion. Still, a solid choice if you're in the neighborhood.",4.0
I've been living in the neighborhood for a while now an only now started to explore it. I've seen this place before just passing by on my bike and finally decided to stop by. Because I had dinner right before I only came for drinks. The atmosphere here is so nice! Such friendly people (the people who work here as well as other customers)!!! Priscilla and Giovanni were very friendly and made me feel like a regular customer even though it was my first time there. Very highly recommended and I will make an update once I try the food!,5.0
"I come here all the time... Yes, it's pricey but it's also freshly made and brick oven made!",4.0
Amo este lugar +++++,5.0
"I am on a vacation from California, and I was staying with a friend in Bushwick. I woke up at the early hour of 3:30 pm, and craved pizza terribly. Found this place, and couldn't have been more delighted! The service is friendly and authentic. The menu is small, but everything sounds simple and delicious. We ordered the Caprese Salad, Prosciutto, Mozzarella and Focaccia, and the Eggplant and Zucchini Pizza, and had more than enough for two. The coffee is also delicious. We ended the meal with a bottle of Prosecco and stayed for the ambience. Will definitely come back!!",5.0
Solid pizza spot.  Had the Margherita pizza which was great. will try others next time. Like the inside too.  Large space with industrial feel.  Good decor for the area.,4.0
"Love, love, and love.  The food and environment were so good I almost cried. The watermelon salad on special was so deliciously and delicately balanced that my tastebuds felt so loved. Perfect for a warm summer day. The margherita pizza...amazing. All of it was amazing. Few but good beer selections on tap. Friendly attentive staff. Chill music playing in background and plenty of Italian conversations to be heard.",5.0
"Good food, Good atmosphere, Good service, Good Drinks , I would recommend this restaurant and will return,",4.0
"Always my go to place when trying to decide where to eat in the neighborhood.  Everything about this place makes for a perfect night.  Great staff, food, atmosphere, and ownership.My ideal night consists of Captain Lawrence IPA and The Funghi Pizza (the mushrooms are amazing). If you're ever in the area, not a place to pass up on.",5.0
I stopped in here on a Monday night after having a pint across the street @ the bodega. I'll definitely be back. I started with an Italian draft beer named Forst. It was not too heavy and went refreshingly well with the food I ordered. I had the mussels for starters and the salsiccia pizza with mushrooms. Both were tantalizingly delectable and did wonders for my pallet. The outdoor garden was pretty cool too.,5.0
"I absolutely love Union Pizza Works!! Amazing food, cozy atmosphere, wonderful staff. I noticed a lot of people have been comparing it to Robertas- maybe because of the proximity and the similar menu. I've been to Robertas many times and have stopped going there because Union Square Pizza Works is much better all around. No wait time, superior service, consistency, and tastier food. Food:The pizza is authentic, fresh and light. Their salads & soups are rich and flavorful. You must order the tiramisu - best I've ever had. The drinks:A+ beer on tap. A++ negroni. The staff:Everyone I've interacted with at Union Pizza works has had such an upbeat attitude and made me feel like I was a friend or guest at their home rather than a customer. The atmosphere:Very bushwick with a european twist -  raw yet classy feel. Somewhere you can either spend a night with friends or take the parents out to brunch. Go check it out for yourself you will not regret it!!!",5.0
